URL link,Title,Date
https://news.google.com/rss/articles/CBMifGh0dHBzOi8vd3d3LmZvcmJlcy5jb20vc2l0ZXMvYXNobGV5c3RhaGwvMjAyMi8wNS8wMy90aGUtcmlzZS1vZi1hcnRpZmljaWFsLWludGVsbGlnZW5jZS13aWxsLXJvYm90cy1hY3R1YWxseS1yZXBsYWNlLXBlb3BsZS_SAQA?oc=5,The Rise Of Artificial Intelligence: Will Robots Actually Replace People? - Forbes,2022-05-04
https://news.google.com/rss/articles/CBMihQFodHRwczovL3d3dy5jYWYuY29tL2VuL2N1cnJlbnRseS9uZXdzLzIwMjIvMDUvaG93LWF1dG9tYXRpb24tYW5kLWFydGlmaWNpYWwtaW50ZWxsaWdlbmNlLXdpbGwtY2hhbmdlLWVtcGxveW1lbnQtaW4tdGhlLXB1YmxpYy1zZWN0b3Iv0gEA?oc=5,How Automation and AI Will Change Employment in the Public Sector - Concacaf,2022-05-02
https://news.google.com/rss/articles/CBMiZGh0dHBzOi8vd3d3LnRlY2hvcGVkaWEuY29tL2hvdy1hcnRpZmljaWFsLWludGVsbGlnZW5jZS13aWxsLXJldm9sdXRpb25pemUtdGhlLXNhbGVzLWluZHVzdHJ5LzIvMzI5NjfSAQA?oc=5,How Artificial Intelligence Will Revolutionize the Sales Industry - Techopedia,2022-05-05
https://news.google.com/rss/articles/CBMiX2h0dHBzOi8vdmVudHVyZWJlYXQuY29tL2FpL2VtcGxveW1lbnQtYWktcmVndWxhdGlvbnMtNS10YWtlYXdheXMtZm9yLXRlY2huaWNhbC1kZWNpc2lvbi1tYWtlcnMv0gEA?oc=5,5 ways to address regulations around AI-enabled hiring and employment - VentureBeat,2022-05-06
https://news.google.com/rss/articles/CBMicmh0dHBzOi8vYmxvZ3MubWljcm9zb2Z0LmNvbS9vbi10aGUtaXNzdWVzLzIwMjIvMDUvMDMvYXJ0aWZpY2lhbC1pbnRlbGxpZ2VuY2UtZGVwYXJ0bWVudC1vZi1kZWZlbnNlLWN5YmVyLW1pc3Npb25zL9IBAA?oc=5,Applications for artificial intelligence in Department of Defense cyber missions - Microsoft On the Issues - Microsoft,2022-05-03
https://news.google.com/rss/articles/CBMiZmh0dHBzOi8vd3d3LmF1dG9kZXNrLmNvbS9ibG9ncy93YXRlci8yMDIyLzA1LzAxL2FpLWluLXdhdGVyLTEwLXdheXMtYWktaXMtY2hhbmdpbmctdGhlLXdhdGVyLWluZHVzdHJ5L9IBAA?oc=5,AI for water: 10 ways AI is changing the water industry - Autodesk Redshift,2022-05-01
https://news.google.com/rss/articles/CBMiZ2h0dHBzOi8vd3d3LmJyb29raW5ncy5lZHUvYXJ0aWNsZXMvdGhlLW51YW5jZWQtcmVsYXRpb25zaGlwLWJldHdlZW4tY3V0dGluZy1lZGdlLXRlY2hub2xvZ2llcy1hbmQtam9icy_SAQA?oc=5,The nuanced relationship between cutting-edge technologies and jobs: Evidence from Germany | Brookings - Brookings Institution,2022-05-05
https://news.google.com/rss/articles/CBMiaGh0dHBzOi8vd3d3LmZvcmJlcy5jb20vc2l0ZXMvYmVybmFyZG1hcnIvMjAyMi8wNS8wNi90aGUtYmVuZWZpdHMtYW5kLWRhbmdlcnMtb2YtdXNpbmctYWktaW4tcmVjcnVpdG1lbnQv0gEA?oc=5,The Benefits And Dangers Of Using AI In Recruitment - Forbes,2022-05-06
https://news.google.com/rss/articles/CBMieGh0dHBzOi8vd3d3LmdlZWt3aXJlLmNvbS8yMDIyL3RoZS1yb2JvdHMtYXJlbnQtY29taW5nLWZvci15b3VyLWpvYnMtYXQtbGVhc3QtYWNjb3JkaW5nLXRvLXRoZXNlLWFpLWFuZC1yb2JvdGljcy1sZWFkZXJzL9IBAA?oc=5,The robots aren't coming for your jobs — at least according to these AI and robotics leaders - GeekWire,2022-05-03
https://news.google.com/rss/articles/CBMiR2h0dHBzOi8vbWl0c2xvYW4ubWl0LmVkdS9pZGVhcy1tYWRlLXRvLW1hdHRlci81LXRyYWl0cy13b3JrZm9yY2UtZnV0dXJl0gEA?oc=5,5 traits of the workforce of the future - MIT Sloan News,2022-05-02
https://news.google.com/rss/articles/CBMigQFodHRwczovL2JldGFraXQuY29tL3Zpc2llci1tYWtlcy1maXJzdC1hY3F1aXNpdGlvbi1hY3F1aXJpbmcteXZhLWFpcy10ZWNoLWFuZC10ZWFtLXRvLWV4cGFuZC11bmRlcnN0YW5kaW5nLW9mLWhvdy1lbXBsb3llZXMtd29yay_SAQA?oc=5,Visier acquires Yva.ai’s tech and team to expand understanding of how employees work - BetaKit - Canadian Startup News,2022-05-04
https://news.google.com/rss/articles/CBMiZ2h0dHBzOi8vd3d3LmNhZi5jb20vZW4vY3VycmVudGx5L25ld3MvMjAyMi8wNS9haS1hbi1vcHBvcnR1bml0eS1mb3ItcHVibGljLWVtcGxveW1lbnQtaW4tbGF0aW4tYW1lcmljYS_SAQA?oc=5,AI: an opportunity for public employment in the region - Concacaf,2022-05-01
https://news.google.com/rss/articles/CBMie2h0dHBzOi8vd3d3LmNhbmFkYS5jYS9lbi9hcm15L3NlcnZpY2VzL2xpbmUtc2lnaHQvYXJ0aWNsZXMvMjAyMi8wNS9sZXZlcmFnaW5nLWFydGlmaWNpYWwtaW50ZWxsaWdlbmNlLWZvci1jYW5hZGFzLWFybXkuaHRtbNIBAA?oc=5,Leveraging Artificial Intelligence for Canada's Army: Current Possibilities and Future Challenges - Canada.ca,2022-05-02
https://news.google.com/rss/articles/CBMiYWh0dHBzOi8vbmV0enBvbGl0aWsub3JnLzIwMjIvc2VyaWVzLW9uLWRpZ2l0YWwtY29sb25pYWxpc20tZ2xvYmFsLWxhYm9yLWNoYWlucy1vZi10aGUtd2VzdGVybi1haS_SAQA?oc=5,Series on Digital Colonialism: Global labor chains of the western AI - netzpolitik.org,2022-05-06
https://news.google.com/rss/articles/CBMiTmh0dHBzOi8vd3d3Lml0cHJvdG9kYXkuY29tL2NhcmVlci10aXBzLzMtcHJlZGljdGlvbnMtZm9yLXRoZS1mdXR1cmUtb2YtaXQtam9ic9IBAA?oc=5,3 Predictions for the Future of IT Jobs and Teams - ITPro Today,2022-05-03
https://news.google.com/rss/articles/CBMiV2h0dHBzOi8vYmVpbmNyeXB0by5jb20vY3J5cHRvLWpvYnMtd2hpY2gtY291bnRyeS1oYXMtdGhlLW1vc3QtY3J5cHRvY3VycmVuY3ktcG9zaXRpb25zL9IBAA?oc=5,Crypto Jobs: Which Country has the Most Cryptocurrency Positions? - BeInCrypto,2022-05-02
https://news.google.com/rss/articles/CBMiRGh0dHBzOi8vd3d3LnRpbWVmb3JraWRzLmNvbS95b3VyLWhvdC1qb2IvYXJ0aWNsZXMvdGVjaG5vbG9neS1jYXJlZXJz0gEA?oc=5,Prepare Kids and Teens for Careers of the Future | Your Job - TIME for Kids,2022-05-02
https://news.google.com/rss/articles/CBMiTmh0dHBzOi8vdGhlbmV4dHdlYi5jb20vbmV3cy9uZXctYWktdG9vbC1hdWRpdGlvbnMtZ2lncy11c2luZy1hY3RvcnMtb3duLXZvaWNlc9IBAA?oc=5,New AI tool auditions for gigs using actors' own voices - TNW,2022-05-06
https://news.google.com/rss/articles/CBMiOmh0dHBzOi8vd3d3LmJ1LmVkdS9jaXNlL2Npc2UtYXdhcmRlZC04LThtLWJ1LXJhc3RpYy1hd2FyZC_SAQA?oc=5,CISE awarded $8.8M to develop the next-generation robotics and autonomous systems workforce | Center for ... - Boston University,2022-05-05
https://news.google.com/rss/articles/CBMidmh0dHBzOi8vYnVzaW5lc3N0ZWNoLmNvLnphL25ld3MvdGVjaG5vbG9neS81Nzg1ODYvbW9zdC1pbi1kZW1hbmQtdGVjaC1qb2JzLWZvci1zb3V0aC1hZnJpY2Fucy1yaWdodC1ub3ctaW5jbHVkaW5nLXBheS_SAQA?oc=5,The most in-demand tech jobs for South Africans right now – including pay - BusinessTech,2022-05-01
https://news.google.com/rss/articles/CBMiXGh0dHBzOi8vY3J5cHRvbmV3cy5jb20uYXUvbmV3cy9hdXN0cmFsaWEtcmFua3MtNHRoLWluLWNyeXB0by1qb2Itb3Bwb3J0dW5pdGllcy1yZXBvcnQtOTQ2NDAv0gEA?oc=5,Australia Ranks 4th in Crypto Job Opportunities Report - Crypto News Australia,2022-05-04
