URL link,Title,Date
https://news.google.com/rss/articles/CBMicGh0dHBzOi8vd3d3Lm1ja2luc2V5LmNvbS9pbmR1c3RyaWVzL2VkdWNhdGlvbi9vdXItaW5zaWdodHMvaG93LWFydGlmaWNpYWwtaW50ZWxsaWdlbmNlLXdpbGwtaW1wYWN0LWstMTItdGVhY2hlcnPSAQA?oc=5,How artificial intelligence will impact K–12 teachers - McKinsey,2020-01-14
https://news.google.com/rss/articles/CBMiMmh0dHBzOi8vd3d3Lm5hdHVyZS5jb20vYXJ0aWNsZXMvczQxNDY3LTAxOS0xNDEwOC150gEA?oc=5,The role of artificial intelligence in achieving the Sustainable Development Goals - Nature.com,2020-01-13
https://news.google.com/rss/articles/CBMihwFodHRwczovL3d3dy5uZXd5b3JrZXIuY29tL2J1c2luZXNzL2N1cnJlbmN5L2NvdWxkLW5ldy1yZXNlYXJjaC1vbi1haS1hbmQtd2hpdGUtY29sbGFyLWpvYnMtZmluYWxseS1icmluZy1hYm91dC1hLXN0cm9uZy1wb2xpY3ktcmVzcG9uc2XSAQA?oc=5,Could New Research on A.I. and White-Collar Jobs Finally Bring About a Strong Policy Response? - The New Yorker,2020-01-14
https://news.google.com/rss/articles/CBMigwFodHRwczovL3d3dy5ueXUuZWR1L2Fib3V0L25ld3MtcHVibGljYXRpb25zL25ld3MvMjAyMC9qYW51YXJ5L2lzLXRoZS1odW1hbi13b3JrZm9yY2UtZG9vbWVkLXdpdGgtdGhlLXJpc2Utb2YtYWktLW5ldy1yZXNlYXJjaC0uaHRtbNIBAA?oc=5,Is the Human Workforce Doomed with the Rise of AI? New Research Says Fears Are Overblown - nyu.edu,2020-01-14
https://news.google.com/rss/articles/CBMiiwFodHRwczovL3d3dy5idXNpbmVzcy1zdGFuZGFyZC5jb20vYXJ0aWNsZS90ZWNobm9sb2d5L2JvdC12cy1tYW4taG93LXRvLWJlYXQtc291dGgta29yZWEtcy1haS1oaXJpbmctYm90cy1hbmQtbGFuZC1hLWpvYi0xMjAwMTE0MDAwNzBfMS5odG1s0gEA?oc=5,Bot vs man: How to beat South Korea's AI hiring bots and land a job - Business Standard,2020-01-14
https://news.google.com/rss/articles/CBMiQmh0dHBzOi8vd3d3Lm5pdGkuZ292LmluL2luZGlhcy1lZHVjYXRpb24tc2VjdG9yLXJpcGUtZGlzcnVwdGlvbi1hadIBAA?oc=5,India's Education Sector is Ripe for Disruption by AI - | NITI Aayog,2020-01-14
https://news.google.com/rss/articles/CBMiRmh0dHBzOi8vaG9tZS5iYXJjbGF5cy9uZXdzLzIwMjAvMDEvbWFjaGluZXMtY2FuLXQtZG8taXQtYnktdGhlbXNlbHZlcy_SAQA?oc=5,The future of machine learning | Innovation - Barclays,2020-01-16
https://news.google.com/rss/articles/CBMiZGh0dHBzOi8vd3d3LmhlYWx0aGNhcmVpdG5ld3MuY29tL25ld3MvYWktdGVsZWhlYWx0aC1jb3VsZC1oZWxwLWFkZHJlc3MtaG9zcGl0YWwtd29ya2ZvcmNlLWNoYWxsZW5nZXPSAQA?oc=5,"AI, telehealth could help address hospital workforce challenges - Healthcare IT News",2020-01-14
https://news.google.com/rss/articles/CBMihQFodHRwczovL3d3dy5mb3JiZXMuY29tL3NpdGVzL2NvZ25pdGl2ZXdvcmxkLzIwMjAvMDEvMTIvaXMtdGhlcmUtYS1kaWZmZXJlbmNlLWJldHdlZW4tYXNzaXN0ZWQtaW50ZWxsaWdlbmNlLXZzLWF1Z21lbnRlZC1pbnRlbGxpZ2VuY2Uv0gEA?oc=5,Is There A Difference Between Assisted Intelligence Vs. Augmented Intelligence? - Forbes,2020-01-12
https://news.google.com/rss/articles/CBMiP2h0dHBzOi8vd3d3LmNubi5jb20vMjAyMC8wMS8xNS90ZWNoL2FpLWpvYi1pbnRlcnZpZXcvaW5kZXguaHRtbNIBOGh0dHBzOi8vYW1wLmNubi5jb20vY25uLzIwMjAvMDEvMTUvdGVjaC9haS1qb2ItaW50ZXJ2aWV3?oc=5,There's a new obstacle to landing a job after college: Getting approved by AI - CNN,2020-01-15
https://news.google.com/rss/articles/CBMiTGh0dHBzOi8vd3d3LmJyb29raW5ncy5lZHUvYXJ0aWNsZXMvYXV0b21hdGlvbi1hbmQtbGFib3ItbWFya2V0LWluc3RpdHV0aW9ucy_SAQA?oc=5,Automation and labor market institutions - Brookings Institution,2020-01-14
https://news.google.com/rss/articles/CBMiP2h0dHBzOi8vd29yZHByZXNzLTEyNjc4NzgtNDU4MzYwNi5jbG91ZHdheXNhcHBzLmNvbS9pcy1haS1tYWxlL9IBAA?oc=5,Is AI Male? - Worth Beyond Wealth,2020-01-16
https://news.google.com/rss/articles/CBMidmh0dHBzOi8vdmVudHVyZWJlYXQuY29tL2J1c2luZXNzL3BoZW5vbS1wZW9wbGUtcmFpc2VzLTMwLW1pbGxpb24tZm9yLWFpLXJlY3J1aXRtZW50LXBsYXRmb3JtLXVzZWQtYnktbWljcm9zb2Z0LW90aGVycy_SAQA?oc=5,"Phenom People raises $30 million for AI recruitment platform used by Microsoft, others - VentureBeat",2020-01-16
https://news.google.com/rss/articles/CBMiYGh0dHBzOi8vd3d3Lml0d2ViLmNvLnphL2FydGljbGUvZW1wbG95ZWVzLXRydXN0LXJvYm90cy1tb3JlLXRoYW4tdGhlaXItbWFuYWdlcnMveEE5UE92TlkyWDNxbzRKONIBAA?oc=5,Employees trust robots more than their managers - ITWeb,2020-01-15
https://news.google.com/rss/articles/CBMicWh0dHBzOi8vd3d3LmphcGFudGltZXMuY28uanAvbmV3cy8yMDIwLzAxLzE0L2FzaWEtcGFjaWZpYy9zb2NpYWwtaXNzdWVzLWFzaWEtcGFjaWZpYy9zb3V0aC1rb3JlYXMtYWktaGlyaW5nLWJvdHMv0gEA?oc=5,'Smile with your eyes': How to beat South Korea's AI hiring bots and land a job - The Japan Times,2020-01-14
https://news.google.com/rss/articles/CBMiZWh0dHA6Ly93d3cucHJsZWFwLmNvbS9wci8yNzM2NzkvaXQtam9iLW1hcmtldC10by1leHBhbmQtYnktMTAwMDAwLW5ldy1qb2JzLWluLTIwMjAtYWNjb3JkaW5nLXRvLWphbmNv0gEA?oc=5,"IT Job Market to Expand by 100,000 new jobs in 2020 according to Janco - PR Leap",2020-01-13
https://news.google.com/rss/articles/CBMimQFodHRwczovL3d3dy5idXNpbmVzc3dpcmUuY29tL25ld3MvaG9tZS8yMDIwMDExNjAwNTI1MC9lbi9Db3JuZXJzdG9uZS1BY3F1aXJlcy1DbHVzdHJlZS10by1CdWlsZC1MZWFkaW5nLUFJLVBvd2VyZWQtU2tpbGxzLVBsYXRmb3JtLWZvci1QZW9wbGUtRGV2ZWxvcG1lbnTSAQA?oc=5,Cornerstone Acquires Clustree to Build Leading AI-Powered Skills Platform for People Development - Business Wire,2020-01-16
https://news.google.com/rss/articles/CBMigwFodHRwczovL3d3dy50aGV0aW1lcy5jb20vY3VsdHVyZS9ib29rcy9hcnRpY2xlL2Etd29ybGQtd2l0aG91dC13b3JrLWJ5LWRhbmllbC1zdXNza2luZC1yZXZpZXctaG93LXRvLWJlYXQtdGhlLXdvcmstcm9ib3RzLWpoZG5ycDg3cdIBAA?oc=5,A World Without Work by Daniel Susskind review — how to beat the work robots - The Times,2020-01-12
https://news.google.com/rss/articles/CBMiPWh0dHBzOi8vZ2xvYmFsbmV3cy5jYS9uZXdzLzYzOTg2NTIvd2hpdGUtaG91c2UtYWktcHJpbmNpcGxlcy_SAUFodHRwczovL2dsb2JhbG5ld3MuY2EvbmV3cy82Mzk4NjUyL3doaXRlLWhvdXNlLWFpLXByaW5jaXBsZXMvYW1wLw?oc=5,Here’s how a ‘laissez-faire’ approach to AI regulation in U.S. could affect development - Global News,2020-01-12
https://news.google.com/rss/articles/CBMiaWh0dHBzOi8vd3d3LmxldmlzdHJhdXNzLmNvbS8yMDIwLzAxLzEzL3N0YW5kaW5nLXVwLWZvci1kb21lc3RpYy13b3JrZXJzLWEtcWEtd2l0aC1sc2YtZ3JhbnRlZS1haS1qZW4tcG9vL9IBAA?oc=5,Standing Up for Domestic Workers – A Q&A with LSF Grantee Ai-jen Poo - Levi Strauss,2020-01-13
https://news.google.com/rss/articles/CBMiZWh0dHBzOi8vd3d3LnNleWZhcnRoLmNvbS9uZXdzLWluc2lnaHRzL2RvbC1hbm5vdW5jZXMtcnVsZS1jbGFyaWZ5aW5nLWpvaW50LWVtcGxveW1lbnQtdW5kZXItZmxzYS5odG1s0gEA?oc=5,DOL Announces Rule Clarifying Joint Employment Under FLSA - Seyfarth Shaw LLP,2020-01-12
https://news.google.com/rss/articles/CBMiamh0dHBzOi8vd3d3LmFiYy5uZXQuYXUvbmV3cy8yMDIwLTAxLTE3L2VuZC1vZi1jaGVja291dC1kaXJlLWZ1dHVyZS1mb3ItdGhvc2Utd2l0aG91dC1yaWdodC1za2lsbHMvMTE4NzQwNTTSASdodHRwczovL2FtcC5hYmMubmV0LmF1L2FydGljbGUvMTE4NzQwNTQ?oc=5,The end of the checkout signals a dire future for those without the right skills - ABC News,2020-01-16
