,URL link,Title,Date,Preprocessed Title,Value,Sentiment
0,https://news.google.com/rss/articles/CBMiTGh0dHBzOi8vd3d3LmlibS5jb20vYmxvZy9idWlsZGluZy1hLWZ1dHVyZS1yZWFkeS13b3JrZm9yY2Utd2l0aC1kYXRhLWFuZC1haS_SAQA?oc=5,Building a future-ready workforce with data and AI - IBM,2021-10-01,building future,"{'neg': 0.0, 'neu': 1.0, 'pos': 0.0, 'compound': 0.0}",Neutral
1,https://news.google.com/rss/articles/CBMiSWh0dHBzOi8vd3d3LmRhdGFtYXRpb24uY29tL3RyZW5kcy9hcnRpZmljaWFsLWludGVsbGlnZW5jZS1hbmQtYXV0b21hdGlvbi_SAQA?oc=5,"AI, Automation, & the Future Impact on Jobs - Datamation",2021-10-08,"ai , automation , & future impact job","{'neg': 0.0, 'neu': 1.0, 'pos': 0.0, 'compound': 0.0}",Neutral
2,https://news.google.com/rss/articles/CBMiWmh0dHBzOi8vdG93YXJkc2RhdGFzY2llbmNlLmNvbS90aGUtZXRoaWNzLW9mLWFpLWRyaXZlbi13b3JrZm9yY2Utc3VydmVpbGxhbmNlLTJiZmFhNTdjYzRhNdIBAA?oc=5,The Ethics of AI-driven Workforce Surveillance | by Andrey Koptelov - Towards Data Science,2021-10-04,ethic ai,"{'neg': 0.0, 'neu': 1.0, 'pos': 0.0, 'compound': 0.0}",Neutral
3,https://news.google.com/rss/articles/CBMiqAFodHRwczovL3d3dy5mb3JiZXNpbmRpYS5jb20vYXJ0aWNsZS9iaWxsaW9uYWlyZXMvaW5kaWEtaGFzLWhpZ2gtcXVhbGl0eS1haS1zY2llbnRpc3RzLWJ1dC1pbmRpYW4tYnVzaW5lc3Nlcy15ZXQtdG8tbWFrZS10aGUtbW9zdC1vZi1haS1zb2x1dGlvbnMtcm9tZXNoLXdhZGh3YW5pLzcwNzU5LzHSAawBaHR0cHM6Ly93d3cuZm9yYmVzaW5kaWEuY29tL2FtcC9hcnRpY2xlL2JpbGxpb25haXJlcy9pbmRpYS1oYXMtaGlnaC1xdWFsaXR5LWFpLXNjaWVudGlzdHMtYnV0LWluZGlhbi1idXNpbmVzc2VzLXlldC10by1tYWtlLXRoZS1tb3N0LW9mLWFpLXNvbHV0aW9ucy1yb21lc2gtd2FkaHdhbmkvNzA3NTkvMQ?oc=5,India has high quality AI scientists but Indian businesses yet to make the most of AI solutions: Romesh Wadhwani - Forbes India,2021-10-01,india high quality ai scientist indian business yet make ai solution : romesh wadhwani,"{'neg': 0.0, 'neu': 0.839, 'pos': 0.161, 'compound': 0.3182}",Positive
4,https://news.google.com/rss/articles/CBMidmh0dHBzOi8vd3d3LnRoZWd1YXJkaWFuLmNvbS90ZWNobm9sb2d5LzIwMjEvb2N0LzAyL3JvYm90cy1zdGVhbGluZy1qb2JzLWxhYm91ci1zaG9ydGFnZXMtYXJ0aWZpY2lhbC1pbnRlbGxpZ2VuY2UtY292aWTSAXZodHRwczovL2FtcC50aGVndWFyZGlhbi5jb20vdGVjaG5vbG9neS8yMDIxL29jdC8wMi9yb2JvdHMtc3RlYWxpbmctam9icy1sYWJvdXItc2hvcnRhZ2VzLWFydGlmaWNpYWwtaW50ZWxsaWdlbmNlLWNvdmlk?oc=5,Robots: stealing our jobs or solving labour shortages? - The Guardian,2021-10-02,robot : stealing job solving labour shortage ?,"{'neg': 0.514, 'neu': 0.27, 'pos': 0.216, 'compound': -0.5106}",Negative
5,https://news.google.com/rss/articles/CBMiWmh0dHBzOi8vc2xvYW5yZXZpZXcubWl0LmVkdS9hcnRpY2xlL2J1aWxkaW5nLWFuLW9yZ2FuaXphdGlvbmFsLWFwcHJvYWNoLXRvLXJlc3BvbnNpYmxlLWFpL9IBAA?oc=5,Building an Organizational Approach to Responsible AI - MIT Sloan Management Review,2021-10-06,building organizational approach responsible ai,"{'neg': 0.0, 'neu': 0.635, 'pos': 0.365, 'compound': 0.3182}",Positive
6,https://news.google.com/rss/articles/CBMidGh0dHBzOi8vd3d3LnRlY2h0YXJnZXQuY29tL3NlYXJjaGVudGVycHJpc2VhaS9uZXdzLzI1MjQ2NTcwNi9HYXVnaW5nLXRoZS1yaWdodC1hbW91bnQtb2YtZ292ZXJubWVudC1yZWd1bGF0aW9uLW9mLUFJ0gEA?oc=5,Examining both sides of the AI regulation debate - TechTarget,2021-10-08,examining side ai regulation debate,"{'neg': 0.0, 'neu': 1.0, 'pos': 0.0, 'compound': 0.0}",Neutral
7,https://news.google.com/rss/articles/CBMiSGh0dHBzOi8vaW5kaWFhaS5nb3YuaW4vYXJ0aWNsZS9hbW1hLWF1dG9tYXRpb24tYW5kLXRoZS1pbmRpYW4tcG9wdWxhdGlvbtIBAA?oc=5,"Amma, Automation and the Indian Population - INDIAai",2021-10-01,"amma , automation indian population","{'neg': 0.0, 'neu': 1.0, 'pos': 0.0, 'compound': 0.0}",Neutral
8,https://news.google.com/rss/articles/CBMigwFodHRwczovL3d3dy5iYm50aW1lcy5jb20vdGVjaG5vbG9neS9kb2VzLWFpLWNyZWF0ZS1vci1kZXN0cm95LWpvYnMtd2hhdC1pcy10aGUtcmVhbC10aHJlYXQtdG8taHVtYW4tc29jaWV0eS1vdmVyLXRoZS1jb21pbmctZGVjYWRlc9IBhwFodHRwczovL3d3dy5iYm50aW1lcy5jb20vdGVjaG5vbG9neS9kb2VzLWFpLWNyZWF0ZS1vci1kZXN0cm95LWpvYnMtd2hhdC1pcy10aGUtcmVhbC10aHJlYXQtdG8taHVtYW4tc29jaWV0eS1vdmVyLXRoZS1jb21pbmctZGVjYWRlcy9hbXA?oc=5,Does AI Create or Destroy Jobs? What is the Real Threat to Human Society Over the Coming Decades? - BBN Times,2021-10-04,ai create destroy job ? real threat human society coming decade ?,"{'neg': 0.444, 'neu': 0.428, 'pos': 0.128, 'compound': -0.7319}",Negative
9,https://news.google.com/rss/articles/CBMiZGh0dHBzOi8vbmV3c3Jvb20ubWVkbGluZS5jb20vY2FyZWdpdmVyLXJlYWRpbmVzcy9hcnRpZmljaWFsLWludGVsbGlnZW5jZS1haWRzLWxvbmctdGVybS1jYXJlLWhpcmluZy_SAQA?oc=5,Artificial intelligence aids long-term care hiring - Medline Newsroom,2021-10-07,artificial intelligence aid long,"{'neg': 0.0, 'neu': 0.492, 'pos': 0.508, 'compound': 0.4767}",Positive
10,https://news.google.com/rss/articles/CBMiNmh0dHBzOi8vd3d3LmFyYWJuZXdzLmNvbS9ub2RlLzE5NDAyOTEvYnVzaW5lc3MtZWNvbm9tedIBAA?oc=5,Japan to have shortage of 270000 AI and IoT engineers by 2030 - Arab News,2021-10-02,japan shortage 270000 ai iot engineer 2030,"{'neg': 0.25, 'neu': 0.75, 'pos': 0.0, 'compound': -0.25}",Negative
11,https://news.google.com/rss/articles/CBMibWh0dHBzOi8vd3d3LmVsbGVubWFjYXJ0aHVyZm91bmRhdGlvbi5vcmcvY2lyY3VsYXItZXhhbXBsZXMvYXJ0aWZpY2lhbC1pbnRlbGxpZ2VuY2UtZm9yLXJlY3ljbGluZy1hbXAtcm9ib3RpY3PSAQA?oc=5,Artificial intelligence for recycling: AMP Robotics - ellenmacarthurfoundation.org,2021-10-01,artificial intelligence recycling : amp robotics,"{'neg': 0.0, 'neu': 0.563, 'pos': 0.437, 'compound': 0.4767}",Positive
12,https://news.google.com/rss/articles/CBMiaWh0dHBzOi8vd3d3LmlkbS5uZXQuYXUvYXJ0aWNsZS8wMDEzNjQ1LWdhcnRuZXItc2F5cy1nb3Zlcm5tZW50LW9yZ2FuaXNhdGlvbnMtYXJlLWluY3JlYXNpbmctaW52ZXN0bWVudC1hadIBAA?oc=5,"Gartner Says Government Organisations Are Increasing Investment in AI, But Workforce Remains Apprehensive - IDM.net.au",2021-10-08,"gartner say government organisation increasing investment ai , workforce remains apprehensive","{'neg': 0.0, 'neu': 1.0, 'pos': 0.0, 'compound': 0.0}",Neutral
13,https://news.google.com/rss/articles/CBMikQFodHRwczovL3d3dy5mb3JiZXMuY29tL3NpdGVzL3JlYmVjY2FzdWhyYXdhcmRpLzIwMjEvMTAvMDgvdGhpbmtpbmctYWJvdXQtYWktdG8tZ3Jvdy15b3VyLWZhc2hpb24tb3ItZGVzaWduLWJyYW5kLWxldC10aGVzZS1jb21wYW5pZXMtaW5zcGlyZS15b3Uv0gEA?oc=5,Design The Next Stages Of Your Business With These Top Technology And AI Innovators - Forbes,2021-10-08,design next stage business top technology ai innovator,"{'neg': 0.0, 'neu': 0.795, 'pos': 0.205, 'compound': 0.2023}",Positive
14,https://news.google.com/rss/articles/CBMiOGh0dHBzOi8vd3d3LndhbWRhLmNvbS8yMDIxLzEwL3JvYm90cy1jcmVhdGUtZGVzdHJveS1qb2Jz0gEA?oc=5,Do robots create or destroy jobs? - Wamda,2021-10-03,robot create destroy job ?,"{'neg': 0.461, 'neu': 0.263, 'pos': 0.276, 'compound': -0.34}",Negative
15,https://news.google.com/rss/articles/CBMibmh0dHBzOi8vd3d3LnNkY2V4ZWMuY29tL3NvZnR3YXJlLXRlY2hub2xvZ3kvYWktYXIvYXJ0aWNsZS8yMTcxMTAzNS9kcmlzaHRpLWhvdy1haS1maWxscy10aGUtbGFib3Itc2hvcnRhZ2UtZ2Fw0gEA?oc=5,How AI Fills the Labor Shortage Gap - Supply and Demand Chain Executive,2021-10-04,ai fill labor shortage gap,"{'neg': 0.333, 'neu': 0.667, 'pos': 0.0, 'compound': -0.25}",Negative
16,https://news.google.com/rss/articles/CBMiT2h0dHBzOi8vbmV3cy51ZmwuZWR1LzIwMjEvMTAvdWYtcHJvZmVzc29yLXNheXMtZXZlcnlvbmUtbmVlZHMtdG8tdW5kZXJzdGFuZC1haS_SAQA?oc=5,Why this UF professor says everyone needs to understand AI - University of Florida,2021-10-06,uf professor say everyone need understand ai,"{'neg': 0.0, 'neu': 1.0, 'pos': 0.0, 'compound': 0.0}",Neutral
17,https://news.google.com/rss/articles/CBMikQFodHRwczovL3d3dy5hdW50bWlubmllLmNvbS9pbWFnaW5nLWluZm9ybWF0aWNzL2FydGlmaWNpYWwtaW50ZWxsaWdlbmNlL2FydGljbGUvMTU2MjkzNjYvZmVhci1vZi1haS1tYXktYmUtc2NhcmluZy1tZWRpY2FsLXN0dWRlbnRzLWZyb20tcmFkaW9sb2d50gEA?oc=5,Fear of AI may be scaring medical students from radiology - AuntMinnie,2021-10-04,fear ai may scaring medical student radiology,"{'neg': 0.55, 'neu': 0.45, 'pos': 0.0, 'compound': -0.7269}",Negative
18,https://news.google.com/rss/articles/CBMiPWh0dHBzOi8vdGVjaGhxLmNvbS8yMDIxLzEwL2F1dG9tYXRpb24tcm9ib3RzLW5leHQtdG9wLXRhaWxvci_SAQA?oc=5,Intelligent automation brings robots and clothing design to the same chic party - TechHQ,2021-10-04,intelligent automation brings robot clothing design chic party,"{'neg': 0.0, 'neu': 0.391, 'pos': 0.609, 'compound': 0.7783}",Positive
19,https://news.google.com/rss/articles/CBMiW2h0dHBzOi8vd3d3LnBlb3BsZW1hbmFnZW1lbnQuY28udWsvYXJ0aWNsZS8xNzQ2MjYyL3Nob3VsZC1wZW9wbGUtbWFuYWdlbWVudC1wb2xpY2llcy11c2UtYWnSAQA?oc=5,101834 - People Management Magazine,2021-10-08,101834,"{'neg': 0.0, 'neu': 1.0, 'pos': 0.0, 'compound': 0.0}",Neutral
20,https://news.google.com/rss/articles/CBMiNGh0dHBzOi8vc2lmdGVkLmV1L2FydGljbGVzL2V1cm9wZS1haS1iaWFzLXJlY3J1aXRpbmfSAQA?oc=5,Why don't Europe's policymakers address AI bias in recruitment? - Sifted,2021-10-07,n't europe 's policymakers address ai bias recruitment ?,"{'neg': 0.167, 'neu': 0.833, 'pos': 0.0, 'compound': -0.1027}",Negative
21,https://news.google.com/rss/articles/CBMijgFodHRwczovL2ludGVybmV0cmV0YWlsaW5nLm5ldC9hc2RhLXR1cm5zLXRvLWFpLWFzLWl0LWFjY2VsZXJhdGVzLW11bHRpLWNoYW5uZWwtdHJhbnNmb3JtYXRpb24tc3RyYXRlZ3ktZHJpdmVuLWJ5LXJldHVybi10by11ay1vd25lcnNoaXAtMjM4MDcv0gEA?oc=5,Asda turns to AI as it accelerates multi-channel transformation strategy driven by return to UK ownership - InternetRetailing,2021-10-06,asda turn ai accelerates multi,"{'neg': 0.0, 'neu': 1.0, 'pos': 0.0, 'compound': 0.0}",Neutral
22,https://news.google.com/rss/articles/CBMiNmh0dHBzOi8vd3d3LmtvcmVhaGVyYWxkLmNvbS92aWV3LnBocD91ZD0yMDIxMTAwNDAwMDIxNNIBOGh0dHBzOi8vbS5rb3JlYWhlcmFsZC5jb20vYW1wL3ZpZXcucGhwP3VkPTIwMjExMDA0MDAwMjE0?oc=5,"[Feature] AI job interviews are booming, but doubts linger - The Korea Herald",2021-10-04,"[ feature ] ai job interview booming , doubt linger","{'neg': 0.294, 'neu': 0.706, 'pos': 0.0, 'compound': -0.3612}",Negative
23,https://news.google.com/rss/articles/CBMiVmh0dHBzOi8vd3d3LmN4dG9kYXkuY29tL2NvbnRhY3QtY2VudHJlL2ZpdmU5LXZzLWdlbmVzeXMtYmF0dGxlLW9mLXRoZS1jb250YWN0LWNlbnRyZXMv0gEA?oc=5,Five9 vs Genesys: Battle of the Contact Centres - CX Today,2021-10-05,five9 v genesys : battle contact centre,"{'neg': 0.394, 'neu': 0.606, 'pos': 0.0, 'compound': -0.3818}",Negative
24,https://news.google.com/rss/articles/CBMicWh0dHBzOi8vamVyc2V5ZXZlbmluZ3Bvc3QuY29tL21vcmVuZXdzL3VrbmV3cy8yMDIxLzEwLzA4L3VrLWFscmVhZHktbGFja2luZy1za2lsbHMtZm9yLWFpLXJldm9sdXRpb24tcmVwb3J0LXNheXMv0gEA?oc=5,"UK already lacking skills for AI revolution, report says - Jersey Evening Post",2021-10-08,"uk already lacking skill ai revolution , report say","{'neg': 0.0, 'neu': 1.0, 'pos': 0.0, 'compound': 0.0}",Neutral
25,https://news.google.com/rss/articles/CBMiS2h0dHBzOi8vdWsuc3R5bGUueWFob28uY29tL25ld3MvdWstYWxyZWFkeS1sYWNraW5nLXNraWxscy1haS0xMzQzMjQwMzkuaHRtbNIBAA?oc=5,"UK already lacking skills for AI revolution, report says - Yahoo Lifestyle UK",2021-10-08,"uk already lacking skill ai revolution , report say","{'neg': 0.0, 'neu': 1.0, 'pos': 0.0, 'compound': 0.0}",Neutral
26,https://news.google.com/rss/articles/CBMiLmh0dHBzOi8vd3d3LmJiYy5jby51ay9uZXdzL3RlY2hub2xvZ3ktNTg4MzEzNzPSATJodHRwczovL3d3dy5iYmMuY28udWsvbmV3cy90ZWNobm9sb2d5LTU4ODMxMzczLmFtcA?oc=5,Legal action over alleged Uber facial verification bias - BBC,2021-10-08,legal action alleged uber facial verification bias,"{'neg': 0.204, 'neu': 0.612, 'pos': 0.184, 'compound': -0.0422}",Negative
27,https://news.google.com/rss/articles/CBMiPGh0dHBzOi8vbnZzaHEub3JnL2NhcmVlci9lbWVyZ2luZy1zZWN0b3JzLWZvci1qb2JzLWluLWluZGlhL9IBAA?oc=5,10 Emerging Sectors for Jobs in India [2024] - In Details - Nvshq.org,2021-10-02,10 emerging sector job india [ 2024 ],"{'neg': 0.0, 'neu': 1.0, 'pos': 0.0, 'compound': 0.0}",Neutral
