,URL link,Title,Date,Preprocessed Title,Value,Sentiment
0,https://news.google.com/rss/articles/CBMihQFodHRwczovL3d3dy5mb3JiZXMuY29tL3NpdGVzL2Jlcm5hcmRtYXJyLzIwMjIvMDUvMzAvaHVtYW4tdnMtYXJ0aWZpY2lhbC1pbnRlbGxpZ2VuY2Utd2h5LWZpbmRpbmctdGhlLXJpZ2h0LWJhbGFuY2UtaXMta2V5LXRvLXN1Y2Nlc3Mv0gEA?oc=5,Human Vs. Artificial Intelligence: Why Finding The Right Balance Is Key To Success - Forbes,2022-05-30,human vs. artificial intelligence : finding right balance key success,"{'neg': 0.0, 'neu': 0.507, 'pos': 0.493, 'compound': 0.7783}",Positive
1,https://news.google.com/rss/articles/CBMiYWh0dHBzOi8vd3d3LnNocm0ub3JnL3RvcGljcy10b29scy9uZXdzL3RlY2hub2xvZ3kvYWktYWRvcHRpb24td2lsbC1jYXVzZS13b3JrZm9yY2UtcmVvcmdhbml6YXRpb27SAQA?oc=5,AI Adoption Will Cause Workforce Reorganization - SHRM,2022-05-25,ai adoption cause workforce reorganization,"{'neg': 0.0, 'neu': 1.0, 'pos': 0.0, 'compound': 0.0}",Neutral
2,https://news.google.com/rss/articles/CBMiUmh0dHBzOi8vY2hhaW5zdG9yZWFnZS5jb20vYWktYW5kLXdvcmtwbGFjZS10cmFuc2Zvcm1hdGlvbi1oZXJlcy13aGF0LXlvdS1uZWVkLWtub3fSAQA?oc=5,AI and Workplace Transformation: Here’s what you need to know - Chain Store Age,2022-05-26,ai workplace transformation : ’ need know,"{'neg': 0.0, 'neu': 1.0, 'pos': 0.0, 'compound': 0.0}",Neutral
3,https://news.google.com/rss/articles/CBMiQGh0dHBzOi8vd3d3LnRlY2hyZXB1YmxpYy5jb20vYXJ0aWNsZS9yZXNraWxsLXlvdXJzZWxmLWNhcmVlci1haS_SAQA?oc=5,How to reskill yourself for a career in AI - TechRepublic,2022-05-27,reskill career ai,"{'neg': 0.0, 'neu': 1.0, 'pos': 0.0, 'compound': 0.0}",Neutral
4,https://news.google.com/rss/articles/CBMiXGh0dHBzOi8vd3d3LmRpY2UuY29tL2NhcmVlci1hZHZpY2UvbWljcm9zb2Z0cy1henVyZS1ub3ctZmVhdHVyZXMtb3BlbmFpLXRvb2xzLWZvci1kZXZlbG9wZXJz0gEA?oc=5,Microsoft's Azure Now Features OpenAI Tools for Developers - Dice Insights,2022-05-31,microsoft 's azure feature openai tool developer,"{'neg': 0.0, 'neu': 1.0, 'pos': 0.0, 'compound': 0.0}",Neutral
5,https://news.google.com/rss/articles/CBMiNGh0dHBzOi8vd3d3LmFwcGVuLmNvbS9ibG9nL2FpLWhlbHBzLWVuZC13b3JsZC1odW5nZXLSAQA?oc=5,"AI Can Help End World Hunger, One Crop at a Time - Appen",2022-05-28,"ai help end world hunger , one crop time","{'neg': 0.187, 'neu': 0.561, 'pos': 0.252, 'compound': 0.1779}",Positive
6,https://news.google.com/rss/articles/CBMiNmh0dHBzOi8vd3d3LmF6b3JvYm90aWNzLmNvbS9BcnRpY2xlLmFzcHg_QXJ0aWNsZUlEPTUyMNIBAA?oc=5,"AI in the Architectural, Engineering and Construction Industries - AZoRobotics",2022-05-26,"ai architectural , engineering construction industry","{'neg': 0.0, 'neu': 1.0, 'pos': 0.0, 'compound': 0.0}",Neutral
7,https://news.google.com/rss/articles/CBMiRWh0dHBzOi8vaHVtYW5tZWRpY2luZS5tc3UuZWR1L25ld3MvYXJjaGl2ZXMvMjAyMi8yMDIyLWVtb3Rpb24tYWkuaHRtbNIBAA?oc=5,Artificial Intelligence Biased Against People with Mental Illness - Michigan State University,2022-05-30,artificial intelligence biased people mental illness,"{'neg': 0.44, 'neu': 0.275, 'pos': 0.284, 'compound': -0.1779}",Negative
8,https://news.google.com/rss/articles/CBMiqgFodHRwOi8vbmV3YW1lcmljYS5vcmcvZWR1Y2F0aW9uLXBvbGljeS9lZGNlbnRyYWwvY29tbXVuaXR5LWNvbGxlZ2VzLWFuZC1lbXBsb3llci1wYXJ0bmVycy1hcmUtdGVhbWluZy11cC10by1leHBhbmQtcGF0aHdheXMtdG8tYXJ0aWZpY2lhbC1pbnRlbGxpZ2VuY2Utam9icy1vZi10aGUtZnV0dXJlL9IBAA?oc=5,Intel aims to expand community college-level AI workforce programs in all fifty states. - New America,2022-05-31,intel aim expand community college,"{'neg': 0.0, 'neu': 0.635, 'pos': 0.365, 'compound': 0.3182}",Positive
9,https://news.google.com/rss/articles/CBMiUGh0dHBzOi8vd3d3LmJyb2FkY29tLmNvbS9ibG9nL2RlcGxveWluZy1haS1tbC10cmFpbmluZy1jbHVzdGVycy13aXRoLWlwLWV0aGVybmV00gEA?oc=5,Deploying AI/ML training clusters with IP/Ethernet - Broadcom Inc.,2022-05-26,deploying ai/ml training cluster ip/ethernet,"{'neg': 0.0, 'neu': 1.0, 'pos': 0.0, 'compound': 0.0}",Neutral
10,https://news.google.com/rss/articles/CBMiXWh0dHBzOi8vd3d3LmZvbGV5LmNvbS9pbnNpZ2h0cy9wdWJsaWNhdGlvbnMvMjAyMi8wNS9uZXctZWVvYy1ndWlkYW5jZS11c2Utb2YtYWktZGlzY3JpbWluYXRlL9IBAA?oc=5,New EEOC Guidance: The Use of Artificial Intelligence Can Discriminate Against Employees or Job Applicants with ... - Foley & Lardner LLP,2022-05-31,new eeoc guidance : use artificial intelligence discriminate employee job applicant ...,"{'neg': 0.0, 'neu': 0.763, 'pos': 0.237, 'compound': 0.4767}",Positive
11,https://news.google.com/rss/articles/CBMiVmh0dHBzOi8vd3d3Lml0YnVzaW5lc3NlZGdlLmNvbS9idXNpbmVzcy1pbnRlbGxpZ2VuY2UvYmlnLWRhdGEtYW5kLWRhdGEtYW5hbHl0aWNzLWpvYnMv0gEA?oc=5,Top Big Data & Data Analytics Jobs in 2022 - IT Business Edge,2022-05-25,top big data & data analytics job 2022,"{'neg': 0.0, 'neu': 0.769, 'pos': 0.231, 'compound': 0.2023}",Positive
12,https://news.google.com/rss/articles/CBMiaGh0dHBzOi8vd3d3LmJyb29raW5ncy5lZHUvYXJ0aWNsZXMvdGhlLWVlb2Mtd2FudHMtdG8tbWFrZS1haS1oaXJpbmctZmFpcmVyLWZvci1wZW9wbGUtd2l0aC1kaXNhYmlsaXRpZXMv0gEA?oc=5,The EEOC wants to make AI hiring fairer for people with disabilities - Brookings Institution,2022-05-26,eeoc want make ai hiring fairer people disability,"{'neg': 0.0, 'neu': 0.843, 'pos': 0.157, 'compound': 0.0772}",Positive
13,https://news.google.com/rss/articles/CBMiYWh0dHBzOi8vd3d3LnRoZWd1YXJkaWFuLmNvbS91cy1uZXdzLzIwMjIvbWF5LzI4L3JvYm90LWFncmljdWx0dXJlLWZhcm1pbmctYXJ0aWZpY2lhbC1pbnRlbGxpZ2VuY2XSAWFodHRwczovL2FtcC50aGVndWFyZGlhbi5jb20vdXMtbmV3cy8yMDIyL21heS8yOC9yb2JvdC1hZ3JpY3VsdHVyZS1mYXJtaW5nLWFydGlmaWNpYWwtaW50ZWxsaWdlbmNl?oc=5,Will this fruit-picking robot transform agriculture? - The Guardian US,2022-05-28,fruit,"{'neg': 0.0, 'neu': 1.0, 'pos': 0.0, 'compound': 0.0}",Neutral
14,https://news.google.com/rss/articles/CBMiLmh0dHBzOi8vd3d3LmJ1c2luZXNzaW5zaWRlci5jb20vZnV0dXJlLW9mLXdvcmvSAQA?oc=5,Future of Work - Business Insider,2022-05-27,future work,"{'neg': 0.0, 'neu': 1.0, 'pos': 0.0, 'compound': 0.0}",Neutral
15,https://news.google.com/rss/articles/CBMiZWh0dHBzOi8vd3d3LmRpY2UuY29tL2NhcmVlci1hZHZpY2Uvd2lsbC10aGUtZ3JlYXQtcmVzaWduYXRpb24tZHJpdmUtam9icy10by1kcm9wLWNvbGxlZ2UtcmVxdWlyZW1lbnRz0gEA?oc=5,Will the Great Resignation Drive Jobs to Drop College Requirements? - Dice Insights,2022-05-26,great resignation drive job drop college requirement ?,"{'neg': 0.347, 'neu': 0.323, 'pos': 0.331, 'compound': 0.2023}",Negative
16,https://news.google.com/rss/articles/CBMiZmh0dHBzOi8vdGVjaGNydW5jaC5jb20vMjAyMi8wNS8yNi9tYW50YS1hLWRhdGEtb2JzZXJ2YWJpbGl0eS1zdGFydHVwLXJhaXNlcy0zNW0tdG8tZ3Jvdy1pdHMtd29ya2ZvcmNlL9IBAA?oc=5,"Manta, a data observability startup, raises $35M to grow its workforce - TechCrunch",2022-05-26,"manta , data observability startup , raise $ 35m grow workforce","{'neg': 0.0, 'neu': 1.0, 'pos': 0.0, 'compound': 0.0}",Neutral
17,https://news.google.com/rss/articles/CBMiT2h0dHBzOi8vaHJtYXNpYS5jb20vNWctbmV0d29yay1leHBlY3RlZC10by1jcmVhdGUtZW1wbG95bWVudC1ib29zdC1pbi1tYWxheXNpYS_SAQA?oc=5,5G network expected to create employment boost in Malaysia - HRM Asia,2022-05-25,5g network expected create employment boost malaysia,"{'neg': 0.0, 'neu': 0.51, 'pos': 0.49, 'compound': 0.5859}",Positive
18,https://news.google.com/rss/articles/CBMiSGh0dHBzOi8vYnVzaW5lc3Nqb3VybmFsZGFpbHkuY29tL2FwcGx5aW5nLWZvci1hLWpvYi1nZXQtcGFzdC1haS1maWx0ZXJzL9IBAA?oc=5,Applying for a Job? Get Past AI Filters - businessjournaldaily.com,2022-05-26,applying job ? get past ai filter,"{'neg': 0.0, 'neu': 1.0, 'pos': 0.0, 'compound': 0.0}",Neutral
