,URL link,Title,Date,Preprocessed Title,Value,Sentiment
56,https://news.google.com/rss/articles/CBMif2h0dHBzOi8vd3d3LnNjaWVudGlmaWNhbWVyaWNhbi5jb20vYXJ0aWNsZS91bnJlZ3VsYXRlZC1haS13aWxsLXdvcnNlbi1pbmVxdWFsaXR5LXdhcm5zLW5vYmVsLXdpbm5pbmctZWNvbm9taXN0LWpvc2VwaC1zdGlnbGl0ei_SAQA?oc=5,"Unregulated AI Will Worsen Inequality, Warns Nobel-Winning Economist Joseph Stiglitz - Scientific American",2023-08-01,"unregulated ai worsen inequality , warns nobel","{'neg': 0.54, 'neu': 0.46, 'pos': 0.0, 'compound': -0.5719}",Negative
57,https://news.google.com/rss/articles/CBMieGh0dHBzOi8vYWRhZ2UuY29tL2FydGljbGUvZGlnaXRhbC1tYXJrZXRpbmctYWQtdGVjaC1uZXdzL2dlbmVyYXRpdmUtYWktam9icy1tYXJrZXRpbmctbmV3LXRpdGxlcy1icmFuZHMtYWdlbmNpZXMvMjUwNzIwNtIBAA?oc=5,AI jobs in marketing—the future of the new titles at brands and agencies - Ad Age,2023-08-01,ai job marketing—the future new title brand agency,"{'neg': 0.0, 'neu': 1.0, 'pos': 0.0, 'compound': 0.0}",Neutral
58,https://news.google.com/rss/articles/CBMiVGh0dHBzOi8vd3d3LnZvYW5ld3MuY29tL2EvYWktYW54aWV0eS13b3JrZXJzLWZyZXQtb3Zlci11bmNlcnRhaW4tZnV0dXJlLzcyMTIwNDkuaHRtbNIBVmh0dHBzOi8vd3d3LnZvYW5ld3MuY29tL2FtcC9haS1hbnhpZXR5LXdvcmtlcnMtZnJldC1vdmVyLXVuY2VydGFpbi1mdXR1cmUvNzIxMjA0OS5odG1s?oc=5,AI Anxiety: Workers Fret Over Uncertain Future - Voice of America - VOA News,2023-08-06,ai anxiety : worker fret uncertain future,"{'neg': 0.494, 'neu': 0.506, 'pos': 0.0, 'compound': -0.4404}",Negative
59,https://news.google.com/rss/articles/CBMiZ2h0dHBzOi8vd3d3LmdvdnRlY2guY29tL2VkdWNhdGlvbi9oaWdoZXItZWQvZ2VvcmdpYS1jb2xsYWJvcmF0aXZlLWRldmVsb3BpbmctYWktbWFudWZhY3R1cmluZy13b3JrZm9yY2XSAQA?oc=5,Georgia Collaborative Developing AI Manufacturing Workforce - Government Technology,2023-08-01,georgia collaborative developing ai manufacturing workforce,"{'neg': 0.0, 'neu': 1.0, 'pos': 0.0, 'compound': 0.0}",Neutral
60,https://news.google.com/rss/articles/CBMiW2h0dHBzOi8vd3d3LmZveG5ld3MuY29tL29waW5pb24vcG9sbC1yZXZlYWxzLXdoYXQtYW1lcmljYW5zLWZlYXItYWJvdXQtYWktdGFraW5nLXRoZWlyLWpvYnPSAV9odHRwczovL3d3dy5mb3huZXdzLmNvbS9vcGluaW9uL3BvbGwtcmV2ZWFscy13aGF0LWFtZXJpY2Fucy1mZWFyLWFib3V0LWFpLXRha2luZy10aGVpci1qb2JzLmFtcA?oc=5,A new poll reveals what Americans fear about AI taking their jobs - Fox News,2023-08-07,new poll reveals american fear ai taking job,"{'neg': 0.314, 'neu': 0.686, 'pos': 0.0, 'compound': -0.4939}",Negative
61,https://news.google.com/rss/articles/CBMikgFodHRwczovL3d3dy5sYXRpbWVzLmNvbS9lbnRlcnRhaW5tZW50LWFydHMvYnVzaW5lc3Mvc3RvcnkvMjAyMy0wOC0wNi9hY3RvcnMtYW5kLXdyaXRlcnMtYXJlLXdvcnJpZWQtYWJvdXQtYWktc28taXMtZXZlcnlvbmUtZWxzZS1uZXctcG9sbGluZy1zaG93c9IBAA?oc=5,"Actors and writers aren’t the only ones worried about AI, new polling shows - Los Angeles Times",2023-08-06,"actor writer ’ one worried ai , new polling show","{'neg': 0.239, 'neu': 0.761, 'pos': 0.0, 'compound': -0.296}",Negative
62,https://news.google.com/rss/articles/CBMigQFodHRwczovL3d3dy5uYmNuZXd5b3JrLmNvbS9uZXdzL2J1c2luZXNzL3dpbGwtYWktcmVwbGFjZS15b3VyLWpvYi1uZXctc3R1ZHktcmV2ZWFscy10aGUtcHJvZmVzc2lvbnMtbW9zdC1hdC1yaXNrLWJ5LTIwMzAvNDU1Nzg3NS_SAYcBaHR0cHM6Ly93d3cubmJjbmV3eW9yay5jb20vbmV3cy9idXNpbmVzcy93aWxsLWFpLXJlcGxhY2UteW91ci1qb2ItbmV3LXN0dWR5LXJldmVhbHMtdGhlLXByb2Zlc3Npb25zLW1vc3QtYXQtcmlzay1ieS0yMDMwLzQ1NTc4NzUvP2FtcD0x?oc=5,Will AI replace your job? New study reveals the professions most at-risk by 2030 - NBC New York,2023-08-08,ai replace job ? new study reveals profession,"{'neg': 0.0, 'neu': 1.0, 'pos': 0.0, 'compound': 0.0}",Neutral
63,https://news.google.com/rss/articles/CBMimAFodHRwczovL3d3dy5yZXNlYXJjaGdhdGUubmV0L3B1YmxpY2F0aW9uLzM3MjgyMjYwN19Bbl9FbXBpcmljYWxfSW52ZXN0aWdhdGlvbl9vZl90aGVfSW1wYWN0X29mX0FydGlmaWNpYWxfSW50ZWxsaWdlbmNlX29uX0FjY291bnRpbmdfUHJhY3RpY2VfaW5fTmlnZXJpYdIBAA?oc=5,(PDF) An Empirical Investigation of the Impact of Artificial Intelligence on Accounting Practice in Nigeria - ResearchGate,2023-08-01,( pdf ) empirical investigation impact artificial intelligence accounting practice nigeria,"{'neg': 0.0, 'neu': 0.721, 'pos': 0.279, 'compound': 0.4767}",Positive
64,https://news.google.com/rss/articles/CBMibmh0dHBzOi8vd3d3LmZveGJ1c2luZXNzLmNvbS90ZWNobm9sb2d5L2FpLWFscmVhZHktc3VycGFzc2VkLWh1bWFuLWNhcGFiaWxpdGllcy1zZXZlcmFsLWRvbWFpbnMtd2hpY2gtam9icy1uZXh00gFyaHR0cHM6Ly93d3cuZm94YnVzaW5lc3MuY29tL3RlY2hub2xvZ3kvYWktYWxyZWFkeS1zdXJwYXNzZWQtaHVtYW4tY2FwYWJpbGl0aWVzLXNldmVyYWwtZG9tYWlucy13aGljaC1qb2JzLW5leHQuYW1w?oc=5,AI has already surpassed human capabilities in several domains; which jobs are next? - Fox Business,2023-08-03,ai already surpassed human capability several domain ; job next ?,"{'neg': 0.0, 'neu': 1.0, 'pos': 0.0, 'compound': 0.0}",Neutral
65,https://news.google.com/rss/articles/CBMiX2h0dHBzOi8vd3d3Lm5iY25ld3MuY29tL25ld3MvYXNpYW4tYW1lcmljYS9hc2lhbi1hbWVyaWNhbi13b3JrZXJzLWhlYXZpbHktYWZmZWN0ZWQtYWktcmNuYTk4MTc50gEqaHR0cHM6Ly93d3cubmJjbmV3cy5jb20vbmV3cy9hbXAvcmNuYTk4MTc5?oc=5,Asian American workers could be the most heavily affected by AI - NBC News,2023-08-04,asian american worker could heavily affected ai,"{'neg': 0.211, 'neu': 0.789, 'pos': 0.0, 'compound': -0.1531}",Negative
66,https://news.google.com/rss/articles/CBMibWh0dHBzOi8vd3d3LmJsb29tYmVyZy5jb20vbmV3cy9hcnRpY2xlcy8yMDIzLTA4LTA4L2hvdy10b3JvbnRvLWlzLWNvbXBldGluZy10by1iZWNvbWUtYS1nbG9iYWwtYWktZGVzdGluYXRpb27SAQA?oc=5,Toronto Takes on Silicon Valley to Become AI Startup Hub - Bloomberg,2023-08-08,toronto take silicon valley become ai startup hub,"{'neg': 0.0, 'neu': 1.0, 'pos': 0.0, 'compound': 0.0}",Neutral
67,https://news.google.com/rss/articles/CBMiWGh0dHBzOi8vbnlwb3N0LmNvbS8yMDIzLzA4LzAyL2FpLXN0b2xlLW15LWpvYi1wYXktaXMtZG93bi05MC1hbmQtbXktZmFtaWx5LWlzLXN1ZmZlcmluZy_SAQA?oc=5,AI stole my job — pay is down 90% and my family is suffering - New York Post,2023-08-02,ai stole job — pay 90 % family suffering,"{'neg': 0.474, 'neu': 0.526, 'pos': 0.0, 'compound': -0.5423}",Negative
68,https://news.google.com/rss/articles/CBMib2h0dHBzOi8vd3d3LnRoZWd1YXJkaWFuLmNvbS90ZWNobm9sb2d5LzIwMjMvYXVnLzAyL2FpLWNoYXRib3QtdHJhaW5pbmctaHVtYW4tdG9sbC1jb250ZW50LW1vZGVyYXRvci1tZXRhLW9wZW5hadIBb2h0dHBzOi8vYW1wLnRoZWd1YXJkaWFuLmNvbS90ZWNobm9sb2d5LzIwMjMvYXVnLzAyL2FpLWNoYXRib3QtdHJhaW5pbmctaHVtYW4tdG9sbC1jb250ZW50LW1vZGVyYXRvci1tZXRhLW9wZW5haQ?oc=5,‘It’s destroyed me completely’: Kenyan moderators decry toll of training of AI models - The Guardian,2023-08-02,‘ ’ destroyed completely ’ : kenyan moderator decry toll training ai model,"{'neg': 0.286, 'neu': 0.714, 'pos': 0.0, 'compound': -0.4939}",Negative
69,https://news.google.com/rss/articles/CBMicWh0dHBzOi8vd3d3LmJ1c2luZXNzaW5zaWRlci5jb20vY2hhdGdwdC1zZWNyZXQtcHJvZHVjdGl2aXR5LXdvcmstYWktdGVjaG5vbG9neS1iYW4tZW1wbG95ZWVzLWNvd29ya2Vycy1qb2ItMjAyMy040gEA?oc=5,Employees Are Secretly Using ChatGPT to Get Ahead at Work - Business Insider,2023-08-01,employee secretly using chatgpt get ahead work,"{'neg': 0.0, 'neu': 1.0, 'pos': 0.0, 'compound': 0.0}",Neutral
70,https://news.google.com/rss/articles/CBMibGh0dHBzOi8vd3d3LnNhY3VycmVudC5jb20vbmV3cy8xNC1vZi1zYW4tYW50b25pb3Mtd29ya2ZvcmNlLWNvdWxkLWJlLXJlcGxhY2VkLWJ5LWFpLWluLWNvbWluZy15ZWFycy0zMjM1NTUwM9IBAA?oc=5,14% of San Antonio's workforce could be replaced by AI in coming years - San Antonio Current,2023-08-07,14 % san antonio 's workforce could replaced ai coming year,"{'neg': 0.0, 'neu': 1.0, 'pos': 0.0, 'compound': 0.0}",Neutral
71,https://news.google.com/rss/articles/CBMiOmh0dHBzOi8vd3d3LnJhZ2FuLmNvbS90aGUtd2Vlay1pbi1jb21tcy1jdnMtYWktam9iLW1hcmtldC_SAQA?oc=5,"CVS cuts 5,000 jobs, employees secretly use AI to work quicker - Ragan Communications",2023-08-04,"cv cut 5,000 job , employee secretly use ai work quicker","{'neg': 0.189, 'neu': 0.811, 'pos': 0.0, 'compound': -0.2732}",Negative
72,https://news.google.com/rss/articles/CBMiRmh0dHBzOi8vZmluYW5jZS55YWhvby5jb20vbmV3cy9haS1jaGF0LWdwdC13aGl0ZS1jb2xsYXItMTU0MDUzMzcwLmh0bWzSAQA?oc=5,"AI and Chat GPT: 'White-Collar, Higher-Paid Workers' Could Be Next To Have Jobs Replaced - Yahoo Finance",2023-08-03,ai chat gpt : 'white,"{'neg': 0.0, 'neu': 1.0, 'pos': 0.0, 'compound': 0.0}",Neutral
73,https://news.google.com/rss/articles/CBMiQ2h0dHBzOi8vd3d3LmRlemVlbi5jb20vMjAyMy8wOC8wMi9hcmNoaXRlY3RzLWxvc2Utam9icy1haS1jb21tZW50cy_SAQA?oc=5,"""AI will never replace a Frank Lloyd Wright"" says commenter - Dezeen",2023-08-02,`` ai never replace frank lloyd wright '' say commenter,"{'neg': 0.0, 'neu': 1.0, 'pos': 0.0, 'compound': 0.0}",Neutral
74,https://news.google.com/rss/articles/CBMiY2h0dHBzOi8vYmxvZ3MubHNlLmFjLnVrL2J1c2luZXNzcmV2aWV3LzIwMjMvMDgvMDQvaG93LXRvLWJyaWRnZS10aGUtYXJ0aWZpY2lhbC1pbnRlbGxpZ2VuY2UtZGl2aWRlL9IBAA?oc=5,How to bridge the artificial intelligence divide - LSE Home,2023-08-04,bridge artificial intelligence divide,"{'neg': 0.0, 'neu': 0.492, 'pos': 0.508, 'compound': 0.4767}",Positive
75,https://news.google.com/rss/articles/CBMiwgFodHRwczovL3d3bXQuY29tL25ld3MvbG9jYWwvYXJ0aWZpY2lhbC1pbnRlbGxpZ2VuY2Utam9icy1ncmFuZC1yYXBpZHMtYXV0b21hdGVkLTIwMjctZ2xvYmFsLW5hdGlvbmFsLWRldHJvaXQtbGFzLXZlZ2FzLW1pYW1pLWVtcGxveW1lbnQtc3RhdGlzdGljcy1zdHVkeS1idXJlYXUtbGFib3ItZWNvbm9taWMtZm9ydW0td2VzdC1taWNoaWdhbtIBxgFodHRwczovL3d3bXQuY29tL2FtcC9uZXdzL2xvY2FsL2FydGlmaWNpYWwtaW50ZWxsaWdlbmNlLWpvYnMtZ3JhbmQtcmFwaWRzLWF1dG9tYXRlZC0yMDI3LWdsb2JhbC1uYXRpb25hbC1kZXRyb2l0LWxhcy12ZWdhcy1taWFtaS1lbXBsb3ltZW50LXN0YXRpc3RpY3Mtc3R1ZHktYnVyZWF1LWxhYm9yLWVjb25vbWljLWZvcnVtLXdlc3QtbWljaGlnYW4?oc=5,"Nearly 80,000 Grand Rapids jobs threatened by AI, study finds - WWMT-TV",2023-08-02,"nearly 80,000 grand rapid job threatened ai , study find","{'neg': 0.231, 'neu': 0.538, 'pos': 0.231, 'compound': 0.0}",Neutral
76,https://news.google.com/rss/articles/CBMiZWh0dHBzOi8vd3d3LnJlYWRlcnNkaWdlc3QuY28udWsvaW5zcGlyZS9saWZlL2hvdy10by1mdXR1cmUtcHJvb2YteW91ci1jYXJlZXItYWdhaW5zdC10aGUtdGhyZWF0LW9mLWFp0gEA?oc=5,How to future-proof your career against the threat of AI - Readers Digest,2023-08-02,future,"{'neg': 0.0, 'neu': 1.0, 'pos': 0.0, 'compound': 0.0}",Neutral
77,https://news.google.com/rss/articles/CBMiZ2h0dHBzOi8vd3d3LmNhbmFkaWFubWFudWZhY3R1cmluZy5jb20vZmVhdHVyZXMvYWktZW1wb3dlcmluZy10aGUtbWFudWZhY3R1cmluZy13b3JrZm9yY2Utb2YtdGhlLWZ1dHVyZS_SAQA?oc=5,AI: Empowering the manufacturing workforce of the future - Canadian Manufacturing,2023-08-03,ai : empowering manufacturing workforce future,"{'neg': 0.0, 'neu': 1.0, 'pos': 0.0, 'compound': 0.0}",Neutral
78,https://news.google.com/rss/articles/CBMiW2h0dHBzOi8vdmVudHVyZWJlYXQuY29tL2FpL2RvbnQtcXVpdC15b3VyLWRheS1qb2ItZ2VuZXJhdGl2ZS1haS1hbmQtdGhlLWVuZC1vZi1wcm9ncmFtbWluZy_SAQA?oc=5,Don’t quit your day job: Generative AI and the end of programming - VentureBeat,2023-08-06,’ quit day job : generative ai end programming,"{'neg': 0.0, 'neu': 1.0, 'pos': 0.0, 'compound': 0.0}",Neutral
79,https://news.google.com/rss/articles/CBMiRmh0dHBzOi8vd3d3LmF4aW9zLmNvbS9sb2NhbC9zYW4tYW50b25pby8yMDIzLzA4LzAyL2FpLWpvYnMtc2FuLWFudG9uaW_SAQA?oc=5,San Antonio's workforce threatened by AI - Axios,2023-08-02,san antonio 's workforce threatened ai,"{'neg': 0.375, 'neu': 0.625, 'pos': 0.0, 'compound': -0.4588}",Negative
80,https://news.google.com/rss/articles/CBMiPWh0dHBzOi8vd3d3LmFhcnAub3JnL3dvcmsvY2FyZWVycy9hdXRvbWF0aW9uLXRlY2hub2xvZ3ktd29yay_SAQA?oc=5,Should Older Workers Worry About AI? - AARP,2023-08-02,older worker worry ai ?,"{'neg': 0.492, 'neu': 0.508, 'pos': 0.0, 'compound': -0.4404}",Negative
81,https://news.google.com/rss/articles/CBMiNmh0dHBzOi8vbmV3cy51ZmwuZWR1LzIwMjMvMDgvdWYtZGVzaWduZWQtYWktZWR1Y2F0aW9uL9IBAA?oc=5,Preparing Florida’s youth for ever evolving 21st century - University of Florida,2023-08-08,preparing florida ’ youth ever evolving 21st century,"{'neg': 0.0, 'neu': 1.0, 'pos': 0.0, 'compound': 0.0}",Neutral
82,https://news.google.com/rss/articles/CBMicGh0dHBzOi8vd3d3Lndzai5jb20vYXJ0aWNsZXMvYWktaXMtaG9sbHl3b29kcy1mYWtlLXZpbGxhaW4tdW5pb25zLXN0cmlrZS1hY3RvcnMtd3JpdGVycy1haS1qb2JzLXN0dWRpb3MtOWNkYjNhYjTSAQA?oc=5,Opinion | AI Is Hollywood’s Fake Villain - The Wall Street Journal,2023-08-01,opinion | ai hollywood ’ fake villain,"{'neg': 0.691, 'neu': 0.309, 'pos': 0.0, 'compound': -0.7717}",Negative
83,https://news.google.com/rss/articles/CBMiUGh0dHBzOi8vd3d3Lndhc2hpbmd0b25wb3N0LmNvbS90ZWNobm9sb2d5LzIwMjMvMDgvMDMvam9iLXNlYXJjaC1zaXRlcy1haS1oaXJpbmcv0gEA?oc=5,Your résumé isn’t the only thing popular job sites evaluate - The Washington Post,2023-08-03,résumé ’ thing popular job site evaluate,"{'neg': 0.0, 'neu': 0.641, 'pos': 0.359, 'compound': 0.4215}",Positive
84,https://news.google.com/rss/articles/CBMiX2h0dHBzOi8vd3d3LnBlcnNvbm5lbHRvZGF5LmNvbS9oci91bmZhaXItdW50cnVzdHdvcnRoeS1jYW5kaWRhdGVzLXZlcmRpY3Qtb24tYWktaW4tcmVjcnVpdG1lbnQv0gEA?oc=5,"‘Unfair, untrustworthy’: candidates’ verdict on AI in recruitment - Personnel Today",2023-08-04,"‘ unfair , untrustworthy ’ : candidate ’ verdict ai recruitment","{'neg': 0.356, 'neu': 0.46, 'pos': 0.184, 'compound': -0.3612}",Negative
85,https://news.google.com/rss/articles/CBMiTmh0dHBzOi8vZm9ydHVuZS5jb20vMjAyMy8wOC8wOC9kaXNuZXktYWktdGFzay1mb3JjZS1hY3RvcnMtd3JpdGVycy1zdGVhbC1qb2JzL9IBAA?oc=5,"Disney has an A.I. task force, while writers strike - Fortune",2023-08-08,"disney a.i . task force , writer strike","{'neg': 0.231, 'neu': 0.769, 'pos': 0.0, 'compound': -0.128}",Negative
86,https://news.google.com/rss/articles/CBMiNWh0dHBzOi8vd3d3LmlyaXNoZXhhbWluZXIuY29tL25ld3MvYXJpZC00MTE5NjkyOC5odG1s0gEA?oc=5,"AI poses significant threat to Irish jobs, says report - Irish Examiner",2023-08-03,"ai pose significant threat irish job , say report","{'neg': 0.304, 'neu': 0.536, 'pos': 0.161, 'compound': -0.3818}",Negative
87,https://news.google.com/rss/articles/CBMiWGh0dHBzOi8vaXRicmllZi5jb20uYXUvc3RvcnkvbWFqb3JpdHktb2YtYXVzdHJhbGlhbnMtY29uY2VybmVkLWFib3V0LWFpLWFkb3B0aW9uLWF0LXdvcmvSAQA?oc=5,Majority of Australians concerned about AI adoption at work - IT Brief Australia,2023-08-01,majority australian concerned ai adoption work,"{'neg': 0.0, 'neu': 1.0, 'pos': 0.0, 'compound': 0.0}",Neutral
88,https://news.google.com/rss/articles/CBMiRmh0dHBzOi8vd3d3LmF4aW9zLmNvbS9sb2NhbC9yaWNobW9uZC8yMDIzLzA4LzA4L3JpY2htb25kLWFpLWpvYi1sb3NzZXPSAQA?oc=5,"Report: Richmond risks losing 75,000 jobs to AI - Axios",2023-08-08,"report : richmond risk losing 75,000 job ai","{'neg': 0.485, 'neu': 0.515, 'pos': 0.0, 'compound': -0.5719}",Negative
89,https://news.google.com/rss/articles/CBMiS2h0dHBzOi8vd3d3LnVrdGVjaC5uZXdzL3BhcnRuZXJzaGlwL2pvYnMtaGlyaW5nLWFpLXJlYWR5LXVrLWNpdGllcy0yMDIzMDgwNNIBAA?oc=5,Three jobs hiring in AI-ready UK cities - UKTN (UK Technology News,2023-08-04,three job hiring ai,"{'neg': 0.0, 'neu': 1.0, 'pos': 0.0, 'compound': 0.0}",Neutral
90,https://news.google.com/rss/articles/CBMiYWh0dHBzOi8vd3d3Lndhc2hpbmd0b25wb3N0LmNvbS9oZWFsdGgvMjAyMy8wOC8wMi9hcnRpZmljaWFsLWludGVsbGlnZW5jZS1icmVhc3QtY2FuY2VyLXNjcmVlbmluZy_SAQA?oc=5,"AI can detect breast cancer as well as radiologists, study finds - The Washington Post",2023-08-02,"ai detect breast cancer well radiologist , study find","{'neg': 0.352, 'neu': 0.48, 'pos': 0.168, 'compound': -0.5106}",Negative
91,https://news.google.com/rss/articles/CBMie2h0dHBzOi8vd3d3LnNtaC5jb20uYXUvcG9saXRpY3MvZmVkZXJhbC9sYWJvci11bmlvbnMtbW92ZS10by1wcm90ZWN0LXdvcmtlcnMtd2hvLWNvdWxkLWxvc2Utam9icy10by1haS0yMDIzMDgwNC1wNWR1MXMuaHRtbNIBe2h0dHBzOi8vYW1wLnNtaC5jb20uYXUvcG9saXRpY3MvZmVkZXJhbC9sYWJvci11bmlvbnMtbW92ZS10by1wcm90ZWN0LXdvcmtlcnMtd2hvLWNvdWxkLWxvc2Utam9icy10by1haS0yMDIzMDgwNC1wNWR1MXMuaHRtbA?oc=5,"Labor, unions move to protect workers who could lose jobs to AI - Sydney Morning Herald",2023-08-06,"labor , union move protect worker could lose job ai","{'neg': 0.22, 'neu': 0.569, 'pos': 0.211, 'compound': -0.0258}",Negative
92,https://news.google.com/rss/articles/CBMiYWh0dHBzOi8vd3d3LmFiYy5uZXQuYXUvbmV3cy8yMDIzLTA4LTAzL2J1c2luZXNzZXMtbmVlZC10by1lbWJyYWNlLWFpLW9yLWdldC1sZWZ0LWJlaGluZC8xMDI2NzgzNDjSAShodHRwczovL2FtcC5hYmMubmV0LmF1L2FydGljbGUvMTAyNjc4MzQ4?oc=5,"Businesses need to embrace AI 'revolution' or get left behind, Perth conference hears - ABC News",2023-08-02,"business need embrace ai 'revolution ' get left behind , perth conference hears","{'neg': 0.0, 'neu': 0.813, 'pos': 0.187, 'compound': 0.3182}",Positive
93,https://news.google.com/rss/articles/CBMiamh0dHBzOi8vd3d3LnN0cmFpdHN0aW1lcy5jb20vYXNpYS9jaGF0Ym90cy1haS1uZXdzLXJlYWRlcnMtYXNpYS1lbWJyYWNlcy1hdXRvbWF0aW9uLWRlc3BpdGUtam9iLWxvc3MtZmVhcnPSAQA?oc=5,"Chatbots, AI news readers: Asia embraces automation despite job loss fears - The Straits Times",2023-08-03,"chatbots , ai news reader : asia embrace automation despite job loss fear","{'neg': 0.0, 'neu': 0.537, 'pos': 0.463, 'compound': 0.7087}",Positive
94,https://news.google.com/rss/articles/CBMib2h0dHBzOi8vd3d3LmJpempvdXJuYWxzLmNvbS9iaXpqb3VybmFscy9uZXdzLzIwMjMvMDgvMDMvZW1lcmdpbmctdGVjaG5vbG9naWVzLWVtcGxveWVlcy1lbXBsb3llcnMtZGlzYWdyZWUuaHRtbNIBAA?oc=5,Employees see emerging technologies as valuable. They’re not sure if employers agree. - The Business Journals,2023-08-03,employee see emerging technology valuable . ’ sure employer agree .,"{'neg': 0.0, 'neu': 0.388, 'pos': 0.612, 'compound': 0.7845}",Positive
95,https://news.google.com/rss/articles/CBMiYWh0dHBzOi8vd3d3LnRoZXN1bi5jby51ay90ZWNoLzIzMzU5NDg0L3Rlbi1qb2JzLW1vc3QtYXQtcmlzay1haS10YWtlb3Zlci1hcnRpZmljaWFsLWludGVsbGlnZW5jZS_SAWVodHRwczovL3d3dy50aGVzdW4uY28udWsvdGVjaC8yMzM1OTQ4NC90ZW4tam9icy1tb3N0LWF0LXJpc2stYWktdGFrZW92ZXItYXJ0aWZpY2lhbC1pbnRlbGxpZ2VuY2UvYW1wLw?oc=5,Ten jobs most likely to be taken by AI revealed by experts as well as the few that are less at risk... - The Sun,2023-08-04,ten job likely taken ai revealed expert well le risk ...,"{'neg': 0.159, 'neu': 0.682, 'pos': 0.159, 'compound': 0.0}",Neutral
96,https://news.google.com/rss/articles/CBMi5gFodHRwczovL2Nic2F1c3Rpbi5jb20vbmV3cy9uYXRpb24td29ybGQvZmFjdC1jaGVjay10ZWFtLXdoaWNoLWluZHVzdHJpZXMtYXJlLWJlaW5nLXRocmVhdGVuZWQtYnktdGhlLXJpc2Utb2YtYXJ0aWZpY2lhbC1pbnRlbGxpZ2VuY2UtY2hpbGRjYXJlLWZpcmVmaWdodGVycy1leHBvc3VyZS1idXNpbmVzcy1hbmFseXN0LXdlYi1kZXZlbG9wbWVudC1kYXRhLWVudHJ5LWN1c3RvbWVyLWZvb2Qtc2VydmljZdIB6gFodHRwczovL2Nic2F1c3Rpbi5jb20vYW1wL25ld3MvbmF0aW9uLXdvcmxkL2ZhY3QtY2hlY2stdGVhbS13aGljaC1pbmR1c3RyaWVzLWFyZS1iZWluZy10aHJlYXRlbmVkLWJ5LXRoZS1yaXNlLW9mLWFydGlmaWNpYWwtaW50ZWxsaWdlbmNlLWNoaWxkY2FyZS1maXJlZmlnaHRlcnMtZXhwb3N1cmUtYnVzaW5lc3MtYW5hbHlzdC13ZWItZGV2ZWxvcG1lbnQtZGF0YS1lbnRyeS1jdXN0b21lci1mb29kLXNlcnZpY2U?oc=5,Fact Check Team: Which industries are being threatened by the rise of AI? - KEYE TV CBS Austin,2023-08-03,fact check team : industry threatened rise ai ?,"{'neg': 0.333, 'neu': 0.667, 'pos': 0.0, 'compound': -0.4588}",Negative
97,https://news.google.com/rss/articles/CBMif2h0dHBzOi8vd3d3LmxhdGltZXMuY29tL2VudGVydGFpbm1lbnQtYXJ0cy9idXNpbmVzcy9zdG9yeS8yMDIzLTA4LTAyL2FjdG9ycy1zdHJpa2Utd3JpdGVycy1zdHJpa2UtYWktaGlyZXMtYXV0b21hdGlvbi1ob2xseXdvb2TSAQA?oc=5,Studios look for AI hires amid strikes by actors and writers - Los Angeles Times,2023-08-02,studio look ai hire amid strike actor writer,"{'neg': 0.176, 'neu': 0.824, 'pos': 0.0, 'compound': -0.128}",Negative
98,https://news.google.com/rss/articles/CBMiT2h0dHBzOi8vd3d3LmluZGlld2lyZS5jb20vbmV3cy9idXNpbmVzcy9kaXNuZXktYWktdGFzay1mb3JjZS1yZXBvcnQtMTIzNDg5MzMxNi_SAQA?oc=5,Disney Now Has an Entire A.I. Task Force — Report - IndieWire,2023-08-08,disney entire a.i . task force — report,"{'neg': 0.0, 'neu': 1.0, 'pos': 0.0, 'compound': 0.0}",Neutral
99,https://news.google.com/rss/articles/CBMiX2h0dHBzOi8vd3d3LmluZGVwZW5kZW50LmNvLnVrL25ld3MvaGVhbHRoL25ocy14cmF5cy1jdC1zY2Fucy1zdXJyZXktc3RldmUtYmFyY2xheS1iMjM4NzM4Mi5odG1s0gEA?oc=5,AI could solve NHS radiologist ‘workforce crisis’ - The Independent,2023-08-04,ai could solve nh radiologist ‘ workforce crisis ’,"{'neg': 0.313, 'neu': 0.305, 'pos': 0.382, 'compound': -0.0258}",Positive
