,URL link,Title,Date,Preprocessed Title,Value,Sentiment
0,https://news.google.com/rss/articles/CBMiowFodHRwczovL3d3dy5pbmRpYXRvZGF5LmluL3RlY2hub2xvZ3kvbmV3cy9zdG9yeS9haS13aWxsLXJlcGxhY2UtbWlsbGlvbnMtb2YtaHVtYW4tam9icy1ieS0yMDIzLWJ1dC10aGVzZS00LWpvYnMtdG8tYmUtYXQtbW9zdC1yaXNrLXJldmVhbHMtc3R1ZHktMjQxNDU5My0yMDIzLTA4LTAx0gGnAWh0dHBzOi8vd3d3LmluZGlhdG9kYXkuaW4vYW1wL3RlY2hub2xvZ3kvbmV3cy9zdG9yeS9haS13aWxsLXJlcGxhY2UtbWlsbGlvbnMtb2YtaHVtYW4tam9icy1ieS0yMDIzLWJ1dC10aGVzZS00LWpvYnMtdG8tYmUtYXQtbW9zdC1yaXNrLXJldmVhbHMtc3R1ZHktMjQxNDU5My0yMDIzLTA4LTAx?oc=5,"AI will replace millions of human jobs by 2030 but these 4 jobs to be at most risk, reveals study - India Today",2023-08-01,"ai replace million human job 2030 4 job risk , reveals study","{'neg': 0.189, 'neu': 0.811, 'pos': 0.0, 'compound': -0.2732}",Negative
1,https://news.google.com/rss/articles/CBMihgFodHRwczovL2hybWUuZWNvbm9taWN0aW1lcy5pbmRpYXRpbWVzLmNvbS9uZXdzL2luZHVzdHJ5L21vc3QtaW4tZGVtYW5kLWpvYnMtaW4tdGhlLXVhZS1pbi10aGUtZXJhLW9mLWFydGlmaWNpYWwtaW50ZWxsaWdlbmNlLzEwMjQxMzQ4ONIBAA?oc=5,"Most in-demand jobs in the UAE in the era of Artificial Intelligence, ETHRWorldME - ETHRWorld Middle East",2023-08-04,,"{'neg': 0.0, 'neu': 0.0, 'pos': 0.0, 'compound': 0.0}",Neutral
2,https://news.google.com/rss/articles/CBMikwFodHRwczovL3d3dy5wZW9wbGVtYXR0ZXJzLmluL2FydGljbGUvdGVjaG5vbG9neS9pbmRpYXMtZXZvbHZpbmctbGFuZHNjYXBlLWRlbWFuZHMtYWktc2tpbGxlZC13b3JrZm9yY2UtZHItc2hhc2hpLXRoYXJvb3ItYXQtdGVjaGhyLWluZGlhLTIwMjMtMzg2NDHSAY8BaHR0cHM6Ly93d3cucGVvcGxlbWF0dGVycy5pbi9hbXAtdGVjaG5vbG9neS1pbmRpYXMtZXZvbHZpbmctbGFuZHNjYXBlLWRlbWFuZHMtYWktc2tpbGxlZC13b3JrZm9yY2UtZHItc2hhc2hpLXRoYXJvb3ItYXQtdGVjaGhyLWluZGlhLTIwMjMtMzg2NDE?oc=5,India's evolving economic landscape demands AI-skilled workforce: Dr Shashi Tharoor - People Matters,2023-08-07,india 's evolving economic landscape demand ai,"{'neg': 0.2, 'neu': 0.8, 'pos': 0.0, 'compound': -0.128}",Negative
3,https://news.google.com/rss/articles/CBMibmh0dHBzOi8vd3d3Lnd0d2NvLmNvbS9lbi1pbi9pbnNpZ2h0cy8yMDIzLzA4L2hvdy1haS1pcy1jaGFuZ2luZy13aGF0LXdvcmstbG9va3MtbGlrZS1pbi10aGUtaW5zdXJhbmNlLWluZHVzdHJ50gEA?oc=5,How AI is changing what work looks like in the insurance industry - WTW,2023-08-03,ai changing work look like insurance industry,"{'neg': 0.0, 'neu': 0.706, 'pos': 0.294, 'compound': 0.3612}",Positive
4,https://news.google.com/rss/articles/CBMiYGh0dHBzOi8vaGJyLm9yZy8yMDIzLzA4L2FpLXdvbnQtcmVwbGFjZS1odW1hbnMtYnV0LWh1bWFucy13aXRoLWFpLXdpbGwtcmVwbGFjZS1odW1hbnMtd2l0aG91dC1hadIBAA?oc=5,AI Won't Replace Humans — But Humans With AI Will Replace Humans Without AI - HBR.org Daily,2023-08-04,ai wo n't replace human — human ai replace human without ai,"{'neg': 0.0, 'neu': 1.0, 'pos': 0.0, 'compound': 0.0}",Neutral
5,https://news.google.com/rss/articles/CBMiT2h0dHBzOi8vd3d3LmdhcnRuZXIuY29tL2VuL2h1bWFuLXJlc291cmNlcy90b3BpY3MvYXJ0aWZpY2lhbC1pbnRlbGxpZ2VuY2UtaW4taHLSAQA?oc=5,AI in HR: How AI Is Transforming the Future of HR - Gartner,2023-08-02,ai hr : ai transforming future hr,"{'neg': 0.0, 'neu': 1.0, 'pos': 0.0, 'compound': 0.0}",Neutral
6,https://news.google.com/rss/articles/CBMidGh0dHBzOi8vd3d3Lm1ja2luc2V5LmNvbS9jYXBhYmlsaXRpZXMvcXVhbnR1bWJsYWNrL291ci1pbnNpZ2h0cy90aGUtc3RhdGUtb2YtYWktaW4tMjAyMy1nZW5lcmF0aXZlLWFpcy1icmVha291dC15ZWFy0gEA?oc=5,The state of AI in 2023: Generative AI’s breakout year - McKinsey,2023-08-01,state ai 2023 : generative ai ’ breakout year,"{'neg': 0.0, 'neu': 1.0, 'pos': 0.0, 'compound': 0.0}",Neutral
7,https://news.google.com/rss/articles/CBMiW2h0dHBzOi8vaW5mb3JtLnRtZm9ydW0ub3JnL2ZlYXR1cmVzLWFuZC1vcGluaW9uL2F1dG9tYXRpb24tYW5kLWFpLWJlZ2luLXRvLWltcGN0LXRlbGNvLWpvYnPSAQA?oc=5,Automation and AI begin to impact telco jobs - TM Forum Inform,2023-08-03,automation ai begin impact telco job,"{'neg': 0.0, 'neu': 1.0, 'pos': 0.0, 'compound': 0.0}",Neutral
8,https://news.google.com/rss/articles/CBMinwFodHRwczovL20uZWNvbm9taWN0aW1lcy5jb20vbmV3cy9pbmRpYS90aGUtY2hhdGdwdC1lZmZlY3Qta29sa2F0YS1naXJscy10YWxlLW9mLTkwLWluY29tZS1kcm9wLWFtaWQtYWktam9iLXRha2VvdmVyL2FpLXRha2luZy1vdmVyLWpvYnMvc2xpZGVzaG93LzEwMjQ5NjMzOS5jbXPSAQA?oc=5,AI jobs: The ChatGPT Effect: Kolkata girl's tale of 90% income drop amid AI job takeover - AI taking over jobs - IndiaTimes,2023-08-07,ai job : chatgpt effect : kolkata girl 's tale 90 % income drop amid ai job takeover,"{'neg': 0.13, 'neu': 0.87, 'pos': 0.0, 'compound': -0.2732}",Negative
9,https://news.google.com/rss/articles/CBMibWh0dHBzOi8vd3d3LmZpbmFuY2lhbGV4cHJlc3MuY29tL2J1c2luZXNzL2Jsb2NrY2hhaW4taG93LWFydGlmaWNpYWwtaW50ZWxsaWdlbmNlLWlzLWNoYW5naW5nLWVjb25vbXktMzIwMTM5OC_SAXJodHRwczovL3d3dy5maW5hbmNpYWxleHByZXNzLmNvbS9idXNpbmVzcy9ibG9ja2NoYWluLWhvdy1hcnRpZmljaWFsLWludGVsbGlnZW5jZS1pcy1jaGFuZ2luZy1lY29ub215LTMyMDEzOTgvbGl0ZS8?oc=5,How Artificial Intelligence is changing economy - The Financial Express,2023-08-06,artificial intelligence changing economy,"{'neg': 0.0, 'neu': 0.492, 'pos': 0.508, 'compound': 0.4767}",Positive
10,https://news.google.com/rss/articles/CBMiUWh0dHBzOi8vd3d3LnVzYXRvZGF5LmNvbS9zdG9yeS9tb25leS8yMDIzLzA4LzA0L2pvYnMtbW9zdC1leHBvc2VkLWFpLzcwNTIzMDU3MDA3L9IBAA?oc=5,A fifth of US workers have jobs with 'high exposure' to AI - USA TODAY,2023-08-04,fifth u worker job 'high exposure ' ai,"{'neg': 0.0, 'neu': 1.0, 'pos': 0.0, 'compound': 0.0}",Neutral
11,https://news.google.com/rss/articles/CBMinAFodHRwczovL3d3dy5mb3JiZXNpbmRpYS5jb20vYXJ0aWNsZS9tZW50b3JzLWFuZC1tYXZlbnMvYWktcm9ib3RzLXdpbGwtbmV2ZXItcmVwbGFjZS1odW1hbnMtYnV0LWNhbi1tYWtlLXVzLW1vcmUtcHJvZHVjdGl2ZS1hbmQtZWZmaWNpZW50LXRob21hcy1mcmV5Lzg3MjExLzHSAaABaHR0cHM6Ly93d3cuZm9yYmVzaW5kaWEuY29tL2FtcC9hcnRpY2xlL21lbnRvcnMtYW5kLW1hdmVucy9haS1yb2JvdHMtd2lsbC1uZXZlci1yZXBsYWNlLWh1bWFucy1idXQtY2FuLW1ha2UtdXMtbW9yZS1wcm9kdWN0aXZlLWFuZC1lZmZpY2llbnQtdGhvbWFzLWZyZXkvODcyMTEvMQ?oc=5,"AI, robots will never replace humans but can make us more productive and efficient: Thomas Frey - Forbes India",2023-08-02,"ai , robot never replace human make u productive efficient : thomas frey","{'neg': 0.0, 'neu': 0.763, 'pos': 0.237, 'compound': 0.4215}",Positive
12,https://news.google.com/rss/articles/CBMidGh0dHBzOi8vd3d3LmZpbnRlY2hmdXR1cmVzLmNvbS8yMDIzLzA4L3RoZS10cmFuc2Zvcm1hdGl2ZS1pbXBhY3Qtb2YtYWktYW5kLWl0cy1pbXBsaWNhdGlvbnMtb24tdGhlLWZ1dHVyZS13b3JrZm9yY2Uv0gEA?oc=5,The transformative impact of AI and its implications on the future workforce - FinTech Futures,2023-08-04,transformative impact ai implication future workforce,"{'neg': 0.0, 'neu': 1.0, 'pos': 0.0, 'compound': 0.0}",Neutral
13,https://news.google.com/rss/articles/CBMitwFodHRwczovL25ld3MubWljcm9zb2Z0LmNvbS9lbi14bS8yMDIzLzA4LzAyL21pY3Jvc29mdHMtMjAyMy13b3JrLXRyZW5kLWluZGV4LXJlcG9ydC1yZXZlYWxzLWltcGFjdC1vZi1kaWdpdGFsLWRlYnQtb24taW5ub3ZhdGlvbi1lbXBoYXNpemVzLW5lZWQtZm9yLWFpLXByb2ZpY2llbmN5LWZvci1ldmVyeS1lbXBsb3llZS_SAQA?oc=5,"Microsoft's 2023 Work Trend Index Report reveals impact of digital debt on innovation, emphasizes need for AI ... - Microsoft",2023-08-02,"microsoft 's 2023 work trend index report reveals impact digital debt innovation , emphasizes need ai ...","{'neg': 0.131, 'neu': 0.733, 'pos': 0.136, 'compound': 0.0258}",Positive
14,https://news.google.com/rss/articles/CBMiZ2h0dHBzOi8vd3d3LnNlYXJjaGVuZ2luZWpvdXJuYWwuY29tL3RoZS1pbXBhY3Qtb2YtYWktb24tam9icy1hbi1pbnRlcnZpZXctd2l0aC1kci1jcmFpZy1mcm9laGxlLzQ5Mjk4MC_SAQA?oc=5,The Impact of AI On Jobs: An Interview With Dr. Craig Froehle - Search Engine Journal,2023-08-01,impact ai job : interview dr. craig froehle,"{'neg': 0.0, 'neu': 1.0, 'pos': 0.0, 'compound': 0.0}",Neutral
15,https://news.google.com/rss/articles/CBMihgFodHRwczovL3d3dy5pbmRpYXRvZGF5LmluL3RlY2hub2xvZ3kvbmV3cy9zdG9yeS9haS13aWxsLXJlcGxhY2UtbW9yZS13b21lbi1lbXBsb3llZXMtdGhhbi1tZW4tYnktMjAzMC1yZXZlYWxzLXN0dWR5LTI0MTU5MTctMjAyMy0wOC0wM9IBigFodHRwczovL3d3dy5pbmRpYXRvZGF5LmluL2FtcC90ZWNobm9sb2d5L25ld3Mvc3RvcnkvYWktd2lsbC1yZXBsYWNlLW1vcmUtd29tZW4tZW1wbG95ZWVzLXRoYW4tbWVuLWJ5LTIwMzAtcmV2ZWFscy1zdHVkeS0yNDE1OTE3LTIwMjMtMDgtMDM?oc=5,"AI will replace more women employees than men by 2030, reveals study - India Today",2023-08-03,"ai replace woman employee men 2030 , reveals study","{'neg': 0.0, 'neu': 1.0, 'pos': 0.0, 'compound': 0.0}",Neutral
16,https://news.google.com/rss/articles/CBMib2h0dHBzOi8vd3d3LmluZGlhdGltZXMuY29tL3dvcnRoL25ld3MvMTItbWlsbGlvbi11cy1lbXBsb3llZXMtbWF5LW5lZWQtam9iLXN3aXRjaC1ieS0yMDMwLWR1ZS10by1haS02MTE0NzQuaHRtbNIBc2h0dHBzOi8vd3d3LmluZGlhdGltZXMuY29tL2FtcC93b3J0aC9uZXdzLzEyLW1pbGxpb24tdXMtZW1wbG95ZWVzLW1heS1uZWVkLWpvYi1zd2l0Y2gtYnktMjAzMC1kdWUtdG8tYWktNjExNDc0Lmh0bWw?oc=5,"1.2 Crore People In US May Need To Change Their Jobs Due To AI By 2030, Reveals McKinsey Study - Indiatimes.com",2023-08-08,"1.2 crore people u may need change job due ai 2030 , reveals mckinsey study","{'neg': 0.0, 'neu': 1.0, 'pos': 0.0, 'compound': 0.0}",Neutral
17,https://news.google.com/rss/articles/CBMiY2h0dHBzOi8vd3d3LmZpbnRlY2hmdXR1cmVzLmNvbS8yMDIzLzA4L2ZpbnRlY2gtZnV0dXJlcy1qb2JzLXRocmVlLXdheXMtYWktaXMtY2hhbmdpbmctZmludGVjaC1qb2JzL9IBAA?oc=5,FinTech Futures Jobs: Three ways AI is changing fintech jobs - FinTech Futures,2023-08-04,fintech future job : three way ai changing fintech job,"{'neg': 0.0, 'neu': 1.0, 'pos': 0.0, 'compound': 0.0}",Neutral
18,https://news.google.com/rss/articles/CBMikQFodHRwczovL3d3dy5pbmRpYXRvZGF5LmluL2VkdWNhdGlvbi10b2RheS9uZXdzL3N0b3J5L3RlY2gtbWFoaW5kcmEtdHJhaW5zLTgwMDAtZW1wbG95ZWVzLXdpdGgtYWktc2tpbGxzLXRvLW1lZXQtZnV0dXJlLWRlbWFuZHMtMjQxNzA2Ny0yMDIzLTA4LTA20gGVAWh0dHBzOi8vd3d3LmluZGlhdG9kYXkuaW4vYW1wL2VkdWNhdGlvbi10b2RheS9uZXdzL3N0b3J5L3RlY2gtbWFoaW5kcmEtdHJhaW5zLTgwMDAtZW1wbG95ZWVzLXdpdGgtYWktc2tpbGxzLXRvLW1lZXQtZnV0dXJlLWRlbWFuZHMtMjQxNzA2Ny0yMDIzLTA4LTA2?oc=5,"Tech Mahindra trains 8,000 employees with AI skills to meet future demands - India Today",2023-08-06,"tech mahindra train 8,000 employee ai skill meet future demand","{'neg': 0.143, 'neu': 0.857, 'pos': 0.0, 'compound': -0.128}",Negative
19,https://news.google.com/rss/articles/CBMiYmh0dHBzOi8vd3d3LnRlY2h0YXJnZXQuY29tL3NlYXJjaGhyc29mdHdhcmUvZmVhdHVyZS9BZHZhbnRhZ2VzLWFuZC1kaXNhZHZhbnRhZ2VzLW9mLXVzaW5nLUFJLWluLUhS0gEA?oc=5,5 advantages and disadvantages of using AI in HR - TechTarget,2023-08-07,5 advantage disadvantage using ai hr,"{'neg': 0.359, 'neu': 0.385, 'pos': 0.256, 'compound': -0.2023}",Negative
20,https://news.google.com/rss/articles/CBMimgFodHRwczovL3RpbWVzb2ZpbmRpYS5pbmRpYXRpbWVzLmNvbS9nYWRnZXRzLW5ld3MvaG9sbHl3b29kLXZzLWFpLWRpc25leS1sb29rcy10by1jdXQtbW9yZS1jb3N0cy1ieS11c2luZy1hcnRpZmljaWFsLWludGVsbGlnZW5jZS9hcnRpY2xlc2hvdy8xMDI1NDI5OTQuY21z0gGeAWh0dHBzOi8vdGltZXNvZmluZGlhLmluZGlhdGltZXMuY29tL2dhZGdldHMtbmV3cy9ob2xseXdvb2QtdnMtYWktZGlzbmV5LWxvb2tzLXRvLWN1dC1tb3JlLWNvc3RzLWJ5LXVzaW5nLWFydGlmaWNpYWwtaW50ZWxsaWdlbmNlL2FtcF9hcnRpY2xlc2hvdy8xMDI1NDI5OTQuY21z?oc=5,Hollywood vs AI: Disney looks to cut more costs by using artificial intelligence - The Times of India,2023-08-08,hollywood v ai : disney look cut cost using artificial intelligence,"{'neg': 0.172, 'neu': 0.574, 'pos': 0.254, 'compound': 0.25}",Positive
21,https://news.google.com/rss/articles/CBMid2h0dHBzOi8vbmV3cy5yaWNlLmVkdS9uZXdzLzIwMjMvcmljZS11LWV4cGVydHMtYXZhaWxhYmxlLWRpc2N1c3MtbmV3LXJlcG9ydC1qb2ItbG9zcy1wcmVkaWN0aW9ucy1tYWpvci1jaXRpZXMtYXJvdW5kLXVz0gEA?oc=5,Rice U. experts available to discuss new report on job loss predictions in major cities around US due to AI - Rice News,2023-08-02,rice u. expert available discus new report job loss prediction major city around u due ai,"{'neg': 0.141, 'neu': 0.859, 'pos': 0.0, 'compound': -0.3182}",Negative
22,https://news.google.com/rss/articles/CBMiUmh0dHBzOi8vd3d3Lm1vYmlsZXdvcmxkbGl2ZS5jb20vaG9tZS1iYW5uZXIvdm9kYWZvbmUtcnVsZXMtb3V0LWFpLWRyaXZlbi1qb2ItY3V0cy_SAQA?oc=5,Vodafone rules out AI-driven job cuts - Mobile World Live,2023-08-04,vodafone rule ai,"{'neg': 0.0, 'neu': 1.0, 'pos': 0.0, 'compound': 0.0}",Neutral
23,https://news.google.com/rss/articles/CBMiYWh0dHBzOi8vd3d3LmRxaW5kaWEuY29tL3NldmVyYWwtam9icy1hdC10aGUtcmlzay1vZi1nb2luZy1leHRpbmN0LWR1ZS10by1hcnRpZmljaWFsLWludGVsbGlnZW5jZS_SAWFodHRwczovL3d3dy5kcWluZGlhLmNvbS9zZXZlcmFsLWpvYnMtYXQtdGhlLXJpc2stb2YtZ29pbmctZXh0aW5jdC1kdWUtdG8tYXJ0aWZpY2lhbC1pbnRlbGxpZ2VuY2Uv?oc=5,Several Jobs at the Risk of Going Extinct Due to Artificial Intelligence - DATAQUEST,2023-08-02,several job risk going extinct due artificial intelligence,"{'neg': 0.188, 'neu': 0.536, 'pos': 0.277, 'compound': 0.25}",Positive
24,https://news.google.com/rss/articles/CBMiZGh0dHBzOi8vd3d3LnNocm0ub3JnL3RvcGljcy10b29scy9uZXdzL3RlY2hub2xvZ3kvZ2VuZXJhdGl2ZS1haS13aWxsLWRpc3J1cHQtY2FyZWVyLXBhdGhzLXJlY3J1aXRpbmfSAQA?oc=5,"Generative AI Will Disrupt Career Paths, Recruiting - SHRM",2023-08-07,"generative ai disrupt career path , recruiting","{'neg': 0.0, 'neu': 1.0, 'pos': 0.0, 'compound': 0.0}",Neutral
25,https://news.google.com/rss/articles/CBMibmh0dHBzOi8vd3d3LmluZGlhLmNvbS90ZWNobm9sb2d5L2dvb2dsZS1nZW5lc2lzLWFpLXRvb2wtbmV3cy1hcnRpY2xlcy1hcmUtam9icy1vZi1qb3VybmFsaXN0cy1hdC1yaXNrLTYxOTk0MTcv0gFyaHR0cHM6Ly93d3cuaW5kaWEuY29tL3RlY2hub2xvZ3kvZ29vZ2xlLWdlbmVzaXMtYWktdG9vbC1uZXdzLWFydGljbGVzLWFyZS1qb2JzLW9mLWpvdXJuYWxpc3RzLWF0LXJpc2stNjE5OTQxNy9hbXAv?oc=5,Google's Genesis AI Tool Could Write The News: Jobs Of Journalists At Risk? - India.com,2023-08-01,google 's genesis ai tool could write news : job journalist risk ?,"{'neg': 0.174, 'neu': 0.826, 'pos': 0.0, 'compound': -0.2732}",Negative
26,https://news.google.com/rss/articles/CBMiigFodHRwczovL21vZGVybmRpcGxvbWFjeS5ldS8yMDIzLzA4LzAxL2Zyb20tY2hhbGxlbmdlLXRvLW9wcG9ydHVuaXR5LWpvYi1jcmVhdGlvbi1pbi10aGUtZXJhLW9mLWFpLWFuZC1hdXRvbWF0aW9uLWZvci1kZXZlbG9waW5nLWNvdW50cmllcy_SAQA?oc=5,From Challenge to Opportunity: Job Creation in the Era of AI and Automation for Developing Countries - Modern Diplomacy,2023-08-01,challenge opportunity : job creation era ai automation developing country,"{'neg': 0.0, 'neu': 0.492, 'pos': 0.508, 'compound': 0.6369}",Positive
27,https://news.google.com/rss/articles/CBMiNGh0dHBzOi8vd3d3Lm5leHRwaXQuY29tL2hvdy1haS1pcy1jaGFuZ2luZy10ZWNoLWpvYnPSAQA?oc=5,How AI is changing tech jobs - NextPit International,2023-08-04,ai changing tech job,"{'neg': 0.0, 'neu': 1.0, 'pos': 0.0, 'compound': 0.0}",Neutral
28,https://news.google.com/rss/articles/CBMiaWh0dHBzOi8vbS5lY29ub21pY3RpbWVzLmNvbS9qb2JzL21pZC1jYXJlZXIvdGhlc2UtaXQtam9icy1hcmUtc2FmZS1mcm9tLWxheW9mZnMvYXJ0aWNsZXNob3cvMTAyNDY2NTQ2LmNtc9IBbWh0dHBzOi8vbS5lY29ub21pY3RpbWVzLmNvbS9qb2JzL21pZC1jYXJlZXIvdGhlc2UtaXQtam9icy1hcmUtc2FmZS1mcm9tLWxheW9mZnMvYW1wX2FydGljbGVzaG93LzEwMjQ2NjU0Ni5jbXM?oc=5,These IT jobs are safe from layoffs - IndiaTimes,2023-08-06,job safe layoff,"{'neg': 0.0, 'neu': 0.408, 'pos': 0.592, 'compound': 0.4404}",Positive
29,https://news.google.com/rss/articles/CBMiOmh0dHBzOi8vdGVjaGNydW5jaC5jb20vMjAyMy8wOC8wNi90aG9tc29uLXJldXRlcnMtYWktam9icy_SAQA?oc=5,"How Thomson Reuters is leveraging AI to enhance productivity, rather than replace jobs - TechCrunch",2023-08-06,"thomson reuters leveraging ai enhance productivity , rather replace job","{'neg': 0.0, 'neu': 1.0, 'pos': 0.0, 'compound': 0.0}",Neutral
30,https://news.google.com/rss/articles/CBMiVmh0dHBzOi8vd3d3Lm1wcm5ld3Mub3JnL2VwaXNvZGUvMjAyMy8wOC8wMi93aWxsLWFydGlmaWNpYWwtaW50ZWxsaWdlbmNlLXN0ZWFsLW91ci1qb2Jz0gEA?oc=5,Will artificial intelligence steal our jobs? - MPR News,2023-08-02,artificial intelligence steal job ?,"{'neg': 0.386, 'neu': 0.241, 'pos': 0.373, 'compound': -0.0258}",Negative
31,https://news.google.com/rss/articles/CBMiYWh0dHBzOi8vZWNvbm9teW1pZGRsZWVhc3QuY29tL25ld3MvdGhlLWZ1dHVyZS1vZi1qb2JzLWhvdy1haS13aWxsLWNoYW5nZS10aGUtd29ya21hcmtldC1pbi1xYXRhci_SAQA?oc=5,The Future of jobs: How AI will change the work market in Qatar - Economy Middle East,2023-08-01,future job : ai change work market qatar,"{'neg': 0.0, 'neu': 1.0, 'pos': 0.0, 'compound': 0.0}",Neutral
32,https://news.google.com/rss/articles/CBMiS2h0dHBzOi8vd3d3Lmhya2F0aGEuY29tL2hpcmluZy1maXJpbmcvYWN0eXYtYWktbGV0cy1nby01MC1vZi1pdHMtd29ya2ZvcmNlL9IBAA?oc=5,Actyv.ai lets go 50% of its workforce - HRKatha,2023-08-04,actyv.ai let go 50 % workforce,"{'neg': 0.0, 'neu': 1.0, 'pos': 0.0, 'compound': 0.0}",Neutral
33,https://news.google.com/rss/articles/CBMiRWh0dHBzOi8vZm9ydHVuZS5jb20vMjAyMy8wOC8wMS93aW5uZXJzLWxvc2Vycy1haS1qb2ItbWFya2V0LW1ja2luc2V5L9IBAA?oc=5,"The winners and losers of the new A.I. job market, as predicted by McKinsey - Fortune",2023-08-01,"winner loser new a.i . job market , predicted mckinsey","{'neg': 0.258, 'neu': 0.455, 'pos': 0.288, 'compound': 0.1027}",Positive
34,https://news.google.com/rss/articles/CBMic2h0dHBzOi8vd3d3LmFuYWx5dGljc2luc2lnaHQubmV0L2FydGlmaWNpYWwtaW50ZWxsaWdlbmNlL2FpLXRocmVhdC1sb29tcy1vdmVyLXdoaXRlLWNvbGxhci1qb2JzLXBldy1yZXNlYXJjaC1jZW50cmXSAX1odHRwczovL3d3dy5hbmFseXRpY3NpbnNpZ2h0Lm5ldC9hbXAvc3RvcnkvYXJ0aWZpY2lhbC1pbnRlbGxpZ2VuY2UvYWktdGhyZWF0LWxvb21zLW92ZXItd2hpdGUtY29sbGFyLWpvYnMtcGV3LXJlc2VhcmNoLWNlbnRyZQ?oc=5,AI Threat Looms Over White-Collar Jobs: Pew Research Centre - Analytics Insight,2023-08-02,ai threat loom white,"{'neg': 0.726, 'neu': 0.274, 'pos': 0.0, 'compound': -0.6486}",Negative
35,https://news.google.com/rss/articles/CBMiUWh0dHBzOi8vaHJleGVjdXRpdmUuY29tLzctYWktY29uc2lkZXJhdGlvbnMtaHItbGVhZGVycy1uZWVkLXRvLXRoaW5rLWFib3V0LXRvZGF5L9IBAA?oc=5,7 AI considerations HR leaders need to think about today - Human Resource Executive®,2023-08-02,7 ai consideration hr leader need think today,"{'neg': 0.0, 'neu': 1.0, 'pos': 0.0, 'compound': 0.0}",Neutral
36,https://news.google.com/rss/articles/CBMiPmh0dHBzOi8vd3d3LnRoZXJlZ2lzdGVyLmNvbS8yMDIzLzA4LzA3L3R2X2FuZF9maWxtX2V4dHJhc19hcmUv0gFCaHR0cHM6Ly93d3cudGhlcmVnaXN0ZXIuY29tL0FNUC8yMDIzLzA4LzA3L3R2X2FuZF9maWxtX2V4dHJhc19hcmUv?oc=5,TV and film extras fear generative AI will copy their faces and bodies to take their jobs - The Register,2023-08-07,tv film extra fear generative ai copy face body take job,"{'neg': 0.242, 'neu': 0.758, 'pos': 0.0, 'compound': -0.4939}",Negative
37,https://news.google.com/rss/articles/CBMiXGh0dHBzOi8vd3d3LmRtbmV3cy5jb20vdGhlLWZ1dHVyZS1vZi1tYXJrZXRpbmctam9icy1lbWJyYWNpbmctYWktYW5kLWdlbmVyYXRpdmUtYWktc3RyYXRlZ3kv0gEA?oc=5,The Future of Marketing Jobs: Embracing AI and Generative AI Strategy - DM News,2023-08-02,future marketing job : embracing ai generative ai strategy,"{'neg': 0.0, 'neu': 1.0, 'pos': 0.0, 'compound': 0.0}",Neutral
38,https://news.google.com/rss/articles/CBMiU2h0dHBzOi8vd3d3Lmp1c3QtZm9vZC5jb20vbmV3cy9zaWduYWwtcGVwc2ljby1nZW5lcmFsLW1pbGxzLWxlYWQtYWktaGlyaW5nLWluLWZvb2Qv0gEA?oc=5,"Signal: PepsiCo, General Mills lead AI hiring in food - just-food.com",2023-08-07,"signal : pepsico , general mill lead ai hiring food","{'neg': 0.0, 'neu': 1.0, 'pos': 0.0, 'compound': 0.0}",Neutral
39,https://news.google.com/rss/articles/CBMiggFodHRwczovL3d3dy5tYXJrdGVjaHBvc3QuY29tLzIwMjMvMDgvMDMvdGhlLWltcGFjdC1vZi1nZW5lcmF0aXZlLWFpLW9uLXRoZS1mdXR1cmUtb2Ytd29yay01LWtleS1pbnNpZ2h0cy1mcm9tLXRoZS1tY2tpbnNleS1yZXBvcnQv0gGGAWh0dHBzOi8vd3d3Lm1hcmt0ZWNocG9zdC5jb20vMjAyMy8wOC8wMy90aGUtaW1wYWN0LW9mLWdlbmVyYXRpdmUtYWktb24tdGhlLWZ1dHVyZS1vZi13b3JrLTUta2V5LWluc2lnaHRzLWZyb20tdGhlLW1ja2luc2V5LXJlcG9ydC8_YW1w?oc=5,The Impact of Generative AI on the Future of Work: 5 Key Insights from the McKinsey Report - MarkTechPost,2023-08-03,impact generative ai future work : 5 key insight mckinsey report,"{'neg': 0.0, 'neu': 1.0, 'pos': 0.0, 'compound': 0.0}",Neutral
40,https://news.google.com/rss/articles/CBMicGh0dHBzOi8vd3d3LmNtc3dpcmUuY29tL2N1c3RvbWVyLWV4cGVyaWVuY2UvZ2VuZXJhdGl2ZS1haS13aWxsLXJlZHVjZS0zMC1vZi1jdXN0b21lci1zZXJ2aWNlLWFuZC1zdXBwb3J0LWFnZW50cy_SAQA?oc=5,Generative AI Will Reduce 30% of Customer Service and Support Agents - CMSWire,2023-08-04,generative ai reduce 30 % customer service support agent,"{'neg': 0.0, 'neu': 0.722, 'pos': 0.278, 'compound': 0.4019}",Positive
41,https://news.google.com/rss/articles/CBMia2h0dHBzOi8vd3d3LmdvdnRlY2guY29tL2FydGlmaWNpYWwtaW50ZWxsaWdlbmNlL2FpLXdpbGwta2lsbC1tb3JlLXRoYW4tMzgway1qb2JzLWluLWhvdXN0b24tcmVzZWFyY2hlcnMtc2F50gEA?oc=5,"AI Will Kill More Than 380K Jobs in Houston, Researchers Say - Government Technology",2023-08-02,"ai kill 380k job houston , researcher say","{'neg': 0.439, 'neu': 0.561, 'pos': 0.0, 'compound': -0.6908}",Negative
42,https://news.google.com/rss/articles/CBMiMGh0dHBzOi8vZWNvbm9teW1pZGRsZWVhc3QuY29tL25ld3MvaW1wYWN0LW9mLWFpL9IBAA?oc=5,The impact of AI on the job market in the region - Economy Middle East,2023-08-04,impact ai job market region,"{'neg': 0.0, 'neu': 1.0, 'pos': 0.0, 'compound': 0.0}",Neutral
43,https://news.google.com/rss/articles/CBMiSmh0dHBzOi8vd3d3LnRlYWFuZGNvZmZlZS5uZXQvYmxvZy8zMjU2MS9zaG91bGQtd29ya2Vycy1mZWFyLXRoZS11c2Utb2YtYWkv0gEA?oc=5,Should workers fear the use of AI? - Tea & Coffee Trade Journal,2023-08-03,worker fear use ai ?,"{'neg': 0.516, 'neu': 0.484, 'pos': 0.0, 'compound': -0.4939}",Negative
44,https://news.google.com/rss/articles/CBMisQFodHRwczovL3d3dy53ZWIzY2FmZS5pbi9hcnRpZmljaWFsLWludGVsbGlnZW5jZS9jaGF0LWdwdC9zdG9yeS9ieS0yMDIzLW1pbGxpb25zLW9mLWh1bWFuLWpvYnMtd2lsbC1iZS1yZXBsYWNlZC1ieS1haS1idXQtdGhlc2Utam9icy1hcmUtbW9zdC1hdC1yaXNrLWNoZWNrLWhlcmUtNjI1NDExLTIwMjMtMDgtMDLSAbUBaHR0cHM6Ly93d3cud2ViM2NhZmUuaW4vYW1wL2FydGlmaWNpYWwtaW50ZWxsaWdlbmNlL2NoYXQtZ3B0L3N0b3J5L2J5LTIwMjMtbWlsbGlvbnMtb2YtaHVtYW4tam9icy13aWxsLWJlLXJlcGxhY2VkLWJ5LWFpLWJ1dC10aGVzZS1qb2JzLWFyZS1tb3N0LWF0LXJpc2stY2hlY2staGVyZS02MjU0MTEtMjAyMy0wOC0wMg?oc=5,Adopt these technologies else AI will take your job! Here’s are the jobs at risk the most - Web3Cafe,2023-08-02,adopt technology else ai take job ! ’ job risk,"{'neg': 0.237, 'neu': 0.595, 'pos': 0.168, 'compound': -0.1759}",Negative
45,https://news.google.com/rss/articles/CBMiYGh0dHBzOi8vd3d3LmZpZXJjZS1uZXR3b3JrLmNvbS9sZWFkZXJzaGlwL2hvdy11bml2ZXJzaXRpZXMtY2FuLWJldHRlci1wcmVwYXJlLXN0dWRlbnRzLWZ1dHVyZS1hadIBAA?oc=5,How Universities Can Better Prepare Students for a Future with AI - Fierce Network,2023-08-03,university better prepare student future ai,"{'neg': 0.0, 'neu': 0.633, 'pos': 0.367, 'compound': 0.4404}",Positive
46,https://news.google.com/rss/articles/CBMigQFodHRwczovL3d3dy5ibG9vbWJlcmcuY29tL25ld3MvYXJ0aWNsZXMvMjAyMy0wOC0wMi9maXJtcy1leHBvc2VkLXRvLWFpLWpvYi1zdHJlYW1saW5pbmctYXJlLWFscmVhZHktYmVhdGluZy10aGUtbWFya2V0LXN0dWR5LXNheXPSAQA?oc=5,AI Study Says Stocks Already Pricing a Job-Replacement Premium - Bloomberg,2023-08-02,ai study say stock already pricing job,"{'neg': 0.0, 'neu': 1.0, 'pos': 0.0, 'compound': 0.0}",Neutral
47,https://news.google.com/rss/articles/CBMiJmh0dHBzOi8vd3d3LnNpeHRodG9uZS5jb20vbmV3cy8xMDEzNDYy0gEA?oc=5,"AI Is Booming in China, But Its Grads Are Trapped in a Talent Gap - Sixth Tone",2023-08-05,"ai booming china , grad trapped talent gap","{'neg': 0.304, 'neu': 0.446, 'pos': 0.25, 'compound': -0.1531}",Negative
48,https://news.google.com/rss/articles/CBMiigFodHRwczovL3d3dy51c2F0b2RheS5jb20vc3RvcnkvZW50ZXJ0YWlubWVudC90di8yMDIzLzA4LzAxL2FpLWFuZC1ob2xseXdvb2Qtc3RyaWtlcy13aGF0LXRoZS1yZWFsLXRocmVhdC1pcy10by1hY3RvcnMtd3JpdGVycy83MDQzNjYxODAwNy_SAQA?oc=5,"SAG-AFTRA, writers strike's real threat? AI taking Hollywood's jobs. - USA TODAY",2023-08-01,sag,"{'neg': 0.0, 'neu': 1.0, 'pos': 0.0, 'compound': 0.0}",Neutral
49,https://news.google.com/rss/articles/CBMibGh0dHBzOi8vd3d3LnJldXRlcnMuY29tL3RlY2hub2xvZ3kvd2lsbC1haS1iZS1hbi1lY29ub21pYy1ibGVzc2luZy1vci1jdXJzZS1oaXN0b3J5LW9mZmVycy1jbHVlcy0yMDIzLTA4LTA3L9IBAA?oc=5,Will AI be an economic blessing or curse? History offers clues - Reuters,2023-08-07,ai economic blessing curse ? history offer clue,"{'neg': 0.299, 'neu': 0.427, 'pos': 0.274, 'compound': -0.0772}",Negative
50,https://news.google.com/rss/articles/CBMiRGh0dHBzOi8vd3d3LnRlY2hyZXB1YmxpYy5jb20vYXJ0aWNsZS9rcG1nLXN1cnZleS1nZW5lcmF0aXZlLWFpLTIwMjMv0gEA?oc=5,KPMG Survey: Momentum for Generative AI Continues to Build in Organizations - TechRepublic,2023-08-04,kpmg survey : momentum generative ai continues build organization,"{'neg': 0.0, 'neu': 1.0, 'pos': 0.0, 'compound': 0.0}",Neutral
51,https://news.google.com/rss/articles/CBMiVWh0dHBzOi8vd3d3LmZhc3Rjb21wYW55LmNvbS85MDkzMjk3MC81LXN1cnByaXNpbmctam9icy10aGF0LXdvbnQtZ2V0LWVsaW1pbmF0ZWQtYnktYWnSAQA?oc=5,5 surprising jobs that won’t get eliminated by AI - Fast Company,2023-08-05,5 surprising job ’ get eliminated ai,"{'neg': 0.0, 'neu': 0.656, 'pos': 0.344, 'compound': 0.2732}",Positive
52,https://news.google.com/rss/articles/CBMiYGh0dHBzOi8vd3d3LmJyb29raW5ncy5lZHUvYXJ0aWNsZXMvaG93LWFpLXBvd2VyZWQtc29mdHdhcmUtZGV2ZWxvcG1lbnQtbWF5LWFmZmVjdC1sYWJvci1tYXJrZXRzL9IBAA?oc=5,How AI-powered software development may affect labor markets - Brookings Institution,2023-08-01,ai,"{'neg': 0.0, 'neu': 1.0, 'pos': 0.0, 'compound': 0.0}",Neutral
53,https://news.google.com/rss/articles/CBMijAFodHRwczovL3d3dy50ZWNoY2lyY2xlLmluLzIwMjMvMDgvMDEvZmlybXMtbmVlZC10by11bmRlcnN0YW5kLWdlbi1haS1pbi1jb250ZXh0LW9mLXRoZWlyLWJ1c2luZXNzLXByaW9yaXRpZXMtcmFrZXNoLXJhdnVyaS1wdWJsaWNpcy1zYXBpZW50L9IBAA?oc=5,Firms need to understand gen AI in context of their business: Publicis Sapient's Rakesh Ravuri - TechCircle,2023-08-01,firm need understand gen ai context business : publicis sapient 's rakesh ravuri,"{'neg': 0.0, 'neu': 1.0, 'pos': 0.0, 'compound': 0.0}",Neutral
54,https://news.google.com/rss/articles/CBMiZWh0dHBzOi8vdGVjaGluZm9ybWVkLmNvbS9mb3VyLWNvb2wtdGhpbmdzLW9jYWRvLWRvZXMtd2l0aC1haS1hbmQtbWwtdG8taW1wcm92ZS1pdHMtcm9ib3RpYy13b3JrZm9yY2Uv0gEA?oc=5,Four cool things Ocado does with AI and ML to improve its robotic workforce - TechInformed,2023-08-07,four cool thing ocado ai ml improve robotic workforce,"{'neg': 0.0, 'neu': 0.574, 'pos': 0.426, 'compound': 0.6369}",Positive
55,https://news.google.com/rss/articles/CBMiR2h0dHBzOi8vd3d3LmJhY2tzdGFnZS5jb20vbWFnYXppbmUvYXJ0aWNsZS9jYW4tYWktcmVwbGFjZS1hY3RvcnMtNzYzNjMv0gEA?oc=5,Is AI Going to Take Your Acting or Writing Gigs? - Backstage,2023-08-01,ai going take acting writing gig ?,"{'neg': 0.0, 'neu': 1.0, 'pos': 0.0, 'compound': 0.0}",Neutral
