,URL link,Title,Date,Preprocessed Title,Value,Sentiment
0,https://news.google.com/rss/articles/CBMiVWh0dHBzOi8vZW50ZXJwcmlzZXJzcHJvamVjdC5jb20vYXJ0aWNsZS8yMDIyLzMvYXJ0aWZpY2lhbC1pbnRlbGxpZ2VuY2UtYWR2YW5jZS1jYXJlZXLSAQA?oc=5,Artificial Intelligence (AI): 3 strategies for advancing your career - The Enterprisers Project,2022-03-07,artificial intelligence ( ai ) : 3 strategy advancing career,"{'neg': 0.0, 'neu': 0.617, 'pos': 0.383, 'compound': 0.4767}",Positive
1,https://news.google.com/rss/articles/CBMib2h0dHBzOi8vd3d3LnJhaWx3YXktdGVjaG5vbG9neS5jb20vZmVhdHVyZXMvbm9ydGgtYW1lcmljYS1pcy1zZWVpbmctYS1oaXJpbmctYm9vbS1pbi1yYWlsd2F5LWluZHVzdHJ5LWFpLXJvbGVzL9IBAA?oc=5,North America is seeing a hiring boom in railway industry AI roles - Railway Technology,2022-03-07,north america seeing hiring boom railway industry ai role,"{'neg': 0.0, 'neu': 1.0, 'pos': 0.0, 'compound': 0.0}",Neutral
2,https://news.google.com/rss/articles/CBMiYWh0dHBzOi8vd3d3LmZvcmJlcy5jb20vc2l0ZXMvcm9idG9ld3MvMjAyMi8wMy8wMS83LW11c3QtcmVhZC1ib29rcy1hYm91dC1hcnRpZmljaWFsLWludGVsbGlnZW5jZS_SAQA?oc=5,7 Must-Read Books About Artificial Intelligence - Forbes,2022-03-01,7 must,"{'neg': 0.0, 'neu': 1.0, 'pos': 0.0, 'compound': 0.0}",Neutral
3,https://news.google.com/rss/articles/CBMiRmh0dHBzOi8vYmVybmFyZG1hcnIuY29tL3dpbGwtYXJ0aWZpY2lhbC1pbnRlbGxpZ2VuY2UtcmVwbGFjZS10ZWFjaGVycy_SAQA?oc=5,Will Artificial Intelligence Replace Teachers? - Bernard Marr,2022-03-07,artificial intelligence replace teacher ?,"{'neg': 0.0, 'neu': 0.492, 'pos': 0.508, 'compound': 0.4767}",Positive
4,https://news.google.com/rss/articles/CBMiY2h0dHBzOi8vd3d3LmFzaWFwYWNpZmljLmNhL3B1YmxpY2F0aW9uL251cnR1cmluZy1uZXh0LWdlbmVyYXRpb24tYWktd29ya2ZvcmNlLXNuYXBzaG90LWFpLWVkdWNhdGlvbtIBAA?oc=5,Nurturing the Next-Generation AI Workforce: A Snapshot of AI Education in China's Public Education System - Asia Pacific Foundation of Canada,2022-03-07,nurturing next,"{'neg': 0.0, 'neu': 0.25, 'pos': 0.75, 'compound': 0.4588}",Positive
5,https://news.google.com/rss/articles/CBMiMmh0dHBzOi8vd3d3Lm5hdHVyZS5jb20vYXJ0aWNsZXMvczQxNTk4LTAyMi0wNzc2NC020gEA?oc=5,Real-time infection prediction with wearable physiological monitoring and AI to aid military workforce readiness during ... - Nature.com,2022-03-08,real,"{'neg': 0.0, 'neu': 1.0, 'pos': 0.0, 'compound': 0.0}",Neutral
6,https://news.google.com/rss/articles/CBMiW2h0dHBzOi8vd3d3Lm94LmFjLnVrL25ld3MvMjAyMi0wMy0wMy1hcnQtb3VyLXNha2UtYXJ0aXN0cy1jYW5ub3QtYmUtcmVwbGFjZWQtbWFjaGluZXMtc3R1ZHnSAQA?oc=5,Art for our sake: artists cannot be replaced by machines – study - University of Oxford,2022-03-03,art sake : artist replaced machine – study,"{'neg': 0.0, 'neu': 1.0, 'pos': 0.0, 'compound': 0.0}",Neutral
7,https://news.google.com/rss/articles/CBMiVGh0dHBzOi8vdmVudHVyZWJlYXQuY29tL3NlY3VyaXR5L2hvdy1haS1wb3dlcmVkLXhkci1jYW4tc2VjdXJlLXRoZS1oeWJyaWQtd29ya2ZvcmNlL9IBAA?oc=5,How AI-powered XDR can secure the hybrid workforce - VentureBeat,2022-03-03,ai,"{'neg': 0.0, 'neu': 1.0, 'pos': 0.0, 'compound': 0.0}",Neutral
8,https://news.google.com/rss/articles/CBMibGh0dHBzOi8vbmV3emhvb2suY29tL3N0b3J5L3N3YXJhamFiaWxpdHktaW5kaWFzLTFzdC1haS10cmlnZ2VyZWQtam9iLXBsYXRmb3JtLWZvci1wZXJzb25zLXdpdGgtZGlzYWJpbGl0aWVzL9IBAA?oc=5,"'Swarajability', India's 1st AI triggered Job Platform for Persons with Disabilities - NewzHook",2022-03-03,"'swarajability ' , india 's 1st ai triggered job platform person disability","{'neg': 0.0, 'neu': 1.0, 'pos': 0.0, 'compound': 0.0}",Neutral
9,https://news.google.com/rss/articles/CBMidWh0dHBzOi8vd3d3LmV1cm9uZXdzLmNvbS9uZXh0LzIwMjIvMDMvMDgvZ2VuZGVyLWJpYXMtaW4tcmVjcnVpdG1lbnQtaG93LWFpLWhpcmluZy10b29scy1hcmUtaGluZGVyaW5nLXdvbWVuLXMtY2FyZWVyc9IBAA?oc=5,Gender bias in recruitment: How AI hiring tools are hindering women's careers - Euronews,2022-03-08,gender bias recruitment : ai hiring tool hindering woman 's career,"{'neg': 0.135, 'neu': 0.865, 'pos': 0.0, 'compound': -0.1027}",Negative
10,https://news.google.com/rss/articles/CBMiTGh0dHBzOi8vaWEuYWNzLm9yZy5hdS9hcnRpY2xlLzIwMjIvYWktbXVzdC1iZS1yZXRyYWluZWQtdG8tYmUtaW5jbHVzaXZlLmh0bWzSAQA?oc=5,AI must be retrained to be inclusive - ACS,2022-03-08,ai must retrained inclusive,"{'neg': 0.0, 'neu': 1.0, 'pos': 0.0, 'compound': 0.0}",Neutral
11,https://news.google.com/rss/articles/CBMiX2h0dHBzOi8vd3d3LnBlb3BsZW1hbmFnZW1lbnQuY28udWsvYXJ0aWNsZS8xNzUxNzM3L2FydGlmaWNpYWwtaW50ZWxsaWdlbmNlLW5vdC1jYXVzZWQtbG9zcy1qb2Jz0gEA?oc=5,106987 - People Management Magazine,2022-03-01,106987,"{'neg': 0.0, 'neu': 1.0, 'pos': 0.0, 'compound': 0.0}",Neutral
12,https://news.google.com/rss/articles/CBMigAFodHRwczovL3d3dy5hbmFseXRpY3NpbnNpZ2h0Lm5ldC9hcnRpZmljaWFsLWludGVsbGlnZW5jZS9ob3ctbXVjaC1kby10aGUtZ292ZXJubWVudHMtYWxsb2NhdGUtYnVkZ2V0LWZvci1haS1hbmQtbWFjaGluZS1sZWFybmluZ9IBigFodHRwczovL3d3dy5hbmFseXRpY3NpbnNpZ2h0Lm5ldC9hbXAvc3RvcnkvYXJ0aWZpY2lhbC1pbnRlbGxpZ2VuY2UvaG93LW11Y2gtZG8tdGhlLWdvdmVybm1lbnRzLWFsbG9jYXRlLWJ1ZGdldC1mb3ItYWktYW5kLW1hY2hpbmUtbGVhcm5pbmc?oc=5,How much do the Governments allocate budget for AI and Machine Learning? - Analytics Insight,2022-03-05,much government allocate budget ai machine learning ?,"{'neg': 0.0, 'neu': 1.0, 'pos': 0.0, 'compound': 0.0}",Neutral
13,https://news.google.com/rss/articles/CBMibGh0dHBzOi8vcmVmcmVzaG1pYW1pLmNvbS9lcnVkaXQtYW1hc3Nlcy0zLTVtLWluLWxhdGUtc2VlZC1mdW5kaW5nLWZvci1haS1wb3dlcmVkLWVtcGxveWVlLWluc2lnaHRzLXBsYXRmb3JtL9IBAA?oc=5,Erudit amasses $3.5M in late seed funding for AI-powered employee insights platform - Refresh Miami,2022-03-01,erudit amasses $ 3.5m late seed funding ai,"{'neg': 0.0, 'neu': 1.0, 'pos': 0.0, 'compound': 0.0}",Neutral
14,https://news.google.com/rss/articles/CBMibGh0dHBzOi8vd3d3LmZvcmJlcy5jb20vc2l0ZXMvYmVybmFyZG1hcnIvMjAyMi8wMy8wMy93aHktaXMtaXQtbm93LXRpbWUtZm9yLW1hY2hpbmVzLXRvLXJlcGxhY2UtY2VydGFpbi1qb2JzL9IBAA?oc=5,Why Is It Now Time For Machines To Replace Certain Jobs - Forbes,2022-03-04,time machine replace certain job,"{'neg': 0.0, 'neu': 0.656, 'pos': 0.344, 'compound': 0.2732}",Positive
15,https://news.google.com/rss/articles/CBMiU2h0dHBzOi8vYzMuYWkvYzMtYWktb3BlbnMtZGV2ZWxvcG1lbnQtY2VudGVyLWluLWd1YWRhbGFqYXJhLWFkZGluZy11cC10by0xMDAwLWpvYnMv0gEA?oc=5,"C3 AI Opens Development Center in Guadalajara, Adding Up to 1,000 Jobs - C3 AI",2022-03-03,"c3 ai open development center guadalajara , adding 1,000 job","{'neg': 0.0, 'neu': 1.0, 'pos': 0.0, 'compound': 0.0}",Neutral
16,https://news.google.com/rss/articles/CBMiU2h0dHBzOi8vd3d3LmpheGRhaWx5cmVjb3JkLmNvbS9uZXdzLzIwMjIvbWFyLzAyL2F1dG9tYXRpb24tYWktcHV0dGluZy1qb2JzLWF0LXJpc2sv0gEA?oc=5,"Automation, AI putting jobs at risk | Jax Daily Record - Jacksonville Daily Record",2022-03-02,"automation , ai putting job risk | jax daily record","{'neg': 0.231, 'neu': 0.769, 'pos': 0.0, 'compound': -0.2732}",Negative
17,https://news.google.com/rss/articles/CBMiRGh0dHBzOi8vZWFydGh3ZWIuY29tL2hvdy1tYW55LWpvYnMtaGF2ZS1iZWVuLXJlcGxhY2VkLWJ5LXRlY2hub2xvZ3kv0gEA?oc=5,How Many Jobs Have Been Replaced By Technology? (2024 Research) - EarthWeb,2022-03-04,many job replaced technology ? ( 2024 research ),"{'neg': 0.0, 'neu': 1.0, 'pos': 0.0, 'compound': 0.0}",Neutral
18,https://news.google.com/rss/articles/CBMiX2h0dHBzOi8vd3d3LnRvZGF5b25saW5lLmNvbS9jb21tZW50YXJ5L2ludGVybmF0aW9uYWwtd29tZW5zLWRheS1zaW5nYXBvcmUtYWktcm9sZS1tb2RlbC0xODM5NzE20gEA?oc=5,International Women's Day: Singapore a model for women in AI - TODAY,2022-03-08,international woman 's day : singapore model woman ai,"{'neg': 0.0, 'neu': 1.0, 'pos': 0.0, 'compound': 0.0}",Neutral
19,https://news.google.com/rss/articles/CBMiZ2h0dHBzOi8vd3d3LnNocm0ub3JnL3RvcGljcy10b29scy9uZXdzL2hyLW1hZ2F6aW5lL2FwcGxpY2FudC10cmFja2luZy1zeXN0ZW0taHVydGluZy1yZWNydWl0aW5nLWVmZm9ydHPSAQA?oc=5,Is Your Applicant Tracking System Hurting Your Recruiting Efforts? - SHRM,2022-03-08,applicant tracking system hurting recruiting effort ?,"{'neg': 0.351, 'neu': 0.649, 'pos': 0.0, 'compound': -0.4019}",Negative
20,https://news.google.com/rss/articles/CBMiWWh0dHBzOi8vd3d3Lml0bmV3cy5jb20uYXUvbmV3cy90ZWxzdHJhLXRvLWRyaXZlLWFpLWludG8tZXZlcnktcGFydC1vZi1pdHMtYnVzaW5lc3MtNTc2Nzcx0gEA?oc=5,Telstra to drive AI into every part of its business - iTnews,2022-03-02,telstra drive ai every part business,"{'neg': 0.0, 'neu': 1.0, 'pos': 0.0, 'compound': 0.0}",Neutral
21,https://news.google.com/rss/articles/CBMiX2h0dHBzOi8vZ3JpdGRhaWx5LmNvbS9zaGVmZmllLXJvYmluc29uLWZvdW5kZXItYW5kLWNlby1vZi1zaGFtcmNrLXdhbnRzLW1vcmUtYmxhY2std29tYW4taW4tYWkv0gEA?oc=5,"Sheffie Robinson, Founder & CEO of Shamrck, Wants More Black Woman in AI - Grit Daily",2022-03-08,"sheffie robinson , founder & ceo shamrck , want black woman ai","{'neg': 0.0, 'neu': 0.86, 'pos': 0.14, 'compound': 0.0772}",Positive
22,https://news.google.com/rss/articles/CBMijAFodHRwczovL3d3dy5hcmFiaWFuYnVzaW5lc3MuY29tL3BvbGl0aWNzLWVjb25vbWljcy91YWUtZGlnaXRhbC1lY29ub215LXRvLWNyZWF0ZS1tYW55LWhpZ2gtcGF5aW5nLWpvYnMtcHJvZHVjZS1sYXJnZXItcmV2ZW51ZS1zdHJlYW1zLXJlcG9ydNIBAA?oc=5,"UAE 'digital economy' to create many high-paying jobs, produce larger revenue streams: report - Arabian Business",2022-03-04,uae 'digital economy ' create many high,"{'neg': 0.0, 'neu': 0.704, 'pos': 0.296, 'compound': 0.2732}",Positive
