URL link,Title,Date,Source,Source Link,description,keywords,og:description,twitter:description,@context,@type,url,image,author,publisher,headline,datePublished,dateModified,articleSection,name,isAccessibleForFree,itemListElement,article:section,article:summary,article text,@graph,@id,logo,alternateName,datemodified,mainEntityOfPage,inLanguage,hasPart,uploadDate,duration,embedUrl,thumbnailUrl,organization,thumbnailURL,contentUrl,imageObject,transcript,sameAs,potentialAction,copyrightYear,articleBody,publishingPrinciples,license,speakable,isPartOf,dateCreated,identifier,creator,legalName,telephone,address,parentOrganization,cssSelector,alternativeHeadline,specialty,mainContentOFPage,lastReviewed,target,foundingDate,slogan,contactPoint,founder,numberOfEmployees,contentLocation,associatedMedia,video,audio,contributors,dateline,sourceOrganization,copyrightHolder,numberOfItems
https://news.google.com/rss/articles/CBMiWWh0dHBzOi8vd3d3LmZvcmJlcy5jb20vc2l0ZXMvYmVybmFyZG1hcnIvMjAyNC8wMS8wNC9nZW5lcmF0aXZlLWFpLWFuZC10aGUtZnV0dXJlLW9mLWpvYnMv0gEA?oc=5,Generative AI And The Future Of Jobs - Forbes,2024-01-04,Forbes,https://www.forbes.com,"Dive into the nuanced future of work shaped by generative AI, where the evolution of jobs, emergence of new roles and the ethical implications of AI augmentation.","Indeed,Jobs,Future Jobs,Generative AI,AI,Future of Work","Dive into the nuanced future of work shaped by generative AI, where the evolution of jobs, emergence of new roles and the ethical implications of AI augmentation.","Dive into the nuanced future of work shaped by generative AI, where the evolution of jobs, emergence of new roles and the ethical implications of AI augmentation.",http://schema.org,BreadcrumbList,https://www.forbes.com/sites/bernardmarr/2024/01/04/generative-ai-and-the-future-of-jobs/,"{'@type': 'ImageObject', 'url': 'https://imageio.forbes.com/specials-images/imageserve/6596650926aadd41b4ae4acc/0x0.jpg?format=jpg&height=900&width=1600&fit=bounds', 'width': 542.79, 'height': 304.6}","{'@type': 'Person', 'name': 'Bernard Marr', 'url': 'https://www.forbes.com/sites/bernardmarr/', 'description': 'Bernard Marr is a world-renowned futurist, board advisor and author of Generative AI in Practice: 100+ Amazing Ways Generative Artificial Intelligence is Changing Business and Society. He has written over 20 best-selling and award-winning books and advises and coaches many of the world’s best-known organisations. He has a combined following of 4 million people across his social media channels and newsletters and was ranked by LinkedIn as one of the top 5 business influencers in the world. Follow Bernard on LinkedIn, X (Twitter) or YouTube. Join his newsletter, check out his website and books.', 'sameAs': ['https://www.linkedin.com/in/bernardmarr/', 'https://www.twitter.com/BernardMarr', 'https://bernardmarr.com/']}","{'@type': 'NewsMediaOrganization', 'name': 'Forbes', 'url': 'https://www.forbes.com/', 'ethicsPolicy': 'https://www.forbes.com/sites/forbesstaff/article/forbes-editorial-values-and-standards/', 'logo': 'https://imageio.forbes.com/i-forbesimg/media/amp/images/forbes-logo-dark.png?format=png&height=455&width=650&fit=bounds'}",Generative AI And The Future Of Jobs,2024-01-04T02:58:59-05:00,2024-01-04T14:45:11-05:00,Enterprise Tech,Generative AI And The Future Of Jobs,False,"[{'@type': 'ListItem', 'position': 1, 'name': 'Forbes Homepage', 'item': 'https://www.forbes.com/'}, {'@type': 'ListItem', 'position': 2, 'name': 'Innovation', 'item': 'https://www.forbes.com/innovation/'}, {'@type': 'ListItem', 'position': 3, 'name': 'Enterprise Tech', 'item': 'https://www.forbes.com/enterprise-tech/'}]",Enterprise Tech,N/A,"More From ForbesJul 23, 2024,12:29pm EDTArtificial Expectations? Time To Get Real About AIJul 23, 2024,02:06am EDTWill AI Really Revolutionize Every Industry? A Critical AnalysisJul 22, 2024,07:46pm EDTBusiness Career Disinformation & How To Exploit ItJul 22, 2024,02:54pm EDTThe Death Of Chevron Doesn’t Kill AI RegulationJul 22, 2024,09:00am EDT2024 Paris Olympic And Paralympic Games: A Big Opportunity For BrandsJul 22, 2024,01:49am EDTBusiness Leaders Still Aren’t Prepared For The AI RevolutionJul 19, 2024,02:59pm EDTNext Steps For Tech & Security Leaders After CrowdStrike Global OutageEdit StoryForbesInnovationEnterprise TechGenerative AI And The Future Of JobsBernard MarrContributorOpinions expressed by Forbes Contributors are their own.FollowingFollowClick to save this article.You'll be asked to sign into your Forbes account.Got it0Jan 4, 2024,02:58am ESTUpdated Jan 4, 2024, 02:45pm ESTShare to FacebookShare to TwitterShare to LinkedinGenerative AI And The Future Of JobsAdobe Stock
We’ve often heard it said that generative AI will affect many of the jobs people do today. But they won’t all be affected equally.

We are increasingly seeing that certain occupations will be changed more than others.


Recent research carried out by Indeed’s economic research team, Hiring Lab, found that some of the most commonly-posted jobs – including nurses, care workers and chefs – are among the 35 percent of roles that will be least affected.

However, if your job is something that can be done remotely or involves software development, there’s a much higher chance you’ll use AI to augment your work. Or, in a worst-case scenario, make you redundant.

PROMOTED
So, what does this mean for the future of work? On the one hand, those in the 20 percent of jobs that are highly likely to be transformed by generative AI are in a position of privilege. The ability to adopt generative AI into their workflow will make them more efficient, productive and valuable.
On the other, as many of these roles – which include doctors, lawyers, and software engineers – command salaries at the higher end of the scale, this could be seen as leading toward growing inequality in society.
MORE FOR YOUTarget Employees Hate Its New AI ChatbotThe Skill Code: Preserve And Enhance Your Workplace Value77% Of Employees Report AI Has Increased Workloads And Hampered Productivity, Study Finds

The Skills Question









DailyDozen
US


Forbes Daily: Join over 1 million Forbes Daily subscribers and get our best stories, exclusive reporting and essential analysis of the day’s news in your inbox every weekday.




                Sign Up
            


By signing up, you agree to receive this newsletter, other updates about Forbes and its affiliates’ offerings, our Terms of Service (including resolving disputes on an individual basis via arbitration), and you acknowledge our Privacy Statement. Forbes is protected by reCAPTCHA, and the Google Privacy Policy and Terms of Service apply.




You’re all set! Enjoy the Daily!


                More Newsletters
            


You’re all set! Enjoy the Daily!

                More Newsletters
            



A job description is generally presented as a selection of necessary skills. This was used as a jumping-in point to start analyzing the potential impact of generative AI across workforce roles.


1/1





Skip Ad
 
Continue watchingafter the adVisit Advertiser websiteGO TO PAGE
The aim was to answer a question that’s been on everyone’s mind but certainly isn’t unique to this latest wave of technological disruption.
Chris Hyams, CEO of Indeed, tells me, ""Frankly, it's a very old question of whether technology will help or hurt jobs. That question goes back a couple of hundred years to when the Luddites first smashed looms in the UK because they thought those jobs were going away.”
It’s easier to assess the impact of generative AI on individual skills than on entire jobs. For certain skills, including driving vehicles, construction skills and veterinary skills, It’s fairly useless. For others, like accounting skills, legal tasks and software development, it’s great.
When broken down like this, however, it seems likely that just about every job will be affected in some way, as nearly all involve skills to some extent that can be enhanced with generative AI.
Educators, researchers, project managers, healthcare professionals, content creators and clerical workers all use these skills, too.
“We think that AI is going to transform almost every job, how they’re done, not necessarily eliminate those jobs, but they will transform,” Hyams says.

New Jobs
As well as changing existing jobs, new jobs are likely to emerge to enable businesses and governments to benefit from the emergence of generative AI – hopefully in a safe and ethical way!
AI scholar and Google Brain co-founder Andrew NG was among the first to offer a balanced evaluation of how this will happen.
He believes that transforming the way we do existing jobs will lead to the creation of many new jobs as well. And we’re already starting to see this happen, with openings appearing for positions like AI prompt engineer or AI auditors.
But it’s widely acknowledged – by Ng and others – that it could also lead to job losses. Again, this will largely affect roles where many of the skills can be augmented or automated. However, it seems likely that a disproportionate impact could be on jobs paying lower salaries. This might include customer service advisors, translators, assistants and back-office clerical staff.

The Evolution Of Skills
Rather than needing to develop new skills (or change profession entirely), I think this shows that skills are evolving.
Remember, when the pocket calculator was invented in the 20th century, many thought that it would lead to a decline in our ability to do basic mathematics. What actually happened was that lots of people – school children in particular – became capable of solving more complicated math problems more quickly.
But as well as enhancing our technical skills, delegating routine elements of work – scheduling, drafting reports – to machines means we have more time to focus on the human aspect of our work.
For lawyers and doctors, this means spending more face time with patients and less time reading charts and reports. Teachers will spend less time grading papers and more time one-on-one with pupils. Real estate agents will use generative AI to create property listings or sales reports while they focus on understanding buyers' unique needs.
It’s also important to point out that employers have a responsibility to help out with this evolution. It's in the interest of their employees, who will benefit from the personal development. But it's also in the interest of their businesses that will grow thanks to the advances in efficiency and innovation driven by the adoption of generative AI.

The Ethical Impact 
As with any discussion on the impact of AI, there are ethical considerations that can’t be ignored.
The changing nature of work, the income disparity between roles that can be augmented and those that can’t, and the intrinsic need for human-centric services in many professions all need to be addressed.
Cooks, cleaners, and laborers will have fewer chances to use generative AI to increase their value, while for financial analysts, lawyers, and software engineers, the opportunities are significant.
This has the potential to exacerbate existing inequalities, and this can only be addressed by continued focus on improving opportunities. This means ensuring that the chance to move into positions that can benefit are available regardless of economic, social, class, racial or gender grouping that has traditionally created barriers.
It’s also vital to make sure that aspects of human behavior that are critical to day-to-day well-being are not augmented out of society. A doctor’s ability to alleviate anxiety with their bedside manner is an important part of the healing process, for example. This could be lost if elements of the work that seem routine – like communicating non-urgent updates on how a patient is recovering – are delegated to AI.
What is becoming clear is that the impact of generative AI on jobs is only going to grow, and over the coming year or two, we’ll start to get a better picture of how this will impact our lives and society as we face up to these important challenges.
Right now, from an individual perspective, the most important thing to do is develop an understanding of how our own roles – or the roles we hope we will have in the future – can benefit from this hugely transformative opportunity.
Follow me on Twitter or LinkedIn. Check out my website or some of my other work here. Bernard MarrFollowingFollowBernard Marr is a world-renowned futurist, board advisor and author of Generative AI in Practice: 100+ Amazing Ways Generative Artificial Intelligence is Changing... Read MoreEditorial StandardsPrintReprints & PermissionsJoin The ConversationComments 0One Community. Many Voices. Create a free account to share your thoughts. Read our community guidelines  here.Forbes Community GuidelinesOur community is about connecting people through open and thoughtful conversations. We want our readers to share their views and exchange ideas and facts in a safe space.In order to do so, please follow the posting rules in our site's Terms of Service.  We've summarized some of those key rules below. Simply put, keep it civil.Your post will be rejected if we notice that it seems to contain:False or intentionally out-of-context or misleading informationSpamInsults, profanity, incoherent, obscene or inflammatory language or threats of any kindAttacks on the identity of other commenters or the article's authorContent that otherwise violates our site's terms.User accounts will be blocked if we notice or believe that users are engaged in:Continuous attempts to re-post comments that have been previously moderated/rejectedRacist, sexist, homophobic or other discriminatory commentsAttempts or tactics that put the site security at riskActions that otherwise violate our site's terms.So, how can you be a power user?Stay on topic and share your insightsFeel free to be clear and thoughtful to get your point across‘Like’ or ‘Dislike’ to show your point of view.Protect your community.Use the report tool to alert us when someone breaks the rules.Thanks for reading our community guidelines.  Please read the full list of posting rules found in our site's Terms of Service.",,,,,,,,,,,,,,,,,,,,,,,,,,,,,,,,,,,,,,,,,,,,,,,,,,,,
https://news.google.com/rss/articles/CBMigAFodHRwczovL3d3dy5tZXJjZXIuY29tL2luc2lnaHRzL3Blb3BsZS1zdHJhdGVneS9mdXR1cmUtb2Ytd29yay9wdXR0aW5nLXRoZS1wb3dlci1vZi1nZW5lcmF0aXZlLWFpLXRvLXdvcmstaW4tYS1za2lsbHMtYmFzZWQtb3JnL9IBAA?oc=5,Putting the power of Gen AI to work in a skills-based organization - Mercer,2024-01-05,Mercer,https://www.mercer.com,Generative AI is already transforming skills-based workplaces by enhancing human capabilities. Find out the power of using gen AI in a skills-based organization.,"Work design,People strategy,Human Resources,Career,Generative AI,Organization design,Future of work,CHRO,Workforce strategy,CFO,Global All,CEO,CIO,Digital strategy,Learning and Development,M&A advisory,Talent,Global All,COO,Ravin Jesuthasan,Corporate Strategy,Article",This intersection of AI and the skills-based workplace will be a theme of this year’s annual Mercer breakfast at Davos. ,N/A,,,,,,,,,,,,,,N/A,N/A,"







Attract & retain talent

Strategic workforce planning  
Mercer’s strategic workforce planning solutions provide a rational business basis to prioritize, develop and fund the people practices needed to support business…




",,,,,,,,,,,,,,,,,,,,,,,,,,,,,,,,,,,,,,,,,,,,,,,,,,,,
