URL link,Title,Date,Source,Source Link,description,keywords,og:description,twitter:description,@context,@graph,article:section,article:summary,article text,@type,url,headline,articleSection,datePublished,dateModified,image,thumbnailUrl,publisher,isAccessibleForFree,requiresSubscription,author,mainEntityOfPage,dateCreated,creator,metadata,itemListElement,articleBody,name,isPartOf,alternativeHeadline,location,logo,email,potentialAction
https://news.google.com/rss/articles/CBMiLGh0dHBzOi8vY251LmVkdS9uZXdzLzIwMjIvMDIvMTYtcGNzZS1jcmVlY2gv0gEA?oc=5,Professors Awarded Grant to Boost AI Lab Capabilities - Christopher Newport University,2022-02-16,Christopher Newport University,https://cnu.edu,Major retrofit will enhance artificial intelligence and machine-learning work.,"cybersecurity, ai, artificial intelligence, machine learning, stem",Major retrofit will enhance artificial intelligence and machine-learning work.,Major retrofit will enhance artificial intelligence and machine-learning work.,,,N/A,N/A,"



Professors Awarded Grant to Boost AI Lab Capabilities
Major retrofit will enhance artificial intelligence and machine-learning work.
by Brian McGuire |         February 16, 2022


Above: The Hunter Creech lab

Read time: less than a minute

Three professors in the Department of Physics, Computer Science and Engineering have been awarded a grant from Virginia's Commonwealth Cyber Initiative to overhaul lab space in Luter Hall that supports the cybersecurity major.
Christopher Kreider, Michael Lapke and Nazli Siasi are leading the project, which will see the beloved Hunter Creech Lab receive major upgrades to its capabilities over the next year.
The planned enhancements will enable Christopher Newport students to pursue the latest developments in artificial intelligence and machine learning in preparation for careers in the fast-growing field of cybersecurity. The grant includes funding for new high-performance computer workstations, cloud-based software applications and other resources to power the new technologies.
""Enabling students to do hands-on work in these areas is extremely important from a learning perspective,"" Kreider said. ""Lab environments that enable us to work in safe virtual environments will greatly enhance both our teaching and independent exploration for students.""
Installation of the new resources will begin this summer and be ready for use by students and faculty in fall 2022.


Read more like this


 Student Research and Creative Activity 
 Faculty Research and Creative Activity 
 Academics 
 Physics Computer Science and Engineering 
 College of Natural and Behavioral Sciences 



",,,,,,,,,,,,,,,,,,,,,,,,,
https://news.google.com/rss/articles/CBMicGh0dHBzOi8vd3d3Lm5hdHVyZS5vcmcvZW4tdXMvd2hhdC13ZS1kby9vdXItaW5zaWdodHMvcGVyc3BlY3RpdmVzL2FydGlmaWNpYWwtaW50ZWxsaWdlbmNlLWdyZWVuLWVuZXJneS1wbGFubmluZy_SAQA?oc=5,"Hydropower, River Protection, and Artificial Intelligence | TNC - The Nature Conservancy",2022-02-18,The Nature Conservancy,https://www.nature.org,How AI can help us balance clean energy expansion and habitat protection.,"['feature', 'latin america', 'hydropower', 'rivers', 'energy siting', 'en_us']","The world needs more renewable energy, but we also need to protect wild habitats, especially free-flowing rivers. So how do we balance these goals? A.I. can help.","The world needs more renewable energy, but we also need to protect wild habitats, especially free-flowing rivers. So how do we balance these goals? A.I. can help.",http://schema.org,,N/A,N/A,N/A,NewsArticle,https://www.nature.org/en-us/what-we-do/our-insights/perspectives/artificial-intelligence-green-energy-planning/,Three Things to Know About Artificial Intelligence and Green Energy Planning,Global Insights,,,,https://natureconservancy-h.assetsadobe.com/is/image/content/dam/tnc/nature/en/photos/b/r/BR_SACR101101_D017.jpg?crop=0%2C296%2C4185%2C2197&amp;wid=1200&amp;hei=630&amp;scl=3.4875,,,,,,2022-02-18T12:00:00Z,[],"{""readTimeMinutes"":"""",""isBlogTemp"":""false"",""primaryAuthor"":"""",""description"":""The world needs more renewable energy, but we also need to protect wild habitats, especially free-flowing rivers. So how do we balance these goals? A.I. can help."",""contentTypeTag"":""Feature"",""articleDate"":""Feb 18, 2022"",""target"":""_self"",""pageImage"":{""small"":""https://natureconservancy-h.assetsadobe.com/is/image/content/dam/tnc/nature/en/photos/b/r/BR_SACR101101_D017.jpg?crop=232%2C0%2C3720%2C2790&wid=300&hei=225&scl=12.4"",""default"":""https://natureconservancy-h.assetsadobe.com/is/image/content/dam/tnc/nature/en/photos/b/r/BR_SACR101101_D017.jpg?crop=232%2C0%2C3720%2C2790&wid=300&hei=225&scl=12.4"",""medium2x"":""https://natureconservancy-h.assetsadobe.com/is/image/content/dam/tnc/nature/en/photos/b/r/BR_SACR101101_D017.jpg?crop=232%2C0%2C3720%2C2790&wid=800&hei=600&scl=4.65"",""large"":""https://natureconservancy-h.assetsadobe.com/is/image/content/dam/tnc/nature/en/photos/b/r/BR_SACR101101_D017.jpg?crop=232%2C0%2C3720%2C2790&wid=800&hei=600&scl=4.65"",""small2x"":""https://natureconservancy-h.assetsadobe.com/is/image/content/dam/tnc/nature/en/photos/b/r/BR_SACR101101_D017.jpg?crop=232%2C0%2C3720%2C2790&wid=600&hei=450&scl=6.2"",""medium"":""https://natureconservancy-h.assetsadobe.com/is/image/content/dam/tnc/nature/en/photos/b/r/BR_SACR101101_D017.jpg?crop=232%2C0%2C3720%2C2790&wid=800&hei=600&scl=4.65"",""large2x"":""https://natureconservancy-h.assetsadobe.com/is/image/content/dam/tnc/nature/en/photos/b/r/BR_SACR101101_D017.jpg?crop=232%2C0%2C3720%2C2790&wid=1600&hei=1200&scl=2.325""},""autoFeatureImage"":{""small"":""https://natureconservancy-h.assetsadobe.com/is/image/content/dam/tnc/nature/en/photos/b/r/BR_SACR101101_D017.jpg?crop=232%2C0%2C3720%2C2790&wid=300&hei=225&scl=12.4"",""default"":""https://natureconservancy-h.assetsadobe.com/is/image/content/dam/tnc/nature/en/photos/b/r/BR_SACR101101_D017.jpg?crop=232%2C0%2C3720%2C2790&wid=300&hei=225&scl=12.4"",""medium2x"":""https://natureconservancy-h.assetsadobe.com/is/image/content/dam/tnc/nature/en/photos/b/r/BR_SACR101101_D017.jpg?crop=396%2C0%2C3392%2C2790&wid=800&hei=658&scl=4.240121580547113"",""large"":""https://natureconservancy-h.assetsadobe.com/is/image/content/dam/tnc/nature/en/photos/b/r/BR_SACR101101_D017.jpg?crop=292%2C0%2C3600%2C2790&wid=800&hei=620&scl=4.5"",""small2x"":""https://natureconservancy-h.assetsadobe.com/is/image/content/dam/tnc/nature/en/photos/b/r/BR_SACR101101_D017.jpg?crop=232%2C0%2C3720%2C2790&wid=600&hei=450&scl=6.2"",""medium"":""https://natureconservancy-h.assetsadobe.com/is/image/content/dam/tnc/nature/en/photos/b/r/BR_SACR101101_D017.jpg?crop=301%2C0%2C3582%2C2790&wid=800&hei=623&scl=4.478330658105939"",""large2x"":""https://natureconservancy-h.assetsadobe.com/is/image/content/dam/tnc/nature/en/photos/b/r/BR_SACR101101_D017.jpg?crop=286%2C0%2C3611%2C2790&wid=1600&hei=1236&scl=2.2572815533980584""},""pageImageAlt"":""Aerial view of river."",""desktopImageCrop"":""center-middle"",""mobileImageCrop"":""center-middle""}",,,,,,,,,
https://news.google.com/rss/articles/CBMiiQFodHRwczovL3d3dy5hbmFseXRpY3NpbnNpZ2h0Lm5ldC9pbnRlcnZpZXcvZXhjbHVzaXZlLWludGVydmlldy13aXRoLWFsYW4tbG9ja2V0dC12cC1vZi1tYWNoaW5lLWxlYXJuaW5nLWFuZC1hcnRpZmljaWFsLWludGVsbGlnZW5jZS1kaXNjb9IBkwFodHRwczovL3d3dy5hbmFseXRpY3NpbnNpZ2h0Lm5ldC9hbXAvc3RvcnkvaW50ZXJ2aWV3L2V4Y2x1c2l2ZS1pbnRlcnZpZXctd2l0aC1hbGFuLWxvY2tldHQtdnAtb2YtbWFjaGluZS1sZWFybmluZy1hbmQtYXJ0aWZpY2lhbC1pbnRlbGxpZ2VuY2UtZGlzY28?oc=5,"Exclusive interview with Alan Lockett, VP of Machine Learning and Artificial Intelligence, DISCO - Analytics Insight",2022-02-17,Analytics Insight,https://www.analyticsinsight.net,,"DISCO,Legal technology company,Alan Lockett,Machine learning ,Artificial intelligence",Trending technologies like machine learning and artificial intelligence are now being used in almost every sector and the legal industry is no different. Operat,Trending technologies like machine learning and artificial intelligence are now being used in almost every sector and the legal industry is no different. Operat,http://schema.org,,N/A,N/A,"The Best Crypto Stocks of July 2024
",NewsArticle,https://www.analyticsinsight.net/interview/exclusive-interview-with-alan-lockett-vp-of-machine-learning-and-artificial-intelligence-disco,"Exclusive interview with Alan Lockett, VP of Machine Learning and Artificial Intelligence, DISCO",Interview,2022-02-17T04:35:00Z,2022-02-17T04:35:00Z,"{'@type': 'ImageObject', 'url': 'https://media.assettype.com/analyticsinsight/import/wp-content/uploads/2022/02/Exclusive-interview-with-Alan-Lockett-VP-of-Machine-Learning-and-Artificial-Intelligence-DISCO.jpg?w=1200&h=675&auto=format%2Ccompress&fit=max&enlarge=true', 'width': '1200', 'height': '675'}",https://media.assettype.com/analyticsinsight/import/wp-content/uploads/2022/02/Exclusive-interview-with-Alan-Lockett-VP-of-Machine-Learning-and-Artificial-Intelligence-DISCO.jpg?w=1200&h=675&auto=format%2Ccompress&fit=max&enlarge=true,"{'@type': 'Organization', '@context': 'http://schema.org', 'name': 'Analytics Insight', 'url': 'https://www.analyticsinsight.net', 'logo': {'@context': 'http://schema.org', '@type': 'ImageObject', 'author': 'analyticsinsight', 'contentUrl': 'https://images.assettype.com/analyticsinsight/2024-05/2df9abcd-45d0-437f-9a36-167417fe7202/AI_logo_white (2).png', 'url': 'https://images.assettype.com/analyticsinsight/2024-05/2df9abcd-45d0-437f-9a36-167417fe7202/AI_logo_white (2).png', 'name': 'logo', 'width': '', 'height': ''}, 'sameAs': ['https://whatsapp.com/channel/0029VafDe8HCBtxLV2PpRA2l', 'https://twitter.com/analyticsinme', 'https://in.pinterest.com/analyticsinsightsubmissions/_created/', 'https://www.instagram.com/analyticsinsightmagazine/', 'https://www.facebook.com/analyticsinsight.net', 'https://news.google.com/publications/CAAiEDD0Ze78owxVdNti611RNvQqFAgKIhAw9GXu_KMMVXTbYutdUTb0?hl=en-IN&gl=IN&ceid=IN%3Aen', 'https://t.me/analyticsinsightmag', 'https://www.youtube.com/channel/UCgF2J0b46YP0vvVEbgL_GuQ', 'https://www.linkedin.com/company/analytics-insight/'], 'id': 'https://www.analyticsinsight.net'}",,,"[{'@type': 'Person', 'givenName': 'Market Trends', 'name': 'Market Trends', 'url': 'https://www.analyticsinsight.net/author/market-trends'}]","{'@type': 'WebPage', '@id': 'https://www.analyticsinsight.net/interview/exclusive-interview-with-alan-lockett-vp-of-machine-learning-and-artificial-intelligence-disco'}",2022-02-17T04:35:00Z,,,"[{'@type': 'ListItem', 'position': 1, 'name': 'Home', 'item': 'https://www.analyticsinsight.net'}, {'@type': 'ListItem', 'position': 2, 'name': 'Interview', 'item': 'https://www.analyticsinsight.net/interview'}, {'@type': 'ListItem', 'position': 3, 'name': 'Exclusive interview with Alan Lockett, VP of Machine Learning and Artificial Intelligence, DISCO', 'item': 'https://www.analyticsinsight.net/interview/exclusive-interview-with-alan-lockett-vp-of-machine-learning-and-artificial-intelligence-disco'}]","Trending technologies like machine learning and artificial intelligence are now being used in almost every sector and the legal industry is no different. Operations like research recommendations and folder analysis are currently done with the help of AI. DISCO is a cutting-edge legal technology company developing legal services products backed by AI. Analytics Insight has engaged in an exclusive interview with Alan Lockett, VP of Machine Learning and Artificial Intelligence, DISCO..Can you tell me about DISCO, your role, and your responsibilities?.DISCO is a cutting-edge legal technology company developing legal services products backed by AI. I am the Vice President of Machine Learning and Artificial Intelligence. In that role, I coordinate DISCO's technical approach to AI across products and lead a team of researchers and developers that implement our AI methods..How does AI in legal practice actually work? .Good AI technologies for legal remove obstacles and enable the lawyer to focus on the tasks that require their legal skills. There are two key ways this happens. First, AI channels the flood of digital information into comprehensible streams. In doing so, AI allows lawyers to keep up with the rapid pace of increase in digital information that lawyers have to review as part of their jobs, including emails, spreadsheets, chats, images, video, and audio. Second, AI integrates data from diverse sources such as documentary evidence, depositions, legal precedents, regulations, and statutes to help lawyers attain a cohesive understanding of the key issues for their clients..Do we need to fear the Robo lawyer? .AI technologies as they exist today are not competent to make decisions that require sophisticated legal judgment, but they give back time to the lawyer to make those judgment calls.  Misconceptions and fears about AI's role in the legal industry are misplaced and in some cases may prevent legal practitioners from adopting technology that could streamline their work. Technological innovation has changed the practice of law but not in the ways many might expect. Autonomous cyborgs are far from replacing the uniquely human aspects of legal reasoning. AI in the legal revolution will augment human intelligence––not replace it..Should AI be exciting to someone with a law degree? Why? .Absolutely. Law school graduates at every level of their careers should be excited about AI. Lawyers that do not embrace AI technology will not be able to compete with lawyers that do. The sheer amount of data involved in many legal cases make it unrealistic to practice law without the benefit of advanced technology. Once tasks such as documentation or reviews that don't require legal judgment are automated, lawyers can dedicate more of their time to practicing law. In the end, by allowing lawyers to focus on serious legal questions, AI can help lawyers to deliver more just and equitable outcomes..Disclaimer: Analytics Insight does not provide financial advice or guidance. Also note that the cryptocurrencies mentioned/listed on the website could potentially be scams, i.e. designed to induce you to invest financial resources that may be lost forever and not be recoverable once investments are made. You are responsible for conducting your own research (DYOR) before making any investments. Read more here.","Exclusive interview with Alan Lockett, VP of Machine Learning and Artificial Intelligence, DISCO","{'@type': 'WebPage', 'url': 'https://www.analyticsinsight.net/interview/exclusive-interview-with-alan-lockett-vp-of-machine-learning-and-artificial-intelligence-disco', 'primaryImageOfPage': {'@type': 'ImageObject', 'url': 'https://media.assettype.com/analyticsinsight/import/wp-content/uploads/2022/02/Exclusive-interview-with-Alan-Lockett-VP-of-Machine-Learning-and-Artificial-Intelligence-DISCO.jpg?w=1200&h=675&auto=format%2Ccompress&fit=max&enlarge=true', 'width': '1200', 'height': '675'}}",,,,,
https://news.google.com/rss/articles/CBMiOGh0dHBzOi8vd3d3LmFiYy5uZXQuYXUvbGlzdGVuL3Byb2dyYW1zL2JpZ2lkZWFzLzEzNzA4MjI20gEA?oc=5,BBC Reith Lecture 3: Artificial Intelligence In The Economy - ABC News,2022-02-17,ABC News,https://www.abc.net.au,Professor Stuart Russell's Reith lectures explore the role of artificial intelligence and what it means for the way we live our lives. How will we adapt as work is increasingly done by machines?,"paul barclay,big ideas,abc,radio national,stuart lee,artificial intelligence,reith lecture,bbc,economy",Professor Stuart Russell's Reith lectures explore the role of artificial intelligence and what it means for the way we live our lives. How will we adapt as work is increasingly done by machines?,N/A,http://schema.org,,N/A,N/A,"In this series of Reith Lectures, Stuart Russell explores the impact of Artificial Intelligence (AI) on our lives.As the world becomes increasingly reliant on all-powerful AI, are we in danger of losing control over the machines that govern so much of what we do?In this third lecture, he asks how will we - and the economy - adapt as work is increasingly done by machines.Due to copyright reasons the stream and download of this talk is only available for 30 days after first broadcast, but you can access the audio via the BBC website.SpeakerStuart Russell - Professor of Computer Science at the University of California, BerkleyCreditsPaul Barclay, PresenterDamian Rabbitt, ProducerImage DetailsAt a factory on the outskirts of Tokyo, Nextage robots control the floor making ATM and vending machines. They do the work of three human beings 24 hours a day.(ABC News)Program:More from Big IdeasRobotics, Computer Science, Community and Society, WorkGet the ABC listen appTake your favourite podcasts and radio with youMore EpisodesAndrew O’Hagan delivers a defence of literature and truth in the age of the machines Published: 8h agoThu 18 Jul 2024 at 3:00amThe surprising bonds that make us and break us — Ceridwen Dovey, Anna McGahan, Ahona Guha  Published: YesterdayWed 17 Jul 2024 at 3:00amBarkaa, Steph Tisdell and Rudi Bremer: Indigenous performers are expected to be perfectPublished: TueTue 16 Jul 2024 at 3:00amThe Australian far right todayPublished: MonMon 15 Jul 2024 at 3:00am",Article,,BBC Reith Lecture 3: Artificial Intelligence In The Economy,,2022-02-17T09:05:00+00:00,2022-02-16T22:08:24+00:00,"{'@type': 'ImageObject', 'height': 90, 'url': 'https://live-production.wcms.abc-cdn.net.au/ae490dc89a4094cd4f31f911dd3b82c2?impolicy=wcms_crop_resize&cropH=413&cropW=738&xPos=207&yPos=2&width=160&height=90', 'width': 160}",,"{'@type': 'Organization', 'name': 'ABC listen', 'logo': {'@type': 'ImageObject', 'height': 60, 'url': '', 'width': 388}}",,,"[{'@type': 'Person', 'name': 'Paul Barclay'}, {'@type': 'Person', 'name': 'Damian Rabbitt'}]",https://www.abc.net.au/listen/programs/bigideas/13708226,,,,,,,,,,,,
https://news.google.com/rss/articles/CBMilAFodHRwczovL2hvc3BpdGFsaXR5LmVjb25vbWljdGltZXMuaW5kaWF0aW1lcy5jb20vbmV3cy9zcGVha2luZy1oZWFkcy9hcnRpZmljaWFsLWludGVsbGlnZW5jZS1lbmNvdXJhZ2VzLWNsb3VkLWtpdGNoZW5zLXRvLWJlLW1vcmUtZWZmZWN0aXZlLzg5NTk4OTA30gGYAWh0dHBzOi8vaG9zcGl0YWxpdHkuZWNvbm9taWN0aW1lcy5pbmRpYXRpbWVzLmNvbS9hbXAvbmV3cy9zcGVha2luZy1oZWFkcy9hcnRpZmljaWFsLWludGVsbGlnZW5jZS1lbmNvdXJhZ2VzLWNsb3VkLWtpdGNoZW5zLXRvLWJlLW1vcmUtZWZmZWN0aXZlLzg5NTk4OTA3?oc=5,Artificial Intelligence encourages cloud kitchens to be more effective - ETHospitality,2022-02-17,ETHospitality,https://hospitality.economictimes.indiatimes.com,ETHospitalityWorld An initiative of The Economic Times,"['Speaking Heads', 'Cloud Kitchens', 'Nirmala Sitharaman', 'Manjari Singh', 'Hospitality Sector', 'Machine', 'Cloud Kitchen']","Cloud Kitchens: After the pandemic and with the new instructions and regulations, the game plan for the industry has changed now.","Cloud Kitchens: After the pandemic and with the new instructions and regulations, the game plan for the industry has changed now.",http://schema.org,,N/A,N/A,N/A,WebSite,https://hospitality.economictimes.indiatimes.com,Artificial Intelligence encourages cloud kitchens to be more effective,Speaking Heads,2022-02-17T14:00:00+05:30,2022-02-17T14:00:00+05:30,"[{'@type': 'ImageObject', 'url': 'https://etimg.etb2bimg.com/thumb/msid-89598907,width-1200,height-900,resizemode-4/.jpg', 'width': 1200, 'height': 900}]",,"{'@type': 'NewsMediaOrganization', 'name': 'ETHospitalityWorld', 'logo': {'@type': 'ImageObject', 'url': 'https://img.etb2bimg.com/files/cp/upload-1679564125-et-hospitality-light-theme.png', 'width': 600, 'height': 60}}",,,"[{'@type': 'Thing', 'name': 'ET HospitalityWorld', 'url': 'https://hospitality.economictimes.indiatimes.com'}]","{'@type': 'WebPage', '@id': 'https://hospitality.economictimes.indiatimes.com/news/speaking-heads/artificial-intelligence-encourages-cloud-kitchens-to-be-more-effective/89598907'}",,,,"[{'@type': 'ListItem', 'position': 1, 'item': {'@id': 'https://hospitality.economictimes.indiatimes.com', 'name': 'Home'}}, {'@type': 'ListItem', 'position': 2, 'item': {'@id': 'https://hospitality.economictimes.indiatimes.com/news', 'name': 'News'}}, {'@type': 'ListItem', 'position': 3, 'item': {'@id': 'https://hospitality.economictimes.indiatimes.com/news/speaking-heads', 'name': 'Speaking Heads'}}, {'@type': 'ListItem', 'position': 4, 'item': {'@id': 'https://hospitality.economictimes.indiatimes.com/news/speaking-heads/artificial-intelligence-encourages-cloud-kitchens-to-be-more-effective/89598907', 'name': 'Artificial Intelligence encourages cloud kitchens to be more effective'}}]","By Manjari SinghThe online food delivery industry is moving continuously towards growth and constantly making its impact on the hospitality sector. With the new instructions and some reliefs announced by the finance minister Nirmala Sitharaman for the union budget Hospitality Sector 2022-23. Now the industry is all set to perform its best to realigned its outline. After the pandemic and with the new instructions and regulations, the game plan for the industry has changed now. The current trend that has become famous in the Hospitality industry is Cloud Kitchen and it has been more than two years of the covid 19 pandemic we have seen the cloud kitchen is on the top list when talking about the growth &amp; overall hospitality sector.Cloud kitchens are also known as ghost kitchens. It is like a viable kitchen space that is only used to prepare meals for the online deliveries and takeout. These commercial kitchens are used for the facilities and services needed to make the food items. The dine-in facility is not available in the cloud-based kitchen models. It is worth expressive that cloud kitchens have some great recompense.Cloud kitchen has a massive scale and now it primarily focuses on delivering online food and reaching a larger audience. This way cloud kitchen reinforces its brand and increases greater exposure. They generally provide food within 10 km and that too in 20-30 minutes. Online food delivery has increased by 150% in the past two years due to the pandemic and the work-from-home culture.If we look at our past two years we can witness that number of students and migrants or those who were working outside their cities were stuck due to the covid restrictions and regulations implemented by the government of India. Hence it results in most of the people have adapted work from home culture instead of regular office for too long and the only problem the country was facing is no further involvement &amp; engagement in outside activities like parties, travel &amp; tourism, hangouts, etc.The Cloud- kitchens trends come up in the high spot when people got bored with the restrictions and work from home culture pressurized them with zero involvement in outdoor activities. they start to order food online from cloud kitchens as per their taste and cuisine because that was the only way to taste the food &amp; dishes and now cloud kitchens have become a trend in the overall hospitality sector.Artificial IntelligenceThe support of Artificial intelligence and Machine learning in this sector is giving cloud kitchens the platform for being more effective and restructuring their operations magnificently. The 21st century is observing rapid growth in terms of technology. There have been countless useful inventions and advanced innovative tech that are helping figure out the future of the country. One such invention is AI. everything these days is based on AI and Machine learning the latest ones to join this flourishing tech are restaurateurs.Online food delivery businesses have been running magnificently with this technology for a very long time now but with people getting more happy dining at home, the impression of cloud kitchens is on an all-time rise and AI is only adding to the profits of these kitchens. AI supports cloud kitchens finding out the right cuisines, identifying the menu mix, managing inventory, and dealing with customer feedback. Machine learning has played an enormous role in the way restaurants are doing business.Effective Cloud KitchensTraditional restaurants receive less profit as compared to the ones that have a cloud kitchen because they need a viable space, large staff with waiters, electricity costs, etc. On the other hand, a ghost kitchen can run in a basement or even in a parking lot. They don&rsquo;t need much administer and hence the revenue margin is big as compared to traditional restaurants.It takes a decent amount of money to start a restaurant by leasing a building rather than expensive construction according to the restaurant&rsquo;s needs. Cloud or virtual kitchens save money by leasing a commercial kitchen and it helps in reducing the cost. If you are planning to open your own ghost kitchen-based food chain, all you need is a decent space and some great chefs.At present-day, cloud kitchens are fulfilling the needs of consumers with their satisfaction of providing the facility of the dining experience at home rather than traditional kitchens and AI-based models has big support towards them in focusing on the quality of food, administrative tasks of the kitchen like health, property taxes, security monitoring, utility bills, and the needs of the consumer instead of other problems. The cloud kitchen ensures uniform taste along with the high-quality production of food. The upcoming future of cloud kitchen has incredible scope for the and it can reconstruct the whole figure of Hospitality Sector.Manjari Singh is the Co-founder of The Chhaunk",ETHospitalityWorld,,,"{'@type': 'Place', 'address': 'Times Internet Limited (Times Center), FC - 6, Sector 16 A, Film City, Noida - 201301 Uttar Pradesh, India'}","{'@type': 'ImageObject', 'url': 'https://img.etb2bimg.com/files/cp/upload-1679564125-et-hospitality-light-theme.png', 'width': 600, 'height': 60}",contactus@ethospitalityworld.com,"{'@type': 'SearchAction', 'target': 'https://hospitality.economictimes.indiatimes.com/search/{query}', 'query-input': 'required name=query'}"
