URL link,Title,Date,Source,Source Link,description,keywords,og:description,twitter:description,@context,@type,url,image,author,publisher,headline,datePublished,dateModified,articleSection,name,isAccessibleForFree,itemListElement,article:section,article:summary,article text,mainEntityOfPage,dateCreated,heading,articleBody,isBasedOn,thumbnailUrl,isPartOf,alternativeHeadline,@graph,identifier,creator,mentions,hasPart,address,diversityPolicy,email,legalName,leiCode,telephone,logo,brand,dateline,uploadDate,duration,potentialAction
https://news.google.com/rss/articles/CBMiWGh0dHBzOi8vd3d3Lm5vdmFydGlzLmNvbS9zdG9yaWVzL2FydGlmaWNpYWwtaW50ZWxsaWdlbmNlLWRlY29kZXMtY2FuY2VyLXBhdGhvbG9neS1pbWFnZXPSAQA?oc=5,Artificial intelligence decodes cancer pathology images - Novartis,2018-11-12,Novartis,https://www.novartis.com,Novartis researchers are collaborating with tech startup PathAI to search for hidden information in pathology slides.,"Cancer, Emerging Technology, Innovation, Novartis Institutes for BioMedical Research, novartis, novartis pharmaceuticals, global healthcare companies,sandoz, sandoz pharmaceuticals, oncology drug development, novartis oncology pipeline, innovative healthcare, rare disease treatment, rare disease patients, innovative medicines, cell therapy, gene therapy",Novartis researchers are collaborating with tech startup PathAI to search for hidden information in pathology slides.,Novartis researchers are collaborating with tech startup PathAI to search for hidden information in pathology slides.,https://schema.org,,,,,,,,,,,,,N/A,N/A,"






Discovery



Artificial intelligence decodes cancer pathology images



Novartis researchers are collaborating with tech startup PathAI to search for hidden information in pathology slides.



By

Elizabeth Dougherty

|
Nov 12, 2018


 
For 150 years, pathologists have been looking through microscopes at tissue samples mounted on slides to diagnose cancer. Each assessment is weighty: Does this patient have cancer or not?
The job of a pathologist is daunting. A single slide could contain hundreds of thousands of cells. Only a handful might be cancer. Inaccurate diagnosis rates range from 3-9% of cases, according to a recent review(link is external).
Enter artificial intelligence (AI), an extra set of unbiased, indefatigable artificial eyes that could help catch errors. Many researchers are pursuing this possibility, but Novartis pathologists think AI might have an additional role to play. They hypothesize that pathology slides could contain information that helps explain why some patients respond to therapy when other seemingly similar patients do not.
To explore this idea, pathologists and data scientists from Novartis have joined forces with tech startup PathAI. They are training an AI system developed by PathAI to learn to see the same patterns pathologists see and then building on that to determine if the system can detect hidden but informative patterns too subtle or complex for pathologists to discern. The effort is part of a larger effort at Novartis to leverage data and digital technologies in ways that could help drug developers get the right drugs to the right patients faster.












View
1/2



View
2/2



<>01













A pathologist sees a field of cells on a slide and relies on years of training to find those that might be cancer.





1/2







The PathAI system also finds signs of cancer and overlays the slide with its assessment, showing cancer (red), surrounding cells (green) and dead cells (black).





2/2










Previous



Next











 
In a first phase of testing, the collaborative team has trained the PathAI system to look at slides from untreated patients and distinguish tumor from normal tissue. The system can also identify different cell types on a slide reliably. For a pathologist, these feats are akin to finding a needle in a haystack and then labeling every piece of straw.
The ability to label every cell is becoming increasingly important as cancer therapies evolve to include medicines that target not only cancer cells but also immune cells. If computers can analyze an entire slide at once and quantify cell types and locations, they could potentially reveal patterns that predict how well a patient might fare on a given therapy.
“Hopefully we can figure out which features correlate with survival or response to a drug,” says Meg McLaughlin, a pathologist and Director of the Oncology Pathology and Biomarkers group in the Oncology Translational Research team at the Novartis Institutes for BioMedical Research (NIBR).
With a recent explosion of experimental immuno-oncology options alongside therapies that target cancer-driving mutations, one of the biggest challenges for drug hunters is matching the most appropriate therapy to individual patients. While genomic information helps drive smart decisions, valuable clues in pathology slides could also help. “We want to create a platform that enables the field of pathology to support the accelerating pace of drug development,” says Andrew Beck, a pathologist, computer scientist and CEO of PathAI, located in Boston, Massachusetts, in the US.

We want to create a platform that enables the field of pathology to support the accelerating pace of drug development.
Andrew Beck, CEO of PathAI

Training the AI model
In collaboration with the Institute of Pathology at the University Hospital Basel in Switzerland, the Novartis team gained access to 400 pathology images from breast and lung cancer tissues along with anonymized information about the patients’ diagnoses and survival times.
The challenge for PathAI’s platform? Given an image, identify cancer, identify cell types and predict the patient’s probability of surviving five years.












One way to approach the challenge is to feed a set of untrained AI algorithms a subset of the data and see what it learns. Unlike a trained pathologist, the machine approaches the problem with no knowledge of cells or cancer.
“A human already has a lot of knowledge,” says NIBR data scientist Holger Hoefling, who is working on the project with PathAI and with an internal NIBR group aiming to use AI to assess safety concerns in pathology images. “Think about autonomous cars. To train a car to drive, the amount of time and data required for training is gigantic. In contrast, you put a human behind the wheel for 20 hours and let them drive.”
To give the untrained algorithms more knowledge about the training data, PathAI decided to feed them even more rich data. A team of consulting pathologists marks up the slides, giving the algorithms more information to work with. It’s a bit like annotations in a hefty piece of literature that highlight and explain critical passages.
For example, when training the algorithms to distinguish cell types, PathAI diced the training slides into about 10 000 smaller images and had pathologists label the cell types in each slice. “We had to think really hard about how we annotate the images,” says McLaughlin. “That step determines to a large extent what you get out of the AI model in the end.”
What is a black box?
AI experts refer to the trained algorithms as a “black box” because it’s difficult to know what the system has learned from the training data or how it makes decisions.
Inside the black box is a set of machine learning algorithms. These algorithms are a cascade of formulas that recognize features, such as the presence of a certain shape, and associate them with real-world data, such as how long a patient actually survived.
As the algorithms see more and more images, they adjust their understanding of the patterns they see in the data. Eventually they learn that certain shapes in a slide predict likely health outcomes, such as having a good chance of living one year or a poor chance of surviving six months.
The black box approach has the benefit of taking a fresh view of the data, so it can reveal unexpected biological patterns. But it can also discover patterns that have no biological meaning at all. Data scientists need to scrutinize the AI model’s output, identify the meaningless conclusions, and adjust the training data and algorithms in ways that weed them out.
Seeing through a machine’s eyes
After training, the PathAI platform lets users see pathology images through the machine’s eyes. Regions of the slides determined to be cancer glow bright red in a field of green surrounding tissue. Different cell types stand out in vivid colors like candies in a dish. The existing platform is for research use only, but PathAI aims to build applications that could be used by doctors in the future.












View
1/2



View
2/2



<>01













Pathologists use visual cues such as cell size and shape to differentiate cell types on a pathology slide.





1/2







The PathAI system has also learned to recognize cell types and overlays the slide with indications of five different kinds: lymphocyte (green), tumor cell (red), macrophage (yellow), plasma cell (black) and fibroblast (purple).





2/2










Previous



Next











 
Now that the researchers have shown that the PathAI system has the potential to see what pathologists see, they want to find out if there’s information in those images that isn’t obvious to pathologists.
For example, they wonder if the distribution and abundance of certain cells, such as immune cells, could hold clues about how well a patient might do on immune therapy. To find out using the human eye would require the painstaking scrutiny of tens of thousands of cells per slide, an implausible task. “I could potentially do it,” says McLaughlin. “But it would take forever.”
With AI, however, the task becomes feasible. McLaughlin and her team at Novartis are supplying PathAI with pathology images and data about survival times and response to therapy from a recent Novartis clinical trial for cancer. Gathering this data together and sharing it with PathAI is no small task. In addition to locating slides and verifying the consent of patients, the team must present orderly and consistent data from doctor’s visits, which can be a challenge when multiple doctors working across several clinics collected it.
“The era we’re heading into is more about data than it is about algorithms,” says Lee Cooper, assistant professor of biomedical informatics and biomedical engineering at Emory University in the US. Cooper specializes in using machine learning to understand pathology images and is collaborating with NIBR researchers. “The algorithms will continue to improve, but really the challenge we’re facing is how to produce the datasets we need to build the best algorithms we can.”
Once the data is in hand, PathAI will have the images annotated. After that, it will be up to the machines to find any hidden messages.
“If we can show that this method can take in this data and overlay information we haven’t seen before from pathologists, we’ll be onto something of potential value,” says Beck.
Video by PJ Kaszas.
Learn how Novartis and PathAI are using #artificialintelligence to decode #cancer pathology images.





Reimagine medicine with Novartis


Find career opportunities in research at Novartis.

Learn More







",,,,,,,,,"[{'@type': 'NewsArticle', 'headline': 'Artificial intelligence decodes cancer pathology images', 'name': 'Artificial intelligence decodes cancer pathology images', 'about': ['Discovery'], 'description': 'Novartis researchers are collaborating with tech startup PathAI to search for hidden information in pathology slides.', 'image': {'@type': 'ImageObject', 'url': 'https://www.novartis.com/sites/novartiscom/files/2021-06/pathai-hero-image.jpg'}, 'datePublished': 'Mon, 11/12/2018 - 11:03', 'dateModified': 'Thu, 02/10/2022 - 13:40', 'publisher': {'@type': 'Organization', '@id': 'https://www.novartis.com/', 'name': 'Novartis', 'url': 'https://www.novartis.com/', 'sameAs': ['https://www.twitter.com/novartis', 'https://www.linkedin.com/company/novartis', 'https://www.youtube.com/user/novartis', 'https://www.facebook.com/novartis', 'https://www.instagram.com/novartis'], 'logo': {'@type': 'ImageObject', 'url': 'https://www.novartis.com/sites/novartis_com/files/novartis-logo-open-graph.jpg'}}, 'mainEntityOfPage': 'https://www.novartis.com/stories/artificial-intelligence-decodes-cancer-pathology-images'}, {'@type': 'WebPage', '@id': 'https://www.novartis.com/', 'breadcrumb': {'@type': 'BreadcrumbList', 'itemListElement': [{'@type': 'ListItem', 'position': 1, 'name': 'Home', 'item': 'https://www.novartis.com/'}, {'@type': 'ListItem', 'position': 2, 'name': 'Stories', 'item': 'https://www.novartis.com/stories'}, {'@type': 'ListItem', 'position': 3, 'name': 'Artificial intelligence decodes cancer pathology images', 'item': 'https://www.novartis.com/stories/artificial-intelligence-decodes-cancer-pathology-images'}]}, 'description': 'Novartis researchers are collaborating with tech startup PathAI to search for hidden information in pathology slides.', 'publisher': {'@type': 'Organization', '@id': 'https://www.novartis.com/', 'name': 'Novartis', 'url': 'https://www.novartis.com/', 'sameAs': ['https://www.twitter.com/novartis', 'https://www.linkedin.com/company/novartis', 'https://www.youtube.com/user/novartis', 'https://www.facebook.com/novartis', 'https://www.instagram.com/novartis'], 'logo': {'@type': 'ImageObject', 'url': 'https://www.novartis.com/sites/novartis_com/files/novartis-logo-open-graph.jpg'}}}]",,,,,,,,,,,,,,,,
https://news.google.com/rss/articles/CBMiYGh0dHBzOi8vdG93YXJkc2RhdGFzY2llbmNlLmNvbS9pcy1hcnRpZmljaWFsLWludGVsbGlnZW5jZS1yYWNpc3QtYW5kLW90aGVyLWNvbmNlcm5zLTgxN2ZhNjBkNzVlOdIBAA?oc=5,Is Artificial Intelligence Racist? (And Other Concerns) | by Mauro Comi - Towards Data Science,2018-11-11,Towards Data Science,https://towardsdatascience.com,"When we think of concerns in Artificial intelligence, two main obvious connections are job loss and lethal autonomous weapons. While killer robots might be an actual threat in the future, the…",N/A,"When we think of concerns in Artificial intelligence, the two main obvious connections are job loss and lethal autonomous weapons. While…","When we think of concerns in Artificial intelligence, the two main obvious connections are job loss and lethal autonomous weapons. While…",http://schema.org,NewsArticle,https://towardsdatascience.com/is-artificial-intelligence-racist-and-other-concerns-817fa60d75e9,['https://miro.medium.com/v2/resize:fit:1200/1*BqejDh9f63qSMa40RyZkdw.jpeg'],"{'@type': 'Person', 'name': 'Mauro Comi', 'url': 'https://towardsdatascience.com/@mauro_ai'}","{'@type': 'Organization', 'name': 'Towards Data Science', 'url': 'towardsdatascience.com', 'logo': {'@type': 'ImageObject', 'width': 192, 'height': 60, 'url': 'https://miro.medium.com/v2/resize:fit:384/1*cFFKn8rFH4ZndmaYeAs6iQ.png'}}",Is Artificial Intelligence Racist? (And Other Concerns),2018-11-12T00:56:53.970Z,2020-05-09T13:49:58.001Z,,Is Artificial Intelligence Racist? (And Other Concerns),,,N/A,N/A,"Is Artificial Intelligence Racist? (And Other Concerns)Mauro Comi·FollowPublished inTowards Data Science·6 min read·Nov 11, 20181742ListenShareWhen we think of concerns in Artificial intelligence, two main obvious connections are job loss and lethal autonomous weapons. While killer robots might be an actual threat in the future, the consequence of automation is a complicated phenomenon that experts are still actively analyzing. Very likely, as for any major Industrial revolution, the market will gradually stabilize. Advances in technology will create new types of jobs, inconceivable at the moment, which will be later disrupted by a new major technology takeover. We have seen this multiple times in modern history and we are probably going to see this again.A third major field of concern is the ethical impact of AI. Here the question falls: is Artificial Intelligence racist?Well, in short.. there is no short answer.What about a long answer? Tales of Google, Seals, and GorillasIn order to answer this question, we first need to define what Racism is.Racism: The belief that all members of each race possess characteristics, abilities, or qualities specific to that race, especially so as to distinguish it as inferior or superior to another race or races. ~ Oxford DictionariesRacism is related to the generalization of specific characteristics to all the members of a race. Generalization is a key concept in Machine learning and this is especially true in classification algorithms. Inductive learning is related to derive general concepts from specific examples. The majority of techniques in supervised learning try to approximate functions to predict the categories of input values with the highest possible accuracy.A function that fits our training set too closely generates overfitting. In practice, it is not able to derive a proper general function given different inputs. On the other hand, a function that doesn’t fit the dataset accurately leads to underfitting. Hence, the model generated is too simple to produce significant and reliable results.Experts in the field know that classification is all about finding the trade-off between overfitting and underfitting. Indeed, the model needs to derive general rules from a specific training set. This clearly leads to a major problem: if the data used to train the model are biased, the model will produce a biased result.A famous case showing the consequence of biased data is the mislabelling of two African-American young guys. Google Photos, which had recently implemented an automatic image labelling, classified the two teenagers as “gorillas” (all the references are reported at the end of the page). Google was heavily criticized, and someone starting to wonder whether a machine could be trained to be racist on purpose.The Google team immediately apologized and a spokesperson tweeted: “ Until recently, [Google Photos] was confusing white faces with dogs and seals. Machine learning is hard”.The actual reason for the misclassification is not due to racism at all, though. The cause of this error lies in the training set.Superman, criminality and racismIn order to understand what we’ve just discussed, let’s see a simple example of misclassification.Suppose we want to predict whether Clark Kent is a criminal or not. Here the dataset we have:Dataset containing 5 elementsOur training set represents 5 people, belonging to three different races: Kryptonian, Human and Robot.We are going to train a Decision Tree classifier to predict if Clark Kent, who’s a 31 Kryptonian Male guy, would be classified as Criminal or not.First, we train the model:clf = tree.DecisionTreeClassifier()X_train = data[['Sex', 'Age', 'Race']]Y_train = data[['Criminal']]clf.fit(X_train, Y_train)Then, we predict the category “Criminal” based on the trained model:# 1 -> Male# 31 -> Age# 1 -> Kryptonianpred = clf.predict([[1, 31, 1]])print('Is Clark Kent a criminal? Prediction: ',pred[0])As we can see, Clark Kent is classified as Criminal. Let’s check the importance of the features, in order to understand how variables influence the final output of the classifier.Here it is. Based on the dataset that we used to train the model, the most important feature is the variable Race.Bias in Computer VisionThis simple example shows the importance of data collection and data organization. When these two actions are performed poorly, ethical and cultural biases can be encoded in the machine learning model. As reported by a great article from Nature (link at the end), 45% of the most used image database in computer vision comes from the United States. China and India, accounting for 36% of the world population, represents just 3% of data in the ImageNet dataset. This unbalance unintentionally creates a bias and explains why computer vision algorithms label a photograph of a North Indian bride as ‘performance art’.Joy Buolamwini, researcher at MIT, addressed the lack of diversity in the data used to train computer vision algorithms a few years ago. She noticed that, while the most famous facial recognition systems at MIT classified correctly the gender of almost every white person, the accuracy dropped drastically as skin shades got darker. The lowest accuracy was related to dark-skinned females, with an error rate of 34%.How Microsoft corrupted a bot in 24 hoursBias and errors do not only happen in Image classification tasks. Natural Language Processing is the field of Artificial Intelligence that focuses on human language processing. A common methodology shared by many NLP algorithms is mapping words to geometric vectors. This technique considers documents as a collection of vectors, allowing computations between words. Bolukbasi and colleagues, in their paper “Man is to Computer Programmer as Woman is to Homemaker? Debiasing Word Embeddings”, show how a simple algorithm for analogies, trained on Google News articles, exhibits female/male gender stereotypes. As they report, the model states that ‘man’ is to ‘doctor’ as ‘woman’ is to ‘nurse’.This reminds of a similar controversy: in 2016 Microsoft deployed TayTweets, a Twitter bot trained through casual conversations on Twitter. The idea was incredibly promising, due to the large amount of textual data available every second on Twitter. Anyway, needless to say, the agent started to tweet misogynistic and racist remarks in less than 24 hours. Who would have thought?Racist bots and where to find themTL;DRAnd finally, here we are at the end of our analysis. The whole point of this article is to raise an ethical issue related to AI that is often overlooked. While scientists, engineers and data scientists need to address the unbalance in training sets, users and non-experts need to understand that Artificial Intelligence is based on Mathematics. And Math, as we all know, can be extremely complex. Neural networks, used in Image classification, are considered ‘black boxes’. The results they give are based on extremely high dimensional computations and cannot be fully controlled — even if companies are making a huge effort to understand the intermediate outputs, with amazing results (check my article about Neural Transfer Style, based on this concept).Still, we have a last question to answer, which hopefully will be discussed in the comments below. Is AI racist?Thanks for reading. For any comments or suggestions don’t hesitate to leave a comment!You can find more about me and my projects at maurocomi.com. You can also find me on Linkedin, or email me directly. I am always up for a chat, or to collaborate on new amazing projects.References:Google Photos Tags Two African-Americans As Gorillas Through Facial Recognition SoftwareWhen Brooklyn-native Jacky Alcine logged onto Photos on Sunday evening, he was shocked to find an album titled…www.forbes.comAI can be sexist and racist - it's time to make it fairWhen Google Translate converts news articles written in Spanish into English, phrases referring to women often become…www.nature.comRacist, Sexist AI Could Be A Bigger Problem Than Lost JobsJoy Buolamwini was conducting research at MIT on how computers recognized people's faces, when she started experiencing…www.forbes.comhttps://www.theverge.com/2016/3/24/11297050/tay-microsoft-chatbot-racist",https://towardsdatascience.com/is-artificial-intelligence-racist-and-other-concerns-817fa60d75e9,2018-11-12T00:56:53.970Z,,,,,,,,817fa60d75e9,['Mauro Comi'],,,,,,,,,,,,,,
