URL link,Title,Date,Source,Source Link,description,keywords,og:description,twitter:description,@context,@type,name,logo,url,sameAs,itemListElement,publisher,headline,author,mainEntityOfPage,articleBody,datePublished,dateModified,image,article:section,article:summary,article text,articleSection,isAccessibleForFree,@graph,expires,location,email,potentialAction,genre,wordcount,foundingDate,founder,employee,inLanguage,thumbnailUrl,dateCreated,isPartOf,alternativeHeadline,alternateName,speakable,creator,isBasedOn,publishingPrinciples
https://news.google.com/rss/articles/CBMiXWh0dHBzOi8vd3d3LmlvdGZvcmFsbC5jb20vZW1vdGlvbmFsLWFpLWFyZS1hbGdvcml0aG1zLXNtYXJ0LWVub3VnaC10by1kZWNpcGhlci1odW1hbi1lbW90aW9uc9IBAA?oc=5,Emotional AI: Are Algorithms Smart Enough to Decipher Human Emotions? - IoT For All,2022-05-05,IoT For All,https://www.iotforall.com,"This article explains what emotional AI is, and how it works with text, audio, and video. Additionally, it illustrates how this technology is applied in different industries, such as healthcare and education. This piece also highlights the key factors that companies need to consider before deploying emotional AI.",N/A,"Emotional AI has many benefits, but its challenges should be addressed when considering potential applications at your organization.","Emotional AI has many benefits, but its challenges should be addressed when considering potential applications at your organization.",https://schema.org,BlogPosting,,,,,"[{'@type': 'ListItem', 'position': 1, 'item': {'@type': 'WebSite', '@id': 'https://www.iotforall.com/', 'name': 'Home'}}, {'@type': 'ListItem', 'position': 2, 'item': {'@type': 'WebPage', '@id': 'https://www.iotforall.com/category/technology', 'name': 'Technology'}}, {'@type': 'ListItem', 'position': 3, 'item': {'@type': 'WebPage', '@id': 'https://www.iotforall.com/category/technology/artificial-intelligence', 'name': 'Artificial Intelligence'}}]","{'@type': 'Organization', 'name': 'IoT For All', 'logo': {'@type': 'ImageObject', 'url': 'https://www.iotforall.com/wp-content/uploads/2017/08/For-Wordpress-2.png', 'height': 60, 'width': 122}}",Emotional AI: Are Algorithms Smart Enough to Decipher Human Emotions?,"{'@type': 'Person', 'name': 'Guest Writer'}","{'@type': 'WebPage', '@id': 'https://www.iotforall.com/emotional-ai-are-algorithms-smart-enough-to-decipher-human-emotions'}","&lt;!-- wp:paragraph --&gt; Nowadays, people prefer to carry their business online, and with the lack of face-to-face communication, it&#039;s hard for companies to understand what their employees and customers are feeling. In this situation, enhancing your operations with emotional AI that can distinguish different sentiments could be a game changer. But this brings up several questions about the potential of misuse of power: &lt;!-- /wp:paragraph --&gt;  &lt;!-- wp:paragraph --&gt; Is it acceptable for companies and government entities to survey people, detect their emotions, and take corresponding actions? And is artificial intelligence smart enough to read human emotions accurately? &lt;!-- /wp:paragraph --&gt;  &lt;!-- wp:paragraph --&gt; Despite these concerns, AI consulting firms are thriving as the global emotional AI market is expected to reach $173.81 billion by 2025, growing at a CAGR of 34.05% between 2019 and 2025.  Let’s take a look at what emotional artificial intelligence can do and what hurdles you can expect along the way should you decide to implement emotional AI at your organization? &lt;!-- /wp:paragraph --&gt;  &lt;!-- wp:heading --&gt; What is Emotional AI? &lt;!-- /wp:heading --&gt;  &lt;!-- wp:paragraph --&gt; Emotional AI, also referred to as affective computing and artificial emotional intelligence, is the branch of artificial intelligence that deals with processing and replicating human emotions. This technology dates back to 1995 and aims at making human-machine interactions more authentic and natural. Emotional AI can read people’s feelings through text, voice tone, facial expressions, and gestures and adjust its demeanor accordingly.  &lt;!-- /wp:paragraph --&gt;  &lt;!-- wp:paragraph --&gt; People have the upper hand in recognizing different emotions, but AI is catching up with its ability to analyze large volumes of data. Emotional AI employs computer vision, speech science, and deep learning algorithms, among other techniques. It can listen to human speech and detect voice inflections that correspond to anger, stress, etc. The technology can spot facial micro-expressions that disappear so rapidly, the human eye wouldn’t be able to catch them.  &lt;!-- /wp:paragraph --&gt;  &lt;!-- wp:paragraph --&gt; Let’s look at three main types of emotional artificial intelligence: &lt;!-- /wp:paragraph --&gt;  &lt;!-- wp:heading {&quot;level&quot;:3} --&gt; #1: Text  &lt;!-- /wp:heading --&gt;  &lt;!-- wp:paragraph --&gt; Extracting emotions from text is also called sentiment analysis or opinion mining. It uses natural language processing and machine learning emotion detection on text samples to determine whether the prevailing sentiment is positive, negative, or neutral. One common application is sifting through reviews of a hotel or a restaurant to understand what customers feel about it. &lt;!-- /wp:paragraph --&gt;  &lt;!-- wp:paragraph --&gt; When looking into sentiments, it is crucial to understand what exactly elicits negative or positive feelings. Seeing negative sentiments towards a particular restaurant doesn’t give the owners actionable tips. They need to understand what exactly went wrong. Was it food or the service, or the lighting, etc. &lt;!-- /wp:paragraph --&gt;  &lt;!-- wp:paragraph --&gt; Clarabridge, an AI-driven text and speech analysis company, performs sentiment analysis and can extract emotions, such as happiness and sadness, and evaluate them on a scale of -10 to 10, reflecting the intensity of the exhibited feeling. For example, “I’m angry” would be less intense than “I’m furious.”   &lt;!-- /wp:paragraph --&gt;  &lt;!-- wp:paragraph --&gt; Difficulties &lt;!-- /wp:paragraph --&gt;  &lt;!-- wp:paragraph --&gt; Often, the sentiment hidden in words depends on the context. One word can have different emotions attached to it. For example, describing a phone as “thin” is positive, while the same characteristic of bedsheets in a hotel room would hold a negative sentiment. &lt;!-- /wp:paragraph --&gt;  &lt;!-- wp:paragraph --&gt; Tip to Implement &lt;!-- /wp:paragraph --&gt;  &lt;!-- wp:paragraph --&gt; There are existing pre-trained models that you can deploy, but it’s strongly recommended to go the extra mile and train those algorithms on a dataset that is specific to your application area. As a result, you will have a customized version with the desired accuracy. &lt;!-- /wp:paragraph --&gt;  &lt;!-- wp:heading {&quot;level&quot;:3} --&gt; #2: Audio &lt;!-- /wp:heading --&gt;  &lt;!-- wp:paragraph --&gt; Emotional AI analyzes a person’s speech through various factors, including intonation, voice tone, vocal pitch, speed, and elongated pauses to determine their sentiment. This technology can detect hidden agitation even if someone uses their dry sense of humor and says the opposite of what they actually mean.  &lt;!-- /wp:paragraph --&gt;  &lt;!-- wp:paragraph --&gt; Advanced techniques can work with sarcasm, hyperbole, and other linguistic habits. One of the main applications of voice emotional artificial intelligence is to spot disappointed customers in call centers and redirect them to someone who can smooth their feelings.   &lt;!-- /wp:paragraph --&gt;  &lt;!-- wp:paragraph --&gt; California-based Behavioral Signals developed an emotional AI-powered solution for call centers. It matches agents to clients and finds the best representative to serve a particular customer. The tool operates solely based on vocal information and ignores conversations’ contents.  &lt;!-- /wp:paragraph --&gt;  &lt;!-- wp:paragraph --&gt; Difficulties &lt;!-- /wp:paragraph --&gt;  &lt;!-- wp:paragraph --&gt; It is not always easy to differentiate between anger and excitement, as they are both expressed with a high-pitch tone. We can overcome this by using training data of 20-50 hours of conversation to identify the baseline.  &lt;!-- /wp:paragraph --&gt;  &lt;!-- wp:paragraph --&gt; One example of thorough training is the Thai Speech Emotion Recognition Model developed by Chulalongkorn University. For the training dataset, researchers asked 200 male and female actors to perform a speech pattern of five emotions: happiness, sadness, anger, frustration, and a regular tone in the form of monologues and dialogues. A team of directors monitored the performances and helped actors deliver realistic speeches.  &lt;!-- /wp:paragraph --&gt;  &lt;!-- wp:paragraph --&gt; Tip to Implement &lt;!-- /wp:paragraph --&gt;  &lt;!-- wp:paragraph --&gt; Ensure your training datasets are representative of the cultures, dialects, and habits of the target population. When you purchase ready-made emotional AI algorithms, make sure the vendor considers your audience and is open to recalibrating their tool to fit your needs.  &lt;!-- /wp:paragraph --&gt;  &lt;!-- wp:heading {&quot;level&quot;:3} --&gt; #3: Video  &lt;!-- /wp:heading --&gt;  &lt;!-- wp:paragraph --&gt; AI facial emotion recognition can analyze facial expressions in videos to gauge the prevailing sentiment with the help of such technologies as facial recognition and computer vision. It can help detect the difference between lying and telling the truth.  &lt;!-- /wp:paragraph --&gt;  &lt;!-- wp:paragraph --&gt; This emotional artificial intelligence type can be used in interview settings to detect whether candidates are nervous, confident, genuine, etc. Financial institutions can potentially use it to examine loan applicants.   &lt;!-- /wp:paragraph --&gt;  &lt;!-- wp:paragraph --&gt; Difficulties &lt;!-- /wp:paragraph --&gt;  &lt;!-- wp:paragraph --&gt; It is challenging to get a clear picture of people’s faces when they are moving, as the lighting and the background change, not to mention the fact that people keep altering their appearances by tanning, growing facial hair, etc. Also, some people are less expressive than others, making it harder to spot any emotional signals.  &lt;!-- /wp:paragraph --&gt;  &lt;!-- wp:paragraph --&gt; Tip to Implement &lt;!-- /wp:paragraph --&gt;  &lt;!-- wp:paragraph --&gt; Many AI emotion detection video applications focus on group responses. For instance, in marketing, this technology is applied to observe people’s reactions to different advertisement campaigns. Instead of focusing on individual users, marketers capture all this data and average it.  &lt;!-- /wp:paragraph --&gt;  &lt;!-- wp:paragraph --&gt; However, if you want to see every individual reaction in the context of your use case, it’s a good practice to customize your model and train it on specific users. &lt;!-- /wp:paragraph --&gt;  &lt;!-- wp:heading --&gt; Emotional AI in Three different industries &lt;!-- /wp:heading --&gt;  &lt;!-- wp:heading {&quot;level&quot;:3} --&gt; #1: Marketing and Advertising  &lt;!-- /wp:heading --&gt;  &lt;!-- wp:paragraph --&gt; AI emotion recognition algorithms help marketers understand which ads resonate better with the target audience and what features they should include in their videos to yield a better outcome.   &lt;!-- /wp:paragraph --&gt;  &lt;!-- wp:paragraph --&gt; One example comes from Affectiva, an emotional AI company based in Boston. It developed a solution that helps marketers gauge customers’ reactions to different advertisements. With users’ permission, the tool analyses their facial expressions, body language, and speech to understand their emotional state. Affectiva’s AI model was trained on a diverse dataset including 6 million faces from 87 countries and can achieve an accuracy of 90%.  &lt;!-- /wp:paragraph --&gt;  &lt;!-- wp:heading {&quot;level&quot;:3} --&gt; #2: Healthcare &lt;!-- /wp:heading --&gt;  &lt;!-- wp:paragraph --&gt; The healthcare sector deploys emotional support AI to help both doctors and patients. For medical personnel, this technology is paired with voice assistants to detect stress levels and respond appropriately. For patients, it is used to monitor their emotions in examination rooms and during surgical procedures.  &lt;!-- /wp:paragraph --&gt;  &lt;!-- wp:paragraph --&gt; Additionally, AI-enhanced solutions can be deployed to measure people’s vitals. For example, the American Heart Association used emotional AI models to build an application that measured blood pressure from short videos instead of using the armband. This solution is believed to have an accuracy of approximately 95%. &lt;!-- /wp:paragraph --&gt;  &lt;!-- wp:heading {&quot;level&quot;:3} --&gt; #3: Customer Service  &lt;!-- /wp:heading --&gt;  &lt;!-- wp:paragraph --&gt; Companies deploy emotional recognition AI at their call centers to enhance customer service. Such solutions have many benefits. They can pick the best fitting agent for a specific client, give real-time feedback to agents and notify them when they start to lose control, and respond in kind to a frustrated customer. Artificial intelligence algorithms can also analyze incoming support tickets and identify clients on the verge of cutting ties with the company.  &lt;!-- /wp:paragraph --&gt;  &lt;!-- wp:paragraph --&gt; An American insurance corporation, MetLife, deployed Cogito’s emotional AI coaching solution in ten of its call centers. This solution could understand customers’ emotional states and provide agents with conversation and conflict resolution tips in real time. As the result, MetLife witnessed 17% reduction in call duration and 6.3% improvement in issue resolution. &lt;!-- /wp:paragraph --&gt;  &lt;!-- wp:heading --&gt; Barriers to Expect &lt;!-- /wp:heading --&gt;  &lt;!-- wp:heading {&quot;level&quot;:3} --&gt; Emotions Are Expressed Differently  &lt;!-- /wp:heading --&gt;  &lt;!-- wp:paragraph --&gt; There is no standardization on how people express emotions. Anthropology research shows that different culture representatives vary in the way they express their feelings. For example, in Japan, a smile is a sign of politeness, and it doesn’t exclude the fact that a smiling person can be in great distress. So, if a Japanese tourist needs assistance somewhere in Europe, emotional AI might give them a low score on urgency just because of the smile.  &lt;!-- /wp:paragraph --&gt;  &lt;!-- wp:paragraph --&gt; Additionally, the Association for Psychological Science concluded there is no scientific support for the fact that people’s emotions can be accurately deduced from their faces.  &lt;!-- /wp:paragraph --&gt;  &lt;!-- wp:heading {&quot;level&quot;:3} --&gt; Bias &lt;!-- /wp:heading --&gt;  &lt;!-- wp:paragraph --&gt; Facial recognition technologies generally struggle with racial bias. Google once mistakenly tagged black faces as “gorilla”, cameras identified Asian people as “blinking”, and not long ago, an emotional AI algorithm ranked black people as “angrier” than their white counterparts.  &lt;!-- /wp:paragraph --&gt;  &lt;!-- wp:paragraph --&gt; Moreover, studies revealed there is bias against elderly people. As our faces age, it becomes harder to identify different emotions, and the technology can penalize corresponding population groups. If, for instance, insurance companies would want to use emotional AI to identify driver’s fatigue based on facial expressions, older drivers will be more likely to match the criteria even when they don’t experience any physical symptoms. As a result, insurance companies will demand older drivers to pay larger premiums. &lt;!-- /wp:paragraph --&gt;  &lt;!-- wp:heading {&quot;level&quot;:3} --&gt; Privacy Compromised  &lt;!-- /wp:heading --&gt;  &lt;!-- wp:paragraph --&gt; Do people agree to be monitored and to have their emotions (mis)interpreted? If someone has written that they feel suicidal on social media, do they consent for health insurers to get hold of this information and react? &lt;!-- /wp:paragraph --&gt;  &lt;!-- wp:paragraph --&gt; ImageNet, one of the most extensive datasets used to train facial detection and recognition algorithms, was forced to blur faces on 1.5 million pictures in response to privacy rights. “We are concerned about the issue of privacy”, reported Olga Russakovsky, Assistant Professor at Princeton University and one of ImageNet managers. Even though they improved on privacy, the research team is wondering how training on faceless data will affect algorithms’ performance in the real world. &lt;!-- /wp:paragraph --&gt;  &lt;!-- wp:heading --&gt; The Final Verdict &lt;!-- /wp:heading --&gt;  &lt;!-- wp:paragraph --&gt; There is still a lot of controversy around AI emotions. So, even if the technology can get accurate readings on what we feel, do we want such intimate surveillance in our life? &lt;!-- /wp:paragraph --&gt;  &lt;!-- wp:paragraph --&gt; Deborah Raji, an AI researcher, explained in her interview with MIT Technology Review how these algorithms can hurt people. Here is what she said, “One way is by not working: by virtue of having higher error rates for people of color, it puts them at greater risk. The second situation is when it does work — where you have the perfect facial recognition system, but it’s easily weaponized against communities to harass them.” &lt;!-- /wp:paragraph --&gt;  &lt;!-- wp:paragraph --&gt; Emotional AI has its benefits. But we should be careful when considering potential applications. Maybe it doesn’t make much sense now to involve this technology in life-altering situations. Rana Gujral, CEO of Behavioral Signals, reports that her company was approached with a request to apply their intent model to immigration. Behavioral Signals declined. &lt;!-- /wp:paragraph --&gt;  &lt;!-- wp:paragraph --&gt; But the question remains: is it correct to penalize people for their feelings? Is it acceptable that job candidates are judged on how their voice sounds and students are punished because their faces look angry? &lt;!-- /wp:paragraph --&gt;",2022-05-05T10:00:00,2022-04-28T10:14:05,"{'@type': 'ImageObject', 'url': 'https://www.iotforall.com/wp-content/uploads/2022/05/Emotional-AI-2.jpg', 'height': 1200, 'width': 1600}",N/A,N/A,"


Emotional AI: Are Algorithms Smart Enough to Decipher Human Emotions? 

Nadejda Alkhaldi -
May 5, 2022





Illustration: © IoT For All























People prefer to carry their business online today, and with the lack of face-to-face communication, it’s hard for companies to understand what their employees and customers are feeling. In this situation, enhancing your operations with emotional AI that can distinguish different sentiments could be a game-changer. But this brings up several questions about the potential for misuse of power:
Is it acceptable for companies and government entities to survey people, detect their emotions, and take corresponding actions? And is artificial intelligence smart enough to read human emotions accurately?
'There is still a lot of controversy around AI emotions. Emotional AI has its benefits, but you should be aware of the challenges when considering potential applications at your organization.' - Nadejda AlkhaldiClick To Tweet
Despite these concerns, AI consulting firms are thriving as the global emotional AI market is expected to reach $173.81 billion by 2025, growing at a CAGR of 34.05 percent between 2019 and 2025.  Let’s take a look at what emotional artificial intelligence can do and what hurdles you can expect along the way should you decide to implement emotional AI in your organization.
What is Emotional AI?
Emotional AI, also referred to as affective computing and artificial emotional intelligence, is the branch of artificial intelligence that deals with processing and replicating human emotions. This technology dates back to 1995 and aims at making human-machine interactions more authentic and natural. Emotional AI can read people’s feelings through text, voice tone, facial expressions, and gestures and adjust its demeanor accordingly. 
People have the upper hand in recognizing different emotions, but AI is catching up with its ability to analyze large volumes of data. Emotional AI employs computer vision, speech science, and deep learning algorithms, among other techniques. It can listen to human speech and detect voice inflections that correspond to anger, stress, etc. The technology can spot facial micro-expressions that disappear so rapidly that the human eye wouldn’t be able to catch them. 
Let’s look at three main types of emotional artificial intelligence.
#1: Text 
Extracting emotions from text is also called sentiment analysis or opinion mining. It uses natural language processing and machine learning emotion detection on text samples to determine whether the prevailing sentiment is positive, negative, or neutral. One common application is sifting through reviews of a hotel or a restaurant to understand what customers feel about it.
When looking into sentiments, it is crucial to understand what exactly elicits negative or positive feelings. Seeing negative sentiments towards a particular restaurant doesn’t give the owners actionable tips. They need to understand what exactly went wrong, whether it be the food, service, or the lighting.
Clarabridge, an AI-driven text and speech analysis company, performs sentiment analysis and can extract emotions, such as happiness and sadness, and evaluate them on a scale of -10 to 10, reflecting the intensity of the exhibited feeling. For example, “I’m angry” would be less intense than “I’m furious.”  
Challenges
Often, the sentiment hidden in words depends on the context. One word can have different emotions attached to it. For example, describing a phone as “thin” is positive, while the same characteristic of bedsheets in a hotel room would hold a negative sentiment.
Tip to Implement
There are existing pre-trained models that you can deploy, but it’s strongly recommended to go the extra mile and train those algorithms on a dataset that is specific to your application area. As a result, you will have a customized version with the desired accuracy.
#2: Audio
Emotional AI analyzes a person’s speech through various factors, including intonation, voice tone, vocal pitch, speed, and elongated pauses to determine their sentiment. This technology can detect hidden agitation even if someone uses their dry sense of humor and says the opposite of what they actually mean. 
Advanced techniques can work with sarcasm, hyperbole, and other linguistic habits. One of the main applications of voice emotional artificial intelligence is to spot disappointed customers in call centers and redirect them to someone who can smooth their feelings.  
California-based Behavioral Signals developed an emotional AI-powered solution for call centers. It matches agents to clients and finds the best representative to serve a particular customer. The tool operates solely based on vocal information and ignores conversations’ contents. 
Challenges
It is not always easy to differentiate between anger and excitement, as they are both expressed with a high-pitch tone. We can overcome this by using training data of 20-50 hours of conversation to identify the baseline. 
One example of thorough training is the Thai Speech Emotion Recognition Model developed by Chulalongkorn University. For the training dataset, researchers asked 200 male and female actors to perform a speech pattern of five emotions: happiness, sadness, anger, frustration, and a regular tone in the form of monologues and dialogues. A team of directors monitored the performances and helped actors deliver realistic speeches. 
Tip to Implement
Ensure your training datasets are representative of the cultures, dialects, and habits of the target population. When you purchase ready-made emotional AI algorithms, make sure the vendor considers your audience and is open to recalibrating their tool to fit your needs. 
#3: Video 
AI facial emotion recognition can analyze facial expressions in videos to gauge the prevailing sentiment with the help of such technologies as facial recognition and computer vision. It can help detect the difference between lying and telling the truth. 
This emotional artificial intelligence type can be used in interview settings to detect whether candidates are nervous, confident, genuine, etc. Financial institutions can potentially use it to examine loan applicants.  
Challenges
It is challenging to get a clear picture of people’s faces when they are moving, as the lighting and the background change, not to mention the fact that people keep altering their appearances by tanning, growing facial hair, etc. Also, some people are less expressive than others, making it harder to spot any emotional signals. 
Tip to Implement
Many AI emotion detection video applications focus on group responses. For instance, in marketing, this technology is applied to observe people’s reactions to different advertisement campaigns. Instead of focusing on individual users, marketers capture all this data and average it. 
However, if you want to see every individual reaction in the context of your use case, it’s a good practice to customize your model and train it on specific users.
Emotional AI in Three Different Industries
#1: Marketing and Advertising 
AI emotion recognition algorithms help marketers understand which ads resonate better with the target audience and what features they should include in their videos to yield a better outcome.  
One example comes from Affectiva, an emotional AI company based in Boston. It developed a solution that helps marketers gauge customers’ reactions to different advertisements. With users’ permission, the tool analyses their facial expressions, body language, and speech to understand their emotional state. Affectiva’s AI model was trained on a diverse dataset including 6 million faces from 87 countries and can achieve an accuracy of 90 percent. 
#2: Healthcare
The healthcare sector deploys emotional support AI to help both doctors and patients. For medical personnel, this technology is paired with voice assistants to detect stress levels and respond appropriately. For patients, it is used to monitor their emotions in examination rooms and during surgical procedures. 
Additionally, AI-enhanced solutions can be deployed to measure people’s vitals. For example, the American Heart Association used emotional AI models to build an application that measured blood pressure from short videos instead of using the armband. This solution is believed to have an accuracy of approximately 95 percent.
#3: Customer Service 
Companies deploy emotional recognition AI at their call centers to enhance customer service. Such solutions have many benefits. They can pick the best fitting agent for a specific client, give real-time feedback to agents and notify them when they start to lose control, and respond in kind to a frustrated customer. Artificial intelligence algorithms can also analyze incoming support tickets and identify clients on the verge of cutting ties with the company. 
An American insurance corporation, MetLife, deployed Cogito’s emotional AI coaching solution in ten of its call centers. This solution could understand customers’ emotional states and provide agents with conversation and conflict resolution tips in real time. As the result, MetLife witnessed 17 percent reduction in call duration and 6.3 percentimprovement in issue resolution.
Barriers to Expect
Emotions Are Expressed Differently 
There is no standardization on how people express emotions. For example, in Japan, a smile is a sign of politeness, and it doesn’t exclude the fact that a smiling person can be in great distress. So, if a Japanese tourist needs assistance somewhere in Europe, emotional AI might give them a low score on urgency just because of the smile. 
Bias
Facial recognition technologies generally struggle with racial bias. Google once mistakenly tagged black faces as “gorilla”, cameras identified Asian people as “blinking”, and not long ago, an emotional AI algorithm ranked black people as “angrier” than their white counterparts. 
Moreover, studies revealed there is bias against elderly people. As our faces age, it becomes harder to identify different emotions, and the technology can penalize corresponding population groups. If, for instance, insurance companies would want to use emotional AI to identify drivers’ fatigue based on facial expressions, older drivers will be more likely to match the criteria even when they don’t experience any physical symptoms. As a result, insurance companies will demand older drivers pay larger premiums.
Privacy
Do people agree to be monitored and to have their emotions (mis)interpreted? ImageNet, one of the most extensive datasets used to train facial detection and recognition algorithms, was forced to blur faces on 1.5 million pictures in response to privacy rights. Even though they improved on privacy, the research team is wondering how training on faceless data will affect algorithms’ performance in the real world.
The Final Verdict
There is still a lot of controversy around AI emotions. Emotional AI has its benefits, but we should be careful when considering potential applications. Maybe it doesn’t make much sense now to involve this technology in life-altering situations. 
But the question remains: Is it right to penalize people for their feelings? Is it acceptable that job candidates are judged on how their voice sounds and students are punished because their faces look angry? All of these concerns will have to be taken into consideration before implementing emotional AI into your organization.
TweetShareShareEmail
Artificial IntelligenceInternet of Things
























Artificial IntelligenceInternet of Things






Author


Nadejda Alkhaldi - Innovation Analyst, ITRex Group office



Contributors






Guest Writer
Guest writers are IoT experts and enthusiasts interested in sharing their insights with the IoT industry through IoT For All.








Guest writers are IoT experts and enthusiasts interested in sharing their insights with the IoT industry through IoT For All.










",,,"[{'@type': 'WebPage', '@id': 'https://www.iotforall.com/emotional-ai-are-algorithms-smart-enough-to-decipher-human-emotions', 'url': 'https://www.iotforall.com/emotional-ai-are-algorithms-smart-enough-to-decipher-human-emotions', 'name': 'Emotional AI: Are Algorithms Smart Enough to Decipher Human Emotions?', 'isPartOf': {'@id': 'https://www.iotforall.com/#website'}, 'primaryImageOfPage': {'@id': 'https://www.iotforall.com/emotional-ai-are-algorithms-smart-enough-to-decipher-human-emotions#primaryimage'}, 'image': {'@id': 'https://www.iotforall.com/emotional-ai-are-algorithms-smart-enough-to-decipher-human-emotions#primaryimage'}, 'thumbnailUrl': 'https://www.iotforall.com/wp-content/uploads/2022/05/Emotional-AI-2.jpg', 'datePublished': '2022-05-05T14:00:00+00:00', 'dateModified': '2022-05-04T22:27:44+00:00', 'author': {'@id': 'https://www.iotforall.com/#/schema/person/76a4aa50cdef1515bc657e4edfda831a'}, 'description': 'Emotional AI has many benefits, but its challenges should be addressed when considering potential applications at your organization.', 'breadcrumb': {'@id': 'https://www.iotforall.com/emotional-ai-are-algorithms-smart-enough-to-decipher-human-emotions#breadcrumb'}, 'inLanguage': 'en-US', 'potentialAction': [{'@type': 'ReadAction', 'target': ['https://www.iotforall.com/emotional-ai-are-algorithms-smart-enough-to-decipher-human-emotions']}]}, {'@type': 'ImageObject', 'inLanguage': 'en-US', '@id': 'https://www.iotforall.com/emotional-ai-are-algorithms-smart-enough-to-decipher-human-emotions#primaryimage', 'url': 'https://www.iotforall.com/wp-content/uploads/2022/05/Emotional-AI-2.jpg', 'contentUrl': 'https://www.iotforall.com/wp-content/uploads/2022/05/Emotional-AI-2.jpg', 'width': 1600, 'height': 1200, 'caption': 'Illustration: © IoT For All'}, {'@type': 'BreadcrumbList', '@id': 'https://www.iotforall.com/emotional-ai-are-algorithms-smart-enough-to-decipher-human-emotions#breadcrumb', 'itemListElement': [{'@type': 'ListItem', 'position': 1, 'name': 'Home', 'item': 'https://www.iotforall.com/'}, {'@type': 'ListItem', 'position': 2, 'name': 'Emotional AI: Are Algorithms Smart Enough to Decipher Human Emotions?'}]}, {'@type': 'WebSite', '@id': 'https://www.iotforall.com/#website', 'url': 'https://www.iotforall.com/', 'name': 'IoT For All', 'description': 'The best content, news, and resources for IoT', 'potentialAction': [{'@type': 'SearchAction', 'target': {'@type': 'EntryPoint', 'urlTemplate': 'https://www.iotforall.com/?s={search_term_string}'}, 'query-input': 'required name=search_term_string'}], 'inLanguage': 'en-US'}, {'@type': 'Person', '@id': 'https://www.iotforall.com/#/schema/person/76a4aa50cdef1515bc657e4edfda831a', 'name': 'Guest Writer', 'image': {'@type': 'ImageObject', 'inLanguage': 'en-US', '@id': 'https://www.iotforall.com/#/schema/person/image/84598ea10dfbe1fba852ca03870919bf', 'url': 'https://www.iotforall.com/wp-content/uploads/2017/05/IoT-For-All-Logo-150x150.png', 'contentUrl': 'https://www.iotforall.com/wp-content/uploads/2017/05/IoT-For-All-Logo-150x150.png', 'caption': 'Guest Writer'}, 'description': 'Guest writers are IoT experts and enthusiasts interested in sharing their insights with the IoT industry through IoT For All.', 'sameAs': ['https://www.iotforall.com/contribute/guest-submission/', 'https://www.linkedin.com/iot4all', 'https://x.com/https://twitter.com/iotforall'], 'url': 'https://www.iotforall.com/author/guestwriter'}]",,,,,,,,,,,,,,,,,,,
