URL link,Title,Date,Source,Source Link,description,keywords,og:description,twitter:description,@context,@type,url,image,author,publisher,headline,datePublished,dateModified,articleSection,name,isAccessibleForFree,itemListElement,article:section,article:summary,article text,articleBody,isBasedOn,thumbnailUrl,isPartOf,alternativeHeadline,mainEntityOfPage,uploadDate,contentUrl,@graph,dateCreated,copyrightYear,sourceOrganization,copyrightHolder,creator,@id,duration,logo,sameAs
https://news.google.com/rss/articles/CBMiXGh0dHBzOi8vd3d3LmZvcmJlcy5jb20vc2l0ZXMvY29nbml0aXZld29ybGQvMjAxOS8wMi8yNS9hcnRpZmljaWFsLWludGVsbGlnZW5jZS1oeXBlLWlzLXJlYWwv0gEA?oc=5,Artificial Intelligence Hype Is Real - Forbes,2019-02-25,Forbes,https://www.forbes.com,"The story of Artificial Intelligence hype has a considerable business history in 2019. AI is increasingly being absorbed into just about every business sector. Once an investment in the future, it is now an optimization of machine learning in the present.",,"The story of Artificial Intelligence hype has a considerable business history in 2019. AI is increasingly being absorbed into just about every business sector. Once an investment in the future, it is now an optimization of machine learning in the present.","The story of Artificial Intelligence hype has a considerable business history in 2019. AI is increasingly being absorbed into just about every business sector. Once an investment in the future, it is now an optimization of machine learning in the present.",http://schema.org,BreadcrumbList,https://www.forbes.com/sites/cognitiveworld/2019/02/25/artificial-intelligence-hype-is-real/,"{'@type': 'ImageObject', 'url': 'https://imageio.forbes.com/blogs-images/cognitiveworld/files/2019/02/Depositphotos_83472010_l-2015-1200x1023.jpg?format=jpg&height=900&width=1600&fit=bounds', 'width': 542.79, 'height': 304.6}","{'@type': 'Person', 'name': 'Michael Spencer', 'url': 'https://www.forbes.com/sites/cognitiveworld/people/michaelspencer1/', 'description': 'Michael Spencer is a prolific futurist referred to as the original business insider with over 800 articles on LinkedIn and writing daily on Medium, where he is a top writer in 20+ tags. He is a content consultant for startups involved in robotics, AI, blockchain and IoT. Michael is founder and editor of FutureSin, a Medium publication that explores aspects of technology and society related to artificial intelligence, China, transhumanism and the future of work. Based in Montreal, a significant academic hub for AI, he enjoys writing about actual business trends related to AI.', 'sameAs': ['https://www.linkedin.com/in/michaelkspencer/', 'https://www.twitter.com/https://twitter.com/Mike_K_Spencer', 'https://medium.com/@Michael_Spencer']}","{'@type': 'NewsMediaOrganization', 'name': 'Forbes', 'url': 'https://www.forbes.com/', 'ethicsPolicy': 'https://www.forbes.com/sites/forbesstaff/article/forbes-editorial-values-and-standards/', 'logo': 'https://imageio.forbes.com/i-forbesimg/media/amp/images/forbes-logo-dark.png?format=png&height=455&width=650&fit=bounds'}",Artificial Intelligence Hype Is Real,2019-02-25T08:21:00-05:00,2019-02-25T08:22:28-05:00,AI & Big Data,Artificial Intelligence Hype Is Real,False,"[{'@type': 'ListItem', 'position': 1, 'name': 'Forbes Homepage', 'item': 'https://www.forbes.com/'}, {'@type': 'ListItem', 'position': 2, 'name': 'Innovation', 'item': 'https://www.forbes.com/innovation/'}, {'@type': 'ListItem', 'position': 3, 'name': 'AI', 'item': 'https://www.forbes.com/ai/'}]",AI & Big Data,N/A,"More From ForbesJun 17, 2024,04:42am EDTProtecting Human Rights In The Age Of Intelligent MachinesApr 24, 2024,05:00am EDTWhat AI Can Tell Us About OzempicFeb 22, 2024,03:42am ESTUnlocking The Power Of Social Data For Clinical Trial DesignJan 25, 2024,04:55am ESTCPG Product Innovation Should Be A Science, Not An ArtAug 7, 2023,08:57am EDTListening Before We Talk: Why Social Data Is Key To Successful NPD In 2023Mar 28, 2023,10:07am EDTHow Technology Is Empowering CPGs To Do More With LessFeb 21, 2023,05:24am ESTAre Humans And Collaboration Still At The Heart Of Innovation?Edit StoryForbesInnovationAIArtificial Intelligence Hype Is RealMichael SpencerContributorCOGNITIVE WORLDContributor GroupOpinions expressed by Forbes Contributors are their own.FollowingFollowClick to save this article.You'll be asked to sign into your Forbes account.Got itFeb 25, 2019,08:21am ESTUpdated Feb 25, 2019, 08:22am ESTThis article is more than 5 years old.Share to FacebookShare to TwitterShare to Linkedin








 The story of Artificial Intelligence hype has a considerable business history in 2019. AI is increasingly being absorbed into just about every business sector. Once an investment in the future, it is now an optimization of machine learning in the present. What was once a buzzword for an unspecified time carries with it now the hype of the future that is quickly becoming very much the here and now.
 Many people don’t know the extent to which Artificial Intelligence is changing the workforce and how it has been an integral part of the history of R&D at companies such as Microsoft. In fact, quite incredibly in 2019 it’s Microsoft that leads the AI patent race. 









PROMOTED

There have been over 154,000 AI patents filed worldwide since 2010 
The survey from IFI Claims Patent Services shows a strong uptick in the patent category covering AI, machine learning and neural networks.
Between 2013 and 2018, the category grew by 34% annually.










DailyDozen
US


Forbes Daily: Join over 1 million Forbes Daily subscribers and get our best stories, exclusive reporting and essential analysis of the day’s news in your inbox every weekday.




                Sign Up
            


By signing up, you agree to receive this newsletter, other updates about Forbes and its affiliates’ offerings, our Terms of Service (including resolving disputes on an individual basis via arbitration), and you acknowledge our Privacy Statement. Forbes is protected by reCAPTCHA, and the Google Privacy Policy and Terms of Service apply.




You’re all set! Enjoy the Daily!


                More Newsletters
            


You’re all set! Enjoy the Daily!

                More Newsletters
            



 Yet tech companies such as Microsoft and Google are also sounding the alarm on the potential dangers of AI in an era of deep fakes, facial recognition software with biases and many other applications with potential dangers. As of November last year, Microsoft though had filed 697 AI patents identified as important due to their ‘significant competitive advantage’. Out of the top 30 companies listed in the research, Microsoft filed 20% of all patents and is ranked number 1.  Microsoft’s approach to AI is rigorous and has a long history. 







Microsoft technical fellow Doug Burger with an AI-optimized Project Brainwave accelerator used in... [+] the company’s Azure data centers.
Microsoft


 Microsoft shows the AI Hype is Real  To seek the origins of Microsoft’s interest in artificial intelligence, we have to go back to when Bill Gates founded Microsoft’s research arm in 1991. It’s clear that AI was an area of investigation from the start that’s fast tracked the world we know today. Think about that for a moment, that’s nearly three decades ago. Indeed from the start, Microsoft Research (MSR for short) hired more than its fair share of computing’s most visionary, accomplished experts and academic talent in the domain. Yet in the last few years up to the present of 2019, AI-based marketing patents are the fastest growing global category, reaching a Compound Annual Growth Rate (CAGR) of 29.3% between 2010 and 2018. Machine learning dominates the AI patent landscape today, leading all categories of AI patents including deep learning and neural networks and Microsoft is among the leaders in the Cloud, cybersecurity and AI-based digital security patents. We are just five years into Satya Nadella’s tenure as Microsoft CEO and he has decidedly pivoted the company towards AI and the Cloud. Incredibly, today more than 1,000 computer scientists are in MSR’s employ, as well as at its Redmond headquarters in addition to such global locations such as Boston, Montreal, Beijing, Bangalore and beyond. You might say that the decade ahead, the 2020s, is the era when artificial intelligence will grow up and while to be sure Hollywood renditions of AI are extreme exaggerations of technology far beyond what we are capable of today, there’s a looming promise of AI’s impact on the global economy for years to come. Essentially AI is attributed to add 1.2% to annual GDP growth over the next decade. That’s an astounding figure, and one that proves that the hype might be justified.  Michael SpencerFollowingFollowMichael Spencer is a prolific futurist referred to as the original business insider with over 800 articles on LinkedIn and writing daily on Medium, where he is... Read MoreEditorial StandardsPrintReprints & Permissions",,,,,,,,,,,,,,,,,,
