URL link,Title,Date,Source,Source Link,description,keywords,og:description,twitter:description,@context,@graph,article:section,article:summary,article text,@type,url,headline,articleSection,datePublished,dateModified,image,thumbnailUrl,publisher,isAccessibleForFree,requiresSubscription,author,mainEntityOfPage,dateCreated,creator,metadata,itemListElement,articleBody,name,isPartOf,alternativeHeadline,location,logo,email,potentialAction
https://news.google.com/rss/articles/CBMiLmh0dHBzOi8vYmxvZ3MubnZpZGlhLmNvbS9ibG9nL3doYXQtaXMtZWRnZS1haS_SAQA?oc=5,What Is Edge AI and How Does It Work? - NVIDIA Blog,2022-02-17,NVIDIA Blog,https://blogs.nvidia.com,"Edge AI is the deployment of AI applications in devices throughout the physical world, so-named because the computation is done near the user at the edge of a network.",N/A,"Edge AI is the deployment of AI applications in devices throughout the physical world, so-named because the computation is done near the user at the edge of a network.",N/A,https://schema.org,"[{'@type': 'WebPage', '@id': 'https://blogs.nvidia.com/blog/what-is-edge-ai/', 'url': 'https://blogs.nvidia.com/blog/what-is-edge-ai/', 'name': 'What Is Edge AI and How Does It Work?\xa0| NVIDIA Blog', 'isPartOf': {'@id': 'https://blogs.nvidia.com/#website'}, 'primaryImageOfPage': {'@id': 'https://blogs.nvidia.com/blog/what-is-edge-ai/#primaryimage'}, 'image': {'@id': 'https://blogs.nvidia.com/blog/what-is-edge-ai/#primaryimage'}, 'thumbnailUrl': 'https://blogs.nvidia.com/wp-content/uploads/2022/02/edge-ai-scene.jpg', 'datePublished': '2022-02-17T16:30:10+00:00', 'dateModified': '2023-01-24T18:30:17+00:00', 'author': {'@id': 'https://blogs.nvidia.com/#/schema/person/7a1065f3e27e5d89fdd715ad9afdc711'}, 'description': 'Edge AI is the deployment of AI applications in devices throughout the physical world, so-named because the computation is done near the user at the edge of a network.', 'breadcrumb': {'@id': 'https://blogs.nvidia.com/blog/what-is-edge-ai/#breadcrumb'}, 'inLanguage': 'en-US', 'potentialAction': [{'@type': 'ReadAction', 'target': ['https://blogs.nvidia.com/blog/what-is-edge-ai/']}]}, {'@type': 'ImageObject', 'inLanguage': 'en-US', '@id': 'https://blogs.nvidia.com/blog/what-is-edge-ai/#primaryimage', 'url': 'https://blogs.nvidia.com/wp-content/uploads/2022/02/edge-ai-scene.jpg', 'contentUrl': 'https://blogs.nvidia.com/wp-content/uploads/2022/02/edge-ai-scene.jpg', 'width': 624, 'height': 375, 'caption': 'What is edge AI?'}, {'@type': 'BreadcrumbList', '@id': 'https://blogs.nvidia.com/blog/what-is-edge-ai/#breadcrumb', 'itemListElement': [{'@type': 'ListItem', 'position': 1, 'name': 'Home', 'item': 'https://blogs.nvidia.com/'}, {'@type': 'ListItem', 'position': 2, 'name': 'What Is Edge AI and How Does It Work?'}]}, {'@type': 'WebSite', '@id': 'https://blogs.nvidia.com/#website', 'url': 'https://blogs.nvidia.com/', 'name': 'NVIDIA Blog', 'description': '', 'potentialAction': [{'@type': 'SearchAction', 'target': {'@type': 'EntryPoint', 'urlTemplate': 'https://blogs.nvidia.com/?s={search_term_string}'}, 'query-input': 'required name=search_term_string'}], 'inLanguage': 'en-US'}, {'@type': 'Person', '@id': 'https://blogs.nvidia.com/#/schema/person/7a1065f3e27e5d89fdd715ad9afdc711', 'name': 'Tiffany Yeung', 'image': {'@type': 'ImageObject', 'inLanguage': 'en-US', '@id': 'https://blogs.nvidia.com/#/schema/person/image/eddd764888b9855ace87617fd1f08fb0', 'url': 'https://blogs.nvidia.com/wp-content/uploads/2021/10/tiffany-yeung-scaled-96x96.jpg', 'contentUrl': 'https://blogs.nvidia.com/wp-content/uploads/2021/10/tiffany-yeung-scaled-96x96.jpg', 'caption': 'Tiffany Yeung'}, 'description': 'Tiffany Yeung is a product marketing manager in edge and enterprise computing solutions at NVIDIA. Tiffany focuses on enabling hospitals, stores, warehouses, factories and more to innovate with NVIDIA’s edge solutions. Tiffany’s background is in entrepreneurship, and she has consulted for many Fortune 500 companies.', 'url': 'https://blogs.nvidia.com/blog/author/tiffanyyeung/'}]",N/A,N/A,"



What Is Edge AI and How Does It Work?

February 17, 2022 by Tiffany Yeung 










					Share			


 
 
 
 
Email0 


  Recent strides in the efficacy of AI, the adoption of IoT devices and the power of edge computing have come together to unlock the power of edge AI.
This has opened new opportunities for edge AI that were previously unimaginable — from helping radiologists identify pathologies in the hospital, to driving cars down the freeway, to helping us pollinate plants.
Countless analysts and businesses are talking about and implementing edge computing, which traces its origins to the 1990s, when content delivery networks were created to serve web and video content from edge servers deployed close to users.
Today, almost every business has job functions that can benefit from the adoption of edge AI. In fact, edge applications are driving the next wave of AI computing in ways that improve our lives at home, at work, in school and in transit.
Learn more about what edge AI is, its benefits and how it works, examples of edge AI use cases, and the relationship between edge computing and cloud computing.
What Is Edge AI? 
Edge AI is the deployment of AI applications in devices throughout the physical world. It’s called “edge AI” because the AI computation is done near the user at the edge of the network, close to where the data is located, rather than centrally in a cloud computing facility or private data center.
Since the internet has global reach, the edge of the network can connote any location. It can be a retail store, factory, hospital or devices all around us, like traffic lights, autonomous machines and phones.
Edge AI: Why Now? 
Organizations from every industry are looking to increase automation to improve processes, efficiency and safety.
To help them, computer programs need to recognize patterns and execute tasks repeatedly and safely. But the world is unstructured and the range of tasks that humans perform covers infinite circumstances that are impossible to fully describe in programs and rules.
Advances in edge AI have opened opportunities for machines and devices, wherever they may be, to operate with the “intelligence” of human cognition. AI-enabled smart applications learn to perform similar tasks under different circumstances, much like real life.
The efficacy of deploying AI models at the edge arises from three recent innovations.

Maturation of neural networks: Neural networks and related AI infrastructure have finally developed to the point of allowing for generalized machine learning. Organizations are learning how to successfully train AI models and deploy them in production at the edge.
Advances in compute infrastructure: Powerful distributed computational power is required to run AI at the edge. Recent advances in highly parallel GPUs have been adapted to execute neural networks.
Adoption of IoT devices: The widespread adoption of the Internet of Things has fueled the explosion of big data. With the sudden ability to collect data in every aspect of a business — from industrial sensors, smart cameras, robots and more — we now have the data and devices necessary to deploy AI models at the edge. Moreover, 5G is providing IoT a boost with faster, more stable and secure connectivity.

Why Deploy AI at the Edge? What Are the Benefits of Edge AI? 
Since AI algorithms are capable of understanding language, sights, sounds, smells, temperature, faces and other analog forms of unstructured information, they’re particularly useful in places occupied by end users with real-world problems. These AI applications would be impractical or even impossible to deploy in a centralized cloud or enterprise data center due to issues related to latency, bandwidth and privacy.
The benefits of edge AI include:

Intelligence: AI applications are more powerful and flexible than conventional applications that can respond only to inputs that the programmer had anticipated. In contrast, an AI neural network is not trained how to answer a specific question, but rather how to answer a particular type of question, even if the question itself is new. Without AI, applications couldn’t possibly process infinitely diverse inputs like texts, spoken words or video.
Real-time insights: Since edge technology analyzes data locally rather than in a faraway cloud delayed by long-distance communications, it responds to users’ needs in real time.
Reduced cost: By bringing processing power closer to the edge, applications need less internet bandwidth, greatly reducing networking costs.
Increased privacy: AI can analyze real-world information without ever exposing it to a human being, greatly increasing privacy for anyone whose appearance, voice, medical image or any other personal information needs to be analyzed. Edge AI further enhances privacy by containing that data locally, uploading only the analysis and insights to the cloud. Even if some of the data is uploaded for training purposes, it can be anonymized to protect user identities. By preserving privacy, edge AI simplifies the challenges associated with data regulatory compliance.
High availability: Decentralization and offline capabilities make edge AI more robust since internet access is not required for processing data. This results in higher availability and reliability for mission-critical, production-grade AI applications.
Persistent improvement: AI models grow increasingly accurate as they train on more data. When an edge AI application confronts data that it cannot accurately or confidently process, it typically uploads it so that the AI can retrain and learn from it. So the longer a model is in production at the edge, the more accurate the model will be.

How Does Edge AI Technology Work?
Lifecycle of an edge AI application.
For machines to see, perform object detection, drive cars, understand speech, speak, walk or otherwise emulate human skills, they need to functionally replicate human intelligence.
AI employs a data structure called a deep neural network to replicate human cognition. These DNNs are trained to answer specific types of questions by being shown many examples of that type of question along with correct answers.
This training process, known as “deep learning,” often runs in a data center or the cloud due to the vast amount of data required to train an accurate model, and the need for data scientists to collaborate on configuring the model. After training, the model graduates to become an “inference engine” that can answer real-world questions.
In edge AI deployments, the inference engine runs on some kind of computer or device in far-flung locations such as factories, hospitals, cars, satellites and homes. When the AI stumbles on a problem, the troublesome data is commonly uploaded to the cloud for further training of the original AI model, which at some point replaces the inference engine at the edge. This feedback loop plays a significant role in boosting model performance; once edge AI models are deployed, they only get smarter and smarter.
What Are Examples of Edge AI Use Cases? 
AI is the most powerful technology force of our time. We’re now at a time where AI is revolutionizing the world’s largest industries.
Across manufacturing, healthcare, financial services, transportation, energy and more, edge AI is driving new business outcomes in every sector, including:

Intelligent forecasting in energy: For critical industries such as energy, in which discontinuous supply can threaten the health and welfare of the general population, intelligent forecasting is key. Edge AI models help to combine historical data, weather patterns, grid health and other information to create complex simulations that inform more efficient generation, distribution and management of energy resources to customers.
Predictive maintenance in manufacturing: Sensor data can be used to detect anomalies early and predict when a machine will fail. Sensors on equipment scan for flaws and alert management if a machine needs a repair so the issue can be addressed early, avoiding costly downtime.
AI-powered instruments in healthcare: Modern medical instruments at the edge are becoming AI-enabled with devices that use ultra-low-latency streaming of surgical video to allow for minimally invasive surgeries and insights on demand.
Smart virtual assistants in retail: Retailers are looking to improve the digital customer experience by introducing voice ordering to replace text-based searches with voice commands. With voice ordering, shoppers can easily search for items, ask for product information and place online orders using smart speakers or other intelligent mobile devices.

What Role Does Cloud Computing Play in Edge Computing? 
AI applications can run in a data center like those in public clouds, or out in the field at the network’s edge, near the user. Cloud computing and edge computing each offer benefits that can be combined when deploying edge AI.
The cloud offers benefits related to infrastructure cost, scalability, high utilization, resilience from server failure, and collaboration. Edge computing offers faster response times, lower bandwidth costs and resilience from network failure.
There are several ways in which cloud computing can support an edge AI deployment:

The cloud can run the model during its training period.
The cloud continues to run the model as it is retrained with data that comes from the edge.
The cloud can run AI inference engines that supplement the models in the field when high compute power is more important than response time. For example, a voice assistant might respond to its name, but send complex requests back to the cloud for parsing.
The cloud serves up the latest versions of the AI model and application.
The same edge AI often runs across a fleet of devices in the field with software in the cloud

Learn more about the best practices for hybrid edge architectures.
The Future of Edge AI 
Thanks to the commercial maturation of neural networks, proliferation of IoT devices, advances in parallel computation and 5G, there is now robust infrastructure for generalized machine learning. This is allowing enterprises to capitalize on the colossal opportunity to bring AI into their places of business and act upon real-time insights, all while decreasing costs and increasing privacy.
We are only in the early innings of edge AI, and still the possible applications seem endless.
Learn how your organization can deploy edge AI by checking out the top considerations for deploying AI at the edge.
Dive deeper into edge computing on the NVIDIA Technical Blog.


Categories: Data Center | Deep Learning | Explainer | RoboticsTags: Artificial Intelligence | Embedded Computing 


 




All NVIDIA News 







Decoding How AI-Powered Upscaling on NVIDIA RTX Improves Video Quality 













Meet the Designer Creating Spaces Where NVIDIANs Do Their Life’s Work 













Next-Gen Video Editing: Wondershare Filmora Adds NVIDIA RTX Video HDR Support, RTX-Accelerated AI Features 













Jensen Huang, Mark Zuckerberg to Discuss Future of Graphics and Virtual Worlds at SIGGRAPH 2024 













Mile-High AI: NVIDIA Research to Present Advancements in Simulation and Gen AI at SIGGRAPH 





 Stay up to date on the latest enterprise news.Thank you for subscribing.* Professional Email AddressSubscribe NowUnsubscribe at any time. Read the NVIDIA Privacy Policy.


",,,,,,,,,,,,,,,,,,,,,,,,,
https://news.google.com/rss/articles/CBMibmh0dHBzOi8vd3d3Lm5ld3NjaWVudGlzdC5jb20vYXJ0aWNsZS8yMzA4MjQzLWRlZXBtaW5kLXVzZXMtYWktdG8tY29udHJvbC1wbGFzbWEtaW5zaWRlLXRva2FtYWstZnVzaW9uLXJlYWN0b3Iv0gEA?oc=5,DeepMind uses AI to control plasma inside tokamak fusion reactor - New Scientist,2022-02-16,New Scientist,https://www.newscientist.com,"For the first time, artificial intelligence has been used to control the super-hot plasma inside a fusion reactor, offering a new way to increase stability and efficiency","['nuclear fusion technology', 'AI', 'fusion', 'ai', 'deepmind', 'tokamak', 'nuclear fusion', 'hydrogen plasma']","For the first time, artificial intelligence has been used to control the super-hot plasma inside a fusion reactor, offering a new way to increase stability and efficiency","For the first time, artificial intelligence has been used to control the super-hot plasma inside a fusion reactor, offering a new way to increase stability and efficiency",https://schema.org,,N/A,N/A,"






Technology

DeepMind uses AI to control plasma inside tokamak fusion reactor
For the first time, artificial intelligence has been used to control the super-hot plasma inside a fusion reactor, offering a new way to increase stability and efficiency
By Matthew Sparkes



                                    16 February 2022
                                                                    




Facebook / Meta







Twitter / X icon





WhatsApp







Linkedin







Reddit







Email












 



Plasma inside the TCV fusion reactor in SwitzerlandCurdin Wüthrich/SPC/EPFL
Fusion reactors promise cheap, abundant and relatively clean energy – if we can get them to work. Now, thanks to artificial intelligence firm DeepMind, fusion researchers are one step closer to extracting power from plasma hotter than the surface of the sun.
DeepMind worked with scientists at the Swiss Federal Institute of Technology in Lausanne (EPFL), Switzerland, to create a neural network capable of controlling the magnetic fields within EPFL’s Variable Configuration Tokamak (TCV) fusion reactor.
These magnetic fields are essential for keeping the plasma generated by the reactor safely contained. If the plasma touches the walls of the reactor it rapidly cools, stifling the reaction and potentially causing significant damage.Advertisement
Join us for a mind-blowing festival of ideas and experiences. New Scientist Live is going hybrid, with a live in-person event in Manchester, UK, that you can also enjoy from the comfort of your own home, from 12 to 14 March 2022. Find out more.
Researchers at the TCV previously used 19 magnetic coils, each controlled by a separate algorithm that monitored the interior of the reactor thousands of times a second with a host of sensors. DeepMind instead created a single neural network to control all the coils at once, automatically learning which voltages needed to be supplied to them to best contain the plasma.
The team trained the AI on a precise digital simulation of the reactor before conducting experiments on the real machine. Ultimately, it was able to successfully contain the plasma for around 2 seconds, which is approaching the limits of the reactor – TCV can only sustain the plasma in a single experiment for up to 3 seconds, after which it needs 15 minutes to cool down. The record for fusion reactors is only 5 seconds, set recently by the Joint European Torus in the UK.
As well as controlling the plasma, the AI was able to shape it and move it around within the reactor. New plasma shapes may bring efficiency or stability improvements in new fusion reactors such as ITER, which is currently being built in France and will be the world’s largest tokamak when complete in 2025. The AI even demonstrated the ability to control two separate beams of plasma at once.
Several plasma configurations sculpted by Deepmind’s learning algorithmDeepMind & SPC/EPFL
Federico Felici at EPFL says that although there are many theoretical approaches that could be used to contain the plasma with a magnetic coil, scientists have tried-and-tested strategies. But the AI surprised the team with its novel approach to forming those same plasma shapes with the coils.
“This AI algorithm, the reinforcement learning, chose to use the TCV coils in a completely different way, which still more or less generates the same magnetic field,” says Felici. “So it was still creating the same plasma as we had expected, but it just used the magnetic cores in a completely different way because it had complete freedom to explore the whole operational space. So people were looking at these experimental results about how the coil currents evolve and they were pretty surprised.”

Read more: Fusion energy record suggests we really could build artificial suns

Gianluca Sarri at Queen’s University Belfast, UK, says that AI is key to the future of control systems for fusion reactors, which have yet to sustain a reaction that produces more power than is consumed.
“Once this is done, this is not the end of the story. Then you have to make it a power plant,” he says. “And this AI is, in my opinion, the only way forward. There are so many variables, and a small change in one of them can cause a big change in the final output. If you try to do it manually, it’s a very lengthy process.”
To make fusion reactors efficient, practical power sources, physicists need to increase the ratio between the pressure of the plasma and the power of the magnetic fields containing it, a value called beta, says Howard Wilson at the University of York, UK.
“The plasma writhes and wiggles and tries to escape the clutches of the magnetic fields, and as one is pushing up that beta parameter, one is having to work harder and harder to get the control that one needs to just hold the plasma there,” he says. “The further you push the plasma, the more chance you just suddenly lose it.”
Wilson believes these AI experiments show promise for containing plasma in “extreme geometries”, which paves the way for experiments with different plasma shapes that might yield improvements in stability or efficiency. “It makes the risky parameter space less risky to operate in, but also opens up new parameter space that we can go into and explore,” he says.
Nature DOI: 10.1038/s41586-021-04301-9

CERN and Mont Blanc: Explore particle physics and glaciers in Switzerland on a New Scientist Discovery Tour

Topics:nuclear fusion technology/AI 





Advertisement














Sign up to our weekly newsletter

Receive a weekly dose of discovery in your inbox! 
            We'll also keep you up to date with New Scientist 
            events and special offers.
Sign up


 

",NewsArticle,https://www.newscientist.com/article/2308243-deepmind-uses-ai-to-control-plasma-inside-tokamak-fusion-reactor/,DeepMind uses AI to control plasma inside tokamak fusion reactor,News,2022-02-16T16:00:55+00:00,2022-02-21T16:09:21+00:00,"[{'@type': 'ImageObject', 'width': 1200, 'height': 675, 'url': 'https://images.newscientist.com/wp-content/uploads/2022/02/16111051/PRI_223707137.jpg?crop=16:9,smart&width=1200&height=675&upscale=true'}, {'@type': 'ImageObject', 'width': 1200, 'height': 900, 'url': 'https://images.newscientist.com/wp-content/uploads/2022/02/16111051/PRI_223707137.jpg?crop=4:3,smart&width=1200&height=900&upscale=true'}, {'@type': 'ImageObject', 'width': 1200, 'height': 1200, 'url': 'https://images.newscientist.com/wp-content/uploads/2022/02/16111051/PRI_223707137.jpg?crop=1:1,smart&width=1200&height=1200&upscale=true'}]","https://images.newscientist.com/wp-content/uploads/2022/02/16111051/PRI_223707137.jpg?crop=1:1,smart&width=150&height=150&upscale=true","{'@type': 'NewsMediaOrganization', 'name': 'New Scientist', 'publishingPrinciples': 'https://www.newscientist.com/about/', 'logo': {'@type': 'ImageObject', 'width': 336, 'height': 60, 'url': 'https://www.newscientist.com/build/images/logo-336x60.4cd3677a.svg'}}",True,False,"[{'@type': 'Person', 'name': 'Matthew Sparkes', 'url': 'https://www.newscientist.com/author/matthew-sparkes/', 'image': {'@type': 'ImageObject', 'width': 150, 'height': 150, 'url': 'https://images.newscientist.com/wp-content/uploads/2022/06/13155252/matthew-sparkes.jpg?crop=1:1,smart&width=150&height=150&upscale=true'}, 'sameAs': ['https://www.linkedin.com/in/matthewsparkes'], 'jobTitle': 'Technology reporter'}]","{'@type': 'WebPage', 'url': 'https://www.newscientist.com/article/2308243-deepmind-uses-ai-to-control-plasma-inside-tokamak-fusion-reactor/'}",,,,,,,,,,,,
