URL link,Title,Date,Source,Source Link,description,keywords,og:description,twitter:description,@context,@graph,article:section,article:summary,article text,@type,url,headline,articleSection,datePublished,dateModified,image,thumbnailUrl,publisher,isAccessibleForFree,requiresSubscription,author,mainEntityOfPage,dateCreated,creator,metadata,itemListElement,articleBody,name,isPartOf,alternativeHeadline,location,logo,email,potentialAction
https://news.google.com/rss/articles/CBMiXmh0dHBzOi8vd3d3LnNjaWVuY2VuZXdzLm9yZy9hcnRpY2xlL2FydGlmaWNpYWwtaW50ZWxsaWdlbmNlLWFpLWNyZWF0aXZpdHktYXJ0LWNvbXB1dGVyLXByb2dyYW3SAQA?oc=5,Artificial intelligence challenges what it means to be creative - Science News Magazine,2022-02-17,Science News Magazine,https://www.sciencenews.org,"Computer programs can mimic famous artworks, but struggle with originality and lack self-awareness.",N/A,"Computer programs can mimic famous artworks, but struggle with originality and lack self-awareness.","Computer programs can mimic famous artworks, but struggle with originality and lack self-awareness.",https://schema.org,"[{'@type': ['Person', 'Organization'], '@id': 'https://www.sciencenews.org/#person', 'name': 'Science News Magazine', 'sameAs': ['https://www.facebook.com/sciencenews', 'https://twitter.com/sciencenews'], 'logo': {'@type': 'ImageObject', '@id': 'https://www.sciencenews.org/#logo', 'url': 'https://www.sciencenews.org/wp-content/uploads/2022/10/sn-square.png', 'contentUrl': 'https://www.sciencenews.org/wp-content/uploads/2022/10/sn-square.png', 'caption': 'Science News Magazine', 'inLanguage': 'en-US', 'width': '512', 'height': '512'}, 'image': {'@type': 'ImageObject', '@id': 'https://www.sciencenews.org/#logo', 'url': 'https://www.sciencenews.org/wp-content/uploads/2022/10/sn-square.png', 'contentUrl': 'https://www.sciencenews.org/wp-content/uploads/2022/10/sn-square.png', 'caption': 'Science News Magazine', 'inLanguage': 'en-US', 'width': '512', 'height': '512'}}, {'@type': 'WebSite', '@id': 'https://www.sciencenews.org/#website', 'url': 'https://www.sciencenews.org', 'name': 'Science News Magazine', 'publisher': {'@id': 'https://www.sciencenews.org/#person'}, 'inLanguage': 'en-US'}, {'@type': 'ImageObject', '@id': 'https://i0.wp.com/www.sciencenews.org/wp-content/uploads/2022/02/sn100_computing_spotlight-creativity_feat.jpg?fit=1440%2C810&amp;ssl=1', 'url': 'https://i0.wp.com/www.sciencenews.org/wp-content/uploads/2022/02/sn100_computing_spotlight-creativity_feat.jpg?fit=1440%2C810&amp;ssl=1', 'width': '1440', 'height': '810', 'caption': 'photo of a person looking at the ""Edmond de Belamy"" portrait', 'inLanguage': 'en-US'}, {'@type': 'WebPage', '@id': 'https://www.sciencenews.org/article/artificial-intelligence-ai-creativity-art-computer-program#webpage', 'url': 'https://www.sciencenews.org/article/artificial-intelligence-ai-creativity-art-computer-program', 'name': 'Artificial intelligence challenges what it means to be creative', 'datePublished': '2022-02-17T07:00:00-05:00', 'dateModified': '2022-02-17T07:00:00-05:00', 'isPartOf': {'@id': 'https://www.sciencenews.org/#website'}, 'primaryImageOfPage': {'@id': 'https://i0.wp.com/www.sciencenews.org/wp-content/uploads/2022/02/sn100_computing_spotlight-creativity_feat.jpg?fit=1440%2C810&amp;ssl=1'}, 'inLanguage': 'en-US'}, {'@type': 'NewsArticle', 'headline': 'Artificial intelligence challenges what it means to be creative', 'datePublished': '2022-02-17T07:00:00-05:00', 'dateModified': '2022-02-17T07:00:00-05:00', 'articleSection': 'Computing', 'author': {'@id': 'https://www.sciencenews.org/author/richard-moss', 'name': 'Helen Thompson'}, 'publisher': {'@id': 'https://www.sciencenews.org/#person'}, 'description': 'Computer programs can mimic famous artworks, but struggle with originality and lack self-awareness.', 'name': 'Artificial intelligence challenges what it means to be creative', '@id': 'https://www.sciencenews.org/article/artificial-intelligence-ai-creativity-art-computer-program#richSnippet', 'isPartOf': {'@id': 'https://www.sciencenews.org/article/artificial-intelligence-ai-creativity-art-computer-program#webpage'}, 'image': {'@id': 'https://i0.wp.com/www.sciencenews.org/wp-content/uploads/2022/02/sn100_computing_spotlight-creativity_feat.jpg?fit=1440%2C810&amp;ssl=1'}, 'inLanguage': 'en-US', 'mainEntityOfPage': {'@id': 'https://www.sciencenews.org/article/artificial-intelligence-ai-creativity-art-computer-program#webpage'}}, {'@type': 'Person', '@id': 'https://www.sciencenews.org/author/richard-moss', 'name': 'Richard Moss', 'description': 'Richard Moss is a freelance writer based in Melbourne, Australia. He is author of The Secret History of Mac Gaming and the forthcoming Shareware Heroes.', 'url': 'https://www.sciencenews.org/author/richard-moss'}]",Computing,N/A,"




					Century of Science				


		Computing	




	Artificial intelligence challenges what it means to be creative




 


This portrait, ""Edmond de Belamy,"" sold in 2018 for $432,500. It was created by an algorithm.


TIMOTHY A. CLARY/AFP via Getty Images





Share this:EmailFacebookTwitterPinterestPocketRedditPrint




By Richard Moss
February 17, 2022 at 7:00 am







When British artist Harold Cohen met his first computer in 1968, he wondered if the machine might help solve a mystery that had long puzzled him: How can we look at a drawing, a few little scribbles, and see a face? Five years later, he devised a robotic artist called AARON to explore this idea. He equipped it with basic rules for painting and for how body parts are represented in portraiture — and then set it loose making art.
Not far behind was the composer David Cope, who coined the phrase “musical intelligence” to describe his experiments with artificial intelligence–powered composition. Cope once told me that as early as the 1960s, it seemed to him “perfectly logical to do creative things with algorithms” rather than to painstakingly draw by hand every word of a story, note of a musical composition or brush stroke of a painting. He initially tinkered with algorithms on paper, then in 1981 moved to computers to help solve a case of composer’s block.


To celebrate our 100th anniversary, we’re highlighting some of the biggest advances in science over the last century. To see more from the series, visit Century of Science.
READ MORE

Cohen and Cope were among a handful of eccentrics pushing computers to go against their nature as cold, calculating things. The still-nascent field of AI had its focus set squarely on solid concepts like reasoning and planning, or on tasks like playing chess and checkers or solving mathematical problems. Most AI researchers balked at the notion of creative machines.
Slowly, however, as Cohen and Cope cranked out a stream of academic papers and books about their work, a field emerged around them: computational creativity. It included the study and development of autonomous creative systems, interactive tools that support human creativity and mathematical approaches to modeling human creativity. In the late 1990s, computational creativity became a formalized area of study with a growing cohort of researchers and eventually its own journal and annual event.
The robotic artist AARON produced this sketch in 1985, which was hand-colored by AARON-creator Harold Cohen.Harold Cohen, AARON
Soon enough — thanks to new techniques rooted in machine learning and artificial neural networks, in which connected computing nodes attempt to mirror the workings of the brain — creative AIs could absorb and internalize real-world data and identify patterns and rules that they could apply to their creations.
Computer scientist Simon Colton, then at Imperial College London and now at Queen Mary University of London and Monash University in Melbourne, Australia, spent much of the 2000s building the Painting Fool. The computer program analyzed the text of news articles and other written works to determine the sentiment and extract keywords. It then combined that analysis with an automated search of the photography website Flickr to help it generate painterly collages in the mood of the original article. Later the Painting Fool learned to paint portraits in real time of people it met through an attached camera, again applying its “mood” to the style of the portrait (or in some cases refusing to paint anything because it was in a bad mood).
The Painting Fool, an AI artist created by Simon Colton, generated collages based on text analysis and Flickr searches.The Painting Fool/thepaitingfool.com
Similarly, in the early 2010s, computational creativity turned to gaming. AI researcher and game designer Michael Cook dedicated his Ph.D. thesis and early research associate work at Goldsmiths, University of London to creating ANGELINA — which made simple games based on news articles from The Guardian, combining current affairs text analysis with hard-coded design and programming techniques.
During this era, Colton says, AIs began to look like creative artists in their own right — incorporating elements of creativity such as intentionality, skill, appreciation and imagination. But what followed was a focus on mimicry, along with controversy over what it means to be creative.


		Related Stories	

 

 



							Science & Society						



				The spoken word album ‘Experimental Words’ weaves rhyme with reason			


				By Aina AbellSeptember 29, 2021 


 

 



							Artificial Intelligence						



				Artificial intelligence has now pretty much conquered poker			


				By Maria TemmingJuly 11, 2019 


 

 



							Artificial Intelligence						



				Why large language models aren’t headed toward humanlike understanding			


				By Tom SiegfriedFebruary 28, 2024 

 

New techniques that excelled at classifying data to high degrees of precision through repeated analysis helped AI master existing creative styles. AI could now create works like those of classical composers, famous painters, novelists and more.
One AI-authored painting modeled on thousands of portraits painted between the 14th and 20th centuries sold for $432,500 at auction. In another case, study participants struggled to differentiate the musical phrases of Johann Sebastian Bach from those created by a computer program called Kulitta that had been trained on Bach’s compositions. Even IBM got in on the fun, tasking its Watson AI system with analyzing 9,000 recipes to devise its own cuisine ideas.
But many in the field, as well as onlookers, wondered if these AIs really showed creativity. Though sophisticated in their mimicry, these creative AIs seemed incapable of true innovation because they lacked the capacity to incorporate new influences from their environment. Colton and a colleague described them as requiring “much human intervention, supervision, and highly technical knowledge” in producing creative results. Overall, as composer and computer music researcher Palle Dahlstedt puts it, these AIs converged toward the mean, creating something typical of what is already out there, whereas creativity is supposed to diverge away from the typical.




 The best of Science News - direct to your inbox Headlines and summaries of the latest Science News articles, delivered to your email inbox every Thursday. Email     Continue  

In order to make the step to true creativity, Dahlstedt suggested, AI “would have to model the causes of the music, the conditions for its coming into being — not the results.”
True creativity is a quest for originality. It is a recombination of disparate ideas in new ways. It is unexpected solutions. It might be music or painting or dance, but also the flash of inspiration that helps lead to advances on the order of light bulbs and airplanes and the periodic table. In the view of many in the computational creativity field, it is not yet attainable by machines.
In just the past few years, creative AIs have expanded into style invention — into authorship that is individualized rather than imitative and that projects meaning and intentionality, even if none exists. For Colton, this element of intentionality — a focus on the process, more so than the final output — is key to achieving creativity. But he wonders whether meaning and authenticity are also essential, as the same poem could lead to vastly different interpretations if the reader knows it was written by a man versus a woman versus a machine.
If an AI lacks the self-awareness to reflect on its actions and experiences, and to communicate its creative intent, then is it truly creative? Or is the creativity still with the author who fed it data and directed it to act?
Ultimately, moving from an attempt at thinking machines to an attempt at creative machines may transform our understanding of ourselves. Seventy years ago Alan Turing — sometimes described as the father of artificial intelligence — devised a test he called “the imitation game” to measure a machine’s intelligence against our own. “Turing’s greatest insight,” writes philosopher of technology Joel Parthemore of the University of Skövde in Sweden, “lie in seeing digital computers as a mirror by which the human mind could consider itself in ways that previously were not possible.”
 

Questions or comments on this article? E-mail us at feedback@sciencenews.org | Reprints FAQ



About Richard Moss


Richard Moss is a freelance writer based in Melbourne, Australia. He is author of The Secret History of Mac Gaming and the forthcoming Shareware Heroes.









We are at a critical time and supporting science journalism 
is more important than ever. Science News and our 
parent organization, the Society for Science, need your help to strengthen 
scientific literacy and ensure that important societal decisions are made 
with science in mind.

Please 

subscribe to Science News and add $16 to expand 
science literacy and understanding.








",,,,,,,,,,,,,,,,,,,,,,,,,
https://news.google.com/rss/articles/CBMiS2h0dHBzOi8vbmV3cy51Z2EuZWR1L2FuLWludGVyZXN0LWluLWFpLWxlZC10aGlzLXN0dWRlbnQtdG8tYS1qb2ItYXQtZ29vZ2xlL9IBAA?oc=5,An interest in AI led this student to a job at Google - University of Georgia,2022-02-18,University of Georgia,https://news.uga.edu,Foundation Fellow Nathan Safir is happiest when working on a complicated problem.,N/A,Foundation Fellow Nathan Safir is happiest when working on a complicated problem.,N/A,https://schema.org,"[{'@type': 'Article', '@id': 'https://news.uga.edu/an-interest-in-ai-led-this-student-to-a-job-at-google/#article', 'isPartOf': {'@id': 'https://news.uga.edu/an-interest-in-ai-led-this-student-to-a-job-at-google/'}, 'author': [{'@id': 'https://news.uga.edu/#/schema/person/image/d5559469ef83bdfee5cf4d248196bf9a'}], 'headline': 'An interest in AI led this student to a job at Google', 'datePublished': '2022-02-18T14:00:39+00:00', 'dateModified': '2022-02-18T14:00:39+00:00', 'mainEntityOfPage': {'@id': 'https://news.uga.edu/an-interest-in-ai-led-this-student-to-a-job-at-google/'}, 'wordCount': 755, 'publisher': {'@id': 'https://news.uga.edu/#organization'}, 'image': {'@id': 'https://news.uga.edu/an-interest-in-ai-led-this-student-to-a-job-at-google/#primaryimage'}, 'thumbnailUrl': 'https://news.uga.edu/wp-content/uploads/2022/02/Safir-2.jpg', 'keywords': ['Columns', 'Foundation Fellows', 'Franklin College of Arts and Sciences', 'Graduate School', 'Inside UGA', 'Morehead Honors College'], 'articleSection': ['Student Spotlight'], 'inLanguage': 'en-US'}, {'@type': 'WebPage', '@id': 'https://news.uga.edu/an-interest-in-ai-led-this-student-to-a-job-at-google/', 'url': 'https://news.uga.edu/an-interest-in-ai-led-this-student-to-a-job-at-google/', 'name': 'An interest in AI led this student to a job at Google', 'isPartOf': {'@id': 'https://news.uga.edu/#website'}, 'primaryImageOfPage': {'@id': 'https://news.uga.edu/an-interest-in-ai-led-this-student-to-a-job-at-google/#primaryimage'}, 'image': {'@id': 'https://news.uga.edu/an-interest-in-ai-led-this-student-to-a-job-at-google/#primaryimage'}, 'thumbnailUrl': 'https://news.uga.edu/wp-content/uploads/2022/02/Safir-2.jpg', 'datePublished': '2022-02-18T14:00:39+00:00', 'dateModified': '2022-02-18T14:00:39+00:00', 'description': 'Foundation Fellow Nathan Safir is happiest when working on a complicated problem.', 'breadcrumb': {'@id': 'https://news.uga.edu/an-interest-in-ai-led-this-student-to-a-job-at-google/#breadcrumb'}, 'inLanguage': 'en-US', 'potentialAction': [{'@type': 'ReadAction', 'target': ['https://news.uga.edu/an-interest-in-ai-led-this-student-to-a-job-at-google/']}]}, {'@type': 'ImageObject', 'inLanguage': 'en-US', '@id': 'https://news.uga.edu/an-interest-in-ai-led-this-student-to-a-job-at-google/#primaryimage', 'url': 'https://news.uga.edu/wp-content/uploads/2022/02/Safir-2.jpg', 'contentUrl': 'https://news.uga.edu/wp-content/uploads/2022/02/Safir-2.jpg', 'width': 2100, 'height': 1400, 'caption': 'Nathan Safir in the Institute for Artificial Intelligence in the Boyd Research and Education Center. (Photo by Chamberlain Smith/UGA)'}, {'@type': 'BreadcrumbList', '@id': 'https://news.uga.edu/an-interest-in-ai-led-this-student-to-a-job-at-google/#breadcrumb', 'itemListElement': [{'@type': 'ListItem', 'position': 1, 'name': 'Home', 'item': 'https://news.uga.edu/'}, {'@type': 'ListItem', 'position': 2, 'name': 'An interest in AI led this student to a job at Google'}]}, {'@type': 'WebSite', '@id': 'https://news.uga.edu/#website', 'url': 'https://news.uga.edu/', 'name': 'UGA Today', 'description': 'Today’s top news from the University of Georgia', 'publisher': {'@id': 'https://news.uga.edu/#organization'}, 'potentialAction': [{'@type': 'SearchAction', 'target': {'@type': 'EntryPoint', 'urlTemplate': 'https://news.uga.edu/?s={search_term_string}'}, 'query-input': 'required name=search_term_string'}], 'inLanguage': 'en-US'}, {'@type': 'Organization', '@id': 'https://news.uga.edu/#organization', 'name': 'University of Georgia', 'url': 'https://news.uga.edu/', 'logo': {'@type': 'ImageObject', 'inLanguage': 'en-US', '@id': 'https://news.uga.edu/#/schema/logo/image/', 'url': 'https://news.uga.edu/wp-content/uploads/2017/09/RGB-GEORGIA-FS-FC.png', 'contentUrl': 'https://news.uga.edu/wp-content/uploads/2017/09/RGB-GEORGIA-FS-FC.png', 'width': 2574, 'height': 843, 'caption': 'University of Georgia'}, 'image': {'@id': 'https://news.uga.edu/#/schema/logo/image/'}, 'sameAs': ['https://www.facebook.com/universityofga', 'https://x.com/universityofga', 'https://www.instagram.com/universityofga/', 'https://www.linkedin.com/school/166638/', 'https://www.youtube.com/channel/UCmNT8A6kDI_-Xxjlhcm9VRg']}, {'@type': 'Person', '@id': 'https://news.uga.edu/#/schema/person/image/d5559469ef83bdfee5cf4d248196bf9a', 'name': 'Jill Hamilton', 'image': {'@type': 'ImageObject', 'inLanguage': 'en-US', '@id': 'https://news.uga.edu/#/schema/person/image/23494c9101089ad44ae88ce9d2f56aac', 'url': 'https://secure.gravatar.com/avatar/?s=96&d=mm&r=g', 'contentUrl': 'https://secure.gravatar.com/avatar/?s=96&d=mm&r=g', 'caption': 'Jill Hamilton'}, 'url': 'https://news.uga.edu/author/jill-hamilton/'}]",N/A,N/A,"

Student Spotlight
An interest in AI led this student to a job at Google
February 18, 2022by

Jill Hamilton





 
Nathan Safir in the Institute for Artificial Intelligence in the Boyd Research and Education Center. (Photo by Chamberlain Smith/UGA)


Foundation Fellow Nathan Safir is happiest when working on a complicated problem


As Nathan Safir was finishing up his master’s in artificial intelligence at the University of Georgia, he had a big decision to make: Did he want to accept the Marshall Scholarship to pursue a Ph.D. in computer science in England or accept an offer to start work at Google this summer?
Safir, a Foundation Fellow, applied his problem-solving brain to the decision.
“Mostly I tried to simplify it into a decision of ‘Am I more excited to work now or am I more excited to go to grad school now?’” said Safir, who has a B.S. in computer science with a minor in geography.
Safir in the Institute for Artificial Intelligence in the Boyd Research and Education Center. (Photo by Chamberlain Smith/UGA)
Google was the winner. For now. Safir hopes to get his Ph.D. in artificial intelligence sometime in the future.
Whatever way he gets there, the end goal is the same – he wants to work in artificial intelligence. “Whether it’s working on a new cool application, existing AI methods, or actually doing the research, I’d really love to work somewhere in that space,” said Safir.
This flexibility will serve Safir well at Google, because he doesn’t yet know what he’ll be doing at the company when he arrives in California this August. “They’ll start team matching closer to my start date,” said Safir. “All I know is that I’ll be in the Bay Area and possibly working on the Google Ads team.”
During a Google internship in summer 2021, he worked with the Cloud AI team.
UGA has helped him find his passion for AI in several ways. One was a difficult math class his first year in college. “I was a super eager freshman, so I took Math 3500. It’s notorious for being very tough, and it was. I was glad I took it, but I realized I was less interested in the proof-based rigorous mathematics.”
Nathan Safir outside of the Institute for Artificial Intelligence in the Boyd Research and Education Center. (Photo by Chamberlain Smith/UGA)
He decided to pick up machine learning instead. “It presented an interesting way to use mathematical thinking and be able to think creatively.”
Also helpful in guiding his path was UGA’s Foundation Fellowship, a merit-based scholarship based in the Jere W. Morehead Honors College that is awarded to between 20-25 high school seniors out of 1,200 applicants. It’s the reason Safir, who grew up in Kansas City, Missouri, ultimately chose UGA out of his ranked list of 13 potential schools.
He said he most appreciates the travel opportunities, although they’ve been a bit truncated during the COVID years, and the people he’s met along the way. “The network of people you can talk to about careers or cool places you could work – that type of thing was super helpful for me trying to imagine what I wanted to do in the future.” Safir said he interacts with staff, peers and friends from the Fellowship on a daily basis.
Safir’s gateway into programming was a documentary he saw in middle school on Mark Zuckerberg. “It said he learned C++ from a book when he was about my age so I checked out the same C++ book from the library. I don’t think I picked it up as quickly as he did, but that was the beginning of me trying to learn programming.”
“I’ve been into math and quantitative problem solving since I was really young. Programming was just an extension of that logical problem-solving,” he said.
Safir is a down-to-earth, well-rounded person who can move between playing in local Monday pick-up hockey games, coaching Athens Youth Hockey and working on his tennis game, to high-level problem-solving. But he’s happiest when he has a tough question to work on.
“My thesis is working on a theoretical problem of how to extend an architecture called variational autoencoders to work with both labeled and unlabeled data,” he said. “My lab, led by Dr. Quinn of the CS department, is at the intersection of biomedical imaging and artificial intelligence. It’s a theoretical problem inspired by a real-world problem. It’s an especially open field—I feel like there are a million different things you can work on. I’m just happy I can be a part of it.”



Columns Foundation Fellows Franklin College of Arts and Sciences Graduate School Inside UGA Morehead Honors College 



FacebookXPinterestLinkedIn 

",,,,,,,,,,,,,,,,,,,,,,,,,
