URL link,Title,Date,Source,Source Link,description,keywords,og:description,twitter:description,@context,@graph,article:section,article:summary,article text,@type,url,image,author,publisher,headline,datePublished,dateModified,articleSection,name,isAccessibleForFree,itemListElement,mainEntityOfPage,dateCreated,heading,articleBody,isBasedOn,thumbnailUrl,isPartOf,alternativeHeadline,hasPart,uploadDate,embedUrl,contentUrl,duration,dateline,creator,copyrightHolder,copyrightYear,inLanguage,foundingDate,logo,sameAs,comment,commentCount,sourceOrganization,@id,diversityPolicy,ethicsPolicy,masthead,speakable,video,Headline,DatePublished,DateModified,Description
https://news.google.com/rss/articles/CBMigQFodHRwczovL3d3dy53YXNoaW5ndG9ucG9zdC5jb20vd2FzaGluZ3Rvbi1wb3N0LWxpdmUvMjAyMy8wNy8xMS9ob3ctYXJ0aWZpY2lhbC1pbnRlbGxpZ2VuY2UtY291bGQtaW1wYWN0LXdvcmtmb3JjZS1nbG9iYWwtZWNvbm9teS_SAQA?oc=5,How artificial intelligence could impact the workforce and the global economy - The Washington Post,2023-07-11,The Washington Post,https://www.washingtonpost.com,"Alondra Nelson, Sal Khan and Michael Howells join Washington Post Live on Tuesday, July 11.",N/A,"The rapid breakthroughs in artificial intelligence could reshape hundreds of millions of jobs, worker productivity and the global economy. On Tuesday, July 11 at 2:00 p.m. ET, join Washington Post Live for back-to-back conversations with Alondra Nelson, former acting director at the White House Office of Science and Technology Policy, Sal Khan, CEO of Khan Academy, and Michael Howells, president of workforce skills at Pearson, about the impact of AI on jobs and the role of education in helping prepare future generations.  ","The rapid breakthroughs in artificial intelligence could reshape hundreds of millions of jobs, worker productivity and the global economy. On Tuesday, July 11 at 2:00 p.m. ET, join Washington Post Live for back-to-back conversations with Alondra Nelson, former acting director at the White House Office of Science and Technology Policy, Sal Khan, CEO of Khan Academy, and Michael Howells, president of workforce skills at Pearson, about the impact of AI on jobs and the role of education in helping prepare future generations.  ",https://schema.org,,Washington Post Live,N/A,"Future of Work: The Impact of AI49:54sharefull-screensubtitlesplaymute0:01 / 49:54Alondra Nelson, Sal Khan and Michael Howells join Washington Post Live on Tuesday, July 11. (Video: The Washington Post)By  Washington Post LiveJuly 11, 2023 at 2:00 p.m. EDTThe rapid breakthroughs in artificial intelligence could reshape hundreds of millions of jobs, worker productivity and the global economy. Join Washington Post Live for back-to-back conversations with Alondra Nelson, former acting director at the White House Office of Science and Technology Policy, Sal Khan, CEO of Khan Academy, and Michael Howells, president of workforce skills at Pearson, about the impact of AI on jobs and the role of education in helping prepare future generations.Subscribe for unlimited access to The PostYou can cancel anytime.SubscribeClick here for transcriptHighlights“The capabilities of artificial intelligence have expanded quite dramatically and we need to be thinking in new and fresh ways about AI governance. Which includes regulation and other kinds of levers that we can work on across sectors including government … That vein of uncertainty that was in the Goldman-Sachs report, one of the ways that we address that uncertainty is through regulation … Regulation guardrails are actually not staunching innovation but allow a kind of certainty in the field of play for workers, for consumers and for industry.” – Alondra Nelson (Video: Washington Post Live)“I think each sector, industry, entity is going to have to think about their own risk calculus around the uncertainty of these tools … We’re really in a moment that the innovation that folks are hoping for is really going to require that we have some kind of shared rules of the road.” – Alondra Nelson (Video: Washington Post Live)“If you're not already using these tools in some way, shape or form, you're probably not doing your work optimally anymore … The tools that leverage generative AI are only going to get better and better. We’re not even at the top of the first inning just yet. Given that it's going to be in the workplace, it is going to be hurting these students if they don't get exposure to these tools."" – Sal Khan (Video: Washington Post Live)“When we launched “Khanmigo” and we did it coincidentally when OpenAI released GPT4 in March, it was actually a blessing that ChatGPT was out there because people were struggling with it already … We were now able to offer something that was special purpose built for education, put some guardrails around it … We now have been testing for about four months in mainstream schools and the feedback has been better than expected.” – Sal Khan (Video: Washington Post Live)“The hot skills today and the even hotter skills tomorrow … show that the value of human skills is really where the future is taking us … Trusting in the value of people and understanding your unique attributes and potential and capabilities as human is really the best advice that I could give to somebody who’s coming into the labor market now.” – Michael Howells (Video: Washington Post Live)Alondra NelsonSenior Fellow, Center for American ProgressProfessor, School of Social Science, Institute for Advanced StudySal KhanFounder & CEO, Khan AcademyMichael HowellsPresident, Workforce Skills, PearsonContent from the EY organizationThe following content is produced and paid for by a Washington Post Live event sponsor. The Washington Post newsroom is not involved in the production of this content. (Video: Washington Post Live)Augmenting the workforce with the exponential power of AIGenerative AI is poised to transform the world we know and work in today. In a segment presented by the EY organization, Beatriz Sanz Sáiz, EY Global Consulting Data and AI Leader, discusses how organizations can embrace AI’s transformative potential with confidence, while considering ethical responsibility and putting humans at the center.Share this articleShareBeatriz Sanz SáizEY Global Consulting Data and AI LeaderShareNewsletterDailyToday’s HeadlinesThe most important news stories of the day, curated by Post editors, delivered every morning.Sign up",VideoObject,,"[{'@context': 'https://schema.org', '@type': 'ImageObject', 'url': 'https://www.washingtonpost.com/wp-apps/imrs.php?src=https://d1i4t8bqe7zgj6.cloudfront.net/07-06-2023/t_0d15bf85ec4b4e89add87b8db7ed40ad_name_0711_Future_of_Work_Headshot_branding_v2.jpg&w=1600&h=900', 'height': 900, 'width': 1600}, {'@context': 'https://schema.org', '@type': 'ImageObject', 'url': 'https://www.washingtonpost.com/wp-apps/imrs.php?src=https://d1i4t8bqe7zgj6.cloudfront.net/07-06-2023/t_0d15bf85ec4b4e89add87b8db7ed40ad_name_0711_Future_of_Work_Headshot_branding_v2.jpg&w=1800&h=1800', 'height': 1800, 'width': 1800}, {'@context': 'https://schema.org', '@type': 'ImageObject', 'url': 'https://www.washingtonpost.com/wp-apps/imrs.php?src=https://d1i4t8bqe7zgj6.cloudfront.net/07-06-2023/t_0d15bf85ec4b4e89add87b8db7ed40ad_name_0711_Future_of_Work_Headshot_branding_v2.jpg&w=800&h=600', 'height': 800, 'width': 600}]","{'@type': 'Person', 'name': 'Washington Post Live'}","{'@id': 'washingtonpost.com', '@type': 'NewsMediaOrganization', 'logo': {'@type': 'ImageObject', 'url': 'https://www.washingtonpost.com/wp-stat/img/wplogo_344x60_blk.png', 'width': {'@type': 'Distance', 'name': '344 px'}, 'height': {'@type': 'Distance', 'name': '60 px'}}, 'name': 'The Washington Post'}",How artificial intelligence could impact the workforce and the global economy ,2023-07-05T18:48:26.041Z,2023-11-06T16:50:15.164Z,,Future of Work: The Impact of AI,False,"[{'@context': 'https://schema.org', '@type': 'ListItem', 'name': 'Washington Post Live', 'position': 1, 'item': 'https://www.washingtonpost.com/washington-post-live/'}]",https://www.washingtonpost.com/washington-post-live/2023/07/11/how-artificial-intelligence-could-impact-workforce-global-economy/,,,,,https://www.washingtonpost.com/wp-apps/imrs.php?src=https%3A%2F%2Fd1i4t8bqe7zgj6.cloudfront.net%2F07-06-2023%2Ft_0d15bf85ec4b4e89add87b8db7ed40ad_name_0711_Future_of_Work_Headshot_branding_v2.jpg&w=960,"{'@type': ['CreativeWork', 'Product'], 'name': 'The Washington Post', 'productID': 'washingtonpost.com:basic', 'description': 'Breaking news and analysis on politics, business, world, national news, entertainment and more. In-depth DC, Virginia, Maryland news coverage including traffic, weather, crime, education, restaurant reviews and more.', 'sku': 'https://subscribe.washingtonpost.com', 'image': 'https://www.washingtonpost.com/resizer/2CjPNwqvXHPS_2RpuRTKY-p3eVo=/1484x0/www.washingtonpost.com/pb/resources/img/twp-social-share.png', 'brand': {'@type': 'brand', 'name': 'The Washington Post'}, 'offers': {'@type': 'offer', 'url': 'https://subscribe.washingtonpost.com/acquisition?promo=o26'}}",,"{'@type': 'WebPageElement', 'cssSelector': '.meteredContent', 'isAccessibleForFree': False}",2023-07-11T22:16:16Z,https://www.washingtonpost.com/video/c/embed/573654df-e171-49e0-a772-b5de132868cb,https://d21rhj7n383afu.cloudfront.net/washpost-production/The_Washington_Post/20230711/64ada60aa2c4c85d876dd8f3/64adcbc4c4202c2eb6924a8c/file_640x360-600-v3.mp4,PT49M54S,,,,,,,,,,,,,,,,,,,,,
https://news.google.com/rss/articles/CBMiWGh0dHBzOi8vd3d3LmVjb25vbWlzdC5jb20vdGhlLWVjb25vbWlzdC1leHBsYWlucy8yMDIzLzA3LzEwL2hvdy1haS1pbWFnZS1nZW5lcmF0b3JzLXdvcmvSAQA?oc=5,How AI image-generators work - The Economist,2023-07-10,The Economist,https://www.economist.com,Some are getting good enough to fool humans,['Artificial intelligence'],Some are getting good enough to fool humans,Some are getting good enough to fool humans,https://schema.org,,N/A,N/A,"The Economist explainsHow AI image-generators workSome are getting good enough to fool humansImage: Eliot Higgins Jul 10th 2023ShareTHE FLURRY of images generated by artificial intelligence (AI) feels like the product of a thoroughly modern tool. In fact, computers have been at the easel for decades. In the early 1970s Harold Cohen, an artist, taught one to draw using an early AI system. “AARON” could instruct a robot to sketch black-and-white shapes on paper; within a decade Cohen had taught AARON to draw human figures.Today “generative AI” models put brush to virtual paper: publicly available apps, such as Midjourney and OpenAI’s DALL-E, create images in seconds based on text prompts. The final products often dupe humans. In March AI-generated images of Donald Trump being handcuffed by police went viral online. And image generators are improving fast. How do they work—and how are they refining their craft?Already have an account?Log inContinue with a free trialExplore all our independent journalism for free for one month. Cancel any timeFree trialOr continue reading this articleRegister nowExplore moreArtificial intelligenceShareReuse this contentThe Economist todayHandpicked stories, in your inboxA daily newsletter with the best of our journalismSign upYes, I agree to receive exclusive content, offers and updates to products and services from The Economist Group. I can change these preferences at any time.More from The Economist explainsWhy some Russian athletes will be eligible to compete at the Paris OlympicsDespite antipathy between the Russian government and the International Olympic Committee a handful will competeWhy did the Secret Service fail to protect Trump from being shot?Lawmakers want an accounting for mistakes that nearly resulted in Mr Trump’s assassination on July 13thWhat is the Chinese Communist Party’s third plenum?Hundreds of the party’s senior members gather in Beijing amid hopes they will speed up economic reformsMore from The Economist explainsWhy some Russian athletes will be eligible to compete at the Paris OlympicsDespite antipathy between the Russian government and the International Olympic Committee a handful will competeWhy did the Secret Service fail to protect Trump from being shot?Lawmakers want an accounting for mistakes that nearly resulted in Mr Trump’s assassination on July 13thWhat is the Chinese Communist Party’s third plenum?Hundreds of the party’s senior members gather in Beijing amid hopes they will speed up economic reformsWho might Donald Trump pick as his running-mate?The Republican nominee has a number of hopefuls to pick fromWhy Finland and others are vaccinating people against bird fluThe virus is spreading undetected in mammalsTen plausible contenders to replace Joe BidenThe Democrats have a deep bench of talent",BreadcrumbList,https://www.economist.com,https://www.economist.com/media-assets/image/20230715_BLP501.jpg,"{'@type': 'NewsMediaOrganization', 'name': 'The Economist', 'logo': {'@type': 'ImageObject', 'url': 'https://www.economist.com/engassets/google-search-logo.png'}, 'url': 'https://www.economist.com/'}","{'@type': 'NewsMediaOrganization', 'name': 'The Economist', 'logo': {'@type': 'ImageObject', 'url': 'https://www.economist.com/engassets/google-search-logo.png'}}",How AI image-generators work,2023-07-10T16:10:25.000Z,,The Economist explains,The Economist,False,"[{'@type': 'ListItem', 'position': 1, 'item': {'@id': 'https://www.economist.com/the-economist-explains/', 'name': 'The Economist explains'}}, {'@type': 'ListItem', 'position': 2, 'item': {'@id': 'https://www.economist.com/the-economist-explains/2023/07/10/how-ai-image-generators-work', 'name': 'How AI image-generators work'}}]",https://www.economist.com/the-economist-explains/2023/07/10/how-ai-image-generators-work,2023-07-10T16:10:25.000Z,,,,https://www.economist.com/media-assets/image/20230715_BLP501.jpg,"{'@type': ['NewsArticle', 'Product'], 'name': 'The Economist', 'productID': 'economist.com:showcase'}",,,,,,,,"{'@type': 'NewsMediaOrganization', 'name': 'The Economist', 'logo': {'@type': 'ImageObject', 'url': 'https://www.economist.com/engassets/google-search-logo.png'}}","{'@type': 'NewsMediaOrganization', 'name': 'The Economist', 'logo': {'@type': 'ImageObject', 'url': 'https://www.economist.com/engassets/google-search-logo.png'}}",2023.0,en,1843,"{'@type': 'ImageObject', 'url': 'https://www.economist.com/engassets/google-search-logo.png'}","['https://www.facebook.com/theeconomist', 'https://www.instagram.com/theeconomist', 'https://www.twitter.com/theeconomist', 'https://www.linkedin.com/company/the-economist', 'https://www.youtube.com/user/economistmagazine', 'https://en.wikipedia.org/wiki/The_Economist']",,,,,,,,,,,,,
https://news.google.com/rss/articles/CBMiWWh0dHBzOi8vd3d3Lm55dGltZXMuY29tLzIwMjMvMDcvMDcvbWFnYXppbmUvYXJ0aWZpY2lhbC1pbnRlbGxpZ2VuY2Utd29ya3BsYWNlLWV0aGljcy5odG1s0gEA?oc=5,Can I Use ChatGPT for the Tedious Parts of My Job? - The New York Times,2023-07-07,The New York Times,https://www.nytimes.com,The magazine’s Ethicist columnist on using artificial intelligence to assist with mundane tasks at work.,N/A,The magazine’s Ethicist columnist on using artificial intelligence to assist with mundane tasks at work.,The magazine’s Ethicist columnist on using artificial intelligence to assist with mundane tasks at work.,https://schema.org,,Magazine,N/A,"Artificial IntelligenceMicrosoft’s Risk-TakerFine Print ChangesQuiz: Fake or Real Images?Apple Enters A.I. FrayMeta’s A.I. ScrapingAdvertisementSKIP ADVERTISEMENTSubscriber-only NewsletterThe EthicistCan I Use ChatGPT for the Tedious Parts of My Job?The magazine’s Ethicist columnist on using artificial intelligence to assist with mundane tasks at work.Share full article183Read in appCredit...Illustration by Tomi UmBy Kwame Anthony AppiahJuly 7, 2023I’m a writer and a college professor at a small college, and I recently became chair of the English department. I usually love to write, but when it comes to administrative documents, I struggle — and this new role asks for a lot of them.It occurred to me that ChatGPT might prove useful for the reports, proposals, assessments and the like that take up the precious time I could be devoting to students and my own scholarship. Is it OK to use ChatGPT to generate drafts of documents like these, which don’t make a claim to creative “genius”? Do I need to cite ChatGPT in these documents if I use it? — Name WithheldFrom the Ethicist:Subscribe to The Times to read as many articles as you like.Kwame Anthony Appiah is The New York Times Magazine’s Ethicist columnist and teaches philosophy at N.Y.U. His books include “Cosmopolitanism,” “The Honor Code” and “The Lies That Bind: Rethinking Identity.” To submit a query: Send an email to ethicist@nytimes.com. More about Kwame Anthony AppiahRead 183 CommentsShare full article183Read in appAdvertisementSKIP ADVERTISEMENTComments 183Can I Use ChatGPT for the Tedious Parts of My Job?Skip to CommentsThe comments section is closed.
      To submit a letter to the editor for publication, write to
      letters@nytimes.com.",NewsMediaOrganization,https://www.nytimes.com/,"[{'@context': 'https://schema.org', '@type': 'ImageObject', 'url': 'https://static01.nyt.com/images/2023/07/16/magazine/16mag-ethicist/16mag-ethicist-videoSixteenByNineJumbo1600.jpg', 'height': 899, 'width': 1600, 'contentUrl': 'https://static01.nyt.com/images/2023/07/16/magazine/16mag-ethicist/16mag-ethicist-videoSixteenByNineJumbo1600.jpg', 'creditText': 'Illustration by Tomi Um'}, {'@context': 'https://schema.org', '@type': 'ImageObject', 'url': 'https://static01.nyt.com/images/2023/07/16/magazine/16mag-ethicist/16mag-ethicist-superJumbo.jpg', 'height': 1148, 'width': 2048, 'contentUrl': 'https://static01.nyt.com/images/2023/07/16/magazine/16mag-ethicist/16mag-ethicist-superJumbo.jpg', 'creditText': 'Illustration by Tomi Um'}, {'@context': 'https://schema.org', '@type': 'ImageObject', 'url': 'https://static01.nyt.com/images/2023/07/16/magazine/16mag-ethicist/16mag-ethicist-mediumSquareAt3X.jpg', 'height': 1400, 'width': 1402, 'contentUrl': 'https://static01.nyt.com/images/2023/07/16/magazine/16mag-ethicist/16mag-ethicist-mediumSquareAt3X.jpg', 'creditText': 'Illustration by Tomi Um'}]","[{'@context': 'https://schema.org', '@type': 'Person', 'url': 'https://www.nytimes.com/column/the-ethicist', 'name': 'Kwame Anthony Appiah'}]","{'@id': 'https://www.nytimes.com/#publisher', 'name': 'The New York Times'}",Can I Use ChatGPT for the Tedious Parts of My Job?,2023-07-07T18:43:25.758Z,2023-07-07T18:43:25.758Z,,The New York Times,False,,https://www.nytimes.com/2023/07/07/magazine/artificial-intelligence-workplace-ethics.html,,,,,,"{'@type': ['CreativeWork', 'Product'], 'name': 'The New York Times', 'productID': 'nytimes.com:basic'}",,"{'@type': 'WebPageElement', 'isAccessibleForFree': False, 'cssSelector': '.meteredContent'}",,,,,,,"{'@id': 'https://www.nytimes.com/#publisher', 'name': 'The New York Times'}",2024.0,en,1851-09-18,"{'@context': 'https://schema.org', '@type': 'ImageObject', 'url': 'https://static01.nyt.com/images/icons/t_logo_291_black.png', 'height': 291, 'width': 291, 'contentUrl': 'https://static01.nyt.com/images/icons/t_logo_291_black.png', 'creditText': 'The New York Times'}",https://en.wikipedia.org/wiki/The_New_York_Times,{'@id': '#commentsContainer'},183.0,"{'@id': 'https://www.nytimes.com/#publisher', 'name': 'The New York Times'}",https://www.nytimes.com/#publisher,https://www.nytco.com/company/diversity-and-inclusion/,https://www.nytco.com/company/standards-ethics/,https://www.nytimes.com/interactive/2023/01/28/admin/the-new-york-times-masthead.html,,,,,,
https://news.google.com/rss/articles/CBMiZGh0dHBzOi8vd3d3LnpkbmV0LmNvbS9hcnRpY2xlL2dlbmVyYXRpdmUtYWktY291bGQtYWRkLXVwLXRvLTQtNC10cmlsbGlvbi1hbm51YWxseS10by1nbG9iYWwtZWNvbm9teS_SAQA?oc=5,Generative AI could add up to $4.4 trillion annually to global economy - ZDNet,2023-07-10,ZDNet,https://www.zdnet.com,Here are the key forecasts on the impact of GenAI across all industry sectors from the latest McKinsey report on the subject.,N/A,Here are the key forecasts on the impact of GenAI across all industry sectors from the latest McKinsey report on the subject.,Here are the key forecasts on the impact of GenAI across all industry sectors from the latest McKinsey report on the subject.,,,N/A,N/A,N/A,,,,,,,,,,,,,,,,,,,,,,,,,,,,,,,,,,,,,,,,,,,,,,
https://news.google.com/rss/articles/CBMiOWh0dHBzOi8vd3d3LmlibS5jb20vdGhpbmsvaW5zaWdodHMvYWktaGVhbHRoY2FyZS1iZW5lZml0c9IBAA?oc=5,AI healthcare benefits - IBM,2023-07-11,IBM,https://www.ibm.com,AI is used in healthcare for everything from answering patient questions to assisting with surgeries and developing new pharmaceuticals.,Healthcare,AI is used in healthcare for everything from answering patient questions to assisting with surgeries and developing new pharmaceuticals.,N/A,,,N/A,N/A,N/A,,,,,,,,,,,,,,,,,,,,,,,,,,,,,,,,,,,,,,,,,,,,,,
