URL link,Title,Date,Source,Source Link,description,keywords,og:description,twitter:description,@context,@type,url,image,author,publisher,headline,datePublished,dateModified,articleSection,name,isAccessibleForFree,itemListElement,article:section,article:summary,article text,mainEntityOfPage,dateCreated,heading,articleBody,isBasedOn,thumbnailUrl,isPartOf,alternativeHeadline,@graph,identifier,creator,mentions,hasPart,address,diversityPolicy,email,legalName,leiCode,telephone,logo,brand,dateline,uploadDate,duration,potentialAction
https://news.google.com/rss/articles/CBMiRmh0dHBzOi8vd3d3LmxhdGltZXMuY29tL2J1c2luZXNzL2xhLWZpLWhpbWktc2llZ2VsLTIwMTgxMTExLXN0b3J5Lmh0bWzSAQA?oc=5,How I Made It: Ian Siegel employs artificial intelligence to disrupt the job recruitment industry - Los Angeles Times,2018-11-11,Los Angeles Times,https://www.latimes.com,"Ian Siegel, ceo of Santa Monica-based ZipRecruiter, has taken a non-traditional route in his career and at his recruiting company.",N/A,"Ian Siegel, 45, is chief executive of Santa Monica-based ZipRecruiter, the company he co-founded in 2010 to disrupt the recruitment and hiring industry. ","Ian Siegel, 45, is chief executive of Santa Monica-based ZipRecruiter, the company he co-founded in 2010 to disrupt the recruitment and hiring industry. ",http://schema.org,NewsArticle,https://www.latimes.com/business/la-fi-himi-siegel-20181111-story.html,"[{'@context': 'http://schema.org', '@type': 'ImageObject', 'height': 836, 'url': 'https://ca-times.brightspotcdn.com/dims4/default/5a1a62f/2147483647/strip/false/crop/2047x1151+0+0/resize/1486x836!/quality/75/?url=https%3A%2F%2Fcalifornia-times-brightspot.s3.amazonaws.com%2F3b%2F95%2F526ea77747bcbc07f4f672df1f47%2Fla-1541726639-h0wlhi0wk9-snap-image', 'width': 1486}, {'@context': 'http://schema.org', '@type': 'ImageObject', 'height': 675, 'url': 'https://ca-times.brightspotcdn.com/dims4/default/efd8392/2147483647/strip/false/crop/2046x1151+0+0/resize/1200x675!/quality/75/?url=https%3A%2F%2Fcalifornia-times-brightspot.s3.amazonaws.com%2F3b%2F95%2F526ea77747bcbc07f4f672df1f47%2Fla-1541726639-h0wlhi0wk9-snap-image', 'width': 1200}]","[{'@context': 'http://schema.org', '@type': 'Person', 'affiliation': 'Los Angeles Times', 'description': 'Ronald D. White was a reporter for the Los Angeles Times from 1993 to 2024. ', 'name': 'Ronald D. White', 'url': 'https://www.latimes.com/people/ronald-d-white'}]","{'@type': 'Organization', 'name': 'Los Angeles Times', 'logo': {'@type': 'ImageObject', 'url': 'https://ca-times.brightspotcdn.com/dims4/default/954b438/2147483647/strip/false/crop/382x60+0+0/resize/382x60!/quality/75/?url=https%3A%2F%2Fcalifornia-times-brightspot.s3.amazonaws.com%2Fde%2F5f%2F46c2d05b430cbc6e775301df1062%2Flogo-full-black.png', 'width': 382, 'height': 60}}",Ian Siegel employs artificial intelligence to disrupt the job recruitment industry,2018-11-11T13:00:00.000Z,2019-07-19T02:12:58.578Z,Business,Ian Siegel employs artificial intelligence to disrupt the job recruitment industry - Los Angeles Times,False,,Business,N/A,"       Ian Siegel, co-founder and chief executive of ZipRecruiter, at the company’s Santa Monica office. (Christina House / Los Angeles Times)       By Ronald D. WhiteStaff Writer    Nov. 11, 2018 5 AM PT      Share       Share via Close extra sharing options    Email     Facebook    X    LinkedIn    Threads    Reddit    WhatsApp    Copy Link URLCopied!   Print        Ian Siegel, 45, is chief executive of Santa Monica-based ZipRecruiter, the company he co-founded in 2010 to disrupt the recruitment and hiring industry. Since then, more than 1.5 million businesses and more than 430 million job seekers have used the online employment marketplace, according to the company. ZipRecruiter has nearly 1,000 employees, a quarter of whom are engineers.Business acumenStudying sociology, psychology and English at Oberlin College wasn’t the waste of time that Siegel feared it might be once he started a career in business.AdChoicesADVERTISING Advertisement   “If you think of psychology as the individual, sociology as society and social psychology as the study of small group dynamics, I was already identifying the opinion leader, the emotional leader, early on in my career. I was breaking down every group into the categories I studied while I was in college, and it actually was really helpful,” Siegel said.The inspirationThe Los Angeles native held executive-level positions at six different companies over 15 years. In hindsight, he sees the connective tissue that inspired ZipRecruiter.“I had to do my own recruiting,” Siegel said, “posting positions to different job boards, each with a different mechanism. For years I was saying, ‘This is crazy. Why isn’t there a magic button I can push and send the same job to all the different job boards and bring all the candidates onto one list, just make it easy and efficient to hire somebody?’”   The lessonSiegel was suffering massive guilt at one of those early jobs, managing a technology team on an interim basis for a West Hollywood firm called Citysearch from 1996 to 1998. He actually apologized to his team for being so unqualified, having studied only non-tech subjects in college.“They told me I was the best manager they ever had, because I listened,” Siegel said. “People didn’t need me to be an engineer. They needed me to be clear about the problem I wanted solved, and they needed the autonomy and the resources to go do it the way they wanted to do it.”Leadership style“Listen more than you talk,” Siegel said of his approach. “Describe the problem we’re trying to solve, describe what success looks like, and then keep listening, because your job is not to do all the work, your job is not to figure out the optimal solution, your job is to create space for all the smart people that you’ve hired to go work on that problem.” Advertisement    ‘Build the solution’“I pulled together three friends. Two of them were engineers, one a designer,” Siegel said. “The four of us worked at my kitchen table at night and on weekends, and we built the first version of ZipRecruiter, and literally the day we launched it, it was like a rocket ship, like right out of the gate, product market fit.”Comfortable fitSiegel had three co-founders who were essential to the start-up days, he said. Ward Poulos had worked with Siegel “at three different companies. When I was mulling on this idea, he was the first person I talked to.” Will Redd “was an engineer that we had both worked with at companies in the past.” Software wizard Joe Edmonds rounded out the group.“We were really aligned in terms of approach and personality, so it was very easy to work together,” Siegel said. All three are still with the company.Growing painsZipRecruiter found that fast growth creates its own problems, Siegel said. “It’s always difficult to scale fast,” he said. “Things always break. There’s this cliche saying that the person that’s right for a 10-person company isn’t right for a 100-person company, the person that’s right for a 100-person company isn’t right for a 1,000-person company, and it’s absolutely true.”Corporate raiders“As we grew, we literally cherry-picked the top 5% of talent that we had worked with across multiple businesses,” Siegel said, “and then we got all their No. 1 referenced friends as well. We have a development office in Israel staffed with some of the best data scientists in the world doing R&D for us. It’s high-level algorithmic work. We’re just applying it to the job category.”Embracing AI talentMany companies are stumbling as they attempt to embrace artificial intelligence and harness it to their business models. Siegel said AI has given his company a built-in advantage by more quickly extracting data from resumes and more efficiently generating likely matches.“We’re ZipRecruiter. We think we’re literally the easiest way to hire, so when we need to add all these bodies, all this expertise, we can eat our own dog food, because we have hired most of the people who work at ZipRecruiter, through ZipRecruiter, so that was probably our ace in the hole.”PersonalSiegel has been married to his wife, Rochelle, for 18 years. They have a 15-year-old daughter and an 11-year-old son. To clear his mind, Siegel prefers running to meditation, and he loves to read. “I’m fascinated by entrepreneurs telling their true truths, not the gilded PR-ready, ‘we were awesome from the beginning’ stories. I love the stories from the trenches. The ugly way that soup got made. I just find it reassuring, and it reminds me that it’s not easy for anyone.”     More to Read               Opinion: What’s behind the AI boom? Exploited humans   July 12, 2024                Granderson: So what if Gen Z applicants bring their parents to a job interview?   June 8, 2024                California advances measures targeting AI discrimination and deepfakes   May 29, 2024         ","{'@type': 'WebPage', '@id': 'https://www.latimes.com/business/la-fi-himi-siegel-20181111-story.html'}",,,"Ian Siegel, 45, is chief executive of Santa Monica-based ZipRecruiter, the company he co-founded in 2010 to disrupt the recruitment and hiring industry. Since then, more than 1.5 million businesses and more than 430 million job seekers have used the online employment marketplace, according to the company. ZipRecruiter has nearly 1,000 employees, a quarter of whom are engineers. Business acumenStudying sociology, psychology and English at Oberlin College wasn’t the waste of time that Siegel feared it might be once he started a career in business. “If you think of psychology as the individual, sociology as society and social psychology as the study of small group dynamics, I was already identifying the opinion leader, the emotional leader, early on in my career. I was breaking down every group into the categories I studied while I was in college, and it actually was really helpful,” Siegel said. The inspirationThe Los Angeles native held executive-level positions at six different companies over 15 years. In hindsight, he sees the connective tissue that inspired ZipRecruiter. “I had to do my own recruiting,” Siegel said, “posting positions to different job boards, each with a different mechanism. For years I was saying, ‘This is crazy. Why isn’t there a magic button I can push and send the same job to all the different job boards and bring all the candidates onto one list, just make it easy and efficient to hire somebody?’” The lessonSiegel was suffering massive guilt at one of those early jobs, managing a technology team on an interim basis for a West Hollywood firm called Citysearch from 1996 to 1998. He actually apologized to his team for being so unqualified, having studied only non-tech subjects in college. “They told me I was the best manager they ever had, because I listened,” Siegel said. “People didn’t need me to be an engineer. They needed me to be clear about the problem I wanted solved, and they needed the autonomy and the resources to go do it the way they wanted to do it.” Leadership style“Listen more than you talk,” Siegel said of his approach. “Describe the problem we’re trying to solve, describe what success looks like, and then keep listening, because your job is not to do all the work, your job is not to figure out the optimal solution, your job is to create space for all the smart people that you’ve hired to go work on that problem.” ‘Build the solution’“I pulled together three friends. Two of them were engineers, one a designer,” Siegel said. “The four of us worked at my kitchen table at night and on weekends, and we built the first version of ZipRecruiter, and literally the day we launched it, it was like a rocket ship, like right out of the gate, product market fit.” Comfortable fitSiegel had three co-founders who were essential to the start-up days, he said. Ward Poulos had worked with Siegel “at three different companies. When I was mulling on this idea, he was the first person I talked to.” Will Redd “was an engineer that we had both worked with at companies in the past.” Software wizard Joe Edmonds rounded out the group. “We were really aligned in terms of approach and personality, so it was very easy to work together,” Siegel said. All three are still with the company. Growing painsZipRecruiter found that fast growth creates its own problems, Siegel said. “It’s always difficult to scale fast,” he said. “Things always break. There’s this cliche saying that the person that’s right for a 10-person company isn’t right for a 100-person company, the person that’s right for a 100-person company isn’t right for a 1,000-person company, and it’s absolutely true.” Corporate raiders“As we grew, we literally cherry-picked the top 5% of talent that we had worked with across multiple businesses,” Siegel said, “and then we got all their No. 1 referenced friends as well. We have a development office in Israel staffed with some of the best data scientists in the world doing R&D for us. It’s high-level algorithmic work. We’re just applying it to the job category.” Embracing AI talentMany companies are stumbling as they attempt to embrace artificial intelligence and harness it to their business models. Siegel said AI has given his company a built-in advantage by more quickly extracting data from resumes and more efficiently generating likely matches. “We’re ZipRecruiter. We think we’re literally the easiest way to hire, so when we need to add all these bodies, all this expertise, we can eat our own dog food, because we have hired most of the people who work at ZipRecruiter, through ZipRecruiter, so that was probably our ace in the hole.” PersonalSiegel has been married to his wife, Rochelle, for 18 years. They have a 15-year-old daughter and an 11-year-old son. To clear his mind, Siegel prefers running to meditation, and he loves to read. “I’m fascinated by entrepreneurs telling their true truths, not the gilded PR-ready, ‘we were awesome from the beginning’ stories. I love the stories from the trenches. The ugly way that soup got made. I just find it reassuring, and it reminds me that it’s not easy for anyone.”",,,"{'@type': ['CreativeWork', 'Product'], 'name': 'Los Angeles Times', 'productID': 'lanews:all-access'}",,,,,,"{'@type': 'WebPageElement', 'isAccessibleForFree': False, 'cssSelector': '.paywall'}",,,,,,,,,,,,
https://news.google.com/rss/articles/CBMia2h0dHBzOi8vd3d3LmNvbnN0cnVjdGlvbnNwZWNpZmllci5jb20vaG93LWFydGlmaWNpYWwtaW50ZWxsaWdlbmNlLWlzLWNoYW5naW5nLXRoZS1pbmR1c3RyeS1hLWNzaS1leGNsdXNpdmUv0gEA?oc=5,How artificial intelligence is changing the industry: A CSI exclusive - Construction Specifier - The Construction Specifier,2018-11-12,The Construction Specifier,https://www.constructionspecifier.com,"Machine learning, algorithms, and specialized artificial intelligence (AI) are impacting the construction industry, largely in the area of design. While jobs may not be eliminated, it will change. Certain aspects of a specifier’s work, such as activities requiring minimal complex thinking, can be done better and faster by some form of AI. Removing these job functions may also be welcomed by many professionals.",N/A,"Machine learning, algorithms, and specialized artificial intelligence (AI) are impacting the construction industry, largely in the area of design. While jobs may not be eliminated, it will change. Certain aspects of a specifier’s work, such as activities requiring minimal complex thinking, can be done better and faster by some form of AI. Removing these job functions may also be welcomed by many professionals.",N/A,https://schema.org,,,,,,,,,,,,,N/A,N/A,"

Digital craftsmanship in stone designModern technology has made its mark on stone design as well as fabrication. Today, project teams taking advantage of technology are experiencing increased freedom in control of the design concept, from development through to fabrication. 

",,,,,,,,,"[{'@type': 'Article', '@id': 'https://www.constructionspecifier.com/how-artificial-intelligence-is-changing-the-industry-a-csi-exclusive/#article', 'isPartOf': {'@id': 'https://www.constructionspecifier.com/how-artificial-intelligence-is-changing-the-industry-a-csi-exclusive/'}, 'author': {'name': 'nithya_caleb', '@id': 'https://www.constructionspecifier.com/#/schema/person/b98ef8acdc4f61ec3c542bdb863ee469'}, 'headline': 'How artificial intelligence is changing the industry: A CSI exclusive', 'datePublished': '2018-11-12T17:31:54+00:00', 'dateModified': '2018-11-12T17:31:54+00:00', 'mainEntityOfPage': {'@id': 'https://www.constructionspecifier.com/how-artificial-intelligence-is-changing-the-industry-a-csi-exclusive/'}, 'wordCount': 229, 'commentCount': 0, 'publisher': {'@id': 'https://www.constructionspecifier.com/#organization'}, 'image': {'@id': 'https://www.constructionspecifier.com/how-artificial-intelligence-is-changing-the-industry-a-csi-exclusive/#primaryimage'}, 'thumbnailUrl': 'https://www.constructionspecifier.com/wp-content/uploads/2018/11/featured-4.jpg', 'keywords': ['Artificial Intelligence', 'CSI', 'Industry Trends'], 'articleSection': ['Columns', 'Inside CSI'], 'inLanguage': 'en-US', 'potentialAction': [{'@type': 'CommentAction', 'name': 'Comment', 'target': ['https://www.constructionspecifier.com/how-artificial-intelligence-is-changing-the-industry-a-csi-exclusive/#respond']}]}, {'@type': 'WebPage', '@id': 'https://www.constructionspecifier.com/how-artificial-intelligence-is-changing-the-industry-a-csi-exclusive/', 'url': 'https://www.constructionspecifier.com/how-artificial-intelligence-is-changing-the-industry-a-csi-exclusive/', 'name': 'How artificial intelligence is changing the industry: A CSI exclusive - Construction Specifier', 'isPartOf': {'@id': 'https://www.constructionspecifier.com/#website'}, 'primaryImageOfPage': {'@id': 'https://www.constructionspecifier.com/how-artificial-intelligence-is-changing-the-industry-a-csi-exclusive/#primaryimage'}, 'image': {'@id': 'https://www.constructionspecifier.com/how-artificial-intelligence-is-changing-the-industry-a-csi-exclusive/#primaryimage'}, 'thumbnailUrl': 'https://www.constructionspecifier.com/wp-content/uploads/2018/11/featured-4.jpg', 'datePublished': '2018-11-12T17:31:54+00:00', 'dateModified': '2018-11-12T17:31:54+00:00', 'breadcrumb': {'@id': 'https://www.constructionspecifier.com/how-artificial-intelligence-is-changing-the-industry-a-csi-exclusive/#breadcrumb'}, 'inLanguage': 'en-US', 'potentialAction': [{'@type': 'ReadAction', 'target': ['https://www.constructionspecifier.com/how-artificial-intelligence-is-changing-the-industry-a-csi-exclusive/']}]}, {'@type': 'ImageObject', 'inLanguage': 'en-US', '@id': 'https://www.constructionspecifier.com/how-artificial-intelligence-is-changing-the-industry-a-csi-exclusive/#primaryimage', 'url': 'https://www.constructionspecifier.com/wp-content/uploads/2018/11/featured-4.jpg', 'contentUrl': 'https://www.constructionspecifier.com/wp-content/uploads/2018/11/featured-4.jpg', 'width': 600, 'height': 401}, {'@type': 'BreadcrumbList', '@id': 'https://www.constructionspecifier.com/how-artificial-intelligence-is-changing-the-industry-a-csi-exclusive/#breadcrumb', 'itemListElement': [{'@type': 'ListItem', 'position': 1, 'name': 'Home', 'item': 'https://www.constructionspecifier.com/'}, {'@type': 'ListItem', 'position': 2, 'name': 'How artificial intelligence is changing the industry: A CSI exclusive'}]}, {'@type': 'WebSite', '@id': 'https://www.constructionspecifier.com/#website', 'url': 'https://www.constructionspecifier.com/', 'name': 'Construction Specifier', 'description': 'Solutions for the Construction Industry', 'publisher': {'@id': 'https://www.constructionspecifier.com/#organization'}, 'potentialAction': [{'@type': 'SearchAction', 'target': {'@type': 'EntryPoint', 'urlTemplate': 'https://www.constructionspecifier.com/?s={search_term_string}'}, 'query-input': 'required name=search_term_string'}], 'inLanguage': 'en-US'}, {'@type': 'Organization', '@id': 'https://www.constructionspecifier.com/#organization', 'name': 'The Construction Specifier', 'url': 'https://www.constructionspecifier.com/', 'logo': {'@type': 'ImageObject', 'inLanguage': 'en-US', '@id': 'https://www.constructionspecifier.com/#/schema/logo/image/', 'url': 'https://www.constructionspecifier.com/wp-content/uploads/2017/09/CS_Logo_BW_LR.jpg', 'contentUrl': 'https://www.constructionspecifier.com/wp-content/uploads/2017/09/CS_Logo_BW_LR.jpg', 'width': 288, 'height': 70, 'caption': 'The Construction Specifier'}, 'image': {'@id': 'https://www.constructionspecifier.com/#/schema/logo/image/'}}, {'@type': 'Person', '@id': 'https://www.constructionspecifier.com/#/schema/person/b98ef8acdc4f61ec3c542bdb863ee469', 'name': 'nithya_caleb', 'image': {'@type': 'ImageObject', 'inLanguage': 'en-US', '@id': 'https://www.constructionspecifier.com/#/schema/person/image/', 'url': 'https://secure.gravatar.com/avatar/7a28b8c910d60115947aa67b1242a27b?s=96&d=mm&r=g', 'contentUrl': 'https://secure.gravatar.com/avatar/7a28b8c910d60115947aa67b1242a27b?s=96&d=mm&r=g', 'caption': 'nithya_caleb'}, 'url': 'https://www.constructionspecifier.com/author/nithya_caleb/'}]",,,,,,,,,,,,,,,,
