URL link,Title,Date,Source,Source Link,description,keywords,og:description,twitter:description,@context,@type,name,logo,url,sameAs,itemListElement,publisher,headline,author,mainEntityOfPage,articleBody,datePublished,dateModified,image,article:section,article:summary,article text,articleSection,isAccessibleForFree,@graph,expires,location,email,potentialAction,genre,wordcount,foundingDate,founder,employee,inLanguage,thumbnailUrl,dateCreated,isPartOf,alternativeHeadline,alternateName,speakable,creator,isBasedOn,publishingPrinciples
https://news.google.com/rss/articles/CBMiY2h0dHBzOi8vZm9ydHVuZS5jb20vMjAyMi8wNS8wNi9haS1hcnRpZmljaWFsLWludGVsbGlnZW5jZS1odW1hbi1jb2xsYWJvcmF0aW9uLXdhdHNvbi1kb21pbm9zLXBpenphL9IBAA?oc=5,Artificial Intelligence: 3 keys to perfecting the human-A.I. combination for your business - Fortune,2022-05-06,Fortune,https://fortune.com,"Domino's Pizza, IBM's Watson, and miner Rio Tinto offer roadmaps for getting the most out of A.I.",,Leadership lessons from IBM's Watson—and Domino's Pizza.,Leadership lessons from IBM's Watson—and Domino's Pizza.,,,,,,,,,,,,,,,,N/A,N/A,"Commentary - EducationBlanket phone bans in schools are well-intentioned—but they could backfireBYDylan DiamondJuly 19, 2024",,,,,,,,,,,,,,,,,,,,,,
https://news.google.com/rss/articles/CBMiZmh0dHBzOi8vd3d3LmF1dG9kZXNrLmNvbS9ibG9ncy93YXRlci8yMDIyLzA1LzAxL2FpLWluLXdhdGVyLTEwLXdheXMtYWktaXMtY2hhbmdpbmctdGhlLXdhdGVyLWluZHVzdHJ5L9IBAA?oc=5,AI for water: 10 ways AI is changing the water industry - Autodesk Redshift,2022-05-01,Autodesk Redshift,https://www.autodesk.com,The potential of AI for water is vast. Here are 10 ways we see AI already changing the way water professionals work.,N/A,The potential of AI for water is vast. Here are 10 ways we see AI already changing the way water professionals work.,N/A,https://schema.org,,,,,,,,,,,,,,,N/A,N/A,"
Artificial intelligence (AI) is making its mark on the water industry, powering intelligent operations using machine learning to optimize resource use and operational budgets for organizations. Here are 10 ways AI is already changing the water industry, from business innovations that save money and make work more efficient to helping combat global water challenges by lowering overall water consumption.
1. AI will drive a decade of technology investment in water and wastewater
Water and wastewater operations are investing in artificial intelligence. Market research is forecasting $6.3 Billion of investment in AI solutions by the year 2030. This investment is a part of a growing trend for the water industry to “go digital” with smart infrastructure solutions. 


Mel Meng on training AI to SWMM: Can AI help predict sewer flows?
One example of AI in action is in predicting sewer flows. Sewer systems are critical infrastructure that transport wastewater to treatment plants, but with the impacts of climate change, aging infrastructure, and historical design practices, too much raw sewage is being released into our environment, causing harm to our planet and damaging properties. By training an AI model with thousands of examples, the model can learn to predict the next flow value, without the need to know the exact processes. 
2. AI will deliver significant OPEX savings
When some US utilities are spending over $300 per customer annually on water and wastewater operations, the potential for savings is significant. AI can save 20-30% on operational expenditures (OPEX) by reducing energy costs, optimizing chemical use for treatment, and enabling proactive asset maintenance.
3. AI will predict emergency events and learn from them at an accelerated rate
Water main breaks are costly for utilities in both financial and social capital. Articifical intelligence and machine learning can “fingerprint” the data patterns that indicate a break event may be imminent and learn from these patterns so that alerts become more accurate over time.


Water Talk: A guide to low-hanging AI fruit for the water and wastewater sector.
4. AI will provide sophisticated decisioning intelligence to support operators
Operators no longer need to analyze complex variables for important decision-making by themselves. Whether it’s turning pumps on or off, determining chemical dosages, or deciding when to maintain assets, AI enables “Operator 2.0” with intelligent recommendations and driven by machine learning.
5. AI will optimize energy use for both drinking water and wastewater
According to the EPA, for many municipal governments, drinking water and wastewater plants are their largest energy consumers, often accounting for 30 to 40 percent of their total energy consumed. That rolls up nationally to a large amount, with drinking water and wastewater systems accounting for approximately 2 percent of energy use in the United States. 
AI can optimize pump runtimes so that they are only using energy when they need to. This should be an easy cost-reduction win for early adopters of AI.
6. AI will help identify overconsumers of water and help them find ways to use less
The kind of efficiency artificial intelligence promises in water savings goes far beyond traditional utility operations and water distribution, for example in the realm of water footprints for datacenter management. Datacenters are becoming ever more pervasive and need ever-more energy to operate. They also need to build water cooling towers to cool the massive racks of servers they have set up in giant warehouses. 
Datacenters have become massive users of water for cooling racks of servers. Can AI help? 
This is all perhaps a bit ironic, considering that AI and machine learning applications themselves require significant datacenter resources, both in terms of raw energy usage and water usage for water. In some sense, energy-hungry AI applications may need to fulfill their water efficiency promises to alleviate their own water usage. 
Currently, more than 30 percent of the datacenters in the world are located in the US, accounting for around 2% of national elecricity usage. That’s as much energy as water and wastewater plants themselves use. Compiling accurate numbers for water usage by datacenters can be a challenge because the industry appears hesitant to share numbers, but we are already seeing big names like Google be more transparent about their water usage, which may encourage more transparency and solution seeking. 
It’s reasonable to assume that these operators know the amount of water they are using is too high and that they themselves will want to find innovative ways related to AI to help reduce their usage, both to realize more cost savings and improve their optics around the issue of sustainability. 
7. AI will keep water clean, cost-effectively
Meeting effluent compliance standards is a requirement for many organizations – both public and private. AI learns from the unique characteristics of your site to ensure that effluence standards are met and that compliance fees are avoided.
8. AI will simplify data integrity
An explosion of available data for water operations managers has brought along a challenge of data management. SCADA systems, CMMS, and even social media hold a wealth of knowledge to improve operations. AI can take this heterogeneous data and process it so that it is clean, useful, secure, and drives high-fidelity recommendations.
9. AI will retain institutional knowledge
How do you ensure that a veteran operator’s valuable knowledge is retained after they leave the workforce? AI-powered dashboards will keep institutional knowledge documented and standardized.
10. AI will accelerate the move to value-based asset maintenance
Early adopters of AI are quickly leaving reactive asset maintenance behind. Time-based maintenance is easy to manage but results in unnecessary uptime and deterioration. Let AI tell your team what assets need to be serviced, and when.
",,,"[{'@type': 'WebPage', '@id': 'https://www.autodesk.com/blogs/water/2022/05/01/ai-in-water-10-ways-ai-is-changing-the-water-industry/', 'url': 'https://www.autodesk.com/blogs/water/2022/05/01/ai-in-water-10-ways-ai-is-changing-the-water-industry/', 'name': 'AI for water: 10 ways AI is changing the water industry - One Water Blog', 'isPartOf': {'@id': 'https://www.autodesk.com/blogs/water/#website'}, 'primaryImageOfPage': {'@id': 'https://www.autodesk.com/blogs/water/2022/05/01/ai-in-water-10-ways-ai-is-changing-the-water-industry/#primaryimage'}, 'image': {'@id': 'https://www.autodesk.com/blogs/water/2022/05/01/ai-in-water-10-ways-ai-is-changing-the-water-industry/#primaryimage'}, 'thumbnailUrl': 'https://www.autodesk.com/blogs/water/wp-content/uploads/sites/37/2022/11/AI_water_waves.jpg', 'datePublished': '2022-05-01T23:56:59+00:00', 'dateModified': '2023-12-19T18:47:24+00:00', 'author': {'@id': 'https://www.autodesk.com/blogs/water/#/schema/person/70279aa78d4c429cd3202c0dbea65c15'}, 'description': 'The potential of AI for water is vast. Here are 10 ways we see AI already changing the way water professionals work.', 'breadcrumb': {'@id': 'https://www.autodesk.com/blogs/water/2022/05/01/ai-in-water-10-ways-ai-is-changing-the-water-industry/#breadcrumb'}, 'inLanguage': 'en-US', 'potentialAction': [{'@type': 'ReadAction', 'target': ['https://www.autodesk.com/blogs/water/2022/05/01/ai-in-water-10-ways-ai-is-changing-the-water-industry/']}]}, {'@type': 'ImageObject', 'inLanguage': 'en-US', '@id': 'https://www.autodesk.com/blogs/water/2022/05/01/ai-in-water-10-ways-ai-is-changing-the-water-industry/#primaryimage', 'url': 'https://www.autodesk.com/blogs/water/wp-content/uploads/sites/37/2022/11/AI_water_waves.jpg', 'contentUrl': 'https://www.autodesk.com/blogs/water/wp-content/uploads/sites/37/2022/11/AI_water_waves.jpg', 'width': 1000, 'height': 616, 'caption': 'AI waves'}, {'@type': 'BreadcrumbList', '@id': 'https://www.autodesk.com/blogs/water/2022/05/01/ai-in-water-10-ways-ai-is-changing-the-water-industry/#breadcrumb', 'itemListElement': [{'@type': 'ListItem', 'position': 1, 'name': 'Home', 'item': 'https://www.autodesk.com/blogs/water/'}, {'@type': 'ListItem', 'position': 2, 'name': 'AI for water: 10 ways AI is changing the water industry'}]}, {'@type': 'WebSite', '@id': 'https://www.autodesk.com/blogs/water/#website', 'url': 'https://www.autodesk.com/blogs/water/', 'name': 'One Water Blog', 'description': 'Because every drop matters', 'potentialAction': [{'@type': 'SearchAction', 'target': {'@type': 'EntryPoint', 'urlTemplate': 'https://www.autodesk.com/blogs/water/?s={search_term_string}'}, 'query-input': 'required name=search_term_string'}], 'inLanguage': 'en-US'}, {'@type': 'Person', '@id': 'https://www.autodesk.com/blogs/water/#/schema/person/70279aa78d4c429cd3202c0dbea65c15', 'name': 'Autodesk', 'image': {'@type': 'ImageObject', 'inLanguage': 'en-US', '@id': 'https://www.autodesk.com/blogs/water/#/schema/person/image/3b5284dbf6cf0d362e42fd45f82857d3', 'url': 'https://www.autodesk.com/blogs/water/wp-content/uploads/sites/37/autodesk-a.jpg', 'contentUrl': 'https://www.autodesk.com/blogs/water/wp-content/uploads/sites/37/autodesk-a.jpg', 'caption': 'Autodesk'}, 'url': 'https://www.autodesk.com/blogs/water/author/jeremyjohns/'}]",,,,,,,,,,,,,,,,,,,
https://news.google.com/rss/articles/CBMiaGh0dHBzOi8vd3d3LmZvcmJlcy5jb20vc2l0ZXMvYmVybmFyZG1hcnIvMjAyMi8wNS8wNi90aGUtYmVuZWZpdHMtYW5kLWRhbmdlcnMtb2YtdXNpbmctYWktaW4tcmVjcnVpdG1lbnQv0gEA?oc=5,The Benefits And Dangers Of Using AI In Recruitment - Forbes,2022-05-06,Forbes,https://www.forbes.com,Artificial Intelligence (AI) has made massive inroads into wider HR practices and recruitment in particular. Here we look at the problems as well as benefits of using AI in recruitment. ,"Infosys,AI,Artificial Intelligence,Recruitment,Jobs,Careers",Artificial Intelligence (AI) has made massive inroads into wider HR practices and recruitment in particular. Here we look at the problems as well as benefits of using AI in recruitment. ,Artificial Intelligence (AI) has made massive inroads into wider HR practices and recruitment in particular. Here we look at the problems as well as benefits of using AI in recruitment. ,http://schema.org,BreadcrumbList,The Benefits And Dangers Of Using AI In Recruitment,,https://www.forbes.com/sites/bernardmarr/2022/05/06/the-benefits-and-dangers-of-using-ai-in-recruitment/,,"[{'@type': 'ListItem', 'position': 1, 'name': 'Forbes Homepage', 'item': 'https://www.forbes.com/'}, {'@type': 'ListItem', 'position': 2, 'name': 'Innovation', 'item': 'https://www.forbes.com/innovation/'}, {'@type': 'ListItem', 'position': 3, 'name': 'Enterprise Tech', 'item': 'https://www.forbes.com/enterprise-tech/'}]","{'@type': 'NewsMediaOrganization', 'name': 'Forbes', 'url': 'https://www.forbes.com/', 'ethicsPolicy': 'https://www.forbes.com/sites/forbesstaff/article/forbes-editorial-values-and-standards/', 'logo': 'https://imageio.forbes.com/i-forbesimg/media/amp/images/forbes-logo-dark.png?format=png&height=455&width=650&fit=bounds'}",The Benefits And Dangers Of Using AI In Recruitment,"{'@type': 'Person', 'name': 'Bernard Marr', 'url': 'https://www.forbes.com/sites/bernardmarr/', 'description': 'Bernard Marr is a world-renowned futurist, board advisor and author of Generative AI in Practice: 100+ Amazing Ways Generative Artificial Intelligence is Changing Business and Society. He has written over 20 best-selling and award-winning books and advises and coaches many of the world’s best-known organisations. He has a combined following of 4 million people across his social media channels and newsletters and was ranked by LinkedIn as one of the top 5 business influencers in the world. Follow Bernard on LinkedIn, X (Twitter) or YouTube. Join his newsletter, check out his website and books.', 'sameAs': ['https://www.linkedin.com/in/bernardmarr/', 'https://www.twitter.com/BernardMarr', 'https://bernardmarr.com/']}",,,2022-05-06T01:19:47-04:00,2022-05-09T05:30:38-04:00,"{'@type': 'ImageObject', 'url': 'https://imageio.forbes.com/specials-images/imageserve/6274afa31115eb7c6b1222ff/0x0.jpg?format=jpg&height=900&width=1600&fit=bounds', 'width': 542.79, 'height': 304.6}",Enterprise Tech,N/A,"More From ForbesJul 19, 2024,09:00am EDTThe Transformative Power Of Generative AI And Knowledge ManagementJul 19, 2024,02:31am EDTOptical Media From Cerabyte Promises Fast Access Archival StorageJul 19, 2024,01:59am EDTHow Walmart Business Is Revolutionizing B2B Shopping With AI: A Deep Dive Into The Future Of RetailJul 18, 2024,06:57pm EDTCatalyzing Change: How Juicyhub Is Fostering Local Innovation In BrazilJul 17, 2024,11:06am EDTAI Adoption Is Driving Real Top - And Bottom-Line Impact For EnterprisesJul 16, 2024,01:02pm EDTThe CEO’s Guide To Building Generative AIJul 16, 2024,01:24am EDT22 Generative AI Workplace Tools And How To Use ThemEdit StoryForbesInnovationEnterprise TechThe Benefits And Dangers Of Using AI In RecruitmentBernard MarrContributorOpinions expressed by Forbes Contributors are their own.FollowingFollowClick to save this article.You'll be asked to sign into your Forbes account.Got itMay 6, 2022,01:19am EDTUpdated May 9, 2022, 05:30am EDTThis article is more than 2 years old.Share to FacebookShare to TwitterShare to LinkedinWhen it comes to hiring and firing, artificial intelligence (AI) has an image problem. Many of us don’t like the idea of putting decisions that can seriously impact people’s lives in the hands of machines, particularly when we might not necessarily understand how and why they do what they do.
The Benefits And Dangers Of Using AI In RecruitmentAdobe Stock

But what if it turns out that machines were actually capable of making decisions in a way that is fairer and less prone to prejudice and bias than decisions made by humans? For many of those working on the problem of applying machine intelligence to recruitment and HR, this is the goal. And going a step further than that, is it possible that AI can help overcome the challenges of today’s fast-changing hiring landscape? The shift to home and remote working prompted by the global Covid-19 pandemic, as well as related developments such as the “great resignation”, require HR departments to navigate and predict their way around complex and ever-changing employee behavioral patterns.

These are the type of patterns that AI excels at recognizing, understanding, and predicting. This is why Google is so good at predicting what you want to search for, and Netflix is so accurate at predicting what you want to watch next – 80% of viewing on the streaming service is apparently driven by recommendations!

PROMOTED
Nevertheless, while we might be happy for a machine to help us choose which movie to watch next, we might feel a bit uneasy at the thought of it deciding whether we can have a job or not – or which workers a company should hire or fire.

I was reassured to learn that these are concerns that are shared by Frida Polli, the CEO and founder of Pymetrics – one of the leading AI-driven recruitment platforms. I was recently joined by Polli for a conversation in which we discussed the ethical implications of this type of technology, as well as how it is evolving to help companies understand concepts like “soft skills”. These are concepts that can be vital to understanding how well a candidate might fit a certain role but are often poorly conveyed by traditional recruitment data gathering channels – such as resumes and interviews.
MORE FROMFORBES ADVISORBest Travel Insurance CompaniesByAmy DaniseEditorBest Covid-19 Travel Insurance PlansByAmy DaniseEditor
Crucially, by helping organizations get a better understanding of what candidates have to offer in this regard, they can lead to less biased and more effective recruiting decisions. This is a view held not just by Polli but by one of her company's customers – Tan Moorthy, global head of education, training, and assessment at Infosys. Moorthy also joined us in the conversation.









DailyDozen
US


Forbes Daily: Join over 1 million Forbes Daily subscribers and get our best stories, exclusive reporting and essential analysis of the day’s news in your inbox every weekday.




                Sign Up
            


By signing up, you agree to receive this newsletter, other updates about Forbes and its affiliates’ offerings, our Terms of Service (including resolving disputes on an individual basis via arbitration), and you acknowledge our Privacy Statement. Forbes is protected by reCAPTCHA, and the Google Privacy Policy and Terms of Service apply.




You’re all set! Enjoy the Daily!


                More Newsletters
            


You’re all set! Enjoy the Daily!

                More Newsletters
            



Moorthy says, ""If you look at what's going on with technology skills, the lifespan of how long they're relevant is reducing on the one hand, and then we have automation that is taking away roles that people can do.


1/1





Skip Ad
 
Continue watchingafter the adVisit Advertiser websiteGO TO PAGE
“What that means is … you need to figure out ways in which people can coexist with machines. That’s the critical need … you have to recruit the right talent [and] it's important therefore to bring in people not based on their degrees but on their skills.”
At Infosys, this understanding of the current challenges in the employment space has led to the establishment of the Reskill and Restart program. The program is built around a free-to-use online platform that connects employers and trainers with jobseekers and potential hires based on their skills and interests rather than their backgrounds and education. So far, it has enabled hundreds of people to reskill for profitable and rewarding careers in the tech industry.
Pymetrics has played an important role in this process thanks to its innovative AI-powered employment decisioning tools.
“I completely understand the concerns around AI. It’s incumbent around tech providers like ourselves to prove we’re equitable … but once we can do that, it's critical for societies to start leveraging some of these platforms - like Reskill and Restart and Pymetrics – that can really help with these broad labor market problems”, Polli tells me.
Polli took the time to explain to me some of the principles behind the way that Pymetrics specifically works. By assessing the soft skills – such as a person’s communication and decision-making ability, as well as their empathy, generosity, or altruism – smarter decisions can be made about who might be a good fit for particular roles. This doesn’t necessarily mean that it differentiates between “good” and “bad” people, as might be implied by the fact it is assessing, for example, altruism.
“What’s amazing … is that everything can be personalized”, she says.
“I get the question all the time, ‘what are the soft skills people need?’ – but that’s not a thing – the soft skills you need to be a successful entrepreneur versus a successful accountant versus a successful CIA agent are completely different … and what’s beautiful about [AI] is that we can be very prescriptive and personalized in our recommendations.
“I might not have the soft skill profile to be an accountant because I’m biased to action and not very methodical, but … an entrepreneur – I can do that.”
This new way of assessing potential is potentially highly valuable in a world where machines will inevitably be making humans redundant in some roles – such as drivers and machine operators – and free them up to take on different, potentially more rewarding tasks.
“Gone are the 1980s… ‘oh, if you’re this, then you'll do this, and you'll be successful – and if you're not, you're out of luck … technology enables us to do that,"" says Polli.
Moorthy says that this type of intelligent assessment and personalized recommendation is crucial to the role Infosys hopes to play in reskilling the workforce of tomorrow.
“We have to look out for people who are in different professions – who want to make a move into technology, and create a pathway for them to get there,” he tells me.
“Recruitment will therefore have to look out for people who have … the ability and desire to learn new things … and the capability of saying ‘I transferred these skills from my last job into this profession, or this industry’. So transferrable skills will be important, and recruitment will have to constantly look out for means by which we can identify those people who carry those transferrable skills, so they can learn and become the talent of the future.""
You can watch my conversation with Frida Polli, CEO and co-founder of Pymetrics, and Tan Moorthy, global head of education, training, and assessments at Infosys, here.
Follow me on Twitter or LinkedIn. Check out my website or some of my other work here. Bernard MarrFollowingFollowBernard Marr is a world-renowned futurist, board advisor and author of Generative AI in Practice: 100+ Amazing Ways Generative Artificial Intelligence is... Read MoreEditorial StandardsPrintReprints & Permissions",Enterprise Tech,False,,,,,,,,,,,,,,,,,,,,
