URL link,Title,Date,Source,Source Link,description,keywords,og:description,twitter:description,@context,@type,url,image,author,publisher,headline,datePublished,dateModified,articleSection,name,isAccessibleForFree,itemListElement,article:section,article:summary,article text,mainEntityOfPage,dateCreated,heading,articleBody,isBasedOn,thumbnailUrl,isPartOf,alternativeHeadline,@graph,identifier,creator,mentions,hasPart,address,diversityPolicy,email,legalName,leiCode,telephone,logo,brand,dateline,uploadDate,duration,potentialAction
https://news.google.com/rss/articles/CBMiqwFodHRwczovL3d3dy5tY2tpbnNleS5jb20vY2FwYWJpbGl0aWVzL21ja2luc2V5LWRpZ2l0YWwvb3VyLWluc2lnaHRzL2hvdy1ib3RzLWFsZ29yaXRobXMtYW5kLWFydGlmaWNpYWwtaW50ZWxsaWdlbmNlLWFyZS1yZXNoYXBpbmctdGhlLWZ1dHVyZS1vZi1jb3Jwb3JhdGUtc3VwcG9ydC1mdW5jdGlvbnPSAQA?oc=5,"How bots, algorithms, and artificial intelligence are reshaping the future of corporate support functions - McKinsey",2018-11-15,McKinsey,https://www.mckinsey.com,Industrial companies are discovering additional sources of value in applying advanced technology to general and administrative support functions. The results can be impressive for businesses that can adapt to the disruption of legacy systems.,N/A,Industrial companies are discovering additional sources of value in applying advanced technology to general and administrative support functions. The results can be impressive for businesses that can adapt to the disruption of legacy systems.,Industrial companies are discovering additional sources of value in applying advanced technology to general and administrative support functions. The results can be impressive for businesses that can adapt to the disruption of legacy systems.,https://schema.org,Article,https://www.mckinsey.com,https://www.mckinsey.com/~/media/mckinsey/business%20functions/mckinsey%20digital/our%20insights/how%20bots%20algorithms%20ai%20are%20reshaping/hero-bots-algorithms-and-artificial-intelligence.jpg,"[{'@type': 'Person', 'name': 'Alexander Edlich', 'url': 'https://www.mckinsey.com/our-people/alexander-edlich'}, {'@type': 'Person', 'name': 'Fanny Ip'}, {'@type': 'Person', 'name': 'Rob Whiteman'}]","{'@type': 'Organization', 'name': 'McKinsey & Company', 'logo': {'@type': 'ImageObject', 'url': 'https://www.mckinsey.com/~/media/Thumbnails/Mck_Logo'}}",,2018-11-15T00:00:00Z,2018-11-15T00:00:00Z,,,,,N/A,N/A,N/A,"{'@type': 'WebPage', '@id': 'https://www.mckinsey.com/capabilities/mckinsey-digital/our-insights/how-bots-algorithms-and-artificial-intelligence-are-reshaping-the-future-of-corporate-support-functions'}",2018-09-19T14:22:27Z,"How bots, algorithms, and artificial intelligence are reshaping the future of corporate support functions",,,,,,,,,,,,,,,,,,,,,,
https://news.google.com/rss/articles/CBMiR2h0dHBzOi8vd3d3Lmdlb3NwYXRpYWx3b3JsZC5uZXQvYmxvZ3MvcHV0dGluZy10cmFmZmljLXNpZ25zLW9uLXRoZS1tYXAv0gEA?oc=5,Putting traffic signs on the map: How artificial intelligence can help - Geospatial World,2018-11-14,Geospatial World,https://www.geospatialworld.net,"The GIS market is booming. It’s set to surge from $5.81 billion in 2017 to $10.03 billion by 2023, but in spite of this, many small cities across the US still just have a one-person GIS shop",N/A,"The GIS market is booming. It’s set to surge from $5.81 billion in 2017 to $10.03 billion by 2023, but in spite of this, many small cities across the US still just have a one-person GIS shop",N/A,http://schema.org,BreadcrumbList,,,,,,,,,,,"[{'@type': 'ListItem', 'position': 1, 'item': {'@type': 'WebSite', '@id': 'https://www.geospatialworld.net/', 'name': 'Home'}}, {'@type': 'ListItem', 'position': 2, 'item': {'@type': 'WebPage', '@id': 'https://www.geospatialworld.net/blogs/', 'name': 'Blogs'}}, {'@type': 'ListItem', 'position': 3, 'item': {'@type': 'WebPage', '@id': 'https://www.geospatialworld.net/blogs/putting-traffic-signs-on-the-map/', 'name': 'Putting traffic signs on the map: How artificial intelligence can help'}}]",N/A,N/A,"

Home  Blogs  Putting traffic signs on the map: How artificial intelligence can help
Blogs

Putting traffic signs on the map: How artificial intelligence can help

By Madelen Arnesdotter -   11/14/2018      4 Minutes Read 




The GIS market is booming. It’s set to surge from $5.81 billion in 2017 to $10.03 billion by 2023, but in spite of this, many small cities across the US still just have a one-person GIS shop, tasked with everything from informing and analyzing urban planning to doing street-level inventory. Time is scarce, and if you work for a city council, money tends to be as well—yet you’re expected to keep track of street assets and their overall conditions.
Steven Hewett’s situation was no different. A GIS specialist at the City of Clovis in New Mexico, a town of 39,000, Steven needed to undertake a complete traffic sign inventory of the approximately 24 square mile city–something that had never been done before. City managers assumed this task could be completed fairly easily and within a month, but no-one knew how many signs were actually out there.
Steven in his office
Asset data collection can be painstakingly time-consuming and expensive. It usually involves either going out yourself to every location and manually recording the data you need, or hiring a contractor to do it for you. With manual traffic sign inventory costing upwards of $4-6 per sign, this would cost a city like Clovis, which Steven now knows has about 4000 traffic signs, somewhere around $16,000-24,000. To a small city council, this is not an insignificant sum of cash.
Like many cities around the world, Clovis had never done a traffic sign inventory before and had little idea how many traffic signs were even out there and what shape they were in (pun intended!). After some investigation, Steven ended up using Mapillary, an AI-powered street-level imagery platform. Instead of hiring a contractor to do surveying, Steven mounted some cameras on his car and captured 200,000 images of the streets of Clovis. Once uploaded to Mapillary, the images are processed with computer vision, a form of artificial intelligence, to automatically detect and analyze data such as traffic signs.
Steven mounting cameras on his car to go out and capture imagery of the streets of Clovis. He mapped all of Clovis in just a few months, but thinks he could have done it in just a few days if he had done it in one go.
Even though Steven was the only person collecting images, and though he juggled it alongside other day-to-day tasks, the entire process took a couple of months. Had he done it in one go, Steven says it could have been done in just a few days—a huge time saving compared to doing the work manually:
“Doing all this work manually, it wouldn’t surprise me if it had taken up to a decade to walk through each and every block to get every sign that is out there. There is no telling how many changes would come through to traffic signs in that time.”
Traffic signs automatically identified by Mapillary’s computer vision algorithms in the city of Clovis, New Mexico.
Soon after the images had been uploaded to Mapillary, Steven was able to access the automatically detected traffic sign data. The data downloaded from Mapillary is compatible with ArcGIS, allowing Steven to ensure that all traffic signs are visible, and to check whether they are in need of repair or replacement. With a full inventory, it is also possible to see where more or fewer signs may be necessary for a particular area.
The Mapillary web platform, showing the location of every identified traffic sign.
Mapillary supports a total of 1,500 traffic signs from 100 different countries. Janine Yoong, VP of Business Development at Mapillary, says traffic sign inventory represents a particular pain point for cities:
“Both small and large cities struggle with keeping tabs on their street assets, but smaller cities are often under a different kind of pressure as they tend to have fewer people working with GIS. Because it takes so long to do manual inventories, most cities just haven’t done it at all. Using computer vision to automatically identify traffic signs saves GIS officers both time and money, and opens up opportunities to focus on other areas”.
Steven working with the Mapillary traffic sign data in ArcGIS
Mapillary works with cities all over the world, ranging from Amsterdam to Stockholm and Los Angeles. As for Steven in Clovis, some of his findings included traffic signs that were so old that they’d actually been completely bleached by the sun, inevitably causing confusion on the streets.
“With this data, we’ll now look into what traffic signs need replacing and where,” Steven says.
This is a guest blog by Madelen Arnesdotter, Customer Success Manager at Mapillary
Also Read: Mapillary fixes maps with computer vision


 

 TAGSArtificial IntelligenceFuture TechnologiesgeospatialGIS & Mapping 


Facebook


Twitter


WhatsApp


Linkedin


  Madelen ArnesdotterCustomer Success Manager at Mapillary

 
",,,,,,,,,"[{'@type': 'Article', '@id': 'https://www.geospatialworld.net/blogs/putting-traffic-signs-on-the-map/#article', 'isPartOf': {'@id': 'https://www.geospatialworld.net/blogs/putting-traffic-signs-on-the-map/'}, 'author': {'name': 'Madelen Arnesdotter', '@id': 'https://www.geospatialworld.net/#/schema/person/60f9d8ac2683cfb1a65a7b6258057224'}, 'headline': 'Putting traffic signs on the map: How artificial intelligence can help', 'datePublished': '2018-11-14T12:22:25+00:00', 'dateModified': '2018-11-14T12:26:44+00:00', 'mainEntityOfPage': {'@id': 'https://www.geospatialworld.net/blogs/putting-traffic-signs-on-the-map/'}, 'wordCount': 823, 'publisher': {'@id': 'https://www.geospatialworld.net/#organization'}, 'image': {'@id': 'https://www.geospatialworld.net/blogs/putting-traffic-signs-on-the-map/#primaryimage'}, 'thumbnailUrl': 'https://geospatialmedia.s3.amazonaws.com/wp-content/uploads/2018/11/4.jpg', 'keywords': ['Artificial Intelligence', 'Future Technologies', 'geospatial', 'GIS &amp; Mapping'], 'articleSection': ['Blogs'], 'inLanguage': 'en-US', 'copyrightYear': '2018', 'copyrightHolder': {'@id': 'https://www.geospatialworld.net/#organization'}}, {'@type': 'WebPage', '@id': 'https://www.geospatialworld.net/blogs/putting-traffic-signs-on-the-map/', 'url': 'https://www.geospatialworld.net/blogs/putting-traffic-signs-on-the-map/', 'name': 'Putting traffic signs on the map: How artificial intelligence can help', 'isPartOf': {'@id': 'https://www.geospatialworld.net/#website'}, 'primaryImageOfPage': {'@id': 'https://www.geospatialworld.net/blogs/putting-traffic-signs-on-the-map/#primaryimage'}, 'image': {'@id': 'https://www.geospatialworld.net/blogs/putting-traffic-signs-on-the-map/#primaryimage'}, 'thumbnailUrl': 'https://geospatialmedia.s3.amazonaws.com/wp-content/uploads/2018/11/4.jpg', 'datePublished': '2018-11-14T12:22:25+00:00', 'dateModified': '2018-11-14T12:26:44+00:00', 'description': 'The GIS market is booming. It’s set to surge from $5.81 billion in 2017 to $10.03 billion by 2023, but in spite of this, many small cities across the US still just have a one-person GIS shop', 'breadcrumb': {'@id': 'https://www.geospatialworld.net/blogs/putting-traffic-signs-on-the-map/#breadcrumb'}, 'inLanguage': 'en-US', 'potentialAction': [{'@type': 'ReadAction', 'target': ['https://www.geospatialworld.net/blogs/putting-traffic-signs-on-the-map/']}]}, {'@type': 'ImageObject', 'inLanguage': 'en-US', '@id': 'https://www.geospatialworld.net/blogs/putting-traffic-signs-on-the-map/#primaryimage', 'url': 'https://geospatialmedia.s3.amazonaws.com/wp-content/uploads/2018/11/4.jpg', 'contentUrl': 'https://geospatialmedia.s3.amazonaws.com/wp-content/uploads/2018/11/4.jpg', 'width': 1743, 'height': 1080, 'caption': 'The Mapillary web platform, showing the location of every identified traffic sign.'}, {'@type': 'BreadcrumbList', '@id': 'https://www.geospatialworld.net/blogs/putting-traffic-signs-on-the-map/#breadcrumb', 'itemListElement': [{'@type': 'ListItem', 'position': 1, 'name': 'Home', 'item': 'https://www.geospatialworld.net/'}, {'@type': 'ListItem', 'position': 2, 'name': 'Putting traffic signs on the map: How artificial intelligence can help'}]}, {'@type': 'WebSite', '@id': 'https://www.geospatialworld.net/#website', 'url': 'https://www.geospatialworld.net/', 'name': 'Geospatial World', 'description': 'Top destination for geospatial industry trends', 'publisher': {'@id': 'https://www.geospatialworld.net/#organization'}, 'potentialAction': [{'@type': 'SearchAction', 'target': {'@type': 'EntryPoint', 'urlTemplate': 'https://www.geospatialworld.net/?s={search_term_string}'}, 'query-input': 'required name=search_term_string'}], 'inLanguage': 'en-US'}, {'@type': 'Organization', '@id': 'https://www.geospatialworld.net/#organization', 'name': 'Geospatial Media & Communications', 'url': 'https://www.geospatialworld.net/', 'logo': {'@type': 'ImageObject', 'inLanguage': 'en-US', '@id': 'https://www.geospatialworld.net/#/schema/logo/image/', 'url': 'https://geospatialmedia.s3.amazonaws.com/wp-content/uploads/2017/10/geospatial-world-logo.png', 'contentUrl': 'https://geospatialmedia.s3.amazonaws.com/wp-content/uploads/2017/10/geospatial-world-logo.png', 'width': 378, 'height': 181, 'caption': 'Geospatial Media & Communications'}, 'image': {'@id': 'https://www.geospatialworld.net/#/schema/logo/image/'}, 'sameAs': ['https://www.facebook.com/GeospatialMedia/', 'https://x.com/geoworldmedia', 'https://www.instagram.com/geospatialmedia/', 'https://www.linkedin.com/company/2391107', 'https://www.pinterest.com/geospatialworld/', 'https://www.youtube.com/channel/UC2UaNw8A-fQhIBBnaZPKEmA']}, {'@type': 'Person', '@id': 'https://www.geospatialworld.net/#/schema/person/60f9d8ac2683cfb1a65a7b6258057224', 'name': 'Madelen Arnesdotter', 'image': {'@type': 'ImageObject', 'inLanguage': 'en-US', '@id': 'https://www.geospatialworld.net/#/schema/person/image/', 'url': 'https://secure.gravatar.com/avatar/22add6bd6a7db9dd4ea8e588bdfd056c?s=96&r=g', 'contentUrl': 'https://secure.gravatar.com/avatar/22add6bd6a7db9dd4ea8e588bdfd056c?s=96&r=g', 'caption': 'Madelen Arnesdotter'}, 'description': 'Customer Success Manager at Mapillary', 'url': 'https://www.geospatialworld.net/author/madelen-arnesdotter/'}]",,,,,,,,,,,,,,,,
https://news.google.com/rss/articles/CBMiaGh0dHBzOi8vdG93YXJkc2RhdGFzY2llbmNlLmNvbS8zLWNoYWxsZW5nZXMtb2YtYXJ0aWZpY2lhbC1pbnRlbGxpZ2VuY2UtaW4tY29tcHV0ZXItZ3JhcGhpY3MtMjIzZTA2YmQ4NDZi0gEA?oc=5,3 Challenges of Artificial Intelligence in Computer graphics | by Mauro Comi - Towards Data Science,2018-11-15,Towards Data Science,https://towardsdatascience.com,"Computer graphics is not only stunning Visual effects. It gives us the tool to reconstruct the physical world for different kind of purposes, such as industrial or medical applications.
The Graphics…",N/A,Reducing the gap between Virtual and Real world,Reducing the gap between Virtual and Real world,http://schema.org,NewsArticle,https://towardsdatascience.com/3-challenges-of-artificial-intelligence-in-computer-graphics-223e06bd846b,['https://miro.medium.com/v2/resize:fit:1200/1*krDCIwwB_YFiNHIVYEGlkA.jpeg'],"{'@type': 'Person', 'name': 'Mauro Comi', 'url': 'https://towardsdatascience.com/@mauro_ai'}","{'@type': 'Organization', 'name': 'Towards Data Science', 'url': 'towardsdatascience.com', 'logo': {'@type': 'ImageObject', 'width': 192, 'height': 60, 'url': 'https://miro.medium.com/v2/resize:fit:384/1*cFFKn8rFH4ZndmaYeAs6iQ.png'}}",3 Challenges of Artificial Intelligence in Computer graphics,2018-11-15T20:40:58.674Z,2018-11-15T22:19:17.983Z,,3 Challenges of Artificial Intelligence in Computer graphics,,,N/A,N/A,"3 Challenges of Artificial Intelligence in Computer graphicsReducing the gap between Virtual and Real worldMauro Comi·FollowPublished inTowards Data Science·6 min read·Nov 15, 201872ListenShareComputer graphics is not only stunning Visual effects. It gives us the tool to reconstruct the physical world for different kind of purposes, such as industrial or medical applications.The Graphics Turing Test in this field was passed a long time ago, as the current state of Photography and Cinematography proves. Reality and Fantasy are virtually indistinguishable, and animators can create photorealistic worlds in a matter of days.Graphics Turing Test: The subject views and interacts with a real or computer generated scene. The test is passed if the subject can not determine reality from simulated reality better than a random guess.A considerable help in this topic comes from the very recent advances in AI. Ian Goodfellow introduced a few years ago a new type of Neural Network Architecture called Generative Adversarial Network (GAN), able to push the boundaries of what is possible in Computer graphics. The applications are endless, but as Stan Lee taught us, great powers come with great responsibilities. Indeed generating images and videos indistinguishable from reality might pose a real threat to our Society, if not properly controlled. Watch this video of a Fake Obama generated with AI to understand what I mean.Deep Fake Obama-Generative Adversarial NetworkEmergent field of artificial intelligence for Fluid simulationsSimulating the dynamics of a fluid has always been a huge mathematical challenge. State-of-the-art techniques require massive computing power, even more for real-time simulations. First, it’s important to remind that the term fluid includes liquids, gases and plasmas. Smoke, wind, water, fire are some examples of fluids.If you are familiar with Computational Fluid Dynamics (CFD), you have encountered Navier-Stokes equations multiple times on your path. These partial differential equations relate the velocity, pressure, temperature and density of a moving fluid, extending the previous simpler models introducing the effect of viscosity. We are not going to describe them since they are very complex and not suitable without a proper background in fluid mechanics, but if you’re interested in them you can check the link at the end of the article.Finding the solutions of these equations is not suitable for two reasons: they are data-dependent, so methods are truncated to fit within a computational budget, and might exhibit really slow asymptotic convergence.To solve these issues, machine learning has recentrly introduceda novel way to model fluid dynamics environments as a supervised regression problem. Neural networks and Regression forests gave good results, but they require a dataset of solutions provided by an exact solver. This is not possible during the test on simulations since the initial frames are generated by the model itself (which is not an exact solver). Results are imperfect, and the applications of this model get limited.A new exciting approach to describe the physical world involves the concept of intuitive or naïve physics. This new field of AI concerns the ability to predict outcomes of physical interactions involving macroscopic objects based on experience. Let’s see an example: babies do not know what gravity is, but through experience, they own the concept of it. The idea is to create artificial neural models able to model intuitive physics. Into this camp falls the work of Tompson et al. (link at the end), who developed a novel and tailored ConvNet architecture to replace existing Eulerian-based solvers and introduced a new training-loss which guarantees faster convergence.Nonlinear Soft-tissue dynamics: model the skinObtaining realistic human body modelling is one of the main goals in computer graphics. The surface of the body needs to deform naturally. In real-time applications, the body is controlled by skeletal movements. For this reason, the surface is linked to its skeletal pose and the animation of the skin is a function of it. How is this achieved?The most common algorithm is Linear blend skinning (LBS), used also by Unity and Unreal. It is not computationally intensive and gives good results in the majority of situations. Still, there are some drawbacks. The main issue is the excessive loss of volume for strong bends or unrealistic effects during rotation of joints.A second important strategy is data-driven body models. This model divides the parameters for pose and shape and permits a deeper control of the body. The main problem here is the absence of control for non-linear dynamics. What do I mean with non-linear dynamics? Soft tissues, like the belly of a person, do not react in a linear way to forces. It bounces, rotates, jiggles. These movements cannot be properly described by non-linear models.To solve this problem, data-driven dynamics models were introduced. These algorithms are typically used for facial movements or cloth dynamics. A very interesting application of this last category was applied recently by Casas and Otaduy (link of the paper at the end). They successfully developed a data-driven model to simulate non-linear soft-tissue dynamics trained with publicly available skeletal motion data. As every machine learning model, also this novel methodology cannot properly describe deformations far from the training set. The only way to overcome this limitation, when necessary, is to adopt physics-based body models. These models are extremely precise but significantly more complex.Cloth and Material understanding in Computer GraphicsA third great challenge is the simulation of cloth. Cloth material recovery methods need complex experimental set up to acquire physical properties. Reproducing the correct behaviour of fabric might be extremely complicated, and researchers are applying machine learning methods to recreate the dynamics of it. Understanding properties of cloth do not find its application only in Animations, but also in totally different fields. Let’s consider a virtual try-on system for clothing: capturing the dynamics of this material can open to a new broad range of services offered in e-commerce. This is especially true if we consider the advances in Virtual Reality, which would allow a more realistic virtual shopping giving us the possibility to try clothes virtually.Retrieving physical properties of a dynamical system is achieved in multiple ways at the moment. The most straightforward approach is through measurements, sampling physical quantities and estimating dependent properties. A second important strategy is to simulate, optimize and iterate the dynamical system, extracting features progressively closer to the real value.ConclusionWe have just seen three challenges of AI in Computer Graphics. In the reproduction of the physical world, these three categories are blended: think of a flag moved by the wind. In this case, all three concepts are present in a single event.There is, of course, a whole set of unsolved problems, and I am going to analyse them in a following article. If you enjoyed this article, I’d love it if you hit the clap button 👏 so others might stumble upon it. For any comments or suggestions don’t hesitate to leave a comment!To check more of my Stories:Is Artificial Intelligence Racist? (And Other Concerns)How to teach an AI to play Games: Deep Reinforcement LearningArtificial Intelligence meets Art: Neural Transfer StyleI am a Data Science major in love with Machine learning and its endless applications. You can find more about me and my projects at maurocomi.com. You can also find me on Linkedin, Twitter, or email me directly. I am always up for a chat, or to collaborate on new amazing projects.Referenceshttps://www.grc.nasa.gov/www/k-12/airplane/nseqs.htmlYang, S., Liang, J., & Lin, M. C. (2017, October). Learning-based cloth material recovery from video. In Proceedings of the IEEE Conference on Computer Vision and Pattern Recognition (pp. 4383–4393).CASAS, D., & OTADUY, M. A. (2018). Learning Nonlinear Soft-Tissue Dynamics for Interactive Avatars.Tompson, J., Schlachter, K., Sprechmann, P., & Perlin, K. (2016). Accelerating eulerian fluid simulation with convolutional networks. arXiv preprint arXiv:1607.03597.",https://towardsdatascience.com/3-challenges-of-artificial-intelligence-in-computer-graphics-223e06bd846b,2018-11-15T20:40:58.674Z,,,,,,,,223e06bd846b,['Mauro Comi'],,,,,,,,,,,,,,
