URL link,Title,Date,Source,Source Link,description,keywords,og:description,twitter:description,@context,@graph,article:section,article:summary,article text,@type,url,image,author,publisher,headline,datePublished,dateModified,articleSection,name,isAccessibleForFree,itemListElement,mainEntityOfPage,dateCreated,heading,articleBody,isBasedOn,thumbnailUrl,isPartOf,alternativeHeadline,hasPart,uploadDate,embedUrl,contentUrl,duration,dateline,creator,copyrightHolder,copyrightYear,inLanguage,foundingDate,logo,sameAs,comment,commentCount,sourceOrganization,@id,diversityPolicy,ethicsPolicy,masthead,speakable,video,Headline,DatePublished,DateModified,Description
https://news.google.com/rss/articles/CBMiiQFodHRwczovL3d3dy50aGVndWFyZGlhbi5jb20vc29jaWV0eS8yMDIzL2p1bC8xMS91c2Utb2YtYXJ0aWZpY2lhbC1pbnRlbGxpZ2VuY2Utd2lkZW5lZC10by1hc3Nlc3MtdW5pdmVyc2FsLWNyZWRpdC1hcHBsaWNhdGlvbnMtYW5kLXRhY2tsZdIBiQFodHRwczovL2FtcC50aGVndWFyZGlhbi5jb20vc29jaWV0eS8yMDIzL2p1bC8xMS91c2Utb2YtYXJ0aWZpY2lhbC1pbnRlbGxpZ2VuY2Utd2lkZW5lZC10by1hc3Nlc3MtdW5pdmVyc2FsLWNyZWRpdC1hcHBsaWNhdGlvbnMtYW5kLXRhY2tsZQ?oc=5,AI use widened to assess universal credit applications and tackle fraud - The Guardian,2023-07-11,The Guardian,https://www.theguardian.com,Department of Work and Pensions warned by auditor general about potential bias in algorithms,N/A,Department of Work and Pensions warned by auditor general about potential bias in algorithms,N/A,,,Society,N/A," The Department of Work and Pensions’ latest annual report says it has ‘tight governance and control over its use of machine learning’. Photograph: Andy Rain/EPAView image in fullscreenThe Department of Work and Pensions’ latest annual report says it has ‘tight governance and control over its use of machine learning’. Photograph: Andy Rain/EPAUniversal credit This article is more than 1 year oldAI use widened to assess universal credit applications and tackle fraudThis article is more than 1 year oldDepartment of Work and Pensions warned by auditor general about potential bias in algorithms Robert Booth Social affairs correspondentTue 11 Jul 2023 12.34 EDTLast modified on Tue 11 Jul 2023 21.30 EDTShareThe government has widened its deployment of artificial intelligence to uncover welfare fraud, despite warnings of algorithmic bias against groups of vulnerable claimants.In a £70m investment applying “advanced analytics” to requests for universal credit (UC), the Department for Work and Pensions (DWP) has extended the use of machine learning as it attempts to save more than £1bn from the £8bn-plus lost to fraud and error last year, audit documents scrutinised by the Guardian reveal.The project does not appear to have been formally announced by the government, which has been accused of being secretive about AI in the welfare system. If extended, it has the potential to reach many of the 5.9 million people who claim UC.After a trial last year using automated software to flag up potential fraudsters seeking UC cash advances, similar technology has now been developed and piloted to scan welfare applications made by people living together, self-employed people, and those wanting housing support, as well as to assess the claims people make about their personal capital such as savings.Welfare rights organisations and UN experts have previously said that extending the UK’s “digital by default” welfare system with machine learning without greater transparency risks creating serious problems for some benefit claimants.Big Brother Watch, a UK civil liberties campaign group, said it was “worrying” the government was “pushing ahead with yet more opaque AI models when it admits its capability to monitor for unfairness is limited”.“The DWP consistently refuses to publish information about how they operate bar the vaguest details,” said Jake Hurfurt, head of research and investigations.The extension of welfare automation is summarised in the comptroller and auditor general’s statement in the DWP’s latest annual report. It says the DWP has “tight governance and control over its use of machine learning”, but it revealed officials have detected “evidence of bias toward older claimants”.An algorithm trialled last year was fed data about previous claimant fraud to teach it to predict which new benefit claimants might be cheating. Final decisions are made by a human.The auditor general warned of “an inherent risk that the algorithms are biased towards selecting claims for review from certain vulnerable people or groups with protected characteristics”.The DWP had admitted its “ability to test for unfair impacts across protected characteristics is currently limited”, they said.skip past newsletter promotionSign up to Headlines UKFree newsletterGet the day’s headlines and highlights emailed direct to you every morningEnter your email address Sign upPrivacy Notice: Newsletters may contain info about charities, online ads, and content funded by outside parties. For more information see our Privacy Policy. We use Google reCaptcha to protect our website and the Google Privacy Policy and Terms of Service apply.after newsletter promotionThe government is under pressure to increase public confidence in its use of AI, and the auditor general urged it to publish its assessment of bias in machine learning models.The DWP has so far declined to release information about how its machine learning algorithm works. It has blocked freedom of information requests from the Guardian seeking the name of any companies involved in the fraud detection trial relating to universal credit advances because “details of contracts are commercially sensitive”. It is also refusing to publish any results from last year’s trial, including assessing bias against certain groups of claimants.Last month, Tom Pursglove, minister for disabled people, health and work, told parliament the government would not publish an equalities assessment of trials of machine-learning algorithms, because it would tip off fraudsters “leading to new frauds and greater losses to the public purse”.The DWP has told the auditor it is “working to develop its capability to perform a more comprehensive fairness analysis across a wider range of protected characteristics”.A spokesperson for the DWP said: “We continue to explore the potential of new technologies in combating fraud and deploy comprehensive safeguards when doing so. AI does not replace human judgment when investigating fraud and error to either determine or deny a payment to a claimant.”Explore more on these topicsUniversal creditArtificial intelligence (AI)WelfareBenefitsnewsShareReuse this contentMost viewed‘A wise investment’: Trump’s $6,000 gift to Kamala Harris comes back to bite himLiveNancy Pelosi endorses Kamala Harris: ‘I have full confidence that she will lead us to victory’ – livePilot, 26, dies as her plane crashes after skydiving flight over Niagara FallsBen Jennings on Joe Biden endorsing Kamala Harris – cartoonYou’ve heard of nepo babies, but what about nepo dogs? The rise of the Very Important Pooch",,,,,,,,,,,,,,,,,,,,,,,,,,,,,,,,,,,,,,,,,,,,,,
https://news.google.com/rss/articles/CBMiqgFodHRwczovL3d3dy5tY2tpbnNleS5jb20vY2FwYWJpbGl0aWVzL3Blb3BsZS1hbmQtb3JnYW5pemF0aW9uYWwtcGVyZm9ybWFuY2Uvb3VyLWluc2lnaHRzL3RoZS1vcmdhbml6YXRpb24tYmxvZy9ob3ctZ2VuZXJhdGl2ZS1haS1jb3VsZC1zdXBwb3J0LW5vdC1yZXBsYWNlLWh1bWFuLXJlc291cmNlc9IBAA?oc=5,How generative AI could support—not replace—human resources - McKinsey,2023-07-10,McKinsey,https://www.mckinsey.com,"In the very near future, generative AI has potential to supplement and streamline human resources and performance management. Here are several use cases to keep an eye on.",N/A,"In the very near future, generative AI has potential to supplement and streamline human resources and performance management. Here are several use cases to keep an eye on.","In the very near future, generative AI has potential to supplement and streamline human resources and performance management. Here are several use cases to keep an eye on.",,,N/A,N/A,N/A,,,,,,,,,,,,,,,,,,,,,,,,,,,,,,,,,,,,,,,,,,,,,,
https://news.google.com/rss/articles/CBMilQFodHRwczovL3d3dy5mb3JiZXMuY29tL3NpdGVzL2JlbmphbWlubGFrZXIvMjAyMy8wNy8wNy90aGUtZGFyay1zaWRlLW9mLWFpLXJlY3J1aXRpbmctZGVwZXJzb25hbGl6YXRpb24tYW5kLWl0cy1jb25zZXF1ZW5jZXMtb24tdGhlLW1vZGVybi1qb2ItbWFya2V0L9IBAA?oc=5,The Dark Side Of AI Recruiting: Depersonalization And Its Consequences On The Modern Job Market - Forbes,2023-07-07,Forbes,https://www.forbes.com,"
Job hunters grapple with AI's dominant role in hiring, while the neglect of diversity, equity, inclusion, and the mental strain caused by ghosting raise serious concerns","AI in hiring,mental health impact of job search,effects of ghosting,diversity in recruitment,equity in job market,inclusion in hiring practices,artificial intelligence and employment,psychological toll of job hunting,job seekers' challenges,impact of technology on job search","
Job hunters grapple with AI's dominant role in hiring, while the neglect of diversity, equity, inclusion, and the mental strain caused by ghosting raise serious concerns","
Job hunters grapple with AI's dominant role in hiring, while the neglect of diversity, equity, inclusion, and the mental strain caused by ghosting raise serious concerns",http://schema.org,,Leadership Strategy,N/A,"More From ForbesJul 22, 2024,01:57pm EDTBeijing Seems Not To Understand Its Responsibility To ActJul 22, 2024,01:56pm EDTEconomic Forecast Impacts Of The 2024 Presidential ElectionJul 22, 2024,12:00pm EDTInnovation At Every Size: Why Small Firms Struggle To Innovate In Today’s Regulatory EnvironmentsJul 22, 2024,10:34am EDTDonnie Wahlberg On Leadership, Sustainability, And His Role With Bioheat®Jul 22, 2024,09:09am EDTA Higher Form Of Personal LeadershipJul 22, 2024,09:00am EDTHow Economic Shifts And Sustainability Needs Are Redefining JobsJul 22, 2024,08:20am EDTGen Z Demands More Paths To Career Success. It's Time We ListenedEdit StoryForbesLeadershipLeadership StrategyThe Dark Side Of AI Recruiting: Depersonalization And Its Consequences On The Modern Job MarketBenjamin LakerContributorOpinions expressed by Forbes Contributors are their own.Expert commentary on global affairs for leaders everywhereFollowingFollowClick to save this article.You'll be asked to sign into your Forbes account.Got it0Jul 7, 2023,09:00am EDTShare to FacebookShare to TwitterShare to LinkedinIn 2023, job seekers face a new reality: AI’s impact on the hiring process is undeniable, but the mental health toll of ghosting and deprioritizing diversity, equity, and inclusion raises serious concerns.
Individuals in search of employment confront an altered landscape: the influence of AI on ... [+] recruitment is incontrovertible, yet the psychological burden posed by disregard and sidelining of diversity, equity, and inclusion, along with the practice of ghosting, provokes grave apprehensions.getty

The age of artificial intelligence has revolutionized the hiring process, and this means that, increasingly, employers turn to job interviews mediated by technology. While it has brought efficiency and the ability to sort through many applications quickly, there is a growing concern that the human touch has been lost, according to research published by the World Economic Forum.

Another study, published by Harvard Business Review concluded, “The use of artificial intelligence in HR processes is a new, and likely unstoppable, trend.” But, the rise of AI has also brought with it the potential for bias and discrimination. With algorithms making decisions, job seekers, especially those from marginalized communities, can face challenges. This means, unfortunately, AI algorithms used by recruiters may inadvertently perpetuate prejudice or discriminate against certain candidates due to their lack of understanding of nuances such as gender and race.

PROMOTED
The use of AI-mediated job interviews can also lead to a “ghosting” effect. Candidates who have been successful during interviews may never hear back from the employer, leaving them anxious and uncertain about their prospects. This phenomenon is an enormous problem in the job market today, and it has consequences that go beyond frustration, according to research. Often, job seekers will experience a sense of powerlessness, worthlessness, and helplessness. These feelings can lead to depression and low self-esteem. What’s more, when people don’t get honest feedback on their performance in the process, they may never know what went wrong and, therefore, cannot fix it for future applications.

That said, ghosting in the job market has negative consequences for businesses too. Suppose candidates are left without communication or feedback. In that case, they may feel frustrated and powerless, which can harm a company’s employer brand, making it increasingly difficult for the organization to attract and retain top talent. In extreme cases, this can snowball into a full-blown brand crisis.
MORE FROMFORBES ADVISORBest High-Yield Savings Accounts Of 2024ByKevin PayneContributorBest 5% Interest Savings Accounts of 2024ByCassidy HortonContributor
The negative impact of this impersonal hiring process on emotional and mental health is significant and cannot be ignored. According to an investigation undertaken by The Guardian, applicants often feel like a number, and the process does not allow for feedback or constructive criticism. Thus, job seekers may never get the closure they need to learn from their mistakes and for future applications.









CxO
US


CEO: C-suite news, analysis, and advice for top decision makers right to your inbox.




                Sign Up
            


By signing up, you agree to receive this newsletter, other updates about Forbes and its affiliates’ offerings, our Terms of Service (including resolving disputes on an individual basis via arbitration), and you acknowledge our Privacy Statement. Forbes is protected by reCAPTCHA, and the Google Privacy Policy and Terms of Service apply.




You’re all set! Enjoy the CEO newsletter!


                More Newsletters
            


You’re all set! Enjoy the CEO newsletter!

                More Newsletters
            



Therefore, incorporating a hiring process that involves interactions with people to ensure that the team agrees on the ideal candidate, taking into account factors such as skills, personality, and cultural fit, can aid in determining whether a candidate is suitable or not for the position.


1/1





Skip Ad
 
Continue watchingafter the adVisit Advertiser websiteGO TO PAGE
This view is congruent with research which found that human interaction is essential to create a fair and equitable hiring process. Although AI technologies can make the recruitment process faster, it is necessary to ensure that the technology complies with anti-discrimination laws and addresses potential biases. This will help ensure a more diverse and equitable workforce. After all, while AI can help streamline certain aspects, it cannot replace an interviewer’s intuition while screening a candidate or the interview guidance many job seekers desire. “By combining the efficiency of AI with the personal touch of human recruiters, companies can create a more inclusive and supportive hiring process that benefits all job seekers,” said William Degbey in an interview. The associate professor of international management at Finland’s University of Vaasa believes that “a combination of AI and human recruiters is the way forward for the recruitment process.”
According to Amanda Rosewarne, CEO of the Professional Development Consortium, economically speaking, the combination of AI and human recruiters could bring even greater efficiency to recruitment. In an interview, Rosewarne said, “In this Information Age, we are moving to a skills-based economy, where ongoing competence requires continuous learning. A crucial part of successful recruitment is understanding the context and experiences behind a candidate’s CV.” In other words, using AI in recruitment can provide an added layer of knowledge and insight, enabling recruiters to better determine a candidate’s experience and competence.
Not only is this combination of human and machine resources more efficient, but it could also provide greater accuracy when selecting candidates. But, it is essential to note that AI still can’t replace the human element of recruitment completely. It is only able to provide an additional layer of insight and data-driven analysis, which, when combined with the traditional resources recruiters have available, can ensure a more effective outcome. “My advice for organizations is to proceed with great caution and take the time to thoroughly test AI tools to ensure they can provide the best possible results and comply with current employment law. We can’t automate selecting colleagues as it removes the ‘humanness’ which is crucial to the process,” said Rosewarne.
So, while AI technology is incredibly useful for streamlining the recruitment process and ensuring fairness in the selection of candidates, there will likely always be a need for human involvement when it comes to filling job roles. After all, no computer can replicate the understanding of an experienced recruiter who knows how to evaluate soft skills, attitude, and cultural fit. Human recruiters can make sure that they are choosing the right person for the job and ensuring a positive work culture.
Although technology has automated many aspects of the recruitment process, such as screening resumes and scheduling interviews, it can never replace the level of insight that a human recruiter can bring to the table. Technology-based tools are useful in assessing a candidate’s basic skills, but they cannot assess softer skills like communication and teamwork. So, while AI and automation can certainly help a recruiter in the process, it is ultimately up to them to ensure they are selecting the right candidate based on their unique characteristics.
A human recruiter’s insight is also invaluable when it comes to understanding culture fit. They can get an immediate sense of how well the candidate would fit into the organization, which is something that AI and automation can’t do...yet!
Follow me on Twitter or LinkedIn. Check out my website. Benjamin LakerFollowingFollowBenjamin Laker is a leadership professor at Henley Business School, University of Reading who undertakes research and delivers keynote speeches on the societal impact... Read MoreEditorial StandardsPrintReprints & Permissions
1/1





Skip Ad
 
Continue watchingafter the adVisit Advertiser websiteGO TO PAGEJoin The ConversationComments 0One Community. Many Voices. Create a free account to share your thoughts. Read our community guidelines  here.Forbes Community GuidelinesOur community is about connecting people through open and thoughtful conversations. We want our readers to share their views and exchange ideas and facts in a safe space.In order to do so, please follow the posting rules in our site's Terms of Service.  We've summarized some of those key rules below. Simply put, keep it civil.Your post will be rejected if we notice that it seems to contain:False or intentionally out-of-context or misleading informationSpamInsults, profanity, incoherent, obscene or inflammatory language or threats of any kindAttacks on the identity of other commenters or the article's authorContent that otherwise violates our site's terms.User accounts will be blocked if we notice or believe that users are engaged in:Continuous attempts to re-post comments that have been previously moderated/rejectedRacist, sexist, homophobic or other discriminatory commentsAttempts or tactics that put the site security at riskActions that otherwise violate our site's terms.So, how can you be a power user?Stay on topic and share your insightsFeel free to be clear and thoughtful to get your point across‘Like’ or ‘Dislike’ to show your point of view.Protect your community.Use the report tool to alert us when someone breaks the rules.Thanks for reading our community guidelines.  Please read the full list of posting rules found in our site's Terms of Service.",BreadcrumbList,https://www.forbes.com/sites/benjaminlaker/2023/07/07/the-dark-side-of-ai-recruiting-depersonalization-and-its-consequences-on-the-modern-job-market/,"{'@type': 'ImageObject', 'url': 'https://imageio.forbes.com/specials-images/imageserve/64a5890fa71af4d8e78aa486/0x0.jpg?format=jpg&height=900&width=1600&fit=bounds', 'width': 542.79, 'height': 304.6}","{'@type': 'Person', 'name': 'Benjamin Laker', 'url': 'https://www.forbes.com/sites/benjaminlaker/', 'description': 'Benjamin Laker is a leadership professor at Henley Business School, University of Reading who undertakes research and delivers keynote speeches on the societal impact of leadership—often influencing government policies and law—to develop new ways for organizations to operate in a socially responsible manner. He is best known for popularizing the concept of Meeting-Free Days, often called ""No-Meeting Days"" or more recently ""Meeting-Free Fridays"", which are becoming increasingly common in workplaces globally—including Facebook, Microsoft, SAP and Shopify—as a way to improve employee wellbeing and productivity.', 'sameAs': ['https://uk.linkedin.com/in/benlaker', 'https://www.twitter.com/DrBenLaker', 'https://www.benjaminlaker.co.uk']}","{'@type': 'NewsMediaOrganization', 'name': 'Forbes', 'url': 'https://www.forbes.com/', 'ethicsPolicy': 'https://www.forbes.com/sites/forbesstaff/article/forbes-editorial-values-and-standards/', 'logo': 'https://imageio.forbes.com/i-forbesimg/media/amp/images/forbes-logo-dark.png?format=png&height=455&width=650&fit=bounds'}",The Dark Side Of AI Recruiting: Depersonalization And Its Consequences On The Modern Job Market,2023-07-07T09:00:00-04:00,2024-06-03T08:16:27-04:00,Leadership Strategy,The Dark Side Of AI Recruiting: Depersonalization And Its Consequences On The Modern Job Market,False,"[{'@type': 'ListItem', 'position': 1, 'name': 'Forbes Homepage', 'item': 'https://www.forbes.com/'}, {'@type': 'ListItem', 'position': 2, 'name': 'Leadership', 'item': 'https://www.forbes.com/leadership/'}, {'@type': 'ListItem', 'position': 3, 'name': 'Leadership Strategy', 'item': 'https://www.forbes.com/leadership-strategy/'}]",,,,,,,,,,,,,,,,,,,,,,,,,,,,,,,,,,
https://news.google.com/rss/articles/CBMic2h0dHBzOi8vd3d3Lm1ja2luc2V5LmNvbS9pbmR1c3RyaWVzL2hlYWx0aGNhcmUvb3VyLWluc2lnaHRzL3RhY2tsaW5nLWhlYWx0aGNhcmVzLWJpZ2dlc3QtYnVyZGVucy13aXRoLWdlbmVyYXRpdmUtYWnSAQA?oc=5,Generative AI in healthcare: Emerging use for care - McKinsey,2023-07-10,McKinsey,https://www.mckinsey.com,Generative AI has the potential to reimagine the healthcare industry in new and exciting ways. We look at some of the emerging use cases in healthcare.,N/A,Generative AI has the potential to reimagine the healthcare industry in new and exciting ways. We look at some of the emerging use cases in healthcare.,Generative AI has the potential to reimagine the healthcare industry in new and exciting ways. We look at some of the emerging use cases in healthcare.,https://schema.org,,N/A,N/A,N/A,Article,https://www.mckinsey.com,https://www.mckinsey.com/~/media/mckinsey/industries/healthcare%20systems%20and%20services/our%20insights/tackling%20healthcares%20biggest%20burdens%20with%20generative%20ai/tackling-1224658211-thumb-1536x1536.jpg,"[{'@type': 'Person', 'name': 'Shashank Bhasker'}, {'@type': 'Person', 'name': 'Damien Bruce', 'url': 'https://www.mckinsey.com/our-people/damien-bruce'}, {'@type': 'Person', 'name': 'Jessica Lamb', 'url': 'https://www.mckinsey.com/our-people/jessica-lamb'}, {'@type': 'Person', 'name': 'George Stein'}]","{'@type': 'Organization', 'name': 'McKinsey & Company', 'logo': {'@type': 'ImageObject', 'url': 'https://www.mckinsey.com/~/media/Thumbnails/Mck_Logo'}}",,2023-07-10T00:00:00Z,2023-07-10T00:00:00Z,,,,,"{'@type': 'WebPage', '@id': 'https://www.mckinsey.com/industries/healthcare/our-insights/tackling-healthcares-biggest-burdens-with-generative-ai'}",2023-08-15T18:09:08Z,Tackling healthcare&rsquo;s biggest burdens with generative AI,,,,,,,,,,,,,,,,,,,,,,,,,,,,,,,
