URL link,Title,Date,Source,Source Link,description,keywords,og:description,twitter:description,@context,@graph,article:section,article:summary,article text,@type,url,image,author,publisher,headline,datePublished,dateModified,articleSection,name,isAccessibleForFree,itemListElement,sameAs,mainEntityOfPage,dateCreated
https://news.google.com/rss/articles/CBMiRGh0dHBzOi8vd3d3LnNvY2lhbGV1cm9wZS5ldS9hcnRpZmljaWFsLWludGVsbGlnZW5jZS1maWxsaW5nLXRoZS1nYXBz0gEA?oc=5,Artificial intelligence: filling the gaps - Social Europe,2022-04-14,Social Europe,https://www.socialeurope.eu,Stronger legislation than the European Commission envisages is needed to regulate AI and protect workers.,N/A,Stronger legislation than the European Commission envisages is needed to regulate AI and protect workers.,Stronger legislation than the European Commission envisages is needed to regulate AI and protect workers.,https://schema.org,"[{'@type': 'Organization', '@id': 'https://www.socialeurope.eu/#organization', 'name': 'Social Europe (SE)', 'sameAs': ['https://www.facebook.com/socialeurope.eu', 'https://twitter.com/socialeurope'], 'logo': {'@type': 'ImageObject', '@id': 'https://www.socialeurope.eu/#logo', 'url': 'https://www.socialeurope.eu/wp-content/uploads/2022/06/SE-8.png', 'contentUrl': 'https://www.socialeurope.eu/wp-content/uploads/2022/06/SE-8.png', 'caption': 'Social Europe', 'inLanguage': 'en-GB', 'width': '750', 'height': '422'}}, {'@type': 'WebSite', '@id': 'https://www.socialeurope.eu/#website', 'url': 'https://www.socialeurope.eu', 'name': 'Social Europe', 'publisher': {'@id': 'https://www.socialeurope.eu/#organization'}, 'inLanguage': 'en-GB'}, {'@type': 'ImageObject', '@id': 'https://www.socialeurope.eu/wp-content/uploads/2022/04/shutterstock_1022667853.jpg', 'url': 'https://www.socialeurope.eu/wp-content/uploads/2022/04/shutterstock_1022667853.jpg', 'width': '1200', 'height': '627', 'caption': 'AI regulation,artificial intelligence,GDPR', 'inLanguage': 'en-GB'}, {'@type': 'WebPage', '@id': 'https://www.socialeurope.eu/artificial-intelligence-filling-the-gaps#webpage', 'url': 'https://www.socialeurope.eu/artificial-intelligence-filling-the-gaps', 'name': 'Artificial intelligence: filling the gaps', 'datePublished': '2022-04-14T05:00:00+02:00', 'dateModified': '2022-04-14T05:00:00+02:00', 'isPartOf': {'@id': 'https://www.socialeurope.eu/#website'}, 'primaryImageOfPage': {'@id': 'https://www.socialeurope.eu/wp-content/uploads/2022/04/shutterstock_1022667853.jpg'}, 'inLanguage': 'en-GB'}, {'@type': 'Person', '@id': 'https://www.socialeurope.eu/author/aida-ponce-del-castillo', 'name': 'Aida Ponce Del Castillo', 'url': 'https://www.socialeurope.eu/author/aida-ponce-del-castillo', 'image': {'@type': 'ImageObject', '@id': 'https://www.socialeurope.eu/wp-content/uploads/2022/04/Pics.png', 'url': 'https://www.socialeurope.eu/wp-content/uploads/2022/04/Pics.png', 'caption': 'Aida Ponce Del Castillo', 'inLanguage': 'en-GB'}, 'worksFor': {'@id': 'https://www.socialeurope.eu/#organization'}}, {'@type': 'NewsArticle', 'headline': 'Artificial intelligence: filling the gaps', 'datePublished': '2022-04-14T05:00:00+02:00', 'dateModified': '2022-04-14T05:00:00+02:00', 'articleSection': 'Economy', 'author': {'@id': 'https://www.socialeurope.eu/author/aida-ponce-del-castillo', 'name': 'Aida Ponce Del Castillo'}, 'publisher': {'@id': 'https://www.socialeurope.eu/#organization'}, 'description': 'Stronger legislation than the European Commission envisages is needed to regulate AI and protect workers.', 'copyrightYear': '2022', 'copyrightHolder': {'@id': 'https://www.socialeurope.eu/#organization'}, 'name': 'Artificial intelligence: filling the gaps', '@id': 'https://www.socialeurope.eu/artificial-intelligence-filling-the-gaps#richSnippet', 'isPartOf': {'@id': 'https://www.socialeurope.eu/artificial-intelligence-filling-the-gaps#webpage'}, 'image': {'@id': 'https://www.socialeurope.eu/wp-content/uploads/2022/04/shutterstock_1022667853.jpg'}, 'inLanguage': 'en-GB', 'mainEntityOfPage': {'@id': 'https://www.socialeurope.eu/artificial-intelligence-filling-the-gaps#webpage'}}]",Economy,N/A,"
Stronger legislation than the European Commission envisages is needed to regulate AI and protect workers.
In joint, human-machine problem-solving, the worker must make the decision (PaO_STUDIO/shutterstock.com)
Artificial intelligence (AI) is of strategic importance for the European Union: the European Commission frequently affirms that ‘artificial intelligence with a purpose can make Europe a world leader’. Recently, the commissioner for the digital age, Margrethe Vestager, again insisted on AI’s ‘huge potential’ but admitted there was ‘a certain reluctance’, a hesitation on the part of the public: ‘Can we trust the authorities that put it in place?’ One had to be able to trust in technology, she said, ‘because this is the only way to open markets for AI to be used’. 
Trust is indeed central to the acceptance of AI by European citizens. The recent toeslagenaffaire (allowances affair) in the Netherlands is a reminder of the dangers. Tens of thousands of families were flagged up as potentially fraudulent claimants of childcare allowances, without any proof, and forced to pay back—driving many into poverty, some to depression and suicide. All of this was the consequence of a self-learning algorithm and AI system, designed without checks and balances and not subject to human scrutiny.
In its current form, the AI regulation proposed by the commission last April will not protect citizens from similar dangers. It will also not protect workers. In its eagerness to push AI forward and position itself in the global AI race, the commission has overlooked workers’ rights. The envisaged AI legislation is framed in terms of product safety and, as such, employment is not within its legal ambit.










Join 24,000+ informed readers and stay ahead with our insightful content. 
It's free.












Subscribe
  Loading... 










Subscribe
  Loading... 






Thank you!
Please check your inbox and click on the link in the confirmation email to complete your newsletter subscription.









The only reference to employment is found in annex III, which lists ‘high-risk’ AI systems. These take in recruitment and selection, the screening and evaluation of candidates, and the elevation or termination of work-related contractual relationships and task allocation, as well as the monitoring and evaluation of the performance and behaviour of persons in such relationships.
The regulation would not however provide any additional specific protection to workers nor ensure their existing rights were safeguarded—despite the uncertainty AI will generate in these regards. The protective capacity for workers of the General Data Protection Regulation (GDPR), although in force for almost four years and despite its potential, is not yet used to the full.
Shortcomings to address
Along with other emerging technologies, such as quantum computing, robotics or blockchain, AI will disrupt life as we know it. The EU can become an AI global leader only if it remains faithful to its democratic and social values, which implies protecting the rights of its workers.

Become a Social Europe Member

Support independent publishing and progressive ideas by becoming a Social Europe member for less than 5 Euro per month. Your support makes all the difference!

Click here to become a member
To do that, the shortcomings of the AI regulation and the GDPR need to be addressed. Seven aspects deserve more attention:
Implementing GDPR in the context of employment: fully implementing GDPR rights for workers is one of the most effective ways to ensure they have control over their data. AI relies on data, including workers’ personal data. Workers need to use GDPR actively, to ask how such data is used (potentially for profiling or to discriminate against them), stored or shared, in and out of the employment relationship; employers need to respect their right to do so. The commission and the European Data Protection Supervisor should issue clear recommendations insisting on the applicability of the GDPR at work. There may also be a need to determine what role labour inspectors could or should play.
Further developing the ‘right to explanation’: when decisions supported by algorithms—the processing of sensitive data, performance assessment, task allocation based on reputational data, profiling and so on—negatively affect workers or are associated with a bias (in the design or the data), the right to explanation becomes an essential defence mechanism. A specific framework based on articles 12-15, 22 and recital 71 of the GDPR must be developed and apply to all forms of employment. In practice, when a decision supported by an algorithm has been made and negatively affects a worker, such framework should enable the individual to obtain information that is simultaneously understandable, meaningful and actionable; receive an explanation as to the logic behind the decision; understand the significance and the consequences of the decision, and challenge the decision, vis-à-vis the employer or in court if necessary.
Purpose of AI algorithms: in an occupational setting, having access to the code behind an algorithm is not useful per se. What matters to workers is understanding the purpose of the AI system or the algorithm embedded in an application. This is partly covered by GDPR article 35, on the obligation to produce data-protection impact assessments. Further action is however needed to make sure workers’ representatives are involved.
Involving workers’ representatives when conducting AI risk assessments at work, pre-deployment: Given the potential risk of misuse, as well as of unintended or unanticipated harmful outcomes stemming from AI systems, employers should have the obligation under the proposed regulation to conduct technology risk assessments before their deployment. Workers’ representatives should be systematically involved and have a role in characterising the level of risk arising from the use of AI systems and in identifying proportionate mitigation measures, all along the life cycle. Risk assessments should address general issues about cybersecurity, privacy and safety, as well as specific associated threats.
Addressing intrusive surveillance: workplace monitoring is increasingly being replaced by intrusive surveillance, using data related to workers’ behaviour, biometrics and emotions. Given the risk of abuse, legal provisions are needed to ban such practices.
Boosting workers’ autonomy in human-machine interactions: this entails ensuring that workers are ‘in the loop’ of fully or semi-automated decision-making and that they make the final decision, using the input from the machine. This is particularly important when joint (human-machine) problem-solving takes place. Boosting workers’ autonomy means sustaining the accumulated tacit knowledge of the workforce and supporting the transfer of that knowledge to the machine—whether it be a co-operative robot or a piece of software. This is particularly pertinent to processes that require testing, quality control or diagnosis.
Enabling workers to become ‘AI literate’: acquiring technical skills and using them ‘at work’, although necessary, is not enough and mostly serves the interests of one’s employer. Becoming ‘AI literate’ means being able to understand critically the role of AI and its impact on one’s work and occupation, and being able to anticipate how it will transform one’s career and role. Passively using AI systems does not benefit workers themselves—a certain distance needs to be established for them to see AI’s overall influence. There is scope here for a new role for workers’ representatives to flag up digitally-related risks and interactions, to assess the uncertain impact of largely invisible technologies and to find new ways of effectively integrating tacit knowledge into workflows and processes.
Two scenarios
In the negotiations over the AI regulation, two possible scenarios have emerged. The first revolves around adding ‘protective’ amendments to the text. This may not be enough, as significant fixes are required to extend its legal purview and make substantial changes to its scope.
The second scenario involves adopting complementary rules on AI for the workplace. These would add to the GDPR and the commission’s draft directive on improving working conditions in platform work, in particular when it comes to algorithmic management.
As the Dutch toeslagenaffaire has shown, algorithms can have a direct and damaging impact on people and on workers’ lives. For trust ever to exist, the AI act must be reorientated: its current focus is on enabling business and promoting the EU as a global AI leader, when the priority should be to protect citizens and workers.



 Aida Ponce Del CastilloAida Ponce Del Castillo is a senior researcher at the European Trade Union Institute.You are here: Home / Economy / Artificial intelligence: filling the gaps







 Most Popular Posts
 The assault on labour rights in FinlandAntti Alaja and Joel Kaitila George Orwell and Europe’s new normalJan Zielonka Ukraine: Putin’s ‘reality’ … and the real worldFrank Hoffer Will the young save Europe from the rise of the far right?Albena Azmanova Housing crisis: Europe cannot afford itGerald Koessl


 Most Recent Posts
 Labour’s labour agenda—resetting relations with EuropeIvan Williams Jimenez Development: better days could lie ahead (yes, really)Vilgot Österlund What Labour needs to succeedMariana Mazzucato and Sarah Doyle Trump and the darkness threatening US politicsRichard Hargy The young generation needs quality traineeshipsMarc Steiert


 Other Social Europe Publications
 Global cities Strategic autonomy RE No. 13: Failed Market Approaches to Long-Term Care Towards a social-democratic century? National recovery and resilience plans


",,,,,,,,,,,,,,,
https://news.google.com/rss/articles/CBMiVWh0dHBzOi8vZW50ZXJwcmlzZXJzcHJvamVjdC5jb20vYXJ0aWNsZS8yMDIyLzQvYXJ0aWZpY2lhbC1pbnRlbGxpZ2VuY2UtYWktNy1rZXktcm9sZXPSAQA?oc=5,Artificial intelligence (AI): 7 roles to prioritize now - The Enterprisers Project,2022-04-14,The Enterprisers Project,https://enterprisersproject.com,Which artificial intelligence (AI) jobs are hottest now? Consider these seven AI/ML roles to prioritize in your organization,N/A,Which artificial intelligence (AI) jobs are hottest now? Consider these seven AI/ML roles to prioritize in your organization,Which artificial intelligence (AI) jobs are hottest now? Consider these seven AI/ML roles to prioritize in your organization,,,N/A,N/A,"
Which artificial intelligence (AI) jobs are hottest now? Consider these seven AI/ML roles to prioritize in your organization



          By 

Marc Lewis


April 14, 2022          |
%t min read



















      79 readers like this.  
















The Great Resignation may be a myth or reality, depending upon your viewpoint. But one thing is clear: The labor shortage is real.
But it is likely not due to a decline in the participation rate. According to the Federal Reserve Bank of St. Louis, the post-pandemic labor force participation rate has not declined dramatically. In fact, the core ages of the workforce, 25-54, saw a dip at the onset of the pandemic that was mild compared to other age groups – especially workers 55+.
Rather than a Great Resignation, this would suggest a Great Reallocation of the workforce. As a global search consultant, we are seeing this precipitous shift in positions, with great demand for skills in artificial intelligence and machine learning (AI/ML).
[ Want best practices for AI workloads? Get the eBook: Top considerations for building a production-ready AI/ML environment. ]
With that in mind, here are seven artificial intelligence (AI)-related roles to consider prioritizing right now as the workforce reallocates talent to new jobs that drive economic value for leading companies:
1. Head of Robotic Process Automation (RPA) – Director, VP, SVP
Description: This role is responsible for improving business process automation technology based on metaphorical software robots (bots) or on artificial intelligence. They lead teams in areas of process improvement, product design, and business transformation, which may involve tasks such as implementing new data sets, R&D or Revenue dashboards, and automation of NLP processes.
Why it is important: Effective management of RPA improves speed, quality, and productivity by minimizing the need for human assistance in the automation process.
[ Get the cheat sheet: How to explain RPA in plain English. ]
2. Head of Artificial Intelligence & Machine Learning (AI/ML) – VP, SVP, EVP
Description: This leader is responsible for building innovative, world-class products and capabilities by leading a team of data and machine learning engineers in building high-quality products for both internal and external use. They lead and mentor teams implementing cutting-edge Machine Learning/Artificial Intelligence and analytics systems, tools, and services that operate at an unprecedented scale.
Why it is important: Every organization is challenged to remain competitive in the market, increasing revenue and reducing operating costs. AI is the single most powerful tool that organizations are using to make informed decisions, drive new lines of revenue, attract new customers, and optimize the costs of business operations. A technical leader to run this program is imperative to the success of the program.
3. Head of Customer Insights
Description: The customer insights leader strives to improve marketing by gaining a better customer understanding through both data and research. These analytics and insights apply to all marketing channels and are delivered at preferred customer touchpoints.
Why it is important: Consumer insights play a huge role in reducing inefficiency and repetitive tasks. Brand leaders can also use consumer insights to measure key performance metrics for optimizing operational excellence and product innovation. This helps reduce churn, waste, and redundancy.
4. Product Management – Artificial Intelligence/Machine Learning
Description: This role is responsible for defining and owning the data science product roadmap within an organization. He or she prioritizes the research and development of optimization, statistical, and machine learning models, and takes to market new product capabilities to automate customers’ business processes.
Why it is important: A deep focus on the customer experience is critical to assure that organizations find solutions to customer challenges and keep up with market trends.
[ Related read: Artificial Intelligence (AI): 3 strategies for advancing your career. ]
5. Chief Data Officer (CDO)
Description: The chief data officer is responsible for providing world-class information management and data operations. The CDO builds enterprise intelligence and automation capabilities to ensure that pertinent data is available, reliable, consistent, accessible, secure, and timely to support the mission and activities. This includes:

Defining an ongoing data strategy in partnership with leaders from across the organization
Implementing an appropriate and well-defined data governance approach
Creating constructs to support optimal access/retrieval, security, storage/caching, movement/transformation, and classification/encryption
Management of data across multiple teams

Why it is important: Many organizations are drowning in data, and the ability to “make data speak” with the right information at the right time is critical to organizational success. The CDO is key to building foundational data and analytics competencies and ensuring that data generates these key business benefits:

Business leaders receive advanced analytics that help decision-making that drives desired business outcomes
Business leaders are empowered to explain to the board and C-level how data is applied in their organization’s use cases
Data becomes a powerful tool to guide strengths, weaknesses, opportunities, and threat discussions

6. Data Scientist
Description: Data scientists are responsible for providing data, analysis, statistical modeling, and machine-learning capabilities to inform key business initiatives.
Why it is important: Data science can add value to any business that can use its data well. From statistics and insights across workflows and hiring new candidates to helping senior staff make better-informed decisions, data science is invaluable in today’s business environment.
7. Chief Digital Officer
Description: The chief digital officer is responsible for leading and building key technologies to drive digital transformation across the enterprise. This role serves as a strategic leader for key IT business processes, including the architecture committee, capital planning, and security processes.

Skip to bottom of list 
More on artificial intelligence

Augmented reality (AR) vs. virtual reality (VR): What’s the difference?
6 misconceptions about AIOps, explained
Cheat sheet: AI glossary
What is AI/ML and why does it matter to your business?
Ebook: Top considerations for building a production-ready AI/ML environment
AI vs. NLP: What are the differences?
What is edge machine learning?




Why it is important: Organizations need to drive growth and strategic renewal by transforming traditional analog business into digital. This role focuses on creating new value through the smart use of digital tools, platforms, technologies, services, and processes. In addition, as companies digitize, many have rushed to the cloud, with mixed results. Managing a cloud strategy is critical as improper management can cost enterprises millions.
While these seven AI roles are critical, finding talent to fill them is difficult.  AI, machine learning, and data analytics are new fields, and few people have relevant experience.
This leads us back to the fact: We are dealing with a Great Reallocation of the labor force to an AI/Machine learning, data-driven world.
[ How does AI connect to hybrid cloud strategy? Get the free eBooks, Hybrid Cloud Strategy for Dummies and Multi-Cloud Portability for Dummies. ]



What to read next



Topics

Enterprise Technology
IT Talent
Artificial Intelligence
Machine Learning







 
Marc Lewis is a co-founding partner and CEO of executive search firm Leadership Capital Group. He has three decades of experience in retained executive and board search nationally, and two decades internationally.More about me






Related content


 

The future of healthcare is in the cloud
 

Cloud computing: 3 business advantages
 

4 ways CIOs are rethinking digital transformation











",,,,,,,,,,,,,,,
