URL link,Title,Date,Source,Source Link,description,keywords,og:description,twitter:description,@context,@type,url,image,author,publisher,headline,datePublished,dateModified,articleSection,name,isAccessibleForFree,itemListElement,article:section,article:summary,article text,mainEntityOfPage,dateCreated,heading,articleBody,isBasedOn,thumbnailUrl,isPartOf,alternativeHeadline,@graph,identifier,creator,mentions,hasPart,address,diversityPolicy,email,legalName,leiCode,telephone,logo,brand,dateline,uploadDate,duration,potentialAction
https://news.google.com/rss/articles/CBMijQFodHRwczovL3d3dy5mb3JiZXMuY29tL3NpdGVzL2Jlcm5hcmRtYXJyLzIwMTgvMTEvMTIvdGhlLWFtYXppbmctd2F5cy1nb29nbGUtYW5kLWdyYW1tYXJseS11c2UtYXJ0aWZpY2lhbC1pbnRlbGxpZ2VuY2UtdG8taW1wcm92ZS1vdXItd3JpdGluZy_SAQA?oc=5,The Amazing Ways Google And Grammarly Use Artificial Intelligence To Improve Your Writing - Forbes,2018-11-12,Forbes,https://www.forbes.com,Grammarly and grammar suggestions from Google Docs use artificial intelligence technologies and algorithms to improve the way we write. Grammarly and Google have their sights set on developing their tech to provide even more editorial oversight to help humans communicate more effectively.,,Grammarly and grammar suggestions from Google Docs use artificial intelligence technologies and algorithms to improve the way we write. Grammarly and Google have their sights set on developing their tech to provide even more editorial oversight to help humans communicate more effectively.,Grammarly and grammar suggestions from Google Docs use artificial intelligence technologies and algorithms to improve the way we write. Grammarly and Google have their sights set on developing their tech to provide even more editorial oversight to help humans communicate more effectively.,http://schema.org,BreadcrumbList,https://www.forbes.com/sites/bernardmarr/2018/11/12/the-amazing-ways-google-and-grammarly-use-artificial-intelligence-to-improve-our-writing/,"{'@type': 'ImageObject', 'url': 'https://imageio.forbes.com/blogs-images/bernardmarr/files/2018/11/AdobeStock_156936344-1200x900.jpeg?format=jpg&height=900&width=1600&fit=bounds', 'width': 542.79, 'height': 304.6}","{'@type': 'Person', 'name': 'Bernard Marr', 'url': 'https://www.forbes.com/sites/bernardmarr/', 'description': 'Bernard Marr is a world-renowned futurist, board advisor and author of Generative AI in Practice: 100+ Amazing Ways Generative Artificial Intelligence is Changing Business and Society. He has written over 20 best-selling and award-winning books and advises and coaches many of the world’s best-known organisations. He has a combined following of 4 million people across his social media channels and newsletters and was ranked by LinkedIn as one of the top 5 business influencers in the world. Follow Bernard on LinkedIn, X (Twitter) or YouTube. Join his newsletter, check out his website and books.', 'sameAs': ['https://www.linkedin.com/in/bernardmarr/', 'https://www.twitter.com/BernardMarr', 'https://bernardmarr.com/']}","{'@type': 'NewsMediaOrganization', 'name': 'Forbes', 'url': 'https://www.forbes.com/', 'ethicsPolicy': 'https://www.forbes.com/sites/forbesstaff/article/forbes-editorial-values-and-standards/', 'logo': 'https://imageio.forbes.com/i-forbesimg/media/amp/images/forbes-logo-dark.png?format=png&height=455&width=650&fit=bounds'}",The Amazing Ways Google And Grammarly Use Artificial Intelligence To Improve Your Writing,2018-11-12T00:19:00-05:00,2018-11-15T05:55:10-05:00,Enterprise & Cloud,The Amazing Ways Google And Grammarly Use Artificial Intelligence To Improve Your Writing,False,"[{'@type': 'ListItem', 'position': 1, 'name': 'Forbes Homepage', 'item': 'https://www.forbes.com/'}, {'@type': 'ListItem', 'position': 2, 'name': 'Innovation', 'item': 'https://www.forbes.com/innovation/'}, {'@type': 'ListItem', 'position': 3, 'name': 'Enterprise Tech', 'item': 'https://www.forbes.com/enterprise-tech/'}]",Enterprise & Cloud,N/A,"More From ForbesJul 8, 2024,09:00am EDTSee The Future Data Center At The Israeli Quantum Computing CenterJun 30, 2024,09:00am EDTWar Can’t Stop Israeli Startups Determined To Thrive In The DesertJun 6, 2024,06:00am EDTIsraeli Startup Combines Software With Medicine To Transform $1.6 Trillion Pharma MarketMay 22, 2024,12:18pm EDT$20M Fund For Connecting Early-Stage Israeli Startups To New York CityMay 20, 2024,09:00am EDTBiomed 2024 Showcases Israel’s Resilient Entrepreneurial SpiritApr 30, 2024,09:00am EDTAI Is Moving Biology From Science To Engineering, Advancing MedicineApr 10, 2024,09:00am EDTThis Startup Wants To Be OpenAI Of Stem Cell Therapy, Targets $250B MarketEdit StoryForbesInnovationEnterprise TechThe Amazing Ways Google And Grammarly Use Artificial Intelligence To Improve Your WritingBernard MarrContributorOpinions expressed by Forbes Contributors are their own.FollowingFollowClick to save this article.You'll be asked to sign into your Forbes account.Got itNov 12, 2018,12:19am ESTUpdated Nov 15, 2018, 05:55am ESTThis article is more than 5 years old.Share to FacebookShare to TwitterShare to LinkedinWhile online editing tools such as Grammarly and grammar suggestions from Google Docs aren’t foolproof, the artificial intelligence and machine learning algorithms that power them are successfully improving the way many of us write. In the process, it saved millions of embarrassing errors caused by carelessness (there vs. they're) and, of course, caught mistakes that involved more challenging grammar rules. Whether we write an email, a text or something more formal, even professionals use these editing tools to detect errors before they mistakenly get broadcast. To really appreciate the technology that makes these editing tools possible, let's take a look at these services and the impressive ways they improve our writing.








Adobe Stock
Adobe Stock






Grammarly: The Leader of the Pack
Since its 2009 inception, cloud-based Grammarly has grown to more than 15 million daily active users and is often one of the top-ranked grammar checkers. Users can download the Grammarly Keyboard for their mobile devices, add an extension to Chrome, Firefox, Safari, Microsoft Edge, use the Grammarly Desktop App or download a plug-in for Microsoft Office so the algorithm can spell and grammar check on Word, social media and Outlook. Grammarly switched from a subscription-only model to a freemium model in 2015 to provide more access to users.
How does it work? Just like with other machine learning algorithms, Grammarly's artificial intelligence system was originally provided with a lot of high-quality training data to teach the algorithm by showing it examples of what proper grammar looks like. This text corpus—a huge compilation human researchers organized and labeled so the AI could understand it—showed, as an example, not only proper uses of punctuation, grammar and spelling, but incorrect applications so the machine could learn the difference. In addition, Grammarly’s system uses natural language processing to analyze every nuance of language down to the character level and all the way up to words and full paragraphs of text.
PROMOTED
The feedback the system gets through humans when they ignore a proposed suggestion helps the system get smarter and provides the human linguists working with the input of the machine on how to make the system better. The more text it is exposed to, the better it can make appropriate suggestions. That's one of the reasons the company switched in 2010 to a consumer service from targeting enterprise customers so it would have access to a larger data set and a more significant opportunity.

In 2017, investors General Catalyst, IVP and Spark Capital committed $110 million to the already profitable company to help it further enhance its capabilities. Although the company has made great strides in improving grammar, grammatically correct writing doesn't necessarily mean it is compelling or concise.  So, although the company has a history of adding new checks such as to identify vagueness or plagiarism to improve your writing, expect this new infusion of funds to allow the company to add staff in an effort to continue improvements to its algorithm and the editing it can do. It has adequately tackled the basic mechanics of writing from spelling, grammar, and sentence structure as well as being able to help with clarity and readability of text. The next frontier is to provide context-specific suggestions.
Grammar Suggestions: Google Docs’ AI Grammar Checker
Grammarly may have recently introduced an extension of their own to work with Google Docs, but Google wants to get their own skin in the game with its grammar suggestions product. Google is using machine translation, the same tech they use to translate from one language to another (and one it has said approached human levels of accuracy), to power its editing tool. Instead of language to language, it translates poorly written text into grammatically correct text. If the system identifies a grammar issue, it will highlight it similar to how the spell check functionality works, so you have a chance to review possible grammar errors before hitting “send” or “publish.” Currently, details are limited about the new service, and the grammar check feature is only available via an early adopter program.









DailyDozen
US


Forbes Daily: Join over 1 million Forbes Daily subscribers and get our best stories, exclusive reporting and essential analysis of the day’s news in your inbox every weekday.




                Sign Up
            


By signing up, you agree to receive this newsletter, other updates about Forbes and its affiliates’ offerings, our Terms of Service (including resolving disputes on an individual basis via arbitration), and you acknowledge our Privacy Statement. Forbes is protected by reCAPTCHA, and the Google Privacy Policy and Terms of Service apply.




You’re all set! Enjoy the Daily!


                More Newsletters
            


You’re all set! Enjoy the Daily!

                More Newsletters
            



These are undoubtedly intriguing developments, but we don't anticipate that they will take the place of a human writer anytime soon.
And according to the Grammarly Blog, “Our goal is to help you express yourself in the best way possible, whether you're applying for a job or texting a joke to your friends."" Ultimately, the company desires to become ""a true communication assistant that improves how people connect with and understand each other.""  It sounds like a brave mission any high school English teacher would support.Follow me on Twitter or LinkedIn. Check out my website or some of my other work here. Bernard MarrFollowingFollowBernard Marr is a world-renowned futurist, board advisor and author of Generative AI in Practice: 100+ Amazing Ways Generative Artificial Intelligence is... Read MoreEditorial StandardsPrintReprints & Permissions",,,,,,,,,,,,,,,,,,,,,,,,,
https://news.google.com/rss/articles/CBMieGh0dHBzOi8vd3d3Lm1ja2luc2V5LmNvbS9mZWF0dXJlZC1pbnNpZ2h0cy9hcnRpZmljaWFsLWludGVsbGlnZW5jZS9haS1hZG9wdGlvbi1hZHZhbmNlcy1idXQtZm91bmRhdGlvbmFsLWJhcnJpZXJzLXJlbWFpbtIBAA?oc=5,"Adoption of AI advances, but foundational barriers remain - McKinsey",2018-11-13,McKinsey,https://www.mckinsey.com,Survey respondents report the rapid adoption of AI and expect only a minimal effect on head count. Yet few companies have in place the foundational building blocks that enable AI to generate value at scale.,N/A,Survey respondents report the rapid adoption of AI and expect only a minimal effect on head count. Yet few companies have in place the foundational building blocks that enable AI to generate value at scale.,Survey respondents report the rapid adoption of AI and expect only a minimal effect on head count. Yet few companies have in place the foundational building blocks that enable AI to generate value at scale.,https://schema.org,Survey,https://www.mckinsey.com,https://www.mckinsey.com/~/media/mckinsey/featured%20insights/artificial%20intelligence/ai%20adoption%20advances%20but%20foundational%20barriers%20remain/ai-adoption-advances-1536x1536-100.jpg,,"{'@type': 'Organization', 'name': 'McKinsey & Company', 'logo': {'@type': 'ImageObject', 'url': 'https://www.mckinsey.com/~/media/Thumbnails/Mck_Logo'}}",,2018-11-13T00:00:00Z,2018-11-13T00:00:00Z,,,,,N/A,N/A,N/A,"{'@type': 'WebPage', '@id': 'https://www.mckinsey.com/featured-insights/artificial-intelligence/ai-adoption-advances-but-foundational-barriers-remain'}",2018-11-12T17:32:09Z,"AI adoption advances, but foundational barriers remain",,,,,,,,,,,,,,,,,,,,,,
