URL link,Title,Date,Source,Source Link,description,keywords,og:description,twitter:description,@context,@graph,article:section,article:summary,article text,@type,url,image,author,publisher,headline,datePublished,dateModified,articleSection,name,isAccessibleForFree,itemListElement,mainEntityOfPage,dateCreated,heading,articleBody,isBasedOn,thumbnailUrl,isPartOf,alternativeHeadline,hasPart,uploadDate,embedUrl,contentUrl,duration,dateline,creator,copyrightHolder,copyrightYear,inLanguage,foundingDate,logo,sameAs,comment,commentCount,sourceOrganization,@id,diversityPolicy,ethicsPolicy,masthead,speakable,video,Headline,DatePublished,DateModified,Description
https://news.google.com/rss/articles/CBMiYGh0dHBzOi8vd3d3LnB1bHNldG9kYXkuY28udWsvdmlld3MvZGF2aWQtc2Fsa2luL3Nob3VsZC1ncHMtYmUtYWZyYWlkLW9mLWFydGlmaWNpYWwtaW50ZWxsaWdlbmNlL9IBAA?oc=5,Should GPs be afraid of artificial intelligence? - Pulse,2023-07-11,Pulse,https://www.pulsetoday.co.uk,Columnist Dr David Salkin considers whether GPs really need to be afraid of the use of artificial intelligence in general practice,N/A,Columnist Dr David Salkin considers whether GPs really need to be afraid of the use of artificial intelligence in general practice,N/A,https://schema.org,"[{'@type': 'NewsArticle', '@id': 'https://www.pulsetoday.co.uk/views/david-salkin/should-gps-be-afraid-of-artificial-intelligence/#article', 'isPartOf': {'@id': 'https://www.pulsetoday.co.uk/views/david-salkin/should-gps-be-afraid-of-artificial-intelligence/'}, 'author': {'name': 'Rhiannon Jenkins', '@id': 'https://www.pulsetoday.co.uk/#/schema/person/fccb2f40c6a43dff774718d40a68b015'}, 'headline': 'Should GPs be afraid of artificial intelligence?', 'datePublished': '2023-07-11T09:18:13+00:00', 'dateModified': '2023-07-11T10:25:59+00:00', 'mainEntityOfPage': {'@id': 'https://www.pulsetoday.co.uk/views/david-salkin/should-gps-be-afraid-of-artificial-intelligence/'}, 'wordCount': 694, 'commentCount': 1, 'publisher': {'@id': 'https://www.pulsetoday.co.uk/#organization'}, 'image': {'@id': 'https://www.pulsetoday.co.uk/views/david-salkin/should-gps-be-afraid-of-artificial-intelligence/#primaryimage'}, 'thumbnailUrl': 'https://www.pulsetoday.co.uk/wp-content/uploads/2023/07/Dr-David-Salkin-1200x800-1.jpg', 'articleSection': ['David Salkin'], 'inLanguage': 'en-GB', 'potentialAction': [{'@type': 'CommentAction', 'name': 'Comment', 'target': ['https://www.pulsetoday.co.uk/views/david-salkin/should-gps-be-afraid-of-artificial-intelligence/#respond']}]}, {'@type': 'WebPage', '@id': 'https://www.pulsetoday.co.uk/views/david-salkin/should-gps-be-afraid-of-artificial-intelligence/', 'url': 'https://www.pulsetoday.co.uk/views/david-salkin/should-gps-be-afraid-of-artificial-intelligence/', 'name': 'Should GPs be afraid of artificial intelligence? - Pulse Today', 'isPartOf': {'@id': 'https://www.pulsetoday.co.uk/#website'}, 'primaryImageOfPage': {'@id': 'https://www.pulsetoday.co.uk/views/david-salkin/should-gps-be-afraid-of-artificial-intelligence/#primaryimage'}, 'image': {'@id': 'https://www.pulsetoday.co.uk/views/david-salkin/should-gps-be-afraid-of-artificial-intelligence/#primaryimage'}, 'thumbnailUrl': 'https://www.pulsetoday.co.uk/wp-content/uploads/2023/07/Dr-David-Salkin-1200x800-1.jpg', 'datePublished': '2023-07-11T09:18:13+00:00', 'dateModified': '2023-07-11T10:25:59+00:00', 'description': 'Columnist Dr David Salkin considers whether GPs really need to be afraid of the use of artificial intelligence in general practice', 'breadcrumb': {'@id': 'https://www.pulsetoday.co.uk/views/david-salkin/should-gps-be-afraid-of-artificial-intelligence/#breadcrumb'}, 'inLanguage': 'en-GB', 'potentialAction': [{'@type': 'ReadAction', 'target': ['https://www.pulsetoday.co.uk/views/david-salkin/should-gps-be-afraid-of-artificial-intelligence/']}]}, {'@type': 'ImageObject', 'inLanguage': 'en-GB', '@id': 'https://www.pulsetoday.co.uk/views/david-salkin/should-gps-be-afraid-of-artificial-intelligence/#primaryimage', 'url': 'https://www.pulsetoday.co.uk/wp-content/uploads/2023/07/Dr-David-Salkin-1200x800-1.jpg', 'contentUrl': 'https://www.pulsetoday.co.uk/wp-content/uploads/2023/07/Dr-David-Salkin-1200x800-1.jpg', 'width': 1200, 'height': 800}, {'@type': 'BreadcrumbList', '@id': 'https://www.pulsetoday.co.uk/views/david-salkin/should-gps-be-afraid-of-artificial-intelligence/#breadcrumb', 'itemListElement': [{'@type': 'ListItem', 'position': 1, 'name': 'Home', 'item': 'https://www.pulsetoday.co.uk/?page_id=2'}, {'@type': 'ListItem', 'position': 2, 'name': 'Views', 'item': 'https://www.pulsetoday.co.uk/type/views/'}, {'@type': 'ListItem', 'position': 3, 'name': 'David Salkin', 'item': 'https://www.pulsetoday.co.uk/category/david-salkin/'}, {'@type': 'ListItem', 'position': 4, 'name': 'Should GPs be afraid of artificial intelligence?'}]}, {'@type': 'WebSite', '@id': 'https://www.pulsetoday.co.uk/#website', 'url': 'https://www.pulsetoday.co.uk/', 'name': 'Pulse Today', 'description': 'provides GP news, jobs and education. A dedicated service for GPs since 1960.', 'publisher': {'@id': 'https://www.pulsetoday.co.uk/#organization'}, 'potentialAction': [{'@type': 'SearchAction', 'target': {'@type': 'EntryPoint', 'urlTemplate': 'https://www.pulsetoday.co.uk/?s={search_term_string}'}, 'query-input': 'required name=search_term_string'}], 'inLanguage': 'en-GB'}, {'@type': 'Organization', '@id': 'https://www.pulsetoday.co.uk/#organization', 'name': 'Pulse Today', 'url': 'https://www.pulsetoday.co.uk/', 'logo': {'@type': 'ImageObject', 'inLanguage': 'en-GB', '@id': 'https://www.pulsetoday.co.uk/#/schema/logo/image/', 'url': 'https://www.pulsetoday.co.uk/wp-content/uploads/2022/08/Pulse_Logo.png', 'contentUrl': 'https://www.pulsetoday.co.uk/wp-content/uploads/2022/08/Pulse_Logo.png', 'width': 244, 'height': 80, 'caption': 'Pulse Today'}, 'image': {'@id': 'https://www.pulsetoday.co.uk/#/schema/logo/image/'}, 'sameAs': ['https://www.facebook.com/Pulse-Today-100392502738216/', 'https://x.com/pulsetoday', 'https://www.linkedin.com/groups/2123632/']}, {'@type': 'Person', '@id': 'https://www.pulsetoday.co.uk/#/schema/person/fccb2f40c6a43dff774718d40a68b015', 'name': 'Rhiannon Jenkins', 'image': {'@type': 'ImageObject', 'inLanguage': 'en-GB', '@id': 'https://www.pulsetoday.co.uk/#/schema/person/image/', 'url': 'https://secure.gravatar.com/avatar/d60a73a7f40f31d4826066f03be1edc3?s=96&d=mm&r=g', 'contentUrl': 'https://secure.gravatar.com/avatar/d60a73a7f40f31d4826066f03be1edc3?s=96&d=mm&r=g', 'caption': 'Rhiannon Jenkins'}, 'url': 'https://www.pulsetoday.co.uk/author/rhiannon-jenkins/'}]",N/A,N/A,N/A,,,,,,,,,,,,,,,,,,,,,,,,,,,,,,,,,,,,,,,,,,,,,,
https://news.google.com/rss/articles/CBMihQFodHRwczovL3d3dy5mb3JiZXMuY29tL3NpdGVzL2Jlcm5hcmRtYXJyLzIwMjMvMDcvMDcvYXJ0aWZpY2lhbC1pbnRlbGxpZ2VuY2UtaW4tbWFudWZhY3R1cmluZy1mb3VyLXVzZS1jYXNlcy15b3UtbmVlZC10by1rbm93LWluLTIwMjMv0gEA?oc=5,Artificial Intelligence In Manufacturing: Four Use Cases You Need To Know In 2023 - Forbes,2023-07-07,Forbes,https://www.forbes.com,"Discover how AI-powered cobots, 3D printing enhancements, futuristic generative designs, and predictive maintenance are revolutionizing the manufacturing industry in 2023","Artificial Intelligence,Adidas,Philips,Procter & Gamble,Manufacturing,AI","Discover how AI-powered cobots, 3D printing enhancements, futuristic generative designs, and predictive maintenance are revolutionizing the manufacturing industry in 2023","Discover how AI-powered cobots, 3D printing enhancements, futuristic generative designs, and predictive maintenance are revolutionizing the manufacturing industry in 2023",http://schema.org,,Enterprise Tech,N/A,"More From ForbesJul 22, 2024,02:54pm EDTThe Death Of Chevron Hurts But Won’t Necessarily Kill AI RegulationJul 22, 2024,09:00am EDT2024 Paris Olympic And Paralympic Games: A Big Opportunity For BrandsJul 22, 2024,01:49am EDTBusiness Leaders Still Aren’t Prepared For The AI RevolutionJul 19, 2024,02:59pm EDTNext Steps For Tech & Security Leaders After CrowdStrike Global OutageJul 19, 2024,09:00am EDTThe Transformative Power Of Generative AI And Knowledge ManagementJul 19, 2024,02:31am EDTOptical Media From Cerabyte Promises Fast Access Archival StorageJul 19, 2024,01:59am EDTHow Walmart Business Is Revolutionizing B2B Shopping With AI: A Deep Dive Into The Future Of RetailEdit StoryForbesInnovationEnterprise TechArtificial Intelligence In Manufacturing: Four Use Cases You Need To Know In 2023Bernard MarrContributorOpinions expressed by Forbes Contributors are their own.FollowingFollowClick to save this article.You'll be asked to sign into your Forbes account.Got it0Jul 7, 2023,01:44am EDTShare to FacebookShare to TwitterShare to LinkedinIn 2023, Artificial Intelligence (AI) is becoming increasingly essential to the day-to-day operations of manufacturers all over the world. Autonomous robots and machine learning-powered predictive analytics means companies are able to streamline processes, increase productivity and reduce the damage done to the environment in many new ways.
Artificial Intelligence In Manufacturing: Four Use Cases You Need To Know In 2023Adobe Stock

Importantly, rather than replacing human workers, a priority for many organizations is doing this in a way that augments human abilities and enables us to work more safely and efficiently.

Today, the concept of AI technology in factories goes far beyond the robot-filled workplaces that have been a feature of industries since the 1960s to encompass smart, connected manufacturing plants where humans and machines work together, and data and analytics enable better predictions and decision-making at every stage of the process. So let’s take a look at some of the most interesting use cases for AI in manufacturing in 2023:



Cobots
PROMOTED
Robots have been used to automate manual tasks in factories and manufacturing plants for decades, but cobots are a relatively new development. What makes them different is that they are designed to work alongside humans in a safe way while augmenting our abilities with their own.
One big advantage of cobots over traditional industrial robots is that they are cheaper to operate as they don’t need their own dedicated space in which to function. This means they can safely work on a regular plant floor without the need for protective cages or segregation from humans. They can pick components, carry out manufacturing operations like screwing, sanding, and polishing, and operate conventional manufacturing machinery like injection molding and stamping presses. They can also carry out quality control inspections using computer vision-enabled cameras.
MORE FROMFORBES ADVISORBest High-Yield Savings Accounts Of 2024ByKevin PayneContributorBest 5% Interest Savings Accounts of 2024ByCassidy HortonContributor
Cobots are widely used by automotive manufacturers, including BMW and Ford, where they perform tasks including gluing and welding, greasing camshafts, injecting oil into engines, and performing quality control inspections.









DailyDozen
US


Forbes Daily: Join over 1 million Forbes Daily subscribers and get our best stories, exclusive reporting and essential analysis of the day’s news in your inbox every weekday.




                Sign Up
            


By signing up, you agree to receive this newsletter, other updates about Forbes and its affiliates’ offerings, our Terms of Service (including resolving disputes on an individual basis via arbitration), and you acknowledge our Privacy Statement. Forbes is protected by reCAPTCHA, and the Google Privacy Policy and Terms of Service apply.




You’re all set! Enjoy the Daily!


                More Newsletters
            


You’re all set! Enjoy the Daily!

                More Newsletters
            



And consumer goods manufacturers, including giant Procter & Gamble, use cobots to streamline their manufacturing processes, engaging in tasks such as assembling and packaging products while maintaining the required high standards of hygiene.


1/1





Skip Ad
 
Continue watchingafter the adVisit Advertiser websiteGO TO PAGE

AI in Additive Manufacturing
Often known as 3D printing, the term additive manufacturing is used because it includes any manufacturing process where products and objects are built up, layer by layer. This differentiates it from more traditional, subtractive manufacturing processes where a product or component is made by cutting away at a block of material.
AI plays an important role in additive manufacturing by optimizing the way materials are dispensed and applied, as well as optimizing the design of complex products (see Generative Design below). It can also be used to spot and correct errors made by 3D printing technology in real-time.
Additive manufacturing equipment manufacturer Markforged has developed a tool called Blacksmith that uses AI to compare product designs with actual finished products and automate fine-tuning of the manufacturing process in order to bring them more closely into line.
Technology like this will be of benefit to manufacturers such as footwear giants Adidas and Reebok, which are now using 3D printing technology to create complex lattice structures for more comfortable and performance-enhancing running shoes.

Generative Design
Generative design is a bit like the generative AI we’ve seen in technologies like ChatGPT or Dall-E, except instead of telling it to create text or images, we tell it to design products.
Designers simply enter parameters such as what materials should be used, the size and weight of the desired product, what manufacturing methods will be used, and how much it should cost, and the generative design algorithms spit out blueprints and instructions.
Design engineers in the manufacturing industry can use this method to create a wide selection of design options for new products they want to create and then pick and choose the best ones to put into production. In this way, it accelerates product development processes while enabling innovation in design.
Generative design is particularly powerful when it comes to conceptualizing what can be done with new additive manufacturing processes, such as 3D printing, due to the complexity of the shapes and structures that can be created.
It has been used to create new types of components that are cheaper, lighter, and sturdier than existing components, improving the overall qualities of many products from cars and aircraft to prefabricated houses and structures.

Predictive Maintenance
Manufacturers use AI to analyze data from sensors and machinery on the factory floor in order to understand how and when failures and breakdowns are likely to occur. This means that they can ensure that resources and spare parts necessary for repair will be on hand to ensure a quick fix. It also means they can more accurately predict the amount of downtime that can be expected in a particular process or operation and account for this in their scheduling and logistical planning. Data from vibrations, thermal imaging, operating efficiency, and analysis of oils and liquids in machinery can all be processed via machine learning algorithms for vital insights into the health of manufacturing machinery.
Some examples of this in practice include Pepsi and Colgate, which both use technology designed by AI startup Augury to detect problems with manufacturing machinery before they cause breakdowns.

The Lights-Out Factory
A lights-out factory is a smart factory that's capable of operating entirely autonomously without any humans on site. Although mostly theoretical, there are some examples in existence already – such as the factory operated by Japanese robotics manufacturer FANUC without humans since 2001, which is capable of operating without human supervision for periods of up to 30 days.
Electronics manufacturer Philips also operates a factory in the Netherlands that makes electric razors, where a total of nine human members of staff are required on site at any time. This is a trend that we can expect to see other companies working towards adopting as time goes by as technology becomes increasingly efficient and affordable. Using a robots-only workforce means a factory can potentially operate 24/7 with no need for human intervention, potentially leading to big benefits when it comes to output and efficiency. Of course, questions will need to be addressed about what the impact removing humans from the manufacturing workforce will have on wider society.

To stay on top of the latest on new and emerging business and tech trends, make sure to subscribe to my newsletter, follow me on Twitter, LinkedIn, and YouTube, and check out my books Future Skills: The 20 Skills and Competencies Everyone Needs to Succeed in a Digital World and The Future Internet: How the Metaverse, Web 3.0, and Blockchain Will Transform Business and Society.
Follow me on Twitter or LinkedIn. Check out my website or some of my other work here. Bernard MarrFollowingFollowBernard Marr is a world-renowned futurist, board advisor and author of Generative AI in Practice: 100+ Amazing Ways Generative Artificial Intelligence is... Read MoreEditorial StandardsPrintReprints & PermissionsJoin The ConversationComments 0One Community. Many Voices. Create a free account to share your thoughts. Read our community guidelines  here.Forbes Community GuidelinesOur community is about connecting people through open and thoughtful conversations. We want our readers to share their views and exchange ideas and facts in a safe space.In order to do so, please follow the posting rules in our site's Terms of Service.  We've summarized some of those key rules below. Simply put, keep it civil.Your post will be rejected if we notice that it seems to contain:False or intentionally out-of-context or misleading informationSpamInsults, profanity, incoherent, obscene or inflammatory language or threats of any kindAttacks on the identity of other commenters or the article's authorContent that otherwise violates our site's terms.User accounts will be blocked if we notice or believe that users are engaged in:Continuous attempts to re-post comments that have been previously moderated/rejectedRacist, sexist, homophobic or other discriminatory commentsAttempts or tactics that put the site security at riskActions that otherwise violate our site's terms.So, how can you be a power user?Stay on topic and share your insightsFeel free to be clear and thoughtful to get your point across‘Like’ or ‘Dislike’ to show your point of view.Protect your community.Use the report tool to alert us when someone breaks the rules.Thanks for reading our community guidelines.  Please read the full list of posting rules found in our site's Terms of Service.",BreadcrumbList,https://www.forbes.com/sites/bernardmarr/2023/07/07/artificial-intelligence-in-manufacturing-four-use-cases-you-need-to-know-in-2023/,"{'@type': 'ImageObject', 'url': 'https://imageio.forbes.com/specials-images/imageserve/64a7a60f5e9eb3b27b9b888f/0x0.jpg?format=jpg&height=900&width=1600&fit=bounds', 'width': 542.79, 'height': 304.6}","{'@type': 'Person', 'name': 'Bernard Marr', 'url': 'https://www.forbes.com/sites/bernardmarr/', 'description': 'Bernard Marr is a world-renowned futurist, board advisor and author of Generative AI in Practice: 100+ Amazing Ways Generative Artificial Intelligence is Changing Business and Society. He has written over 20 best-selling and award-winning books and advises and coaches many of the world’s best-known organisations. He has a combined following of 4 million people across his social media channels and newsletters and was ranked by LinkedIn as one of the top 5 business influencers in the world. Follow Bernard on LinkedIn, X (Twitter) or YouTube. Join his newsletter, check out his website and books.', 'sameAs': ['https://www.linkedin.com/in/bernardmarr/', 'https://www.twitter.com/BernardMarr', 'https://bernardmarr.com/']}","{'@type': 'NewsMediaOrganization', 'name': 'Forbes', 'url': 'https://www.forbes.com/', 'ethicsPolicy': 'https://www.forbes.com/sites/forbesstaff/article/forbes-editorial-values-and-standards/', 'logo': 'https://imageio.forbes.com/i-forbesimg/media/amp/images/forbes-logo-dark.png?format=png&height=455&width=650&fit=bounds'}",Artificial Intelligence In Manufacturing: Four Use Cases You Need To Know In 2023,2023-07-07T01:44:51-04:00,2024-02-20T12:12:08-05:00,Enterprise Tech,Artificial Intelligence In Manufacturing: Four Use Cases You Need To Know In 2023,False,"[{'@type': 'ListItem', 'position': 1, 'name': 'Forbes Homepage', 'item': 'https://www.forbes.com/'}, {'@type': 'ListItem', 'position': 2, 'name': 'Innovation', 'item': 'https://www.forbes.com/innovation/'}, {'@type': 'ListItem', 'position': 3, 'name': 'Enterprise Tech', 'item': 'https://www.forbes.com/enterprise-tech/'}]",,,,,,,,,,,,,,,,,,,,,,,,,,,,,,,,,,
