URL link,Title,Date,Source,Source Link,description,keywords,og:description,twitter:description,@context,@type,name,url,logo,sameAs,article:section,article:summary,article text,isPartOf,dateline,headline,mainEntityOfPage,dateCreated,datePublished,dateModified,image,publisher,author,creator,copyrightHolder,copyrightYear,articleSection,thumbnailUrl,inLanguage,isAccessibleForFree,printSection,printEdition,foundingDate,itemListElement,articleBody,breadcrumb,uploadDate,duration,contentUrl,embedUrl,about,identifier,hasPart
https://news.google.com/rss/articles/CBMiUGh0dHBzOi8vZ2xvYmFsbmV3cy5jYS9uZXdzLzc2NjE5Mjcvam9icy1jYW5hZGEtcm9iaXRpY3MtYXJ0aWZpY2lhbC1pbnRlbGxpZ2VuY2Uv0gFUaHR0cHM6Ly9nbG9iYWxuZXdzLmNhL25ld3MvNzY2MTkyNy9qb2JzLWNhbmFkYS1yb2JpdGljcy1hcnRpZmljaWFsLWludGVsbGlnZW5jZS9hbXAv?oc=5,COMMENTARY: How robotics are changing jobs in Canada - Global News Toronto,2021-02-27,Global News Toronto,https://globalnews.ca,"Canadian firms that employed robots have also hired more human workers, contrary to what you may instinctively believe, says Joshua A. Marshall of Queen's.","AI, Artificial Intelligence, automation, Future Of Work, Jobs, Labour, Robotics, Robots, Work, Commentary","Canadian firms that employed robots have also hired more human workers, contrary to what you may instinctively believe, says Joshua A. Marshall of Queen's.","Canadian firms that employed robots have also hired more human workers, contrary to what you may instinctively believe, says Joshua A. Marshall of Queen's.",http://schema.org,NewsArticle,,,,,N/A,N/A,"
In 2017, I returned to Canada from Sweden, where I had spent a year working on automation in mining. Shortly after my return, the New York Times published a piece called, “The Robots Are Coming, and Sweden Is Fine,” about Sweden’s embrace of automation while limiting human costs.
Although Swedes are apparently optimistic about their future alongside robots, other countries aren’t as hopeful. One widely cited study estimates that 47 per cent of jobs in the United States are at risk of being replaced by robots and artificial intelligence.Whether we like it or not, the robot era is already upon us. The question is: is the Canadian economy poised to flourish or flounder in a world where robots take over the tasks we don’t want to do ourselves? The answer may surprise you.  Story continues below advertisement



 Modern-day robots are how artificial intelligence (AI) physically interacts with us, and the world around us. Although some robots resemble humans, most do not and are instead specifically designed to autonomously carry out complex tasks.Over the last few decades, robots have rapidly grown from specialized devices developed for select industry applications to household items. You can buy a robot to vacuum your floors, cut your grass and keep your home secure. Kids play with educational robots at school, where they learn to code, and compete in robot design teams that culminate in exciting international competitions. 


More on Canada


More than half of businesses have lost profit from extreme weather: survey					


Nova Scotia flash flood victim identified as 13-year-old; family in shock					


Freeland says she has ‘confidence’ to do her job after reports of tension					


Premiers wrapping up Council of the Federation meeting in Halifax					





Robots are also appearing in our hospitals, promising to help us fight the COVID-19 pandemic and performing other health-care tasks in safer and more efficient ways.The media is abuzz with stories about the latest technical claims, rumours and speculations about the secret developments of major international corporations, including Waymo, Tesla, Apple, Volvo and GM.And NASA just landed the Perseverance rover on Mars, with an autonomous helicopter called Ingenuity attached to its belly. 

				Breaking news from Canada and around the world				
				 sent to your email, as it happens.
				


Oh, and there are the dancing robots too, of course.  Story continues below advertisement



  










1:48
NASA’s Perseverance rover hoping to land on the surface of Mars





I have been working on robotics and autonomous vehicles technology in mining since the late 1990s. As such, I have been part of an industry that is undergoing a sea change, with fully autonomous machines steadily replacing workers in dark, dirty and dangerous scenarios.This robot revolution is happening behind the scenes in other industries too. Robots fill Amazon orders, manufacture stuff in factories, plant and pick crops, assist on construction sites, and the list goes on.In fact, robots even build other robots. Will we soon run out of jobs for people?There are many who paint a bleak picture of the future, where robots and AI take away all the “good jobs.” Although I fully acknowledge that we must be mindful of possible inequalities and unintended outcomes that might arise as a result of new technologies, I contend that Canadians have the potential to thrive.  Story continues below advertisement



 But to make it happen, my colleagues and I agree that our country needs a “robotics strategy.”In 2017, Canada launched the world’s first national AI strategy. Called the Pan-Canadian Artificial Intelligence Strategy and costing $125 million, the strategy aims to strengthen Canada’s leadership in AI by funding institutes, universities and hospitals to meet key objectives. 










7:59
Is Canada keeping up with automation?





 

Trending Now









Jack Black axes Tenacious D tour over bandmate’s ‘inappropriate’ Trump joke












Country star’s national anthem flub called the ‘worst’ people have ever heard







In its 2020 list of future jobs, the World Economic Forum listed “robotics engineers” as No. 10, in close company with “AI and machine learning specialists.” In Canada, I see huge potential for our robotics industry, with companies such as Clearpath Robotics, OTTO Motors, Kinova, Robotiq and Titan Medical already world leaders in the design and manufacture of robots for purposes ranging from materials handling to surgery.  Story continues below advertisement



 Beyond building robots, Canada’s most significant opportunities may lie in the increased adoption of robots into economically important industry sectors, including mining, agriculture, manufacturing and transportation.And yet, Canada may be the only G7 country without a robotics strategy.As it turns out, there is hope. According to a November 2020 report from Statistics Canada, Canadian firms that employed robots have also hired more human workers, contrary to what you may instinctively believe. In fact, they hired 15 per cent more workers!However, this does not mean that we can all sit back and relax. Along with the increased economic activity that robots bring to businesses comes a shift in the workforce from “workers spending less time performing routine, manual tasks, in favour of non-routine, cognitive tasks.”Mobile robotics researchers from the Ingenuity Labs Research Institute at Queen’s University. (Heshan Fernando), Author providedThe roles of education and research and development — such as new programs to train the next generation of robot-savvy Canadians and collaborative research clusters — are paramount. And they need to be combined with a national robotics strategy and a progressive socioeconomic system that supports a transitioning workforce to ensure the success, well-being and happiness of Canadians, alongside our robot friends.Joshua A. Marshall, associate professor of mechatronics and robotics engineering, Queen’s University.  Story continues below advertisement



 This article is republished from The Conversation under a Creative Commons licence. Read the original article. ",,,COMMENTARY: How robotics are changing jobs in Canada,https://globalnews.ca/news/7661927/jobs-canada-robitics-artificial-intelligence/,,2021-02-27T08:00:16-05:00,2021-04-19T15:39:52-04:00,"{'@type': 'ImageObject', 'url': 'https://globalnews.ca/wp-content/uploads/2017/07/artificial-intelligence.jpg?quality=85&#038;strip=all', 'width': 720, 'height': 514, 'caption': ""A 'Third AI' robot is seen on display during the Artifical Intelligence Exhibition and Conference in Tokyo, Japan, June 28, 2017. ""}","{'@type': 'Organization', 'name': 'Global News', 'logo': {'@type': 'ImageObject', 'url': 'https://globalnews.ca/wp-content/themes/shaw-globalnews/_img/logos/logo-amp.png?v=2', 'width': 230, 'height': 60}}","{'@type': 'Organization', 'name': 'Special to Global News'}",,,,,https://globalnews.ca/wp-content/uploads/2017/07/artificial-intelligence.jpg?quality=85&#038;strip=all,,,,,,,,,,,,,Commentary,,
https://news.google.com/rss/articles/CBMiWmh0dHBzOi8vdG93YXJkc2RhdGFzY2llbmNlLmNvbS9iZXN0LWNvbXBhbmllcy10by13b3JrLWZvci1hcy1hLWRhdGEtc2NpZW50aXN0LWFhOTkxZmYyOWUyYdIBAA?oc=5,Best Companies to Work for as a Data Scientist - Towards Data Science,2021-02-25,Towards Data Science,https://towardsdatascience.com,Expand your horizons when job hunting for Data Science roles,N/A,Expand your horizons when job hunting for Data Science roles,Expand your horizons when job hunting for Data Science roles,http://schema.org,NewsArticle,Best Companies to Work for as a Data Scientist - Towards Data Science,https://towardsdatascience.com/best-companies-to-work-for-as-a-data-scientist-aa991ff29e2a,,,N/A,N/A,"Member-only storyBest Companies to Work for as a Data ScientistExpand your horizons when job hunting for Data Science rolesRenato Boemer·FollowPublished inTowards Data Science·6 min read·Feb 25, 2021112ListenSharePhoto by Jordan Whitfield on UnsplashAre you either a Data Scientist actively seeking a job, or are you switching careers to Data Science and wants to know what is out there? If so, this article will give you some insights on where to work as a Data Scientist beyond the traditional tech companies.Obviously, most data professions would be excited to work at one of the companies that form the widely known acronym FAANG (Facebook, Apple, Amazon, Netflix, Google). FAANG companies are at the forefront of technological development. As a result, Data Scientist could learn a lot by spending a few years at one of those companies.However, according to the US Bureau of Labour Statistics, the need to manipulate data will rise, and there will be around 11.5 million job openings by 2026 [1]. There will be so many opportunities for data professionals (including machine learning and software engineers) that they do not have to focus on FAANG companies. For this reason, here is a list of tech companies that have the potential to provide a unique Data Science career. The list is based on the combination of Glassdoor and The Great Place to Work’s rank for tech companies. Enjoy!Large Companies",,,Best Companies to Work for as a Data Scientist - Towards Data Science,https://towardsdatascience.com/best-companies-to-work-for-as-a-data-scientist-aa991ff29e2a,2021-02-25T21:09:40.847Z,2021-02-25T21:09:40.847Z,2022-01-01T02:51:42.710Z,['https://miro.medium.com/v2/resize:fit:1200/1*MGYZRugfVxNaFktBR1r7mQ.jpeg'],"{'@type': 'Organization', 'name': 'Towards Data Science', 'url': 'towardsdatascience.com', 'logo': {'@type': 'ImageObject', 'width': 192, 'height': 60, 'url': 'https://miro.medium.com/v2/resize:fit:384/1*cFFKn8rFH4ZndmaYeAs6iQ.png'}}","{'@type': 'Person', 'name': 'Renato Boemer', 'url': 'https://boemer.medium.com'}",['Renato Boemer'],,,,,,False,,,,,,,,,,,,aa991ff29e2a,"{'@type': 'WebPageElement', 'isAccessibleForFree': 'False', 'cssSelector': '.meteredContent'}"
