URL link,Title,Date,Source,Source Link,description,keywords,og:description,twitter:description,@context,@type,name,logo,url,sameAs,itemListElement,publisher,headline,author,mainEntityOfPage,articleBody,datePublished,dateModified,image,article:section,article:summary,article text,articleSection,isAccessibleForFree,@graph,expires,location,email,potentialAction,genre,wordcount,foundingDate,founder,employee,inLanguage,thumbnailUrl,dateCreated,isPartOf,alternativeHeadline,alternateName,speakable,creator,isBasedOn,publishingPrinciples
https://news.google.com/rss/articles/CBMihQFodHRwczovL3d3dy5jYWYuY29tL2VuL2N1cnJlbnRseS9uZXdzLzIwMjIvMDUvaG93LWF1dG9tYXRpb24tYW5kLWFydGlmaWNpYWwtaW50ZWxsaWdlbmNlLXdpbGwtY2hhbmdlLWVtcGxveW1lbnQtaW4tdGhlLXB1YmxpYy1zZWN0b3Iv0gEA?oc=5,How Automation and AI Will Change Employment in the Public Sector - Concacaf,2022-05-02,Concacaf,https://www.caf.com,"As part of International Labor Day, CAF highlights how automation and artificial intelligence (AI) can each have complementary roles",N/A,"As part of International Labor Day, CAF highlights how automation and artificial intelligence (AI) can each have complementary roles","As part of International Labor Day, CAF highlights how automation and artificial intelligence (AI) can each have complementary roles",http://schema.org,Article,How Automation and Artificial Intelligence Will Change Employment in the Public Sector | CAF,https://www.caf.com/media/4662825/caforiginalcaribeh-eng.svg,https://www.caf.com/en/currently/news/2022/05/how-automation-and-artificial-intelligence-will-change-employment-in-the-public-sector/,"['https://www.facebook.com/CAF.America.Latina', 'https://twitter.com/AgendaCAF', 'https://www.youtube.com/user/CAFenVideo', 'https://www.linkedin.com/company/caf', 'https://www.instagram.com/agendacaf']","[{'@type': 'ListItem', 'position': '1', 'item': {'@type': 'Thing', '@id': 'https://www.caf.com/en/', 'name': 'CAF - development bank of Latin America'}}, {'@type': 'ListItem', 'position': '2', 'item': {'@type': 'Thing', '@id': 'https://www.caf.com/en/currently/', 'name': 'Currently'}}, {'@type': 'ListItem', 'position': '3', 'item': {'@type': 'Thing', '@id': 'https://www.caf.com/en/currently/news/', 'name': 'News'}}, {'@type': 'ListItem', 'position': '4', 'item': {'@type': 'Thing', '@id': 'https://www.caf.com/en/currently/news/2022/05/how-automation-and-artificial-intelligence-will-change-employment-in-the-public-sector/', 'name': 'How Automation and Artificial Intelligence Will Change Employment in the Public Sector'}}]","{'@type': 'Organization', 'name': 'CAF', 'logo': {'@type': 'ImageObject', 'url': 'https://www.caf.com/media/4662825/caforiginalcaribeh-eng.svg'}}",How Automation and Artificial Intelligence Will Change Employment in the Public Sector,CAF,https://www.caf.com/en/currently/news/2022/05/how-automation-and-artificial-intelligence-will-change-employment-in-the-public-sector/,"As part of International Labor Day, CAF highlights how automation and artificial intelligence (AI) can each have complementary roles",2022-05-04T18:03:00+00:00,2023-08-02T11:15:00+00:00,"{'@type': 'ImageObject', 'url': 'https://www.caf.com/media/3682537/pexels-thisisengineering-3861958.jpg', 'width': '965', 'height': '644'}",N/A,N/A,N/A,,,,,,,,,,,,,,,,,,,,,,
https://news.google.com/rss/articles/CBMifGh0dHBzOi8vd3d3LmZvcmJlcy5jb20vc2l0ZXMvYXNobGV5c3RhaGwvMjAyMi8wNS8wMy90aGUtcmlzZS1vZi1hcnRpZmljaWFsLWludGVsbGlnZW5jZS13aWxsLXJvYm90cy1hY3R1YWxseS1yZXBsYWNlLXBlb3BsZS_SAQA?oc=5,The Rise Of Artificial Intelligence: Will Robots Actually Replace People? - Forbes,2022-05-04,Forbes,https://www.forbes.com,Worried about losing your job to a robot? Here's what you should know about artificial intelligence and your career.,"AI,career coach,career advice,robots in the workplace",Worried about losing your job to a robot? Here's what you should know about artificial intelligence and your career.,Worried about losing your job to a robot? Here's what you should know about artificial intelligence and your career.,http://schema.org,BreadcrumbList,The Rise Of Artificial Intelligence: Will Robots Actually Replace People?,,https://www.forbes.com/sites/ashleystahl/2022/05/03/the-rise-of-artificial-intelligence-will-robots-actually-replace-people/,,"[{'@type': 'ListItem', 'position': 1, 'name': 'Forbes Homepage', 'item': 'https://www.forbes.com/'}, {'@type': 'ListItem', 'position': 2, 'name': 'Leadership', 'item': 'https://www.forbes.com/leadership/'}, {'@type': 'ListItem', 'position': 3, 'name': 'Careers', 'item': 'https://www.forbes.com/careers/'}]","{'@type': 'NewsMediaOrganization', 'name': 'Forbes', 'url': 'https://www.forbes.com/', 'ethicsPolicy': 'https://www.forbes.com/sites/forbesstaff/article/forbes-editorial-values-and-standards/', 'logo': 'https://imageio.forbes.com/i-forbesimg/media/amp/images/forbes-logo-dark.png?format=png&height=455&width=650&fit=bounds'}",The Rise Of Artificial Intelligence: Will Robots Actually Replace People?,"{'@type': 'Person', 'name': 'Ashley Stahl', 'url': 'https://www.forbes.com/sites/ashleystahl/', 'description': ""I'm a career coach, international bestselling author of You Turn, host of the top 100 mental health show, You Turn Podcast, and a TEDx speechwriter (and booker!). My mission is to help you step into a career you're excited about and aligned with. This may look like coaching you 1:1 or having you in one of my online courses, focused on career pivots, booking and writing TEDx talks, personal branding, podcast launching or creating a side hustle. Before being an entrepreneur, I was an award-winning counterterrorism professional who helped the Pentagon in Washington, DC with preparing civilians to prepare for the frontlines of the war on terror in Afghanistan."", 'sameAs': ['https://www.linkedin.com/in/ashleystahl', 'https://www.twitter.com/AshleyStahl', 'https://ashleystahl.com']}",,,2022-05-03T08:15:00-04:00,2022-05-04T15:09:15-04:00,"{'@type': 'ImageObject', 'url': 'https://imageio.forbes.com/specials-images/imageserve/5e432e1ba854780006b10cf4/0x0.jpg?format=jpg&height=900&width=1600&fit=bounds', 'width': 542.79, 'height': 304.6}",Careers,N/A,"More From ForbesJul 19, 2024,07:21am EDT9 Tips To Sustain A Youthful Mind And Thrive On Your Career PathJul 18, 2024,05:00pm EDTThe New 2024 Trend: ‘Loud Vacations’ Encouraging Employees To Use Their PTOJul 18, 2024,04:00pm EDTCareers In Tech Are Losing Appeal For Gen Z, According To SurveyJul 18, 2024,02:00pm EDTLooking To Work At A Startup? Explore These 5 Job BoardsJul 18, 2024,10:00am EDT5 Interview Questions That Gauge Critical Thinking SkillsJul 18, 2024,09:00am EDT3 Hiring Trends Worth Noting: How To Prepare For The Next Hiring SurgeJul 18, 2024,06:30am EDTA Fresh Look At Authenticity: How To Make It ActionableEdit StoryForbesLeadershipCareersThe Rise Of Artificial Intelligence: Will Robots Actually Replace People?Ashley StahlFormer ContributorOpinions expressed by Forbes Contributors are their own.Click to save this article.You'll be asked to sign into your Forbes account.Got itMay 3, 2022,08:15am EDTUpdated May 4, 2022, 03:09pm EDTThis article is more than 2 years old.Share to FacebookShare to TwitterShare to LinkedinWill robots replace human workers? Getty
Robots and artificial intelligence (AI) are expected to permeate our daily lives by 2025. This could have huge implications on several business sectors, most notably healthcare, customer service and logistics. Already, AI is responsible for medical research breakthroughs and climate research, not to mention self-driving cars.


Will robots replace human workers? 

The answer to that seems to be divided. According to Pew Research, about half (48%) of experts surveyed felt that robots and digital agents will displace a significant number of blue- and white-collar jobs. Their concern is that this will increase income inequality and create a mass of virtually unemployable people. The other half (52%) expect robotics and AI to create more jobs than they take. This latter half believes that while AI will replace humans, these experts have faith in human ingenuity to create new jobs, industries, and new ways of making a living—much like at the dawn of the Industrial Revolution.

Of interest in the Pew study, both groups are concerned that our educational institutions are not adequately preparing people for the job market of tomorrow.

What is artificial intelligence? 
PROMOTED
AI in its simplest form stands for artificial intelligence designed to mimic human intelligence to perform tasks. Advocates of AI see this as a positive step forward. It will make it easier for businesses to identify and rectify problems. AI will potentially improve recruitment, cybersecurity, marketing, and standard operating processes.
AI can process large amounts of data and execute complex algorithms quickly and accurately. Each year, AI is getting ""smarter"" and increasing business efficiency.
What will it be like to work with robots? 
MORE FROMFORBES ADVISORBest High-Yield Savings Accounts Of 2024ByKevin PayneContributorBest 5% Interest Savings Accounts of 2024ByCassidy HortonContributor
Leading expert Martina Mara, professor of robopsychology at Johannes Kepler University Linz, suggests we ask a different question: What do we want the future of work to look like? How do we want robots to change our lives? She reminds us that robots are developed by people. While robots can work 24/7, they cannot generalize or contextualize. They have no soft skills.









CxO
US


CEO: C-suite news, analysis, and advice for top decision makers right to your inbox.




                Sign Up
            


By signing up, you agree to receive this newsletter, other updates about Forbes and its affiliates’ offerings, our Terms of Service (including resolving disputes on an individual basis via arbitration), and you acknowledge our Privacy Statement. Forbes is protected by reCAPTCHA, and the Google Privacy Policy and Terms of Service apply.




You’re all set! Enjoy the CEO newsletter!


                More Newsletters
            


You’re all set! Enjoy the CEO newsletter!

                More Newsletters
            



They're hard wired, literally, to perform highly specific and clearly structured tasks. This is great news for humans—we get to pass off the mundane repetitive tasks and adopt those that require critical thinking and problem solving based on human intuition.


1/1





Skip Ad
 
Continue watchingafter the adVisit Advertiser websiteGO TO PAGE
AI is evolving and technology is having an increasingly bigger role, but it will complement and augment most jobs, not replace them. In a study involving 1500 companies, researchers found that the most significant performance improvements occurred when humans and machines worked together. Humans perform three crucial roles: they train machines what to do, explain outcomes especially when those are counterintuitive or controversial, and they sustain responsible use of machines. Robots need us just as much as we need them.
Robots are used to do the heavy lifting, literally. In manufacturing, cobots, context-aware robots, perform repetitive actions dominated by heavy lifting, while their human coworker completes complementary tasks that require more dexterity and judgment.
Whether you are pro-bot or anti-bot, you may not have a choice. Rosie the Robot who worked for the Jetsons is probably still far away, but we already have robots that will vacuum our floors and AI has been used in the customer service industry for years.
We need to begin to look at how we can improve technology-related skills while at the same time promoting characteristically human skills. Creativity, intuition, initiative and critical thinking are human skills that will not likely translate to robots—at least not soon. We should already be thinking of how we as employers and employees can harness robots to augment the work we do.
If not already, it won't be long before your next co-worker is a robot.
Follow me on Twitter or LinkedIn. Check out my website. Ashley StahlI'm a career coach, international bestselling author of You Turn, host of the top 100 mental health show, You Turn Podcast, and a TEDx speechwriter (and... Read MoreEditorial StandardsPrintReprints & Permissions
1/100:00Miley Cyrus Explains Why Growing With Her Audience Means So Much To Her





Skip Ad
 
Continue watchingMiley Cyrus Explains Why Growing With Her Audience Means So Much To Herafter the adVisit Advertiser websiteGO TO PAGE",Careers,False,,,,,,,,,,,,,,,,,,,,
https://news.google.com/rss/articles/CBMiV2h0dHBzOi8vZWRyaS5vcmcvb3VyLXdvcmsvdGhlLWV1cy1hcnRpZmljaWFsLWludGVsbGlnZW5jZS1hY3QtY2l2aWwtc29jaWV0eS1hbWVuZG1lbnRzL9IBAA?oc=5,The EU’s Artificial Intelligence Act: Civil society amendments - European Digital Rights (EDRi),2022-05-03,European Digital Rights (EDRi),https://edri.org,"Artificial Intelligence (AI) systems are increasingly used in all areas of public life. It is vital that the AI Act addresses the structural, societal, political and economic impacts of the use of AI, is future-proof, and prioritises affected people, the protection of fundamental rights and democratic values. The following issue papers detail the amendments of civil society following the Civil Society Statement on the AI Act, released in November 2021.",N/A,"Artificial Intelligence (AI) systems are increasingly used in all areas of public life. It is vital that the AI Act addresses the structural, societal, political and economic impacts of the use of AI, is future-proof, and prioritises affected people, the protection of fundamental rights and democratic values. The following issue papers detail the amendments of civil society following the Civil Society Statement on the AI Act, released in November 2021.",N/A,https://schema.org,,,,,,,,,,,,,,,N/A,N/A,N/A,,,"[{'@type': 'WebPage', '@id': 'https://edri.org/our-work/the-eus-artificial-intelligence-act-civil-society-amendments/', 'url': 'https://edri.org/our-work/the-eus-artificial-intelligence-act-civil-society-amendments/', 'name': 'The EU’s Artificial Intelligence Act: Civil society amendments - European Digital Rights (EDRi)', 'isPartOf': {'@id': 'https://edri.org/#website'}, 'primaryImageOfPage': {'@id': 'https://edri.org/our-work/the-eus-artificial-intelligence-act-civil-society-amendments/#primaryimage'}, 'image': {'@id': 'https://edri.org/our-work/the-eus-artificial-intelligence-act-civil-society-amendments/#primaryimage'}, 'thumbnailUrl': 'https://edri.org/wp-content/uploads/2022/03/edri-final1_Power-in-the-hands-of-people1-scaled.jpg', 'datePublished': '2022-05-03T11:00:23+00:00', 'dateModified': '2023-01-05T11:28:37+00:00', 'description': 'Artificial Intelligence (AI) systems are increasingly used in all areas of public life. It is vital that the AI Act addresses the structural, societal, political and economic impacts of the use of AI, is future-proof, and prioritises\xa0affected people, the protection of fundamental rights and democratic values. The following issue papers detail the amendments of civil society following the\xa0Civil Society Statement on the AI Act, released in November 2021.', 'breadcrumb': {'@id': 'https://edri.org/our-work/the-eus-artificial-intelligence-act-civil-society-amendments/#breadcrumb'}, 'inLanguage': 'en-US', 'potentialAction': [{'@type': 'ReadAction', 'target': ['https://edri.org/our-work/the-eus-artificial-intelligence-act-civil-society-amendments/']}]}, {'@type': 'ImageObject', 'inLanguage': 'en-US', '@id': 'https://edri.org/our-work/the-eus-artificial-intelligence-act-civil-society-amendments/#primaryimage', 'url': 'https://edri.org/wp-content/uploads/2022/03/edri-final1_Power-in-the-hands-of-people1-scaled.jpg', 'contentUrl': 'https://edri.org/wp-content/uploads/2022/03/edri-final1_Power-in-the-hands-of-people1-scaled.jpg', 'width': 2560, 'height': 1440, 'caption': 'A group of people on the left are holding protest signs reading ""Dignity"", ""Justice"", ""Peace"", with the European flag behind them. On the right side, a set of surveillance cameras is pointed at the group of people.'}, {'@type': 'BreadcrumbList', '@id': 'https://edri.org/our-work/the-eus-artificial-intelligence-act-civil-society-amendments/#breadcrumb', 'itemListElement': [{'@type': 'ListItem', 'position': 1, 'name': 'Home', 'item': 'https://edri.org/'}, {'@type': 'ListItem', 'position': 2, 'name': 'Resources', 'item': 'https://edri.org/our-work/'}, {'@type': 'ListItem', 'position': 3, 'name': 'The EU’s Artificial Intelligence Act: Civil society amendments'}]}, {'@type': 'WebSite', '@id': 'https://edri.org/#website', 'url': 'https://edri.org/', 'name': 'European Digital Rights (EDRi)', 'description': 'Protecting digital rights in Europe.', 'potentialAction': [{'@type': 'SearchAction', 'target': {'@type': 'EntryPoint', 'urlTemplate': 'https://edri.org/?s={search_term_string}'}, 'query-input': 'required name=search_term_string'}], 'inLanguage': 'en-US'}]",,,,,,,,,,,,,,,,,,,
https://news.google.com/rss/articles/CBMiQ2h0dHBzOi8vd3d3LmVtcGxveW1lbnRsYXd3b3JsZHZpZXcuY29tL3RhZy9hcnRpZmljaWFsLWludGVsbGlnZW5jZS_SAQA?oc=5,Artificial intelligence Archives - Employment Law Worldview,2022-05-03,Employment Law Worldview,https://www.employmentlawworldview.com,N/A,N/A,N/A,N/A,https://schema.org,,,,,,,,,,,,,,,N/A,N/A,"


Does permitting the use of AI in employment call the works council into action? Not necessarily, says the German Labour Court
By Anna-Maria Hesse on March 5, 2024 Posted in Artificial Intelligence, Consultation, Data Protection, Monitoring, Privacy

The use of ChatGPT and its peers to make work easier and faster – whether permitted, tolerated or prohibited – is already part of everyday working life in many companies. However, the spread of that technology has raced far ahead of the law so the legal consequences of that use (employment rights and obligations, data … Continue Reading

",,,"[{'@type': 'CollectionPage', '@id': 'https://www.employmentlawworldview.com/tag/artificial-intelligence/', 'url': 'https://www.employmentlawworldview.com/tag/artificial-intelligence/', 'name': 'Artificial intelligence Archives | Employment Law Worldview', 'isPartOf': {'@id': 'https://www.employmentlawworldview.com/#website'}, 'breadcrumb': {'@id': 'https://www.employmentlawworldview.com/tag/artificial-intelligence/#breadcrumb'}, 'inLanguage': 'en-US'}, {'@type': 'BreadcrumbList', '@id': 'https://www.employmentlawworldview.com/tag/artificial-intelligence/#breadcrumb', 'itemListElement': [{'@type': 'ListItem', 'position': 1, 'name': 'Home', 'item': 'https://www.employmentlawworldview.com/'}, {'@type': 'ListItem', 'position': 2, 'name': 'Artificial intelligence'}]}, {'@type': 'WebSite', '@id': 'https://www.employmentlawworldview.com/#website', 'url': 'https://www.employmentlawworldview.com/', 'name': 'Employment Law Worldview', 'description': '', 'potentialAction': [{'@type': 'SearchAction', 'target': {'@type': 'EntryPoint', 'urlTemplate': 'https://www.employmentlawworldview.com/?s={search_term_string}'}, 'query-input': 'required name=search_term_string'}], 'inLanguage': 'en-US'}]",,,,,,,,,,,,,,,,,,,
https://news.google.com/rss/articles/CBMiY2h0dHBzOi8vd3d3LmZyb250aWVyc2luLm9yZy9qb3VybmFscy9hcnRpZmljaWFsLWludGVsbGlnZW5jZS9hcnRpY2xlcy8xMC4zMzg5L2ZyYWkuMjAyMi44Njg3ODkvZnVsbNIBAA?oc=5,On the Impact of Digitalization and Artificial Intelligence on Employers' Flexibility Requirements in Occupations ... - Frontiers,2022-05-03,Frontiers,https://www.frontiersin.org,"Artificial intelligence (AI) has a high application potential in many areas of the economy, and its use is expected to accelerate strongly in the coming year...","digitalization,artificial intelligence,flexible working conditions,Occupations,employer survey","Artificial intelligence (AI) has a high application potential in many areas of the economy, and its use is expected to accelerate strongly in the coming year...",N/A,,,,,,,,,,,,,,,,N/A,N/A,"An Occupational Safety and Health Perspective on Human in Control and AI Susanne  Niehaus, Matthias  Hartwig, Patricia H.  Rosen and Sascha  Wischniewski",,,,,,,,,,,,,,,,,,,,,,
https://news.google.com/rss/articles/CBMiiAFodHRwczovL3d3dy5zb2NpYWxpc3RzYW5kZGVtb2NyYXRzLmV1L25ld3Nyb29tL2FydGlmaWNpYWwtaW50ZWxsaWdlbmNlLW11c3QtYmVuZWZpdC1odW1hbnMtbm90LWp1c3QtYmUtdG9vbC1zdXJ2ZWlsbGFuY2Utc29jaWV0eS1zYXktc2Rz0gEA?oc=5,"Artificial intelligence must benefit humans, not just be a tool for a surveillance society, say S&Ds | Socialists & Democrats - S&D Group",2022-05-03,S&D Group,https://www.socialistsanddemocrats.eu,The Socialists and Democrats have declared their support for the development and use of human-centric artificial intelligence technologies in the EU to help develop cr,"democracy, equality, employment, climate, migration, taxation, social",The Socialists and Democrats have declared their support for the development and use of human-centric artificial intelligence technologies in the EU to help develop cr,The Socialists and Democrats have declared their support for the development and use of human-centric artificial intelligence technologies in the EU to help develop cr,,,,,,,,,,,,,,,,N/A,N/A,"






Published date:

03/05/2022






Content type:


Press release







Share:

















The Socialists and Democrats have declared their support for the development and use of human-centric artificial intelligence technologies in the EU to help develop crucial areas of our society and economy. The S&Ds showed their support for the report of the Special Committee on Artificial Intelligence in a Digital Age during the plenary debate in the European Parliament and the report was adopted this afternoon. AI can offer great benefits to society, including in the fields of healthcare and environmental protection, as well as opportunities for small and medium enterprises. The S&D Group wants the EU to benefit from all the opportunities AI brings, while ensuring we are protected from the potential hidden risks of these technologies, especially in relation to workers' rights and people’s private lives.
Brando Benifei MEP, the S&D negotiator on the issue of Artificial Intelligence, said: 
“Artificial intelligence brings a lot of opportunities to people in their daily lives, but we have to make sure this fully respects human dignity, the environment and the achievements of democracy. The EU should lead in a global debate about artificial intelligence and work on settling global standards. What the S&D Group wants to avoid at any price is turning Europe into a surveillance society with the help of AI. Europe is a world champion in the protection of privacy, protection of personal data and workers’ rights. We should not allow any undermining of all the achievements we, the Socialists and Democrats, have fought for so hard throughout the years. The surveillance of workers or biometric recognition in public spaces are against these values and we will continue to fight so that they are not allowed in Europe.”
Ibán García del Blanco MEP, S&D spokesperson in the European Parliament’s Special Committee on Artificial Intelligence in a Digital Age, said: 
“After 18 months of work, our special committee has brought together a very balanced report where different aspects of human activity and challenges to the EU are reflected. Among them are the impact of AI on the daily lives of our citizens; its contribution to healthcare; the ways it can benefit the goals of the Green Deal; possible implications for democracy; the need for gender balance; and so many more. AI-powered surveillance in the workplace should not be allowed, as it severely compromises fundamental rights and mental health. We should continue a democratic dialogue with citizens, promoting AI literacy at all levels in order to have a technology that respects fundamental and workers’ rights.”


",,,,,,,,,,,,,,,,,,,,,,
