URL link,Title,Date,Source,Source Link,description,keywords,og:description,twitter:description,@context,@graph,article:section,article:summary,article text,@type,url,image,author,publisher,headline,datePublished,dateModified,articleSection,name,isAccessibleForFree,itemListElement,mainEntityOfPage,dateCreated,heading,articleBody,isBasedOn,thumbnailUrl,isPartOf,alternativeHeadline,hasPart,uploadDate,embedUrl,contentUrl,duration,dateline,creator,copyrightHolder,copyrightYear,inLanguage,foundingDate,logo,sameAs,comment,commentCount,sourceOrganization,@id,diversityPolicy,ethicsPolicy,masthead,speakable,video,Headline,DatePublished,DateModified,Description
https://news.google.com/rss/articles/CBMiSWh0dHBzOi8vd3d3LnRlY2hyZXB1YmxpYy5jb20vYXJ0aWNsZS91cHdvcmstbGF1bmNoZXMtZ2VuZXJhdGl2ZS1haS10b29scy_SAQA?oc=5,Upwork Launches New Generative AI Tools and Services Hub - TechRepublic,2023-07-11,TechRepublic,https://www.techrepublic.com,Upwork is launching a new generative AI tools and services hub. Discover more about Upwork's latest news with our article.,N/A,Upwork is launching a new generative AI tools and services hub. Discover more about Upwork's latest news with our article.,N/A,https://schema.org,"[{'@type': 'NewsArticle', '@id': 'https://www.techrepublic.com/article/upwork-launches-generative-ai-tools/#article', 'isPartOf': {'@id': 'https://www.techrepublic.com/article/upwork-launches-generative-ai-tools/'}, 'author': {'name': 'Karl Greenberg', '@id': 'https://www.techrepublic.com/#/schema/person/08ea3d9bdcc7e93c5425c7dd07742d38'}, 'headline': 'Upwork Launches New Generative AI Tools and Services Hub', 'datePublished': '2023-07-11T14:39:56+00:00', 'dateModified': '2023-07-14T14:38:15+00:00', 'mainEntityOfPage': {'@id': 'https://www.techrepublic.com/article/upwork-launches-generative-ai-tools/'}, 'wordCount': 815, 'publisher': {'@id': 'https://www.techrepublic.com/#organization'}, 'image': {'@id': 'https://www.techrepublic.com/article/upwork-launches-generative-ai-tools/#primaryimage'}, 'thumbnailUrl': 'https://assets.techrepublic.com/uploads/2022/05/Upwork-Laptop.jpeg', 'keywords': ['artificial intelligence', 'generative ai', 'upwork'], 'articleSection': ['Artificial Intelligence', 'Big Data', 'CXO'], 'inLanguage': 'en-US', 'copyrightYear': '2023', 'copyrightHolder': {'@id': 'https://www.techrepublic.com/#organization'}}, {'@type': 'WebPage', '@id': 'https://www.techrepublic.com/article/upwork-launches-generative-ai-tools/', 'url': 'https://www.techrepublic.com/article/upwork-launches-generative-ai-tools/', 'name': 'Upwork Launches New Generative AI Tools and Services Hub', 'isPartOf': {'@id': 'https://www.techrepublic.com/#website'}, 'primaryImageOfPage': {'@id': 'https://www.techrepublic.com/article/upwork-launches-generative-ai-tools/#primaryimage'}, 'image': {'@id': 'https://www.techrepublic.com/article/upwork-launches-generative-ai-tools/#primaryimage'}, 'thumbnailUrl': 'https://assets.techrepublic.com/uploads/2022/05/Upwork-Laptop.jpeg', 'datePublished': '2023-07-11T14:39:56+00:00', 'dateModified': '2023-07-14T14:38:15+00:00', 'description': ""Upwork is launching a new generative AI tools and services hub. Discover more about Upwork's latest news with our article."", 'breadcrumb': {'@id': 'https://www.techrepublic.com/article/upwork-launches-generative-ai-tools/#breadcrumb'}, 'inLanguage': 'en-US', 'potentialAction': [{'@type': 'ReadAction', 'target': ['https://www.techrepublic.com/article/upwork-launches-generative-ai-tools/']}]}, {'@type': 'ImageObject', 'inLanguage': 'en-US', '@id': 'https://www.techrepublic.com/article/upwork-launches-generative-ai-tools/#primaryimage', 'url': 'https://assets.techrepublic.com/uploads/2022/05/Upwork-Laptop.jpeg', 'contentUrl': 'https://assets.techrepublic.com/uploads/2022/05/Upwork-Laptop.jpeg', 'width': 1400, 'height': 788, 'caption': 'Image: Adobe Stock'}, {'@type': 'BreadcrumbList', '@id': 'https://www.techrepublic.com/article/upwork-launches-generative-ai-tools/#breadcrumb', 'itemListElement': [{'@type': 'ListItem', 'position': 1, 'name': 'Home', 'item': 'https://www.techrepublic.com/'}, {'@type': 'ListItem', 'position': 2, 'name': 'Upwork Launches New Generative AI Tools and Services Hub'}]}, {'@type': 'WebSite', '@id': 'https://www.techrepublic.com/#website', 'url': 'https://www.techrepublic.com/', 'name': 'TechRepublic', 'description': 'News, Tips, and Advice for Technology Professionals', 'publisher': {'@id': 'https://www.techrepublic.com/#organization'}, 'potentialAction': [{'@type': 'SearchAction', 'target': {'@type': 'EntryPoint', 'urlTemplate': 'https://www.techrepublic.com/?s={search_term_string}'}, 'query-input': 'required name=search_term_string'}], 'inLanguage': 'en-US'}, {'@type': 'Organization', '@id': 'https://www.techrepublic.com/#organization', 'name': 'TechRepublic', 'url': 'https://www.techrepublic.com/', 'logo': {'@type': 'ImageObject', 'inLanguage': 'en-US', '@id': 'https://www.techrepublic.com/#/schema/logo/image/', 'url': 'https://www.techrepublic.com/wp-content/uploads/2022/01/tr-logo-large.png', 'contentUrl': 'https://www.techrepublic.com/wp-content/uploads/2022/01/tr-logo-large.png', 'width': 746, 'height': 183, 'caption': 'TechRepublic'}, 'image': {'@id': 'https://www.techrepublic.com/#/schema/logo/image/'}, 'sameAs': ['https://www.facebook.com/TechRepublic/', 'https://x.com/TechRepublic', 'https://www.instagram.com/techrepublic/', 'https://www.linkedin.com/company/techrepublic/', 'https://www.pinterest.com/techrepublic/', 'https://www.youtube.com/c/techrepublic', 'https://en.wikipedia.org/wiki/TechRepublic']}, {'@type': 'Person', '@id': 'https://www.techrepublic.com/#/schema/person/08ea3d9bdcc7e93c5425c7dd07742d38', 'name': 'Karl Greenberg', 'image': {'@type': 'ImageObject', 'inLanguage': 'en-US', '@id': 'https://www.techrepublic.com/#/schema/person/image/', 'url': 'https://assets.techrepublic.com/uploads/2022/11/tr-karl-greenberg-headshot-112922-96x96.png', 'contentUrl': 'https://assets.techrepublic.com/uploads/2022/11/tr-karl-greenberg-headshot-112922-96x96.png', 'caption': 'Karl Greenberg'}, 'description': 'Karl is a lead writer on cloud security for TechRepublic, specializing in enterprise security risks, strategies, products, threats, trends and technologies for securing organizations. After receiving a BA in comparative religions from Florida State University, he worked for the Tampa Tribune, and radio and TV stations in Tallahassee before moving to Boulder, Colorado, where he pursued his interests in acting at Denver theaters. After receiving an MFA in dramatic writing from Brooklyn College he became a journalist and wrote for several years for publications covering the automotive, industrial chemical, internet tech and consumer marketing verticals. He has written for Adweek, Brandweek, The Chemical Market Reporter and MediaPost, and was also the public affairs officer at the NYU Tandon School of Engineering for six years prior to coming to TA.', 'url': 'https://www.techrepublic.com/meet-the-team/us/karl-greenberg/'}]",N/A,N/A,"

Image: Adobe Stock
Upwork, a global employment marketplace, is launching a hub dedicated to connecting companies seeking workers with technical skills specific to artificial intelligence with independent professionals who have such expertise. The AI Services hub is also designed to host a suite of generative AI tools along with new features powered by OpenAI, and tools from AI content generator Jasper.
Jump to:

Upwork offers free trial of Jasper generative AI
Increased demand for AI jobs and skills
The key to new Upwork AI hub is interactivity
OpenAI powers some features in Upwork’s new hub
Growing demand for prompt engineers, creators

Upwork offers free trial of Jasper generative AI
According to Dave Bottoms, general manager and vice president of products for Upwork Marketplace, the company is launching a 30-day free trial of Jasper generative AI services for copywriting, marketing and image creation available to all talent on Upwork, so they can increase their productivity, communicate more effectively with clients and elevate the quality of their work.
“These updates are technically found outside the AI Services hub, in other areas of the product flow,” he said.
Increased demand for AI jobs and skills
Jobs in generative AI reportedly jumped 20% in the U.S. in May 2023. According to online training and education site Coursera, the top jobs in AI include positions for data scientists and for engineers specializing in AI, machine learning, data, robotics and software.
Upwork sees rapid adoption of generative AI among pros and businesses
The company noted an over 450% growth in weekly job posts related to generative AI compared to this time last year.
“AI was the fastest-growing category on our platform in the first half of 2023, as measured by total number of individuals hired,” said Bottoms. He said that generative AI job posts on Upwork (Figure A) are up more than 1,000% and related searches are up more than 1,500% when comparing the second quarter of 2023 to the fourth quarter of 2022 .
Engineers, data scientists, among high demand AI positions. Image: Upwork
Upwork’s recent research indicates that demand for AI skills is accelerating, with 64% of C-suite executives saying they will hire more professionals of all types due to generative AI, according to Bottoms.
“Businesses are seeking out independent professionals on Upwork with expertise in AI tools like ChatGPT, DALL-E, Midjourney, Stable Diffusion, Jasper and more.” He said such job posts are up 230% in the second quarter of 2023 versus the fourth quarter of 2022.
SEE: Should you use generative AI for hiring? Read this TechRepublic article to find out.
The key to new Upwork AI hub is interactivity
The new AI Services hub is the company’s first foray into helping Upwork clients find and hire the best AI talent.
“It is an interactive experience that helps businesses quickly connect with independent professionals with AI expertise and find tips for integrating AI into their business,” he said. “For example, once there, clients can book a 1:1 consultation to get advice from an AI expert, hire a professional with experience in common AI use cases, check out the new AI Services resource center and more.”
Among tools that the AI Services hub includes are:

Guides for integrating generative AI into business.
Research on the adoption of generative AI in the workplace.
Access to the AI and Machine Learning Upwork Community Group


More must-read AI coverage



            WWDC: Apple Intelligence Brings Generative AI to Mail, Messaging and More        



            OpenAI Spring Update: Next Flagship Model Is the ‘Natively Multimodal’ GPT-4o        



            The 10 Best AI Courses in 2024        



            Copilot Cheat Sheet (Formerly Bing Chat): Complete Guide for 2024        



            Top AI Predictions for 2024 (Free Download)        



OpenAI powers some features in Upwork’s new hub
The company said OpenAI will power some new features in beta for job seekers and employers, including:

A large language model job post generator designed to help recruiters post customizable job post drafts.
A proposal tips tool for independent professionals on Upwork to improve their proposals for specific job posts by providing personalized tips on how to best showcase skills that meet the demands of hiring clients.
Upwork Chat for businesses working on the platform; this is designed to help on tasks such as hiring and talent search (Figure B).

Upwork Chat lets users use an AI natural language interface. Image: Upwork.
Growing demand for prompt engineers, creators, AI chatbot pros and more
“A few roles that we’ve seen gain steam are prompt engineers, AI content creators, machine learning and deep learning engineers, data scientists, AI chatbot developers, and professionals with model tuning and AI model integration expertise,” Bottoms said. “As we look at work being sought across a breadth of marketplace categories we support, we see talent using AI tools to augment their workflows in nearly every category.”
He added that Upwork is aiming to be the pre-eminent destination for clients seeking AI-related talent and work. “Over the past year alone, more than 10,000 contracts have involved AI work, and more than 250 AI skills are represented by talent on Upwork.”





                    Subscribe to the Innovation Insider Newsletter                

                    Catch up on the latest tech innovations that are changing the world, including IoT, 5G, the latest about phones, security, smart cities, AI, robotics, and more. Delivered Tuesdays and Fridays                




                        Email Address
                    






                            By signing up to receive our newsletter, you agree to our Terms of Use and Privacy Policy. You can unsubscribe at any time.                        



                    Subscribe                








            Share Article
          










































Account Information


TechRepublic close modal




Share with Your Friends
Upwork Launches New Generative AI Tools and Services Hub





Check out this article I found on TechRepublic.

Your email has been sent










Also Read



                    Hiring kit: Prompt engineer                  



                    10 most in-demand tech skills for freelancers in 2023                  



                    Freelance work hits an all-time high of 60 million Americans in 2022                  



                    How does Upwork compare to Fiverr?                  



                    Upwork vs. Freelancer.com: 2023 comparison                  



                    Artificial Intelligence: More must-read coverage                  



",,,,,,,,,,,,,,,,,,,,,,,,,,,,,,,,,,,,,,,,,,,,,,
https://news.google.com/rss/articles/CBMiVmh0dHBzOi8vd3d3LmNuYmMuY29tLzIwMjMvMDcvMTAvaG93LXRvLXVzZS1haS10by1tYWtlLW1vbmV5LXJpZ2h0LW5vdy1zYXktZXhwZXJ0cy5odG1s0gFaaHR0cHM6Ly93d3cuY25iYy5jb20vYW1wLzIwMjMvMDcvMTAvaG93LXRvLXVzZS1haS10by1tYWtlLW1vbmV5LXJpZ2h0LW5vdy1zYXktZXhwZXJ0cy5odG1s?oc=5,Self-made millionaire: 'A.I. will be the biggest wealth creator in history'—2 ways to use it to make money right now - CNBC,2023-07-10,CNBC,https://www.cnbc.com,"If you start learning artificial intelligence skills now, you'll be ahead of the curve when it becomes ubiquitous, says self-made millionaire Matt Higgins.","['makeit', 'Articles', 'Shark Tank', 'Artificial intelligence', 'Generative AI', 'Make It', 'Make It - Success', 'Make It - Power Players', 'Make It - Money', 'Make It: Next Gen Investing', 'source:tagname:CNBC US Source']","If you start learning artificial intelligence skills now, you'll be ahead of the curve when it becomes ubiquitous, says self-made millionaire Matt Higgins.","If you start learning artificial intelligence skills now, you'll be ahead of the curve when it becomes ubiquitous, says self-made millionaire Matt Higgins.",https://schema.org,,Make It: Next Gen Investing,N/A,N/A,NewsArticle,https://www.cnbc.com/2023/07/10/how-to-use-ai-to-make-money-right-now-say-experts.html,"{'@type': 'ImageObject', 'url': 'https://image.cnbcfm.com/api/v1/image/105791309-1552490360011gettyimages-1013442304.jpg?v=1688992201', 'width': 2004, 'height': 3000}","[{'@type': 'Person', 'name': 'Ashton Jackson', 'url': 'https://www.cnbc.com/ashton-jackson/'}]","{'@type': 'NewsMediaOrganization', 'name': 'CNBC', 'url': 'https://www.cnbc.com/', 'foundingDate': '1989-04-17', 'logo': {'@type': 'ImageObject', 'url': 'https://sc.cnbcfm.com/applications/cnbc.com/staticcontent/img/cnbc-hdr-logo2.png', 'width': 378, 'height': 98}, 'sameAs': ['https://www.facebook.com/CNBCMakeIt', 'https://www.twitter.com/CNBCMakeit', 'https://www.linkedin.com/showcase/cnbc-make-it']}",Self-made millionaire: 'A.I. will be the biggest wealth creator in history'—2 ways to use it to make money right now,2023-07-10T12:30:01+0000,2023-07-10T12:30:01+0000,Make It,,,,https://www.cnbc.com/2023/07/10/how-to-use-ai-to-make-money-right-now-say-experts.html,2023-07-10T12:30:01+0000,,,,https://image.cnbcfm.com/api/v1/image/105791309-1552490360011gettyimages-1013442304.jpg?v=1688992201&w=720&h=405,,,,,,,,,,,,,,,,,,,,,,,"{'@type': 'SpeakableSpecification', 'xpath': ['/html/head/title', '/html/head/meta[@name=""description""]/@content'], 'cssSelector': ['.group p']}","{'@type': 'VideoObject', 'contentUrl': 'https://pdl-iphone-cnbc-com.akamaized.net/VCPS/Y2023/M04D17/7000295087/1681755014034-Makeit_230405_PowerPlayers_Ramit_Sethi_toxic_beliefs_v2_L.mp4', 'description': 'Ramit Sethi, self-made millionaire and star of the new Netflix show ""How To Get Rich,"" lists three toxic money beliefs that could be holding you back from wealth creation.', 'duration': 'PT2M51S', 'name': 'Ramit Sethi: Avoid these 3 toxic money beliefs to build wealth', 'thumbnailUrl': 'https://image.cnbcfm.com/api/v1/image/107226529-_DSC5958-2.jpg?v=1715610628', 'uploadDate': '2023-04-17T18:09:42+0000'}",,,,
