URL link,Title,Date,Source,Source Link,description,keywords,og:description,twitter:description,@context,@type,name,url,logo,sameAs,article:section,article:summary,article text,isPartOf,dateline,headline,mainEntityOfPage,dateCreated,datePublished,dateModified,image,publisher,author,creator,copyrightHolder,copyrightYear,articleSection,thumbnailUrl,inLanguage,isAccessibleForFree,printSection,printEdition,foundingDate,itemListElement,articleBody,breadcrumb,uploadDate,duration,contentUrl,embedUrl,about,identifier,hasPart
https://news.google.com/rss/articles/CBMiiwFodHRwczovL3d3dy5kYXplZGRpZ2l0YWwuY29tL2FydC1waG90b2dyYXBoeS9hcnRpY2xlLzUyMDMwLzEvcGVvcGxlLWNhbnQtZGlzdGluZ3Vpc2gtYmV0d2Vlbi1haS1hcnRpZmljaWFsLWludGVsbGlnZW5jZS1odW1hbi1hcnQtbmV3LXN0dWR50gGRAWh0dHBzOi8vd3d3LmRhemVkZGlnaXRhbC5jb20vYXJ0LXBob3RvZ3JhcGh5L2FydGljbGUvNTIwMzAvMS9wZW9wbGUtY2FudC1kaXN0aW5ndWlzaC1iZXR3ZWVuLWFpLWFydGlmaWNpYWwtaW50ZWxsaWdlbmNlLWh1bWFuLWFydC1uZXctc3R1ZHk_YW1wPTE?oc=5,"Most people can’t distinguish between AI and human art, says a new study - Dazed",2021-02-25,Dazed,https://www.dazeddigital.com,"Inspired by the $432,500 sale of an AI-created portrait, the study also explores what types of art are most associated with artificially intelligent creators","art,fashion,film,music,ideas,ideas sharing network,dazed & confused, dazed, dazed & confused magazine, dazed and confused, dazed and confused magazine,dazed+confused,dazeddigital",N/A,"Inspired by the $432,500 sale of an AI-created portrait, the study also explores what types of art are most associated with artificially intelligent creators",http://schema.org,Organization,Dazed Digital,http://www.dazeddigital.com/,"{'@context': 'http://schema.org', '@type': 'ImageObject', 'url': 'http://www.dazeddigital.com/content/images/logo-199x60.png', 'width': '199', 'height': '60'}","['https://www.facebook.com/DazedandConfusedMagazine', 'https://twitter.com/Dazed', 'https://www.youtube.com/user/dazeddigital']",Art & Photography,N/A,"Art & PhotographyNews25February 2021TextThom WaiteShareHuman vs AI artworkscourtesy Harsha Gangadharbatla, Empirical Studies of the ArtsMost people can’t distinguish between AI and human art, says a new studyArt & PhotographyNewsInspired by the $432,500 sale of an AI-created portrait, the study also explores what types of art are most associated with artificially intelligent creators25February 2021TextThom Waite
 A new study that measures how humans perceive artworks generated by artificial intelligence, alongside artworks created by humans, has concluded that a majority of people basically can’t tell the difference.
Published in the journal Empirical Studies in the Arts by researcher Harsha Gangadharbatla, the study was inspired by the sale of “Edmond de Belamy”, an AI-generated portrait by the creative studio Obvious. Hailed as “the future”, the artwork fetched around ten times the average price for a male artist at auction (and 20 times more than artworks by women), going for $432,500 at Christie’s in 2018. 
The hype around “Edmond de Belamy” wasn’t an isolated occurrence, either. In a 2017 study that asked people to compare a selection of AI artworks and actual Art Basel pieces, people mostly preferred the artworks created by machines.
 “For me, the interesting thing was the role of humans in producing art,” Gangadharbatla tells Artnet. “I always assumed there was a soul that the human pours into the work. When a machine creates the work, how do people interpret it? Are they still moved? What role does the knowledge of who produced the artwork play in how it is perceived?”
The study consisted of a survey asking respondents to distinguish between human and AI artworks. The human pieces were created by artists Tom Bailey and Steve Johnson – impressionistic landscapes and geometric abstractions, respectively – while the computer-created artworks were the work of a single artist’s algorithms.
Of the hundreds of people that responded to the survey, a majority were unable to correctly attribute more than one in five landscape works created by the AI. More than 75 per cent guessed wrong on the remaining four. People were slightly more successful at attributing the AI’s abstract artworks, signalling a tendency to equate abstraction with AI and representational art with a human creator.
While Gangadharbatla says that AI creating artworks is relatively harmless (unless, presumably, you’re a human artist that doesn’t need any more competition), he adds that advertising could be a different story. “If computers start producing persuasive messages and they’re put in front of people,” he asks, “what effect would that have?”
In more recent news from the robot art world, Ai-Da (AKA the world’s first AI humanoid to create art without human input) announced a new exhibition of self portraits, set to go on display at London’s Design Museum. Earlier this year, OpenAI also debuted DALL·E, a neural network that can create bizarre images based on written descriptions.
In case you’re still trying to figure out whether the images above are made by humans or AI, they are, in order: AI, human, human, and AI.

Read More The queer art show raising money for the Joiners Arms This book explores queer art and its connection to clubbing What is AI image scraping, and how can artists fight back? These provocative photos are a celebration of queer erotica",,,,,,,,,,,,,,,,,,,,,,,,,,,,,,
https://news.google.com/rss/articles/CBMiZmh0dHBzOi8vd3d3LmVjb25vbWlzdC5jb20vYm9va3MtYW5kLWFydHMvMjAyMS8wMi8yNS9hcnRpZmljaWFsLWludGVsbGlnZW5jZS1oYXMtYS1wcm9ibGVtLXdpdGgtZ3JhbW1hctIBAA?oc=5,Artificial intelligence has a problem with grammar - The Economist,2021-02-25,The Economist,https://www.economist.com,The hitch illuminates the nature of language,[],The hitch illuminates the nature of language,The hitch illuminates the nature of language,https://schema.org,BreadcrumbList,The Economist,https://www.economist.com,"{'@type': 'ImageObject', 'url': 'https://www.economist.com/engassets/google-search-logo.png'}","['https://www.facebook.com/theeconomist', 'https://www.instagram.com/theeconomist', 'https://www.twitter.com/theeconomist', 'https://www.linkedin.com/company/the-economist', 'https://www.youtube.com/user/economistmagazine', 'https://en.wikipedia.org/wiki/The_Economist']",N/A,N/A,"Culture | JohnsonArtificial intelligence has a problem with grammarThe hitch illuminates the nature of language Feb 25th 2021ShareIF YOU FREQUENTLY Google language-related questions, whether out of interest or need, you’ve probably seen an advertisement for Grammarly, an automated grammar-checker. In ubiquitous YouTube spots Grammarly touts its ability not only to fix mistakes, but to improve style and polish too. Over more than a decade it has sprawled into many applications: it can check emails, phone messages or longer texts composed in Microsoft Word and Google Docs, among other formats.Already have an account?Log inContinue with a free trialExplore all our independent journalism for free for one month. Cancel any timeFree trialOr continue reading this articleRegister nowCulture February 27th 2021The siege of BollywoodThe first novel by a digital laureateThe risks and rewards of commodity-tradersThe life and lies of an unrepentant double-agentArtificial intelligence has a problem with grammarShareReuse this contentThe Economist todayHandpicked stories, in your inboxA daily newsletter with the best of our journalismSign upYes, I agree to receive exclusive content, offers and updates to products and services from The Economist Group. I can change these preferences at any time.More from CultureThe largest sting operation you’ve never heard ofA new book looks at Anom, a messaging app started by the FBI to catch criminalsWhy American sports teams switch cities so oftenAnd why fans outside America should fear being similarly jiltedWater’s benefits and risks run deeper than many knowTwo new books warn of battles over ocean management and freshwater supplyMore from CultureThe largest sting operation you’ve never heard ofA new book looks at Anom, a messaging app started by the FBI to catch criminalsWhy American sports teams switch cities so oftenAnd why fans outside America should fear being similarly jiltedWater’s benefits and risks run deeper than many knowTwo new books warn of battles over ocean management and freshwater supplySpain’s footballers, cream of the Euros, reflect a changed nationSport can express fierce rivalries—but it can also healThe best film and television of 2024 (so far)What to stream on your summer holidayWhoever wins at Wimbledon, many of tennis’s professionals are losersA new book chronicles the grim reality of chasing sporting success","{'@type': ['NewsArticle', 'Product'], 'name': 'The Economist', 'productID': 'economist.com:showcase'}",,Artificial intelligence has a problem with grammar,https://www.economist.com/books-and-arts/2021/02/25/artificial-intelligence-has-a-problem-with-grammar,2021-02-25T15:51:49.000Z,2021-02-25T15:51:49.000Z,,https://www.economist.com/sites/default/files/images/print-edition/20210227_BKD001_0.jpg,"{'@type': 'NewsMediaOrganization', 'name': 'The Economist', 'logo': {'@type': 'ImageObject', 'url': 'https://www.economist.com/engassets/google-search-logo.png'}}","{'@type': 'NewsMediaOrganization', 'name': 'The Economist', 'logo': {'@type': 'ImageObject', 'url': 'https://www.economist.com/engassets/google-search-logo.png'}, 'url': 'https://www.economist.com/'}","{'@type': 'NewsMediaOrganization', 'name': 'The Economist', 'logo': {'@type': 'ImageObject', 'url': 'https://www.economist.com/engassets/google-search-logo.png'}}","{'@type': 'NewsMediaOrganization', 'name': 'The Economist', 'logo': {'@type': 'ImageObject', 'url': 'https://www.economist.com/engassets/google-search-logo.png'}}",2021.0,Culture,https://www.economist.com/sites/default/files/images/print-edition/20210227_BKD001_0.jpg,en,False,Culture,2021-02-27T00:00:00Z,1843,"[{'@type': 'ListItem', 'position': 1, 'item': {'@id': 'https://www.economist.com/culture/', 'name': 'Culture'}}, {'@type': 'ListItem', 'position': 2, 'item': {'@id': 'https://www.economist.com/weeklyedition/2021-02-27', 'name': 'February 27th 2021 edition'}}]",,,,,,,,,
https://news.google.com/rss/articles/CBMiiQFodHRwczovL3d3dy5mYW8ub3JnL25ld3Nyb29tL2RldGFpbC9CdWlsZGluZy1tb21lbnR1bS1vbi10aGUtZXRoaWNhbC1hcHByb2FjaC10b3dhcmRzLUFydGlmaWNpYWwtSW50ZWxsaWdlbmNlLWVuZG9yc2VkLWJ5LVBvcGUtRnJhbmNpcy9lbtIBAA?oc=5,Building momentum on the ethical approach towards Artificial Intelligence endorsed by Pope Francis - Food and Agriculture Organization of the United Nations,2021-02-26,Food and Agriculture Organization of the United Nations,https://www.fao.org,"Pontifical Academy for Life, FAO, IBM and Microsoft mark the first anniversary of the Rome Call for AI Ethics",N/A,"Pontifical Academy for Life, FAO, IBM and Microsoft mark the first anniversary of the Rome Call for AI Ethics","Pontifical Academy for Life, FAO, IBM and Microsoft mark the first anniversary of the Rome Call for AI Ethics",http://schema.org,Article,Building momentum on the ethical approach towards Artificial Intelligence endorsed by Pope Francis,,,,N/A,N/A,N/A,,,,,,26/02/2021,,,"{'@type': 'Organization', 'name': 'FAO', 'logo': {'@type': 'ImageObject', 'url': 'https://www.fao.org/ResourcePackages/FAO/assets/dist/img/FAO-logo.JPG'}}",,,,,,,,,,,,"[{'@type': 'ListItem', 'position': 1, 'name': 'Home', 'item': 'https://www.fao.org/newsroom/en'}, {'@type': 'ListItem', 'position': 2, 'name': 'detail', 'item': 'https://www.fao.org/newsroom/detail/en'}]",,,,,,,,,
https://news.google.com/rss/articles/CBMiWmh0dHBzOi8vd3d3LmluZGlld2lyZS5jb20vZmVhdHVyZXMvZ2VuZXJhbC9hcnRpZmljaWFsLWludGVsbGlnZW5jZS1yYWNpYWwtYmlhcy0xMjM0NjE5ODc1L9IBAA?oc=5,Black Storytellers Use Artificial Intelligence to Address Racial Bias - IndieWire,2021-02-27,IndieWire,https://www.indiewire.com,"Stunning and accessible browser-based media (Web XR) has opened portals into Black ancestry, collective histories, and speculative futures.",N/A,"Stunning and accessible browser-based media (Web XR) has opened portals into Black ancestry, collective histories, and speculative futures.","Stunning and accessible browser-based media (Web XR) has opened portals into Black ancestry, collective histories, and speculative futures.",http://schema.org,NewsArticle,IndieWire,https://www.indiewire.com/features/general/artificial-intelligence-racial-bias-1234619875/,https://www.indiewire.com/wp-content/plugins/pmc-plugins/pmc-nova/wp-assets/brand-logos/indiewire-logo.svg,,N/A,N/A,N/A,,,Black Storytellers Use Artificial Intelligence to Address Racial Bias,"{'@type': 'WebPage', '@id': 'https://www.indiewire.com/features/general/artificial-intelligence-racial-bias-1234619875/'}",,2021-02-27T20:09:53+00:00,2021-02-27T22:41:18+00:00,"{'@type': 'ImageObject', 'url': 'https://www.indiewire.com/wp-content/uploads/2021/02/secretgarden.png'}","{'@type': 'Organization', 'name': 'IndieWire', 'url': 'https://www.indiewire.com', 'logo': {'@type': 'ImageObject', 'url': 'https://www.indiewire.com/wp-content/uploads/2018/04/cropped-iw_favicon.png'}}","{'@type': 'Person', 'name': 'Andrea S. Kim', 'url': 'https://www.indiewire.com/author/andrea-s-kim/'}",,,,,,,True,,,,,"Stunning and accessible browser-based media (Web XR) has opened portals into Black ancestry, collective histories, and speculative futures.",,,,,,,,
https://news.google.com/rss/articles/CBMiaGh0dHBzOi8vd3d3Lm5ld3N0aW1lcy5jb20vYnVzaW5lc3MvYXJ0aWNsZS8xMC1lbWVyZ2luZy1jYXJlZXJzLXRoYXQtd2lsbC1kb21pbmF0ZS10aGUtd29ybGQtMTU5ODIwNDkucGhw0gEA?oc=5,10 Emerging Careers That Will Dominate the Future of Work - Danbury News Times,2021-02-26,Danbury News Times,https://www.newstimes.com,The modern world has transformed many of the jobs that we used to know have perished and...,N/A,The modern world has transformed many of the jobs that we used to know have perished and...,The modern world has transformed many of the jobs that we used to know have perished and...,https://schema.org,WebPage,,https://www.entrepreneur.com/article/366177,,,N/A,N/A,"Depositphotos.comThe modern world has transformed many of the jobs that we used to know have perished and have transformed others to make way for the new needs demanded by the labor market. Given this, emerging professions have emerged thanks to the new demands that companies need.According to studies by LinkedIn and the World Economic Forum, they have sought to know the most relevant jobs to determine the direction of the labor market and companies. For this reason, Universidad Tecmilenio listed the 10 best-paid emerging professions in the last five years.Summer Sale! Dive into the news anytime with digital access: ONLY 25¢. ONLY 25¢ACT NOW1. Artificial Intelligence SpecialistAdvertisementArticle continues below this adThe hiring of artificial intelligence positions has grown 74% in the last four years, and covers different specializations within the industry such as artificial intelligence engineering and machine learning.close dialogAdvertisementclose dialog2. Robotics engineeringRobotics is a growing industry, therefore the demand for careers in robotics engineering and jobs in virtual and physical bots will be on the rise over the next few years.More BusinessJeweler, herbalist opens boutique store on Main Street in SalisburyJessica DeCarlo, a jeweler and herbalist, has opened Rosemary Rose Finery on Main Street...How the CDK cyberattack is affecting Connecticut car dealershipsCar dealers adapt after six days of being shut out of a crucial software system impacting...CT lawmakers say a Hamden company is no longer making lethal injection drugThe company was mentioned in an April episode of the HBO news comedy show Last Week...Connecticut quasi-public regional water authority seeks to buy Aquarion WaterThe South Central Connecticut Regional Water Authority looks to buy Aquarion Water from...CT adds estimated 4,700 jobs in May, unemployment declines slightlyConnecticut added an estimated 4,700 jobs in May, its fifth-straight month of payroll...3. Data scientistAdvertisementArticle continues below this adData science has topped the list of emerging jobs for three years, and demand for this specialty will continue to grow across all industries for years to come.4. Full stack engineeringThe pace of change in technology has made professions such as programming engineering or full stack a valuable job within companies. Since 2015, hiring for this position has increased 35% per year.5. Site Reliability EngineerAdvertisementArticle continues below this adThis profession is responsible for the operational and application development processes to function properly. So the demand for this work will continue to increase as we use technology in our day.6. Customer Success SpecialistGiven the growth of technology services, jobs related to Customer Success or customer success specialists have grown 34% since 2018. Most of these professionals work in the software and information technology industry, since they are responsible for both understand technology and manage the relationship with the customer.7. Sales development representativeAdvertisementArticle continues below this adThis profession has been on the list of emerging jobs more than once, and its importance lies in the continuous growth of the technology services of sales specialists to find new clients.8. Data engineeringToday, data is a valuable resource within all types of organizations and they need professionals who can build infrastructures to keep it organized. Therefore, the hiring rate of these specialists has increased 35% since 2015.9. Behavioral health technicianAdvertisementArticle continues below this adThis profession specializes in providing care for mental health, substance abuse, autism, and behavioral disorders. His field of work is varied so it does not require a specific degree, providing the opportunity for professionals from different areas to join this emerging career.10. Cybersecurity specialistCybersecurity is a priority for different sectors and companies in the face of the theft of confidential data. Vacancies for IT security specialists have increased more than 50% compared to years past.
					Copyright 2021 Entrepreneur.com Inc., All rights reserved
AdvertisementArticle continues below this adThis article originally appeared on entrepreneur.comAdvertisementArticle continues below this ad",,,10 Emerging Careers That Will Dominate the Future of Work,https://www.entrepreneur.com/article/366177,,2021-02-26T19:30:00Z,2021-02-26T19:30:00Z,"{'@type': 'imageObject', 'width': 2000, 'height': 1333, 'url': 'https://s.hdnux.com/photos/01/16/63/34/20657971/22/rawImage.jpg', 'thumbnailUrl': 'https://s.hdnux.com/photos/01/16/63/34/20657971/22/square_small.jpg'}","{'@type': 'NewsMediaOrganization', 'name': 'News-Times', 'url': 'https://www.newstimes.com/', 'address': {'@type': 'PostalAddress', 'addressLocality': 'Danbury', 'addressRegion': 'CT'}, 'logo': {'@type': 'ImageObject', 'url': 'https://www.newstimes.com/img/ldjson_logo.png', 'width': '600', 'height': '60'}, 'sameAs': ['https://www.facebook.com/newstimes', 'https://twitter.com/newstimes', 'https://www.instagram.com/insider_ct/']}","[{'@type': 'Person', 'name': 'Entrepreneur en Español'}]",,,,Business,,en,,,,,,"The modern world has transformed many of the jobs that we used to know have perished and have transformed others to make way for the new needs demanded by the labor market. Given this, emerging professions have emerged thanks to the new demands that companies need. According to studies by LinkedIn and the World Economic Forum, they have sought to know the most relevant jobs to determine the direction of the labor market and companies. For this reason, Universidad Tecmilenio listed the 10 best-paid emerging professions in the last five years. 1. Artificial Intelligence Specialist The hiring of artificial intelligence positions has grown 74% in the last four years, and covers different specializations within the industry such as artificial intelligence engineering and machine learning. 2. Robotics engineering Robotics is a growing industry, therefore the demand for careers in robotics engineering and jobs in virtual and physical bots will be on the rise over the next few years. 3. Data scientist Data science has topped the list of emerging jobs for three years, and demand for this specialty will continue to grow across all industries for years to come. 4. Full stack engineering The pace of change in technology has made professions such as programming engineering or full stack a valuable job within companies. Since 2015, hiring for this position has increased 35% per year. 5. Site Reliability Engineer This profession is responsible for the operational and application development processes to function properly. So the demand for this work will continue to increase as we use technology in our day. 6. Customer Success Specialist Given the growth of technology services, jobs related to Customer Success or customer success specialists have grown 34% since 2018. Most of these professionals work in the software and information technology industry, since they are responsible for both understand technology and manage the relationship with the customer. 7. Sales development representative This profession has been on the list of emerging jobs more than once, and its importance lies in the continuous growth of the technology services of sales specialists to find new clients. 8. Data engineering Today, data is a valuable resource within all types of organizations and they need professionals who can build infrastructures to keep it organized. Therefore, the hiring rate of these specialists has increased 35% since 2015. 9. Behavioral health technician This profession specializes in providing care for mental health, substance abuse, autism, and behavioral disorders. His field of work is varied so it does not require a specific degree, providing the opportunity for professionals from different areas to join this emerging career. 10. Cybersecurity specialist Cybersecurity is a priority for different sectors and companies in the face of the theft of confidential data. Vacancies for IT security specialists have increased more than 50% compared to years past. Copyright 2021 Entrepreneur.com Inc., All rights reserved This article originally appeared on entrepreneur.com","{'@type': 'BreadcrumbList', 'itemListElement': [{'@type': 'ListItem', 'position': '1', 'item': {'@type': 'WebPage', '@id': 'https://www.newstimes.com', 'name': 'Home'}}, {'@type': 'ListItem', 'position': '2', 'item': {'@type': 'WebPage', '@id': 'https://www.newstimes.com/business/', 'name': 'Business'}}]}",,,,,,,
https://news.google.com/rss/articles/CBMieGh0dHBzOi8vd3d3LnpkbmV0LmNvbS9hcnRpY2xlL3dvcmtpbmctZnJvbS1ob21lLXRoZW4tbWF5YmUteW91LXNob3VsZC1iZS1wYWlkLW1vcmUtdG8tZ2V0LWEtYmlnZ2VyLXBsYWNlLXNheS1lY29ub21pc3RzL9IBAA?oc=5,"Working from home? Then maybe you should be paid more to get a bigger place, say economists - ZDNet",2021-02-25,ZDNet,https://www.zdnet.com,Daphné Leprince-Ringuet says economists have estimated how much remote working costs in rent and mortgages. Who should pay the bill? Read more: http://zd.net/30fKjdB,N/A,Economists estimate that working from home could cost billions every year in housing space. Should companies pay for it?,Economists estimate that working from home could cost billions every year in housing space. Should companies pay for it?,https://schema.org,VideoObject,Working from home: Should your company pay for extra house space?,,,,N/A,N/A,N/A,,,,,,,,,,,,,,,https://www.zdnet.com/a/img/resize/696aeb03a09b11a6e46eb2b03c298b032fec3a02/2021/03/05/5b50ff34-6c4a-4857-92d1-d88e58fd537a/20210304-daphne-karen-space.jpg?auto=webp&fit=crop&height=675&width=1200,,,,,,,,,2021-03-05T19:33:46.000Z,PT0H6M37S,https://mt-rv-v5.zdnet.com/vr/2021/03/05/1869111363825/20210304_Daphne_Karen_Space_648336_742.mp4,https://www.zdnet.com/video/share/working-from-home-should-your-company-pay-for-extra-house-space/,,,
