URL link,Title,Date,Source,Source Link,description,keywords,og:description,twitter:description,@context,@type,url,image,author,publisher,headline,datePublished,dateModified,articleSection,name,isAccessibleForFree,itemListElement,article:section,article:summary,article text,@graph,dateCreated,identifier,creator,mainEntityOfPage,articleBody,thumbnailUrl,inLanguage,timeRequired,wordCount,video,hasPart,jobTitle,telephone,sameAs,address,alternativeHeadline,isPartOf,foundingDate,logo,contactPoint,speakable,associatedMedia
https://news.google.com/rss/articles/CBMif2h0dHBzOi8vd3d3LmZvcmJlcy5jb20vc2l0ZXMvYmVybmFyZG1hcnIvMjAxOS8wOC8yMy90aGUtYW1hemluZy13YXlzLXlvdXR1YmUtdXNlcy1hcnRpZmljaWFsLWludGVsbGlnZW5jZS1hbmQtbWFjaGluZS1sZWFybmluZy_SAQA?oc=5,The Amazing Ways YouTube Uses Artificial Intelligence And Machine Learning - Forbes,2019-08-23,Forbes,https://www.forbes.com,There are more than 1.9 billion users logged in to YouTube every single month who watch over a billion hours of video every day.,,There are more than 1.9 billion users logged in to YouTube every single month who watch over a billion hours of video every day.,There are more than 1.9 billion users logged in to YouTube every single month who watch over a billion hours of video every day.,http://schema.org,BreadcrumbList,https://www.forbes.com/sites/bernardmarr/2019/08/23/the-amazing-ways-youtube-uses-artificial-intelligence-and-machine-learning/,"{'@type': 'ImageObject', 'url': 'https://imageio.forbes.com/specials-images/imageserve/5d5f7a1668cb0a000917e355/0x0.jpg?format=jpg&height=900&width=1600&fit=bounds', 'width': 542.79, 'height': 304.6}","{'@type': 'Person', 'name': 'Bernard Marr', 'url': 'https://www.forbes.com/sites/bernardmarr/', 'description': 'Bernard Marr is a world-renowned futurist, board advisor and author of Generative AI in Practice: 100+ Amazing Ways Generative Artificial Intelligence is Changing Business and Society. He has written over 20 best-selling and award-winning books and advises and coaches many of the world’s best-known organisations. He has a combined following of 4 million people across his social media channels and newsletters and was ranked by LinkedIn as one of the top 5 business influencers in the world. Follow Bernard on LinkedIn, X (Twitter) or YouTube. Join his newsletter, check out his website and books.', 'sameAs': ['https://www.linkedin.com/in/bernardmarr/', 'https://www.twitter.com/BernardMarr', 'https://bernardmarr.com/']}","{'@type': 'NewsMediaOrganization', 'name': 'Forbes', 'url': 'https://www.forbes.com/', 'ethicsPolicy': 'https://www.forbes.com/sites/forbesstaff/article/forbes-editorial-values-and-standards/', 'logo': 'https://imageio.forbes.com/i-forbesimg/media/amp/images/forbes-logo-dark.png?format=png&height=455&width=650&fit=bounds'}",The Amazing Ways YouTube Uses Artificial Intelligence And Machine Learning,2019-08-23T01:32:05-04:00,2019-08-23T01:32:05-04:00,Enterprise & Cloud,The Amazing Ways YouTube Uses Artificial Intelligence And Machine Learning,False,"[{'@type': 'ListItem', 'position': 1, 'name': 'Forbes Homepage', 'item': 'https://www.forbes.com/'}, {'@type': 'ListItem', 'position': 2, 'name': 'Innovation', 'item': 'https://www.forbes.com/innovation/'}, {'@type': 'ListItem', 'position': 3, 'name': 'Enterprise Tech', 'item': 'https://www.forbes.com/enterprise-tech/'}]",Enterprise & Cloud,N/A,"More From ForbesJul 8, 2024,09:00am EDTSee The Future Data Center At The Israeli Quantum Computing CenterJun 30, 2024,09:00am EDTWar Can’t Stop Israeli Startups Determined To Thrive In The DesertJun 6, 2024,06:00am EDTIsraeli Startup Combines Software With Medicine To Transform $1.6 Trillion Pharma MarketMay 22, 2024,12:18pm EDT$20M Fund For Connecting Early-Stage Israeli Startups To New York CityMay 20, 2024,09:00am EDTBiomed 2024 Showcases Israel’s Resilient Entrepreneurial SpiritApr 30, 2024,09:00am EDTAI Is Moving Biology From Science To Engineering, Advancing MedicineApr 10, 2024,09:00am EDTThis Startup Wants To Be OpenAI Of Stem Cell Therapy, Targets $250B MarketEdit StoryForbesInnovationEnterprise TechThe Amazing Ways YouTube Uses Artificial Intelligence And Machine LearningBernard MarrContributorOpinions expressed by Forbes Contributors are their own.FollowingFollowClick to save this article.You'll be asked to sign into your Forbes account.Got itAug 23, 2019,01:32am EDTUpdated Aug 23, 2019, 01:32am EDTThis article is more than 4 years old.Share to FacebookShare to TwitterShare to LinkedinThere are more than 1.9 billion users logged in to YouTube every single month who watch over a billion hours of video every day. Every minute, creators upload 300 hours of video to the platform. With this number of users, activity, and content, it makes sense for YouTube to take advantage of the power of artificial intelligence (AI) to help operations. Here are a few ways YouTube, owned by Google, uses artificial intelligence today. 
The Amazing Ways YouTube Uses Artificial Intelligence And Machine LearningAdobe Stock

Automatically remove objectionable content 

In the first quarter of this year, 8.3 million videos were removed from YouTube, and 76% were automatically identified and flagged by artificial intelligence classifiers. More than 70% of these were identified before there were any views by users. While the algorithms are not foolproof, they are combing through content much more quickly than if humans were trying to monitor the platform singlehandedly. In some cases, the algorithm pulled down newsworthy videos mistakenly seeing them as “violent extremism.” This is just one of the reasons Google has full-time human specialists employed to work with AI to address violative content. 

In fact, according to Cecile Frot-Coutaz, head of EMEA, YouTube’s “number one priority” is to protect its users from harmful content. In pursuit of that, the company invested in not only human specialists but the machine learning technology to support the effort. AI has contributed greatly to YouTube's ability to quickly identify objectionable content. Before using artificial intelligence, only 8% of videos containing ""violent extremism"" (banned on the platform) were flagged and removed before ten views had occurred; but after machine learning was used, more than half of the videos removed had fewer than ten views. 

PROMOTED
One of the main drivers for YouTube's diligence in removing objectionable content is the pressure from brands, agencies, and governments and the backlash that's experienced if ads appear alongside offensive videos. When ads started appearing next to YouTube videos supporting racism and terrorism, Havas UK and other brands began pulling their advertising dollars. In response, YouTube deployed advanced machine learning and partnered with third-party companies to help provide transparency to advertising partners. 
The company also has a “trashy video classifier” in use which scans YouTube’s homepage and “watch next” panels. It looks at the feedback from viewers who might report a misleading title, inappropriate or other objectionable content.  
MORE FOR YOUTrump Assassination Attempt: Here’s What We KnowApple iPhone 16 Pro Design Upgrade Promises Key Feature Boost, Report SaysExplosive Materials Found In Car Of Suspected Trump Shooter
New effects on videos 
Move over Snapchat, Google’s artificial intelligence researchers trained a neural network to be able to swap out backgrounds on videos without the need for specialized equipment. While it's been possible to do this for decades—think green screens that are replaced by digital effects—it was a complicated and time-consuming process. The researchers trained an algorithm with carefully labeled imagery that allowed the algorithm to learn patterns, and the result is a fast system that can keep up with video. 









DailyDozen
US


Forbes Daily: Join over 1 million Forbes Daily subscribers and get our best stories, exclusive reporting and essential analysis of the day’s news in your inbox every weekday.




                Sign Up
            


By signing up, you agree to receive this newsletter, other updates about Forbes and its affiliates’ offerings, our Terms of Service (including resolving disputes on an individual basis via arbitration), and you acknowledge our Privacy Statement. Forbes is protected by reCAPTCHA, and the Google Privacy Policy and Terms of Service apply.




You’re all set! Enjoy the Daily!


                More Newsletters
            


You’re all set! Enjoy the Daily!

                More Newsletters
            



“Up Next” feature 
If you have ever used YouTube’s “Up Next” feature, you benefited from the platform’s artificial intelligence. Since the dataset on YouTube is constantly changing as its users upload hours of video every minute, the AI required to power its recommendation engine needed to be different than the recommendation engines of Netflix or Spotify. It had to be able to handle real-time recommendations while new data is constantly added by users. The solution they came up with is a two-part system. The first is candidate generation, where the algorithm assesses the YouTube history of the user. The second part is the ranking system that assigns a score to each video. 


1/100:16Forbes Innovation





Skip Ad
 
Continue watchingCall Of Duty Black Ops 6 Beta Dates And More Revealedafter the adVisit Advertiser websiteGO TO PAGE
Guillaume Chaslot, a former Google employee and founder of an initiative urging greater transparency known as AlgoTransparency, explained that the metric used by YouTube’s algorithm to determine a successful recommendation is watch time. This is good for the platform and the advertisers, but not so good for the users, he said. This situation could amplify videos that have outlandish content, and the more people spend time watching it, the more it gets recommended.  
Training on depth prediction 
With so much data, YouTube videos provide a fertile training ground for artificial intelligence algorithms. Google AI researchers used more than 2,000 ""mannequin challenge"" videos posted on the platform to create an AI model with the ability to discern the depth of field in videos. The ""mannequin challenge"" had groups of people in a video stand still as if frozen while one person goes through the scene shooting the video. Ultimately, this skill of depth prediction could help propel the development of augmented reality experiences. 
With the continuing crisis of mass shootings plaguing America, President Trump requested that social media companies, ""develop tools that can detect mass shooters before they strike."" With the assistance of artificial intelligence, YouTube, Twitter, and Facebook already work to delete terrorist content, but what's new in the President's request is that they work with the Department of Justice and law enforcement agencies. There are many questions about how such a partnership would work, if social media channels could detect actual terrorists before they act and the potential to impact the civil liberties of innocent people. Whether YouTube and other social media companies could use artificial intelligence to stop terrorists while not infringing on the rights of others remains to be seen.  
Follow me on Twitter or LinkedIn. Check out my website or some of my other work here. Bernard MarrFollowingFollowBernard Marr is a world-renowned futurist, board advisor and author of Generative AI in Practice: 100+ Amazing Ways Generative Artificial Intelligence is... Read MoreEditorial StandardsPrintReprints & PermissionsThe video player is currently playing an ad. You can skip the ad in 5 sec with a mouse or keyboard
1/100:08Mona Kattan On Building In Entrepreneurship And Founding Kayali | Forbes 30/50 Summit 2024





Skip Ad
 
Continue watchingMona Kattan On Building In Entrepreneurship And Founding Kayali | Forbes 30/50 Summit 2024after the adVisit Advertiser websiteGO TO PAGE",,,,,,,,,,,,,,,,,,,,,,,
https://news.google.com/rss/articles/CBMijwFodHRwczovL25ld3MubWljcm9zb2Z0LmNvbS9hcGFjLzIwMTkvMDgvMjYvcHJlcGFyaW5nLWZvci1haS10aGUtaW1wbGljYXRpb25zLW9mLWFydGlmaWNpYWwtaW50ZWxsaWdlbmNlLWZvci1qb2JzLWFuZC1za2lsbHMtaW4tYXNpYW4tZWNvbm9taWVzL9IBAA?oc=5,Preparing for AI: The implications of artificial intelligence for jobs and skills in Asian economies - Microsoft Stories Asia - Microsoft,2019-08-26,Microsoft,https://news.microsoft.com,N/A,N/A,"Maximizing the workplace benefits of new technologies How we adopt – and adapt to – artificial intelligence in the workplace will be crucial to the future of our region’s economic growth and the very nature of employment. The 4th Industrial Revolution is already bringing many changes. And, policymakers, employers, and civil society organizations across the […]",N/A,https://schema.org,,,,,,,,,,,,,N/A,N/A,"


		BEXIMCO Communications revolutionizes operations with Microsoft Dynamics 365 Business Central deployment	

","[{'@type': 'WebPage', '@id': 'https://news.microsoft.com/apac/2019/08/26/preparing-for-ai-the-implications-of-artificial-intelligence-for-jobs-and-skills-in-asian-economies/', 'url': 'https://news.microsoft.com/apac/2019/08/26/preparing-for-ai-the-implications-of-artificial-intelligence-for-jobs-and-skills-in-asian-economies/', 'name': 'Preparing for AI: The implications of artificial intelligence for jobs and skills in Asian economies - Microsoft Stories Asia', 'isPartOf': {'@id': 'https://news.microsoft.com/apac/#website'}, 'primaryImageOfPage': {'@id': 'https://news.microsoft.com/apac/2019/08/26/preparing-for-ai-the-implications-of-artificial-intelligence-for-jobs-and-skills-in-asian-economies/#primaryimage'}, 'image': {'@id': 'https://news.microsoft.com/apac/2019/08/26/preparing-for-ai-the-implications-of-artificial-intelligence-for-jobs-and-skills-in-asian-economies/#primaryimage'}, 'thumbnailUrl': 'https://news.microsoft.com/wp-content/uploads/prod/sites/43/2019/08/AdobeStock_165294159-3.jpeg', 'datePublished': '2019-08-26T11:36:15+00:00', 'dateModified': '2019-08-26T12:08:19+00:00', 'author': {'@id': 'https://news.microsoft.com/apac/#/schema/person/d4b65000ccc8681225ffe085d92c314f'}, 'breadcrumb': {'@id': 'https://news.microsoft.com/apac/2019/08/26/preparing-for-ai-the-implications-of-artificial-intelligence-for-jobs-and-skills-in-asian-economies/#breadcrumb'}, 'inLanguage': 'en-US', 'potentialAction': [{'@type': 'ReadAction', 'target': ['https://news.microsoft.com/apac/2019/08/26/preparing-for-ai-the-implications-of-artificial-intelligence-for-jobs-and-skills-in-asian-economies/']}]}, {'@type': 'ImageObject', 'inLanguage': 'en-US', '@id': 'https://news.microsoft.com/apac/2019/08/26/preparing-for-ai-the-implications-of-artificial-intelligence-for-jobs-and-skills-in-asian-economies/#primaryimage', 'url': 'https://news.microsoft.com/wp-content/uploads/prod/sites/43/2019/08/AdobeStock_165294159-3.jpeg', 'contentUrl': 'https://news.microsoft.com/wp-content/uploads/prod/sites/43/2019/08/AdobeStock_165294159-3.jpeg', 'width': 4908, 'height': 3333, 'caption': 'Engineer hand using tablet with machine real time monitoring system software. Automation robot arm machine in smart factory automotive industrial Industry 4th iot , digital manufacturing operation.'}, {'@type': 'BreadcrumbList', '@id': 'https://news.microsoft.com/apac/2019/08/26/preparing-for-ai-the-implications-of-artificial-intelligence-for-jobs-and-skills-in-asian-economies/#breadcrumb', 'itemListElement': [{'@type': 'ListItem', 'position': 1, 'name': 'Home', 'item': 'https://news.microsoft.com/apac/'}, {'@type': 'ListItem', 'position': 2, 'name': 'Recent News', 'item': 'https://news.microsoft.com/apac/recent-news/'}, {'@type': 'ListItem', 'position': 3, 'name': 'Preparing for AI: The implications of artificial intelligence for jobs and skills in Asian economies'}]}, {'@type': 'WebSite', '@id': 'https://news.microsoft.com/apac/#website', 'url': 'https://news.microsoft.com/apac/', 'name': 'Asia News Center', 'description': 'Microsoft Stories Asia', 'potentialAction': [{'@type': 'SearchAction', 'target': {'@type': 'EntryPoint', 'urlTemplate': 'https://news.microsoft.com/apac/?s={search_term_string}'}, 'query-input': 'required name=search_term_string'}], 'inLanguage': 'en-US'}, {'@type': 'Person', '@id': 'https://news.microsoft.com/apac/#/schema/person/d4b65000ccc8681225ffe085d92c314f', 'name': 'Dylan Ong', 'image': {'@type': 'ImageObject', 'inLanguage': 'en-US', '@id': 'https://news.microsoft.com/apac/#/schema/person/image/bf819dc076653e513bc102297c0ec9f9', 'url': 'https://secure.gravatar.com/avatar/49caf8260e877fa4fe36f356f297a150?s=96&d=mm&r=g', 'contentUrl': 'https://secure.gravatar.com/avatar/49caf8260e877fa4fe36f356f297a150?s=96&d=mm&r=g', 'caption': 'Dylan Ong'}, 'url': 'https://news.microsoft.com/apac/author/dylanong/'}]",,,,,,,,,,,,,,,,,,,,,,
