URL link,Title,Date,Source,Source Link,description,keywords,og:description,twitter:description,@context,@type,url,image,author,publisher,headline,datePublished,dateModified,articleSection,name,isAccessibleForFree,itemListElement,article:section,article:summary,article text,@graph,dateCreated,identifier,creator,mainEntityOfPage,articleBody,thumbnailUrl,inLanguage,timeRequired,wordCount,video,hasPart,jobTitle,telephone,sameAs,address,alternativeHeadline,isPartOf,foundingDate,logo,contactPoint,speakable,associatedMedia
https://news.google.com/rss/articles/CBMigAFodHRwczovL3Rvd2FyZHNkYXRhc2NpZW5jZS5jb20vZml2ZS1oeXBvdGhlc2VzLWFzLXRvLXdoeS1hcnRpZmljaWFsLWludGVsbGlnZW5jZS1hbmQtbWFjaGluZS1sZWFybmluZy1wcm9qZWN0cy1mYWlsLTdjNmIyYzQ1NmQ0MdIBAA?oc=5,Five Hypotheses as to why Artificial Intelligence and Machine Learning projects fail - Towards Data Science,2019-08-23,Towards Data Science,https://towardsdatascience.com,There are numerous articles and published papers around why AI/Machine Learning/Natural Language Processing projects never make it to “production” or fail to deliver on the value proposed (Gartner…,N/A,There are numerous articles and published papers around why AI/Machine Learning/Natural Language Processing projects never make it to…,There are numerous articles and published papers around why AI/Machine Learning/Natural Language Processing projects never make it to…,http://schema.org,NewsArticle,https://towardsdatascience.com/five-hypotheses-as-to-why-artificial-intelligence-and-machine-learning-projects-fail-7c6b2c456d41,['https://miro.medium.com/v2/resize:fit:1200/1*AecH0CYX0NAsmwJU8L_LLA.png'],"{'@type': 'Person', 'name': 'Alison Doucette', 'url': 'https://alison-doucette.medium.com'}","{'@type': 'Organization', 'name': 'Towards Data Science', 'url': 'towardsdatascience.com', 'logo': {'@type': 'ImageObject', 'width': 192, 'height': 60, 'url': 'https://miro.medium.com/v2/resize:fit:384/1*cFFKn8rFH4ZndmaYeAs6iQ.png'}}",Five Hypotheses as to why Artificial Intelligence and Machine Learning projects fail,2019-08-23T11:10:42.223Z,2021-12-11T09:47:58.130Z,,Five Hypotheses as to why Artificial Intelligence and Machine Learning projects fail,,,N/A,N/A,"Five Hypotheses as to why Artificial Intelligence and Machine Learning projects failAlison Doucette·FollowPublished inTowards Data Science·5 min read·Aug 23, 20192634ListenShareThere are numerous articles and published papers around why AI/Machine Learning/Natural Language Processing projects never make it to “production” or fail to deliver on the value proposed (Gartner predicts that through 2022, 85 percent of AI projects will deliver erroneous outcomes due to bias in data, algorithms or the teams responsible for managing them). The following are a few hypotheses as to why Artificial Intelligence projects fail and some observations on company reactions (technical and organizational) to AI projects lack of delivered value. Please note these opinions do not reflect on any current or prior employers, but are a synthesis of conversations with data scientists, engineers, product managers and architects across industries.Hypothesis #1: Data Science initial models don’t scale or are too experimental to be used by internal or external customers.Projects often start here as companies hire on a few data scientists who build their models in Python or R, only to discover quickly that there is a difference in mindset between data scientists and engineers. In the short run this problem is often solved by having machine learning engineers or other software engineers take the code, rewrite it and follow standard dev-ops processes in order to scale and deploy the application. Given the stochastic nature of results, Quality Engineering also needs to scale to the task. During this transition period, business users (and/or their proxy product managers) can be left out of the process and the requirements or underlying data may change.Organizationally, some companies take the next step of hiring engineers into the data science group to help the data scientists learn more about scaling for production and deployments. The goal with this approach is to alleviate the handoff process. The challenges are that this research/engineering organization can become siloed away from the rest of the production support workflow. “Data Scientists don’t wear pagers on call”.Hypothesis #2: Data science/ML models while brilliant and innovative don’t meet the business requirements or are too fragile to respond to change in the supporting data.At the recommendation of consulting groups, some companies make the decision that in order to foster innovation, “innovation teams” need to be isolated from the “non-digital” cultures which surround them. But while isolated innovation teams can lead to great opportunities for experimentation and those teams can learn and develop interesting solutions, when the resultant projects then need to be “pushed” to the market or internal customers, there is often minimal adoption. While the solution may meet the specific challenge, the experience for the user is often less than optimal. Lack of a less complex model to fall back upon if the data changes can also present a challenge. On the upside, the research can be published in academic journals read by other data scientists to further overall industry knowledge.In response to this non-adoption problem, some innovation/data science teams may add product marketers to their organization to “promote” their work internally and to try to market their concepts to customers directly.Hypothesis #3: AI initiatives are driven by the company’s internal IT organizations and inherit “waterfall” challenges.As part of a “digital transformation”, some companies see AI as part of an overall data warehouse initiative or as part of an automation effort for customer management or marketing applications. The need for “labelled” (appropriately tagged) data in AI or Machine Learning means that companies will also need to have a fairly mature analytics and data capture infrastructure in place. While it may seem rational to approach AI and Machine Learning as part of an overall IT data project, without an accompanying experimental/prototyping initiative, AI projects can be buried as a consequence. Ironically, when the data is finally ready in the data pipelines, the customer needs may have changed completely (ex: optimizing around CD distribution while the company strategy moves to streaming).Hypothesis #4: Companies don’t have the patience for the time it takes to deliver on AI/ML projects.Given the uncertainty of success and timelines for many proposed AI/ML projects, they may die before they even have a chance to begin. Add to this the newness of the technology and the head-start dominance of Google, Amazon and Microsoft and the result is that non-direct consumer-oriented enterprise companies may talk AI, but start with Business Process Automation tools as their first foray and wait for things to settle (capturing data along the way for the future).Hypothesis #5: A lack of a “Product” approach to AI/ML projects is core to project failure and increased risk.The role of Product Manager/Owner in Agile software development is clear in software development. Product Managers work as part of a team including UX, Engineering, QA and Project Management. What seems to be missing in AI projects is this same “Product” mindset. Good Product Managers understand how to ask or find the highest value business questions. Experienced Product Managers are experts at managing the uncertainty of product delivery. Seasoned Analytics Product Managers understand where the data is missing or buried. So, the question of the day may not be “Where are all the data scientists we need?”, but rather “Where are all the AI Product Managers who know how to ask the right questions?”Summary:Fundamentally AI/ML projects will not succeed unless the same “Agile” “Lean” Product approach is taken up by technically savvy product managers to meet the challenges of risk, territory battles and failure to solve or answer the business questions. Data Scientists and Machine Learning Engineers need to be integral to product development teams. Much as “Design Thinking” brought UX on board to software development teams, so “AI thinking” needs to integrate AI research into product development. AI product managers need business executive support to guide the business value evaluation process and to balance technology/data science agendas.While the shake-up continues in AI Cloud Platforms and while tooling is changing rapidly, companies who step up and train or hire AI Product Managers with the requisite technical or data skills and challenge them to find a business question to answer with a team of UX Designers, Data Scientists, Machine Learning Engineers, Software Engineers, coordinated by a project manager who understands and can communicate uncertainty rationally will be a long ways down the road to leverage AI to success.Companies who already have tagged data streams like those in e-commerce and finance/payments have a head start and provide good models for others on how to scale, but it will be by asking the right questions and leveraging and scaling ML/NLP/AI to get the right answers that some of them will lead the pack over the next decades.",,2019-08-23T11:10:42.223Z,7c6b2c456d41,['Alison Doucette'],https://towardsdatascience.com/five-hypotheses-as-to-why-artificial-intelligence-and-machine-learning-projects-fail-7c6b2c456d41,,,,,,,,,,,,,,,,,,
https://news.google.com/rss/articles/CBMilgFodHRwczovL3d3dy5mb3JiZXMuY29tL3NpdGVzL2JyeWFucm9iaW5zb24vMjAxOS8wOC8yMy9ob3ctYXJ0aWZpY2lhbC1pbnRlbGxpZ2VuY2UtaXMtcHJldmVudGluZy1jb2duaXRpdmUtb3ZlcmxvYWQtY29tcGFzc2lvbi1mYXRpZ3VlLWFuZC1qb2ItYnVybm91dC_SAQA?oc=5,"How Artificial Intelligence Is Preventing Cognitive Overload, Compassion Fatigue And Job Burnout - Forbes",2019-08-23,Forbes,https://www.forbes.com,"Big corporations are using cutting edge Artificial Intelligence technology to prevent cognitive overload, compassion fatigue and job burnout and to augment employee quality of life and drive operational value for the organization.",,"Big corporations are using cutting edge Artificial Intelligence technology to prevent cognitive overload, compassion fatigue and job burnout and to augment employee quality of life and drive operational value for the organization.","Big corporations are using cutting edge Artificial Intelligence technology to prevent cognitive overload, compassion fatigue and job burnout and to augment employee quality of life and drive operational value for the organization.",http://schema.org,BreadcrumbList,https://www.forbes.com/sites/bryanrobinson/2019/08/23/how-artificial-intelligence-is-preventing-cognitive-overload-compassion-fatigue-and-job-burnout/,"{'@type': 'ImageObject', 'url': 'https://imageio.forbes.com/blogs-images/bryanrobinson/files/2019/08/alex-kotliarskyi-QBpZGqEMsKg-unsplash-1200x800.jpg?format=jpg&height=900&width=1600&fit=bounds', 'width': 542.79, 'height': 304.6}","{'@type': 'Person', 'name': 'Bryan Robinson, Ph.D.', 'url': 'https://www.forbes.com/sites/bryanrobinson/', 'description': ""I am the author of 40 nonfiction books, including Chained to the Desk in a Hybrid World (New York University Press, 2023) and #Chill: Turn Off Your Job And Turn On Your Life (William Morrow, 2019). My books have been translated into 15 languages, and I co-host the podcast, How's That Working for Ya? The Shrink and Ms. Smarty Pants on YouTube, ITunes and Spotify. I am Professor Emeritus at the University of North Carolina at Charlotte, where I conducted the first studies on children of workaholics and the effects of work addiction on marriage. I built my career on the themes of resilience and work-life balance and have lectured throughout the world on work addiction and workplace issues. My research was featured on 20/20, Good Morning America, ABC’s World News Tonight, NBC Nightly News, NBC Universal, The CBS Early Show, CNBC’s The Big Idea and NPR's Marketplace. I hosted the PBS documentary, Overdoing It: How to Slow Down and Take Care of Yourself. I maintain a private psychotherapy practice in Asheville, NC and reside in the Blue Ridge Mountains with my spouse, three dogs and occasional bears at night. Check out my website: bryanrobinsonphd.com."", 'sameAs': ['https://www.twitter.com/BRTherapist', 'https://bryanrobinsonphd.com', 'RobinsonBryanE']}","{'@type': 'NewsMediaOrganization', 'name': 'Forbes', 'url': 'https://www.forbes.com/', 'ethicsPolicy': 'https://www.forbes.com/sites/forbesstaff/article/forbes-editorial-values-and-standards/', 'logo': 'https://imageio.forbes.com/i-forbesimg/media/amp/images/forbes-logo-dark.png?format=png&height=455&width=650&fit=bounds'}","How Artificial Intelligence Is Preventing Cognitive Overload, Compassion Fatigue And Job Burnout",2019-08-23T07:30:00-04:00,2019-10-19T14:47:58-04:00,Careers,"How Artificial Intelligence Is Preventing Cognitive Overload, Compassion Fatigue And Job Burnout",True,"[{'@type': 'ListItem', 'position': 1, 'name': 'Forbes Homepage', 'item': 'https://www.forbes.com/'}, {'@type': 'ListItem', 'position': 2, 'name': 'Leadership', 'item': 'https://www.forbes.com/leadership/'}, {'@type': 'ListItem', 'position': 3, 'name': 'Careers', 'item': 'https://www.forbes.com/careers/'}]",Careers,N/A,"More From ForbesAug 27, 2019,04:42pm EDTRobots Are Actually Teaching Humans To Be More CompassionateAug 26, 2019,09:52am EDTAI Tests A 200-Year-Old Evolutionary TheoryAug 23, 2019,10:48am EDTAI Making Waves In News And JournalismAug 21, 2019,10:34am EDTExplainable AI Could Help Us Audit AI Startup ClaimsAug 21, 2019,02:20am EDTArtificial Intelligence Beyond The Buzzword From Two Fintech CEOsAug 20, 2019,05:46pm EDTWhat Is Artificial Intelligence?Aug 20, 2019,03:41pm EDTAI Startup Cerebras Develops The Most Powerful Processor In The WorldEdit StoryLeadershipCareersHow Artificial Intelligence Is Preventing Cognitive Overload, Compassion Fatigue And Job BurnoutBryan Robinson, Ph.D.ContributorOpinions expressed by Forbes Contributors are their own.author of Chained to the Desk in a Hybrid World: A Guide to Balance.FollowingFollowAug 23, 2019,07:30am EDTUpdated Oct 19, 2019, 02:47pm EDTThis article is more than 4 years old.Share to FacebookShare to TwitterShare to Linkedin







New technology in the form of artificial intelligence guides employees during stressful customer... [+] interactions empowering them and helping with their performance.
Photo by Alex Kotliarskyi on Unsplash




Organizations are beginning to grasp the severity of burnout and the impact it has on your life and health in the long term. Work can be stressful, and due to many factors including a combination of hours, tasks, measurement and intensity, some jobs result in mental, physical and emotional exhaustion. If stress accumulates to a breaking point, you reach overload, fatigue and ultimately burnout.

Job Burnout On The Rise
A survey reported this month by Skye Learning found that a majority of American workers report job burnout. Gallup studied nearly 7,500 full-time employees and found that 23% reported feeling burned out at work very often or always, while an additional 44% reported feeling burned out sometimes. Recently the World Health Organization officially recognized “employee burnout” as a medical condition. Burnout costs organizations in the form of high employee turnover, increased medical and insurance costs and drops in productivity. It can be even more dangerous for you, the employee, because it puts your well-being and mental health at risk.
Your Decision-Fatigued Brain 
When you make decisions after working days on end, chances are they’ll be different from the ones you’d make after your brain has a rest period. Why? Scientists have discovered a phenomenon known as decision fatigue—which is what happens when your brain is worn out, depleted of mental energy. Decision fatigue is why many wage earners have little mental energy left over for activities outside of work. After hours of nonstop working, your brain can suffer from cognitive overload, compassion fatigue and burnout. The longer you work and the more choices you make in those extended work hours, the more difficult it is for your strained mind to make sound decisions. It becomes hard to make even ordinary choices, such as what to wear, where to eat, how much to spend or how to prioritize work projects. So you start to take short cuts, permitting your newly licensed teenager to drive the car on an icy night or opting out of responsibilities and decision making at work. You’re short with coworkers and loved ones; you eat junk food instead of healthy meals; you tell your spouse to pick the restaurant for dinner.
PROMOTED
Artificial Intelligence And Burnout Prevention
To prevent decision fatigue and burnout, your brain needs restorative rest just like your body does when you’re tired. You can change bad habits and prevent stress accumulation and burnout by engaging in certain activities such as brisk exercise, relaxing in nature, power napping and in practices such as deep breathing, progressive muscle relaxation, prayer, meditation, laughing, yoga, massage and tai chi. While these tools never go out of style, some of the world’s top companies such as MetLife and Humana are employing innovative new technology to offset burnout by enhancing employee engagement, improving customer experience and providing a more emotionally intelligent and empathetic workplace.
Dr. Skyler Place, Chief Behavioral Science Officer and Head of People at Cogito, told me, “One significant working population that is highly susceptible to burn out is call center workers, of which there are an estimated five million in the U.S. alone. Their working environment leads them to feel a lack of support and control. They are caught between customers who are often frustrated and management who is under pressure to achieve corporate goals. Performing repetitive tasks and carrying the burden of emotionally tense situations is extremely draining, even for the most seasoned professional. In the call center specifically burnout and churn are on the rise, and many organizations can experience churn of greater than 50%, according to the 2018 Contact Babel Decision Maker’s Guide.”
According to Dr. Place, some organizations are looking at new technological advancements that can help alleviate cognitive overload, compassion fatigue and employee burnout: “One such technology comes from Cogito, which leverages a foundation of behavioral science in combination with Artificial Intelligence (AI) to guide employees, especially during stressful customer interactions, empowering them and helping them perform better. One large insurance company has stated how employee churn has decreased by 10% amongst agents as a result of Cogito’s in-call communication guidance, more objective feedback from supervisors and better customer rapport. Cogito is unique in its application, where traditionally technology was deployed exclusively to provide insights to management and ignored the emotional state of the employee. Cogito is designed to recognize the behavioral dynamics of each individual and deliver in-the-moment coaching that helps them professionally manage a given situation. Cogito applies AI to augment an employee’s—and specifically call center agent’s—natural abilities, giving them the assistance they need to better help emotional customers and meet their performance goals.”
Cogito’s AI coach analyzes human behavior through voice and provides in-the-moment feedback during conversations. The software provides nudges to call-center agents via the display of in-the-moment cues—for example a coffee cup when energy is low or a heart when a customer’s emotional state changes, indicating a need for empathy. It guides agents during conversations to be more emotionally intelligent, which takes some of the cognitive burden off of them and helps better control conversations. It also helps them lead customers through challenging situations without taking on the emotional burden. The nudges Cogito applies lead to positive behavior change that helps the agent and the customer while driving operational value for the organization.
Dr. Place concludes that this win-win dynamic comes from applying behavioral science in a way that can reduce burnout while increasing value to the corporation, “This is the true calling for AI—augmenting humans in ways that increase their quality of life, providing in-the-moment and on-the-job training and allowing their organizations to be competitive in the market.”
 Follow me on Twitter. Check out my website or some of my other work here. Bryan Robinson, Ph.D.FollowingFollowI am the author of 40 nonfiction books, including Chained to the Desk in a Hybrid World (New York University Press, 2023) and #Chill: Turn Off Your Job... Read MoreEditorial StandardsPrintReprints & Permissions",,,,,,,,,,,,,,,,,,,,,,,
