URL link,Title,Date,Source,Source Link,description,keywords,og:description,twitter:description,@context,@type,url,image,author,publisher,headline,datePublished,dateModified,articleSection,name,isAccessibleForFree,itemListElement,article:section,article:summary,article text,@graph,dateCreated,identifier,creator,mainEntityOfPage,articleBody,thumbnailUrl,inLanguage,timeRequired,wordCount,video,hasPart,jobTitle,telephone,sameAs,address,alternativeHeadline,isPartOf,foundingDate,logo,contactPoint,speakable,associatedMedia
https://news.google.com/rss/articles/CBMicGh0dHBzOi8vd3d3LnVzYXRvZGF5LmNvbS9zdG9yeS90ZWNoLzIwMTkvMDgvMjMvYWktdHJhaW5pbmctaHVtYW4tZW1wbG95ZWVzLXRvLWhhdmUtbW9yZS1lbXBhdGh5LXdvcmsvMjA3MDAwMjAwMS_SAQA?oc=5,AI training human employees to have more empathy at work - USA TODAY,2019-08-23,USA TODAY,https://www.usatoday.com,"AI-powered software Cogito aims to improve customer service agents' emotional intelligence. Basically, the computer helps them to be more human.",N/A,"AI-powered software Cogito aims to improve customer service agents' emotional intelligence. Basically, the computer helps them to be more human.","AI-powered software Cogito aims to improve customer service agents' emotional intelligence. Basically, the computer helps them to be more human.",,,,,,,,,,,,,,N/A,N/A,"TECHArtificial IntelligenceAdd TopicAI at work: Machines are training human workers to be more compassionateFrances YueUSA TODAYPlayPauseSound OnSound Off0:001:45AD0:10SKIPClosedCaptionOpen ShareEnter Full ScreenExit Full Screen“You are speaking faster than usual,” reads an alert on a computer screen. The call center agent on the phone with a customer can see a speedometer icon.The conversation with the customer continues, as does the computer feedback. “Think about how the customer is feeling. Try to relate,” the artificial intelligence-powered tool interjects. The agent receives other notifications, from “extended silence” to “empathy cue,” which suggests the worker is not showing enough empathy. For about 1,700 agents at the call center of Humana Pharmacy, the software called Cogito is becoming part of their work lives. It listens to most of their phone calls with customers nationwide and guides the agents on how to better communicate by analyzing vocal cues in conversations such as pitch, tone and rhythm of voices.In recent years, global industries have seen considerable transformation brought by automation in the workplace. One-third of activities in about 60% of occupations worldwide could be automatable, according to a 2017 report by management consulting firm McKinsey & Co. As the technology advances, AI has gained increasing presence. It could perform a widening range of tasks that were previously done by humans and has been used in recruiting and management processes. The increasing prevalence of AI has boosted efficiency and reduced costs for companies but has also drawn concerns about job losses and hidden discrimination. Reuters last year unveiled that Amazon abandoned an AI recruiting tool in development, as the tech giant cannot fix its bias against women. Uber’s facial recognition technology reportedly didn’t process and recognize transgender drivers. A study published by New York University's AI Now Institute in April shows how many AI systems favor white people and males. Talking about such concerns around AI, Joshua Feast, Cogito Inc.’s co-founder and CEO said its software doesn’t mean to replace anybody. “We’re a coach,” he said. “We're sort of proud as a company that we're helping workers do well on the job, helping customers have better experiences on the phone and helping our clients keep those customers.” The company, which works with call centers of large insurance companies, including MetLife and Humana, retail banks and credit card issuers, says it has more than 25,000 users. It helps to minimize bias that Cogito's algorithm analyzes biological signaling mechanism, which is largely independent on language and culture, Feast said. The company has also deployed a secondary algorithm and a human annotation team to check for bias, he added. AI comes into play when humans get tired sometimes and suffer from “compassion fatigue,'' according to Feast. “What the AI is really doing is helping somebody be more consistent in the course of the day."" The software also provides tools for supervisors to track the performance of team members and guide workers accordingly, though Feast said Cogito doesn’t function as ""a performance management system."" A customer agent at Humana handles 30 to 40 calls a day on average, according to Mark Morse, vice president of Humana Pharmacy’s service operations. “When you're tired or on any given day, what happens at home and frustrations in life can come into the contact center,” he said. But showing empathy is always important as the customers of life insurance companies are usually “in the midst of some of the most challenging moments of their lives, from going on disability to the loss of a loved one,"" said Kristine Poznanski, head of global customer solutions at MetLife. Using Cogito is not compulsory at Humana, but the company is considering integrating Cogito's assessment into its bonus mechanism to promote the software's usage, said Morse. When asked if human customer agents would one day disappear, Feast said he doesn't think so, though the trend of automation has been growing – the share of customer service interactions completely handled by AI will reach 15% by 2021, according to research company Gartner. That's a 400% increase from 2017.“I don't think they (human customer agents) will be completely replaced,"" Feast said. ""Humans will always want to talk to other humans,” Feast said. “The reason is that only other humans really understand us.”Follow Frances Yue on Twitter: @FrancesYue_.Why CVS, Walgreens allow pharmacists to deny birth control Georgia residents can claim embryo as a dependent on their state taxes As online shopping slows, Amazon closes or pauses 40 warehouses is Gen Z underestimating how much money it will need to retire? The Daily Money delivers our top personal finance stories to your inboxCompareCredit.com2 Cards Charging 0% Interest Until Nearly 2026With no annual fee & no interest for 18 months, these cards are helping Americans pay off debt in record time.CompareCredit.com|AdAdRead MoreUndoOnline Shopping ToolsFlight Attendant Shows How To Fly Business Class For The Price of EconomyAmericans, you'll want to check this out ASAPOnline Shopping Tools|AdAdUndoHistory Strategy GameGame shows what the world without US military interventions would look likeThis strategy games makes you become a player in the crucial situations of history.History Strategy Game|AdAdUndoAudien HearingThis #1 Selling Cheap Hearing Aid In America Is Not What You Think (See For Yourself)Hear every word in conversations, without spending thousands of dollars.Audien Hearing|AdAdUndoUnforgettable Gadgets61 Shockingly Bizarre Gifts Nobody Would Think OfWeird & wonderful gifts you'd never think to buy. In stock. Free shipping on many.Unforgettable Gadgets|AdAdShop NowUndoSherumThis New AC Cooler Cools the Room In SecondsSherum|AdAdLearn MoreUndoHaloClean UV SanitizerThis Dad Decimated 10,000 Bed Bugs From His Kid's Bed After Pushing 1 ButtonNaturally Kill Bed BugsHaloClean UV Sanitizer|AdAdUndoFree Covid TestUS Government is Providing Free Covid Test Kits Again, Get Yours Now Before They Are All Gone AgainSearch your address to see free test kit availability instantlyFree Covid Test|AdAdSearch NowUndoFisher Investments7 Wealth Tips Once Your Portfolio Reaches $1 MillionHow do retirees take steps to preserve their wealth in retirement? Download The Seven Secrets of High Net Worth Investors now.Fisher Investments|AdAdLearn MoreUndoCoupon Code FinderDon't Pay $179/Year for Amazon Prime - Use This Trick InsteadThis simple trick can save tons of money on Amazon, but most Prime members are ignoring it.Coupon Code Finder|AdAdUndoDeal of the DayREVIEWEDJLab Headphones Are Under $20 For Amazon Prime DayREVIEWEDView Deal Recommendations are independently chosen by our editors. Purchases you make through our links may earn us a commission.Undo






























Featured Weekly Ad",,,,,,,,,,,,,,,,,,,,,,,
https://news.google.com/rss/articles/CBMidWh0dHBzOi8vd3d3Lndhc2hpbmd0b25wb3N0LmNvbS90ZWNobm9sb2d5LzIwMTkvMDgvMjMvZ29vZ2xlLXNheXMtb25seS10YWxrLWFib3V0LXdvcmstd29ya2FuZC1kZWZpbml0ZWx5LW5vLXBvbGl0aWNzL9IBAA?oc=5,Google’s new workplace guidelines seek to rein in uninhibited culture - The Washington Post,2019-08-23,The Washington Post,https://www.washingtonpost.com,The company issued new guidelines in response to “a year of increased incivility on our internal platforms.”,"google, free speech, alphabet, Tech culture, workplace culture, employees, contractor, silicon valley",The company issued new guidelines in response to “a year of increased incivility on our internal platforms.”,The company issued new guidelines in response to “a year of increased incivility on our internal platforms.”,https://schema.org,BreadcrumbList,,"[{'@context': 'https://schema.org', '@type': 'ImageObject', 'url': 'https://www.washingtonpost.com/wp-apps/imrs.php?src=https://arc-anglerfish-washpost-prod-washpost.s3.amazonaws.com/public/4UZBSSGDSEI6TC7XZXRNTYEQKU.jpg&w=1600&h=900', 'height': 900, 'width': 1600}, {'@context': 'https://schema.org', '@type': 'ImageObject', 'url': 'https://www.washingtonpost.com/wp-apps/imrs.php?src=https://arc-anglerfish-washpost-prod-washpost.s3.amazonaws.com/public/4UZBSSGDSEI6TC7XZXRNTYEQKU.jpg&w=1800&h=1800', 'height': 1800, 'width': 1800}, {'@context': 'https://schema.org', '@type': 'ImageObject', 'url': 'https://www.washingtonpost.com/wp-apps/imrs.php?src=https://arc-anglerfish-washpost-prod-washpost.s3.amazonaws.com/public/4UZBSSGDSEI6TC7XZXRNTYEQKU.jpg&w=800&h=600', 'height': 800, 'width': 600}]","{'@type': 'Person', 'name': 'Greg Bensinger', 'url': 'https://www.washingtonpost.com/people/greg-bensinger/'}","{'@id': 'washingtonpost.com', '@type': 'NewsMediaOrganization', 'logo': {'@type': 'ImageObject', 'url': 'https://www.washingtonpost.com/wp-stat/img/wplogo_344x60_blk.png', 'width': {'@type': 'Distance', 'name': '344 px'}, 'height': {'@type': 'Distance', 'name': '60 px'}}, 'name': 'The Washington Post'}",Google says only talk about work at work — and definitely no politics,2019-08-23T19:38:06.466Z,2019-08-23T20:29:40.332Z,,,False,"[{'@context': 'https://schema.org', '@type': 'ListItem', 'name': 'Technology', 'position': 1, 'item': 'https://www.washingtonpost.com/technology/'}]",Technology,N/A,"(Jeff Chiu/AP) ShareComment on this storyComment90Add to your saved storiesSaveGoogle has a message to its workers: Heads down and do your job.Google issued new guidelines in a memo Friday for how its roughly 100,000 employees ought to conduct themselves. Out are open, free-ranging discussions about politics, news stories and other non-work-related topics, not to mention name-calling and bullying. In are work-related and fact-based conversations, as well as manager-led crackdowns on violative speech or behavior.Subscribe for unlimited access to The PostYou can cancel anytime.SubscribeThe spirit of the recommendations appears to fly in the face of Google’s famously uninhibited culture, in which workers are encouraged to spend 20 percent of their time working on personal side projects and new ideas are bandied about in a virtual sandbox. Google has been buffeted by criticism from the White House over alleged anti-conservative biases and from employees who have openly protested against proposed defense projects and its handling of sexual harassment claims against high-profile executives.AdvertisementStory continues below advertisement“Our primary responsibility is to do the work we’ve each been hired to do, not to spend working time on debates about non-work topics,” said the Google memo, posted to its website. “Avoid conversations that are disruptive to the workplace or otherwise violate Google’s workplace policies. Managers are expected to address discussions that violate those rules.”💻Follow TechnologyFollowA company spokeswoman, Jenn Kaiser, said the guidelines were in response to “a year of increased incivility on our internal platforms.”GET CAUGHT UPStories to keep you informedPreviousNextThe Republicans are here. For Milwaukee, that’s complicated.There’s a mix of apprehension and excitement for the heavily Democratic city hosting the RNC.Local leaders touted an economic boost, but some businesses see disruptions and fewer bookings.The event brings security concerns and the potential for unrest with protests and counter protests.SparkleSummary is AI-generated, newsroom-reviewed.See moreExpand contentAmazon Prime Day causes workplace injuries, Senate probe findsThe review found workplace injuries hit a high during Prime Day sales week in 2019.It cites understaffing, “unsustainable productivity requirements” and “ignored” safety protocols.Amazon disputes the report, saying its recordable injury rate has improved significantly since 2019.SparkleSummary is AI-generated, newsroom-reviewed.See moreExpand contentHousing, once the ticket to wealth in China, is now draining fortunesA three-year slump in the property sector has sparked widespread financial insecurity.The real estate crisis challenges China’s economic growth as people rethink spending.
The government has been cautious, avoiding major support for the housing market.
SparkleSummary is AI-generated, newsroom-reviewed.See moreExpand content“We’ve heard that employees want clearer rules of the road on what’s okay to say and what’s not,” she said in an email.The rules potentially drive a wedge between workers who have cherished the devil-may-care attitude of Google’s workplace and the company’s management, which appears to be striving for a more buttoned-up culture.AdvertisementStory continues below advertisementGoogle has also been under pressure to clean up YouTube, which some allege is rife with misinformation, particularly heading into the 2020 U.S. presidential election.In recent weeks, former employees have alleged Google retaliated against them, for expressing conservative views or for helping to organize a global walkout.Google workers are active on internal forums for subgroups representing a wide range of passions, ethnicities and lifestyles. The Silicon Valley search giant also sought to put the kibosh on the overuse or misuse of the online forums, warning that “we will remove particular discussion forums, revoke commenting, viewing, or posting privileges, or take disciplinary action.”As well, Google reminded, leaking classified information is a no-no and could result in disciplinary action or firing.“Working at Google comes with tremendous responsibility,” Kaiser said. “Billions of people rely on us every day for high-quality, reliable information. It’s critical that we honor that trust and uphold the integrity of our products and services.”Share90 CommentsNewsletterAs news breaksTech News AlertsBreaking news email alerts on technology and the tech industry.Sign upSubscribe to comment and get the full experience. Choose your plan →",,,,,https://www.washingtonpost.com/technology/2019/08/23/google-says-only-talk-about-work-workand-definitely-no-politics/,,,,,,,"{'@type': 'WebPageElement', 'cssSelector': '.meteredContent', 'isAccessibleForFree': False}",,,,,Google’s new workplace guidelines seek to rein in uninhibited culture,"{'@type': ['CreativeWork', 'Product'], 'name': 'The Washington Post', 'productID': 'washingtonpost.com:basic', 'description': 'Breaking news and analysis on politics, business, world, national news, entertainment and more. In-depth DC, Virginia, Maryland news coverage including traffic, weather, crime, education, restaurant reviews and more.', 'sku': 'https://subscribe.washingtonpost.com', 'image': 'https://www.washingtonpost.com/resizer/2CjPNwqvXHPS_2RpuRTKY-p3eVo=/1484x0/www.washingtonpost.com/pb/resources/img/twp-social-share.png', 'brand': {'@type': 'brand', 'name': 'The Washington Post'}, 'offers': {'@type': 'offer', 'url': 'https://subscribe.washingtonpost.com/acquisition?promo=o26'}}",,,,,
