URL link,Title,Date,Source,Source Link,description,keywords,og:description,twitter:description,@context,@graph,article:section,article:summary,article text
https://news.google.com/rss/articles/CBMiWWh0dHBzOi8vd3d3LmFic2F0endpcnRzY2hhZnQuZGUva3VlbnN0bGljaGUtaW50ZWxsaWdlbnotbWFzY2hpbmUtbWVuc2NoLW1hcmtldGluZy0yMTg5MDQv0gEA?oc=5,Wie künstliche Intelligenz fürs Marketing funktioniert - Absatzwirtschaft,2018-02-04,Absatzwirtschaft,https://www.absatzwirtschaft.de,Alle reden darüber und inzwischen werden sie auch praktisch eingesetzt: superintelligente Maschinen. In Gestalt von Chatbots und smarten Plattformen,N/A,Alle reden darüber und inzwischen werden sie auch praktisch eingesetzt: superintelligente Maschinen. In Gestalt von Chatbots und smarten Plattformen können sie auch Marketern die Arbeit erleichtern – bis hin zur automatisierten Mediaplanung.,Alle reden darüber und inzwischen werden sie auch praktisch eingesetzt: superintelligente Maschinen. In Gestalt von Chatbots und smarten Plattformen,https://schema.org,"[{'@type': 'Article', '@id': 'https://www.absatzwirtschaft.de/kuenstliche-intelligenz-maschine-mensch-marketing-218904/#article', 'isPartOf': {'@id': 'https://www.absatzwirtschaft.de/kuenstliche-intelligenz-maschine-mensch-marketing-218904/'}, 'author': {'name': 'Christine Mattauch', '@type': 'Person'}, 'headline': '„Um schlau zu sein, fehlt Maschinen die Biologie&#8220;: Doch künstliche Intelligenz funktioniert fürs Marketing', 'datePublished': '2018-02-03T23:00:00+00:00', 'dateModified': '2018-02-03T23:00:00+00:00', 'mainEntityOfPage': {'@id': 'https://www.absatzwirtschaft.de/kuenstliche-intelligenz-maschine-mensch-marketing-218904/'}, 'wordCount': 769, 'commentCount': 0, 'publisher': {'@id': 'https://www.absatzwirtschaft.de/#organization'}, 'image': {'@id': 'https://www.absatzwirtschaft.de/kuenstliche-intelligenz-maschine-mensch-marketing-218904/#primaryimage'}, 'thumbnailUrl': 'https://www.absatzwirtschaft.de/wp-content/uploads/2022/03/Mensch-vs-KI-e1556114725835.jpg', 'keywords': ['Algorithmus', 'Chatbots', 'Echtzeit', 'Künstliche Intelligenz', 'Künstliche Intelligenz (KI) im Marketing'], 'articleSection': {'1': 'Digital', '2': 'Kommunikation', '3': 'Marketing IT'}, 'inLanguage': 'de-DE', 'potentialAction': [{'@type': 'CommentAction', 'name': 'Comment', 'target': ['https://www.absatzwirtschaft.de/kuenstliche-intelligenz-maschine-mensch-marketing-218904/#respond']}]}, {'@type': 'WebPage', '@id': 'https://www.absatzwirtschaft.de/kuenstliche-intelligenz-maschine-mensch-marketing-218904/', 'url': 'https://www.absatzwirtschaft.de/kuenstliche-intelligenz-maschine-mensch-marketing-218904/', 'name': 'Wie künstliche Intelligenz fürs Marketing funktioniert', 'isPartOf': {'@id': 'https://www.absatzwirtschaft.de/#website'}, 'primaryImageOfPage': {'@id': 'https://www.absatzwirtschaft.de/kuenstliche-intelligenz-maschine-mensch-marketing-218904/#primaryimage'}, 'image': {'@id': 'https://www.absatzwirtschaft.de/kuenstliche-intelligenz-maschine-mensch-marketing-218904/#primaryimage'}, 'thumbnailUrl': 'https://www.absatzwirtschaft.de/wp-content/uploads/2022/03/Mensch-vs-KI-e1556114725835.jpg', 'datePublished': '2018-02-03T23:00:00+00:00', 'dateModified': '2018-02-03T23:00:00+00:00', 'description': 'Alle reden darüber und inzwischen werden sie auch praktisch eingesetzt: superintelligente Maschinen. In Gestalt von Chatbots und smarten Plattformen', 'breadcrumb': {'@id': 'https://www.absatzwirtschaft.de/kuenstliche-intelligenz-maschine-mensch-marketing-218904/#breadcrumb'}, 'inLanguage': 'de-DE', 'potentialAction': [{'@type': 'ReadAction', 'target': ['https://www.absatzwirtschaft.de/kuenstliche-intelligenz-maschine-mensch-marketing-218904/']}]}, {'@type': 'ImageObject', 'inLanguage': 'de-DE', '@id': 'https://www.absatzwirtschaft.de/kuenstliche-intelligenz-maschine-mensch-marketing-218904/#primaryimage', 'url': 'https://www.absatzwirtschaft.de/wp-content/uploads/2022/03/Mensch-vs-KI-e1556114725835.jpg', 'contentUrl': 'https://www.absatzwirtschaft.de/wp-content/uploads/2022/03/Mensch-vs-KI-e1556114725835.jpg', 'width': 630, 'height': 353}, {'@type': 'BreadcrumbList', '@id': 'https://www.absatzwirtschaft.de/kuenstliche-intelligenz-maschine-mensch-marketing-218904/#breadcrumb', 'itemListElement': [{'@type': 'ListItem', 'position': 1, 'name': 'Startseite', 'item': 'https://www.absatzwirtschaft.de/'}, {'@type': 'ListItem', 'position': 2, 'name': 'Neu', 'item': 'https://www.absatzwirtschaft.de/neu/'}, {'@type': 'ListItem', 'position': 3, 'name': '„Um schlau zu sein, fehlt Maschinen die Biologie&#8220;: Doch künstliche Intelligenz funktioniert fürs Marketing'}]}, {'@type': 'WebSite', '@id': 'https://www.absatzwirtschaft.de/#website', 'url': 'https://www.absatzwirtschaft.de/', 'name': 'absatzwirtschaft.de', 'description': 'absatzwirtschaft ist das Medium für Marketing, Vertrieb, Werbung und E-Commerce', 'publisher': {'@id': 'https://www.absatzwirtschaft.de/#organization'}, 'potentialAction': [{'@type': 'SearchAction', 'target': {'@type': 'EntryPoint', 'urlTemplate': 'https://www.absatzwirtschaft.de/?s={search_term_string}'}, 'query-input': 'required name=search_term_string'}], 'inLanguage': 'de-DE'}, {'@type': 'Organization', '@id': 'https://www.absatzwirtschaft.de/#organization', 'name': 'Absatzwirtschaft', 'alternateName': 'absatzwirtschaft', 'url': 'https://www.absatzwirtschaft.de/', 'logo': {'@type': 'ImageObject', 'inLanguage': 'de-DE', '@id': 'https://www.absatzwirtschaft.de/#/schema/logo/image/', 'url': 'https://www.absatzwirtschaft.de/wp-content/uploads/2022/03/absatzwirtschaft_logo_1-zeilig_positiv_4C-svg.svg', 'contentUrl': 'https://www.absatzwirtschaft.de/wp-content/uploads/2022/03/absatzwirtschaft_logo_1-zeilig_positiv_4C-svg.svg', 'width': 497, 'height': 74, 'caption': 'Absatzwirtschaft'}, 'image': {'@id': 'https://www.absatzwirtschaft.de/#/schema/logo/image/'}, 'sameAs': ['https://www.facebook.com/absatzwirtschaft/', 'https://twitter.com/aswonline', 'https://www.instagram.com/absatzwirtschaft/', 'https://www.xing.com/news/pages/absatzwirtschaft-413', 'https://de.linkedin.com/company/absatzwirtschaft']}, {'@type': 'Person', '@id': 'https://www.absatzwirtschaft.de/#/schema/person/0f2cf864b03cdf8f9b5f5d837280b566', 'name': 'flow4_admin', 'image': {'@type': 'ImageObject', 'inLanguage': 'de-DE', '@id': 'https://www.absatzwirtschaft.de/#/schema/person/image/', 'url': 'https://secure.gravatar.com/avatar/f27f139c6e8a38a78cad82db0cf0a31b?s=96&d=mm&r=g', 'contentUrl': 'https://secure.gravatar.com/avatar/f27f139c6e8a38a78cad82db0cf0a31b?s=96&d=mm&r=g', 'caption': 'flow4_admin'}, 'url': '#'}]",N/A,N/A,"

Algorithmus / Chatbots / Echtzeit / Künstliche Intelligenz / Künstliche Intelligenz (KI) im Marketing„Um schlau zu sein, fehlt Maschinen die Biologie“: Doch künstliche Intelligenz funktioniert fürs MarketingAlle reden darüber und inzwischen werden sie auch praktisch eingesetzt: superintelligente Maschinen. In Gestalt von Chatbots und smarten Plattformen können sie auch Marketern die Arbeit erleichtern – bis hin zur automatisierten Mediaplanung.
Christine Mattauch 04.02.2018  
Auf künstliche Intelligenz spezialisierte Start-ups sind vor allem in Berlin und München zu Hause. 

„Können Sie das bitte anders ausdrücken?“ fragt die Maschine. Dabei hatte der Kunde bloß eingegeben, dass er seine neue Jacke in den Alpen tragen will. Alpen? Offenbar kennt sich der „Personal Intelligent Shopper“ des amerikanischen Outdoorherstellers The North Face in Europa nicht aus. Dabei wird dieser Chatbot angeblich von Supercomputer IBM Watson gefüttert. Der müsste doch wissen, dass es mehr auf der Welt gibt als Nordamerika?
Auch wenn es mit der Kommunikation hapert, der Trend ist unverkennbar
Chatbots, Sprachassistenten und smarte Plattformen ziehen ins Marketing ein – und mit ihnen Künstliche Intelligenz (KI). Ihr Einsatz verspricht Effizienzgewinne. Das gilt für automatisierte Interaktion mit den Endkunden ebenso wie für KI-gestützte Mediaplanung. Die Innovation könnte die Branche grundlegend verändern: Laut einer Studie der University of Oxford liegt die Wahrscheinlichkeit, dass die Aufgaben von Marketinganalysten und Anzeigenverkäufern eines Tages von Robotern erledigt werden, bei 61 beziehungsweise 54 Prozent.
Was aber ist eigentlich Künstliche Intelligenz?
Simon Hegelich, Professor für Politik- und Computerwissenschaft an der Technischen Universität München, unterscheidet zwischen Computern, die lernen, und Computern, die denken können. Letztere bleiben als humanoide Spezies vorerst die Vision von Science-Fiction-Filmen. Ob sie jemals so umfassend klug werden können wie Menschen? Hegelich hält das für möglich. „Computer beginnen bereits, Sprachen zu verstehen“, sagt er, „wir stehen bei KI vor einer Revolution.“ Markus Gabriel hingegen, Philosophieprofessor an der Universität Bonn, ist überzeugt, dass Intelligenz, der körperliche Erfahrung fehlt und das Wechselspiel zwischen Verstand und Gefühl, diesen Stand niemals erreichen werden: „Um schlau zu sein wie Menschen, fehlt Maschinen die Biologie.“ Lernende Maschinen aber, die aus Big Data Wissen ableiten und ihre Leistung mit Hilfe neuronaler Netze selbsttätig optimieren, rücken schon heute in viele Lebensbereiche vor: In der Medizin können diese Roboter per Fotoauswertung Hautkrebs besser erkennen als Ärzte. An der Börse kaufen sie Aktien. Und für das Auto von morgen hat Bosch einen Bordcomputer entwickelt, der Unfälle vermeidet.
In allen Bereichen einsetzbar
Auch in Handel und Marketing gibt es diese Anfänge. Beim Online-Supermarkt Allyouneedfresh prüft seit gut einem Jahr eine Maschine die Einkaufsliste, die Kunden über Whatsapp einreichen, und spezifiziert im Dialog: Darf’s „Hohes C“ sein, wenn „Orangensaft“ bestellt wurde?
Auf der Website der Münchner Bildungsakademie Macromedia lenkt ein Chatbot Interessenten aus dem Ausland durch ein Auswahlverfahren und entscheidet anhand der Antworten autonom, ob ein Bewerber Erfolgsaussichten hat oder an einem anderen Institut besser aufgehoben wäre. SAP hat auf seine Leonardo-Plattform eine algorithmische Bilderkennung aufgesetzt, die die Sichtbarkeit im Sportsponsoring misst und von Audi und einem Fernsehsender genutzt wird. „Die Branche entwickelt sich von Mad Men zu Math Men“, sagt Andrea Malgara, Geschäftsführer der Münchner Agentur Mediaplus.
Deren Schwesteragentur Plan.net begann vor vier Jahren, eine KI-Bibliothek aufzubauen. Die Daten bilden heute die Grundlage für automatisierte Mediaplanung: Die Plattform „Brand Investor“ errechnet je nach Zielvorgabe – etwa Maximierung der Kaufbereitschaft oder Lead-Generierung – die bestmögliche Verteilung eines Budgets. 19 Medienkanäle stehen zur Auswahl und 10 hoch 57 Planalternativen, also praktisch unendlich viele. Die Fähigkeit, Millionen von Daten zu scannen und binnen Minuten den besten Vorschlag herauszufiltern, wird vor allem für individualisierte und dynamische Kampagnen wichtig. „Es geht im Marketing gar nicht so sehr um Intelligenz, sondern um Produktivität“, findet Plan.net-Geschäftsführer Marcus Ambrus.
Selbstlernende Algorithmen für Online-Shops
Das gilt auch für die blitzschnelle Auswertung der Customer Journey als Grundlage für das nächste Dialogangebot. Bei Lufthansa analysiert KI die so genannte Passagiererlebniskette und entscheidet anhand von Wetter-, Reise- und Branchendaten, wie der Newsletter für den Kunden aussehen soll. Das Hamburger Start-up Akanoo hat selbstlernende Algorithmen für Online-Shops entwickelt. Sie werten in Echtzeit das Nutzerverhalten aus und blenden dann personalisierte Rabattgutscheine, Kupons oder Produktempfehlungen ein. Zu den Kunden zählen Deichmann, Thalia und Otto.
Noch aber gehören Agenturen und Unternehmen, die KI nutzen, zu einer kleinen Avantgarde, zumal in Deutschland. Die Vielzahl und die gute Qualität der Daten, die es braucht, um künstliche Intelligenz für den eigenen Betrieb zu nutzen, stellt für viele eine Hürde dar. Denn: Entgegen der Hoffnung mancher Marketer gibt es KI nicht fertig als Gesamtpaket zu kaufen. Auch eine noch so clevere Maschine braucht, um individuelle Ergebnisse liefern zu können, eine entsprechende Eingabe. Selbst Supercomputer Watson kann die Alpen nur in den Dialog mit den Kunden einbeziehen, wenn die Programmierer von North Face Europa für einen relevanten Markt halten.



 


  

 Christine Mattauch

(mat) führte ihr erstes Interview für die absatzwirtschaft 2008 in New York. Heute lebt die freie Journalistin in Kaiserslautern. Sie hat die Kölner Journalistenschule besucht und Volkswirtschaft studiert. Mag gute Architektur und guten Wein. Denkt gern an New York zurück.


Algorithmus / Chatbots / Echtzeit / Künstliche Intelligenz / Künstliche Intelligenz (KI) im Marketing


Daily Newsletter
Green Wednesday
Tech Tuesday
Work & Culture

 
"
https://news.google.com/rss/articles/CBMiamh0dHBzOi8vc3RhZHQtYnJlbWVyaGF2ZW4uZGUvZ29vZ2xlLWZsaWdodHMta3VlbnN0bGljaGUtaW50ZWxsaWdlbnotc29sbC12ZXJzcGFldHVuZ2VuLXNjaG5lbGxlci1lcmtlbm5lbi_SAQA?oc=5,Google Flights: Künstliche Intelligenz soll Verspätungen schneller erkennen - Caschys Blog,2018-02-01,Caschys Blog,https://stadt-bremerhaven.de,"Wenn ihr euch schon einmal mit Fernreisen oder mit Flügen generell beschäftigt habt, werdet ihr sicherlich auch über die ...",N/A,"Wenn ihr euch schon einmal mit Fernreisen oder mit Flügen generell beschäftigt habt, werdet ihr sicherlich auch über die ...","Wenn ihr euch schon einmal mit Fernreisen oder mit Flügen generell beschäftigt habt, werdet ihr sicherlich auch über die ...",,,N/A,N/A,"
Google / Internet
Google Flights: Künstliche Intelligenz soll Verspätungen schneller erkennen
von Olli  Feb 1, 2018 | 4 Kommentare





Wenn ihr euch schon einmal mit Fernreisen oder mit Flügen generell beschäftigt habt, werdet ihr sicherlich auch über die Google-Flights-Plattform gestolpert sein. Google bietet damit eine eigene Möglichkeit an, nach Flügen und den billigsten Preisen zu suchen, die Ergebnisse werden dabei direkt in die Websuche integriert.
In einer gewissen Regelmäßigkeit integriert Google neue Funktionen in Google Flights, erst im November aktualisierte man das Design im Web, im Dezember kamen dann bessere Funktionen für Preise und Deals dazu. Nun möchte man neben der besseren Markierung von Economy-Flügen auch die hauseigene künstliche Intelligenz in das System integrieren.
Konkret soll Machine Learning dafür sorgen Verspätungen von Flügen zu erkennen noch bevor die Airlines das an die Systeme melden. Dazu nutzt das System verschiedene Werte, zu denen beispielsweise Abflugszeit oder Wind- und Wetter-Daten gehören und errechnet daraus eine Verspätungswahrscheinlichkeit.
Liegt das Ergebnis der Berechnung über 80 Prozent, geht Google davon aus, dass sich der Flug tatsächlich verspätet und zeigt das auf der Google-Flights-Plattform an. Nutzer bekommen also schneller mitgeteilt, wenn was mit ihrem Flug nicht stimmt. Wie hoch die Trefferquote der KI am Ende wirklich ist, wird sich in Zukunft zeigen.



Gefällt dir der Artikel? Dann teile ihn mit deinen Freunden.TeilenTweetSpeichernVerschickenVerschicken

"
