URL link,Title,Date,Source,Source Link,description,keywords,og:description,twitter:description,@context,@type,dateModified,datePublished,headline,articleBody,mainEntityOfPage,author,publisher,about,image,itemListElement,article:section,article:summary,article text,articleSection,dateCreated,pagination,url,wordCount,alternativeHeadline,isAccessibleForFree,hasPart,@id,name,sku,inProductGroupWithID,isbn,numberOfPages,bookFormat,offers,logo,sameAs,parentOrganization,potentialAction
https://news.google.com/rss/articles/CBMiaWh0dHBzOi8vd3d3LnRhZ2Vzc2NoYXUuZGUvd2lydHNjaGFmdC9kaWdpdGFsZXMva3VlbnN0bGljaGUtaW50ZWxsaWdlbnotYXJiZWl0c2FsbHRhZy11bnRlcm5laG1lbi0xMDAuaHRtbNIBAA?oc=5,Wo Künstliche Intelligenz im Arbeitsalltag schon eingesetzt wird - tagesschau.de,2023-06-19,tagesschau.de,https://www.tagesschau.de,"Künstliche Intelligenz gilt als Zukunftsthema. Doch in manchen Unternehmen und Branchen gehört sie bereits zum Alltag, wie eine Umfrage von tagesschau.de unter deutschen Wirtschaftsverbänden zeigt. Von Till Bücker.","['Künstliche Intelligenz', 'KI', 'Arbeit', 'Beschäftigung', 'Unternehmen']","Künstliche Intelligenz gilt als Zukunftsthema. Doch in manchen Unternehmen und Branchen gehört sie bereits zum Alltag, wie eine Umfrage von tagesschau.de unter deutschen Wirtschaftsverbänden zeigt. Von Till Bücker.","Künstliche Intelligenz gilt als Zukunftsthema. Doch in manchen Unternehmen und Branchen gehört sie bereits zum Alltag, wie eine Umfrage von tagesschau.de unter deutschen Wirtschaftsverbänden zeigt. Von Till Bücker.",https://schema.org,BreadcrumbList,2024-02-12T14:33:35.852+01:00,2023-06-19T14:50:31.554+02:00,Wo Künstliche Intelligenz im Arbeitsalltag schon eingesetzt wird,"Künstliche Intelligenz gilt als Zukunftsthema. Doch in manchen Unternehmen und Branchen gehört sie bereits zum Alltag, wie eine Umfrage von tagesschau.de unter deutschen Wirtschaftsverbänden zeigt. Von Till Bücker Fast jeder vierte Deutsche hat einer Umfrage des TÜV-Verbandes unter mehr als 1000 Menschen zufolge bereits ChatGPT genutzt - unter anderem für berufliche Zwecke. Gerade auf dem Arbeitsmarkt könnte Künstliche Intelligenz (KI) für große Veränderungen sorgen. So glaubt Bundesarbeitsminister Hubertus Heil (SPD), dass es ab 2035 keinen Job mehr geben wird, der nichts mit KI zu tun hat. Im ""Future of Jobs Report 2023"" des Weltwirtschaftsforums gaben jüngst rund drei Viertel der Unternehmen an, entsprechende Technologien bis 2027 einsetzen zu wollen. Allerdings gibt es längst viele Firmen, die bereits mit KI arbeiten - etwa um Kosten zu sparen oder dem Fachkräftemangel entgegenzuwirken. Doch um welche Branchen geht es da?  Jede siebte Firma setzt bereits KI ein ""Ob maschinelle Übersetzung, vorausschauende Wartung oder personalisiertes Marketing - der Anwendungsbereich von KI erstreckt sich über nahezu alle Wirtschaftszweige und Geschäftsbereiche"", heißt es von der Deutschen Industrie- und Handelskammer (DIHK). Laut ihrer Digitalisierungsumfrage setzten im Februar dieses Jahres branchenübergreifend rund 14 Prozent der mehr als 1000 befragten Unternehmen KI ein. Weitere 23 Prozent planen demnach die Einführung innerhalb der kommenden drei Jahre.  ""Schon jetzt gibt es enorme Anwendungsmöglichkeiten für alle Berufsgruppen, die die Produktivität erhöhen können"", erklärt Roman Fessler, Unternehmenscoach für die sogenannte generative KI, bei der Texte, Bilder oder Videos maschinell erstellt werden. Allein diese Art der KI könnte nach Einschätzung des McKinsey Global Institute weltweit einen jährlichen Produktivitätszuwachs von umgerechnet 2,4 bis 4,1 Billionen Euro ermöglichen. Allerdings gibt es seit langem auch Befürchtungen, dass zahlreiche Menschen ihren Job verlieren könnten.  Textroboter wie ChatGPT und Bard oder Bildgeneratoren wie Stable Diffusion können laut Fessler zu großer Zeitersparnis führen. ""Das interessante an diesen Modellen ist die universelle Anwendbarkeit. Selbst in einem familienbetriebenen Handwerksbetrieb kann ein KI-basierter Chatbot Teile der Buchhaltung, das Schreiben der Angebote oder die Kommunikation übernehmen"", sagt der Experte im Gespräch mit tagesschau.de. Besonders viele Anfragen bekomme er allerdings von Social-Media-Agenturen und aus Marketingbereichen von Firmen.  Roboter in der Kundenbetreuung von Banken Diese Beobachtung deckt sich mit der DIHK-Erhebung. So steht an der Spitze die Branche der Informations- und Kommunikationstechnologien (IKT), wo bereits mehr als ein Viertel der Unternehmen KI nutzt. ""All unsere Mitgliedsunternehmen wie Agenturen, Medien, Vermarkter und Plattformen arbeiten bereits oder werden in naher Zukunft mit KI-Lösungen arbeiten"", berichtet der Bundesverband Digitale Wirtschaft (BVDW). Zum Einsatz komme KI etwa bei Übersetzungen, Zusammenfassungen sowie beim Verfassen von eigenen Texten und Beschreibungen von Produkten. Zudem werde die Technologie zur Bildbearbeitung genutzt, bei der Erstellung von Präsentationen und beim Schreiben von Programmiercodes für Software.  An zweiter Stelle folgt die Finanzwirtschaft mit 24 Prozent. ""Künstliche Intelligenz im Bankenwesen kann in den Bereichen Risikomanagement, Identifizierung von Geldwäsche, Wertpapierhandel und bei Chatbots eingesetzt werden"", so der Bundesverband deutscher Banken (BdB). Auch bei Versicherungen gehört KI laut dem Gesamtverband der Deutschen Versicherungswirtschaft (GDV) bereits zum Alltag - besonders in der Kundenbetreuung und in der Schadensregulierung. ""Durch den Einsatz von KI-basierten Systemen können Versicherungsunternehmen Schadensfälle vor allem schneller, aber auch genauer bewerten und entschädigen"", sagt GDV-Hauptgeschäftsführer Jörg Asmussen gegenüber tagesschau.de. Das senke Kosten, sorge aber auch für eine effizientere Identifizierung von Betrugsfällen. Weitere Einsatzfelder sind der DIHK zufolge die Prüfung von Identitäten und die Analyse von Kennzahlen.  Bedeutung in der Industrie wächst In der Industrie setzen 13 Prozent der Firmen bereits KI ein, 26 Prozent planen das. Laut DIHK wird die Technologie hier dafür verwendet, Anlagen zu warten und die Qualität zu sichern. Dabei geht es um Unregelmäßigkeiten in komplexen Maschinendaten und darum, automatisiert Fehler zu erkennen.  Der Verband der Elektro- und Digitalindustrie (ZVEI) verweist zudem auf Trendanalysen und die Nutzung von KI-basierten Chatprogrammen, um Bedienungsanleitungen zu formulieren. Auch bei der Wartung von Zügen komme KI bereits zum Einsatz: Durch die Auswertung von Nutzungs-, Infrastruktur-, Wetter und Verkehrsdaten sollen die Verlässlichkeit erhöht und Ausfallzeiten reduziert werden. Die Deutsche Bahn setzt auf der Grundlage von Künstlicher Intelligenz eine selbst entwickelte Software ein, um im Schienennetz Verspätungen zu begrenzen.  Welche Brötchen sind gefragt? In der Autoindustrie spielt KI insbesondere bei autonom fahrenden Autos eine zentrale Rolle, wie der Verband der Automobilindustrie (VDA) mitteilt. Komplexe KI-Systeme analysieren Sensordaten und sollen Verkehrssituationen erkennen. ""Bei Fahrerassistenzsystemen wird KI beispielsweise bei adaptiver Geschwindigkeitsregelung, Spurhalteassistenten und Notbremsassistenten eingesetzt"", so ein VDA-Sprecher. Auch in der Nahrungsmittelproduktion spielt KI zunehmend eine Rolle. So können Bilderkennungs-Programme falsch gelieferte Rohstoffe erkennen. Oder Bäckereien ermitteln anhand von Kassendaten die am meisten frequentierten Zeiten und besonders nachgefragte Brötchensorten.  Wetterdaten für die Warenbestellung Im Bau nutzen derzeit lediglich sechs Prozent der Unternehmen KI-Anwendungen. Straßenbauunternehmen setzen sie ein, um etwa das Volumen von Schüttgut-Haufen zu errechnen. Bestimmte Programme sollen dabei helfen, Bauschäden zu erfassen oder sanierungsbedürftige Dächer zu untersuchen. Der Zentralverband des Deutschen Handwerks (ZDH) verweist auf eine Fleischerei in Mecklenburg-Vorpommern, die mit dem Fraunhofer-Institut ein KI-basiertes Tool für die Warenbestellung entwickelt habe. Mittels moderner Software seien ""die Verkaufsstatistiken vergangener Jahre mit weiteren Faktoren wie dem Wetter oder mit Feiertagen kombiniert"" und dadurch die Produktion angepasst worden.  Auch im Groß- und Außenhandel ""nutzen Unternehmen zunehmend die Möglichkeiten, die der Einsatz von Künstlicher Intelligenz bietet"", berichtet der Bundesverband Großhandel, Außenhandel, Dienstleistungen (BGA). Zwar stünden noch viele Firmen am Anfang. Mögliche Einsatzgebiete seien die Planung von Lagerbeständen oder die Analyse von Kaufentscheidungen. Einsatz als Labor-Bote An Bedeutung gewinnen könnte künftig eine neue Generation von KI-basierten Servicerobotern - etwa im Einzelhandel oder in der Gastronomie. Der Verband Deutscher Maschinen- und Anlagenbau (VDMA) verweist darauf, dass solche Roboter heute schon zur Labor-Automatisierung eingesetzt werden.   So gibt es eine Bochumer Firma, die zusammen mit einem KI-Robotik-Unternehmen aus München erste Krankenhäuser mit autonomen Robotern ausstattet, die dort den Transport und das Sortieren von Blut-, Urin- oder Stuhlproben übernehmen sollen. Die Künstliche Intelligenz soll für bessere Abläufe sorgen und bei der Interaktion mit Pflegerinnen und Pflegern helfen. ",https://www.tagesschau.de/wirtschaft/digitales/kuenstliche-intelligenz-arbeitsalltag-unternehmen-100.html,"[{'@type': 'Person', 'name': 'Till Bücker', 'jobTitle': 'Correspondent', 'url': 'https://www.tagesschau.de/korrespondenten/till-buecker-101.html'}]","{'@type': 'Organization', 'name': 'tagesschau.de', 'logo': {'@type': 'ImageObject', 'url': 'https://www.tagesschau.de/resources/assets/image/json_logo_amp.png', 'width': 340, 'height': 60}}","[{'@type': 'Thing', 'name': 'Künstliche Intelligenz', 'sameAs': 'https://www.tagesschau.de/thema/künstliche_intelligenz'}, {'@type': 'Thing', 'name': 'KI', 'sameAs': 'https://www.tagesschau.de/thema/ki'}, {'@type': 'Thing', 'name': 'Arbeit', 'sameAs': 'https://www.tagesschau.de/thema/arbeit'}, {'@type': 'Thing', 'name': 'Beschäftigung', 'sameAs': 'https://www.tagesschau.de/thema/beschäftigung'}, {'@type': 'Thing', 'name': 'Unternehmen', 'sameAs': 'https://www.tagesschau.de/thema/unternehmen'}]","[{'@type': 'ImageObject', 'url': 'https://images.tagesschau.de/image/d4129503-f92b-4e9a-aeef-30aa55a39b37/AAABhpfQ0h8/AAABjwnlGwo/16x9-1920/chat-gpt-103.jpg', 'author': 'picture alliance/dpa', 'width': 1920, 'height': 1080, 'datePublished': '2023-06-19T14:50:31.554+02:00', 'description': 'ChatGPT Website auf einem Laptop', 'name': 'ChatGPT Website auf einem Laptop'}, {'@type': 'ImageObject', 'url': 'https://images.tagesschau.de/image/d4129503-f92b-4e9a-aeef-30aa55a39b37/AAABhpfQ0h8/AAABjwnlUSc/1x1-840/chat-gpt-103.jpg', 'author': 'picture alliance/dpa', 'width': 840, 'height': 840, 'datePublished': '2023-06-19T14:50:31.554+02:00', 'description': 'ChatGPT Website auf einem Laptop', 'name': 'ChatGPT Website auf einem Laptop'}]","[{'@type': 'ListItem', 'position': 1, 'item': {'@id': '/', 'name': 'tagesschau.de'}}, {'@type': 'ListItem', 'position': 2, 'item': {'@id': '/wirtschaft', 'name': 'Wirtschaft'}}, {'@type': 'ListItem', 'position': 3, 'item': {'@id': '/wirtschaft/digitales', 'name': 'Digitales'}}]",N/A,N/A,"























hintergrund



KI in der Arbeitswelt
Wo Künstliche Intelligenz schon Alltag ist

Stand: 19.06.2023 14:50 Uhr




Künstliche Intelligenz gilt als Zukunftsthema. Doch in manchen Unternehmen und Branchen gehört sie bereits zum Alltag, wie eine Umfrage von tagesschau.de unter deutschen Wirtschaftsverbänden zeigt.










Von Till Bücker, ARD-Finanzredaktion
                        





Fast jeder vierte Deutsche hat einer Umfrage des TÜV-Verbandes unter mehr als 1000 Menschen zufolge bereits ChatGPT genutzt - unter anderem für berufliche Zwecke. Gerade auf dem Arbeitsmarkt könnte Künstliche Intelligenz (KI) für große Veränderungen sorgen. So glaubt Bundesarbeitsminister Hubertus Heil (SPD), dass es ab 2035 keinen Job mehr geben wird, der nichts mit KI zu tun hat.

Im ""Future of Jobs Report 2023"" des Weltwirtschaftsforums gaben jüngst rund drei Viertel der Unternehmen an, entsprechende Technologien bis 2027 einsetzen zu wollen. Allerdings gibt es längst viele Firmen, die bereits mit KI arbeiten - etwa um Kosten zu sparen oder dem Fachkräftemangel entgegenzuwirken. Doch um welche Branchen geht es da?




















Player: videoPaul Lukowicz, Deutsches Forschungszentrum für Künstliche Intelligenz, zum Gesetzentwurf über Künstliche Intelligenz im EU-Parlament






interview

14.06.2023


EU-Gesetz zum Einsatz von KI
""Mit der Regulierung verhindern wir Schlimmes""



Obwohl KI eigentlich nicht intelligent sei, werde sie unser Leben massiv verändern, sagt KI-Experte Lukowicz.
                                    mehr










Jede siebte Firma setzt bereits KI ein

""Ob maschinelle Übersetzung, vorausschauende Wartung oder personalisiertes Marketing - der Anwendungsbereich von KI erstreckt sich über nahezu alle Wirtschaftszweige und Geschäftsbereiche"", heißt es von der Deutschen Industrie- und Handelskammer (DIHK). Laut ihrer Digitalisierungsumfrage setzten im Februar dieses Jahres branchenübergreifend rund 14 Prozent der mehr als 1000 befragten Unternehmen KI ein. Weitere 23 Prozent planen demnach die Einführung innerhalb der kommenden drei Jahre.

Dieses Element enthält Daten von 23degrees.io. Sie können die Einbettung solcher Inhalte auf unserer Datenschutzseite blockieren.


""Schon jetzt gibt es enorme Anwendungsmöglichkeiten für alle Berufsgruppen, die die Produktivität erhöhen können"", erklärt Roman Fessler, Unternehmenscoach für die sogenannte generative KI, bei der Texte, Bilder oder Videos maschinell erstellt werden. Allein diese Art der KI könnte nach Einschätzung des McKinsey Global Institute weltweit einen jährlichen Produktivitätszuwachs von umgerechnet 2,4 bis 4,1 Billionen Euro ermöglichen. Allerdings gibt es seit langem auch Befürchtungen, dass zahlreiche Menschen ihren Job verlieren könnten.

Textroboter wie ChatGPT und Bard oder Bildgeneratoren wie Stable Diffusion können laut Fessler zu großer Zeitersparnis führen. ""Das interessante an diesen Modellen ist die universelle Anwendbarkeit. Selbst in einem familienbetriebenen Handwerksbetrieb kann ein KI-basierter Chatbot Teile der Buchhaltung, das Schreiben der Angebote oder die Kommunikation übernehmen"", sagt der Experte im Gespräch mit tagesschau.de. Besonders viele Anfragen bekomme er allerdings von Social-Media-Agenturen und aus Marketingbereichen von Firmen.








































11.05.2023


EU-Parlament
Strengere Regeln für Künstliche Intelligenz



Abgeordnete wollen das Gesetz der Kommission zur Reglementierung von Künstlicher Intelligenz verschärfen.
                                    mehr










Roboter in der Kundenbetreuung von Banken

Diese Beobachtung deckt sich mit der DIHK-Erhebung. So steht an der Spitze die Branche der Informations- und Kommunikationstechnologien (IKT), wo bereits mehr als ein Viertel der Unternehmen KI nutzt. ""All unsere Mitgliedsunternehmen wie Agenturen, Medien, Vermarkter und Plattformen arbeiten bereits oder werden in naher Zukunft mit KI-Lösungen arbeiten"", berichtet der Bundesverband Digitale Wirtschaft (BVDW). Zum Einsatz komme KI etwa bei Übersetzungen, Zusammenfassungen sowie beim Verfassen von eigenen Texten und Beschreibungen von Produkten. Zudem werde die Technologie zur Bildbearbeitung genutzt, bei der Erstellung von Präsentationen und beim Schreiben von Programmiercodes für Software.

An zweiter Stelle folgt die Finanzwirtschaft mit 24 Prozent. ""Künstliche Intelligenz im Bankenwesen kann in den Bereichen Risikomanagement, Identifizierung von Geldwäsche, Wertpapierhandel und bei Chatbots eingesetzt werden"", so der Bundesverband deutscher Banken (BdB). Auch bei Versicherungen gehört KI laut dem Gesamtverband der Deutschen Versicherungswirtschaft (GDV) bereits zum Alltag - besonders in der Kundenbetreuung und in der Schadensregulierung.

""Durch den Einsatz von KI-basierten Systemen können Versicherungsunternehmen Schadensfälle vor allem schneller, aber auch genauer bewerten und entschädigen"", sagt GDV-Hauptgeschäftsführer Jörg Asmussen gegenüber tagesschau.de. Das senke Kosten, sorge aber auch für eine effizientere Identifizierung von Betrugsfällen. Weitere Einsatzfelder sind der DIHK zufolge die Prüfung von Identitäten und die Analyse von Kennzahlen.








































30.04.2023


Zukunftsforschung
So verändert KI die Arbeitswelt



Künstliche Intelligenz verändert die Welt: Sie schreibt Referate, Werbetexte oder Programmcodes in Sekundenschnelle.
                                    mehr










Bedeutung in der Industrie wächst

In der Industrie setzen 13 Prozent der Firmen bereits KI ein, 26 Prozent planen das. Laut DIHK wird die Technologie hier dafür verwendet, Anlagen zu warten und die Qualität zu sichern. Dabei geht es um Unregelmäßigkeiten in komplexen Maschinendaten und darum, automatisiert Fehler zu erkennen.

Der Verband der Elektro- und Digitalindustrie (ZVEI) verweist zudem auf Trendanalysen und die Nutzung von KI-basierten Chatprogrammen, um Bedienungsanleitungen zu formulieren. Auch bei der Wartung von Zügen komme KI bereits zum Einsatz: Durch die Auswertung von Nutzungs-, Infrastruktur-, Wetter und Verkehrsdaten sollen die Verlässlichkeit erhöht und Ausfallzeiten reduziert werden. Die Deutsche Bahn setzt auf der Grundlage von Künstlicher Intelligenz eine selbst entwickelte Software ein, um im Schienennetz Verspätungen zu begrenzen.
Welche Brötchen sind gefragt?

In der Autoindustrie spielt KI insbesondere bei autonom fahrenden Autos eine zentrale Rolle, wie der Verband der Automobilindustrie (VDA) mitteilt. Komplexe KI-Systeme analysieren Sensordaten und sollen Verkehrssituationen erkennen. ""Bei Fahrerassistenzsystemen wird KI beispielsweise bei adaptiver Geschwindigkeitsregelung, Spurhalteassistenten und Notbremsassistenten eingesetzt"", so ein VDA-Sprecher.

Auch in der Nahrungsmittelproduktion spielt KI zunehmend eine Rolle. So können Bilderkennungs-Programme falsch gelieferte Rohstoffe erkennen. Oder Bäckereien ermitteln anhand von Kassendaten die am meisten frequentierten Zeiten und besonders nachgefragte Brötchensorten.




















Player: audioFake-Urteile, gefährlicher Rat - Wo Künstliche Intelligenz nach Hinten losgeht





09.06.2023


Rechtsanwalt in den USA
Wenn KI nach hinten losgeht



Eine KI denkt sich Urteile einfach aus, Aktenzeichen inklusive - es ist nicht das einzige Negativ-Beispiel.
                                    mehr










Wetterdaten für die Warenbestellung

Im Bau nutzen derzeit lediglich sechs Prozent der Unternehmen KI-Anwendungen. Straßenbauunternehmen setzen sie ein, um etwa das Volumen von Schüttgut-Haufen zu errechnen. Bestimmte Programme sollen dabei helfen, Bauschäden zu erfassen oder sanierungsbedürftige Dächer zu untersuchen.

Der Zentralverband des Deutschen Handwerks (ZDH) verweist auf eine Fleischerei in Mecklenburg-Vorpommern, die mit dem Fraunhofer-Institut ein KI-basiertes Tool für die Warenbestellung entwickelt habe. Mittels moderner Software seien ""die Verkaufsstatistiken vergangener Jahre mit weiteren Faktoren wie dem Wetter oder mit Feiertagen kombiniert"" und dadurch die Produktion angepasst worden.




















Player: audioExperten warnen vor ""Vernichtung durch KI""





30.05.2023


Experten warnen vor Risiken
KI so gefährlich wie Pandemien oder Atomkrieg



Eine Reihe führender Experten sieht in KI eine potenzielle globale Gefahr.
                                    mehr











Auch im Groß- und Außenhandel ""nutzen Unternehmen zunehmend die Möglichkeiten, die der Einsatz von Künstlicher Intelligenz bietet"", berichtet der Bundesverband Großhandel, Außenhandel, Dienstleistungen (BGA). Zwar stünden noch viele Firmen am Anfang. Mögliche Einsatzgebiete seien die Planung von Lagerbeständen oder die Analyse von Kaufentscheidungen.
Einsatz als Labor-Bote

An Bedeutung gewinnen könnte künftig eine neue Generation von KI-basierten Servicerobotern - etwa im Einzelhandel oder in der Gastronomie. Der Verband Deutscher Maschinen- und Anlagenbau (VDMA) verweist darauf, dass solche Roboter heute schon zur Labor-Automatisierung eingesetzt werden.


















                        Eine Labormitarbeiterin mit einem KI-gesteuerten Roboter der Bochumer Firma  United Robotics Group
                    



So gibt es eine Bochumer Firma, die zusammen mit einem KI-Robotik-Unternehmen aus München erste Krankenhäuser mit autonomen Robotern ausstattet, die dort den Transport und das Sortieren von Blut-, Urin- oder Stuhlproben übernehmen sollen. Die Künstliche Intelligenz soll für bessere Abläufe sorgen und bei der Interaktion mit Pflegerinnen und Pflegern helfen.



Künstliche Intelligenz


KI


Arbeit


Beschäftigung


Unternehmen



Dieses Thema im Programm: Über dieses Thema berichtete Deutschlandfunk am 30. April 2023 um 07:37 Uhr.





Facebook




Facebook




X





X




Whatsapp






WhatsApp




Mail






Mail




Drucken




Drucken





",,,,,,,,,,,,,,,,,,,,
https://news.google.com/rss/articles/CBMiWGh0dHBzOi8vd3d3LnN1ZWRkZXV0c2NoZS5kZS9wcm9qZWt0ZS9hcnRpa2VsL2tvbHVtbmUva3VlbnN0bGljaGUtaW50ZWxsaWdlbnota2ktZTkwMzUwNy_SAQA?oc=5,SZ-Transparenz-Blog zu KI - Süddeutsche Zeitung - SZ.de,2023-06-16,Süddeutsche Zeitung - SZ.de,https://www.sueddeutsche.de,Wie die SZ künstliche Intelligenz nutzt,Künstliche Intelligenz,"Eine kurze Erklärung, wie die Redaktion mit neuen Technologien umgeht.","Eine kurze Erklärung, wie die Redaktion mit neuen Technologien umgeht.",http://schema.org,NewsArticle,2023-06-17T01:34:00.674Z,2023-06-16T08:00:00.000Z,SZ-Transparenz-Blog zu KI,,https://www.sueddeutsche.de/projekte/artikel/kolumne/kuenstliche-intelligenz-ki-e903507/,"[{'@type': 'Person', 'name': 'Andrian Kreye', 'sameAs': 'https://www.sueddeutsche.de/autoren/autor-undefined'}]","{'@type': 'Organization', 'name': 'Süddeutsche Zeitung', 'logo': {'@type': 'ImageObject', 'url': 'https://www.sueddeutsche.de/assets/png/sz-e6f6c02355590e640386e3947d66f8cd.png', 'width': 1200, 'height': 630}}",Leserbriefe,"{'@type': 'ImageObject', 'url': 'https://www.sueddeutsche.de/projekte/artikel/kolumne/kuenstliche-intelligenz-ki-e903507/44a3c7f6c26cabc457fbde3478e2d04afee615c70fccf82f44abdcda0da9ddec_w2400_h1256_r0,1,4800,2512_q70.png', 'width': 2400, 'height': 1256}",,Leserbriefe,N/A,N/A,Leserbriefe,2023-06-16T08:00:00.000Z,1.0,https://www.sueddeutsche.de/projekte/artikel/kolumne/kuenstliche-intelligenz-ki-e903507/,453.0,SZ-Transparenz-Blog zu KI,True,[],,,,,,,,,,,,
https://news.google.com/rss/articles/CBMiPWh0dHBzOi8vd3d3Lnpmay5kZS9rYXJyaWVyZS91ZWJlcm5pbW10LWRpZS1raS1iYWxkLW1laW5lbi1qb2LSAQA?oc=5,Übernimmt die KI bald meinen Job?: Zeitung für kommunale Wirtschaft - Zeitung für kommunale Wirtschaft,2023-06-20,Zeitung für kommunale Wirtschaft,https://www.zfk.de,N/A,N/A,"Fast jeder vierte Arbeitnehmer fürchtet um seinen Arbeitsplatz. Zu Recht, denn die Künstliche Intelligenz (KI) hat die Macht, unsere bekannte Arbeitswelt zu revolutionieren. Der Vorteil: Es werden mehr neue Posten entstehen als alte wegfallen.",N/A,https://www.schema.org,BreadcrumbList,,,,,,,,,,"[{'@type': 'ListItem', 'position': 1, 'item': {'@id': 'https://www.zfk.de/', 'name': 'ZfK.de'}}, {'@type': 'ListItem', 'position': 2, 'item': {'@id': 'https://www.zfk.de/karriere', 'name': 'Karriere'}}, {'@type': 'ListItem', 'position': 3, 'item': {'@id': 'https://www.zfk.de/karriere/uebernimmt-die-ki-bald-meinen-job', 'name': 'Übernimmt die KI bald meinen Job?'}}]",N/A,N/A,"Sie befinden sich hier:homeZfK.de  >  KarriereTeilenFacebookLinkedInSymbolsE-MailKarriereÜbernimmt die KI bald meinen Job? Fast jeder vierte Arbeitnehmer fürchtet um seinen Arbeitsplatz. Zu Recht, denn die Künstliche Intelligenz (KI) hat die Macht, unsere bekannte Arbeitswelt zu revolutionieren. Der Vorteil: Es werden mehr neue Posten entstehen als alte wegfallen. 20.06.2023„Künstliche Intelligenz wird unser Leben für immer verändern – auch die Art, wie wir arbeiten"", heißt es in einer Studie von E&Y.Bild: © ihorvsn/AdobeStockKünstliche Intelligenz (KI) kann in Zukunft unsere Arbeit erleichtern. Oder wird sie  immer mehr Arbeitnehmerinnen und Arbeitnehmer überflüssig machen? Fast jeder vierte Beschäftigte in Deutschland sorgt sich laut einer aktuellen Befragung von Ernst & Young (EY), dass die KI seinen Job übernimmt.Weltweit gesehen ist es sogar mehr als jeder Dritte. Am ausgeprägtesten ist diese Angst in Saudi-Arabien (56 Prozent), Indien (52 Prozent) und China (48 Prozent). Die Italiener sorgen sich am wenigsten: Dort befürchtet nur einer von sechs Arbeitnehmern, dass Maschinen in Zukunft den eigenen Job…Weiterlesen mit ZFK Plus Lesen Sie diesen und viele weitere Artikel auf zfk.de in voller Länge.  Mit einem ZfK+-Zugang profitieren Sie von exklusiven Berichten, Hintergründen und Interviews rund um die kommunale Wirtschaft. Jetzt freischaltenSie sind bereits Abonnent? Zum Log-In",,,,,,,,,,,,,,,,,,,,
