URL link,Title,Date,Source,Source Link,description,keywords,og:description,twitter:description,image,articleBody,author,@type,about,dateModified,isAccessibleForFree,isPartOf,mainEntityOfPage,@context,datePublished,alternativeHeadline,publisher,category,headline,articleSection,article:section,article:summary,article text,itemListElement,name,@graph
https://news.google.com/rss/articles/CBMikQFodHRwczovL3d3dy53ZWx0LmRlL3dpcnRzY2hhZnQvYXJ0aWNsZTIzMzI1NzM1My9LdWVuc3RsaWNoZS1JbnRlbGxpZ2Vuei1UZXNsYS13aWxsLVJvYm90ZXItZnVlci1nZWZhZWhybGljaGUtb2Rlci1sYW5nd2VpbGlnZS1BcmJlaXRlbi1iYXVlbi5odG1s0gEA?oc=5,Künstliche Intelligenz: Tesla will Roboter für gefährliche oder langweilige Arbeiten bauen - WELT,2021-08-20,WELT,https://www.welt.de,Sie sollen aussehen wie Menschen und Hände mit fünf Fingern haben. Tesla plant neben autonomen Autos künftig auch Roboter zu bauen. Elon Musk will den Prototypen bereits kommendes Jahr vorstellen.,"Newsteam, Tesla Motors, Künstliche Intelligenz (KI), texttospeech, Tesla Bot, Auto, Elon Musk, Grünheide, Roboter, Auto, Nabu Brandenburg, Bündnis 90/Die Grünen",Sie sollen aussehen wie Menschen und Hände mit fünf Fingern haben. Tesla plant neben autonomen Autos künftig auch Roboter zu bauen. Elon Musk will den Prototypen bereits kommendes Jahr vorstellen.,Sie sollen aussehen wie Menschen und Hände mit fünf Fingern haben. Tesla plant neben autonomen Autos künftig auch Roboter zu bauen. Elon Musk will den Prototypen bereits kommendes Jahr vorstellen.,"{'@type': 'ImageObject', 'url': 'https://img.welt.de/img/bildergalerien/mobile233257327/0501352227-ci16x9-w1200/Tesla-will-humanoiden-Roboter-fuer-gefaehrliche-Arbeiten-bauen.jpg', 'width': 1200, 'height': 675}","<p>Der US-Elektrobauer Tesla will künftig auch Roboter bauen, die gefährliche oder langweilige Arbeiten verrichten können. Tesla-Chef Elon Musk kündigte am Donnerstag einen menschenähnlichen Prototypen an, den sogenannten „Tesla Bot“: Er werde „Hände mit fünf Fingern“ haben. Musk will den Prototypen bereits kommendes Jahr präsentieren. </p>
<p>Die Ankündigung machte Musk auf dem „AI Day“ von Tesla – dem „Tag der Künstlichen Intelligenz“ (KI). „Er soll natürlich freundlich sein, durch eine für Menschen gebaute Welt navigieren können und gefährliche, sich wiederholende und langweilige Arbeiten eliminieren.“ Er werde auch so konstruiert sein, dass er nicht besonders schnell sei. „Man wird vor ihm weglaufen können.“</p>
<p>Nach Angaben von Musk wird der Tesla-Bot rund 177 Zentimeter groß sein und 57 Kilogramm wiegen. „Er hat eine Art Bildschirm am Kopf für nützliche Informationen, aber ansonsten ist er im Grunde genommen mit einem Autopilotsystem ausgestattet“, sagte der Unternehmer. Der Tesla-Roboter werde mit acht Kameras und einem vollwertigen selbstfahrenden Computer ausgestattet sein und die gleichen Werkzeuge nutzen, die Tesla im Auto verwende. </p>
<h3>Menschen sollen dem Roboter Befehle geben können</h3>
<p>„Das Schwierigste an einem nützlichen humanoiden Roboter ist, dass er nicht durch die Welt navigieren kann, ohne gezielt trainiert zu werden.“ Das müsse aber ohne explizite Anweisungen funktionieren. „Man kann mit ihm sprechen und sagen: ‚Bitte nimm diese Schraube und befestige sie mit dem Schraubenschlüssel am Auto‘, und er sollte in der Lage sein, das zu tun“.</p>
<p>Der Einsatz von humanoiden Robotern werde weitreichende Konsequenzen haben, sagte Musk voraus. „In der Zukunft wird körperliche Arbeit eine Option sein. Wenn man sie erledigen will, kann man sie tun, aber man muss sie nicht tun.“ Dies habe offensichtlich tiefgreifende Auswirkungen auf die Wirtschaft. Denn wenn man bedenke, dass die Wirtschaft auf ihrer grundlegenden Ebene aus Arbeit bestehe, dann gebe es vielleicht keine wirklichen Grenzen für die Wirtschaft mehr.</p>
<p>Tesla ist dafür bekannt, große technische Neuerungen zu einem sehr frühen Zeitpunkt der Entwicklung zu verkünden und Systeme live zu stellen, die von anderen Unternehmen noch nicht als marktreif angesehen werden. Das gilt auch für die Selbstfahrer-Option in Teslas Fahrassistenzsystem „Autopilot“, die nach einer Reihe von Auffahrunfällen in der Kritik steht. Die nächste Stufe des Programms nennt Tesla „Full Self-Driving“ – also komplett selbstfahrend –, obwohl es nach in der Branche gängigen Kriterien weiterhin lediglich ein Assistenzsystem bleibt.</p>
<p>Neue Kritik gibt es von mehreren Umweltverbänden <a href=""/wirtschaft/article233094023/Elon-Musk-macht-Druck-beim-Zeitplan-fuer-Tesla-Fabrik-in-Gruenheide.html"" target=""_blank"" class=""o-link"" name=""inlineLink_"">für die Baupläne der Tesla-Fabrik in Grünheide</a> bei Berlin. Die Beurteilung der geplanten Batteriefabrik in den neuen Antragsunterlagen für die Genehmigung sei schwierig, „weil alles geschwärzt ist“, sagte der Landesgeschäftsführer der Grünen Liga, Michael Ganschow, am Freitag. „Die Mengenangaben kann man nicht nachvollziehen, die Stoffe nicht nachvollziehen.“ Die Batteriefabrik werde auf die Grenze eines Wasserschutzgebietes gebaut, sodass bestimmte Gefahrenstoffe nicht verboten seien.</p>
<p>Tesla will möglichst zum Jahresende dort mit der Produktion beginnen, der Start war ursprünglich schon für Juli geplant. Die abschließende umweltrechtliche Genehmigung durch das Land Brandenburg steht bisher aus, deshalb baut das Unternehmen auf einzelne vorzeitige Zulassungen. Die Geschäftsführerin des Nabu Brandenburg, Christiane Schröder, lehnt weitere vorzeitige Zulassungen für die Ansiedlung ab. „Weil man hier einfach Gefahr läuft, Dinge in die Landschaft zu bauen und Störfälle zu erzeugen, die dann nicht mehr eingefangen werden können“, sagte Schröder.</p>
<p>Die Frist für Einwendungen gegen den aktualisierten Antrag von Tesla ist in der Nacht zu Freitag um Mitternacht abgelaufen. Beide Umweltverbände waren im Juli mit einem Eilantrag gegen eine weitere vorzeitige Genehmigung für den Bau gescheitert.</p>","[{'@type': 'Organization', 'name': 'WELT'}]",NewsArticle,Prototyp angekündigt,2021-08-20T13:24:48Z,True,"{'@type': ['CreativeWork', 'Product'], 'name': 'WELT', 'productID': 'welt.de:showcase'}","{'@type': 'WebPage', '@id': 'https://google.com/article', 'url': 'https://www.welt.de/wirtschaft/article233257353/Kuenstliche-Intelligenz-Tesla-will-Roboter-fuer-gefaehrliche-oder-langweilige-Arbeiten-bauen.html'}",https://schema.org,2021-08-20T12:33:51Z,Tesla will Roboter für gefährliche oder langweilige Arbeiten bauen,"{'@type': 'Organization', 'name': 'WELT', 'logo': {'@type': 'ImageObject', 'url': 'https://www.welt.de/assets/images/global/welt-logo-trans-788d2173e3.png', 'width': 228, 'height': 60}}",Wirtschaft,Künstliche Intelligenz: Tesla will Roboter für gefährliche oder langweilige Arbeiten bauen,Wirtschaft,N/A,N/A,"           Comment  56  Kommentare                      Whatsapp                               Wirtschaft Prototyp angekündigt Tesla will Roboter für gefährliche oder langweilige Arbeiten bauen    Veröffentlicht am 20.08.2021 | Lesedauer: 3 Minuten                               Tesla will solche humanoiden Roboter für gefährliche Arbeiten bauen  Quelle: dpa/-        Sie sollen aussehen wie Menschen und Hände mit fünf Fingern haben. Tesla plant neben autonomen Autos künftig auch Roboter zu bauen. Elon Musk will den Prototypen bereits kommendes Jahr vorstellen.             Comment  56  Kommentare                      Whatsapp                                              Hier können Sie unsere WELT-Podcasts hören   Um eingebettete Inhalte anzuzeigen, ist deine widerrufliche Einwilligung in die Übermittlung und Verarbeitung von personenbezogenen Daten notwendig, da die Anbieter der eingebetteten Inhalte als Drittanbieter diese Einwilligung verlangen [In diesem Zusammenhang können auch Nutzungsprofile (u.a. auf Basis von Cookie-IDs) gebildet und angereichert werden, auch außerhalb des EWR]. Indem du den Schalter auf „an“ stellst, stimmst du diesen (jederzeit widerruflich) zu. Dies umfasst auch deine Einwilligung in die Übermittlung bestimmter personenbezogener Daten in Drittländer, u.a. die USA, nach Art. 49 (1) (a) DSGVO. Mehr Informationen dazu findest du hier. Du kannst deine Einwilligung jederzeit über den Schalter und über Privatsphäre am Seitenende widerrufen.         Podcast freigeben          Anzeige      Der US-Elektrobauer Tesla will künftig auch Roboter bauen, die gefährliche oder langweilige Arbeiten verrichten können. Tesla-Chef Elon Musk kündigte am Donnerstag einen menschenähnlichen Prototypen an, den sogenannten „Tesla Bot“: Er werde „Hände mit fünf Fingern“ haben. Musk will den Prototypen bereits kommendes Jahr präsentieren.   Die Ankündigung machte Musk auf dem „AI Day“ von Tesla – dem „Tag der Künstlichen Intelligenz“ (KI). „Er soll natürlich freundlich sein, durch eine für Menschen gebaute Welt navigieren können und gefährliche, sich wiederholende und langweilige Arbeiten eliminieren.“ Er werde auch so konstruiert sein, dass er nicht besonders schnell sei. „Man wird vor ihm weglaufen können.“ Nach Angaben von Musk wird der Tesla-Bot rund 177 Zentimeter groß sein und 57 Kilogramm wiegen. „Er hat eine Art Bildschirm am Kopf für nützliche Informationen, aber ansonsten ist er im Grunde genommen mit einem Autopilotsystem ausgestattet“, sagte der Unternehmer. Der Tesla-Roboter werde mit acht Kameras und einem vollwertigen selbstfahrenden Computer ausgestattet sein und die gleichen Werkzeuge nutzen, die Tesla im Auto verwende.  Menschen sollen dem Roboter Befehle geben können   „Das Schwierigste an einem nützlichen humanoiden Roboter ist, dass er nicht durch die Welt navigieren kann, ohne gezielt trainiert zu werden.“ Das müsse aber ohne explizite Anweisungen funktionieren. „Man kann mit ihm sprechen und sagen: ‚Bitte nimm diese Schraube und befestige sie mit dem Schraubenschlüssel am Auto‘, und er sollte in der Lage sein, das zu tun“.    Lesen Sie auch                             Mercedes EQV im Test    Dieser Elektro-Mercedes ist die richtige Idee – und wird trotzdem scheitern       Der Einsatz von humanoiden Robotern werde weitreichende Konsequenzen haben, sagte Musk voraus. „In der Zukunft wird körperliche Arbeit eine Option sein. Wenn man sie erledigen will, kann man sie tun, aber man muss sie nicht tun.“ Dies habe offensichtlich tiefgreifende Auswirkungen auf die Wirtschaft. Denn wenn man bedenke, dass die Wirtschaft auf ihrer grundlegenden Ebene aus Arbeit bestehe, dann gebe es vielleicht keine wirklichen Grenzen für die Wirtschaft mehr.                      So soll er aussehen, der Tesla-Roboter   Quelle: dpa/-      Tesla ist dafür bekannt, große technische Neuerungen zu einem sehr frühen Zeitpunkt der Entwicklung zu verkünden und Systeme live zu stellen, die von anderen Unternehmen noch nicht als marktreif angesehen werden. Das gilt auch für die Selbstfahrer-Option in Teslas Fahrassistenzsystem „Autopilot“, die nach einer Reihe von Auffahrunfällen in der Kritik steht. Die nächste Stufe des Programms nennt Tesla „Full Self-Driving“ – also komplett selbstfahrend –, obwohl es nach in der Branche gängigen Kriterien weiterhin lediglich ein Assistenzsystem bleibt.   Anzeige      Neue Kritik gibt es von mehreren Umweltverbänden für die Baupläne der Tesla-Fabrik in Grünheide bei Berlin. Die Beurteilung der geplanten Batteriefabrik in den neuen Antragsunterlagen für die Genehmigung sei schwierig, „weil alles geschwärzt ist“, sagte der Landesgeschäftsführer der Grünen Liga, Michael Ganschow, am Freitag. „Die Mengenangaben kann man nicht nachvollziehen, die Stoffe nicht nachvollziehen.“ Die Batteriefabrik werde auf die Grenze eines Wasserschutzgebietes gebaut, sodass bestimmte Gefahrenstoffe nicht verboten seien.    Lesen Sie auch                             Premiere des Model Y    Dieser Tesla kann etwas Neues – und verpasst doch „das nächste große Ding“       Tesla will möglichst zum Jahresende dort mit der Produktion beginnen, der Start war ursprünglich schon für Juli geplant. Die abschließende umweltrechtliche Genehmigung durch das Land Brandenburg steht bisher aus, deshalb baut das Unternehmen auf einzelne vorzeitige Zulassungen. Die Geschäftsführerin des Nabu Brandenburg, Christiane Schröder, lehnt weitere vorzeitige Zulassungen für die Ansiedlung ab. „Weil man hier einfach Gefahr läuft, Dinge in die Landschaft zu bauen und Störfälle zu erzeugen, die dann nicht mehr eingefangen werden können“, sagte Schröder.    Lesen Sie auch              Angebote    Bis zu 3,76 Prozent Zinsen – Hier lohnen sich Fest- und Tagesgeld       Die Frist für Einwendungen gegen den aktualisierten Antrag von Tesla ist in der Nacht zu Freitag um Mitternacht abgelaufen. Beide Umweltverbände waren im Juli mit einem Eilantrag gegen eine weitere vorzeitige Genehmigung für den Bau gescheitert.               dpa/coh                                 ",,,
https://news.google.com/rss/articles/CBMiX2h0dHBzOi8vaGFtYnVyZy1idXNpbmVzcy5jb20vZGUvbmV3cy9zby1lcm9iZXJ0LXN0YXJ0dXAtZ3J1ZW5kZXJpbi1sZW5hLXdlaXJhdWNoLWRpZS1raS1icmFuY2hl0gEA?oc=5,So erobert Startup-Gründerin Lena Weirauch die KI-Branche - Hamburg Invest,2021-08-18,Hamburg Invest,https://hamburg-business.com,"Teil 3 der Serie „Female AI – vier Fragen an Frauen aus der KI“. Heute: Lena Weirauch, Mitgründerin des Startups ai-omatic",N/A,"Teil 3 der Serie: „Female AI – vier Fragen an Frauen aus der KI“. Heute: Lena Weirauch, Gründerin des KI-Startups ai-omatic","Teil 3 der Serie: „Female AI – vier Fragen an Frauen aus der KI“. Heute: Lena Weirauch, Gründerin des KI-Startups ai-omatic","['https://hamburg-business.com/_Resources/Persistent/6/f/5/f/6f5fb39c2da275112dacb083f8c6caf00ed5c191/Frau%20am%20Laptop%20%7C%20Unsplash%3ACrew%20%7C%20170821-bf8e21abc470d990b920b1caacdaf7cb-1920x1080.jpg', 'https://hamburg-business.com/_Resources/Persistent/2/4/4/2/2442a28760561ea2682cace563a41dc3fb19872c/Frau%20am%20Laptop%20%7C%20Unsplash%3ACrew%20%7C%20170821-bf8e21abc470d990b920b1caacdaf7cb-1855x1391.jpg', 'https://hamburg-business.com/_Resources/Persistent/c/6/b/2/c6b274deb2608122aeca137354079a6657fecfd1/Frau%20am%20Laptop%20%7C%20Unsplash%3ACrew%20%7C%20170821-bf8e21abc470d990b920b1caacdaf7cb-1080x1080.jpg']",,,NewsArticle,,2024-02-24T14:57:54+01:00,True,,https://hamburg-business.com/de/news/so-erobert-startup-gruenderin-lena-weirauch-die-ki-branche,http://schema.org/,2021-08-18T09:21:07+02:00,,"{'type': 'Organization', '@id': 'Hamburg News', 'name': 'Hamburg News', 'url': 'https://hamburg-business.com/', 'sameAs': ['https://www.facebook.com/HHBusinessnews/', 'https://twitter.com/HH_BusinessNews', 'https://www.xing.com/communities/groups/hamburg-news-wirtschaftsnachrichten-aus-der-metropolregion-hamburg-1009342'], 'logo': {'@type': 'ImageObject', 'url': 'https://hamburg-business.com/_Resources/Static/Packages/Teha.Site/Build/svg/logo/default.b5159f2f.svg'}}",,So erobert Startup-Gründerin Lena Weirauch die KI-Branche,Künstliche Intelligenz,N/A,N/A,"Künstliche IntelligenzSo erobert Startup-Gründerin Lena Weirauch die KI-Branche18. August 2021Teil 3 der Serie „Female AI – vier Fragen an Frauen aus der KI“. Heute: Lena Weirauch, Mitgründerin des Startups ai-omaticDer Bereich künstliche Intelligenz bietet vielfältige Karrieremöglichkeiten. Davon sind auch das Hamburger KI-Unternehmen Synergeticon, der Verein ARIC Hamburg und die Bildungsinitiative proTechnicale überzeugt – und wollen speziell Frauen in der KI mehr Sichtbarkeit verleihen und fördern. Gemeinsam mit den Hamburg News kommen deshalb in der Interview-Reihe „Female AI – vier Fragen an Frauen aus der KI“ junge Frauen zu Wort, die bereits erfolgreich in der Branche Fuß gefasst haben. In der Serie berichten sie von ihrem Werdegang und ihren Erfahrungen.
Vier Fragen an ... Lena Weirauch, Mitgründerin von ai-omaticHamburg News: Was machst du in der KI-Branche, und warum ist das wichtig? 
Lena Weirauch: Ich bin CEO und Mitgründerin von ai-omatic, einem KI-Startup mit dem Fokus auf industrieller KI. Wir haben eine einzigartige Methode im Bereich der vorausschauenden Wartung (Predictive Maintenance, Anm. d. Redaktion) entwickelt, die in der Lage ist, Ausfallzeiten von Maschinen zu verhindern. Dabei bin ich verantwortlich für unsere Strategie, den Vertrieb und die Produktentwicklung. Zusammen mit unserem Vertriebsteam spreche ich mit neuen potenziellen Kunden mit dem Ziel, ihre Probleme und Bedürfnisse im Bereich der Instandhaltung vollständig zu verstehen, um unsere Lösung kontinuierlich zu verbessern. Aufgrund meiner Kenntnisse im Bereich künstlicher Intelligenz bin ich in der Lage, die Bedürfnisse der Kunden in technische Anforderungen zu übersetzen, die ich dann mit unserem Data-Science-Team diskutiere. Ich bin also sozusagen die Schnittstelle zwischen Vertrieb und Produktentwicklung. Darüber hinaus engagiere ich mich als Botschafterin für das in Hamburg ansässige MINT-Orientierungsprogramm proTechnicale.
Hamburg News: Was bist du zur KI gekommen?
Lena: Ursprünglich habe ich Psychologie studiert. Während der Statistikvorlesung meines Bachelorstudiums habe ich meine Leidenschaft für die Verarbeitung und Analyse großer Datenmengen entdeckt. Nach meinem Bachelor-Abschluss wollte ich im Bereich der KI arbeiten, um praktische Erfahrungen zu sammeln. Deshalb begann ich als Vertriebsleiterin in der Luftfahrt zu arbeiten. Schon nach ein paar Tagen Arbeit im Bereich KI wusste ich, dass es das ist, was ich machen möchte. Mir gefielen die Energie und die Leidenschaft der Menschen, und ich war fasziniert von den interessanten Themen und Lösungen. Heute habe ich die Chance, in einem der innovativsten Bereiche zu arbeiten, und ich liebe meinen Job jeden Tag.
ai-omatic-Mitgründerin Lena Weirauch© Lena WeirauchHamburg News: Was sind deine Pläne für die Zukunft? 
Lena: Mein Plan ist, dass ai-omatic das relevanteste Unternehmen wird, wenn es um Predictive Maintenance in Deutschland geht, und danach sogar weltweit. Nachdem wir den deutschen Markt abgedeckt haben, planen wir auch den Schritt in den asiatischen und den US-amerikanischen Markt. Ende dieses Jahres werde ich für drei Monate ins Silicon Valley und nach Shanghai reisen, um neue potenzielle Kunden zu treffen. Neben meiner Arbeit forsche ich in meiner Freizeit zum Thema Mitarbeiterzufriedenheit in Startups.
Hamburg News: Warum sollte es mehr Frauen in der KI geben? 
Lena: Ich denke, in jedem Bereich ist es wichtig, vielfältige Teams zu haben – auch, wenn es um KI geht. Künstliche Intelligenz ist ein mächtiges Werkzeug, das großartige Dinge schaffen kann, aber es wird auch die Perspektive seines Schöpfers repräsentieren. Ein sehr gutes Beispiel, um zu unterstreichen, wie wichtig das ist, ist der Fall von Samsung. Hauptsächlich männliche Entwickler waren für die Entwicklung des Samsung-Gesundheitstrackers verantwortlich und was passierte, ist, dass sie vergaßen, einen Perioden-Tracker zu integrieren, obwohl dies ein so wichtiger Teil des Lebens und der Gesundheit einer Frau ist. Diese Art von Ereignissen führt zu einer höheren Aufmerksamkeit für vielfältigere Teams in der KI. Trotzdem ist es noch ein weiter Weg. Vorbilder zu schaffen und Frauen in der KI sichtbarer zu machen, hilft auch, andere Frauen zu motivieren, insbesondere junge Frauen. Wir müssen ein neues Bild in unseren Köpfen schaffen, damit, wenn man an eine Data Scientist denkt, nicht eine männliche Person im Kopf hat, denn das ist immer noch der Fall. Indem wir Frauen aus der KI-Branche ins Rampenlicht stellen, können wir das aktiv ändern, und ich bin stolz darauf, ein Teil davon zu sein. ae/tn/sb
Quellen und weitere Informationen


ai-omatic.comWeitere Teile der Serie „Female AI – vier Fragen an Frauen aus der KI“
Ela Daniliuc, Synergeticon
Franziska Wittleder, ARIC e. V.Mehr zum ThemaKünstliche IntelligenzStartupsGründerInnenInnovationZukunftÄhnliche Artikel© Mediaserver HamburgKünstliche Intelligenz: Frauen erobern die SchlüsseltechnologieTeil 2 unserer Serie: „Female AI – vier Fragen an Frauen aus der KI“. Heute: Franziska Wittleder© Daniel ErdelmeierKünstliche Intelligenz: vier Fragen an Ela Daniliuc, SynergeticonNeue Serie: „Female AI – vier Fragen an Frauen aus der KI“. Die Zukunftstechnologie bietet spannende Karrieremöglichkeiten© Yvonne SchellerKann künstliche Intelligenz die Umwelt schützen?Expert*innen bei AI.HAMBURG-Veranstaltung skizzierten KI-Anwendungsszenarien aus Logistik, Erneuerbaren Energien und Food© Britta Sowa / HAW HamburgImmer mehr Einsatzbereiche für künstliche IntelligenzDie Technologie entwickelt sich rasant, Sicherheit ist dabei ein wesentlicher Aspekt. Zu diesen spannenden KI-Projekten forscht die HAW Hamburg","[{'@type': 'ListItem', 'position': 1, 'name': 'Das Portal für die Wirtschaft', 'item': 'https://hamburg-business.com/'}, {'@type': 'ListItem', 'position': 2, 'name': 'News', 'item': 'https://hamburg-business.com/de/news'}, {'@type': 'ListItem', 'position': 3, 'name': 'So erobert Startup-Gründerin Lena Weirauch die KI-Branche', 'item': 'https://hamburg-business.com/de/news/so-erobert-startup-gruenderin-lena-weirauch-die-ki-branche'}]",So erobert Startup-Gründerin Lena Weirauch die KI-Branche,
