URL link,Title,Date,Source,Source Link,description,keywords,og:description,twitter:description,@context,@type,dateModified,datePublished,headline,articleBody,mainEntityOfPage,author,publisher,about,image,itemListElement,article:section,article:summary,article text,articleSection,dateCreated,pagination,url,wordCount,alternativeHeadline,isAccessibleForFree,hasPart,@id,name,sku,inProductGroupWithID,isbn,numberOfPages,bookFormat,offers,logo,sameAs,parentOrganization,potentialAction
https://news.google.com/rss/articles/CBMiSGh0dHBzOi8vd3d3LmFpY2hhY2hlci16ZWl0dW5nLmRlL3N0aWNod29ydC9LJUMzJUJDbnN0bGljaGUlMjBJbnRlbGxpZ2VuetIBAA?oc=5,(Künstliche Intelligenz) - Aichacher Zeitung,2023-06-16,Aichacher Zeitung,https://www.aichacher-zeitung.de,Aktuelle Nachrichten aus dem Landkreis Aichach-Friedberg,N/A,Aktuelle Nachrichten für den Landkreis Aichach-Friedberg,N/A,http://schema.org,WebSite,,,Nachrichten aus dem Landkreis Aichach-Friedberg,,,,,,,"[{'@type': 'ListItem', 'position': 1, 'name': 'Startseite', 'item': 'www.donaukurier.de/'}, {'@type': 'ListItem', 'position': 2, 'name': 'Lokales', 'item': 'www.donaukurier.de/lokales'}, {'@type': 'ListItem', 'position': 3, 'name': 'Landkreis Aichach-Friedberg'}]",N/A,N/A,  In eigener Sache   Die Aichacher Zeitung beim Donaukurier: Alle Infos für Nutzer und Abonnenten  ,,,,https://www.donaukurier.de/lokales/landkreis-aichach-friedberg,,,,,#website,Donaukurier,,,,,,,,,,
https://news.google.com/rss/articles/CBMilQFodHRwczovL3d3dy5oYW5kZWxzYmxhdHQuY29tL3VudGVybmVobWVuL2RpZW5zdGxlaXN0ZXIvd2lydHNjaGFmdHNhbndhZWx0ZS1rdWVuc3RsaWNoZS1pbnRlbGxpZ2Vuei1oYWVsdC1laW56dWctaW4td2lydHNjaGFmdHNrYW56bGVpZW4vMjkxOTk1NTIuaHRtbNIBAA?oc=5,KI: Roboter halten Einzug in Wirtschaftskanzleien - Handelsblatt,2023-06-17,Handelsblatt,https://www.handelsblatt.com,Wirtschaftskanzleien stehen vor einer tiefgreifenden Transformation. Die großen Sozietäten investieren viel Geld in Künstliche Intelligenz. Müssen Anwälte nun um ihren Job fürchten?,N/A,Wirtschaftskanzleien stehen vor einer tiefgreifenden Transformation. Die großen Gesellschaften investieren viel Geld in Künstliche Intelligenz. Müssen Anwälte um ihren Job fürchten?,N/A,,,,,,,,,,,,,Unternehmen - Dienstleister,N/A,"WirtschaftsanwälteKünstliche Intelligenz hält Einzug in WirtschaftskanzleienWirtschaftskanzleien stehen vor einer tiefgreifenden Transformation. Die großen Gesellschaften investieren viel Geld in Künstliche Intelligenz. Müssen Anwälte um ihren Job fürchten?Julia Leonhardt 17.06.2023 - 11:00 Uhr















































Schon heute verändert Legal Tech die Rechtsberatung. Die Anwendungsbereiche von KI sind vielfältig. Foto: picture alliance / Westend61 Düsseldorf. Unmengen von Daten analysieren, Verträge aufsetzen, Sachverhalte abgleichen und Schriftsätze verfassen – Aufgaben, die in Wirtschaftskanzleien zum alltäglichen Geschäft gehören. Solche wiederholenden Tätigkeiten kosten Zeit und binden viele Mitarbeiter. Doch das dürfte sich schon bald ändern. Denn die Branche steht vor einem epochalen Umbruch. Der Grund: Künstliche Intelligenz (KI).Schon heute verändert Legal Tech alte Strukturen. Die Anwendungsbereiche von KI in der Rechtsbranche sind vielfältig. KI-basierte Lösungen werden unter anderem bei der Verarbeitung großer Datenmengen, der automatisierten Dokumentenanalyse oder in der Vorbereitung von Gerichtsverfahren eingesetzt. Standardverträge können durch eine KI geschrieben werden.Im Bereich der Textsuche und -auswertung kommt Künstliche Intelligenz bereits heute regelmäßig zum Einsatz. Die Kombination von Software und KI kann bestimmte Prozesse in Wirtschaftskanzleien automatisieren. Auch Massenverfahren können schneller und meist besser bearbeitet werden. Die juristische Aufarbeitung des Dieselskandals mit Hunderttausenden ähnlich gelagerter Klagen ist dafür ein Musterbeispiel.",,,,,,,,,,,,,,,,,,,,
https://news.google.com/rss/articles/CBMibGh0dHBzOi8vd3d3LnBzeWNob2xvZ2llLWhldXRlLmRlL2JlcnVmL2FydGlrZWwtZGV0YWlsYW5zaWNodC80MjY5OS1tYWNodC1rdWVuc3RsaWNoZS1pbnRlbGxpZ2Vuei1laW5zYW0uaHRtbNIBAA?oc=5,KI im Job: Rede ich nur noch mit dem System? - Psychologie Heute,2023-06-19,Psychologie Heute,https://www.psychologie-heute.de,"Unter der Woche abends keinen Alkohol mehr trinken. Jeden Monat zwei Bücher lesen. Einmal die Woche früher nach Hause gehen, um bei der erkrankten Tante vorbeizuschauen: Wenn wir etwas verändern wollen in unserem Leben, unser Verhalten umkrempeln, dann brauchen wir Willensstärke, so eine verbreitete Vorstellung. In Wirklichkeit liegt das Geheimnis dauerhafter Veränderung oft ganz woanders. Wir beleuchten in unserer Titelgeschichte der Juliausgabe die Magie guter Gewohnheiten - und warum sie wie ein zweites Ich wirken.

Freuds Erben: Rückkehr der Psychoanalyse?
Verlassene Eltern: Warum Kinder den Kontakt abbrechen
Arztgespräche: Wie sie auf die Genesung wirken",Arbeit Beruf Einsamkeit Künstliche Intelligenz Soziale Interaktion,"Wer bei der Arbeit nur noch mit künstlicher Intelligenz kommuniziert, tut sich selbst keinen Gefallen. >> zum Beitrag ",N/A,https://schema.org/,Article,2023-06-19,2023-06-19,Macht künstliche Intelligenz einsam? ,,https://www.psychologie-heute.de/beruf/artikel-detailansicht/42699-macht-kuenstliche-intelligenz-einsam.html,"[{'@type': 'Person', 'name': 'Susanne Ackermann', 'url': 'https://www.psychologie-heute.de/autor/susanne-ackermann.html'}]","{'@type': 'Organization', 'name': 'Psychologie Heute', 'logo': {'@type': 'ImageObject', 'url': 'https://www.psychologie-heute.de/fileadmin/psychologie_heute/bilder/logos/logo_psychologie_heute.svg'}}",,https://www.psychologie-heute.de/fileadmin/2317010133899432151.jpg,,N/A,N/A,N/A,,,,https://www.psychologie-heute.de/beruf/artikel-detailansicht/42699-macht-kuenstliche-intelligenz-einsam.html,,,,,,Psychologie Heute 7/2024: Die Straße der guten Gewohnheiten,9783407482471,81751,978-3-407-48247-1,106,"21,2 x 28 x ,594","{'@type': 'Offer', 'availability': 'https://schema.org/InStock', 'itemCondition': 'https://schema.org/NewCondition', 'price': '8.50', 'priceCurrency': 'EUR', 'url': 'https://www.psychologie-heute.de/abo-shop/detailseite/42757-psychologie-heute-72024-die-strasse-der-guten-gewohnheiten.html'}",,,,
https://news.google.com/rss/articles/CBMiaGh0dHBzOi8vd3d3LmJsdWV3aW4uY2gvZGUvZGlnaXRhbC9zby1lcmtsYWVyc3QtZHUtZGVpbmVuLWtpbmRlci1kaWUta3VlbnN0bGljaGUtaW50ZWxsaWdlbnotMTcyNTE3Ny5odG1s0gEA?oc=5,So erklärst du deinen Kinder die künstliche Intelligenz - blue News,2023-06-17,blue News,https://www.bluewin.ch,"Künstliche Intelligenz wie ChatGPT ist allgegenwärtig und bereits in Schulen und Kinderzimmern angekommen. Hier sind Tipps, wie du dein Kind für die Chancen und Risiken sensibilisierst, ohne ChatGPT zu fragen.",,"Künstliche Intelligenz wie ChatGPT ist allgegenwärtig und bereits in Schulen und Kinderzimmern angekommen. Hier sind Tipps, wie du dein Kind für die Chancen und Risiken sensibilisierst, ohne ChatGPT zu fragen.",N/A,http://schema.org,NewsArticle,2023-06-17T07:31:37.351Z,2023-06-17T07:31:37.351Z,So erklärst du deinen Kinder die künstliche Intelligenz,,"{'@type': 'WebPage', '@id': 'https://www.bluewin.ch/de/digital/so-erklaerst-du-deinen-kinder-die-kuenstliche-intelligenz-1725177.html'}","{'@type': 'Organization', 'name': 'blue News', 'sameAs': 'https://www.bluewin.ch'}","{'@type': 'Organization', 'name': 'blue News', 'logo': {'@type': 'ImageObject', 'url': 'https://www.bluewin.ch/assets/images/bluewin_logo.png', 'width': 512, 'height': 512}}",,"{'@type': 'ImageObject', 'url': 'https://production-livingdocs-bluewin-ch.imgix.net/2023/05/03/d54b809c-10a0-4678-a83f-1b81bfee43c2.jpeg?w=994&amp;auto=format', 'height': 1497, 'width': 2048}",,N/A,N/A,N/A,,,,https://www.bluewin.ch/de/digital/so-erklaerst-du-deinen-kinder-die-kuenstliche-intelligenz-1725177.html,,,,,,So erklärst du deinen Kinder die künstliche Intelligenz,,,,,,,https://www.bluewin.ch/assets/images/bluewin_logo.png,"['https://twitter.com/bluenews_de', 'https://twitter.com/blueSport_de', 'https://www.facebook.com/swisscom.blueentertainment', 'https://www.facebook.com/swisscom.bluesport', 'https://www.facebook.com/swisscom.bluecinema', 'https://www.instagram.com/swisscom.blueentertainment', 'https://www.instagram.com/swisscom.bluesport', 'https://www.youtube.com/channel/UCX85rYowvEfiYE8p4VZeyYQ', 'https://www.youtube.com/channel/UCpyQHdmKhMGn3iMPwQOA2Yg']","{'@type': 'Organization', 'name': 'blue Entertainment Programm AG', 'address': 'Löwenstrasse 11 Postfach, 8021 Zürich'}","{'@type': 'SearchAction', 'target': 'https://www.bluewin.ch/de/suche.html#q={query}', 'query-input': 'required name=query'}"
https://news.google.com/rss/articles/CBMicGh0dHBzOi8vd3d3LmhhbmRlbHNibGF0dC5jb20vdGVjaG5pay9pdC1pbnRlcm5ldC9tZWRpemluLXdpZS1raS1kaWUtYmlvdGVjaC1icmFuY2hlLXJldm9sdXRpb25pZXJ0LzI5MjA2MDA2Lmh0bWzSAQA?oc=5,Bio International Convention: Wie KI die Biotech-Branche revolutioniert - Handelsblatt,2023-06-19,Handelsblatt,https://www.handelsblatt.com,Mit Künstlicher Intelligenz will die Biotech-Forschung Krankheiten wie Krebs besiegen. Doch KI in der Medizin bringt neben neuen Ansätzen für Gentherapie auch Gefahren. Die Trends von der Bio International Convention.,N/A,Aufbruchstimmung in der Biotechforschung. Mit Künstlicher Intelligenz wollen Wissenschaftler Krankheiten wie Krebs besiegen. Doch mit der neuen Technik steigen auch die Gefahren.,N/A,,,,,,,,,,,,,Technologie - IT + Telekommunikation,N/A,"MedizinWie KI die Biotech-Branche revolutioniertAufbruchstimmung in der Biotech-Forschung. Mit KI wollen Wissenschaftler Krankheiten wie Krebs besiegen. Doch mit der neuen Technik steigen auch die Gefahren wie durch künstliche Erreger.Felix Holtermann 19.06.2023 - 08:18 Uhr















































Der Kampf gegen Krebs und andere Krankheiten wird von der KI verändert. Zahlreiche Optimisten rechnen mit einer Revolution der Medizin.Boston, New York. Die „Bio International Convention“ ist eine der wichtigen Fachmessen der Biotechbranche. 19.000 Ärzte, Wissenschaftler und Analysten kamen Anfang Juni in Boston zusammen, um über das Neueste vom Neuen zu sprechen.In diesem Jahr war es: „Medical AI“, Künstliche Intelligenz (KI) in der Medizin. Auf den Panels, in Gesprächen und Präsentationen dominierte das Thema: „Überall wird über Künstliche Intelligenz diskutiert“, sagt Stefano Pacifico, Gründer des Biotech-Start-ups Epistemic AI.Der Branche verschafft die KI Optimismus. Mit dem Ende der Covid-Pandemie ebbte auch das außergewöhnlich starke Wachstum von Biotechfirmen ab, die Aktienkurse fielen deutlich, auch im gesamten Technologiebereich.Bio International Convention zeigt die wichtigsten Biotech-Trends",,,,,,,,,,,,,,,,,,,,
