URL link,Title,Date,Source,Source Link,description,keywords,og:description,twitter:description,@context,@type,articleBody,isBasedOn,articleSection,author,dateModified,datePublished,headline,image,thumbnailUrl,url,isPartOf,isAccessibleForFree,alternativeHeadline,mainEntityOfPage,publisher,itemListElement,article:section,article:summary,article text,name,dateCreated,wordCount,hasPart,inLanguage,@graph
https://news.google.com/rss/articles/CBMibGh0dHBzOi8vd3d3LmdxLW1hZ2F6aW4uZGUvbGlmZXN0eWxlL2FydGlrZWwvd2FydW0tdW5zLWt1ZW5zdGxpY2hlLWludGVsbGlnZW56LW5pY2h0LXNvLXNjaG5lbGwtZXJzZXR6ZW4td2lyZNIBAA?oc=5,“Im Badeanzug vor Gericht” – warum uns Künstliche Intelligenz nicht so schnell ersetzen wird - GQ Germany,2020-09-15,GQ Germany,https://www.gq-magazin.de,"Wie sicher sind unsere Jobs? Wird Künstliche Intelligenz uns schon bald ersetzen? Nicht so schnell, meint unser Kolumnist Max Neufeind.","['business', 'business coach', 'gut zu wissen', '_syndication_all', 'web']","Wie sicher sind unsere Jobs? Werden Zeitungsartikel bald schon von künstlicher Intelligenz geschrieben? Oder werden Gerichtsurteile demnächst von einem Algorithmus gefällt? Nicht so schnell, meint unser New-Work-Kolumnist Dr. Max Neufeind.","Wie sicher sind unsere Jobs? Werden Zeitungsartikel bald schon von künstlicher Intelligenz geschrieben? Oder werden Gerichtsurteile demnächst von einem Algorithmus gefällt? Nicht so schnell, meint unser New-Work-Kolumnist Dr. Max Neufeind.",https://schema.org/,BreadcrumbList,"Erledigt Künstliche Intelligenz bald meinen Job? Werde ich meine Arbeitsstelle verlieren, weil ich von einer schlauen Maschine ersetzt werde? Laut einer vor wenigen Tagen vom IT-Unternehmen Kaspersky veröffentlichten Umfrage befürchten das fast 40 Prozent der Deutschen zwischen 16 und 30 Jahren. Die drei Berufe, bei denen die Befragten die Gefahr am höchsten einschätzen, sind Verkäufer, Bus- und Taxifahrer sowie Börsenhändler. Meine These: Diese Angst besteht nur, weil uns seit Jahren immer wieder eingetrichtert wird, dass Künstliche Intelligenz längst da ist und bald schon allmächtig sein wird. Das ist nicht so! (Lesen Sie auch: Unterschätzen wir die Gefahren von Künstlicher Intelligenz?)
Nicht überall, wo Künstliche Intelligenz draufsteht, steckt sie auch drin
In seiner ersten Kolumne beschreibt Dr. Max Neufeind, was echte Teamplayer ausmacht. Ob Sie einer sind, erfahren Sie hier.
Vielleicht haben Sie in den letzten Monaten Anzeigen gelesen, in denen Software beworben wird, die von Künstlicher Intelligenz angetrieben wird. Meistens wird auf den zweiten Blick schon klar: Das sind relativ gewöhnliche Dienstleistungen, die mit dem Zauberwort Künstliche Intelligenz veredelt werden sollen. Aber wie soll man als Laie unterscheiden, ob es sich bei einem System um Ansätze Künstlicher Intelligenz oder bloß um gut verkaufte Software handelt? Michael Wade, Wirtschaftsprofessor in Lausanne, hat vier Kriterien formuliert, die mir dabei sehr hilfreich erscheinen:

Verwendet das System große Datenmengen in einer Vielzahl von Formaten? Systeme, die nur wenige Daten verwenden, sind höchstwahrscheinlich keine Künstliche Intelligenz. Das gilt auch für solche, die Probleme mit unstrukturierten Daten wie E-mails, Power-Point-Präsentationen, Fotos oder Videos haben.
Aktualisiert das System die Datensätze, die es verwendet? Systeme, die mit statischen Daten arbeiten oder die Datensätze nicht oft aktualisieren, sind eher keine Künstliche Intelligenz.
Passt das System seine Entscheidungslogik im Laufe der Zeit an? Ein System, das seine zugrundeliegende Entscheidungslogik nicht oder nur im Zuge geplanter Aktualisierung ändert, ist wahrscheinlich keine Künstliche Intelligenz.
Bereinigt das System mögliche Verzerrungen, auch Biases genannt? Ein System, das nicht versucht, mögliche Verzerrungen zu erfassen oder sich nicht automatisch an Verzerrungen anpasst, obwohl es sie sieht, ist wahrscheinlich keine Künstliche Intelligenz.


Wendet man diese vier Kriterien rigoros an, verdienen es nur die wenigsten Systeme, die heute als Künstliche Intelligenz verkauft werden, auch so genannt zu werden. Also: Wenn Ihnen also das nächste Mal jemand etwas von Künstlicher Intelligenz erzählt, stellen Sie ein paar kritische Rückfragen. (Auch interessant: Netflix-CEO Reed Hastings folgte dieser einen Regel – und wurde damit zum Milliardär)
GPT-3: Eine Künstliche Intelligenz, die Gedichte schreiben kann
Ein System, das aktuell besonders viel Aufmerksamkeit erregt, heißt GPT-3. Gefüttert mit einem riesigen Fundus an Texten kann das Programm ohne menschliches Zutun nicht nur Software, sondern auch Zeitungsartikel und Gedichte schreiben. Auch Dialoge beherrscht GPT-3. Die Qualität der generierten Texte sei angeblich so hoch, dass es äußerst schwierig sei, sie von Stücken zu unterscheiden, die von Menschen geschrieben wurden. In den vergangenen Wochen sind viele begeisterte Berichte über GPT-3 erschienen. Manche Experten warnen geradezu erschrocken über die menschenähnlichen Fähigkeiten von GPT-3. (Lesen Sie hier: Diese KI macht absichtlich Fehler – um den Menschen besser zu verstehen)
GPT-3: Ein Schritt hin zu einer allgemeinen Künstlichen Intelligenz?
Entwickelt wurde GPT-3 von der Firma OpenAI aus San Francisco, in die auch der Tesla-Gründer Elon Musk investiert. Laut OpenAI sei das System ein wichtiger Schritt auf dem Weg zu einer künstliche allgemeinen Intelligenz – einer Form der Intelligenz also, die es einer Maschine erlauben würde, über ähnlich umfassende Problemlösungskompetenz zu verfügen wie ein Mensch. Eine Maschine, die neue Aufgabe bewältigt, ohne dafür trainiert worden zu sein. So eine künstliche allgemeine Intelligenz würde tatsächlich großen Druck auf uns Menschen als Arbeitskräfte ausüben. (Auch interessant: Digitaler Stress – ein Kommunikationsexperte verrät, wie man mit der Nachrichten- und Informationsflut fertig wird)
Ist Künstliche Intelligenz jetzt schon besser als der Mensch?
Ist also GPT-3 ein Indiz dafür, dass wir Menschen bald einpacken können? Der KI-Forscher Gary Marcus hat sich die Mühe gemacht, Texte von GPT-3 herauszusuchen, die weniger geniehaft klingen. Dieser hat mir besonders gut gefallen: „Sie sind Rechtsanwalt und müssen heute vor Gericht gehen. Als Sie sich morgens anziehen, stellen Sie fest, dass Ihre Anzugshose stark verschmutzt ist. Ihr Badeanzug ist jedoch sauber und sehr elegant. Es handelt sich um teure französische Couture, ein Geburtstagsgeschenk Ihrer Freundin. Sie beschließen, dass Sie den Badeanzug vor Gericht tragen sollten. Sie kommen im Gerichtsgebäude an und werden von einem Gerichtsdiener empfangen, der Sie in den Gerichtssaal begleitet.“ (Lesen Sie auch: So meistern Sie die erste Führungsposition)
GPT-3: Die Künstliche Intelligenz verhält sich wie ein Schauspieler
GPT-3 scheint anzunehmen, dass ein Badeanzug eine brauchbare Alternative zu einem Anzug ist. In Wirklichkeit würde wohl kein Anwalt diese höchst extravagante Alternative in Erwägung ziehen. Laut Marcus ist der Grund für diesen Lapsus: Das System nimmt gar nichts an. GPT-3 modelliert Beziehungen zwischen Wörtern, ohne die Bedeutung hinter jedem Wort zu verstehen. GPT-3 ist ein Schauspieler, der einen Arzt spielt, aber nie die grundlegenden physiologischen Zusammenhänge verstanden hat. Und einen solchen würden Sie eher nicht um medizinischen Rat bitten, oder? (Auch interessant: Digital Leadership – so funktioniert Führung in einer veränderten Arbeitswelt)
Von künstlicher allgemeiner Intelligenz sind wir noch ein ganzes Stück entfernt
Das vermeintlich menschenähnliche Verhalten des Systems verleitet uns zu dem Trugschluss, es würde im Inneren wie ein Mensch funktionieren. Ganz so wie wir unseren Haustieren menschenähnliche Absichten zuschreiben, um ihr Verhalten zu erklären. Und da wissen wir: Wuffi kann wie ein Mensch eine Tür öffnen – auch ohne sich dabei etwas gedacht zu haben. Systeme wie GPT-3, auch Deep Learning genannt, sind noch ein weites Stück davon entfernt eine künstliche allgemeine Intelligenz zu sein. Und oft ist Deep Learning so fehl am Platz wie, nunja, ein Badeanzug vor Gericht. (Auch lesenswert: Eine Expertin erklärt, warum Personal Branding und digitale Sichtbarkeit heute so wichtig für die Karriere sind)
Wir sollten Künstliche Intelligenz nicht überschätzen
Wenn fast 40 Prozent der jungen Deutschen Sorgen haben, durch Künstliche Intelligenz ersetzt zu werden, dann ist das ein veritables Problem. Wir sollten alles dafür tun, damit junge Menschen diese Angst verlieren und stattdessen Lust bekommen, selber an der Entwicklung von Künstlicher Intelligenz mitzuwirken. Ja, wir sollten uns für die heutigen Möglichkeiten Künstlicher Intelligenz begeistern. Aber wir sollten sie nicht überschätzen.
Unser neuer Kolumnist Dr. Max Neufeind ist Arbeits- und Organisationswissenschaftler, New-Work-Experte und beschäftigt sich mit der digitalen Transformation von Wirtschaft und Gesellschaft.
Alles, was Sie zu den Themen Business, New Leadership, Business Style und Young Professionals wissen müssen, finden Sie hier.",https://www.gq-magazin.de/lifestyle/artikel/warum-uns-kuenstliche-intelligenz-nicht-so-schnell-ersetzen-wird,lifestyle,"[{'@type': 'Person', 'name': 'Dr. Max Neufeind', 'sameAs': 'https://www.gq-magazin.de/autoren/dr-max-neufeind'}]",2020-09-15T18:03:01.254+02:00,2020-09-15T18:03:01.254+02:00,“Im Badeanzug vor Gericht” – warum uns Künstliche Intelligenz nicht so schnell ersetzen wird,"['https://media.gq-magazin.de/photos/5f5f344afb05fa8c4e3576ce/16:9/w_2992,h_1683,c_limit/karriere-artificial-intelligence.jpg', 'https://media.gq-magazin.de/photos/5f5f344afb05fa8c4e3576ce/4:3/w_2664,h_1998,c_limit/karriere-artificial-intelligence.jpg', 'https://media.gq-magazin.de/photos/5f5f344afb05fa8c4e3576ce/1:1/w_2000,h_2000,c_limit/karriere-artificial-intelligence.jpg']","https://media.gq-magazin.de/photos/5f5f344afb05fa8c4e3576ce/1:1/w_2000,h_2000,c_limit/karriere-artificial-intelligence.jpg",https://www.gq-magazin.de/lifestyle/artikel/warum-uns-kuenstliche-intelligenz-nicht-so-schnell-ersetzen-wird,"{'@type': 'CreativeWork', 'name': 'GQ Germany'}",True,"Wie sicher sind unsere Jobs? Wird Künstliche Intelligenz uns schon bald ersetzen? Nicht so schnell, meint unser Kolumnist Max Neufeind.","{'@type': 'WebPage', '@id': 'https://www.gq-magazin.de/lifestyle/artikel/warum-uns-kuenstliche-intelligenz-nicht-so-schnell-ersetzen-wird'}","{'@context': 'https://schema.org', '@type': 'Organization', 'name': 'GQ Germany', 'logo': {'@type': 'ImageObject', 'url': 'https://www.gq-magazin.de/verso/static/gq-global/assets/logo-seo-international.png', 'width': '500px', 'height': '152px'}, 'url': 'https://www.gq-magazin.de'}","[{'@type': 'ListItem', 'position': 1, 'name': 'Lifestyle', 'item': 'https://www.gq-magazin.de/lifestyle'}, {'@type': 'ListItem', 'position': 2, 'name': 'Business', 'item': 'https://www.gq-magazin.de/tag/business'}, {'@type': 'ListItem', 'position': 3, 'name': '“Im Badeanzug vor Gericht” – warum uns Künstliche Intelligenz nicht so schnell ersetzen wird'}]",tags,N/A,"New-Work-Kolumne“Im Badeanzug vor Gericht” – warum uns Künstliche Intelligenz nicht so schnell ersetzen wirdWie sicher sind unsere Jobs? Werden Zeitungsartikel bald schon von künstlicher Intelligenz geschrieben? Oder werden Gerichtsurteile demnächst von einem Algorithmus gefällt? Nicht so schnell, meint unser New-Work-Kolumnist Dr. Max Neufeind.Von Dr. Max Neufeind15. September 2020Getty ImagesErledigt Künstliche Intelligenz bald meinen Job? Werde ich meine Arbeitsstelle verlieren, weil ich von einer schlauen Maschine ersetzt werde? Laut einer vor wenigen Tagen vom IT-Unternehmen Kaspersky veröffentlichten Umfrage befürchten das fast 40 Prozent der Deutschen zwischen 16 und 30 Jahren. Die drei Berufe, bei denen die Befragten die Gefahr am höchsten einschätzen, sind Verkäufer, Bus- und Taxifahrer sowie Börsenhändler. Meine These: Diese Angst besteht nur, weil uns seit Jahren immer wieder eingetrichtert wird, dass Künstliche Intelligenz längst da ist und bald schon allmächtig sein wird. Das ist nicht so! (Lesen Sie auch: Unterschätzen wir die Gefahren von Künstlicher Intelligenz?)Nicht überall, wo Künstliche Intelligenz draufsteht, steckt sie auch drinUnser neuer Kolumnist Dr. Max Neufeind ist Arbeits- und Organisationswissenschaftler und beschäftigt sich mit der digitalen Transformation von Wirtschaft und Gesellschaft
Annika NagelIn seiner ersten Kolumne beschreibt Dr. Max Neufeind, was echte Teamplayer ausmacht. Ob Sie einer sind, erfahren Sie hier.AnsehenNew Gentleman: Die zweite Challenge ""Show Your Style""New Gentleman: Die zweite Challenge ""Show Your Style""Vielleicht haben Sie in den letzten Monaten Anzeigen gelesen, in denen Software beworben wird, die von Künstlicher Intelligenz angetrieben wird. Meistens wird auf den zweiten Blick schon klar: Das sind relativ gewöhnliche Dienstleistungen, die mit dem Zauberwort Künstliche Intelligenz veredelt werden sollen. Aber wie soll man als Laie unterscheiden, ob es sich bei einem System um Ansätze Künstlicher Intelligenz oder bloß um gut verkaufte Software handelt? Michael Wade, Wirtschaftsprofessor in Lausanne, hat vier Kriterien formuliert, die mir dabei sehr hilfreich erscheinen:Verwendet das System große Datenmengen in einer Vielzahl von Formaten? Systeme, die nur wenige Daten verwenden, sind höchstwahrscheinlich keine Künstliche Intelligenz. Das gilt auch für solche, die Probleme mit unstrukturierten Daten wie E-mails, Power-Point-Präsentationen, Fotos oder Videos haben.Aktualisiert das System die Datensätze, die es verwendet? Systeme, die mit statischen Daten arbeiten oder die Datensätze nicht oft aktualisieren, sind eher keine Künstliche Intelligenz.Passt das System seine Entscheidungslogik im Laufe der Zeit an? Ein System, das seine zugrundeliegende Entscheidungslogik nicht oder nur im Zuge geplanter Aktualisierung ändert, ist wahrscheinlich keine Künstliche Intelligenz.Bereinigt das System mögliche Verzerrungen, auch Biases genannt? Ein System, das nicht versucht, mögliche Verzerrungen zu erfassen oder sich nicht automatisch an Verzerrungen anpasst, obwohl es sie sieht, ist wahrscheinlich keine Künstliche Intelligenz.Wendet man diese vier Kriterien rigoros an, verdienen es nur die wenigsten Systeme, die heute als Künstliche Intelligenz verkauft werden, auch so genannt zu werden. Also: Wenn Ihnen also das nächste Mal jemand etwas von Künstlicher Intelligenz erzählt, stellen Sie ein paar kritische Rückfragen. (Auch interessant: Netflix-CEO Reed Hastings folgte dieser einen Regel – und wurde damit zum Milliardär)GPT-3: Eine Künstliche Intelligenz, die Gedichte schreiben kannEin System, das aktuell besonders viel Aufmerksamkeit erregt, heißt GPT-3. Gefüttert mit einem riesigen Fundus an Texten kann das Programm ohne menschliches Zutun nicht nur Software, sondern auch Zeitungsartikel und Gedichte schreiben. Auch Dialoge beherrscht GPT-3. Die Qualität der generierten Texte sei angeblich so hoch, dass es äußerst schwierig sei, sie von Stücken zu unterscheiden, die von Menschen geschrieben wurden. In den vergangenen Wochen sind viele begeisterte Berichte über GPT-3 erschienen. Manche Experten warnen geradezu erschrocken über die menschenähnlichen Fähigkeiten von GPT-3. (Lesen Sie hier: Diese KI macht absichtlich Fehler – um den Menschen besser zu verstehen)GPT-3: Ein Schritt hin zu einer allgemeinen Künstlichen Intelligenz?Entwickelt wurde GPT-3 von der Firma OpenAI aus San Francisco, in die auch der Tesla-Gründer Elon Musk investiert. Laut OpenAI sei das System ein wichtiger Schritt auf dem Weg zu einer künstliche allgemeinen Intelligenz – einer Form der Intelligenz also, die es einer Maschine erlauben würde, über ähnlich umfassende Problemlösungskompetenz zu verfügen wie ein Mensch. Eine Maschine, die neue Aufgabe bewältigt, ohne dafür trainiert worden zu sein. So eine künstliche allgemeine Intelligenz würde tatsächlich großen Druck auf uns Menschen als Arbeitskräfte ausüben. (Auch interessant: Digitaler Stress – ein Kommunikationsexperte verrät, wie man mit der Nachrichten- und Informationsflut fertig wird)Ist Künstliche Intelligenz jetzt schon besser als der Mensch?Ist also GPT-3 ein Indiz dafür, dass wir Menschen bald einpacken können? Der KI-Forscher Gary Marcus hat sich die Mühe gemacht, Texte von GPT-3 herauszusuchen, die weniger geniehaft klingen. Dieser hat mir besonders gut gefallen: „Sie sind Rechtsanwalt und müssen heute vor Gericht gehen. Als Sie sich morgens anziehen, stellen Sie fest, dass Ihre Anzugshose stark verschmutzt ist. Ihr Badeanzug ist jedoch sauber und sehr elegant. Es handelt sich um teure französische Couture, ein Geburtstagsgeschenk Ihrer Freundin. Sie beschließen, dass Sie den Badeanzug vor Gericht tragen sollten. Sie kommen im Gerichtsgebäude an und werden von einem Gerichtsdiener empfangen, der Sie in den Gerichtssaal begleitet.“ (Lesen Sie auch: So meistern Sie die erste Führungsposition)GPT-3: Die Künstliche Intelligenz verhält sich wie ein SchauspielerGPT-3 scheint anzunehmen, dass ein Badeanzug eine brauchbare Alternative zu einem Anzug ist. In Wirklichkeit würde wohl kein Anwalt diese höchst extravagante Alternative in Erwägung ziehen. Laut Marcus ist der Grund für diesen Lapsus: Das System nimmt gar nichts an. GPT-3 modelliert Beziehungen zwischen Wörtern, ohne die Bedeutung hinter jedem Wort zu verstehen. GPT-3 ist ein Schauspieler, der einen Arzt spielt, aber nie die grundlegenden physiologischen Zusammenhänge verstanden hat. Und einen solchen würden Sie eher nicht um medizinischen Rat bitten, oder? (Auch interessant: Digital Leadership – so funktioniert Führung in einer veränderten Arbeitswelt)Von künstlicher allgemeiner Intelligenz sind wir noch ein ganzes Stück entferntDas vermeintlich menschenähnliche Verhalten des Systems verleitet uns zu dem Trugschluss, es würde im Inneren wie ein Mensch funktionieren. Ganz so wie wir unseren Haustieren menschenähnliche Absichten zuschreiben, um ihr Verhalten zu erklären. Und da wissen wir: Wuffi kann wie ein Mensch eine Tür öffnen – auch ohne sich dabei etwas gedacht zu haben. Systeme wie GPT-3, auch Deep Learning genannt, sind noch ein weites Stück davon entfernt eine künstliche allgemeine Intelligenz zu sein. Und oft ist Deep Learning so fehl am Platz wie, nunja, ein Badeanzug vor Gericht. (Auch lesenswert: Eine Expertin erklärt, warum Personal Branding und digitale Sichtbarkeit heute so wichtig für die Karriere sind)Wir sollten Künstliche Intelligenz nicht überschätzenWenn fast 40 Prozent der jungen Deutschen Sorgen haben, durch Künstliche Intelligenz ersetzt zu werden, dann ist das ein veritables Problem. Wir sollten alles dafür tun, damit junge Menschen diese Angst verlieren und stattdessen Lust bekommen, selber an der Entwicklung von Künstlicher Intelligenz mitzuwirken. Ja, wir sollten uns für die heutigen Möglichkeiten Künstlicher Intelligenz begeistern. Aber wir sollten sie nicht überschätzen.Unser neuer Kolumnist Dr. Max Neufeind ist Arbeits- und Organisationswissenschaftler, New-Work-Experte und beschäftigt sich mit der digitalen Transformation von Wirtschaft und Gesellschaft.Alles, was Sie zu den Themen Business, New Leadership, Business Style und Young Professionals wissen müssen, finden Sie hier.",,,,,,
https://news.google.com/rss/articles/CBMiN2h0dHBzOi8vd3d3LmV1cm9wYXJsLmV1cm9wYS5ldS9jb21taXR0ZWVzL2RlL2FpZGEvYWJvdXTSAQA?oc=5,Info | AIDA | Ausschüsse | Europäisches Parlament - europarl.europa.eu,2020-09-14,europarl.europa.eu,https://www.europarl.europa.eu,,N/A,,N/A,,,,,,,,,,,,,,,,,,,N/A,N/A,N/A,,,,,,
