URL link,Title,Date,Source,Source Link,description,keywords,og:description,twitter:description,image,articleBody,author,@type,about,dateModified,isAccessibleForFree,isPartOf,mainEntityOfPage,@context,datePublished,alternativeHeadline,publisher,category,headline,articleSection,article:section,article:summary,article text,itemListElement,name,@graph
https://news.google.com/rss/articles/CBMimgFodHRwczovL3d3dy5oYW5kZWxzYmxhdHQuY29tL3RlY2huaWsvbWVkaXppbi9pbWFnZWJpb3BzeS1kaWVzZS1ncnVlbmRlci1oZWxmZW4tcmFkaW9sb2dlbi1taXQta3VlbnN0bGljaGVyLWludGVsbGlnZW56LWJlaS1kZXIta25vY2hlbmFyYmVpdC8yNzUyNDU4Ni5odG1s0gEA?oc=5,Imagebiopsy: KI hilft Radiologen bei der Knochenarbeit - Handelsblatt,2021-08-19,Handelsblatt,https://www.handelsblatt.com,Die Analyse von Röntgenbildern ist aufwendig und fehleranfällig. Ein Algorithmus des Wiener Jungunternehmens Imagebiopsy soll helfen.,N/A,Die Analyse von Röntgenbildern ist aufwendig und fehleranfällig. Ein Algorithmus des Wiener Jungunternehmens Imagebiopsy soll helfen.,N/A,,,,,,,,,,,,,,,,,Technologie - Medizin + Gesundheit,N/A,"ImagebiopsyDiese Gründer helfen Radiologen mit Künstlicher Intelligenz bei der KnochenarbeitDie Analyse von Röntgenbildern ist aufwendig und fehleranfällig. Ein Algorithmus des Wiener Jungunternehmens Imagebiopsy soll helfen.Daniel Imwinkelried, Britta Rybicki, Lukas Hoffmann 19.08.2021 - 14:52 Uhr















































Osteoporose trifft viele Menschen, doch die Erkrankung wird oft erst spät diagnostiziert. Foto: Hero Images/Getty Images Wien, Düsseldorf. Treten Radiologen im Krankenhaus ihre Morgenschicht an, stapeln sich nicht selten die Röntgenbilder der Nacht zuvor auf ihren Pulten. Dann sind schnelle, vor allem aber fundierte Entscheidungen gefragt: Welche Knochenverletzung ist beispielsweise gravierender, sodass eine Operation angebracht ist? Und welche Bilder soll der Radiologe überhaupt zuerst anschauen?Künstliche Intelligenz (KI) lautet das Zauberwort – wie mittlerweile fast überall, wo rasch Informationen verarbeitet werden müssen. Das vor fünf Jahren gegründete Wiener Unternehmen Imagebiopsy hat einen Algorithmus entwickelt, der anhand der Röntgenbilder analysiert, wie es im Knochen aussieht. „Unsere Software erstellt einen standardisierten Rapport, beispielsweise um eine Kniearthrose zu beurteilen“, sagt Firmenchef und Mitgründer Richard Ljuhar.Die Analyse mittels KI dient dabei nicht nur dem Zweck der effizienten Diagnose, sie macht diese auch genauer. Gemeinhin gilt die Medizin als exakte Naturwissenschaft. Aber menschengemachte Diagnosen sind oft nicht so eindeutig, wie Patienten glauben. „Radiologen und Orthopäden schauen ein Röntgenbild an und kommen nicht selten zu unterschiedlichen Schlüssen“, sagt der Ingenieur Ljuhar. „Oft handelt es sich bei einer Diagnose um eine subjektive Einschätzung.“Und so müssen sich beispielsweise Patienten mit Kniebeschwerden einer Operation unterziehen, obwohl es gereicht hätte, wenn sie ihr Gewicht reduziert hätten, um das Gelenk zu schonen. „KI verbreitert in solchen Fällen das Wissen“, sagt Ljuhar.Praktische Mediziner stimmen dieser Ansicht zu. „Menschen sind schlecht darin, Dinge exakt zu quantifizieren“, sagt Felix Nensa, Oberarzt der Radiologie der Uniklinik Essen und IT-Spezialist. „In der Muskel-Skelett-Bildgebung wird die Quantifizierung immer wichtiger.“ Deshalb setzt Imagebiopsy laut Nensa auf die richtige Technik.Auch in Deutschland hat man das Potenzial kluger Radiologie-Befundung erkannt. Das Münchener Unternehmen Smart Reporting hat im vergangenen Jahr eine Finanzspritze von 15 Millionen Euro erhalten. Das Heidelberger Unternehmen Mint Medical, ebenfalls auf strukturierte Radiologie-Software spezialisiert, wurde im März von dem Medizinsoftware-Unternehmen Brainlab aufgekauft. Und das Berliner Unternehmen Neo-Q mit seiner Software Radio Report ist ebenfalls darauf aus, Marktanteile zu erobern.Unternehmen, die eine Radiologie-KI trainieren, haben eine Herausforderung zu meistern: Es ist schwierig, an gute, also strukturierte Daten zu kommen. Der Radiologe spricht seine Einschätzung eines Röntgenbilds oft frei in ein Diktiergerät. Manchmal ist seine Interpretation zwei Sätze lang, manchmal füllt sie mehrere Seiten. Unternehmen wie Smart Reporting oder Neo-Q haben eine Radiologie-Software mit Textbausteinen entwickelt. Der Arzt diktiert nicht mehr, er klickt sich durch und produziert so strukturierte Daten für die KI.Die Suche nach IT-Spezialisten ist auch in Wien ein DauerthemaImagebiopsy klingt zwar nach steriler Medizin, aber in den Wiener Büros des Unternehmens herrscht die typische Gründerstimmung einer IT-Firma. Ljuhar und der Leiter Produktentwicklung, Christoph Götz, sind in kurzen Hosen unterwegs und schweben in Socken über das Parkett.So klischeehaft das nach Start-up-Unternehmen klingen mag: Umgekehrt haben die Gründer von Imagebiopsy ebenfalls fixe Vorstellungen davon, wie es bei etablierten Firmen zugeht. Zum Leidwesen der beiden Jungunternehmer hat man soeben einen Spezialisten für KI an eine Bank in Zürich verloren. Dort verdiene man zwar mehr als in Wien, aber er frage sich, wie man in Anzug und Krawatte programmieren könne, feixt Götz.Verwandte Themen
 USA



 Folgen  Inside Digital Health



 Folgen  Start-ups



 Folgen  Österreich



 Folgen  Künstliche Intelligenz



 Folgen  Medizin



 Folgen 















Die Gründer von Imagebiopsy haben fixe Vorstellungen davon, wie es bei etablierten Firmen zugeht.  Foto: Unternehmen Die Suche nach IT-Spezialisten ist auch bei der Wiener Jungfirma ein Dauerthema. Den Eignern ist bewusst, dass man mit den Löhnen in München oder Zürich nicht mithalten kann. Ljuhar mag trotzdem nicht über den Fachkräftemangel klagen. Das Kultur- und Freizeitangebot sei in Österreichs Hauptstadt riesig, und im Vergleich zu gewissen Großstädten in den beiden deutschsprachigen Nachbarländern hat Wien einen Vorteil: Wohnen ist vergleichsweise günstig.Das ist gerade für Post-Docs und junge Akademiker aus Zentral- und Osteuropa ein Argument. Und so setzt sich der 40-köpfige Mitarbeiterbestand von Imagebiopsy aus Angehörigen von zehn Nationalitäten zusammen.Die nächste Förderrunde ist in den USA geplantWeiter internationalisieren will Ljuhar auch das Geschäft. Die Firma hat knapp über 100 Kunden, wobei die deutschsprachigen Länder einen Schwerpunkt bilden. Zu den Investoren der ersten Stunde gehören ferner die deutsch-österreichische Private-Equity-Firma Apex Ventures sowie AWS, ein Förderfonds der Republik Österreich. „Die nächste Investitionsrunde wird aber in den USA stattfinden“, sagt Ljuhar.Dieses Land ist für ein Unternehmen der Medtech-Branche in mancher Hinsicht ein attraktiverer Markt als Europa. Auf dem alten Kontinent ist das Zulassungsprozedere vergleichsweise aufwendig, etwa wegen der vielen Sprachen. Produktbeschreibungen müssen aufwendig übersetzt werden. Mehr zum Thema lesen Sie exklusiv in Handelsblatt Inside Digital Health, dem Fachbriefing zur digitalen Revolution im Gesundheitswesen. Melden Sie sich hier an.



Die Vereinigten Staaten dagegen sind ein einheitlicher Markt. „Europa ist gut, um Erfahrungen zu sammeln und zu lernen“, sagt Ljuhar. „Aber das große Geschäft macht man in den USA.“ Dort gibt es gewichtige Gesundheits- und Klinikorganisationen, und sobald ein Unternehmen mit einer von ihnen ins Geschäft gekommen ist, kann es sein Angebot skalieren.Dabei setzt Ljuhar in den USA auch auf „altgediente Vertriebler“. Diese seien vielleicht nicht in jedem Fall die schnellsten, würden sich aber auskennen und hätten Beziehungen. Für reife Semester ist das beruhigend zu hören – ihre Erfahrung ist offenbar auch bei Jungunternehmen noch gefragt.Mehr: Die systematische Auswertung von MRT- oder CT-Bildern könnte die medizinische Diagnose revolutionieren. Noch sind nicht alle Ärzte überzeugt.Zur StartseiteNachricht an die Redaktion",,,
https://news.google.com/rss/articles/CBMiTWh0dHBzOi8vd3d3LnNjaW5leHguZGUvbmV3cy90ZWNobmlrL21vb3Jlcy1sYXctd2VsbGVuLXN0YXR0LWV4cG9uZW50aWFsa3VydmUv0gEA?oc=5,Moore's Law: Wellen statt Exponentialkurve - Miniaturisierung von Mikrochips verlief in sechs Wellen – wie viele ... - scinexx | Das Wissensmagazin,2021-08-19,scinexx | Das Wissensmagazin,https://www.scinexx.de,"Anders als gedacht: Nach dem berühmten ""Mooreschen Gesetz"" soll die Miniaturisierung von Computerchips exponentiell verlaufen. Doch stattdessen zeigt die",N/A,"Anders als gedacht: Nach dem berühmten ""Mooreschen Gesetz"" soll die Miniaturisierung von Computerchips exponentiell verlaufen. Doch stattdessen zeigt die",N/A,,,,,,,,,,https://schema.org,,,,,,,N/A,N/A,"


 
Technik
Moore’s Law: Wellen statt Exponentialkurve

			Miniaturisierung von Mikrochips verlief in sechs Wellen – wie viele bleiben noch?		
19. August 2021, Lesezeit: 4 Min.


Wie lange lassen sich Silizium-Mikrochips noch miniaturisieren? © Andy/ Getty images















Vorlesen



Anders als gedacht: Nach dem berühmten „Mooreschen Gesetz“ soll die Miniaturisierung von Computerchips exponentiell verlaufen. Doch stattdessen zeigt die Mikrochip-Entwicklung seit 1959 sechs regelmäßige Wellen, wie eine Analyse enthüllt. Demnach verzehnfachte sich die Transistorendichte jeweils im Laufe von sechs Jahren, dann folgten drei Jahre der Stagnation. Der nächste Schub wäre inzwischen überfällig, doch er könnte der letzte für die Silizium-Technologie sein, so das Forscherteam im Fachmagazin „PLoS ONE“.
Im Jahr 1965 prognostizierte der US-Ingenieur Gordon Moore, dass die künftige Miniaturisierung der Computerschaltkreise einer exponentiellen Kurve folgen würde: Alle zwei Jahre sollte sich die Zahl der Transistoren auf einem integrierten Schaltkreis verdoppeln. Teilweise wird das Mooresche Gesetz auch auf Transistoren pro Flächeneinheit bezogen. Tatsächlich haben sich die Chipkomponenten inzwischen so verkleinert, dass sie nur noch wenige Nanometer groß sind.
Moore’s Law auf dem Prüfstand
Aber wie gut trifft Moore’s Law wirklich auf die vergangene Entwicklung zu? Und was sagt dies für die Zukunft aus? Das haben nun David Burg und Jesse Asubel von der Rockefeller University in New York untersucht. Dafür werteten sie die Daten der Chip-Hersteller Fairchild und Intel von 1959 bis heute aus – beides Firmen, an denen Moore einst selbst beteiligt war. Aus den Daten rekonstruierten sie den Verlauf der Transistordichte pro Flächeneinheit.
Diese logarithmische Darstellung zeigt die Beschleunigungsphasen der sechs Miniaturisierungs-Wellen. © Burg und Asubel/ PLoS ONE, CC-by-sa 4.0
Das Ergebnis: Grob betrachtet scheint das Mooresche Gesetz zu stimmen, wenngleich die Steigung der Kurve zwei Phasen zeigt: Bis 1973 verdoppelte sich die Transistordichte im Schnitt alle 17 Monate, danach alle 33 Monate, wie die Forscher feststellten. Doch bei näherer Analyse zeigten sich weitere Auffälligkeiten: „Statt der typischen Beschleunigungsmerkmale einer Exponentialkurve zeigen die Daten Fluktuationen mit mehreren Phasen einer klaren Verlangsamung“, berichten Burg und Asubel.
Entwicklung in sechs Wellen
Diese Schwankungen entpuppten sich als verblüffend regelmäßige Wellen: Seit 1959 hat die Chipentwicklung sechs Phasen der beschleunigten Miniaturisierung durchlaufen, auf die jeweils eine Phase der Stagnation folgte. „Während jeder Welle erhöhte sich die Transistordichte innerhalb von sechs Jahren um das Zehnfache, dann stagnierte die Entwicklung drei Jahre lang“, so das Team.Anzeige
Motor dieser Wellen waren jeweils entscheidende Innovationen in der Chipproduktion, wie die Forscher berichten: Die erste Phase folgte der Erfindung des Siliziumtransistors und der Fotolithografie durch die Bell Labs, die zweite begann, nachdem im Jahr 1964 der erste Metalloxid-Halbleiter-Feldeffekt-Transistor (MOSFET) patentiert worden war. Die dritte Welle wurde durch die 1971 von Intel implementierte Silizium-Gate-Technologie (SGT) initiiert.
Die vierte Welle beruht auf der Patentierung der Kurzkanal-MOS (HMOS) im Jahr 1977, die erneut eine Verdichtung der Transistoren auf den Mikrochips ermöglichte. 1989 folgte mit der Markteinführung des 80486-Chips mit Cache und Mathe-Coprozessor ein weiterer Miniaturisierungsschub. Während er 1990er Jahre begann dann die sechste Welle mit der Entwicklung der Tiefen UV-Exzimerlaser-Lithografie, die eine weitere Verkleinerung der Schaltkreise ermöglichte. „Alle seit 1998 produzierten Prozessoren beruhen auf dieser Technologe“, so die Forscher.
Wann ist Schluss für das Silizium?
Seither allerdings stockt die Entwicklung: „Während der letzten zwei Dekaden haben sich die Fortschritte in der Transistor-Miniaturisierung substanziell verlangsamt“, berichten Burg und Asubel. Zwar gab es technische Entwicklungen, durch die die Transistordichte und Prozessorleistung weiter gestiegen ist, aber physikalische Effekte und immer höhere Kosten erschweren die weitere Miniaturisierung.
„Beruhend auf unseren Analysen wäre der nächste Schub in der Transistor-Miniaturisierung überfällig“, konstatieren die Wissenschaftler. Sie halten aber für durchaus wahrscheinlich, dass den Silizium-Chips nur noch ein oder zwei solcher Wellen bleiben, bis sie von einer neuen Technologie abgelöst werden: „Wir haben sechs Wellen von jeweils besserer Silizium-Technologie durchlaufen, aber jetzt könnte der Abschied aus den Hügeln und Tälern des Siliziums und der Wechsel in die Landschaften anderer Materialien und Prozesse bevorstehen.“
Was kommt als nächstes?
Tatsächlich sind bereits zahlreiche alternative Technologien in der Erprobung: Forscher experimentieren mit Speichern und Schaltkreisen aus einzelnen Atomen, Transistoren aus Nanoröhrchen oder Elektronenspins als Recheneinheiten. Auch photonische Bauteile und Mikrochips sind in der Forschung. Parallel dazu entwickeln sich Quantencomputer und die quantenbasierte Kommunikation rasant weiter.
„Möglicherweise warten am Ende der aktuellen Welle statt eines weiteren Silizium-Hügels die Qubit-Gärten“, mutmaßt Asubel. Schon jetzt könnten erste Quantenrechner das Quanten-Supremat demonstriert haben – Leistungen jenseits des für klassische Rechner Erreichbaren. Der erste 1.000-Qubit-Rechner ist ebenfalls bereits in der Entwicklung.
Ungeachtet der Frage, welche Technologie der künftigen Entwicklung zugrunde liegen wird, sehen Asubel und Burg die Treiber dafür vor allem in neuen Anwendungen und Technikprodukten. Dazu gehören lernfähige Algorithmen und KI-Systeme ebenso wie das autonome Fahren oder die mit der 5G-Technologie verknüpfte Hardware. Sie alle werden noch schnellere, kleinere Prozessoren und höhere Leistungen benötigen. (PLoS ONE, 2021; doi: )
Quelle: Terry Collins Association



19. August 2021	
	
	 - Nadja Podbregar

Tags:Computer Mikrochip Miniaturisierung Moore's Law Mooresches GEsetz Schaltkreise Silizium Transistoren 

Teilen:		












vorherige Meldung


nächste Meldung 









 



Anzeige
In den Schlagzeilen

VogelgrippeNews des Tages

Missing Link der Schwarzen Löcher aufgespürtSchon steinzeitliche Bauern starben an der PestWie Eltern das wissenschaftliche Denkvermögen ihrer Kinder prägenDiabetes: Lassen sich insulinproduzierende Zellen nachzüchten?Diaschauen zum Thema

QuantencomputerMagnetische SpeichermaterialienNeurocomputerDossiers zum Thema

Quantencomputer - Tops und Flops beim Rechnen mit den kleinsten TeilchenNanospeicher bringen Computer groß raus - Wissenschaftler erforschen magnetische NanostrukturenAuf dem Weg zum künstlichen Gehirn? - Wissenschaftler arbeiten an Computern nach dem Vorbild des GehirnsDas Geheimnis des richtigen Spins - Auf der Suche nach ferromagnetischen Halbleitern für elektronische BauteileKünstliche Intelligenz - Wenn Maschinen zu denken beginnen...Nanoröhrchen - Kohlenstoffwinzlinge als Bausteine für Computer der ZukunftBücher zum ThemaSmarte Maschinen - Wie Künstliche Intelligenz unser Leben verändert von Ulrich EberlDie Erfindung der Zukunft: Sechs Innovationen, die die Welt veränderten - von Steven Johnson un Monika NiehausDie Wunder maschine - Die unendliche Geschichte der Daten- verarbeitung von Herbert Matis
Top-Clicks der Woche







 




Magnetisches Moment von Atomkernen neu berechnet
Präziserer Blick ins Innere von Atomen 








 




Unterwasserarchäologen finden Relikte eines zweiten antiken Schiffswracks unweit der Fundstelle
Antikythera: Das berühmte Schiff sank nicht allein 








 




Neuer Signalweg zwischen Gehirn und externen Nerven entdeckt
Auslöser für Migräne-Anfälle identifiziert 








 




Chemiker erzeugen erstmals einen aromatischen Metallring ohne angelagerte Stützmoleküle
Erster Aromaten-Ring allein aus Metallatomen 








 




Artenvielfalt der ikonischen Kopffüßer während der späten Kreidezeit untersucht
Wären die Ammoniten auch ohne „Dinokiller“ ausgestorben? 









",,,"[{'@type': 'Article', '@id': 'https://www.scinexx.de/news/technik/moores-law-wellen-statt-exponentialkurve/#article', 'isPartOf': {'@id': 'https://www.scinexx.de/news/technik/moores-law-wellen-statt-exponentialkurve/'}, 'author': {'name': 'Nadja Podbregar', '@id': 'https://www.scinexx.de/#/schema/person/242ffc681c7bc2254d6a2e012a40f8f5'}, 'headline': 'Moore&#8217;s Law: Wellen statt Exponentialkurve', 'datePublished': '2021-08-18T23:01:01+00:00', 'dateModified': '2021-08-20T04:50:41+00:00', 'mainEntityOfPage': {'@id': 'https://www.scinexx.de/news/technik/moores-law-wellen-statt-exponentialkurve/'}, 'wordCount': 796, 'publisher': {'@id': 'https://www.scinexx.de/#organization'}, 'image': {'@id': 'https://www.scinexx.de/news/technik/moores-law-wellen-statt-exponentialkurve/#primaryimage'}, 'thumbnailUrl': 'https://www.scinexx.de/wp-content/uploads/m/o/mooreslawg.jpg', 'keywords': ['Computer', 'Mikrochip', 'Miniaturisierung', ""Moore's Law"", 'Mooresches GEsetz', 'Schaltkreise', 'Silizium', 'Transistoren'], 'articleSection': ['Technik'], 'inLanguage': 'de-DE'}, {'@type': 'WebPage', '@id': 'https://www.scinexx.de/news/technik/moores-law-wellen-statt-exponentialkurve/', 'url': 'https://www.scinexx.de/news/technik/moores-law-wellen-statt-exponentialkurve/', 'name': ""Moore's Law: Wellen statt Exponentialkurve - Miniaturisierung von Mikrochips verlief in sechs Wellen – wie viele bleiben noch? - scinexx.de"", 'isPartOf': {'@id': 'https://www.scinexx.de/#website'}, 'primaryImageOfPage': {'@id': 'https://www.scinexx.de/news/technik/moores-law-wellen-statt-exponentialkurve/#primaryimage'}, 'image': {'@id': 'https://www.scinexx.de/news/technik/moores-law-wellen-statt-exponentialkurve/#primaryimage'}, 'thumbnailUrl': 'https://www.scinexx.de/wp-content/uploads/m/o/mooreslawg.jpg', 'datePublished': '2021-08-18T23:01:01+00:00', 'dateModified': '2021-08-20T04:50:41+00:00', 'description': 'Anders als gedacht: Nach dem berühmten ""Mooreschen Gesetz"" soll die Miniaturisierung von Computerchips exponentiell verlaufen. Doch stattdessen zeigt die', 'breadcrumb': {'@id': 'https://www.scinexx.de/news/technik/moores-law-wellen-statt-exponentialkurve/#breadcrumb'}, 'inLanguage': 'de-DE', 'potentialAction': [{'@type': 'ReadAction', 'target': ['https://www.scinexx.de/news/technik/moores-law-wellen-statt-exponentialkurve/']}]}, {'@type': 'ImageObject', 'inLanguage': 'de-DE', '@id': 'https://www.scinexx.de/news/technik/moores-law-wellen-statt-exponentialkurve/#primaryimage', 'url': 'https://www.scinexx.de/wp-content/uploads/m/o/mooreslawg.jpg', 'contentUrl': 'https://www.scinexx.de/wp-content/uploads/m/o/mooreslawg.jpg', 'width': 1000, 'height': 506, 'caption': 'Wie lange lassen sich Silizium-Mikrochips noch miniaturisieren? © Andy/ Getty images'}, {'@type': 'BreadcrumbList', '@id': 'https://www.scinexx.de/news/technik/moores-law-wellen-statt-exponentialkurve/#breadcrumb', 'itemListElement': [{'@type': 'ListItem', 'position': 1, 'name': 'Startseite', 'item': 'https://www.scinexx.de/'}, {'@type': 'ListItem', 'position': 2, 'name': 'Moore&#8217;s Law: Wellen statt Exponentialkurve'}]}, {'@type': 'WebSite', '@id': 'https://www.scinexx.de/#website', 'url': 'https://www.scinexx.de/', 'name': 'scinexx | Das Wissensmagazin', 'description': '', 'publisher': {'@id': 'https://www.scinexx.de/#organization'}, 'potentialAction': [{'@type': 'SearchAction', 'target': {'@type': 'EntryPoint', 'urlTemplate': 'https://www.scinexx.de/?s={search_term_string}'}, 'query-input': 'required name=search_term_string'}], 'inLanguage': 'de-DE'}, {'@type': 'Organization', '@id': 'https://www.scinexx.de/#organization', 'name': 'Scinexx - Das Wissensmagazin', 'url': 'https://www.scinexx.de/', 'logo': {'@type': 'ImageObject', 'inLanguage': 'de-DE', '@id': 'https://www.scinexx.de/#/schema/logo/image/', 'url': 'https://www.scinexx.de/wp-content/uploads/s/c/scinexx.png', 'contentUrl': 'https://www.scinexx.de/wp-content/uploads/s/c/scinexx.png', 'width': 352, 'height': 85, 'caption': 'Scinexx - Das Wissensmagazin'}, 'image': {'@id': 'https://www.scinexx.de/#/schema/logo/image/'}}, {'@type': 'Person', '@id': 'https://www.scinexx.de/#/schema/person/242ffc681c7bc2254d6a2e012a40f8f5', 'name': 'Nadja Podbregar', 'image': {'@type': 'ImageObject', 'inLanguage': 'de-DE', '@id': 'https://www.scinexx.de/#/schema/person/image/', 'url': 'https://secure.gravatar.com/avatar/545d68008f5926c3322130fb132a600e?s=96&d=blank&r=g', 'contentUrl': 'https://secure.gravatar.com/avatar/545d68008f5926c3322130fb132a600e?s=96&d=blank&r=g', 'caption': 'Nadja Podbregar'}}]"
