URL link,Title,Date,Source,Source Link,description,keywords,og:description,twitter:description,article:section,article:summary,article text,@id,@type,itemListElement,@context,url,contentUrl,width,height,id,name,legalName,alternateName,logo,image,email,telephone,address,contactPoint,sameAs,publisher,datePublished,dateModified,isPartOf,primaryImageOfPage,breadcrumb,operatingSystem,applicationCategory,applicationSubcategory,aggregateRating,offers,caption,headline,mainEntityOfPage,articleSection,isAccessibleForFree,@graph,thumbnailUrl,author,creator,dateCreated
https://news.google.com/rss/articles/CBMiQGh0dHBzOi8vd3d3LmRldXRzY2hsYW5kZnVua2t1bHR1ci5kZS9tZW5zY2gtbWFzY2hpbmUta2ktMTAwLmh0bWzSAQA?oc=5,Künstliche Intelligenz - Warum der Mensch-Maschine-Vergleich hinkt - Deutschlandfunk Kultur,2022-07-07,Deutschlandfunk Kultur,https://www.deutschlandfunkkultur.de,"Was unterscheidet den Menschen von der Maschine? Mit der Weiterentwicklung Künstlicher Intelligenz stellt sich diese Frage immer wieder neu, auch in Bezug auf Bewusstsein und Gefühle. Das schürt bei manchen Ängste. Zu Recht?","Maschine,Roboter,Künstliche Intelligenz","Was unterscheidet den Menschen von der Maschine? Mit der Weiterentwicklung Künstlicher Intelligenz stellt sich diese Frage immer wieder neu, auch in Bezug auf Bewusstsein und Gefühle. Das schürt bei manchen Ängste. Zu Recht?","Was unterscheidet den Menschen von der Maschine? Mit der Weiterentwicklung Künstlicher Intelligenz stellt sich diese Frage immer wieder neu, auch in Bezug auf Bewusstsein und Gefühle. Das schürt bei manchen Ängste. Zu Recht?",N/A,N/A,N/A,,,,,,,,,,,,,,,,,,,,,,,,,,,,,,,,,,,,,,,,
https://news.google.com/rss/articles/CBMifGh0dHBzOi8vd3d3LmJsaWNrLmNoL3NjaHdlaXovc296aW9sb2dpbi1tYXJsaXMtYnVjaG1hbm4tdWViZXItZGllLXp1a3VuZnQtZGVyLWFyYmVpdC1iaWxkdW5nLWJpbGR1bmctYmlsZHVuZy1pZDE3NjQ4MjQxLmh0bWzSAQA?oc=5,"Die Zukunft der Arbeit: «Bildung, Bildung, Bildung» - BLICK",2022-07-10,BLICK,https://www.blick.ch,"Fachkräftemangel, künstliche Intelligenz, neue Arbeitsmodelle: Auf dem Schweizer Arbeitsmarkt ist ganz schön was los, weiss Soziologin Marlis Buchmann.",N/A,"Fachkräftemangel, künstliche Intelligenz, neue Arbeitsmodelle: Auf dem Schweizer Arbeitsmarkt ist ganz schön was los, weiss Soziologin Marlis Buchmann.","Fachkräftemangel, künstliche Intelligenz, neue Arbeitsmodelle: Auf dem Schweizer Arbeitsmarkt ist ganz schön was los, weiss Soziologin Marlis Buchmann.",Schweiz,N/A," Vorlesefunktion derzeit nicht verfügbarTeile uns deine Meinung zur Vorlesefunktion mit. Zur kurzen Umfrage.1/5Marlis Buchmann (72) ist Soziologieprofessorin an der Universität Zürich.zvg1/5Marlis Buchmann (72) ist Soziologieprofessorin an der Universität Zürich.Interview: Janina BauerSonntagsBlick: Frau Buchmann, welchen Stellenwert hat Arbeit hierzulande?Marlis Buchmann: Die Jahresarbeitsstunden hier sind im internationalen Vergleich sehr hoch, was von der Bevölkerung weitestgehend so akzeptiert wird – die Schweizerinnen und Schweizer sind insgesamt also ein sehr arbeitsames Völkchen.2012 hat sich das Stimmvolk an der Urne gegen sechs Wochen Ferien pro Jahr ausgesprochen. Heute wird die Forderung nach der Viertagewoche lauter. Was hat sich verändert?In den letzten Jahren ist die Work-Life-Balance für die Menschen wichtiger geworden. Die Arbeit ins Zentrum des Lebens zu stellen, ist für viele nicht mehr erstrebenswert. Unsere Forschung zeigt, dass seit den 1990er-Jahren, die Stelleninserate für Fast-Vollzeitstellen, also alle Arbeitsstellen zwischen 80 und 95 Prozent, enorm zugenommen haben. Das ist immer noch viel, aber wir bewegen uns langsam weg von der Norm, 42 Stunden die Woche arbeiten zu müssen.Ein Treiber dieser Forderungen ist die Generation Z. Den Jungen ist Karriere weniger wichtig, sie wollen mehr Zeit für sich. Eine Trotzreaktion gegen die Boomer-Eltern?Für die Boomergeneration war Arbeit der Identitätsstifter. Seit den 90er-Jahren beobachten wir im Westen einen kulturellen Wandel. Wir individualisieren uns immer stärker – und zwar im Sinne der Selbstrealisierung: Wonach strebe ich? Was ist meine Passion? Das umfasst das ganze Leben und nicht nur die Arbeit. Das manifestiert sich stark in der jungen Generation, die jetzt in den Arbeitsmarkt eintritt.Ältere werfen der Gen Z auch vor, sie sei faul.Wenn man 100 Prozent arbeiten als Norm sieht, dann sind alle faul, die weniger arbeiten. Diese Sichtweise ist verkürzt, denn ein beträchtlicher Teil, vor allem Frauen, arbeitet Teilzeit. Seit dem Jahr 2000 folgt Krise auf Krise. Damit müssen junge Menschen umgehen, es betrifft vor allem ihre Zukunft. Daher finde ich es verständlich, dass sich die Jugend genau überlegt: Wie sollen wir uns in dieser Welt einrichten?Schon jetzt gibt es in der Schweiz einen Fachkräftemangel – und immer weniger rücken nach. Ist es nicht verrückt, in dieser Situation weniger Arbeit zu fordern?Man könnte meinen, es sei paradox. Doch: Arbeitskräfte kommen nicht nur aus dem Inland. Die Schweiz hat einen hohen Anteil an hoch qualifizierten Arbeitskräften aus dem Ausland, was viel ausgleicht. Das wird auch die nächsten 20 Jahre so bleiben. Gleichzeitig geht der Trend dahin, dass immer höher qualifizierte Arbeitskräfte benötigt werden. Deswegen müssen wir den jungen Menschen in der Schweiz vermitteln: Bildung, Bildung, Bildung ist essenziell um auf dem Arbeitsmarkt der Zukunft bestehen zu können.Digitalisierung und Pandemie schickten die Menschen ins Homeoffice. Arbeiten wir zukünftig nur noch von zu Hause aus?Man kann heute in bestimmten Jobs für zwei Monate ins Ausland gehen und von dort arbeiten, was vor zehn Jahren noch undenkbar war. Durch die Flexibilisierung des Arbeitslebens kann auch das Privatleben freier gestaltet werden. Andererseits haben viele zu Hause keinen ruhigen Arbeitsplatz und können wegen der fehlenden Abgrenzung nicht abschalten. Online arbeiten hat seine Limiten. Der informelle Austausch gestaltet sich schwieriger. Projekte und innovative Ideen schmieden sich besser bei persönlichen Begegnungen. Die Arbeitgeber fordern bereits jetzt wieder verstärkt Anwesenheit. Die Menschen werden immer an den physischen Arbeitsort zurückkehren – nur eben flexibler.WerbungRund ums Thema ArbeitKampf um neue BewerberinnenSo machen Chefs ihre vielen freien Stellen schmackhaft17'000 Ausbildungsplätze freiDer Schweiz gehen die Lehrlinge aus!Kampf gegen FachkräftemangelZuwanderung hilft nur teilweiseDas gab es bislang noch nichtJetzt kommt die DigitalisierungslehreBeizen zu, Lehrer ohne DiplomHier tut der Fachkräfte-mangel besonders wehFachkräftemangel – was hilft?Vier Rezepte gegen den Job-Alarm250'000 Stellen offen!Wohin verschwinden unsere Fachkräfte?Neben dem Homeoffice brachte die Digitalisierung auch künstliche Intelligenz hervor. Werden Maschinen zukünftig Mängel auf dem Arbeitsmarkt ausgleichen?Bisher konnte die Technologie vor allem standardisierte Arbeit übernehmen. Dort, wo es um Entscheidungen, Schlussfolgerungen und analytische Überlegungen geht, ist der Mensch der Maschine noch voraus. Die Fachkräfte fehlen vor allem am oberen Ende. Aber: Es hängt alles davon ab, wie die künstliche Intelligenz sich weiterentwickelt. Je nachdem sind schon einschneidende Konsequenzen für viele Berufsfelder zu erwarten.Sind wir in 50 Jahren alle Dienstleister der künstlichen Intelligenz?Nein, das glaube ich nicht. Die Maschine ist vom Menschen gemacht, weswegen er immer einen Schritt voraus sein wird. Technologieschübe gibt es seit der Industrialisierung. Bisher wurden die weggefallenen Arbeitsplätze immer durch neue Berufsfelder ersetzt. Der Mensch erfindet immer Neues, dadurch ist der Gesellschaft bisher nie die Arbeit ausgegangen. Heute gibt es so viele Bereiche, in denen Arbeitsplätze schlummern, aber der Markt noch fehlt. Stichwort: Ökologie und Klimawandel, mit Arbeit Krisen lösen. ",https://img.blick.ch/incoming/17648279-v1-arbeit.png?imwidth=2000&ratio=1_1&x=1770&y=0&width=2000&height=2000,NewsArticle,"[{'@type': 'ListItem', 'position': 1, 'name': 'Home', 'item': {'@id': 'https://www.blick.ch/'}}, {'@type': 'ListItem', 'position': 2, 'name': 'Schweiz', 'item': {'@id': 'https://www.blick.ch/schweiz/'}}, {'@type': 'ListItem', 'position': 3, 'name': 'Die Zukunft der Arbeit: «Bildung, Bildung, Bildung»'}]",https://schema.org,https://img.blick.ch/incoming/17648279-v1-arbeit.png?imwidth=2000&ratio=1_1&x=1770&y=0&width=2000&height=2000,https://img.blick.ch/incoming/17648279-v1-arbeit.png?imwidth=2000&ratio=1_1&x=1770&y=0&width=2000&height=2000,2000.0,2000.0,https://www.blick.ch/#/schema/Article/17648241,Blick,Blick,Blick.ch,{'@id': '/_next/static/assets/images/logo_schemaorg.e1f20f226ffde3ce8adabfb6965022d3.png'},"[{'@id': 'https://img.blick.ch/incoming/17648279-v1-arbeit.png?imwidth=2000&ratio=16_9&x=223&y=0&width=3552&height=2000'}, {'@id': 'https://img.blick.ch/incoming/17648279-v1-arbeit.png?imwidth=2000&ratio=4_3&x=666&y=0&width=2666&height=2000'}, {'@id': 'https://img.blick.ch/incoming/17648279-v1-arbeit.png?imwidth=2000&ratio=1_1&x=1770&y=0&width=2000&height=2000'}]",redaktion@blick.ch,+41442596262,{'@id': 'https://www.blick.ch#/schema/Address/Organization/1'},"{'@type': 'ContactPoint', 'telephone': '+41442596262', 'contactType': 'Customer support', 'email': 'redaktion@blick.ch'}","['https://www.facebook.com/blick', 'https://twitter.com/blickch', 'https://instagram.com/blick', 'https://www.tiktok.com/@blick', 'https://www.youtube.com/@BlickTube', 'https://bsky.app/profile/blick.ch', 'https://de.wikipedia.org/wiki/Blick.ch']",{'@id': 'https://www.blick.ch/#/schema/Organization/1'},2022-07-10T07:30:05.055Z,2022-07-10T07:30:05.055Z,{'@id': 'https://www.blick.ch/schweiz/soziologin-marlis-buchmann-ueber-die-zukunft-der-arbeit-bildung-bildung-bildung-id17648241.html'},{'@id': 'https://img.blick.ch/incoming/17648279-v1-arbeit.png?imwidth=2000&ratio=16_9&x=223&y=0&width=3552&height=2000'},{'@id': 'https://www.blick.ch/#/schema/BreadcrumbList/schweiz/soziologin-marlis-buchmann-ueber-die-zukunft-der-arbeit-bildung-bildung-bildung-id17648241.html'},iOS,EntertainmentApplication,NewsApplication,{},"{'@type': 'Offer', 'price': '0.00'}","Die Zukunft der Arbeit: «Bildung, Bildung, Bildung»","Die Zukunft der Arbeit: «Bildung, Bildung, Bildung»",{'@id': 'https://www.blick.ch/schweiz/soziologin-marlis-buchmann-ueber-die-zukunft-der-arbeit-bildung-bildung-bildung-id17648241.html'},News,True,,,,,
https://news.google.com/rss/articles/CBMiYGh0dHBzOi8vd3d3LmNhcGdlbWluaS5jb20vZGUtZGUvaW5zaWdodHMvYmxvZy9uYWNoaGFsdGlna2VpdC1zdXN0YWluYWJsZS1pdC11bnRlcm5laG1lbnMtYWdlbmRhL9IBAA?oc=5,Nachhaltigkeit: Sustainable IT gehört auf jede Unternehmens-Agenda - Capgemini,2022-07-11,Capgemini,https://www.capgemini.com,Auf dem Weg zu Net Zero: Wie Sie ihre Unternehmens-IT nachhaltig gestalten und so den CO2-Fußabdruck reduzieren.,[],Auf dem Weg zu Net Zero: Wie Sie ihre Unternehmens-IT nachhaltig gestalten und so den CO2-Fußabdruck reduzieren.,N/A,N/A,N/A,"

Nachhaltigkeit: Sustainable IT gehört auf jede Unternehmens-AgendaMarius Vöhringer11. Juli 2022 
FacebookTwitterLinkedinAuf dem Weg zu Net Zero wollen Unternehmen den CO2-Fußabdruck ihrer IT minimieren. Die IT-Architektur spielt dabei die entscheidende Rolle. Sie kann unternehmensweit negative Umweltfolgen verringern und die Effizienz steigern.

Die Berichtspflicht zur Nachhaltigkeit wird ab dem Jahr 2023 deutlich ausgeweitet. Europäische Unternehmen mit mehr als 250 Mitarbeitenden sowie kleine und mittlere kapitalmarktorientierte Unternehmen werden in absehbarer Zukunft einen Report über ihre Nachhaltigkeitsmaßnahmen vorlegen müssen. Hinsichtlich der Dekarbonisierung haben die meisten deutschen Unternehmen zumindest bereits Ziele definiert: Aus der aktuellen IT-Trends-Studie von Capgemini in Deutschland geht hervor, dass knapp 71 Prozent der Unternehmen beabsichtigen, ihre jährlichen Treibhausgasemissionen bis 2026 um durchschnittlich 37 Prozent zu senken.
IT spielt in Nachhaltigkeitsstrategien noch eine zu geringe Rolle
Eine andere Studie von Capgemini (Sustainable IT: Why it’s time for a Green Revolution for your organization’s IT, 2021) zeigt allerdings, dass die IT in den Nachhaltigkeitsstrategien der meisten Unternehmen noch keine oder nur eine untergeordnete Rolle spielt. Zwar verfügt die Hälfte der Unternehmen über eine Nachhaltigkeitsstrategie, doch nur bei jedem fünften Unternehmen berücksichtigt diese auch die IT.
Die Unternehmens-IT kann einen wertvollen Beitrag zu CO2-Einsparungen leisten, verursacht aber auch selbst einen CO2-Fußabdruck. Wie groß dieser in ihrem Unternehmen ist, wissen nur 43 Prozent der befragten Manager, und erst 18 Prozent haben zu seiner Minimierung eine umfassende Strategie mit klar definierten Zielen und Zeitvorgaben definiert.
Die Verringerung des CO2-Fußabdrucks der IT kann in erster Linie durch die Optimierung und Verschlankung von IT-Landschaften und -Architekturen erreicht werden. Dies erfordert eine unternehmensweite Strategie, die Möglichkeiten zur Verringerung der Umweltauswirkungen aus allen Geschäftsbereichen einbezieht.
Ein Framework unterstützt die Implementierung nachhaltiger IT
Eine solche Strategie für nachhaltige IT sollte klare, messbare Ziele und Meilensteine definieren sowie notwendige Veränderungen in der Organisation, den Prozessen und der Unternehmenskultur aufzeigen. Wir empfehlen ein Vorgehen mit den folgenden 8 Schritten:

1. Sensibilisierung der IT-Teams für NachhaltigkeitFördern Sie bei Mitarbeitenden in der IT eine Nachhaltigkeitskultur, die die Zusammenarbeit mit Cloud-Hyperscalern wie AWS, Microsoft oder Google einschließt. Stimmen Sie die Team- und Unternehmenskultur darauf ein, Nachhaltigkeitsziele zu verfolgen und schneller zu erreichen: Jede*r muss Verantwortung für die Auswirkungen der Cloud-Nutzung auf die Umwelt übernehmen.
2. Strategie für nachhaltige ITFühren Sie zur Dokumentation der Ausgangslage eine grundlegende Bewertung des ökologischen Fußabdrucks Ihrer gesamten IT und des Reifegrads bestehender Nachhaltigkeitsmaßnahmen durch. Entwickeln Sie für Ihr Unternehmen eine umfassende Nachhaltigkeits-Strategie, die Ihre Vision von nachhaltiger IT beinhaltet und selbst Teil eines größeren ESG-Ansatzes ist. Zur Umsetzung ist es sinnvoll, eine leitende Position für nachhaltige IT zu besetzen, die den Erfolg der Maßnahmen anhand von KPIs kontrolliert und die notwendige Governance etabliert.
3. Digitalisierung für ein nachhaltiges BusinessAnalysieren Sie die Wertschöpfungskette und die Kernbereiche des aktuellen Geschäftsmodells, um Ansatzpunkte für Verbesserungen hin zu mehr Nachhaltigkeit zu identifizieren und sie umzusetzen, z. B. durch Disintermediation. Eine weitere Möglichkeit für mehr Effizienz im Geschäft besteht in einer grundlegenden Konsolidierung umfangreicher Anwendungslandschaften bis hin zur Abschaltung von Anwendungen.
4. Evaluieren und modellierenEin digitaler Zwilling der IT- und Anwendungslandschaft kann durch datengestützte Geschäfts- und IT-Evaluierungen helfen, die jeweils aktuellen CO2-Emissionen zu ermitteln und das CO2-Reduktionspotenzial zu modellieren. Im Rahmen gemeinsam definierter Entscheidungskriterien lassen sich Optimierungspotenziale innerhalb der IT-Landschaften und -Architekturen identifizieren. Die Wirksamkeit von Maßnahmen kann simuliert werden. Neben der Nachhaltigkeitsprüfung von On-Premise-Einrichtungen (DC) lohnt es sich, durch Cloud Transformation die höhere Stromverbrauchseffektivität (Power Usage Effectiveness PUE) von Cloud-Rechenzentren zu nutzen.
5. Design und PlanungDie Architektur bestimmt maßgeblich das Setup der Rechenzentren, Landing Zones, Netzwerke und der Kommunikationswege. Der Aufbau einer Plattform für nachhaltige IT erschließt erhebliche Effizienzgewinne, denn in der Cloud verbrauchen Workloads und Speicherplatz weniger Energie bzw. stoßen weniger CO2 aus. Cloud-Nutzung und automatisierte Skalierungen der erforderlichen Hardwareressourcen sparen erfahrungsgemäß viel Energie ein, da Cloud-basierte Anwendungslandschaften Rechenressourcen üblicherweise zu mehr als 60 Prozent auslasten, während klassische Rechenzentren vor Ort in der Regel nur eine Auslastung von weniger als 20 Prozent verzeichnen.
So kann Cloud Computing grundsätzlich einen großen Beitrag zur Energieeffizienz leisten, doch gegenüber herkömmlichen Rechenzentren gibt es durch die notwendige Vernetzung und Kommunikation auch zusätzliche Energieverbraucher. Eine nachhaltige Architektur wird daher Übertragung von Daten möglichst reduzieren und effiziente Datenübertragungsmechanismen sowie Edge Computing nutzen. Dies und eine Analyse des Unternehmensportfolios auf nachhaltige Modernisierungspfade hin ist die Grundlage für ein umfassendes Architekturkonzept.
6. Green Coding – Entwicklung nachhaltiger SoftwareDer Energieverbrauch von Infrastruktur bzw. Rechenzentren lässt sich auch durch eine Verbesserung der Software-Architektur wesentlich senken, denn ihr Design bestimmt die erforderliche Hardware-Dimensionierung und den Stromverbrauch. Green Coding in der Anwendungsentwicklung und ‑transformation ist daher ein weiteres wichtiges Element nachhaltiger IT. Einige Unternehmen sparen durch optimierte Software-Architekturen und Anwendungen bereits 50 Prozent des Energiebedarfs ein und reduzieren die CO2-Emissionen entsprechend.
7. BetriebDevOps kann zu einem besseren Energiemanagement beitragen, wenn DevOps-Prozesse und -Automatisierung zur kontinuierlichen Optimierung eingesetzt werden. Site Reliability Engineering kann durch Automatisierung sowie Continuous Integration and Delivery (CI/CD) effiziente, skalierbare und hochgradig zuverlässige Software-Systeme aufbauen. Mit modernen DevOps-Tools und ‑Technologien, automatisierten CI-/CD-Pipelines und Tests lassen sich Fehler frühzeitig erkennen, bevor sie in Produktion gehen. Wer Monitoring-Systeme nutzt, kann auf Warnhinweise reagieren, bevor sie zu Vorfällen werden und Ressourcen schonen, um sie für andere Aufgaben effektiver einzusetzen.
8. Monitoring mit FinOpsKalkulatoren für lokale und Cloud-basierte Infrastrukturen sowie Monitoringtools können den CO2-Fußabdruck der Unternehmens-IT ermitteln und Dashboards für Treibhausgas-Emissionen erstellen. Indem Sie Nachhaltigkeit in FinOps integrieren und den Ressourcen-Verbrauch optimieren, erzielen Sie im Rahmen des Finanz- und Umweltmanagements von IT- und Cloud-Systemen den größtmöglichen geschäftlichen Nutzen.
Eine Transformation, die diese acht Punkte berücksichtigt, reduziert mit dem Energieverbrauch negative Umweltauswirkungen der Unternehmens-IT und erschließt durch steigende Effizienz darüber hinaus geschäftliche und finanzielle Vorteile.
Kennen Sie bereits den CO2-Fußabdruck Ihrer Unternehmens-IT und arbeiten effektiv daran, ihn zu minimieren oder stehen Sie vor Herausforderungen bei der genauen Strategie und Umsetzung? Wir freuen uns auf den Austausch mit Ihnen – sehr gern auch auf LinkedIn:
Marius VöhringerAndreas Hess


Blog-Updates per Mail?Abonnieren Sie unseren Newsletter und erhalten Sie alle zwei Monate eine Auswahl der besten Blogartikel. Zur Anmeldung   Blog per E-Mail abonnieren 

E-Mail (Pflichtfeld) *E-Mail (Pflichtfeld) ist ungültig.Unternehmen / Organisation (optional)



				Ich bin damit einverstanden, dass die von mir angegebenen Daten zum Zwecke der Bearbeitung meines Anliegens von der Capgemini Service SAS gespeichert und wie in den Nutzungsbedingungen und der Datenschutzerklärung beschrieben, verarbeitet werden.  			

 




Pfeil nach rechts ziehen
















				Vielen Dank. Wir haben Sie in unseren E-Mail-Verteiler aufgenommen.


Es tut uns leid, die Übermittlung des Formulars ist fehlgeschlagen. Bitte versuchen Sie es erneut.



Autor
















Marius Vöhringer


Expertise: Cloud, Sustainable IT













Weitere BlogpostsSustainabilityBattery Passport – Potenziale durch erfolgreiche technische Umsetzung nutzenMarc Schmid11. Juli 2024Intelligent IndustryCo-DesignNext: Die Zukunft des integrierten Produkt- und Produktionsdesigns Patrik Sojda27. Juni 2024SustainabilityKreislaufwirtschaft: Wege zu wirtschaftlichen Mehrwegverpackungs-SystemenBernd Amsler11. Juni 2024Alle Blogposts 
",,NewsArticle,,https://schema.org,http://www.capgemini.com/de-de/insights/blog/nachhaltigkeit-sustainable-it-unternehmens-agenda/,,,,,,,,,"{'@type': 'ImageObject', 'url': 'https://www.capgemini.com/de-de/wp-content/uploads/sites/8/2022/07/nachhaltige-it.png'}",,,,,,"{'@type': 'Organization', 'name': 'Capgemini Germany', 'logo': ''}",2022-07-11T13:31:00Z,2023-01-30T08:19:39Z,,,,,,,,,,Nachhaltigkeit: Sustainable IT gehört auf jede Unternehmens-Agenda,"{'@type': 'WebPage', '@id': 'http://www.capgemini.com/de-de/insights/blog/nachhaltigkeit-sustainable-it-unternehmens-agenda/'}",Technology,,"[{'@type': 'WebPage', '@id': 'https://www.capgemini.com/de-de/insights/blog/nachhaltigkeit-sustainable-it-unternehmens-agenda/', 'url': 'https://www.capgemini.com/de-de/insights/blog/nachhaltigkeit-sustainable-it-unternehmens-agenda/', 'name': 'Nachhaltigkeit: Sustainable IT gehört auf jede Unternehmens-Agenda - Capgemini', 'isPartOf': {'@id': 'https://www.capgemini.com/de-de/#website'}, 'primaryImageOfPage': {'@id': 'https://www.capgemini.com/de-de/insights/blog/nachhaltigkeit-sustainable-it-unternehmens-agenda/#primaryimage'}, 'image': {'@id': 'https://www.capgemini.com/de-de/insights/blog/nachhaltigkeit-sustainable-it-unternehmens-agenda/#primaryimage'}, 'thumbnailUrl': 'https://www.capgemini.com/de-de/wp-content/uploads/sites/8/2022/07/nachhaltige-it.png', 'datePublished': '2022-07-11T13:31:00+00:00', 'dateModified': '2023-01-30T08:19:39+00:00', 'author': {'@id': 'https://www.capgemini.com/de-de/#/schema/person/5999f5dfdc13bedb5df7d9515edf03d1'}, 'description': 'Auf dem Weg zu Net Zero: Wie Sie ihre Unternehmens-IT nachhaltig gestalten und so den CO2-Fußabdruck reduzieren.', 'inLanguage': 'de-DE', 'potentialAction': [{'@type': 'ReadAction', 'target': ['https://www.capgemini.com/de-de/insights/blog/nachhaltigkeit-sustainable-it-unternehmens-agenda/']}]}, {'@type': 'ImageObject', 'inLanguage': 'de-DE', '@id': 'https://www.capgemini.com/de-de/insights/blog/nachhaltigkeit-sustainable-it-unternehmens-agenda/#primaryimage', 'url': 'https://www.capgemini.com/de-de/wp-content/uploads/sites/8/2022/07/nachhaltige-it.png', 'contentUrl': 'https://www.capgemini.com/de-de/wp-content/uploads/sites/8/2022/07/nachhaltige-it.png', 'width': 2032, 'height': 1091}, {'@type': 'WebSite', '@id': 'https://www.capgemini.com/de-de/#website', 'url': 'https://www.capgemini.com/de-de/', 'name': 'Capgemini Germany', 'description': 'Capgemini Germany', 'potentialAction': [{'@type': 'SearchAction', 'target': {'@type': 'EntryPoint', 'urlTemplate': 'https://www.capgemini.com/de-de/?s={search_term_string}'}, 'query-input': 'required name=search_term_string'}], 'inLanguage': 'de-DE'}, {'@type': 'Person', '@id': 'https://www.capgemini.com/de-de/#/schema/person/5999f5dfdc13bedb5df7d9515edf03d1', 'name': 'georgogulin', 'url': 'https://www.capgemini.com/de-de/author/georgogulin/'}]",https://www.capgemini.com/de-de/wp-content/uploads/sites/8/2022/07/nachhaltige-it.png?w=150&h=150&crop=1,"[{'@type': 'Person', 'name': 'georgogulin'}]",['georgogulin'],2022-07-11T13:31:00Z
