URL link,Title,Date,Source,Source Link,description,keywords,og:description,twitter:description,article:section,article:summary,article text,itemListElement,@type,@context,about,articleBody,articleSection,author,dateCreated,dateModified,datePublished,headline,image,mainEntityOfPage,publisher,url,wordCount,alternativeHeadline,isAccessibleForFree,hasPart,timeRequired,@graph
https://news.google.com/rss/articles/CBMiYWh0dHBzOi8vd3d3LmRldXRzY2hsYW5kZnVuay5kZS9zZWhyLXdhaHJzY2hlaW5saWNoLWhhc3Mtd2Vubi1rdWVuc3RsaWNoZS1pbnRlbGxpZ2Vuei1kYXMtMTAwLmh0bWzSAQA?oc=5,Sehr wahrscheinlich Hass - Wenn Künstliche Intelligenz das Forum moderiert - Deutschlandfunk,2021-09-09,Deutschlandfunk,https://www.deutschlandfunk.de,"Klassische Nachrichtenmedien versuchen, ihre Kommentarspalten im Netz nicht von Hasspostings dominieren zu lassen. Viele Redaktionen setzen hierbei auf Künstliche Intelligenz. Doch nicht alle tun das so transparent wie die ""Rheinische Post"".",N/A,"Klassische Nachrichtenmedien versuchen, ihre Kommentarspalten im Netz nicht von Hasspostings dominieren zu lassen. Viele Redaktionen setzen hierbei auf Künstliche Intelligenz. Doch nicht alle tun das so transparent wie die ""Rheinische Post"".","Klassische Nachrichtenmedien versuchen, ihre Kommentarspalten im Netz nicht von Hasspostings dominieren zu lassen. Viele Redaktionen setzen hierbei auf Künstliche Intelligenz. Doch nicht alle tun das so transparent wie die ""Rheinische Post"".",N/A,N/A,"



Nahostkonflikt
Aktuelle Lage und Hintergründe
Der Überfall der palästinensischen Terrororganisation Hamas im Oktober 2023 auf Israel hat in der Region wieder die Gewalt entfacht. Israel möchte die Hamas zerstören. Diese wird wie die Hisbollah im Libanon vom Iran unterstützt.
",,,,,,,,,,,,,,,,,,,,,
