URL link,Title,Date,Source,Source Link,description,keywords,og:description,twitter:description,article:section,article:summary,article text,itemListElement,@type,@context,about,articleBody,articleSection,author,dateCreated,dateModified,datePublished,headline,image,mainEntityOfPage,publisher,url,wordCount,alternativeHeadline,isAccessibleForFree,hasPart,timeRequired,@graph
https://news.google.com/rss/articles/CBMijwFodHRwczovL3d3dy5hdWdzYnVyZ2VyLWFsbGdlbWVpbmUuZGUvd2lydHNjaGFmdC9LdWVuc3RsaWNoZS1JbnRlbGxpZ2Vuei1XaWUtTWFzY2hpbmVuLW1pdC1HZWZ1ZWhsLXVuc2VyLUxlYmVuLXZlcmJlc3Nlcm4tc29sbGVuLWlkNjAzOTAyNjEuaHRtbNIBAA?oc=5,Wie Maschinen mit Gefühl unser Leben verbessern sollen - Augsburger Allgemeine,2021-09-07,Augsburger Allgemeine,https://www.augsburger-allgemeine.de,"Unser Alltag wird immer digitaler, aber das macht ihn nicht automatisch einfacher. Elisabeth André erforscht, wie Mensch und Computer besser zusammenfinden können.",N/A,"Unser Alltag wird immer digitaler, aber das macht ihn nicht automatisch einfacher. Elisabeth André erforscht, wie Mensch und Computer besser zusammenfinden können.","Unser Alltag wird immer digitaler, aber das macht ihn nicht automatisch einfacher. Elisabeth André erforscht, wie Mensch und Computer besser zusammenfinden können.",N/A,N/A,"


Künstliche Intelligenz 
Wie Maschinen mit Gefühl unser Leben verbessern sollen

 Unser Alltag wird immer digitaler, aber das macht ihn nicht automatisch einfacher. Elisabeth André erforscht, wie Mensch und Computer besser zusammenfinden können. 


Von  Matthias Zimmermann
|

 07.09.21, 19:36 Uhr
 




","[{'item': 'https://www.augsburger-allgemeine.de/', '@type': 'ListItem', 'name': 'Startseite', 'position': '1'}, {'item': 'https://www.augsburger-allgemeine.de/wirtschaft', '@type': 'ListItem', 'name': 'Wirtschaft', 'position': '2'}]",BreadcrumbList,http://schema.org,,,,,,,,,,,,,,,,,,
https://news.google.com/rss/articles/CBMiYmh0dHBzOi8vd3d3LnN1ZWRkZXV0c2NoZS5kZS9rdWx0dXIva3VlbnN0bGljaGUtaW50ZWxsaWdlbnotZ2FzcGFyZC1rb2VuaWctbmV1ZXJzY2hlaW51bmctMS41NDA0NTk50gEA?oc=5,Gaspard Koenigs Reise in die Welt der künstlichen Intelligenz - Süddeutsche Zeitung - SZ.de,2021-09-08,Süddeutsche Zeitung - SZ.de,https://www.sueddeutsche.de,"KI überlässt nichts dem Zufall und nichts dem Gefühl. Der französische Philosoph Gaspard Koenig erklärt in einem Buch, warum das gut ist. ","Amazon,Autonomes Fahren,Dating Apps,Google,Künstliche Intelligenz,Literatur,Philosophie,Soziale Netzwerke,Literatur,Amazon,Unternehmen,Autonomes Fahren,Dating-Apps,Google,Künstliche Intelligenz,Digital,Philosophie,Leben und Gesellschaft,Social Media,Kultur,Süddeutsche Zeitung","KI überlässt nichts dem Zufall und nichts dem Gefühl. Der französische Philosoph Gaspard Koenig erklärt in einem Buch, warum das gut ist. ",N/A,N/A,N/A,"""Das Ende des Individuums"" von Gaspard Koenig:Fehler helfen8. September 2021, 15:36 UhrLesezeit: 6 minDetailansicht öffnenNur keine Angst vor dem humanoiden Roboter! Die vielen Tausend Abwägungen, die der Mensch jeden Tag trifft, bekommt die künstliche Intelligenz nicht hin. (Foto: Alexander Limbach /imago images)Warum können wir nicht zugeben, dass wir einfach nicht wissen, was die Zukunft bringt? Der französische Philosoph Gaspard Koenig ist durch die Welt gereist, um herauszufinden, wie es um Künstliche Intelligenz steht.Von Nils MinkmarMerkenTeilenFeedbackBis in die Siebzigerjahre hinein gab es in guten Schuhgeschäften einen ganz besonderen Apparat: Weil man Kinder in Fragen der Schuhgröße nicht traute und gute Schuhe eine Anschaffung waren, gab es einen Apparat, der die Füße der Kinder in neuen Schuhen einfach durchleuchten konnte, ein Röntgengerät. Was heute nur mit vielen Vorsichtsmaßnahmen und bei erwiesener medizinischer Notwendigkeit gemacht wird, klang sehr praktisch - so konnte man schwarz auf weiß sehen, ob die Zehen vorne anstoßen und ob es an der Seite drückt.TeilenFeedbackZur SZ-StartseiteSZ PlusSven Regener: ""Glitterschnitter"":Dieses ständige Gefühl, etwas zu verpassenSven Regener kehrt in seinem Roman ins Westberlin der 80er-Jahre zurück. Als Leser fühlt man sich wie auf einer WG-Party nachts um drei, wenn alle in der Küche hocken. Ein Treffen.Von Verena MayerLesen Sie mehr zum ThemaLiteraturAmazonUnternehmenAutonomes FahrenDating-AppsGoogleKünstliche IntelligenzDigitalPhilosophieLeben und GesellschaftSocial Media",,NewsArticle,https://schema.org,Literatur,"Bis in die Siebzigerjahre hinein gab es in guten Schuhgeschäften einen ganz besonderen Apparat: Weil man Kinder in Fragen der Schuhgröße nicht traute und gute Schuhe eine Anschaffung waren, gab es einen Apparat, der die Füße der Kinder in neuen Schuhen einfach durchleuchten konnte, ein Röntgengerät. Was heute nur mit vielen Vorsichtsmaßnahmen und bei erwiesener medizinischer Notwendigkeit gemacht wird, klang sehr praktisch - so konnte man schwarz auf weiß sehen, ob die Zehen vorne anstoßen und ob es an der Seite drückt.",Kultur,"[{'@type': 'Person', 'name': 'Nils Minkmar', 'sameAs': '/autoren/nils-minkmar-1.5449030'}]",2021-09-08T13:36:31.000Z,2021-10-26 07:54:10,2021-09-08T13:36:31.000Z,Gaspard Koenigs Reise in die Welt der künstlichen Intelligenz ,"{'@type': 'ImageObject', 'height': '675', 'url': 'https://www.sueddeutsche.de/2022/06/08/65beee06-d776-42d0-acbf-69c8473398e9.jpeg?q=60&fm=webp&width=1200&rect=0%2C142%2C1349%2C758', 'width': '1200'}",https://www.sueddeutsche.de/kultur/kuenstliche-intelligenz-gaspard-koenig-neuerscheinung-1.5404599,"{'@type': 'Organization', 'logo': {'@type': 'ImageObject', 'height': '64', 'url': 'https://www.sueddeutsche.de/szde-assets/img/szde-article-sueddeutsche-logo.svg', 'width': '525'}, 'name': 'Süddeutsche Zeitung'}",https://www.sueddeutsche.de/kultur/kuenstliche-intelligenz-gaspard-koenig-neuerscheinung-1.5404599,1472.0,Gaspard Koenigs Reise in die Welt der künstlichen Intelligenz ,False,"{'@type': 'WebPageElement', 'cssSelector': '.article-content', 'isAccessibleForFree': 'False'}",PT6M,
https://news.google.com/rss/articles/CBMikwFodHRwczovL3d3dy5pdC1maW5hbnptYWdhemluLmRlL2t1ZW5zdGxpY2hlLWludGVsbGlnZW56LWVyZ28tZW50d2lja2VsdC1laW5lLWZ1ZXItZGllLXZlcnNpY2hlcnVuZ3NicmFuY2hlLXJldm9sdXRpb25hZXJlLXBsYXR0Zm9ybS1hdWYtYXdzLTEyNDQwNS_SAQA?oc=5,AWS-Plattform von ERGO ist revolutionär für die Versicherungsbranche - IT Finanzmagazin,2021-09-07,IT Finanzmagazin,https://www.it-finanzmagazin.de,"Wird KI im Versicherungswesen richtig eingesetzt, kann sie die Entscheidungsfindung verbessern und eine reibungslose Kundenbetreuung bieten.",N/A,"Wird KI im Versicherungswesen richtig eingesetzt, kann sie die Entscheidungsfindung verbessern und eine reibungslose Kundenbetreuung bieten.",N/A,N/A,N/A,"


STRATEGIE7. September 2021 Künstliche Intelligenz: ERGO entwickelt eine für die Versicherungsbranche re­vo­lu­tio­nä­re Plattform auf AWS 
IT Finanzmagazin /AJ
7. September 2021
Archiv, Strategie




Wird Künstliche Intelligenz (KI) im Versicherungswesen richtig eingesetzt, kann sie die Entscheidungsfindung verbessern, die Effizienz der Abläufe steigern, und eine reibungslose Kundenbetreuung bieten. Allerdings setzen KI-Innovationen ein hohes Maß an Flexibilität bei der Datenintegration voraus. Das konnten die meisten der Legacy-Datenarchitekturen der ERGO Group nicht bieten. Die Anforderungen an interne Governance, Datenschutz und IT-Sicherheit erschwerten die Integration zusätzlich. Dieses Problem musste gelöst werden, um KI auf Unternehmensebene nutzen und auch sensible Daten in einer Cloud-Umgebung verwenden zu können.
von Piotr Klesta, Delivery Director und Mitglied des ERGO-Führungsteams &
Robert Meisner, Lead Product Owner der AI Factory bei ERGO &
Sid Singh, Amazon Web Services

Vor diesem Hintergrund entstand die Idee, ein zentrales System zu entwickeln, um in andere Kernanwendungen und damit auch in die Geschäftsprozesse von ERGO „Intelligenz“ zu implementieren. Die geplante Plattform sollte die Entwicklung, das Training und das Testen komplexer KI-Modelle unterstützen und die betriebliche Effizienz erhöhen. Letztlich ging es darum, den Daten-Teams durch die Plattform allgemein schwierige Aufgaben abzunehmen, sodass sie sich auf ihre Stärken konzentrieren können: das Analysieren von Daten und die Gewinnung neuer Erkenntnisse.
Aufbau der ERGO AI Factory zur Unterstützung von KI-Anwendungsfällen
So entstand die ERGO AI Factory auf Basis der AWS Cloud. Es handelt sich dabei um eine Compliance-konforme Plattform für das Ausführen produktionsreifer KI-Anwendungsfälle, die darüber hinaus eine flexible Umgebung für die Modellentwicklung und Modellprüfung bietet. Sie enthält folgende Funktionen und Dienste:
AI Factory-ImperativeAmazon Web Services

Compliance: Die Umsetzung von Sicherheitsmaßnahmen wie Authentifizierung, Verschlüsselung und das Least-Privilege-Prinzip zählte zu den obersten Prioritäten bei der Entwicklung der Plattform. Um die strengen bereichs- und geospezifischen Compliance-Anforderungen zu erfüllen, arbeiteten die Verantwortlichen eng mit den Sicherheitsteams zusammen.
Data Governance: Die Ermittlung der Datenherkunft und die tiefe Extraktion von Metadaten unterstützen die ordnungsgemäße Datenverwaltung und Nachvollziehbarkeit. Und die Anwender können sich dadurch besser in der komplexen Datenlandschaft zurechtfinden. Die entsprechenden Frameworks von ERGO enthalten sowohl Dienste von Drittanbietern als auch von AWS. Damit lassen sich technische sowie geschäftliche Metadaten erfassen und katalogisieren.
Datenspeicherung und -zugriff: AI Factory speichert Daten sicher und Compliance-konform im Amazon Simple Storage Service (S3). Zugriffsrechte werden nur Personen gewährt, die an den entsprechenden Projekten arbeiten. Die jeweiligen Rollen werden im Active Directory definiert.
Automatisierte Daten-Pipelines: Um eine flexible und robuste Datenintegrationslösung anbieten zu können, setzt ERGO auf eine ETL-Pipeline mit Apache Spark, Apache Airflow und Kubernetes-Pods. Diese lässt sich für die Entwicklung von KI-Modellen und die anschließende Datenaufbereitung für die Operationalisierung und Modellintegration nutzen.
Monitoring und Sicherheit: AI Factory stützt sich auf Open-Source-Cloud-Monitoring-Lösungen wie Grafana, um Sicherheitsbedrohungen und Anomalien zu erkennen. Diese Lösungen sammeln Service- und Anwendungsprotokolle, verfolgen Metriken und erzeugen Alarme.
Feedback-Schleife: Nach dem Speichern der Modelleingaben und -ausgaben werden das Verhalten und die Leistung produktiver KI-Modelle mithilfe von BI-Tools wie Amazon QuickSight verfolgt. Diese Informationen teilt ERGO mit Geschäftspartnern, um ihr Vertrauen in die KI zu stärken.
Entwicklerfreundliche Umgebung: Die Erstellung von KI-Modellen ist auf mobilen Endgeräten sowie in einer integrierten Entwicklungsumgebung möglich. Da die Daten-Teams eine Vielzahl von Frameworks und Bibliotheken für maschinelles Lernen (ML) verwenden, stellt AWS sicher, dass die Plattform erweiterbar und die Frameworks unabhängig bleiben. Unterstützt werden unter anderem Python/R, Apache Spark, PyTorch und TensorFlow. Prozesse im Rahmen von Continuous Integration (CI) und Continuous Development (CD) beschleunigen die Bereitstellung und senken die Fehlerrate.
Integration von Geschäftsprozessen: AI Factory bietet Dienste zur Integration von ML-Modellen in bestehende Geschäftsabläufe. Das ERGO-Team konzentriert sich vor allem auf die Standardisierung von Prozessen und die enge Zusammenarbeit mit geschäftlichen und technischen Stakeholdern. Das übergreifende Ziel besteht darin, das KI-Modell in kürzester Zeit zu operationalisieren und dabei hohe Qualitäts- und Sicherheitsstandards zu wahren.

Die Architektur der AI Factory
Die Architektur der Plattform basiert auf fünf Workflow-SchrittenAmazon Web Services

Umgebung für die Datenerfassung: Hier werden die Informationen aus bekannten On-Premises-Datenquellen von ERGO übernommen. Ihre Batch- oder Delta-Übertragung an verschiedene Cloud-Ziele lässt sich mithilfe mehrerer mit Kubernetes gehosteten Microservices planen. Nach dem Einlesen werden die Daten als ERGO Data Lake auf Amazon S3 persistent gespeichert, katalogisiert und auf die Verarbeitung durch die Upstream-Umgebungen vorbereitet.
Umgebung für die Modellentwicklung: Diese Umgebung wird hauptsächlich von Data Scientists und Data Engineers genutzt. Für die Datenaufbereitung, das Daten-Wrangling – also das Transformieren und Zuordnen in bestimmte Formate – das Experimentieren mit Vorhersagemodellen sowie für die Entwicklung auf Basis schneller Iterationen kommen Amazon EMR und Amazon SageMaker zum Einsatz.
Umgebung für die Modell-Operationalisierung: In diesem Schritt werden die trainierten Modelle mit zufriedenstellenden KPIs, von der Modellentwicklung in die Operationalisierungsumgebung überführt und damit in bestehende Geschäftsprozesse integriert. Das Team konzentriert sich dabei auf die Einführung und Optimierung des Betriebs von Diensten und Algorithmen. Eine wesentliche Voraussetzung für die erfolgreiche Operationalisierung von Modellen ist die kontinuierliche Überwachung der Qualität der eingesetzten ML-Modelle mithilfe des „Feedback Loop Service“. Die Einbindung der KI-Modelle in Geschäftsabläufe wird mithilfe des von Kubernetes gehosteten „Model Service“ ermöglicht.
 Umgebung für Modelleinsichten: Hier werden die Informationen über Plattformleistung, Prozesse und Analysedaten angezeigt. Datenwissenschaftler prüfen anhand dieser Dienste, ob ein Modell unerwartete Verzerrungen oder Leistungsabweichungen aufweist. Rückmeldungen über den „Feedback Loop Service“ unterstützen sie dabei, Probleme schnell zu erkennen und das Modell neu zu trainieren.
Shared-Services-Umgebung: Obwohl als fünfter Schritt des Workflows dargestellt, unterstützt die Shared-Services-Umgebung fast jeden Schritt des Prozesses. Sie bietet gemeinsame Komponenten für verschiedene Teile der Plattform, die CI/CD- und Orchestrierungsprozesse innerhalb der AI Factory verwalten. Zusätzliche Dienste wie Plattformprotokollierung und -überwachung, Authentifizierung und Metadaten-Management werden ebenfalls von der Shared-Services-Umgebung bereitgestellt.

Die Autoren: Piotr Klesta, Robert Meisner & Sid SinghPiotr Klesta ist eine erfahrene Führungskraft mit umfassenden Managementkenntnissen, die er in großen Versicherungs-, Bank- und Technologieunternehmen erworben hat. Als Delivery Director und Mitglied des ERGO-Führungsteams entwickelt Piotr Klesta die Roadmap und leitet das Portfolio von Projekten und strategischen Initiativen im Bereich KI und Daten. Zuletzt leitete er den erfolgreichen Launch der AI Factory, führte neue Arbeitsweisen ein und baute Partnerschaften und leistungsstarke Teams auf.
Robert Meisner verfügt über mehr als 12 Jahre Erfahrung im Bereich InsurTech und ist Lead Product Owner der AI Factory bei ERGO. Robert Meisner bietet MLOps-Funktionen an, die die Zeit für die Datenintegration und -aufbereitung zugunsten der eigentlichen Data-Science-Arbeit reduzieren. Er ist davon überzeugt, dass zuverlässige KI schon bald zu einem geschäftlichen Muss werden wird, das Fairness, Verständlichkeit, Stabilität, Datenherkunft und Transparenz gewährleistet.
Sid Singh ist Senior Solutions Architect bei Amazon Web Services (Webseite). Er arbeitet mit globalen Finanzdienstleistungskunden zusammen und verfügt über mehr als 10 Jahre Branchenerfahrung mit einer breiten Palette von Technologien. Außerhalb der Arbeit reist er gerne, ist ein begeisterter Feinschmecker und Liebhaber von bayerischem Bier. 
Über die verschiedenen Subplattformen hinweg werden alle Bereitstellungs- und Implementierungsaktivitäten mithilfe von IaC-Verfahren (Infrastructure as Code) automatisiert. Dies reduziert das Potenzial für menschliche Fehler, erhöht die architektonische Flexibilität und beschleunigt die Softwareentwicklung sowie die infrastrukturbezogenen Abläufe erheblich.
Alle Komponenten der AI Factory werden in der AWS-Cloud ausgeführt und lassen sich nach Bedarf skalieren und anpassen. Die Verbindung zwischen Modellentwicklung und Operationalisierung erfolgt über klar definierte Schnittstellen, um eine unnötige Verknüpfung von Komponenten zu verhindern.
Lessons Learned

Security first


Frühzeitige und häufige Abstimmung mit dem Sicherheitsteam;
Verstehen aller rechtlichen Verpflichtungen und Dokumentation als kritische, nicht-funktionale Anforderungen.


Modularer Ansatz


Kombination moderner Data-Science-Technologie und professioneller IT mit einer funktionsübergreifenden, agilen Arbeitsweise;
Anwendung lose gekoppelter Dienste mit einem API-First-Ansatz.


Data Governance


Nachverfolgung technischer Metadaten unter Berücksichtigung geschäftlicher Attribute;
Bestimmen der Dateneigentümerschaft in operativen Systemen, um vorgelagerte Data-Governance-Workflows abzubilden;
Erarbeiten von Lösungen für die Datenmaskierung, die erforderlich sind, wenn Informationen über Sub-Plattformen verschoben werden;
Definition von Zugriffsrechten und Berechtigungsgrenzen zwischen verschiedenen Personas.


FinOps-Strategie


Sorgfältige Kontrolle der Plattformkosten;
Zuweisung von Verantwortlichkeiten für Überwachung und Kostenkontrolle;
Regelmäßiges Feedback an die Plattform-Stakeholder über Nutzungsmuster und damit verbundene Kosten.


Zusammenarbeit mit dem AWS-Team

– Definition fester Zeiten für die Überprüfung der Architektur und die Aktualisierung neuer Funktionen;
– Planung von Cloud-Schulungen.
Die Zukunft der AI Factory
Die Entwicklung der AI Factory stellt einen wesentlichen Baustein der ERGO-Strategie dar und schafft die Voraussetzung zur Erstellung noch tiefer gehender Analysen. Dabei konzentriert sich das Team auf wichtige Anwendungsfälle, die einen besonders hohen Geschäftswert liefern.
Die Funktionen der AI Factory sollen erweitert und skaliert werden. Damit wird die Plattform auch für die internationalen ERGO-Tochtergesellschaften verfügbar.”
Geplant sind die Einrichtung einer „Drehscheibe für analytische Inhalte“, die auf automatischer Textextraktion basiert, eine verbesserte Umwandlung von Sprache in Text sowie die Entwicklung von Übersetzungsprozessen für alle unstrukturierten und semistrukturierten Daten mit Hilfe von AWS AI Services.Piotr Klesta (ERGO), Robert Meisner (ERGO) & Sid Singh (Amazon)

 Sie finden diesen Artikel im Internet auf der Website:https://itfm.link/124405



teilen teilen teilen teilen teilen RSS-feed E-Mail drucken 
 
Auch interessant





 



                  50.000 Besucher bei Amazon Web Services (AWS) und zwei innovative Versicherungs­anwendungen                









 



                  Cloud-Multicast-Datenservice für die Finanzbranche soll Daten zugänglicher machen                









 



                  Global Fintech Accelerator: Wie Amazon AWS und Nvidia die Fintech-Welt fördern wollen                












 



                  Optimierung des Sanktions-Screenings: Wege zur Reduzierung von False-Positives und Warnmeldungen                









 



                  Datenüberprüfung per LLM: Oper stellt KI-gestützte Produkt Features vor                









 



                  KYC und Unterschriften in Sekundenschnelle: IDnow führt neue Signaturlösungen ein                








 


AWS 


Schreiben Sie einen Kommentar Antworten abbrechenIhre E-Mail-Adresse wird nicht veröffentlicht. Erforderliche Felder sind mit * markiertKommentar * Name * 
E-Mail * 
 

 
",,,https://schema.org,,,,,,,,,,,,,,,,,,"[{'@type': 'Article', '@id': 'https://www.it-finanzmagazin.de/kuenstliche-intelligenz-ergo-entwickelt-eine-fuer-die-versicherungsbranche-revolutionaere-plattform-auf-aws-124405/#article', 'isPartOf': {'@id': 'https://www.it-finanzmagazin.de/kuenstliche-intelligenz-ergo-entwickelt-eine-fuer-die-versicherungsbranche-revolutionaere-plattform-auf-aws-124405/'}, 'author': {'name': 'IT Finanzmagazin /AJ', '@id': 'https://www.it-finanzmagazin.de/#/schema/person/17812389184cd4708128d17d7a2224ee'}, 'headline': 'Künstliche Intelligenz: ERGO&nbsp;entwickelt eine für die Versicherungsbranche re\xadvo\xadlu\xadtio\xadnä\xadre Plattform auf AWS', 'datePublished': '2021-09-07T08:20:49+00:00', 'dateModified': '2021-09-08T08:41:51+00:00', 'mainEntityOfPage': {'@id': 'https://www.it-finanzmagazin.de/kuenstliche-intelligenz-ergo-entwickelt-eine-fuer-die-versicherungsbranche-revolutionaere-plattform-auf-aws-124405/'}, 'wordCount': 1549, 'commentCount': 0, 'publisher': {'@id': 'https://www.it-finanzmagazin.de/#organization'}, 'image': {'@id': 'https://www.it-finanzmagazin.de/kuenstliche-intelligenz-ergo-entwickelt-eine-fuer-die-versicherungsbranche-revolutionaere-plattform-auf-aws-124405/#primaryimage'}, 'thumbnailUrl': 'https://www.it-finanzmagazin.de/wp-content/uploads/2021/09/AWS-516-2.jpg', 'keywords': ['AWS'], 'articleSection': ['Archiv', 'Strategie'], 'inLanguage': 'de-DE', 'potentialAction': [{'@type': 'CommentAction', 'name': 'Comment', 'target': ['https://www.it-finanzmagazin.de/kuenstliche-intelligenz-ergo-entwickelt-eine-fuer-die-versicherungsbranche-revolutionaere-plattform-auf-aws-124405/#respond']}], 'copyrightYear': '2021', 'copyrightHolder': {'@id': 'https://www.it-finanzmagazin.de/#organization'}}, {'@type': 'WebPage', '@id': 'https://www.it-finanzmagazin.de/kuenstliche-intelligenz-ergo-entwickelt-eine-fuer-die-versicherungsbranche-revolutionaere-plattform-auf-aws-124405/', 'url': 'https://www.it-finanzmagazin.de/kuenstliche-intelligenz-ergo-entwickelt-eine-fuer-die-versicherungsbranche-revolutionaere-plattform-auf-aws-124405/', 'name': 'AWS-Plattform von ERGO ist revolutionär für die Versicherungsbranche', 'isPartOf': {'@id': 'https://www.it-finanzmagazin.de/#website'}, 'primaryImageOfPage': {'@id': 'https://www.it-finanzmagazin.de/kuenstliche-intelligenz-ergo-entwickelt-eine-fuer-die-versicherungsbranche-revolutionaere-plattform-auf-aws-124405/#primaryimage'}, 'image': {'@id': 'https://www.it-finanzmagazin.de/kuenstliche-intelligenz-ergo-entwickelt-eine-fuer-die-versicherungsbranche-revolutionaere-plattform-auf-aws-124405/#primaryimage'}, 'thumbnailUrl': 'https://www.it-finanzmagazin.de/wp-content/uploads/2021/09/AWS-516-2.jpg', 'datePublished': '2021-09-07T08:20:49+00:00', 'dateModified': '2021-09-08T08:41:51+00:00', 'description': 'Wird KI im Versicherungswesen richtig eingesetzt, kann sie die Entscheidungsfindung verbessern und eine reibungslose Kundenbetreuung bieten.', 'breadcrumb': {'@id': 'https://www.it-finanzmagazin.de/kuenstliche-intelligenz-ergo-entwickelt-eine-fuer-die-versicherungsbranche-revolutionaere-plattform-auf-aws-124405/#breadcrumb'}, 'inLanguage': 'de-DE', 'potentialAction': [{'@type': 'ReadAction', 'target': ['https://www.it-finanzmagazin.de/kuenstliche-intelligenz-ergo-entwickelt-eine-fuer-die-versicherungsbranche-revolutionaere-plattform-auf-aws-124405/']}]}, {'@type': 'ImageObject', 'inLanguage': 'de-DE', '@id': 'https://www.it-finanzmagazin.de/kuenstliche-intelligenz-ergo-entwickelt-eine-fuer-die-versicherungsbranche-revolutionaere-plattform-auf-aws-124405/#primaryimage', 'url': 'https://www.it-finanzmagazin.de/wp-content/uploads/2021/09/AWS-516-2.jpg', 'contentUrl': 'https://www.it-finanzmagazin.de/wp-content/uploads/2021/09/AWS-516-2.jpg', 'width': 516, 'height': 424}, {'@type': 'BreadcrumbList', '@id': 'https://www.it-finanzmagazin.de/kuenstliche-intelligenz-ergo-entwickelt-eine-fuer-die-versicherungsbranche-revolutionaere-plattform-auf-aws-124405/#breadcrumb', 'itemListElement': [{'@type': 'ListItem', 'position': 1, 'name': 'Aktuell', 'item': 'https://www.it-finanzmagazin.de/'}, {'@type': 'ListItem', 'position': 2, 'name': 'Künstliche Intelligenz: ERGO&nbsp;entwickelt eine für die Versicherungsbranche re\xadvo\xadlu\xadtio\xadnä\xadre Plattform auf AWS'}]}, {'@type': 'WebSite', '@id': 'https://www.it-finanzmagazin.de/#website', 'url': 'https://www.it-finanzmagazin.de/', 'name': 'IT Finanzmagazin', 'description': 'Das Fachmagazin für IT und Organisation bei Banken, Sparkassen und Versicherungen', 'publisher': {'@id': 'https://www.it-finanzmagazin.de/#organization'}, 'potentialAction': [{'@type': 'SearchAction', 'target': {'@type': 'EntryPoint', 'urlTemplate': 'https://www.it-finanzmagazin.de/?s={search_term_string}'}, 'query-input': 'required name=search_term_string'}], 'inLanguage': 'de-DE'}, {'@type': 'Organization', '@id': 'https://www.it-finanzmagazin.de/#organization', 'name': 'IT Finanzmagazin', 'url': 'https://www.it-finanzmagazin.de/', 'logo': {'@type': 'ImageObject', 'inLanguage': 'de-DE', '@id': 'https://www.it-finanzmagazin.de/#/schema/logo/image/', 'url': 'https://www.it-finanzmagazin.de/wp-content/uploads/2017/08/Logo-V6-2017-256.png', 'contentUrl': 'https://www.it-finanzmagazin.de/wp-content/uploads/2017/08/Logo-V6-2017-256.png', 'width': 256, 'height': 46, 'caption': 'IT Finanzmagazin'}, 'image': {'@id': 'https://www.it-finanzmagazin.de/#/schema/logo/image/'}, 'sameAs': ['https://www.facebook.com/ITFinanzmagazin/', 'https://x.com/ITFinanzmagazin', 'https://www.linkedin.com/company/it-finanzmagazin/', 'https://www.xing.com/news/pages/it-finanzmagazin-183', 'https://www.pinterest.de/ITFinanzmagazin', 'https://bsky.app/profile/it-finanzmagazin.bsky.social']}, {'@type': 'Person', '@id': 'https://www.it-finanzmagazin.de/#/schema/person/17812389184cd4708128d17d7a2224ee', 'name': 'IT Finanzmagazin /AJ', 'sameAs': ['https://www.it-finanzmagazin.de', 'https://www.facebook.com/pg/ITFinanzmagazin', 'https://x.com/@itfinanzmagazin'], 'url': 'https://www.it-finanzmagazin.de/author/it-finanzmagazin-aj-2/'}]"
