URL link,Title,Date,Source,Source Link,description,keywords,og:description,twitter:description,@context,@graph,article:section,article:summary,article text,@type,itemListElement,mainEntityOfPage,headline,datePublished,dateModified,image,author,isAccessibleForFree,hasPart,isPartOf,@id,publisher,alternativeHeadline,articleBody,video,articleSection,url,genre,inLanguage,thumbnailUrl,name,givenName,familyName,alternateName,jobTitle,mainEntity,breadcrumb
https://news.google.com/rss/articles/CBMicmh0dHBzOi8vd3d3LnRhZ2Vzc3BpZWdlbC5kZS93aXNzZW4vYmVybGluZXItdW5pcy11bmQtZGllLW5ldWVuLWtpLXN5c3RlbWUtd2lyLWhhYmVuLWNoYXRncHQtaW0tdmlzaWVyLTkzNjU1MjIuaHRtbNIBAA?oc=5,Berliner Unis und die neuen KI-Systeme: „Wir haben ChatGPT im Visier“ - Tagesspiegel,2023-02-20,Tagesspiegel,https://www.tagesspiegel.de,"Welche Folgen die Künstliche Intelligenz etwa für Prüfungsformate hat, wird intensiv diskutiert. Leitlinien gibt es noch nicht an den großen Berliner Unis.","['Hochschule', 'ChatGPT']","Welche Folgen die Künstliche Intelligenz etwa für Prüfungsformate hat, wird intensiv diskutiert. Leitlinien gibt es noch nicht an den großen Berliner Unis.",N/A,http://schema.org,,Wissen,N/A,"Sie befinden sich hier:StartseiteWissenBerliner Unis und die neuen KI-Systeme: „Wir haben ChatGPT im Visier“ © Thilo Rückeis TSP  Berliner Unis und die neuen KI-Systeme: „Wir haben ChatGPT im Visier“Welche Folgen die Künstliche Intelligenz etwa für Prüfungsformate hat, wird intensiv diskutiert. Leitlinien gibt es noch nicht an den großen Berliner Unis. Von  Amory Burchard 20.02.2023, 13:48 UhrEine Frage im Umgang mit ChatGPT und anderen KI-gestützten Systemen, die Klausuraufgaben lösen und Teile schriftlicher Hausarbeiten generieren können, ist schnell beantwortet. „Unsere Regelungen zu Täuschungen müssen derzeit nicht angepasst werden: Wer beim Schummeln erwischt wird, fällt bei der Prüfung durch.“ So positioniert sich Christian Schröder, Vizepräsident der TU Berlin für Studium und Lehre, auf Anfrage des Tagesspiegels.Genauso sieht man es auch an der Hertie School of Governance, der privaten Berliner Politik-Hochschule, die vor einer guten Woche wie berichtet als erste Hauptstadt-Hochschule konkrete interne Chatbot-Regeln veröffentlichte. Und die sind zu Täuschungsversuchen sehr deutlich: „Eine Arbeit, die von einer KI verfasst wurde, als eigene abzugeben, ist ein Plagiat und wird als solches geahndet.“Tägliches Entscheider-Briefing Der Newsletter zu Digitalisierung & KI für Experten aus Wirtschaft, Politik, Verbänden, Wissenschaft und NGOs. Hier geht es zur Anmeldung. So weit wie die Hertie School sind die staatlichen Hochschulen noch nicht. Ob zum Start des Sommersemesters am 1. April überall Richtlinien zur Hand sind, bleibt fraglich. Warum es kompliziert ist, zeigt sich exemplarisch an der Technischen Universität. Zu den ersten Einsichten über die Textmaschinen gehört, dass studentische Hausarbeiten und schriftliche Prüfungsformate nicht mehr dieselben sein können wie vorher. Eine Zeitenwende also für Leistungsnachweise an der Hochschule?Vermutlich weiterhin nutzbar sind offene digitale Prüfungsformate für spezielle Rechnungen und hochspezialisierte Fragen.Christian Schröder, TU-Vizepräsident für Studium und Lehre„Es ist aktuell klar, dass Hausarbeiten durch solche Programme beeinflusst werden können“, konstatiert TU-Vizepräsident Schröder. Wenn also Studierende ihre Semesterarbeiten anfertigen, ist die Versuchung groß, Fragestellungen an ChatGPT weiterzureichen und die Antworten als eigene einzubauen. Hier stellt sich den Hochschulen vor allem die Frage, wie sie das erkennen können.  Das ist ChatGPT ChatGPT ist ein Chatbot, der eine fortschrittliche Künstliche Intelligenz verwendet, um Texte zu erzeugen. Der Name steht für „Chat Generative Pre-trained Transformer“. Das KI-Tool wurde mit öffentlich zugänglichen Quellen trainiert und hat keine Möglichkeit, neue Informationen einzuspeisen. Sein Wissensstand ist von 2021.ChatGPT wurde von dem US-amerikanischen Unternehmen OpenAI entwickelt und im November 2022 veröffentlicht.Der Chatbot kann menschenähnliche Konversationen führen sowie Texte aller Art schreiben, darunter auch Gedichte, Aufsätze, Nachrichten oder Reden.TU-Vize Schröder sagt, es gebe noch keine dafür nutzbare Plagiatssoftware und verweist auf das in Entwicklung befindliche eigene Tool des Anbieters OpenAI. Zwei Berliner Internet-Forscher raten in einem Gastbeitrag für den Tagesspiegel jedoch dazu, auf die Softwares GPTZero oder AI Text Classifier zurückzugreifen.Kompliziert wird es Schröder zufolge insbesondere bei schriftlichen Prüfungen. Gefragt seien jetzt Formate, „in denen die Form der Hilfsmittel überprüfbar ist“. Sogenannte Open-Book-Klausuren, in denen die Studierenden Fachbücher, Nachschlagewerke und das Internet nutzen dürften, also auch ChatGPT, könne es in großen Grundlagenfächern nicht mehr geben. Neue Formate und Weiterbildung brauchen Zeit „Vermutlich weiterhin nutzbar“ seien solche offenen digitalen Formate „für spezielle Rechnungen und hochspezialisierte Fragen“ – wo der Chatbot nicht helfen kann. Letztlich müsse „für jede Prüfung individuell überprüft werden, welche Auswirkungen solche Programme haben“, so Schröder. Er sieht die Uni einerseits unter Zeitdruck, zu handeln. Andererseits brauche es einen längeren Vorlauf, um die Lehrenden weiterzubilden und ihnen einen Erfahrungsaustausch untereinander zu ermöglichen. All das brauche „Zeit, die wir dafür bekommen müssen“. Mehr zum Thema ChatGPT Erste Berliner Uni regelt ChatGPT Hertie School lässt Nutzung in engen Grenzen zu Künstliche Intelligenz in der Forschung Wie ChatGPT das wissenschaftliche Arbeiten verändern wird Interview mit einem Lehrer zu KI „ChatGPT kann eine große Entlastung sein“ Die Humboldt-Universität hat bereits einen Zeitplan, wie man zu Leitlinien kommen will, berichtete Niels Pinkwart, Vizepräsident für Lehre, jetzt im Akademischen Senat. Am 2. März findet ein Symposium auf dem Campus Adlershof dazu statt, besprochen werden sollen Möglichkeiten, Grenzen und technische Grundlagen der neuartigen Software in der Lehre. Weitere Workshops schließen sich an, die in eine Positionierung der Uni münden sollen. „Wir haben das Thema im Visier“, so Pinkwart.Das Präsidium der Freien Universität trifft sich in dieser Woche zu einer Strategiesitzung, heißt es aus Dahlem. Zwar habe man sich noch keinen Termin für FU-Richtlinien gesetzt, aber schon jetzt gelte selbstverständlich: Werden Hausarbeiten mithilfe von KI angefertigt, wird „ein solches Vorgehen prüfungsrechtlich als Täuschung eingeordnet“.Allerdings sei an der FU bislang „zentral kein solcher Fall bekannt“. Auch an der TU „wurde bisher kein Fall gemeldet“. Sind die Studierenden klug genug, nicht mit ChatGPT zu schummeln – oder sich nicht erwischen zu lassen? Es ist noch viel zu klären im Umgang mit der Text-KI. Nicht zuletzt, wobei sie Studierenden sinnvoll und legal helfen kann.Zur StartseiteshowPaywall:falseisSubscriber:falseisPaid:showPaywallPiano:false0Kommentareper E-Mail teilenauf Facebook teilenauf Twitter teilenper WhatsApp teilenauf Pocket teilenper E-Mail teilen0KommentareAusblenden",NewsArticle,,"{'@type': 'WebPage', 'url': 'https://www.tagesspiegel.de/wissen/berliner-unis-und-die-neuen-ki-systeme-wir-haben-chatgpt-im-visier-9365522.html'}",Berliner Unis und die neuen KI-Systeme: „Wir haben ChatGPT im Visier“,2023-02-20T12:48:30.000Z,,"[{'@type': 'ImageObject', 'url': '/images/heprodimagesfotos87120150602tuthilojpg1/alternates/BASE_1_1_W1000/heprodimagesfotos87120150602tuthilojpg.jpeg', 'width': 1000, 'height': 1000}, {'@type': 'ImageObject', 'url': '/images/heprodimagesfotos87120150602tuthilojpg1/alternates/BASE_4_3_W1000/heprodimagesfotos87120150602tuthilojpg.jpeg', 'width': 1000, 'height': 750}, {'@type': 'ImageObject', 'url': '/images/heprodimagesfotos87120150602tuthilojpg1/alternates/BASE_21_9_W1000/heprodimagesfotos87120150602tuthilojpg.jpeg', 'width': 1000, 'height': 428}, {'@type': 'ImageObject', 'url': '/images/heprodimagesfotos87120150602tuthilojpg1/alternates/BASE_16_9_W1400/heprodimagesfotos87120150602tuthilojpg.jpeg', 'width': 1400, 'height': 787}, {'@type': 'ImageObject', 'url': '/images/heprodimagesfotos87120150602tuthilojpg1/alternates/BASE_21_9_W2000/heprodimagesfotos87120150602tuthilojpg.jpeg', 'width': 2000, 'height': 857}]","[{'name': 'Amory Burchard', '@type': 'Person', 'url': '/autoren/amory-burchard'}]",True,,,,"{'@id': 'tagesspiegel.de', '@type': 'Organization', 'name': 'Der Tagesspiegel', 'logo': {'@type': 'ImageObject', 'url': '/logos/tagesspiegel.svg', 'width': 1000, 'height': 136}}",Berliner Unis und die neuen KI-Systeme: „Wir haben ChatGPT im Visier“,,,Wissen,https://www.tagesspiegel.de/wissen/berliner-unis-und-die-neuen-ki-systeme-wir-haben-chatgpt-im-visier-9365522.html,,,,,,,,,,
https://news.google.com/rss/articles/CBMibWh0dHBzOi8vd3d3LmRlcnN0YW5kYXJkLmRlL3N0b3J5LzIwMDAxNDM2NDA1OTAva3JlYXRpdi1hdWYta29tbWFuZG8ta2Fubi1rdWVuc3RsaWNoZS1pbnRlbGxpZ2Vuei1rdW5zdC1tYWNoZW7SAQA?oc=5,Wie künstliche Intelligenz den Kunstbetrieb umkrempelt - Bildende Kunst - DER STANDARD,2023-02-17,DER STANDARD,https://www.derstandard.de,"Erteilt man KI-Bildgeneratoren konkrete Anweisungen, erstellen sie in Windeseile Bilder, Fotos und Grafiken. Welche Probleme bringt das? Und welchen Nutzen?",N/A,"Erteilt man KI-Bildgeneratoren konkrete Anweisungen, erstellen sie in Windeseile Bilder, Fotos und Grafiken. Welche Probleme bringt das? Und welchen Nutzen?","Erteilt man KI-Bildgeneratoren konkrete Anweisungen, erstellen sie in Windeseile Bilder, Fotos und Grafiken. Welche Probleme bringt das? Und welchen Nutzen?",,,N/A,N/A,"



Kreativ auf Knopfdruck
Wie künstliche Intelligenz den Kunstbetrieb umkrempelt
Erteilt man KI-Bildgeneratoren konkrete Anweisungen, erstellen sie in Windeseile Bilder, Fotos und Grafiken. Welche Probleme bringt das? Und welchen Nutzen?












DALL·E 2023-02-13 09.55.28 - An oil painting by Monet of robot painter


Foto: Rustler / Dall-E




Um Missverständnissen vorzubeugen, eine Info vorab: Ohne menschliche Anweisung würde das Bild des Roboter-Künstlers (siehe oben), das durch die simple Eingabe des Satzes ""An oil painting by Monet of robot painter"" in den KI-Bildgenerator Dall-E in Sekundenschnelle erschaffen wurde, nicht existieren. Ohne konkretes Kommando rührt die künstliche Intelligenz nämlich keinen Finger.



Willkommen bei DER STANDARD

Sie entscheiden darüber, wie Sie unsere Inhalte nutzen wollen. Ihr Gerät erlaubt uns derzeit leider nicht, die entsprechenden Optionen anzuzeigen.

Bitte deaktivieren Sie sämtliche Hard- und Software-Komponenten, die in der Lage sind Teile unserer Website zu blockieren. Z.B. Browser-AddOns wie Adblocker oder auch netzwerktechnische Filter.
Sie haben ein PUR-Abo? Hier anmelden.


",,,,,,,,,,,,,,,,,,,,,,,,,,,,
https://news.google.com/rss/articles/CBMiY2h0dHBzOi8vd3d3LmJhem9ubGluZS5jaC93aXJkLWt1ZW5zdGxpY2hlLWludGVsbGlnZW56LWJhbGQtYXVjaC1tZWluZS1hcmJlaXQtZXJsZWRpZ2VuLTY3NzY5OTQ5MDQ0M9IBAA?oc=5,Wird künstliche Intelligenz bald auch meine Arbeit erledigen? - Basler Zeitung,2023-02-20,Basler Zeitung,https://www.bazonline.ch,Welche Berufsausbildungen machen überhaupt noch Sinn? Und welche Jobs haben gute Zukunftsaussichten? Fachleute aus Basel geben Antwort. ,['municipality-Basel'],Welche Berufsausbildungen machen überhaupt noch Sinn? Und welche Jobs haben gute Zukunftsaussichten? Fachleute aus Basel geben Antwort. ,N/A,https://schema.org,,N/A,N/A,"Startseite|Basel|Q&A: Berufe der Zukunft: Wird künstliche Intelligenz bald auch meine Arbeit erledigen? Q&A: Berufe der Zukunft – Wird künstliche Intelligenz bald auch meine Arbeit erledigen? Welche Berufsausbildungen machen überhaupt noch Sinn? Und welche Jobs haben gute Zukunftsaussichten? Fachleute aus Basel geben Antwort. Dina SambarPubliziert: 20.02.2023, 08:5011Roboter BlessU-2 segnet in der reformierten Kirche Rickenbach Kirchengänger (2019).Foto: Marc DahindenJetzt abonnieren und von der Vorlesefunktion profitieren.Abo abschliessenLoginBotTalkRoboter, die Fliessbandarbeit übernehmen, sind schon lange Alltag. Kassiererinnen wurden teilweise bereits durch Self-Check-outs ersetzt. Taxifahrer wird es in selbstfahrenden Fahrzeugen nicht mehr brauchen. Und nun kann künstliche Intelligenz (KI) immer mehr Bürojobs und qualifizierte Arbeiten übernehmen. ",Person,"[{'@type': 'ListItem', 'position': 1, 'name': 'Startseite', 'item': 'https://www.bazonline.ch/'}, {'@type': 'ListItem', 'position': 2, 'name': 'Basel', 'item': 'https://www.bazonline.ch/basel'}, {'@type': 'ListItem', 'position': 3, 'name': 'Q&A: Berufe der Zukunft: Wird künstliche Intelligenz bald auch meine Arbeit erledigen?\xa0', 'item': 'https://www.bazonline.ch/wird-kuenstliche-intelligenz-bald-auch-meine-arbeit-erledigen-677699490443'}]","{'@type': 'WebPage', '@id': 'https://www.bazonline.ch/wird-kuenstliche-intelligenz-bald-auch-meine-arbeit-erledigen-677699490443'}",Q&A: Berufe der Zukunft: Wird künstliche Intelligenz bald auch meine Arbeit erledigen? ,2023-02-20T08:50:09+01:00,2023-02-20T07:50:09.000Z,"https://cdn.unitycms.io/images/7uARrajpKsq8fJFQESGnjC.jpg?op=ocroped&val=400,400,500,1000,0,243&sum=k5-BwPixyg0","[{'@type': 'Person', 'name': 'Dina Sambar', 'url': 'https://www.bazonline.ch/author/23844570/dina-sambar', '@id': 'https://www.bazonline.ch/author/23844570/dina-sambar#Person'}]",False,"{'@type': 'WebPageElement', 'isAccessibleForFree': False, 'cssSelector': '._paywalled-content'}",,23844570,"{'@type': 'Organization', 'name': 'Tamedia Espace AG', 'url': 'https://www.bazonline.ch', 'sameAs': 'https://www.facebook.com/BaslerZeitung/', 'logo': {'@type': 'ImageObject', 'url': 'https://www.bazonline.ch/_next/static/media/logo_bazonline.42f1ca99.png'}}",,,,basel,https://www.bazonline.ch/wird-kuenstliche-intelligenz-bald-auch-meine-arbeit-erledigen-677699490443,news,de,"https://cdn.unitycms.io/images/7hofYL_VKlMAyR6VOgVLT6.jpg?op=ocroped&val=1200,630,1000,1000,0,0&sum=nAdMGnzLnlU",Dina Sambar,Dina,Sambar,dis,Author,,
https://news.google.com/rss/articles/CBMihAFodHRwczovL3d3dy5pbmdhbWUuZGUvbmV3cy9ndGEtNi1mYW4ta2ktY292ZXItZW50d3VyZi1ncmFuZC10aGVmdC1hdXRvLWt1ZW5zdGxpY2hlLWludGVsbGlnZW56LXNwaWVsLWFpLXJlZGRpdC1oYW1idXJnLTkyMDk1ODQ0Lmh0bWzSAQA?oc=5,GTA 6: Künstliche Intelligenz erstellt Cover – So genial kann das neue Spiel aussehen - ingame.de,2023-02-19,ingame.de,https://www.ingame.de,Seit Monaten kreieren Fans ihre eigenen Cover zu GTA 6. Ein Reddit-User hat diesen Job jetzt aber einer KI überlassen und begeistert damit alle.,N/A,N/A,N/A,http://schema.org,,N/A,N/A,"ingameGamingGTA 6: Künstliche Intelligenz erstellt Cover – So genial kann das neue Spiel aussehenStand: 19.02.2023, 08:56 UhrVon: Aileen UdowenkoKommentareDruckenTeilen










Seit Monaten kreieren Fans ihre eigenen Cover zu GTA 6. Ein Reddit-User hat diesen Job jetzt aber einer KI überlassen und begeistert damit alle.Hamburg – Rockstar lässt seine Fans zu GTA 6 immer noch komplett im Dunkeln. Weder einen Trailer noch ein erstes offizielles Artwork bekam die GTA-Community bisher zu sehen. Kein Wunder also, dass die Fans fleißig dabei sind, ihre eigenen kreativen Ideen umzusetzen. Neben Logos wird auch an Covern für das Spiel gebastelt. Ein Fan hat sich dabei jetzt etwas Besonderes überlegt und eine KI die ganze Arbeit für ihn machen lassen. Das Ergebnis ist überraschend gut.Titel des SpielsGrand Theft Auto VI (noch nicht bestätigt)Release (Datum der Erstveröffentlichung)TBAPublisherRockstar GamesEntwicklerstudioRockstar NorthPlattformenPS5, Xbox Series X/S, PC (noch nicht bestätigt)GenreOpen-World, ActionFan lässt KI Cover für GTA 6 erstellen – Fans sind begeistert vom LookDas ist passiert: Man muss nicht immer alles selber machen – zumindest dann nicht, wenn einem eine KI die Arbeit abnehmen kann. Das dachte sich auch ein GTA-Fan auf Reddit. Der User kuznetskiy wollte nämlich ein eigenes Cover für den bevorstehenden sechsten Teil im GTA-Kosmos entwerfen, dabei holte er sich allerdings tatkräftige Unterstützung.Das sind KIsKünstliche Intelligenzen übernehmen gerade das Internet. Es handelt sich hierbei um Bots, die so programmiert worden, dass sie menschliches Handeln und Gedanken imitieren können. Somit kann die KI durch das Einspeisen vieler Information oder durch den Zugriff auf das Internet eigenständig Antworten finden oder auch Probleme lösen. KIs kommen dabei in verschiedenen Bereichen zum Einsatz. Der Bot ChatGPT ist beispielsweise spezialisiert auf das Schreiben in Textform, wohingegen Midjourney Bilder generieren kann.Zusammen mit der KI Midjourney entwarf kuznetskiy ein Cover, dass in der Community für reichlich Staunen sorgte. Obwohl bisher fast noch nichts über das Spiel bekannt ist, trifft das Artwork der KI sehr gut den Stil des Mega-Leaks des vergangenen Jahres. Das Entwicklerstudio gab noch keine offiziellen Informationen an die Spieler, allerdings sorgte ein Valentinstags-Post von Rockstar für Aufsehen bei Fans. So sieht das Cover auf Reddit aus:Wer hat sich da versteckt? Wachsamen Augen dürfte wohl aufgefallen sein, dass sich auch ein bekannter Schauspieler auf das Cover geschmuggelt hat. Denn der Mann ganz links unten im Bild erinnert sehr an Michael McKean. Allerdings ist es weniger überraschend, dass sich die KI an seinem Gesicht bedient hat, denn McKean verkörperte in der Serie Better Call Saul die Figur Chuck McGill. Da es sich bei der Serie um ein Spin-off von Breaking Bad handelt, in der es um Drogen geht, ist eine Herleitung zum GTA-Franchise gar nicht weit hergeholt.GTA 6: KI erstellt Cover – Fans feiern das ernste ArtworkFans sind begeistert: Natürlich tummeln sich in verschiedenen Foren zu GTA 6 massig Fan-Cover. Doch kuznetskiy scheint mit seiner KI-Version genau ins Schwarze getroffen zu haben. Unter seinem Post bekommt er nämlich massig Zuspruch für das Bild. Besonders die düstere Atmosphäre scheint den Fans zu gefallen. Das Cover zu GTA 5 ist im Gegensatz zur KI-Version noch deutlich bunter. Das sagen die Fans:Interessiert Dich bestimmt auchEx-Frau von Mois erhebt schwere Vorwürfe, berichtet von 7 Jahren UnterdrückungDie ultimative Star-Trek-Simulation auf Steam lässt euch sogar Neelix nachspielenOld_Bar: „Das ist wirklich das beste Cover bisher. Ich mag den ernsten und düsteren Ton.“SultyBoi: „Das ist krasse KI-Kunst. KIs werden von Tag zu Tag beeindruckender.“ChildhoodResident: „Das sieht sehr realistisch aus.“AcademicSavings: „Sieht gut aus und niemand hat acht Finger.“Falls ihr jetzt selber versuchen wollt, ein GTA6-Cover zu erstellen, haben wir hier eine Anleitung für Midjourney erstellt. Natürlich könnt ihr mit der KI auch noch andere Dinge erstellen. Wir haben mit der KI bekannte deutsche Streamer zu Autos zu verwandeln.Auch interessant



 

































SkipAds by 






This Is The #1 Star Trek Game On Desktop
Star Trek Fleet Command Is Now on Desktop. Download Now for Free
Star Trek Fleet Command










7 Wealth Tips Once Your Portfolio Reaches $1 Million
How do retirees take steps to preserve their wealth in retirement? Download The Seven Secrets of High Net Worth Investors now.
Fisher Investments










Cardiologist: How To Quickly Lose a Hanging Belly
getfittoday.online










Explore Our Collection of Games to Keep You Entertained
ArcadeGamesFree is an exciting gaming extension that provides you with the best & engaging arcade, puzzle, strategy and other browser games!
arcadegamesfree.app










Seniors in District Of Columbia Are Eligible For Hearing Aids In July
HearClear



 













Urologist: Do This If You Have an Enlarged Prostate
Prostate Reports










Warzone: Cheater entwickeln dreisten Hack – Reports deutlich schwerer










Kim Kardashian will Roblox verklagen – Sohn entdeckt altes „Amateur-Video“










Heart Surgeon Begs Americans: ""Stop Eating These Blueberries For Breakfast"" (Here's Why)
Learn More thehealthyfat.com



 














Japaner erklärt, wie (un)authentisch Assassin’s Creed Shadows Japan darstellt










Meet the powerful tools everyone needs to thrive at work.
Adobe Systems Incorporated










Rammstein: YouTuberin packt über Vorwürfe aus – „Es sind Hunderte Mädchen betroffen“



 














Many Travelers Don't Realize Flying Private Is Cheap (Check The Price)
Click Here bestsearches.net










7 vs. Wild: Fritz Meinecke stinksauer – Zuschauer verpetzen YouTuber bei Bundesbehörde










Tinnitus? When The Ringing Won't Stop, Do This (It's Genius)
WG Tinnitus










MontanaBlack: Schlimmer Herz-Schmerz – „Konnte nie 100 Prozent damit abschließen“



 






KommentareTeilen",WebPage,,,,,,,,,,,,,,,,,,,,,,,,,,"{'@type': 'NewsArticle', 'mainEntityOfPage': 'https://www.ingame.de/news/gta-6-fan-ki-cover-entwurf-grand-theft-auto-kuenstliche-intelligenz-spiel-ai-reddit-hamburg-92095844.html', 'headline': 'GTA 6: Künstliche Intelligenz erstellt Cover – So genial kann das neue Spiel aussehen', 'datePublished': '2023-02-19T08:56:11+0100', 'description': 'Seit Monaten kreieren Fans ihre eigenen Cover zu GTA 6. Ein Reddit-User hat diesen Job jetzt aber einer KI überlassen und begeistert damit alle.', 'publisher': {'@type': 'Organization', 'name': 'ingame', 'logo': 'https://idcdn.de/west/assets/ingame/img/logo.svg'}, 'author': {'@type': 'Person', 'name': 'Aileen Udowenko', 'url': 'https://www.ingame.de/autoren/18817/'}, 'image': ['https://www.ingame.de/assets/images/30/935/30935453-gta-fan-freut-sich-ueber-ki-cover-von-gta-3ni94vSLPGea.jpg', 'https://www.ingame.de/assets/images/30/935/30935453-gta-fan-freut-sich-ueber-ki-cover-von-gta-3ni94vSLPGe9.jpg', 'https://www.ingame.de/assets/images/30/935/30935453-gta-fan-freut-sich-ueber-ki-cover-von-gta-3ni94vSLPGec.jpg'], 'mentions': {'name': 'GTA 6', '@type': 'Thing', '@id': 'https://data.globalnewsgraph.org/gng/catchword/gta-6', 'description': '', 'sameAs': ['http://www.wikidata.org/entity/Q23648408'], 'url': ['https://www.ingame.de/thema/gta-6-sti1258968/', 'https://www.dasgelbeblatt.de/thema/gta-6-sti1406312/']}}","{'@type': 'BreadcrumbList', 'name': 'BreadCrumb', 'itemListElement': [{'@type': 'ListItem', 'position': 1, 'name': 'ingame', 'item': {'@type': 'WebPage', '@id': 'https://www.ingame.de/'}}, {'@type': 'ListItem', 'position': 2, 'name': 'Gaming', 'item': {'@type': 'WebPage', '@id': 'https://www.ingame.de/news/'}}]}"
https://news.google.com/rss/articles/CBMiamh0dHBzOi8vd3d3Lmx1emVybmVyemVpdHVuZy5jaC9rdWx0dXIvemVudHJhbHNjaHdlaXovc2NoYWZmdC1rdW5zdGxpY2hlLWludGVsbGlnZW56LWVjaHRlLWt1bnN0LWxkLjI0MTc3MTnSAQA?oc=5,Künstliche Intelligenz (KI) schafft Kunst: Dragica Kahlina erklär - Luzerner Zeitung,2023-02-18,Luzerner Zeitung,https://www.luzernerzeitung.ch,"Künstliche Intelligenzen, die auf Kommando in Sekunden ganze Gemälde «malen», werden immer populärer. Dragica Kahlina, Dozentin der Hochschule Luzern, erklärt.","['Kunst', 'Künstliche Intelligenz', 'Kunst', 'Technik und Informationstechnologie', 'Hochschule Luzern', 'Théâtre', 'Martin Zimmermann', 'Jason Allen', 'Jan Vermeer', 'Leonardo da Vinci']","Künstliche Intelligenzen, die auf Kommando in Sekunden ganze Gemälde «malen», werden immer populärer. Dragica Kahlina, Dozentin der Hochschule Luzern, erklärt.","Künstliche Intelligenzen, die auf Kommando in Sekunden ganze Gemälde «malen», werden immer populärer. Dragica Kahlina, Dozentin der Hochschule Luzern, erklärt.",http://schema.org,,N/A,N/A,"             
    Mensch-Maschine
    «Ich will ein Mensch sein wie du»: Interview mit einer künstlichen Intelligenz            15.12.2022     ",NewsArticle,,"{'@type': 'WebPage', '@id': 'https://www.luzernerzeitung.ch/kultur/zentralschweiz/schafft-kunstliche-intelligenz-echte-kunst-ld.2417719'}",Künstliche Intelligenz (KI) schafft Kunst: Dragica Kahlina erklär,2023-02-17T15:33:24+02:00,2023-02-18T07:00:00+02:00,"{'@type': 'ImageObject', 'url': 'https://img.chmedia.ch/2023/02/17/b3d1e810-84ea-4405-8a9f-c4684fc444f6.jpeg?width=720&height=405&fit=bounds&quality=75&auto=webp&crop=720,405,x0,y72&wmark=none', 'width': 720, 'height': 405}","[{'@type': 'Person', 'name': 'Interview: Martin Zimmermann*'}]",False,"{'@type': 'WebPageElement', 'isAccessibleForFree': False, 'cssSelector': '.regwalled'}",,,"{'@type': 'NewsMediaOrganization', 'name': 'Luzerner Zeitung', 'url': 'https://www.luzernerzeitung.ch', 'logo': {'@type': 'ImageObject', 'url': 'https://www.luzernerzeitung.ch/publisher-logo.png', 'width': 116, 'height': 116}, 'contactPoint': [{'@type': 'ContactPoint', 'telephone': '+41-58-2005555', 'contactType': 'customer service'}], 'sameAs': ['https://www.facebook.com/LuzernerZeitung', 'https://www.instagram.com/luzernerzeitung.ch', 'https://www.twitter.com/LuzernerZeitung', 'https://www.linkedin.com/company/5330274', 'https://de.wikipedia.org/wiki/Luzerner_Zeitung', 'https://www.wikidata.org/wiki/Q683440'], 'masthead': 'https://www.luzernerzeitung.ch/impressum', 'foundingDate': '1996'}",Bilder durch künstliche Intelligenz: Ist das wirklich echte Kunst? Oder ein Bluff und  Betrug an den Kunstschaffenden?,,,Kultur,,,de,,,,,,,,
