URL link,Title,Date,Source,Source Link,description,keywords,og:description,twitter:description,@context,@type,about,articleBody,articleSection,author,dateCreated,dateModified,datePublished,headline,image,mainEntityOfPage,publisher,url,wordCount,alternativeHeadline,timeRequired,article:section,article:summary,article text,commentCount,copyrightHolder,copyrightYear,discussionUrl,identifier,inLanguage,isAccessibleForFree,isFamilyFriendly,isPartOf,provider,sourceOrganization,thumbnailUrl,version,@id,additionalType,itemListElement
https://news.google.com/rss/articles/CBMiWmh0dHBzOi8vd3d3LnN1ZWRkZXV0c2NoZS5kZS93aXJ0c2NoYWZ0L2t1ZW5zdGxpY2hlLWludGVsbGlnZW56LWFsZ29yaXRobWVuLWV0aGlrLTEuNDIzNTgxNtIBAA?oc=5,"Algorithmen ""Made in Germany"" - KI braucht Ethik - Wirtschaft - SZ.de - Süddeutsche Zeitung - SZ.de",2018-12-08,Süddeutsche Zeitung - SZ.de,https://www.sueddeutsche.de,"Schlau und fair soll künstliche Intelligenz aus Deutschland sein, findet Peter Buxmann. Ethik könne auch ein Standortvorteil sein.","Automatisierung,Computer,Künstliche Intelligenz,Technologie,Künstliche Intelligenz,Digital,Computer,Technologie,Wirtschaft,Süddeutsche Zeitung","Schlau und fair soll künstliche Intelligenz aus Deutschland sein, findet Peter Buxmann. Ethik könne auch ein Standortvorteil sein.",N/A,https://schema.org,NewsArticle,Künstliche Intelligenz,"Am Thema  künstliche Intelligenz  (KI) scheiden sich die Geister. Die einen befürworten eine intensive Nutzung von KI, darunter zum Beispiel der Facebook-Gründer Marc Zuckerberg. Er propagiert neue gesellschaftlich wünschenswerte Anwendungen wie etwa den Einsatz in der medizinischen Diagnose und Therapie. Eine große Zahl von Beratungsfirmen baut KI-Abteilungen auf und verdient damit viel Geld.
Der US-amerikanische Wirtschaftswissenschaftler Erik Brynjolfsson vom Massachusetts Institute of Technology bezeichnet künstliche Intelligenz als die bedeutendste ""General Purpose Technology"" (Basistechnologie) unserer Zeit. Die unzähligen Möglichkeiten, KI im Alltag oder branchenübergreifend in Unternehmen anzuwenden, scheinen ihm recht zu geben. Hinzu kommt, dass die Algorithmen viele Jobs in der Regel sehr gut erledigen: Sie analysieren auf Basis von CT-Bildern Krankheiten, sagen Aktienkurse vorher, erkennen Gesichter oder verhindern Cyberangriffe.
Auf der anderen Seite gibt es viele Kritiker, Tesla-Chef Elon Musk etwa, und auch das verstorbene Physik-Genie Stephen Hawking gehörte dazu. Die Befürchtung: KI könnte sich eines Tages selbst verbessern, sodass in einem sich verstärkenden Kreislauf eine Superintelligenz entsteht - ein Intellekt also, der dem Menschen in allen Bereichen überlegen ist und ihn beherrscht. Zukunftsforscher Ray Kurzweil ist angeblich sogar in der Lage, ein Datum zu nennen, wann dies passieren wird: im Jahr 2045. Ob die Prognose seriös ist, darf bezweifelt werden.
Algorithmen sind bisher nur sehr beschränkt einsetzbar
Algorithmen oder Roboter, die der Menschheit überlegen sind, sind seit Jahrzehnten ein beliebtes Thema und Gegenstand von Dystopien oder Science-Fiction-Filmen wie ""Alien"", ""Blade Runner"" oder ""Terminator"". Herbert A. Simon, einer der Väter der KI, sagte schon 1965 voraus, dass es nur noch zwanzig Jahre dauern werde, bis Maschinen in der Lage seien, jede Arbeit zu erledigen, die bislang Menschen vorbehalten war. Der Status quo der KI-Anwendung sieht dagegen so aus: Algorithmen sind darauf spezialisiert, bestimmte Probleme zu lösen; darin sind sie kaum zu schlagen, aber kein Algorithmus würde auf die Idee kommen, sein Anwendungsgebiet zu erweitern. Es gibt auch keine erfolgversprechenden Ansätze, die in der Lage wären, eine solche Superintelligenz mit eigenem Bewusstsein zu entwickeln.
Ist also alles in bester Ordnung? Können wir sorglos in eine Zukunft blicken, in der KI uns bei vielen Tätigkeiten und Entscheidungen unterstützt und unsere Gesellschaft dadurch verbessert? So einfach ist es leider nicht. Wir müssen beachten, dass es sich bei den meisten KI-Algorithmen um ""Black Boxes"" handelt. Sie geben häufig nicht preis, warum sie wie entschieden haben. Das mag in manchen Fällen unproblematisch sein, in vielen anderen ist es das aber nicht.
In einigen Unternehmen sind heute schon KI-Lösungen bei der Auswahl von Personal im Einsatz. Arbeitet der Algorithmus nach dem Black-Box-Prinzip, können wir die Auswahlentscheidung nicht erklären. Zudem wissen wir nicht, ob der Algorithmus Parameter wie Geschlecht, Hautfarbe oder Religion in seine Entscheidung einbezogen hat. Wollen wir solche Algorithmen? Die Antwort muss heißen: nein.
Ein weiterer kritischer Punkt ist das Thema Privatsphäre. KI-Algorithmen können relativ gut Daten verknüpfen und Personen zuordnen. Diese Algorithmen und Technologien könnten Wegbereiter für mehr Überwachung durch Staaten oder Firmen sein. So sind in China bereits erste Modelle im Einsatz, die Menschen anhand ihres Online- und Offline-Verhaltens bewerten. Dieses ""Scoring"" wird für Entscheidungen über die Vergabe von Krediten, Ausreisegenehmigungen oder den Zugang zum Internet herangezogen. Der sprichwörtliche gläserne Mensch wird durch KI noch transparenter. Auch hier lautet die Antwort auf die Frage, ob wir eine solche Gesellschaft wollen: nein.
Was folgt daraus? Ich denke nicht, dass wir KI-Forschung verteufeln und darauf verzichten sollten. Im Gegenteil, ein großes Problem für Europa und Deutschland besteht darin, dass wir im Bereich der künstlichen Intelligenz ins Hintertreffen geraten sind - wie bei anderen Digitalisierungsthemen auch. Die Investitionen in KI-Start-ups sind überwiegend auf zwei Länder verteilt: 48 Prozent dieser Investitionen entfielen im vergangenen Jahr auf China, weitere 38 Prozent auf den langjährigen Spitzenreiter USA. Der Rest der Welt ist weit abgeschlagen. Für Deutschland, eigentlich die Heimat vieler herausragender KI-Forscher, reicht es selbst in Europa nicht zum Spitzenplatz. Den hat Großbritannien inne, wo Start-ups wie Darktrace und Graphcore inzwischen den sogenannten Unicorn-Status erreicht haben, also mit mehr als einer Milliarde Dollar bewertet sind.
Interdsiziplinäre Forschung soll uns auf das KI-Zeitalter vorbereiten
Insofern gehen die Schritte von Europäischer Union und Bundesregierung in die richtige Richtung, mit Investitionen diesen Rückstand aufzuholen. Allerdings dürfen wir dabei nicht die Augen vor gesellschaftlich relevanten Themen wie Transparenz und Privatsphäre verschließen. Vor diesem Hintergrund erscheint insbesondere die Förderung von interdisziplinären Forschungsprojekten wünschenswert. Nur solche fächerübergreifenden Programme sind in der Lage, die potenziellen Folgen für Gesellschaft und Wirtschaft umfassend zu analysieren und soziologisch, historisch oder philosophisch gewonnene Erkenntnisse in die technologischen Entwicklungen zu integrieren.
Darüber hinaus besteht eine wichtige praktische Aufgabe darin, mehr Bewusstsein für die aktuellen Herausforderungen der KI zu schaffen. In einer aktuellen Studie zur KI-Nutzung im Personalbereich zeigte sich, dass vielen Verantwortlichen nicht bewusst war, dass sie mit einer Black Box arbeiten, die aufgrund des Algorithmus oder der Trainingsdaten rassistische oder sexistische Entscheidungen treffen könnte. Den Entscheidern ging es primär darum, Kosten und Zeit einzusparen. Erfreulicherweise gibt es aber bereits Ansätze in der Forschung, die sich um Transparenz bemühen, damit die Entscheidungen der KI für die Menschen nachvollziehbar werden. Intensive Aufklärung könnte den Anstoß dazu geben, dass KI-Nutzer zukünftig auf transparente und faire Algorithmen setzen.
Eine große Zahl von Menschen ist mittlerweile bereit, für Fair-Trade-Produkte einen hohen Preis zu zahlen. Vielleicht lässt sich diese Erfolgsgeschichte auch auf KI-Algorithmen übertragen. Deren Fairness könnte für die Anbieter und für die europäische Wirtschaft insgesamt zu einem Wettbewerbsvorteil werden.",Wirtschaft,"[{'@type': 'Organization', 'logo': {'@type': 'ImageObject', 'height': '64', 'url': 'https://www.sueddeutsche.de/szde-assets/img/szde-article-sueddeutsche-logo.svg', 'width': '525'}, 'name': 'Süddeutsche Zeitung'}]",2018-12-08T12:31:40.000Z,2018-12-08 12:36:50,2018-12-08T12:31:40.000Z,"Algorithmen ""Made in Germany"" - KI braucht Ethik","{'@type': 'ImageObject', 'height': '675', 'url': 'https://www.sueddeutsche.de/2022/06/22/3638a74b-709b-4a4c-987f-5164e4c3190f.jpeg?q=60&fm=webp&width=1200&rect=127%2C130%2C1131%2C636', 'width': '1200'}",https://www.sueddeutsche.de/wirtschaft/kuenstliche-intelligenz-algorithmen-ethik-1.4235816,"{'@type': 'Organization', 'logo': {'@type': 'ImageObject', 'height': '64', 'url': 'https://www.sueddeutsche.de/szde-assets/img/szde-article-sueddeutsche-logo.svg', 'width': '525'}, 'name': 'Süddeutsche Zeitung'}",https://www.sueddeutsche.de/wirtschaft/kuenstliche-intelligenz-algorithmen-ethik-1.4235816,884.0,"Algorithmen ""Made in Germany"" - KI braucht Ethik",PT4M,N/A,N/A,"Künstliche Intelligenz:Der gläserne Mensch wird durch KI noch transparenter8. Dezember 2018, 13:31 UhrLesezeit: 4 minDetailansicht öffnenKünstliche Intelligenz kann viele Dinge besser als Menschen, sie weiß nur nicht warum. (Foto: imago/Science Photo Library)Deutschland liegt im Rennen um künstliche Intelligenz hinter anderen Nationen zurück.Investitionen von EU und Bundesregierung sind deshalb eine gute Idee. Deutschland sollte dabei aber nicht auf ethische Standards verzichten.So könnte künstliche Intelligenz ""Made in Germany"" einen unerwarteten Wettbewerbsvorteil erlangen.Gastbeitrag von Peter BuxmannMerkenTeilenFeedbackDruckenAm Thema künstliche Intelligenz (KI) scheiden sich die Geister. Die einen befürworten eine intensive Nutzung von KI, darunter zum Beispiel der Facebook-Gründer Marc Zuckerberg. Er propagiert neue gesellschaftlich wünschenswerte Anwendungen wie etwa den Einsatz in der medizinischen Diagnose und Therapie. Eine große Zahl von Beratungsfirmen baut KI-Abteilungen auf und verdient damit viel Geld.Der US-amerikanische Wirtschaftswissenschaftler Erik Brynjolfsson vom Massachusetts Institute of Technology bezeichnet künstliche Intelligenz als die bedeutendste ""General Purpose Technology"" (Basistechnologie) unserer Zeit. Die unzähligen Möglichkeiten, KI im Alltag oder branchenübergreifend in Unternehmen anzuwenden, scheinen ihm recht zu geben. Hinzu kommt, dass die Algorithmen viele Jobs in der Regel sehr gut erledigen: Sie analysieren auf Basis von CT-Bildern Krankheiten, sagen Aktienkurse vorher, erkennen Gesichter oder verhindern Cyberangriffe.Detailansicht öffnenPeter Buxmann, 54, ist Universitätsprofessor für Wirtschaftsinformatik, Software & Digital Business an der TU Darmstadt und leitet dort auch das Innovations- und Gründungszentrum HIGHEST. (Foto: OH)Auf der anderen Seite gibt es viele Kritiker, Tesla-Chef Elon Musk etwa, und auch das verstorbene Physik-Genie Stephen Hawking gehörte dazu. Die Befürchtung: KI könnte sich eines Tages selbst verbessern, sodass in einem sich verstärkenden Kreislauf eine Superintelligenz entsteht - ein Intellekt also, der dem Menschen in allen Bereichen überlegen ist und ihn beherrscht. Zukunftsforscher Ray Kurzweil ist angeblich sogar in der Lage, ein Datum zu nennen, wann dies passieren wird: im Jahr 2045. Ob die Prognose seriös ist, darf bezweifelt werden.Algorithmen sind bisher nur sehr beschränkt einsetzbarAlgorithmen oder Roboter, die der Menschheit überlegen sind, sind seit Jahrzehnten ein beliebtes Thema und Gegenstand von Dystopien oder Science-Fiction-Filmen wie ""Alien"", ""Blade Runner"" oder ""Terminator"". Herbert A. Simon, einer der Väter der KI, sagte schon 1965 voraus, dass es nur noch zwanzig Jahre dauern werde, bis Maschinen in der Lage seien, jede Arbeit zu erledigen, die bislang Menschen vorbehalten war. Der Status quo der KI-Anwendung sieht dagegen so aus: Algorithmen sind darauf spezialisiert, bestimmte Probleme zu lösen; darin sind sie kaum zu schlagen, aber kein Algorithmus würde auf die Idee kommen, sein Anwendungsgebiet zu erweitern. Es gibt auch keine erfolgversprechenden Ansätze, die in der Lage wären, eine solche Superintelligenz mit eigenem Bewusstsein zu entwickeln.Bewerben:Wenn der Computer Nein sagtZunehmend wählen große Firmen ihre Bewerber mithilfe von Algorithmen aus. Viele Menschen, die einen Job suchen, wissen nicht, wie sie sich darauf einstellen sollen und wie man davon profitiert. Die wichtigsten Fragen und Antworten.Von Sven LüüsIst also alles in bester Ordnung? Können wir sorglos in eine Zukunft blicken, in der KI uns bei vielen Tätigkeiten und Entscheidungen unterstützt und unsere Gesellschaft dadurch verbessert? So einfach ist es leider nicht. Wir müssen beachten, dass es sich bei den meisten KI-Algorithmen um ""Black Boxes"" handelt. Sie geben häufig nicht preis, warum sie wie entschieden haben. Das mag in manchen Fällen unproblematisch sein, in vielen anderen ist es das aber nicht.In einigen Unternehmen sind heute schon KI-Lösungen bei der Auswahl von Personal im Einsatz. Arbeitet der Algorithmus nach dem Black-Box-Prinzip, können wir die Auswahlentscheidung nicht erklären. Zudem wissen wir nicht, ob der Algorithmus Parameter wie Geschlecht, Hautfarbe oder Religion in seine Entscheidung einbezogen hat. Wollen wir solche Algorithmen? Die Antwort muss heißen: nein.Ein weiterer kritischer Punkt ist das Thema Privatsphäre. KI-Algorithmen können relativ gut Daten verknüpfen und Personen zuordnen. Diese Algorithmen und Technologien könnten Wegbereiter für mehr Überwachung durch Staaten oder Firmen sein. So sind in China bereits erste Modelle im Einsatz, die Menschen anhand ihres Online- und Offline-Verhaltens bewerten. Dieses ""Scoring"" wird für Entscheidungen über die Vergabe von Krediten, Ausreisegenehmigungen oder den Zugang zum Internet herangezogen. Der sprichwörtliche gläserne Mensch wird durch KI noch transparenter. Auch hier lautet die Antwort auf die Frage, ob wir eine solche Gesellschaft wollen: nein.Was folgt daraus? Ich denke nicht, dass wir KI-Forschung verteufeln und darauf verzichten sollten. Im Gegenteil, ein großes Problem für Europa und Deutschland besteht darin, dass wir im Bereich der künstlichen Intelligenz ins Hintertreffen geraten sind - wie bei anderen Digitalisierungsthemen auch. Die Investitionen in KI-Start-ups sind überwiegend auf zwei Länder verteilt: 48 Prozent dieser Investitionen entfielen im vergangenen Jahr auf China, weitere 38 Prozent auf den langjährigen Spitzenreiter USA. Der Rest der Welt ist weit abgeschlagen. Für Deutschland, eigentlich die Heimat vieler herausragender KI-Forscher, reicht es selbst in Europa nicht zum Spitzenplatz. Den hat Großbritannien inne, wo Start-ups wie Darktrace und Graphcore inzwischen den sogenannten Unicorn-Status erreicht haben, also mit mehr als einer Milliarde Dollar bewertet sind.Interdsiziplinäre Forschung soll uns auf das KI-Zeitalter vorbereitenInsofern gehen die Schritte von Europäischer Union und Bundesregierung in die richtige Richtung, mit Investitionen diesen Rückstand aufzuholen. Allerdings dürfen wir dabei nicht die Augen vor gesellschaftlich relevanten Themen wie Transparenz und Privatsphäre verschließen. Vor diesem Hintergrund erscheint insbesondere die Förderung von interdisziplinären Forschungsprojekten wünschenswert. Nur solche fächerübergreifenden Programme sind in der Lage, die potenziellen Folgen für Gesellschaft und Wirtschaft umfassend zu analysieren und soziologisch, historisch oder philosophisch gewonnene Erkenntnisse in die technologischen Entwicklungen zu integrieren.Darüber hinaus besteht eine wichtige praktische Aufgabe darin, mehr Bewusstsein für die aktuellen Herausforderungen der KI zu schaffen. In einer aktuellen Studie zur KI-Nutzung im Personalbereich zeigte sich, dass vielen Verantwortlichen nicht bewusst war, dass sie mit einer Black Box arbeiten, die aufgrund des Algorithmus oder der Trainingsdaten rassistische oder sexistische Entscheidungen treffen könnte. Den Entscheidern ging es primär darum, Kosten und Zeit einzusparen. Erfreulicherweise gibt es aber bereits Ansätze in der Forschung, die sich um Transparenz bemühen, damit die Entscheidungen der KI für die Menschen nachvollziehbar werden. Intensive Aufklärung könnte den Anstoß dazu geben, dass KI-Nutzer zukünftig auf transparente und faire Algorithmen setzen.Eine große Zahl von Menschen ist mittlerweile bereit, für Fair-Trade-Produkte einen hohen Preis zu zahlen. Vielleicht lässt sich diese Erfolgsgeschichte auch auf KI-Algorithmen übertragen. Deren Fairness könnte für die Anbieter und für die europäische Wirtschaft insgesamt zu einem Wettbewerbsvorteil werden.© SZ vom 03.12.2018 - Rechte am Artikel können Sie hier erwerben.TeilenFeedbackDruckenZur SZ-StartseiteDigitalgipfel der Bundesregierung:Künstliche Intelligenz wird überschätztDie Superintelligenz wird uns nicht vernichten, teils funktionieren noch nicht einmal einfache KI-Produkte richtig. Dennoch darf Deutschland diese nächste Welle der Digitalisierung nicht verschlafen.Essay von Helmut Martin-JungLesen Sie mehr zum ThemaKünstliche IntelligenzDigitalComputerTechnologie",,,,,,,,,,,,,,,,
https://news.google.com/rss/articles/CBMidGh0dHBzOi8vd3d3LmhlaXNlLmRlL25ld3MvQ29tcHV0ZXItYWxzLVN0ZXVlcmZhaG5kZXIta3VlbnN0bGljaGUtSW50ZWxsaWdlbnotaGlsZnQtRXJtaXR0bHVuZ3NiZWhvZXJkZW4tNDI0NTkyNC5odG1s0gEA?oc=5,Computer als Steuerfahnder – künstliche Intelligenz hilft Ermittlungsbehörden - heise online,2018-12-08,heise online,https://www.heise.de,AdModule,"Behörden, Künstliche Intelligenz, Steuerfahndung, Steuerrecht","Die Suche nach Steuersündern in Millionen von Finanzdaten stellt Fahnder vor Probleme. Wo der Mensch an Grenzen stößt, könnte künstliche Intelligenz helfen.","Die Suche nach Steuersündern in Millionen von Finanzdaten stellt Fahnder vor Probleme. Wo der Mensch an Grenzen stößt, könnte künstliche Intelligenz helfen.",https://schema.org,ItemList,"[{'@id': 'https://www.heise.de/thema/K%C3%BCnstliche-Intelligenz', '@type': 'Thing', 'name': 'Künstliche Intelligenz'}, {'@id': 'https://www.heise.de/thema/Recht', '@type': 'Thing', 'name': 'Recht'}, {'@id': 'https://www.heise.de/thema/Steuerrecht', '@type': 'Thing', 'name': 'Steuerrecht'}]",,HO Navigation,"[{'@id': '2898587', '@type': 'Person', 'name': 'Göran Gehlen'}, {'@type': 'Person', 'name': 'dpa'}]",,2018-12-08T12:24:00+01:00,2018-12-08T12:24:00+01:00,Computer als Steuerfahnder – künstliche Intelligenz hilft Ermittlungsbehörden,"{'@type': 'ImageObject', 'height': 1079, 'url': 'https://www.heise.de/imgs/18/2/5/5/8/0/9/7/tax-return-1368168_1920-723c009906b9749a.jpeg', 'width': 1920}","{'@id': 'https://www.heise.de/news/Computer-als-Steuerfahnder-kuenstliche-Intelligenz-hilft-Ermittlungsbehoerden-4245924.html', '@type': 'WebPage', 'breadcrumb': {'@context': 'http://schema.org', '@type': 'BreadcrumbList', 'itemListElement': [{'@type': 'ListItem', 'item': {'@id': 'https://www.heise.de/', '@type': 'WebPage', 'name': 'heise online'}, 'position': 1}, {'@type': 'ListItem', 'item': {'@id': 'https://www.heise.de/newsticker/wissen/', '@type': 'WebPage', 'name': 'Wissen'}, 'position': 2}, {'@type': 'ListItem', 'item': {'@id': 'https://www.heise.de/news/Computer-als-Steuerfahnder-kuenstliche-Intelligenz-hilft-Ermittlungsbehoerden-4245924.html', '@type': 'WebPage', 'name': 'Computer als Steuerfahnder – künstliche Intelligenz hilft Ermittlungsbehörden'}, 'position': 3}]}}","{'@type': 'Organization', 'logo': {'@type': 'ImageObject', 'url': 'https://www.heise.de/icons/ho/opengraph/opengraph.png'}, 'name': 'heise online', 'url': 'https://www.heise.de'}",https://www.heise.de/news/Computer-als-Steuerfahnder-kuenstliche-Intelligenz-hilft-Ermittlungsbehoerden-4245924.html,580.0,Computer als Steuerfahnder – künstliche Intelligenz hilft Ermittlungsbehörden,PT4M,N/A,N/A,,66,"{'@id': 'https://www.heise.de', '@type': 'Organization', 'name': 'Heise Medien'}",2018,/forum/heise-online/News-Kommentare/Computer-als-Steuerfahnder-kuenstliche-Intelligenz-hilft-Ermittlungsbehoerden/forum-415160/comment/,2558097.0,de,True,True,"{'@type': ['Product'], 'name': 'heise online', 'productID': 'heise.de:basic'}",,"{'@id': 'https://www.heise.de/', '@type': 'Organization', 'identifier': 'ho', 'name': 'heise online'}",https://www.heise.de/imgs/18/2/5/5/8/0/9/7/tax-return-1368168_1920-723c009906b9749a.jpeg,,3632786,AdModule,"[{'@type': 'ListItem', 'position': 0, 'item': {'@type': 'WPAdBlock', '@id': '3631856', 'additionalType': 'StickyFooterAd'}}]"
https://news.google.com/rss/articles/CBMiWWh0dHBzOi8vd3d3LnRhZ2Vzc3BpZWdlbC5kZS93aXJ0c2NoYWZ0L3JvbGxzLXJveWNlLXNldHp0LWluLWRhaGxld2l0ei1hdWYta2ktNDk5NTM1NS5odG1s0gEA?oc=5,Digitale Technologien: Rolls Royce setzt in Dahlewitz auf KI - Tagesspiegel,2018-12-09,Tagesspiegel,https://www.tagesspiegel.de,Der größte deutsche Standort wird erneut aufgewertet. In einem virtuellen Triebwerk können Ingenieure demnächst ihre Veränderungen vornehmen.,['Digitalisierung &amp; KI'],Der größte deutsche Standort wird erneut aufgewertet. In einem virtuellen Triebwerk können Ingenieure demnächst ihre Veränderungen vornehmen.,N/A,http://schema.org,NewsArticle,,,Wirtschaft,"[{'name': 'Rainer W. During', '@type': 'Person', 'url': '/autoren/rainer-w-during'}]",,,2018-12-09T15:56:43.000Z,Digitale Technologien: Rolls Royce setzt in Dahlewitz auf KI,"[{'@type': 'ImageObject', 'url': '/wirtschaft/images/rolls-royce-seit-20-jahren-in-brandenburg-8692/alternates/BASE_1_1_W1000/rolls-royce-seit-20-jahren-in-brandenburg-8692.jpeg', 'width': 1000, 'height': 1000}, {'@type': 'ImageObject', 'url': '/wirtschaft/images/rolls-royce-seit-20-jahren-in-brandenburg-8692/alternates/BASE_4_3_W1000/rolls-royce-seit-20-jahren-in-brandenburg-8692.jpeg', 'width': 1000, 'height': 750}, {'@type': 'ImageObject', 'url': '/wirtschaft/images/rolls-royce-seit-20-jahren-in-brandenburg-8692/alternates/BASE_21_9_W1000/rolls-royce-seit-20-jahren-in-brandenburg-8692.jpeg', 'width': 1000, 'height': 428}, {'@type': 'ImageObject', 'url': '/wirtschaft/images/rolls-royce-seit-20-jahren-in-brandenburg-8692/alternates/BASE_16_9_W1400/rolls-royce-seit-20-jahren-in-brandenburg-8692.jpeg', 'width': 1400, 'height': 787}, {'@type': 'ImageObject', 'url': '/wirtschaft/images/rolls-royce-seit-20-jahren-in-brandenburg-8692/alternates/BASE_21_9_W2000/rolls-royce-seit-20-jahren-in-brandenburg-8692.jpeg', 'width': 2000, 'height': 857}]","{'@type': 'WebPage', 'url': 'https://www.tagesspiegel.de/wirtschaft/rolls-royce-setzt-in-dahlewitz-auf-ki-4995355.html'}","{'@type': 'Organization', 'name': 'Der Tagesspiegel', 'logo': {'@type': 'ImageObject', 'url': '/logos/tagesspiegel.svg', 'width': 1000, 'height': 136}}",https://www.tagesspiegel.de/wirtschaft/rolls-royce-setzt-in-dahlewitz-auf-ki-4995355.html,,Digitale Technologien: Rolls Royce setzt in Dahlewitz auf KI,,Wirtschaft,N/A,"Sie befinden sich hier:StartseiteWirtschaftDigitale Technologien: Rolls Royce setzt in Dahlewitz auf KI © Patrick Pleul/dpa  Digitale Technologien: Rolls Royce setzt in Dahlewitz auf KIDer größte deutsche Standort wird erneut aufgewertet. In einem virtuellen Triebwerk können Ingenieure demnächst ihre Veränderungen vornehmen. Von  Rainer W. During 09.12.2018, 16:56 UhrDer britische Rolls-Royce-Konzern sieht sich selbst als den Branchenvorreiter bei der Digitalisierung. Ungeachtet vom Brexit errichtet man jetzt im brandenburgischen Dahlewitz das erste Zentrum für Künstliche Intelligenz. Damit wird der größte deutsche Standort des Unternehmens erneut aufgewertet. Insgesamt will Rolls-Royce in den kommenden fünf Jahren weltweit 100 Millionen Pfund in Künstliche Intelligenz und neue Datentechnologien investieren.Den relativ bescheidenen Anfang soll zunächst eine Handvoll von Spezialisten machen. Deren Stellen wurden bereits ausgeschrieben, im kommenden Jahr soll die Arbeit in Dahlewitz beginnen. Dabei will man eng mit akademischen Einrichtungen aus der Region zusammenarbeiten und von den Start-up-Szenen in Brandenburg und vor allem in Berlin profitieren. Mit dem Potsdamer Hasso-Plattner-Institut wurde bereits eine Kooperation vereinbart. Ingenieure arbeiten in digitalen Werken Schon heute lassen sich am Rechner binnen fünf Minuten Triebwerk-Designs erstellen, für die man bisher Tage oder gar Wochen gebraucht hat. In einem virtuellen Triebwerk können Ingenieure Veränderungen vornehmen und testen. Bei der Montage des Trent XWB für den neuen Airbus A350 kommen intelligente Winkelschrauber zum Einsatz, die jede Schraube erkennen und dem Mechaniker signalisieren, wie viele Exemplare er an welcher Stelle mit welchem Drehmoment festziehen muss. Und erst dann grünes Licht geben, wenn alles passt.Strategie der Bundesregierung Deutschland will bei Künstlicher Intelligenz führend sein Doch damit nicht genug. Ab dem nächsten Jahr kommen Kameras zum Einsatz, die sämtliche rund 10 000 Teile eines fertiggestellten Triebwerks mit dessen digitalem Zwilling vergleichen und erkennen, wenn etwas fehlt oder falsch montiert wurde. Und Inspektionen der Antriebe sollen zukünftig viel häufiger ohne aufwändige Demontage direkt am Flugzeug erfolgen. Weil auch die biegsamen Endoskope nicht in alle Teile des Triebwerksinneren vordringen können, sollen künftig winzige, käferartige Roboter in die unzugänglichsten Teile krabbeln und von dort Aufnahmen senden, die von den Ingenieuren zu einem Gesamtbild zusammengesetzt werden. Rund fünf Zentimeter große Prototypen wurden bereits entwickelt. In fünf bis zehn Jahren sollen sie auf wenige Millimeter verkleinert und einsatzreif sein.Zur Startseite Digitalisierung & KI showPaywall:falseisSubscriber:falseisPaid:showPaywallPiano:false0Kommentareper E-Mail teilenauf Facebook teilenauf Twitter teilenper WhatsApp teilenauf Pocket teilenper E-Mail teilen0KommentareAusblenden",,,,,,,True,,,,,,,,,
