URL link,Title,Date,Source,Source Link,description,keywords,og:description,twitter:description,article:section,article:summary,article text,@id,@type,itemListElement,@context,url,contentUrl,width,height,id,name,legalName,alternateName,logo,image,email,telephone,address,contactPoint,sameAs,publisher,datePublished,dateModified,isPartOf,primaryImageOfPage,breadcrumb,operatingSystem,applicationCategory,applicationSubcategory,aggregateRating,offers,caption,headline,mainEntityOfPage,articleSection,isAccessibleForFree,@graph,thumbnailUrl,author,creator,dateCreated
https://news.google.com/rss/articles/CBMiWmh0dHBzOi8vd3d3LmJ1c2luZXNzaW5zaWRlci5kZS9ncnVlbmRlcnN6ZW5lL2J1c2luZXNzL2tpLXN0YXJ0dXAtaW52ZXN0bWVudHMtdmMtYnJhbmNoZS1kL9IBAA?oc=5,Diese Investoren lassen eine KI nach neuen Unicorns suchen – das sind ihre überraschenden Erkenntnisse - Business Insider Deutschland,2022-07-07,Business Insider Deutschland,https://www.businessinsider.de,"Das VC-Geschäft ist riskant. Trifft ein Investor die falsche Entscheidung, sind schnell Millionen futsch. Was aber, wenn eine KI entscheidet?","Künstliche Intelligenz, Startup Investment, Venture Capital","Das VC-Geschäft ist riskant. Trifft ein Investor die falsche Entscheidung, sind schnell Millionen futsch. Was aber, wenn eine KI entscheidet?",N/A,N/A,N/A,"

In Startups zu investieren ist hochriskant. Trifft ein Investor die falsche Entscheidung, sind schnell Millionen futsch. Große Hoffnungen ruhen deshalb auf neuen Auswahlverfahren mittels KI.







Lade Premium-Inhalte...








Sind Computer die besseren Investoren? Die beiden VCs André Retterath und Christian Leybold (rechts) versuchen es herauszufinden.
Gründerszene / Earlybird / Headline




Alles, was ihr hier nicht lesen werdet: dass Computer künftig Investmententscheidungen treffen. Dass Wagniskapitalgeber sich lieber auf Künstliche Intelligenz verlassen als auf ihr Bauchgefühl. Oder dass Maschinen besser sind als Menschen. 







Lade Premium-Inhalte...

Inhalt nicht verfügbar - bitte aktivieren
Sie haben ein contentpass-Abo, wollen jedoch ihr Business Insider Abo Verwalten oder ein Abo abschliessen?

Dann klicken Sie auf ""zustimmen"" und wir binden unseren externen Abo-Dienst der Firma ""Piano"" in unser Angebot ein.  In diesem Zusammenhang können auch Nutzungsprofile (u.a. aus Basis von Cookie-IDs) gebildet und angereichert, auch außerhalb des EWR. Ihre Einwilligung umfasst in diesem Fall auch die Übermittlung bestimmter personenbezogener Daten in Drittländer, u.a. die USA nach Art 49 Abs. 1 Buchst. a) DSGVO.
 
Weitere Details zur Datenverarbeitung finden Sie in unseren Datenschutzhinweisen sowie in der Privatsphäre,  jeweils jederzeit im Footer unseres Angebotes verfügbar.
 
Ihre Einwilligung können Sie jederzeit im Footer unseres Angebotes über den Link ""Widerruf Tracking"" ausüben.

Zustimmen und anzeigen










Verwandte Artikel Apple will euch KI aufs Handy bringen – Samsung steckt sie euch an den Finger Jetzt neu: Lasst euer Pitchdeck von unseren Experten checken! Obwohl es noch keine verbindlichen Regeln gibt: Bundesregierung nutzt immer häufiger KI „Ich wollte nicht auf der Titanic der KI arbeiten“: Ehemaliger OpenAI-Mitarbeiter erklärt, warum er kündigte Meta-KI in Europa pausiert: Was ihr trotzdem wissen solltet


Mehr zum ThemaKünstliche IntelligenzStartup InvestmentVenture Capital






",,NewsArticle,,http://schema.org,,,,,,,,,,,,,,,,"{'@type': 'Organization', 'name': 'Business Insider'}",,,"{'@type': ['CreativeWork', 'Product'], 'name': 'Business Insider', 'productID': 'businessinsider.de:showcase'}",,,,,,,,,,,,False,"[{'@type': 'NewsArticle', '@id': 'https://www.businessinsider.de/gruenderszene/business/ki-startup-investments-vc-branche-d/#article', 'isPartOf': {'@id': 'https://www.businessinsider.de/gruenderszene/business/ki-startup-investments-vc-branche-d/'}, 'author': {'@type': 'Person', 'name': 'Nina Anika Klotz', 'url': 'https://www.businessinsider.de/autoren/nina-anika-klotz/'}, 'headline': 'Diese Investoren lassen eine KI nach neuen Unicorns suchen', 'datePublished': '2022-07-07T12:00:00+00:00', 'dateModified': '2024-02-14T12:13:44+00:00', 'mainEntityOfPage': {'@id': 'https://www.businessinsider.de/gruenderszene/business/ki-startup-investments-vc-branche-d/'}, 'wordCount': 1698, 'publisher': {'@id': 'https://www.businessinsider.de/#organization'}, 'image': {'@id': 'https://www.businessinsider.de/gruenderszene/business/ki-startup-investments-vc-branche-d/#primaryimage'}, 'thumbnailUrl': 'https://cdn.businessinsider.de/wp-content/uploads/2021/11/ki-investoren-startups.jpg?ver=1637334039', 'keywords': ['Künstliche Intelligenz', 'Startup Investment', 'Venture Capital'], 'articleSection': ['Business', 'Wirtschaft'], 'inLanguage': 'de-DE', 'copyrightYear': '2022', 'copyrightHolder': {'@id': 'https://www.businessinsider.de/#organization'}}, {'@type': 'WebPage', '@id': 'https://www.businessinsider.de/gruenderszene/business/ki-startup-investments-vc-branche-d/', 'url': 'https://www.businessinsider.de/gruenderszene/business/ki-startup-investments-vc-branche-d/', 'name': 'Diese Investoren lassen eine KI nach neuen Unicorns suchen', 'isPartOf': {'@id': 'https://www.businessinsider.de/#website'}, 'primaryImageOfPage': {'@id': 'https://www.businessinsider.de/gruenderszene/business/ki-startup-investments-vc-branche-d/#primaryimage'}, 'image': {'@id': 'https://www.businessinsider.de/gruenderszene/business/ki-startup-investments-vc-branche-d/#primaryimage'}, 'thumbnailUrl': 'https://cdn.businessinsider.de/wp-content/uploads/2021/11/ki-investoren-startups.jpg?ver=1637334039', 'datePublished': '2022-07-07T12:00:00+00:00', 'dateModified': '2024-02-14T12:13:44+00:00', 'description': 'Das VC-Geschäft ist riskant. Trifft ein Investor die falsche Entscheidung, sind schnell Millionen futsch. Was aber, wenn eine KI entscheidet?', 'breadcrumb': {'@id': 'https://www.businessinsider.de/gruenderszene/business/ki-startup-investments-vc-branche-d/#breadcrumb'}, 'inLanguage': 'de-DE', 'potentialAction': [{'@type': 'ReadAction', 'target': ['https://www.businessinsider.de/gruenderszene/business/ki-startup-investments-vc-branche-d/']}]}, {'@type': 'ImageObject', 'inLanguage': 'de-DE', '@id': 'https://www.businessinsider.de/gruenderszene/business/ki-startup-investments-vc-branche-d/#primaryimage', 'url': 'https://cdn.businessinsider.de/wp-content/uploads/2021/11/ki-investoren-startups.jpg?ver=1637334039', 'contentUrl': 'https://cdn.businessinsider.de/wp-content/uploads/2021/11/ki-investoren-startups.jpg?ver=1637334039', 'width': 1920, 'height': 1200}, {'@type': 'BreadcrumbList', '@id': 'https://www.businessinsider.de/gruenderszene/business/ki-startup-investments-vc-branche-d/#breadcrumb', 'itemListElement': [{'@type': 'ListItem', 'position': 1, 'name': 'Home', 'item': 'https://www.businessinsider.de/'}, {'@type': 'ListItem', 'position': 2, 'name': 'Gründerszene', 'item': 'https://www.businessinsider.de/gruenderszene/'}, {'@type': 'ListItem', 'position': 3, 'name': 'Business', 'item': 'https://www.businessinsider.de/gruenderszene/business/'}, {'@type': 'ListItem', 'position': 4, 'name': 'Diese Investoren lassen eine KI nach neuen Unicorns suchen – das sind ihre überraschenden Erkenntnisse'}]}, {'@type': 'WebSite', '@id': 'https://www.businessinsider.de/#website', 'url': 'https://www.businessinsider.de/', 'name': 'Business Insider', 'description': 'Aktuelle News von Business Insider aus Deutschland.', 'publisher': {'@id': 'https://www.businessinsider.de/#organization'}, 'potentialAction': [{'@type': 'SearchAction', 'target': {'@type': 'EntryPoint', 'urlTemplate': 'https://www.businessinsider.de/?s={search_term_string}'}, 'query-input': 'required name=search_term_string'}], 'inLanguage': 'de-DE'}, {'@type': 'Organization', '@id': 'https://www.businessinsider.de/#organization', 'name': 'Business Insider', 'url': 'https://www.businessinsider.de/', 'logo': {'@type': 'ImageObject', 'inLanguage': 'de-DE', '@id': 'https://www.businessinsider.de/#/schema/logo/image/', 'url': 'https://cdn.businessinsider.de/wp-content/uploads/2024/03/BI-SecondaryLogo-Black.png?ver=1709627310', 'contentUrl': 'https://cdn.businessinsider.de/wp-content/uploads/2024/03/BI-SecondaryLogo-Black.png?ver=1709627310', 'width': 4096, 'height': 361, 'caption': 'Business Insider'}, 'image': {'@id': 'https://www.businessinsider.de/#/schema/logo/image/'}}, {'@type': 'Person', '@id': 'https://www.businessinsider.de/#/schema/person/6652e4ae6ecb2207d0e052b6d8665ae7', 'name': 'Nina Anika Klotz', 'description': 'ist Redakteurin bei Gründerszene. Sie arbeitet seit 15 Jahren als Journalistin, insbesondere für Wirtschaftsmedien, und schreibt am liebsten über Firmen, Menschen und deren richtig gute Ideen.', 'url': 'https://www.businessinsider.de/autoren/nina-anika-klotz/'}]",,,,
