URL link,Title,Date,Source,Source Link,description,keywords,og:description,twitter:description,@context,@type,mainEntityOfPage,headline,image,author,publisher,datePublished,dateModified,url,thumbnailUrl,dateCreated,articleSection,@graph,article:section,article:summary,article text,name,potentialAction,logo,sameAs,isAccessibleForFree,hasPart,itemListElement,articleBody,speakable,alternativeHeadline
https://news.google.com/rss/articles/CBMiemh0dHBzOi8vcHJlc3NlLmluc2VybS5mci9jb21tZW50LXByZWRpcmUtbGUtcmlzcXVlLXN1aWNpZGFpcmUtY2hlei1sZXMtZXR1ZGlhbnRzLWdyYWNlLWEtbGludGVsbGlnZW5jZS1hcnRpZmljaWVsbGUvNDMwODUv0gEA?oc=5,Comment prédire le risque suicidaire chez les étudiants grâce à l'intelligence artificielle ? - Inserm (salle de presse),2021-06-15,Inserm (salle de presse),https://presse.inserm.fr,N/A,[''],"Comment prédire le risque suicidaires chez les étudiants ? C’est une question d’actualité, alors que les effets délétères de la crise sanitaire sur la santé mentale des étudiants sont de plus en plus visibles, et que l’on connait l’importance d’une détection et d’une prise en charge précoce de ce risque.",N/A,https://schema.org,NewsArticle,"{'@type': 'WebPage', '@id': 'https://presse.inserm.fr/comment-predire-le-risque-suicidaire-chez-les-etudiants-grace-a-lintelligence-artificielle/43085/'}",Comment prédire le risque suicidaire chez les étudiants grâce à l&rsquo;intelligence artificielle ?,"{'@type': 'ImageObject', 'url': 'https://presse.inserm.fr/wp-content/uploads/2021/06/PhotoCP-web.png', 'width': 848, 'height': 597}","{'@type': 'Organization', 'name': 'INSERM (Salle de presse)'}","{'@type': 'Organization ', 'name': 'Salle de presse Inserm', 'logo': {'@type': 'ImageObject', 'url': 'https://presse.inserm.fr/wp-content/uploads/2022/12/logo-inserm.svg'}}",,, https://presse.inserm.fr/comment-predire-le-risque-suicidaire-chez-les-etudiants-grace-a-lintelligence-artificielle/43085/,https://presse.inserm.fr/wp-content/uploads/2021/06/PhotoCP-web.png,,,"[{'@type': 'WebPage', '@id': 'https://presse.inserm.fr/comment-predire-le-risque-suicidaire-chez-les-etudiants-grace-a-lintelligence-artificielle/43085/', 'url': 'https://presse.inserm.fr/comment-predire-le-risque-suicidaire-chez-les-etudiants-grace-a-lintelligence-artificielle/43085/', 'name': ""Comment prédire le risque suicidaire chez les étudiants\xa0grâce à l'intelligence artificielle ? - Salle de presse de l&#039;Inserm"", 'isPartOf': {'@id': 'https://presse.inserm.fr/#website'}, 'primaryImageOfPage': {'@id': 'https://presse.inserm.fr/comment-predire-le-risque-suicidaire-chez-les-etudiants-grace-a-lintelligence-artificielle/43085/#primaryimage'}, 'image': {'@id': 'https://presse.inserm.fr/comment-predire-le-risque-suicidaire-chez-les-etudiants-grace-a-lintelligence-artificielle/43085/#primaryimage'}, 'thumbnailUrl': 'https://presse.inserm.fr/wp-content/uploads/2021/06/PhotoCP-web.png', 'datePublished': '2021-06-15T09:00:27+00:00', 'dateModified': '2022-08-16T15:13:07+00:00', 'author': {'@id': 'https://presse.inserm.fr/#/schema/person/ea37ae7e377f64b15f2ed598e5f54e31'}, 'breadcrumb': {'@id': 'https://presse.inserm.fr/comment-predire-le-risque-suicidaire-chez-les-etudiants-grace-a-lintelligence-artificielle/43085/#breadcrumb'}, 'inLanguage': 'fr-FR', 'potentialAction': [{'@type': 'ReadAction', 'target': ['https://presse.inserm.fr/comment-predire-le-risque-suicidaire-chez-les-etudiants-grace-a-lintelligence-artificielle/43085/']}]}, {'@type': 'ImageObject', 'inLanguage': 'fr-FR', '@id': 'https://presse.inserm.fr/comment-predire-le-risque-suicidaire-chez-les-etudiants-grace-a-lintelligence-artificielle/43085/#primaryimage', 'url': 'https://presse.inserm.fr/wp-content/uploads/2021/06/PhotoCP-web.png', 'contentUrl': 'https://presse.inserm.fr/wp-content/uploads/2021/06/PhotoCP-web.png', 'width': 848, 'height': 597, 'caption': 'Alors même que le nombre d’étudiants vulnérables augmente sous l’effet de la crise sanitaire, détecter les individus en grande détresse et à risque suicidaire est essentiel pour permettre d’intervenir le plus précocement possible. © Ben Blennerhassett - Unsplash'}, {'@type': 'BreadcrumbList', '@id': 'https://presse.inserm.fr/comment-predire-le-risque-suicidaire-chez-les-etudiants-grace-a-lintelligence-artificielle/43085/#breadcrumb', 'itemListElement': [{'@type': 'ListItem', 'position': 1, 'name': 'Accueil', 'item': 'https://presse.inserm.fr/'}, {'@type': 'ListItem', 'position': 2, 'name': 'Comment prédire le risque suicidaire chez les étudiants\xa0grâce à l&rsquo;intelligence artificielle ?'}]}, {'@type': 'WebSite', '@id': 'https://presse.inserm.fr/#website', 'url': 'https://presse.inserm.fr/', 'name': 'Salle de presse de l&#039;Inserm', 'description': 'Salle de presse de l&#039;Institut national de la santé et de la recherche médicale', 'potentialAction': [{'@type': 'SearchAction', 'target': {'@type': 'EntryPoint', 'urlTemplate': 'https://presse.inserm.fr/?s={search_term_string}'}, 'query-input': 'required name=search_term_string'}], 'inLanguage': 'fr-FR'}, {'@type': 'Person', '@id': 'https://presse.inserm.fr/#/schema/person/ea37ae7e377f64b15f2ed598e5f54e31', 'name': 'Tatiana Marotta', 'image': {'@type': 'ImageObject', 'inLanguage': 'fr-FR', '@id': 'https://presse.inserm.fr/#/schema/person/image/', 'url': 'https://secure.gravatar.com/avatar/173458ed5965fee19c7f42fbd8f0a986?s=96&d=mm&r=g', 'contentUrl': 'https://secure.gravatar.com/avatar/173458ed5965fee19c7f42fbd8f0a986?s=96&d=mm&r=g', 'caption': 'Tatiana Marotta'}, 'url': '#'}]",N/A,N/A,"Contact ChercheurMélissa Macalli, Christophe TzourioCentre de Recherche Inserm-Université de BordeauxU1219 – Bordeaux population healthE-mails : rf.xuaedrob-u@illacam.assilemrf.xuaedrob-u@oiruozt.ehpotsirhcTéléphone sur demandeContact Presserf.mresni@esserp",,,,,,,,,,
https://news.google.com/rss/articles/CBMikAFodHRwczovL3d3dy5sZXNlY2hvcy5mci9pZGVlcy1kZWJhdHMvbGVhZGVyc2hpcC1tYW5hZ2VtZW50L2ludGVsbGlnZW5jZS1hcnRpZmljaWVsbGUtbGEtY2xlLWR1LXN1Y2Nlcy1jZXN0LWRhZG9wdGVyLXVuZS1hcHByb2NoZS1nbG9iYWxlLTEzMjM2MzfSAQA?oc=5,"Intelligence artificielle : la clé du succès, c'est d'adopter une approche globale - Les Échos",2021-06-15,Les Échos,https://www.lesechos.fr,"A mesure que l'IA est intégrée dans l'entreprise, remplaçant les individus dans la prise de décisions de plus en plus complexes, de nouvelles contraintes éthiques apparaissent.",N/A,"A mesure que l'IA est intégrée dans l'entreprise, remplaçant les individus dans la prise de décisions de plus en plus complexes, de nouvelles contraintes éthiques apparaissent.","A mesure que l'IA est intégrée dans l'entreprise, remplaçant les individus dans la prise de décisions de plus en plus complexes, de nouvelles contraintes éthiques apparaissent.",http://schema.org,BreadcrumbList,"{'@type': 'WebPage', '@id': 'https://www.lesechos.fr/idees-debats/leadership-management/intelligence-artificielle-la-cle-du-succes-cest-dadopter-une-approche-globale-1323637'}","Intelligence artificielle : la clé du succès, c'est d'adopter une approche globale","{'@type': 'ImageObject', 'url': 'https://media.lesechos.com/api/v1/images/view/60c85e4a8fe56f607625cc16/1280x720/0611147557710-web-tete.jpg', 'height': '720', 'width': '1280'}","{'@type': 'Person', 'name': 'Theodoros Evgeniou'}","{'@type': 'Organization', 'name': 'Les Echos', 'logo': {'@type': 'ImageObject', 'url': 'https://static.lesechos.com/0fbe31cfc3d7f1cdecc51f122d4c11b4.webp', 'width': 200, 'height': 38}}",2021-06-15T10:00:52+02:00,2021-06-15T10:15:57+02:00,https://www.lesechos.fr,,,,,Idées & Débats,N/A,"ChroniqueIntelligence artificielle : la clé du succès, c'est d'adopter une approche globale Contenu réservé aux abonnésA mesure que l'IA est intégrée dans l'entreprise, remplaçant les individus dans la prise de décisions de plus en plus complexes, de nouvelles contraintes éthiques apparaissent.Ajouter à mes articlesCommenterPartagerPartagerLeadership & managementIl est essentiel de bien comprendre l'écart existant entre le minimum requis et la précision atteignable grâce à l'IA aujourd'hui. (iStock)Publié le 15 juin 2021 à 10:00Mis à jour le 15 juin 2021 à 10:15Réservé à nos abonnésPourquoi tant de cadres supérieurs trouvent-ils difficile d'intégrer l'intelligence artificielle (IA) dans les activités de leurs entreprises ? Dans une récente enquête menée par le centre de gouvernance d'entreprise de l'Insead, nous avons interrogé des PDG, des présidents de conseil d'administration et des directeurs sur les principales contraintes liées à l'introduction de l'IA dans leurs organisations. Les résultats font ressortir trois grandes catégories d'obstacles.Premièrement, il y a un manque de compétences, selon 80 % des répondants, et de compréhension (pour 70 %). Ensuite, les capacités de mise en oeuvre manquantes vont d'une infrastructure informatique insuffisante à une résistance interne à l'IA, en passant par une valeur ajoutée pour l'entreprise assez floue. Enfin, les considérations éthiques apparaissent comme un nouvel enjeu important.Ce contenu est réservé aux abonnés Access et PremiumFace à l’incertitude, n’hésitez plus et choisissez la fiabilité des EchosJe profite du mois OFFERTDéjà abonné ? Connectez-vousNos VidéosParis sportifs en ligne : qui sont les vrais gagnants ?Il y a 14 ans, la Française des Jeux (FDJ) perdait son monopole sur les paris sportifs en ligne. Aujourd’hui, 15 opérateurs se partagent ce marché toujours en croissance. Mais est-il si rentable que cela pour eux ? On vous explique.Portugal, Espagne, Grèce : la revanche des « pays du Club Med »Les jeunes ont-ils vraiment un problème avec le travail ?SNCF : la concurrence peut-elle faire baisser les prix des billets de train ?PublicitéLes plus lusTribuneLeadership : 7 nouveaux paradigme essentiels ChroniqueLégislatives 2024 : votez-vous pour vous-même ou pour la France ?Notre sélectionNe manquez pas les colloques phares de l'été !PublicitéÀ la UneDécryptageLégislatives 2024 : ces onze circonscriptions sans front républicainSix questions sur le second tour de dimancheLégislatives : « pas question » de gouverner avec LFI, lance Macron en Conseil des ministresPublicité",Les Echos,"{'@type': 'SearchAction', 'target': 'https://www.lesechos.fr/recherche?q={query}', 'query-input': 'required name=query'}",https://static.lesechos.com/0fbe31cfc3d7f1cdecc51f122d4c11b4.webp,"['https://www.facebook.com/lesechos/', 'https://x.com/LesEchos?lang=fr', 'https://www.linkedin.com/company/les-echos']",False,"{'@type': 'WebPageElement', 'isAccessibleForFree': 'False', 'cssSelector': '.post-paywall'}","[{'@type': 'ListItem', 'position': 1, 'item': {'@id': 'https://www.lesechos.fr/', 'name': 'Les Echos'}}, {'@type': 'ListItem', 'position': 2, 'item': {'@id': 'https://www.lesechos.fr/idees-debats', 'name': 'Idées & Débats'}}, {'@type': 'ListItem', 'position': 3, 'item': {'@id': 'https://www.lesechos.fr/idees-debats/leadership-management', 'name': 'Leadership & management'}}]",,,
https://news.google.com/rss/articles/CBMigAFodHRwczovL3d3dy5hY3R1aWEuY29tL2FjdHVhbGl0ZS9ldGF0cy11bmlzLXVuLWdyb3VwZS1kZS10cmF2YWlsLXByb3Bvc2VyYS1zZXMtcmVjb21tYW5kYXRpb25zLWF1LW5hdGlvbmFsLWFpLXJlc2VhcmNoLXJlc291cmNlL9IBAA?oc=5,Etats-Unis : un groupe de travail proposera ses recommandations au National AI Research Resource - Intelligence artificielle - Actu IA,2021-06-15,Intelligence artificielle - Actu IA,https://www.actuia.com,L'Office of Science and Technology Policy (OSTP) de la Maison-Blanche et la National Science Foundation (NSF) ont annoncé la formation du National,N/A,L'Office of Science and Technology Policy (OSTP) de la Maison-Blanche et la National Science Foundation (NSF) ont annoncé la formation du National,L'Office of Science and Technology Policy (OSTP) de la Maison-Blanche et la National Science Foundation (NSF) ont annoncé la formation du National,,,,,,,,,,,,,,,N/A,N/A,"

Etats-Unis : un groupe de travail proposera ses recommandations au National AI Research Resource


Le 15 juin 2021, par
Zacharie Tazrout.




L’Office of Science and Technology Policy (OSTP) de la Maison-Blanche et la National Science Foundation (NSF) ont annoncé la formation du National Artificial Intelligence Research Resource Task (Task Force). Ce groupe de travail rédigera la feuille de route qui dirigera la recherche, la conception et l’utilisation d’outils d’IA à l’échelle des États-Unis et favoriser l’accès à des ressources pour l’éducation, la gestion des données, l’aide aux utilisateurs, etc. Ce plan directeur servira pour le National AI Research Resource (NAIRR), un institut de recherche dédié à l’IA.
Un groupe consultatif pour proposer ses recommandations au NAIRR
Dans la National AI Initiative Act of 2020 notifié par le Congrès des États-Unis, le groupe de travail ainsi constitué servira de comité consultatif pour aider à concevoir et à mettre en place un plan directeur pour la NAIRR. Cet institut de recherche permettra de regrouper des étudiants et des chercheurs spécialisés dans l’IA, et ce dans une large palette de secteur, afin qu’ils puissent réaliser leur formation ou leur recherche à l’aide de ressources informatiques dédiées.
Le groupe explicitera ses recommandations pour la NAIRR en matière de capacités techniques, de gouvernance, d’administration, d’évaluation, de sécurité, de confidentialité, de droits et libertés civils. Deux rapports seront soumis au Congrès pour présenter une stratégie globale et un plan de mise en œuvre : l’un sera rendu en mai 2022, et le second en novembre 2022.
Eric Lander, le conseiller scientifique du président et directeur de l’OSTP, évoque l’arrivée de la NAIRR dans l’écosystème d’IA des États-Unis :
“La prospérité économique de l’Amérique repose sur des investissements fondamentaux dans notre leadership technologique. Le National AI Research Resource élargira l’accès aux ressources et aux outils qui alimentent la recherche et le développement de l’IA, ouvrant des opportunités aux esprits brillants de toute l’Amérique pour poursuivre les prochaines avancées scientifiques et technologiques.”
Sethuraman Panchanathan, le directeur de la NSF, s’attarde sur le groupe Task Force :
“La NSF est ravie de coprésider le groupe de travail national sur les ressources de recherche en IA qui a pour rôle essentiel d’envisager l’infrastructure de recherche qui stimulera les futures innovations en IA. En réunissant les meilleurs experts du pays, issus du monde universitaire, de l’industrie et du gouvernement, nous serons en mesure de tracer une voie passionnante et convaincante, garantissant la compétitivité à long terme des États-Unis dans tous les domaines de la science et de l’ingénierie et dans tous les secteurs de notre économie.”
Une douzaine d’experts pour rédiger cette feuille de route
Voici les douze membres qui composeront le groupe consultatif National Artificial Intelligence Research Resource Task :

Lynne Parker, Bureau du groupe scientifique et technologique de la Maison Blanche (coprésidente)
Erwin Gianchandani, NSF (coprésident)
Daniela Braga, DefinedCrowd
Mark Dean, retraité (anciennement IBM et Université du Tennessee, Knoxville)
Oren Etzioni, Allen Institute for AI
Julia Lane, Université de New York
Fei-Fei Li, Université de Stanford
Andrew Moore, Google
Michael Norman, Université de Californie, San Diego
Dan Stanzione, Université du Texas, Austin
Frederick Streitz, Département de l’énergie
Elham Tabassi, Institut national des normes et de la technologie

Les citoyens américains seront sollicités pour proposer leurs commentaires autour de la mise en place du NAIRR. Un registre fédéral sera créé dans ce but. De plus, dans les prochaines semaines, un comité consultatif sur l’IA sera mis en place pour traiter plus largement l’IA dans les domaines suivants : recherche et développement, compétitivité économique, questions sociétales, enjeux éthiques et juridiques, applications commerciales, sécurité, sureté, etc.




Recevez gratuitement l'actualité de l'intelligence artificielle
Suivez la Newsletter de référence sur l'intelligence artificielle (+ de 18 000 membres), quotidienne et 100% gratuite.  

Adresse e-mail 



Prénom



Nom



Organisme/Société


Fréquence

 Quotidienne


 Hebdomadaire - lundi matin


 Hebdomadaire - vendredi après-midi






Tout comme vous, nous n'apprécions pas le spam. Vos coordonnées ne seront transmises à aucun tiers.Laissez ce champ vide si vous êtes humain :  
 ",,,,,,,,,,
