URL link,Title,Date,Source,Source Link,description,keywords,og:description,twitter:description,@context,@graph,article:section,article:summary,article text,@type,itemListElement,@id,address,contactPoint,foundingDate,image,logo,name,telephone,url,mainEntityOfPage,publisher,headline,datePublished,dateModified,author,articleBody,speakable,copyrightHolder,copyrightYear,creator,dateCreated,inLanguage,sameAs,potentialAction,breadcrumb
https://news.google.com/rss/articles/CBMiggFodHRwczovL3d3dy5sZXNpbmZvc2R1cGF5c2dhbGxvLmNvbS8yMDIwLzA1LzEzL2xhLWdhY2lsbHktZ3JvdXBlLXJvY2hlci1xdWFuZC1sZXMtbmV1cm9zLXNjaWVuY2VzLWZhY2lsaXRlbnQtbGUtcmV0b3VyLWF1LXRyYXZhaWwv0gEA?oc=5,La Gacilly. Groupe Rocher: quand les neuros-sciences facilitent le retour au travail - Les Infos du Pays Gallo,2020-05-13,Les Infos du Pays Gallo,https://www.lesinfosdupaysgallo.com,"Neuros-sciences, intelligence artificielle, e-learning, innovation et partage... Le groupe Rocher n'a pas lésiné sur les moyens pour réussir le challenge",N/A,"Neuros-sciences, intelligence artificielle, e-learning, innovation et partage... Le groupe Rocher n'a pas lésiné sur les moyens pour réussir le challenge",N/A,https://schema.org,"[{'@type': 'Article', '@id': 'https://www.lesinfosdupaysgallo.com/2020/05/13/la-gacilly-groupe-rocher-quand-les-neuros-sciences-facilitent-le-retour-au-travail/#article', 'isPartOf': {'@id': 'https://www.lesinfosdupaysgallo.com/2020/05/13/la-gacilly-groupe-rocher-quand-les-neuros-sciences-facilitent-le-retour-au-travail/'}, 'author': {'name': 'infosgallo', '@id': 'https://www.lesinfosdupaysgallo.com/#/schema/person/579b4ef9cdb85b34ef39ccfa0a11d28d'}, 'headline': 'La Gacilly. Groupe Rocher: quand les neuros-sciences facilitent le retour au travail', 'datePublished': '2020-05-13T16:40:54+00:00', 'dateModified': '2020-05-13T16:40:54+00:00', 'mainEntityOfPage': {'@id': 'https://www.lesinfosdupaysgallo.com/2020/05/13/la-gacilly-groupe-rocher-quand-les-neuros-sciences-facilitent-le-retour-au-travail/'}, 'wordCount': 1042, 'commentCount': 0, 'publisher': {'@id': 'https://www.lesinfosdupaysgallo.com/#organization'}, 'image': {'@id': 'https://www.lesinfosdupaysgallo.com/2020/05/13/la-gacilly-groupe-rocher-quand-les-neuros-sciences-facilitent-le-retour-au-travail/#primaryimage'}, 'thumbnailUrl': 'https://www.lesinfosdupaysgallo.com/wp-content/uploads/2020/03/nz76584-1160x773.jpg', 'keywords': ['coronavirus', 'groupe rocher', 'la gacilly', 'Yves rocher'], 'articleSection': ['Augan', 'Beignon', 'Berric', 'Bohal', 'Brignac', 'Caden', 'Campénéac', 'Carentoir', 'Caro', 'Concoret', 'coronavirus', 'Cournon', 'Cruguel', 'Evriguet', 'Gourhel', 'Guégon', 'Guer', 'Guillac', 'Guilliers', 'Helléan', 'Josselin', 'La Croix-Hélléan', 'La Gacilly', 'La Grée-Saint-Laurent', 'La Trinité-Porhoët', 'La vie de vos entreprises', 'La Vraie-Croix', 'Lantillac', 'Larré', 'Lauzach', 'Le Cours', 'Les Forges', 'Les Fougerets', 'Limerzel', 'Lizio', 'Loyat', 'Malansac', 'Malestroit', 'Mauron', 'Ménéac', 'Missiriac', 'Mohon', 'Molac', 'Monteneuf', 'Monterrein', 'Montertelot', 'Néant-sur-Yvel', 'Oust à Brocéliande', 'Pays de GUER', 'Pays de Josselin', 'Pays de LA GACILLY', 'Pays de La Trinité-Porhoet', 'Pays de Malestroit', 'Pays de Mauron', 'Pays de Ploërmel', 'Péaule', 'Pleucadeuc', 'Ploërmel', 'Ploërmel Communauté', 'Pluherlin', 'Porcaro', 'Questembert', 'Questembert Communauté', 'Réminiac', 'Rochefort-en-Terre', 'Ruffiac', 'Saint-Abraham', 'Saint-Brieuc de Mauron', 'Saint-Congard', 'Saint-Gravé', 'Saint-Guyomard', 'Saint-Laurent-sur-Oust', 'Saint-Léry', 'Saint-Malo de Beignon', 'Saint-Malo-des-Trois Fontaines', 'Saint-Marcel', 'Saint-Martin', 'Saint-Nicolas-du-Tertre', 'Saint-Servant', 'Sérent', 'Taupont', 'Thématiques', 'Tréal', 'Tréhorenteuc', ""Val d'Oust"", 'Vie Pratique'], 'inLanguage': 'fr-FR', 'potentialAction': [{'@type': 'CommentAction', 'name': 'Comment', 'target': ['https://www.lesinfosdupaysgallo.com/2020/05/13/la-gacilly-groupe-rocher-quand-les-neuros-sciences-facilitent-le-retour-au-travail/#respond']}]}, {'@type': 'WebPage', '@id': 'https://www.lesinfosdupaysgallo.com/2020/05/13/la-gacilly-groupe-rocher-quand-les-neuros-sciences-facilitent-le-retour-au-travail/', 'url': 'https://www.lesinfosdupaysgallo.com/2020/05/13/la-gacilly-groupe-rocher-quand-les-neuros-sciences-facilitent-le-retour-au-travail/', 'name': 'La Gacilly. Groupe Rocher: quand les neuros-sciences facilitent le retour au travail - Les Infos du Pays Gallo', 'isPartOf': {'@id': 'https://www.lesinfosdupaysgallo.com/#website'}, 'primaryImageOfPage': {'@id': 'https://www.lesinfosdupaysgallo.com/2020/05/13/la-gacilly-groupe-rocher-quand-les-neuros-sciences-facilitent-le-retour-au-travail/#primaryimage'}, 'image': {'@id': 'https://www.lesinfosdupaysgallo.com/2020/05/13/la-gacilly-groupe-rocher-quand-les-neuros-sciences-facilitent-le-retour-au-travail/#primaryimage'}, 'thumbnailUrl': 'https://www.lesinfosdupaysgallo.com/wp-content/uploads/2020/03/nz76584-1160x773.jpg', 'datePublished': '2020-05-13T16:40:54+00:00', 'dateModified': '2020-05-13T16:40:54+00:00', 'description': ""Neuros-sciences, intelligence artificielle, e-learning, innovation et partage... Le groupe Rocher n'a pas lésiné sur les moyens pour réussir le challenge"", 'breadcrumb': {'@id': 'https://www.lesinfosdupaysgallo.com/2020/05/13/la-gacilly-groupe-rocher-quand-les-neuros-sciences-facilitent-le-retour-au-travail/#breadcrumb'}, 'inLanguage': 'fr-FR', 'potentialAction': [{'@type': 'ReadAction', 'target': ['https://www.lesinfosdupaysgallo.com/2020/05/13/la-gacilly-groupe-rocher-quand-les-neuros-sciences-facilitent-le-retour-au-travail/']}]}, {'@type': 'ImageObject', 'inLanguage': 'fr-FR', '@id': 'https://www.lesinfosdupaysgallo.com/2020/05/13/la-gacilly-groupe-rocher-quand-les-neuros-sciences-facilitent-le-retour-au-travail/#primaryimage', 'url': 'https://www.lesinfosdupaysgallo.com/wp-content/uploads/2020/03/nz76584-1160x773.jpg', 'contentUrl': 'https://www.lesinfosdupaysgallo.com/wp-content/uploads/2020/03/nz76584-1160x773.jpg', 'width': 1920, 'height': 1280, 'caption': 'photo: Emmanuel Bethier'}, {'@type': 'BreadcrumbList', '@id': 'https://www.lesinfosdupaysgallo.com/2020/05/13/la-gacilly-groupe-rocher-quand-les-neuros-sciences-facilitent-le-retour-au-travail/#breadcrumb', 'itemListElement': [{'@type': 'ListItem', 'position': 1, 'name': 'Accueil', 'item': 'https://www.lesinfosdupaysgallo.com/'}, {'@type': 'ListItem', 'position': 2, 'name': 'coronavirus', 'item': 'https://www.lesinfosdupaysgallo.com/category/coronavirus/'}, {'@type': 'ListItem', 'position': 3, 'name': 'La Gacilly. Groupe Rocher: quand les neuros-sciences facilitent le retour au travail'}]}, {'@type': 'WebSite', '@id': 'https://www.lesinfosdupaysgallo.com/#website', 'url': 'https://www.lesinfosdupaysgallo.com/', 'name': 'Les Infos du Pays Gallo', 'description': 'L&#039;actualité de Ploërmel à Questembert', 'publisher': {'@id': 'https://www.lesinfosdupaysgallo.com/#organization'}, 'potentialAction': [{'@type': 'SearchAction', 'target': {'@type': 'EntryPoint', 'urlTemplate': 'https://www.lesinfosdupaysgallo.com/?s={search_term_string}'}, 'query-input': 'required name=search_term_string'}], 'inLanguage': 'fr-FR'}, {'@type': 'Organization', '@id': 'https://www.lesinfosdupaysgallo.com/#organization', 'name': 'Les Infos du Pays Gallo', 'url': 'https://www.lesinfosdupaysgallo.com/', 'logo': {'@type': 'ImageObject', 'inLanguage': 'fr-FR', '@id': 'https://www.lesinfosdupaysgallo.com/#/schema/logo/image/', 'url': 'https://www.lesinfosdupaysgallo.com/wp-content/uploads/2019/02/logo.jpg', 'contentUrl': 'https://www.lesinfosdupaysgallo.com/wp-content/uploads/2019/02/logo.jpg', 'width': 377, 'height': 197, 'caption': 'Les Infos du Pays Gallo'}, 'image': {'@id': 'https://www.lesinfosdupaysgallo.com/#/schema/logo/image/'}, 'sameAs': ['https://www.facebook.com/infospaysgallo', 'https://x.com/InfosPaysGallo', 'https://www.youtube.com/channel/UCu7wTAGZaSCOEPbKQkSnT8A']}, {'@type': 'Person', '@id': 'https://www.lesinfosdupaysgallo.com/#/schema/person/579b4ef9cdb85b34ef39ccfa0a11d28d', 'name': 'infosgallo', 'image': {'@type': 'ImageObject', 'inLanguage': 'fr-FR', '@id': 'https://www.lesinfosdupaysgallo.com/#/schema/person/image/', 'url': 'https://secure.gravatar.com/avatar/6e9bd2ee97211c2b84623b0ed463f486?s=96&d=mm&r=g', 'contentUrl': 'https://secure.gravatar.com/avatar/6e9bd2ee97211c2b84623b0ed463f486?s=96&d=mm&r=g', 'caption': 'infosgallo'}}]",N/A,N/A,"
 ",,,,,,,,,,,,,,,,,,,,,,,,,,,
https://news.google.com/rss/articles/CBMiUWh0dHBzOi8vdGhlZ29vZGxpZmUuZnIvam9lbGxlLXBpbmVhdS1pbnRlbGxpZ2VuY2UtYXJ0aWZpY2llbGxlLWF1LXByb2ZpdC1kZS10b3VzL9IBAA?oc=5,Facebook : Joëlle Pineau L'intelligence artiϐicielle au profit de tous - The Good Life,2020-05-12,The Good Life,https://thegoodlife.fr,"Un pied chez Facebook, l’autre à l’université McGill de Montréal, l’experte canadienne en intelligence artificielle Joëlle Pineau bouleverse les codes.",N/A,"Un pied chez Facebook, l’autre à l’université McGill de Montréal, l’experte canadienne en intelligence artificielle Joëlle Pineau bouleverse les codes.",N/A,https://schema.org,"[{'@type': 'WebSite', '@id': 'https://thegoodlife.fr/#website', 'url': 'https://thegoodlife.fr/', 'name': 'The Good Life', 'description': 'Business &amp; Lifestyle', 'potentialAction': [{'@type': 'SearchAction', 'target': {'@type': 'EntryPoint', 'urlTemplate': 'https://thegoodlife.fr/?s={search_term_string}'}, 'query-input': 'required name=search_term_string'}], 'inLanguage': 'fr-FR'}, {'@type': 'ImageObject', 'inLanguage': 'fr-FR', '@id': 'https://thegoodlife.fr/joelle-pineau-intelligence-artificielle-au-profit-de-tous/#primaryimage', 'url': '/wp-content/thumbnails/uploads/sites/2/2020/05/numerisation-tgl-42-joelle-pineau-intelligence-artificielle-1-56-tt-width-1872-height-1200-fill-0-crop-0-bgcolor-eeeeee.jpg', 'contentUrl': '/wp-content/thumbnails/uploads/sites/2/2020/05/numerisation-tgl-42-joelle-pineau-intelligence-artificielle-1-56-tt-width-1872-height-1200-fill-0-crop-0-bgcolor-eeeeee.jpg', 'width': 1872, 'height': 1200, 'caption': 'Facebook : Joëlle Pineau, l’intelligence artificielle au profit de tous'}, {'@type': 'WebPage', '@id': 'https://thegoodlife.fr/joelle-pineau-intelligence-artificielle-au-profit-de-tous/#webpage', 'url': 'https://thegoodlife.fr/joelle-pineau-intelligence-artificielle-au-profit-de-tous/', 'name': 'Facebook : Joëlle Pineau, l’intelligence artificielle au profit de tous', 'isPartOf': {'@id': 'https://thegoodlife.fr/#website'}, 'primaryImageOfPage': {'@id': 'https://thegoodlife.fr/joelle-pineau-intelligence-artificielle-au-profit-de-tous/#primaryimage'}, 'datePublished': '2020-05-12T04:19:29+00:00', 'dateModified': '2021-12-10T15:52:00+00:00', 'author': {'@id': 'https://thegoodlife.fr/#/schema/person/d775670d682baf0d30035783a0e4a9df'}, 'description': 'Un pied chez Facebook, l’autre à l’université McGill de Montréal, l’experte canadienne en intelligence artificielle Joëlle Pineau bouleverse les codes.', 'breadcrumb': {'@id': 'https://thegoodlife.fr/joelle-pineau-intelligence-artificielle-au-profit-de-tous/#breadcrumb'}, 'inLanguage': 'fr-FR', 'potentialAction': [{'@type': 'ReadAction', 'target': ['https://thegoodlife.fr/joelle-pineau-intelligence-artificielle-au-profit-de-tous/']}]}, {'@type': 'BreadcrumbList', '@id': 'https://thegoodlife.fr/joelle-pineau-intelligence-artificielle-au-profit-de-tous/#breadcrumb', 'itemListElement': [{'@type': 'ListItem', 'position': 1, 'name': 'Accueil', 'item': 'https://thegoodlife.fr/'}, {'@type': 'ListItem', 'position': 2, 'name': 'Facebook : Joëlle Pineau L’intelligence artiϐicielle au profit de tous'}]}, {'@type': 'Person', '@id': 'https://thegoodlife.fr/#/schema/person/d775670d682baf0d30035783a0e4a9df', 'name': 'jchassagne'}]",N/A,N/A,"

 

 Facebook : Joëlle Pineau, l’intelligence artificielle au profit de tous

jchassagne


The Good Business Facebook : Joëlle Pineau L’intelligence artiϐicielle au profit de tous 
                Partager : 













Par Elisabeth Guédel, le 12 mai 2020



                            Partager : 


The Good Business

                        Un pied chez Facebook, l’autre à l’université McGill de Montréal, l’experte canadienne en intelligence artificielle bouleverse les codes avec une idée pionnière : la collaboration et le partage dans la recherche.                    
Jongler entre deux mondes, Joëlle Pineau en a l’habitude. Originaire de l’anglophone Ottawa, la capitale du Canada, elle travaille depuis plus de quinze ans dans la province francophone du Québec, à Montréal. Elle a grandi entre la musique – elle jouait du violon – et les mathématiques. Aujourd’hui, à 45 ans, la scientifique codirige les huit laboratoires de recherche en intelligence artificielle (IA) de l’une des plus grandes entreprises au monde, Facebook, tout en chapeautant les travaux d’une vingtaine d’étudiants à l’université McGill.
Une double casquette privé-public qui ne la gêne pas. Bien au contraire. « Il faut toujours faire attention aux questions de conflits d’intérêts et de partage de la propriété intellectuelle, reconnaît-elle sans tabou. Il faut s’assurer que le partenariat soit vu de façon positive des deux côtés. Mais il y a des avantages pour tous. »
Collaboration privé-public autour de l’intelligence artificielle
Ce modèle de collaboration a été établi dès la création du laboratoire de recherche en intelligence artificielle de Facebook (FAIR), en 2013. Côté académique, la démarche d’intégrer le secteur industriel était pourtant loin d’être naturelle. A l’université McGill, Joëlle Pineau a secoué les habitudes en acceptant, il y a trois ans, de travailler pour le réseau social de Mark Zuckerberg. « Il fallait juste que l’université ait un peu d’imagination pour voir ce que ça pouvait donner dans un département informatique, comme cela se faisait déjà dans ceux de médecine, d’ingénierie ou de business », explique avec enthousiasme la directrice du laboratoire d’apprentissage et de raisonnement à la prestigieuse université montréalaise.


 

			L’un des bâtiments de l’Université McGill à Montréal.			DR 

Son domaine d’expertise : le reinforcement learning, l’apprentissage par renforcement, une branche de l’IA consacrée à l’entraînement des agents par un système de récompenses et de conséquences. Un système « que toute personne ayant des enfants ou un animal domestique connaît bien. Il permet d’adapter le comportement. On l’applique aux machines », résume simplement l’experte en algorithmes et mère de quatre enfants. Les machines apprennent ainsi à prendre les bonnes décisions à partir de l’expérience et non plus sur instruction. Les propres recherches de Joëlle Pineau s’appliquent à la robotique et à la santé.
Assurer la qualité des contenus de Facebook
Au sein de Facebook, la chercheuse travaille sur de vastes projets qui s’étendent, au-delà du FAIR de Montréal, aux laboratoires de Menlo Park, en Californie – le siège de Facebook –, de New York et de Paris – les trois plus gros – ou encore à ceux de Seattle, Pittsburg, Londres et Tel-Aviv. Elle est impliquée dans la gestion des équipes et les stratégies de recherche orientées notamment sur les questions d’intégrité des données et du repérage des contenus haineux. Un travail accompli de plus en plus par des algorithmes d’apprentissage.
« Nous sommes aujourd’hui capables de réaliser très rapidement des traductions – entre cinquante et soixante langues. Nous visons la centaine de langues, celles exprimées par les utilisateurs de Facebook, afin de pouvoir détecter rapidement le contenu problématique. » La priorité du réseau social aujourd’hui ? Assurer la qualité du contenu, au cœur des critiques de ces dernières années, surtout depuis la campagne présidentielle américaine de 2016.
« Nous avons eu des élections au Canada à l’automne, ce fut une sorte de préparation aux grandes élections de novembre prochain aux Etats-Unis. » Des leçons à tirer afin d’améliorer la visibilité des utilisateurs de Facebook, de les aider à mieux comprendre ce qu’ils lisent, voient et entendent, et de leur apprendre à mieux filtrer. Les critiques faites à Facebook sont justifiées, reconnaît Joëlle Pineau, mais les problèmes soulevés ne sont pas propres au groupe de Mark Zuckerberg. « Si Facebook s’arrêtait demain matin, ces problèmes surgiraient sur les autres plates-formes. Or, Facebook a les effectifs et les moyens pour trouver des solutions qui peuvent être partagées avec d’autres. »

Elle l’avoue : elle n’aurait pas accepté de travailler dans un laboratoire privé autre que celui de Facebook. « Les travaux y sont réalisés sur un mode de sciences ouvertes, donc nous publions, nous parlons de nos travaux de façon très ouverte. A long terme, cela bénéficie à toutes les entreprises qui n’ont pas forcément les ressources nécessaires pour améliorer les choses. Cela me tient à coeur en tant que chercheuse. » Un sens du partage qui fait du bien.



Lire aussi
Luc Julia, l’intelligence… sans artifice
Rencontre avec Kai-Fu Lee, le gourou de l’intelligence artificielle chinoise
Heuritech, quand l’intelligence artificielle chasse les tendances



                        Partager l’article : 







                    Voir plus d’articles sur le sujet
                





The Good Business // Les révolutions du son et de l’image avec DolbyThe Good Business // Comment les banques investissent dans l’intelligence artificielle ?The Good Business // Un décollage immédiat avec le taxi volant eVTOLThe Good Business // Ces 8 entrepreneur.se.s à suivre en 2024The Good Business // Michael Dell : un parcours unique dans la tech américaineThe Good Business // Un Paris-New York avec La Compagnie, la business class démocratiqueThe Good Business // Zoï, le check-up médical 3.0The Good Business // Rencontre avec Richard Collier, nouveau CEO des bagages D_b_The Good Business // Succession : que faut-il faire pour hériter d’un milliardaire ?The Good Business // Havea à l’assaut des compléments alimentairesThe Good Business // Certification B Corp : qu’est-ce que ça veut vraiment dire ?The Good Business // Malgré l’exode, le patron chinois d’Alibaba tient à son vignoble bordelais 





                    Continuer la lecture
                



",,,,,,,,,,,,,,,,,,,,,,,,,,,
