URL link,Title,Date,Source,Source Link,description,keywords,og:description,twitter:description,@context,@graph,article:section,article:summary,article text,@type,itemListElement,@id,address,contactPoint,foundingDate,image,logo,name,telephone,url,mainEntityOfPage,publisher,headline,datePublished,dateModified,author,articleBody,speakable,copyrightHolder,copyrightYear,creator,dateCreated,inLanguage,sameAs,potentialAction,breadcrumb
https://news.google.com/rss/articles/CBMicGh0dHBzOi8vd3d3LmFsbG5ld3MuY2gvY29udGVudC9wb2ludHMtZGUtdnVlL2wlRTIlODAlOTlpbnRlbGxpZ2VuY2UtZXN0LWVsbGUtZW5jb3JlLWxlLXByb3ByZS1kZS1sJUUyJTgwJTk5aG9tbWXSAQA?oc=5,L'intelligence est-elle encore le propre de l'homme? - allnews.ch,2020-05-14,allnews.ch,https://www.allnews.ch,L’utilisation de l’intelligence artificielle et du machine learning aura un impact important sur l’économie en augmentant la productivité du travail.,N/A,L’utilisation de l’intelligence artificielle et du machine learning aura un impact important sur l’économie en augmentant la productivité du travail.,L’utilisation de l’intelligence artificielle et du machine learning aura un impact important sur l’économie en augmentant la productivité du travail.,,,N/A,N/A,"

 L’intelligence est-elle encore le propre de l’homme?


14 May 2020 - 07:00

Florence Anglès, Capco

3 minutes de lecture




L’utilisation de l’intelligence artificielle et du machine learning aura un impact important sur l’économie en augmentant la productivité du travail.


Depuis la Grèce antique, l’intelligence est associée au cerveau, qui capture l’information au travers de nos différents sens. Le cervau est composé d’environ 100 milliards d’entités indépendantes : les neurones. Ils sont interconnectés entre eux, composant ainsi un réseau infiniment complexe. Loin d’être figé, cet organe évolue tout au long de notre vie, au rythme de notre vécu, de nos expériences. Sa plasticité contribue ainsi à une meilleure adaptation à notre environnement. La compréhension des règles gouvernant les réseaux de neurones remonte aux travaux de recherche du canadien Donald Hebb en 1949 avec sa fameuse formule: «des neurones qui s’excitent ensemble se lient entre eux». Sa théorie est ainsi à l’origine des réseaux de neurones artificiels. Qui permettent aujourd’hui aux machines d’être capables d’apprendre
De l’apprentissage au Deep Learning
L’intelligence artificielle (IA) est un sujet très vaste qui se définit comme «l’ensemble des théories mises en œuvre en vue de réaliser des machines capables de simuler l’intelligence». Le machine learning (ML) est un élément de l’IA, qui s’appuie sur des approches mathématiques et statistiques donnant aux machines la capacité d’apprendre. 
Un aperçu de l’IA, du Machine Learning et analyse des big data

Source: Financial Stability Board, «Artificial intelligence and machine learning in financial services»
 

L’histoire du ML débute dans les années 40 avec la découverte du neurone artificiel par deux chercheurs de l’université de Chicago, Warren McCulloch et Walter Pitts. Le neurone artificiel est une abstraction mathématique et informatique du neurone biologique. Il devient possible de construire des réseaux de neurones artificiels afin de résoudre des opérations logiques. Le perceptron est l'un des premiers algorithmes d'apprentissage automatique et le réseau neuronal le plus simple. Il s'agit d'un algorithme d'apprentissage supervisé de classificateurs binaires, inventé en 1957 par Frank Rossenblatt au Cornell Aeronautical Laboratory et utilisé pour la reconnaissance d'images. Ce perceptron monocouche a encore des limites : il ne peut séparer les classes que linéairement. L'ajout de couches cachées améliore l'algorithme et permet de multiplier le pouvoir explicatif du modèle. Le perceptron multicouche est un réseau neuronal profond. Plus nous ajoutons de couches cachées, plus la profondeur du réseau est grande et meilleure est la prise de décision du ML. Cependant, cela entraîne également des difficultés, dont l'un est le problème central de l'apprentissage automatique appelé le surapprentissage. De plus, cette architecture de réseau nécessite également une grande puissance de calcul et beaucoup de données. Le réseau neuronal est resté confiné à des tâches restreintes car pour résoudre des problèmes complexes, plusieurs couches sont nécessaires et les chercheurs ne savaient pas comment former ces couches superposées.
Selon l’OCDE, en 2019, le marché du private equity
compte 12% d’investissements dans des start-up d’IA.
Les réseaux de neurones et l’IA ont traversé des hauts et des bas. 2012 est une année marquante pour les réseaux de neurone avec le Deep Learning. Lors du défi ImageNet 2012, Geoffrey Hinton, Ilya Sutskever et Alex Krizhevsky ont soumis une architecture de réseau de neurones convolutionnel, AlexNet. Il a surclassé ses concurrents en ramenant l'erreur top 5 de 26% à 15%. Le Deep Learning est devenu courant et a traversé les frontières jusqu’en Asie de l’est En 2016, la Chine reconnaît tout le potentiel de l’IA et du Deep Learning et décide de devenir un leader dans ce domaine.   Après Deep Blue en 1997, qui a battu le champion du monde des échecs, AlphaGo s’est lancé à la conquête d’un jeu ancestral chinois caractérisé par sa complexité: le jeu de Go, apanage des stratèges et des empereurs. Par l’immensité du nombre de combinaison possible, ce jeu semblait un défi de taille pour l’IA. Pourtant, en mars 2016, AlphaGo affronte le maître, Lee Sedol et remporte la bataille. La machine l’emporte sur l’homme et attire alors l’attention du monde entier. Et ce n'est pas un hasard si trois pionniers du Deep Learning, Yoshua Bengio, Geoffrey Hinton et Yann LeCun obtiennent le prix Turing en 2019.
Un marché attractif pour les investisseurs
Sur la base de ces succès et des avancées de l’algo trading, les investisseurs s’intéressent de façon croissante à l’IA. Selon l’OCDE, en 2019, le marché du private equity compte 12% d’investissements dans des start-up d’IA. Les principaux acteurs sont les USA, la Chine (depuis 2016 avec le soutien de son gouvernement) et l’Europe.

Source: OECD estimates, based on Crunchbase (July 2018)
 

Les hedge funds sont de grands acteurs des algorithmes d'IA et d'apprentissage automatique en raison de leur capacité à identifier de nouveaux signaux, des mouvements de prix et à digérer une grande quantité de données. Cela fait partie intégrante de leur quotidien. En utilisant des modèles quantitatifs, les fonds spéculatifs peuvent développer de nouvelles stratégies de négociation. Mais son utilisation ne s’arrête pas aux investisseurs et à la gestion alternative. Elle peut s’avérer être une opportunité pour les banquiers privés. Il apparait aujourd’hui clairement que leur futur va dépendre de leur capacité à utiliser l’IA pour personnaliser la relation client et pour prendre en compte la demande des millénials, dont les attentes sont façonnées par les nouvelles technologies. La gestion de fortune va devoir augmenter l’utilisation de l’IA pour améliorer l’expérience client en fournissant des produits et des services qui répondent mieux aux besoins. Elle ne remplacera pas le conseiller clientèle mais va tout au contraire l’aider: le métier de banquier va graduellement évoluer et sera IA «augmenté». 
En quelques années, l’IA est ainsi devenue
une affaire stratégique et géopolitique.
La fonction de gestion des risques doit elle aussi s’adapter afin d’avoir les bonnes compétences à bord pour comprendre l’IA et les modèles de ML. Cette tendance est liée à l’essor du big data et de la puissance de calcul. Toutefois, ces technologies ne sont pas parfaites. Si l’IA et plus particulièrement le Deep Learning sont probablement des «game changer» pour l’industrie financière et la gestion des risques, ils peuvent aussi amplifier ou créer de nouveaux risques (biais algorithmiques ou simples erreurs de programmation).
L’utilisation de ces technologies n’est pas limitée à la finance, elle aura un impact important sur l’économie en augmentant la productivité du travail, en créant une nouvelle main d’œuvre virtuelle et des nouvelles sources de revenus avec la diffusion de l’innovation. Elle devient ainsi une problématique stratégique pour les pays. La Chine débute sa course de l’IA afin d’accroître son activité économique et son influence géopolitique. En quelques années, l’IA est ainsi devenue une affaire stratégique et géopolitique. 
Les machines pensent-elles? La question reste en suspens. Une chose est sûre: elles sont capables d’apprendre en profondeur.




Imprimer










",,,,,,,,,,,,,,,,,,,,,,,,,,,
https://news.google.com/rss/articles/CBMib2h0dHBzOi8vaXRzb2NpYWwuZnIvY29udGVudXMvYWN0dWFsaXRlcy9tYXAtbWF0Y2gtdW4tb3V0aWwtcG91ci1yZW1vYmlsaXNlci1sZXMtZXF1aXBlcy1hcHJlcy1sZS1kZWNvbmZpbmVtZW50L9IBAA?oc=5,"Map & match, un outil pour remobiliser les équipes après le déconfinement - IT SOCIAL - IT Social",2020-05-12,IT Social,https://itsocial.fr,N/A,N/A,"Que ce soit la crise et le confinement qui s’en est suivi ou simplement la transformation numérique et le bouleversement des modes de travail, les salariés ont été mis à rude épreuve ces derniers temps. Pour remobiliser ses troupes et raviver la cohésion et l’engagement, les solutions peuvent être applicative, comme le propose map & […]",N/A,https://schema.org,"[{'@type': 'WebPage', '@id': 'https://itsocial.fr/contenus/actualites/map-match-un-outil-pour-remobiliser-les-equipes-apres-le-deconfinement/', 'url': 'https://itsocial.fr/contenus/actualites/map-match-un-outil-pour-remobiliser-les-equipes-apres-le-deconfinement/', 'name': 'Map & match, un outil pour remobiliser les équipes après le déconfinement - IT SOCIAL', 'isPartOf': {'@id': 'https://itsocial.fr/#website'}, 'primaryImageOfPage': {'@id': 'https://itsocial.fr/contenus/actualites/map-match-un-outil-pour-remobiliser-les-equipes-apres-le-deconfinement/#primaryimage'}, 'image': {'@id': 'https://itsocial.fr/contenus/actualites/map-match-un-outil-pour-remobiliser-les-equipes-apres-le-deconfinement/#primaryimage'}, 'thumbnailUrl': 'https://itsocial.fr/wp-content/uploads/2020/05/logo-new_with-baseline_createur_dalchimie_collab.png', 'datePublished': '2020-05-12T05:47:00+00:00', 'dateModified': '2020-05-12T06:52:54+00:00', 'author': {'@id': 'https://itsocial.fr/#/schema/person/3c25d07cf1666f6fe669f8ea4210b5e6'}, 'breadcrumb': {'@id': 'https://itsocial.fr/contenus/actualites/map-match-un-outil-pour-remobiliser-les-equipes-apres-le-deconfinement/#breadcrumb'}, 'inLanguage': 'fr-FR', 'potentialAction': [{'@type': 'ReadAction', 'target': ['https://itsocial.fr/contenus/actualites/map-match-un-outil-pour-remobiliser-les-equipes-apres-le-deconfinement/']}]}, {'@type': 'ImageObject', 'inLanguage': 'fr-FR', '@id': 'https://itsocial.fr/contenus/actualites/map-match-un-outil-pour-remobiliser-les-equipes-apres-le-deconfinement/#primaryimage', 'url': 'https://itsocial.fr/wp-content/uploads/2020/05/logo-new_with-baseline_createur_dalchimie_collab.png', 'contentUrl': 'https://itsocial.fr/wp-content/uploads/2020/05/logo-new_with-baseline_createur_dalchimie_collab.png', 'width': 2534, 'height': 504}, {'@type': 'BreadcrumbList', '@id': 'https://itsocial.fr/contenus/actualites/map-match-un-outil-pour-remobiliser-les-equipes-apres-le-deconfinement/#breadcrumb', 'itemListElement': [{'@type': 'ListItem', 'position': 1, 'name': 'Home', 'item': 'https://itsocial.fr/'}, {'@type': 'ListItem', 'position': 2, 'name': 'Map &#038; match, un outil pour remobiliser les équipes après le déconfinement'}]}, {'@type': 'WebSite', '@id': 'https://itsocial.fr/#website', 'url': 'https://itsocial.fr/', 'name': 'IT SOCIAL', 'description': 'Média IT, Tech et Innovation', 'potentialAction': [{'@type': 'SearchAction', 'target': {'@type': 'EntryPoint', 'urlTemplate': 'https://itsocial.fr/?s={search_term_string}'}, 'query-input': 'required name=search_term_string'}], 'inLanguage': 'fr-FR'}, {'@type': 'Person', '@id': 'https://itsocial.fr/#/schema/person/3c25d07cf1666f6fe669f8ea4210b5e6', 'name': 'Mourad Krim', 'image': {'@type': 'ImageObject', 'inLanguage': 'fr-FR', '@id': 'https://itsocial.fr/#/schema/person/image/', 'url': 'https://itsocial.fr/wp-content/uploads/avatars/640/64ca4020d8d48-bpfull.jpg', 'contentUrl': 'https://itsocial.fr/wp-content/uploads/avatars/640/64ca4020d8d48-bpfull.jpg', 'caption': 'Mourad Krim'}, 'description': 'Journaliste IT'}]",N/A,N/A,"




CONTENUSACTUALITES

Map & match, un outil pour remobiliser les équipes après le déconfinement

Par Mourad Krim -   12/05/2020 



 





   
Que ce soit la crise et le confinement qui s’en est suivi ou simplement la transformation numérique et le bouleversement des modes de travail, les salariés ont été mis à rude épreuve ces derniers temps. Pour remobiliser ses troupes et raviver la cohésion et l’engagement, les solutions peuvent être applicative, comme le propose map & match, une solution managériale qui « offre une lecture différente de ce qu’apporte un collaborateur au sein d’un collectif », selon son éditeur. En cette période de reprise de l’activité, les managers doivent reconduire leurs équipes vers la performance dans un contexte inédit de déconfinement. Une reprise comme aucune autre auparavant, sous le signe de la distanciation physique et des règles qui ne favorisent pas comportement naturel sur le lieu de travail.


Map & match est une jeune pousse française qui propose une solution de management de l’entreprise et des équipes, résultat de 20 ans de recherche fondamentale par la chercheuse Chantal Gensse, sur le fonctionnement d’un système social compris comme un système vivant, et en constante recherche de performance. Le modèle développé par la startup permet, via un algorithme, de révéler les talents innés de chaque collaborateur, leurs impacts dans un projet collectif et l’adéquation aux enjeux de l’entreprise. Concrètement, l’outil permet de mieux se connaître individuellement pour voir comment mieux servir les objectifs du groupe.


L’objectif est de donner aux managers la capacité de mieux connaître leurs équipes et d’optimiser leurs fonctionnements en permettant à chaque collaborateur d’exploiter au mieux ses talents donc d’être plus performant. « Au lieu de se baser seulement sur les compétences techniques et expertises, nous allons plus loin pour miser sur les appétences, “les plaisirs du faire” qui sont créateurs d’énergie et de valeur, explique Fazila Rialland, directrice générale de la startup. On renforce la performance en s’appuyant sur les moteurs d’action naturels liés à la personnalité du plaisir de faire de chacun. »


Comment ça fonctionne ?


À partir d’un questionnaire en ligne, l’algorithme révèle au collaborateur ses talents innés.


Le « map » présente deux cartographies :Le « map » de l’équipe : la plateforme consolide tous les profils pour sortir une cartographie de l’ADN de l’équipe qui va permettre au manager, en un coup d’œil de se rendre compte ou non de la complémentarité de ses membres.Le « map » de projet : le manager qualifie les enjeux de son projet et map & match les traduit en talents requis. La deuxième cartographie présente les talents requis pour réaliser le projet.


Le « match » : map & match fait matcher les deux « maps ». Le matching révèle les forces et les « trous dans la raquette » du fonctionnement de l’équipe par rapport à ses objectifs et permet ainsi de prendre les décisions managériales pour s’ajuster.


Enfin, le manager optimise son organisation en mettant les bons talents au bon endroit afin de répondre au mieux aux enjeux, tout en assurant une parfaite complémentarité des talents requis.


« L’entreprise gagnera immédiatement en efficacité avec des collaborateurs plus investis et plus épanouis et un fonctionnement d’équipe plus optimisé », affirme le communiqué.
    


MOTS CLESRHSIRHTalents 
Mourad KrimJournaliste IT  
ARTICLES SIMILAIRESPLUS DE L'AUTEUR




 

LexisNexis lance sa solution d’IA générative pour professionnels du droit 

 



 

Orange Business SD-WAN Essentials, une offre de connectivité qui vise les PME 

 



 

Colt signe avec OVHCloud pour assurer la conformité de ses clients européens 

 




 

Denodo 9.0 simplifie l’accès et l’exploitation des données pour l’alimentation des LLM 

 



 

MicroStrategy One combine IA et analytique pour remonter les informations à la volée 

 



 

Cloudera lance trois nouveaux assistants IA pour les applications métier, les requêtes SQL et le ML 

 




 

Datadog lance LLM Observability pour surveiller des grands modèles de langage 

 



 

Grâce à l’IA, GitGuardian FP Remover réduirait de moitié les faux positifs 

 



 

AI EVERYWERE : De l’IA générative au PC IA, le futur de l’entreprise 

  


LAISSER UN COMMENTAIRE Annuler ma réponseConnecter pour laisser un commentaire  
 




Les vidéos Tech les plus waouh 
Suivre sur LinkedIn✉️ Newsletter quotidienne
	Recevez notre newsletter quotidienne comme 40,000 décideurs IT  et digital : articles de fond, actualités, interviews, tribunes... 


Conférence | On Demand 



Infographie – Zero Trust 


Derniers articles de fond




Intelligence artificielle : les Français restent méfiants 
Intelligence Artificielle - Articles 03/07/2024 


 




Les défis de sécurité croissants dans les environnements conteneurisés et Kubernetes 
Cloud & Infrastructure IT - Articles 03/07/2024 


 




La croissance du numérique fléchit en 2024 
Transformation digitale - Articles 02/07/2024 


 




L’impression 3D s’appuie sur l’intelligence artificielle 
Intelligence Artificielle - Articles 02/07/2024 


 




Plus de la moitié des dirigeants de TPE considèrent l’IA comme... 
Intelligence Artificielle - Articles 01/07/2024 


 Charger plus Derniers livres blancs




Tirez parti de toute la puissance de l’IA pour les vendeurs 
Intelligence Artificielle - Livres blancs 21/06/2024 


 




Stimulez l’innovation avec Microsoft Power Platform et l’IA 
Intelligence Artificielle - Livres blancs 21/06/2024 


 




Accélérez votre chiffre d’affaires avec Microsoft Dynamics 365 Sales 
Intelligence Artificielle - Livres blancs 21/06/2024 


 




Pourquoi votre stratégie de tests end-to-end échoue ? 
Logiciel & Agilité - Livres blancs 19/06/2024 


 




Groupe Mane : Privileged Remote Access garantit la sécurité et la... 
Cyberécurité - Livres blancs 19/06/2024 


 Charger plus Dernières actualités




LexisNexis lance sa solution d’IA générative pour professionnels du droit 
Intelligence Artificielle - Actualités 03/07/2024 


 




Orange Business SD-WAN Essentials, une offre de connectivité qui vise les... 
Cloud & Infrastructure IT - Actualités 03/07/2024 


 




Colt signe avec OVHCloud pour assurer la conformité de ses clients... 
Cloud & Infrastructure IT - Actualités 02/07/2024 


 




Denodo 9.0 simplifie l’accès et l’exploitation des données pour l’alimentation des... 
Intelligence Artificielle - Actualités 02/07/2024 


 




MicroStrategy One combine IA et analytique pour remonter les informations à... 
Intelligence Artificielle - Actualités 01/07/2024 


 Charger plus Social Attitude 

 
",,,,,,,,,,,,,,,,,,,,,,,,,,,
https://news.google.com/rss/articles/CBMiZWh0dHBzOi8vbC1mcmlpLmNvbS90cmF1bWF0aXNtZS1mYWNlYm9vay1kZWJvdXJzZXJhLWVudmlyb24tMzEtbWlsbGlhcmRzLWRlLWZjZmEtcG91ci1zZXMtbW9kZXJhdGV1cnMv0gEA?oc=5,Traumatisme : Facebook déboursera environ 31 milliards de FCFA pour ses modérateurs - L-FRII,2020-05-14,L-FRII,https://l-frii.com,N/A,N/A,"Selena Scola, une ancienne modératrice de Facebook, a déposé une plainte auprès d’un tribunal californien contre l’entreprise en septembre 2018. Après 9 mois de travail chez le réseau, la jeune femme disait souffrir d’un syndrome de stress post-traumatique. Fatigué de son statut de milliardaire, Elon Musk vend tous ses biens Comme le rapporte Phonandroïd, c’est généralement après une […]",N/A,,,N/A,N/A,"

 







 




Comment choisir le meilleur bookmaker au Togo ? 












 








Comment choisir le meilleur bookmaker au Togo ? 







",,,,,,,,,,,,,,,,,,,,,,,,,,,
