URL link,Title,Date,Source,Source Link,description,keywords,og:description,twitter:description,article:section,article:summary,article text,@context,@type,itemListElement,headline,publisher,mainEntityOfPage,image,datePublished,dateModified,articleSection,author,articleBody,copyrightYear,@graph,@id,name,url,logo,foundingDate,sameAs,speakable,associatedMedia
https://news.google.com/rss/articles/CBMidGh0dHBzOi8vd3d3LmxhcHJlc3NlLmNhL2FjdHVhbGl0ZXMvc2NpZW5jZXMvMjAyMC0wOC0zMC91bmUtc29tbWl0ZS1lbi1pbnRlbGxpZ2VuY2UtYXJ0aWZpY2llbGxlLWNob2lzaXQtbW9udHJlYWwucGhw0gEA?oc=5,Une sommité en intelligence artificielle choisit Montréal - La Presse,2020-08-30,La Presse,https://www.lapresse.ca,"Elle est détentrice de 64 brevets et a fait une longue carrière chez IBM avant de choisir Montréal pour y poursuivre ses travaux. Irina Rish, originaire de ce qui est aujourd’hui l’Ouzbékistan, dirigera l’automne prochain une chaire de recherche dotée d’un imposant budget de 34 millions afin d’approfondir les liens entre le cerveau humain et l’intelligence artificielle. Portrait. ",,"Elle est détentrice de 64 brevets et a fait une longue carrière chez IBM avant de choisir Montréal pour y poursuivre ses travaux. Irina Rish, originaire de ce qui est aujourd’hui l’Ouzbékistan, dirigera l’automne prochain une chaire de recherche dotée d’un imposant budget de 34 millions afin d’approfondir les liens entre le cerveau humain et l’intelligence artificielle. Portrait. ","Elle est détentrice de 64 brevets et a fait une longue carrière chez IBM avant de choisir Montréal pour y poursuivre ses travaux. Irina Rish, originaire de ce qui est aujourd’hui l’Ouzbékistan, dirigera l’automne prochain une chaire de recherche dotée d’un imposant budget de 34 millions afin d’approfondir les liens entre le cerveau humain et l’intelligence artificielle. Portrait. ",Sciences,N/A,"







        Sciences
    





        Une sommité en intelligence artificielle choisit Montréal
    










                    PHOTO OLIVIER JEAN, LA PRESSE
                

                    Irina Rish, originaire de ce qui est aujourd’hui l’Ouzbékistan, est la nouvelle star de l’intelligence artificielle à Montréal. 
                





Elle est détentrice de 64 brevets et a fait une longue carrière chez IBM avant de choisir Montréal pour y poursuivre ses travaux. Irina Rish, originaire de ce qui est aujourd’hui l’Ouzbékistan, dirigera l’automne prochain une chaire de recherche dotée d’un imposant budget de 34 millions afin d’approfondir les liens entre le cerveau humain et l’intelligence artificielle. Portrait. 



Publié le 30 août 2020




































Philippe Mercure
                    
La Presse
                    



La campagne de séduction a été longue et intense. Dans les conférences internationales, les stars de l’intelligence artificielle montréalaises comme Yoshua Bengio et Joëlle Pineau lui faisaient du pied. Mais Irina Rish était bien installée dans son laboratoire new-yorkais d’IBM, où elle travaillait depuis près de 20 ans. 
« J’aimais mon travail, je ne cherchais pas le changement », dit-elle à La Presse. Mais le milieu montréalais a insisté. On lui a fait miroiter non pas une, mais bien deux chaires de recherche. Irina Rish a accepté de venir visiter Mila, l’Institut québécois d’intelligence artificielle, qu’elle connaissait de réputation. 
« J’ai trouvé ça intéressant, raconte-t-elle. L’an dernier, j’ai reçu un appel et une offre et je me suis retrouvée confrontée à une décision difficile. J’avais beaucoup d’amis et de collaborateurs chez IBM. Les choses allaient bien. Mais il y avait cette opportunité. » 









En blague, Irina Rish dit qu’elle a finalement choisi l’Université de Montréal et le Québec pour le ski. Chaque année, sa famille passait la relâche scolaire au mont Tremblant. « Pouvoir y aller en une heure et demie plutôt que huit heures de conduite est un gros plus pour nous ! », dit-elle. Plus sérieusement, celle qui tisse des liens entre l’intelligence des machines et celle des humains vante la recherche qui se fait dans la métropole québécoise. 


Tant en matière d’intelligence artificielle et d’apprentissage profond que de neurosciences et de psychologie, il y a des choses ici qui sont très attirantes. 


            Irina Rish
        

Yoshua Bengio, professeur au département d’informatique et de recherche opérationnelle de l’Université de Montréal et directeur scientifique de Mila, se réjouit de cette nouvelle acquisition. 









                    PHOTO OLIVIER JEAN, ARCHIVES LA PRESSE
                

                    Yoshua Bengio
                



« Irina Rish est une experte reconnue mondialement dans la recherche à l’interface de l’intelligence artificielle fondamentale et des applications médicales de l’intelligence artificielle. Elle a une longue expérience aux laboratoires de recherche d’IBM aux États-Unis, où elle a contribué à la fois aux progrès scientifiques profitant de la synergie entre neurosciences, psychiatrie et apprentissage profond et aux applications industrielles de l’intelligence artificielle », dit-il. 
De l’Ouzbékistan à Montréal 
Irina Rish est née à Samarcande, dans ce qui était à l’époque l’Union soviétique et forme aujourd’hui l’Ouzbékistan. Ses grands-parents, moscovites, s’y étaient réfugiés pour échapper à la répression sous le régime de Staline. Avec deux parents professeurs de mathématiques, la petite Irina tombe tôt dans la marmite des sciences. 
« Petite, je m’amusais à résoudre des problèmes que mes frères aînés me donnaient. J’en tirais du plaisir », raconte-t-elle. À l’école, elle s’illustre dans les olympiades de sciences et de mathématiques organisées par le gouvernement. 









                    PHOTO OLIVIER JEAN, LA PRESSE
                

                    Irina Rish
                



À 14 ans, Irina Rish tombe sur un livre intitulé Can Machines Think ? (« Est-ce que les machines peuvent penser ? »). « C’était mon premier contact avec l’intelligence artificielle et ça a frappé ma curiosité », raconte-t-elle. L’informatique est alors en plein essor et Irina Rish s’y lance. Après un baccalauréat en mathématiques appliquées à l’Institut Goubkine de Moscou, au cours duquel elle maintient une moyenne de 4,98 sur 5, elle prend le chemin des États-Unis. Elle effectue sa maîtrise et son doctorat en intelligence artificielle à l’Université de Californie à Irvine, avant d’entrer chez IBM, où elle mène une prolifique carrière au centre de recherche Thomas J. Watson de New York pendant près de 20 ans. 
« Lire dans les pensées » 
La professeure Rish résume son champ d’expertise comme on déclame un slogan : « l’intelligence artificielle pour la neuroscience, et la neuroscience pour l’intelligence artificielle ». 
D’un côté, la spécialiste utilise l’intelligence artificielle pour mieux comprendre le cerveau humain et les problèmes qui le touchent. Chez IBM, elle faisait même partie d’un groupe de recherche sur la « psychiatrie computationnelle ». 
« Nous essayons essentiellement d’utiliser des données provenant de l’imagerie du cerveau, en combinaison avec d’autres données de tests cognitifs ou de langage, pour détecter et reconnaître différents états mentaux ou des changements dans l’état mental », explique la spécialiste. En analysant l’activité du cerveau, les chercheurs peuvent ainsi déceler des problèmes comme la schizophrénie, la douleur ou la dépendance. Ils peuvent même deviner ce que fait un sujet sain ou comment il se sent simplement en analysant les données provenant de l’imagerie par résonance magnétique fonctionnelle. 
« Parfois, on dit que ce genre d’analyse revient à lire dans les pensées ! », lance Irina Rish. 
Mais la chercheuse travaille aussi dans la direction inverse : elle s’inspire du cerveau pour développer de meilleurs modèles et de meilleurs algorithmes d’intelligence artificielle. 


Nous voulons des systèmes plus larges et plus robustes. Des systèmes d’intelligence artificielle qui pourront éventuellement apprendre toute leur vie, comme les humains le font, et qui pourront résoudre différents types de problèmes. 


            Irina Rish
        

Elle rappelle que la plupart des systèmes actuels sont extrêmement spécialisés. Ils peuvent être entraînés à exécuter une tâche très spécifique — jouer aux échecs, par exemple —, mais sont pratiquement incapables de faire autre chose. 
Arrivée à Montréal l’automne dernier, Irina Rish dirigera à l’Université de Montréal une chaire d’excellence en recherche du Canada dotée d’un budget de 34 millions sur sept ans, en plus d’une autre chaire de recherche de l’Institut canadien de recherches avancées, organisation financée par des fonds privés et publics. Ses enfants, âgés de 16 et 8 ans, s’adaptent bien à Montréal, une ville appréciée par toute la famille. 
« D’un côté, c’est une grande ville et il y a des choses à faire, observe-t-elle. De l’autre, c’est une atmosphère plus calme et plus relaxe qu’à New York, qui peut devenir assez stressante. Pour nous, c’est un peu le meilleur des deux mondes. » 



































",https://schema.org,NewsMediaOrganization,,,,,,,,,,,,,https://www.lapresse.ca/#organization,La Presse,https://www.lapresse.ca,"{'@type': 'ImageObject', 'url': 'https://static.lpcdn.ca/lpweb/lapresse/img/lp_facebook_1.91x1.png', 'width': 1203, 'height': 630}",1884-10-20,"['https://www.facebook.com/LaPresseFB', 'https://twitter.com/lp_lapresse', 'https://www.linkedin.com/company/la-presse', 'https://www.instagram.com/lp_lapresse', 'https://fr.wikipedia.org/wiki/La_Presse_(Montr%C3%A9al)']",,
https://news.google.com/rss/articles/CBMihAFodHRwczovL3d3dy5qb3VybmFsZHVuZXQuY29tL2ludGVsbGlnZW5jZS1hcnRpZmljaWVsbGUvMTQ5MzEwMS1sZS1tYWNoaW5lLWxlYXJuaW5nLWF1dG9tYXRpc2UtdmEtdC1pbC1yZW1wbGFjZXItbGVzLWRhdGEtc2NpZW50aXN0cy_SAQA?oc=5,Le machine learning automatisé va-t-il remplacer le data scientist ? - JDN,2020-08-28,JDN,https://www.journaldunet.com,"DataRobot, Google AutoML, H2O.ai... Les solutions d'automated machine learning se multiplient depuis quelques années. Leur ambition ? Automatiser la création de modèles d'apprentissage.",N/A,"DataRobot, Google AutoML, H2O.ai... Les solutions d'automated machine learning se multiplient depuis quelques années. Leur ambition ? Automatiser la création de modèles d'apprentissage.","DataRobot, Google AutoML, H2O.ai... Les solutions d'automated machine learning se multiplient depuis quelques années. Leur ambition ? Automatiser la création de modèles d'apprentissage.",N/A,N/A,"



                                        Le machine learning automatisé va-t-il remplacer le data scientist ?                









Antoine Crochet-Damais
JDN





                                 
                                Mis à jour le 28/08/20 14:37








Twitter 














LinkedIn 



Facebook 



Whatsapp 



Email












                DataRobot, Google AutoML, H2O.ai... Les solutions d'automated machine learning se multiplient depuis quelques années. Leur ambition ? Automatiser la création de modèles d'apprentissage.        
Nouveau buzzword de l'IA, l'automated machine learning (auto ML) promet comme son nom l'indique d'automatiser la création de modèles d'apprentissage. Ces dernières années, de nombreux acteurs se sont lancés à l'assaut de ce nouveau Far West. En 2012, les pure player DataRobot et H2O.ai s ouvrent la route. Google leur emboîte le pas en 2018 en lançant son service cloud AutoML. En 2019, c'est au tour de Microsoft avec Azure ML, et d'AWS avec Sagemaker Autopilot. En parallèle, des studios de data science entrent dans la danse en intégrant cette dimension à leur offre. C'est le cas du français Dataiku, de l'allemand Knime ou de l'américain Rapidminer (lire le comparatif des outils d'automated machine learning). Ces solutions peuvent-elles prétendre remplacer le travail du data scientist ? Evidemment en partie, mais pour l'heure elles sont avant tout considérées comme des outils susceptibles d'assister le scientifique de la donnée dans la mise en œuvre de ses projets.
""L'automated machine learning permet à un data analyst de créer rapidement un modèle simple, par exemple un classifieur d'images, en l’entraînant à partir d'un data set de photos labellisées"", explique Didier Gaultier, directeur data science & AI au sein de Business & Decision, filiale d'Orange experte en data.  Le mode opératoire d'un environnement d'auto ML ? En fonction d'un problème à résoudre (une prédiction financière, une maintenance préventive, de la reconnaissance d'images...), il commence par  sélectionner plusieurs algorithmes possibles. Puis il les entraîne, comme vu plus haut, sur la base d'un set de données d'apprentissage prédéfini. Via une couche de scoring, il compare ensuite leurs résultats en mixant plusieurs combinaisons d'hyperparamètres. Dans le cas du deep learning, ces derniers correspondent par exemple au nombre de couches du réseau de neurones et au nombre de nœuds dans chaque couche. Compte tenu de l'objectif cible à atteindre, le modèle le plus performant est retenu au final.
L'auto ML, un assistant
Si le problème à résoudre devient plus complexe, l'automated machine learning sera vite dépassé. ""Ces solutions sont très performantes pour benchmarker les modèles d'apprentissage supervisés classiques : régression linéaire, arbre de décision, forêt aléatoire, machine à vecteurs de support"", constate Aymen Chakhari, directeur de l'IA au sein de l'ESN française Devoteam. ""Sur ce périmètre, elles fourniront au data scientist des scores de fiabilité leur permettant de gagner du temps et réduire le time to value."" Mais pour aboutir à un résultat satisfaisant sur des prédictions complexes, par exemple en économétrie, en recherche pharmaceutique ou encore pour la détection des fraudes, il sera nécessaire de personnaliser les modèles voir de les combiner. ""Prenons l'exemple des systèmes de détection d'attaques informatiques. Certaines attaques changent de signature en temps réel. Il n'est donc plus possible de les détecter via les algorithmes classiques. Pour les repérer, on doit passer par des approches semi-supervisées ou non-supervisées qui nécessitent l'intervention d'un data scientist.""


Slide issue d’une présentation de Devoteam présentant les différentes étapes prises en charge par les outils d’automated machine learning (feature engineering, entrainement, évaluation et validation des modèles, serving) et pour chacune le degré d’automatisation estimé. © Devoteam


Autre cas d'école, Devoteam a publié début juin une modélisation sur l'évolution du Covid-19 en France. ""La courbe de l'épidémie va s'aplatir, avec un nombre de décès qui atteindra 30 293 en France le 15 juillet, contre 29 021 au 4 juin"", prédisait alors l'ESN. Résultat : mi-juillet, le nombre de morts du Covid-19 s'élevait dans l'Hexagone à 30 120, soit un degré de précision de 99,42% comparé à la projection initiale. Pour atteindre cette finesse de prédiction, l'entreprise de Levallois-Perret a d'abord eu recours à plusieurs technologies d'automated machine learning (Azure ML, Google AutoML, H2O.ai, Knime et Rapidminer). ""Avec ces outils, nous avons obtenu des prédictions de l'ordre de 80 000 à 120 000 décès pour cette date, associées à des précisions estimées à environ 96%. Ce qui est évidemment à côté de la plaque. Mais nous savions que la probabilité d'un écart important existerait"", reconnait Aymen Chakhari.

""Le feature engineering n'est pas une science, c'est plus de l'art, du feeling""

Pourquoi ? Car deux composantes centrales manquaient pour résoudre l'équation. La première : la nécessité de composer avec une grande variété de données (taux de propagation du virus, respect de gestes barrières, comportement des français dans les lieux publics...) ""L'automated machine learning a certes permis de constater que la forêt aléatoire apportait une bonne précision, mais cet algorithme n'était pas capable de composer avec la diversité des contenus à traiter"", explique Aymen Chakhari. ""Nous avons dû le mixer avec l'apprentissage par renforcement du Bandit manchot."" Evidemment, l'auto ML est incapable d'atteindre un tel degré d'ingénierie, et notamment de réaliser de l'ensembling de modèles.
Seconde valeur ajoutée apportée par les data scientist de Devoteam : le feature engineering. Une étape qui consiste à sélectionner les variables intervenant dans l'algorithme et leur poids respectifs. ""Le feature engineering n'est pas une science, c'est plus de l'art, du feeling"", estime Aymen Chakhari.
10 ans avant le business understanding
L'automated machine learning permet, il est vrai, de détecter des types de variables dans un data set : variable d'horodatage, variable textuelle, variable numérique discrète ou continue, URL, de date… ""Reste à savoir comment les coder. On pourra par exemple définir une valeur de vitesse par plages : entre 0 et 20 km/h, 21 et 60 km/h, 61 et 80 km/h, etc. Mais si les plages sont codées différemment, le résultat du modèle ne sera pas le même"", pointe Didier Gaultier chez Business & Decision. ""Du coup, les outils d'auto ML sont incapables de réaliser ce travail. Ils se contentent de faire un recodage par force brute, en calculant toutes les possibilités de codage d'une variable avec elle-même. Ce qui n'est pas très efficace et demande des ressources de calcul considérables."" Pour autant, l'auto ML permettra de mettre le doigt sur les 20% de variables vraiment importantes, et donner des pistes sur les poids à leur associer. ""Des variables que le data scientist devra ensuite recoder à la main"", ajoute Didier Gaultier.
Le poids à allouer aux variables est une autre dimension que l'automated machine learning appréhende difficilement. ""Prenez la modélisation que nous avons réalisée pour estimer l'évolution du PIB français suite à la crise du Covid-19. L'algorithme a été entraîné sur des données de l'INSEE, de Statista, de la banque de France et de l'OCDE, couvrant les années 2017, 2018 et 2019"", indique Aymen Chakhari. Des opérations itératives de feature engineering ont ensuite été réalisées pour pondérer au plus juste l'impact des paramètres choisis en fonction du contexte : pertes d'emplois (avec un score volontairement plus important), création d'emplois, consommation des ménages, contribution des secteurs économiques… ""Une sérialisation mathématique algébrique a été appliquée pour aligner la logique de pondération retenue à l'ensemble des paramètres"", complète Aymen Chakhari. ""Ici, la particularité est d'être dans un contexte non-stationnaire avec une évolution rapide sur l'activité, par conséquent des algorithmes de reinforcement learning ont été retenus et optimisés pour s'adapter à cette cinétique d'évolution et en tenir compte dans les prédictions.""
Ce dernier exemple démontre le chemin qui reste à parcourir avant d'aboutir à un automated machine learning capable de tenir compte d'un contexte métier et d'y apporter une réponse cohérente et adaptée aussi complexe soit-elle. ""Il faudra attendre encore 10 ans avant que l'auto ML entre dans l'ère du business understanding. Cela devrait passer par des techniques comme le reinforcement learning ou les réseaux antagonistes génératifs"", anticipe Aymen Chakhari.

Le JDN c'est plus de 1000 articles publiés chaque annéetotalement GRATUITS, pour cela une inscription suffit !Inscrivez-vous gratuitement pour lire l’article de Antoine Crochet-Damais, rédacteur spécialisé dans le digital !Lire gratuitement l'article en s'inscrivantDéja membre ? Se connecter
",http://schema.org,BreadcrumbList,"[{'@type': 'ListItem', 'position': 1, 'item': {'@id': 'https://www.journaldunet.com/', 'url': 'https://www.journaldunet.com/', 'name': 'Accueil'}}, {'@type': 'ListItem', 'position': 2, 'item': {'@id': 'https://www.journaldunet.com/intelligence-artificielle/', 'url': 'https://www.journaldunet.com/intelligence-artificielle/', 'name': 'Intelligence artificielle'}}]",,,,,,,,,,,,,,,,,,,
