URL link,Title,Date,Source,Source Link,description,keywords,og:description,twitter:description,article:section,article:summary,article text,@context,@type,itemListElement,headline,publisher,mainEntityOfPage,image,datePublished,dateModified,articleSection,author,articleBody,copyrightYear,@graph,Image,inLanguage,url,isAccessibleForFree,name,hasPart,dateCreated,sameAs,potentialAction,breadcrumb
https://news.google.com/rss/articles/CBMicGh0dHBzOi8vd3d3Lmlsby5vcmcvZnIvcmVzb3VyY2UvbmV3cy9saW50ZWxsaWdlbmNlLWFydGlmaWNpZWxsZS1nZW5lcmF0aXZlLWRldnJhaXQtY29tcGxldGVyLXBsdXRvdC1xdWUtZGV0cnVpcmXSAQA?oc=5,L'intelligence artificielle générative devrait compléter plutôt que détruire des emplois - Organisation Internationale du Travail,2023-08-21,Organisation Internationale du Travail,https://www.ilo.org,N/A,N/A,N/A,N/A,N/A,N/A,"







Intelligence artificielle
L'intelligence artificielle générative devrait compléter plutôt que détruire des emplois
Un rapport de l’OIT évalue l'impact de l'intelligence artificielle générative (capable de générer du texte, des images ou d'autres médias) sur la quantité et la qualité des emplois.
21 août 2023




                    Facebook
                



                    Twitter
                



                    Linkedin
                


 









  GENÈVE (OIT Infos) – Une nouvelle étude de l'Organisation internationale du Travail (OIT) révèle que l'intelligence artificielle générative (IA) est plus susceptible de compléter que de détruire les emplois en automatisant certaines tâches plutôt qu'en remplaçant entièrement un rôle.    L'étude, Generative AI and Jobs: A global analysis of potential effects on job quantity and quality (NDR: IA générative et l'emploi: une analyse globale des effets potentiels sur la quantité et la qualité de l'emploi), suggère que la plupart des emplois et des industries ne sont que partiellement exposés à l'automatisation et sont plus susceptibles d'être complétés que remplacés par la dernière vague d'IA générative, telle que chatGPT. Par conséquent, l'impact le plus important de cette technologie ne sera probablement pas la destruction d'emplois, mais plutôt les changements potentiels de la qualité des emplois, notamment l'intensité du travail et l'autonomie.      Le travail de bureau s’avère être la catégorie la plus exposée aux technologies d’intelligence artificielles, avec près d'un quart des tâches considérées comme très exposées et plus de la moitié des tâches présentant un niveau d'exposition moyen. Dans d'autres catégories professionnelles - notamment les cadres, les professionnels et les techniciens – seule une petite partie des tâches est considérée comme très exposée, tandis qu'environ un quart d'entre elles présentent un niveau d'exposition moyen.    L'étude, de portée mondiale, met en évidence des différences notables dans les effets sur les pays à différents niveaux de développement, liées aux contextes économiques et aux écarts technologiques existants. Elle constate que 5,5 % de l'emploi total dans les pays à revenu élevé est potentiellement exposé aux effets d'automatisation de la technologie, alors que dans les pays à faible revenu, le risque d'automatisation ne concerne qu'environ 0,4 % de l'emploi. D'autre part, le potentiel d'augmentation est pratiquement le même dans tous les pays, ce qui laisse penser qu'avec la mise en place de politiques appropriées, cette nouvelle vague de transformation technologique pourrait offrir d'importants avantages aux pays en développement.    L'étude révèle que les effets potentiels de l'IA générative sont susceptibles de différer sensiblement pour les hommes et les femmes, la part de l'emploi féminin pouvant être affectée par l'automatisation étant plus de deux fois supérieure. Cela s'explique par la surreprésentation des femmes dans les emplois de bureau, en particulier dans les pays à revenu élevé et intermédiaire. Les emplois de bureau étant traditionnellement une source importante d'emplois féminins au fur et à mesure que les pays se développent économiquement, l'IA générative pourrait avoir pour conséquence que certains emplois de bureau ne voient jamais le jour dans les pays à faible revenu.   Le document conclut que les impacts socio-économiques de l'IA générative dépendront largement de la manière dont sa diffusion sera gérée. Il souligne la nécessité de concevoir des politiques qui favorisent une transition ordonnée, équitable et consultative. Le dialogue avec les travailleurs, la formation et une protection sociale adéquate seront essentielles pour gérer la transition. Dans le cas contraire, seuls quelques pays et acteurs du marché bien préparés risquent de bénéficier de la nouvelle technologie.    Les auteurs notent que «les résultats de la transition technologique ne sont pas prédéterminés. Ce sont les êtres humains qui sont à l'origine de la décision d'incorporer ces technologies et ce sont eux qui doivent guider le processus de transition.»    








Contenu associé


",,,,,,,,,,,,,,,,,,,,,,,,
https://news.google.com/rss/articles/CBMijwFodHRwczovL3d3dy5jYXBpdGFsLmZyL2VudHJlcHJpc2VzLW1hcmNoZXMvbGludGVsbGlnZW5jZS1hcnRpZmljaWVsbGUtZGV2cmFpdC1jcmVlci1wbHVzLWRlbXBsb2lzLXF1ZW4tZGV0cnVpcmUtc2Vsb24tdW5lLWV0dWRlLWRlLWxvbnUtMTQ3Njk3ONIBAA?oc=5,"L'intelligence artificielle devrait créer plus d'emplois qu'en détruire, selon une étude de l'ONU - Capital.fr",2023-08-21,Capital.fr,https://www.capital.fr,"L'Organisation internationale du travail des Nations Unies a publié ce lundi 21 août une étude mettant en avant les conséquences positives des intelligences artificielles (IA) sur l'emploi. D'après le rapport, les IA seraient plus susceptibles d'en créer que l'inverse. ",",emploi,intelligence artificielle,robot,ChatGPT,","L'Organisation internationale du travail des Nations Unies a publié ce lundi 21 août une étude mettant en avant les conséquences positives des intelligences artificielles (IA) sur l'emploi. D'après le rapport, les IA seraient plus susceptibles d'en créer que l'inverse. ","L'Organisation internationale du travail des Nations Unies a publié ce lundi 21 août une étude mettant en avant les conséquences positives des intelligences artificielles (IA) sur l'emploi. D'après le rapport, les IA seraient plus susceptibles d'en créer que l'inverse. ",business,N/A,"



 


			Intelligence artificielle : pourquoi les entreprises y succombent 
									
		




				INTELLIGENCE ARTIFICIELLE
			

",http://schema.org,NewsArticle,"[{'@type': 'ListItem', 'position': 1, 'item': {'name': 'Accueil', '@id': 'https://www.capital.fr/'}}]","L'intelligence artificielle devrait créer plus d'emplois qu'en détruire, selon une étude de l'ONU","{'@type': 'Organization', 'name': 'Capital.fr', 'url': 'https://www.capital.fr', 'logo': {'@type': 'ImageObject', 'url': 'https://www.capital.fr/assets/capital/modern/images/logo_capital.5e6f8109c8f4ffb474a4.png', 'height': 60, 'width': 175}}",https://www.capital.fr/entreprises-marches/lintelligence-artificielle-devrait-creer-plus-demplois-quen-detruire-selon-une-etude-de-lonu-1476978,"{'url': 'https://cap.img.pmdstatic.net/fit/https.3A.2F.2Fi.2Epmdstatic.2Enet.2Fcap.2F2023.2F03.2F24.2F6e6f8224-1eee-4c4b-af7c-023d57759122.2Ejpeg/1200x630/cr/wqkgSGFtaWQvQWRvYmUgU3RvY2sgLyBDQVBJVEFM/lintelligence-artificielle-devrait-creer-plus-demplois-quen-detruire-selon-une-etude-de-lonu-1476978.jpg', 'width': 1200, 'height': 630, '@type': 'ImageObject'}",2023-08-21T22:20:01+02:00,2023-08-21T22:20:01+02:00,business,"[{'@type': 'Person', 'name': 'Capital avec AFP'}]","Doit-on vraiment s'en m&eacute;fier comme de la peste ? L'intelligence artificielle (IA) est plus susceptible de cr&eacute;er des emplois que d'en d&eacute;truire, estime une &eacute;tude publi&eacute;e lundi 21 ao&ucirc;t par l'ONU. Le lancement en novembre du robot conversationnel ChatGPT, consid&eacute;r&eacute; comme une r&eacute;volution dans l'usage de l'IA, a cr&eacute;&eacute; de nombreuses craintes quant &agrave; la transformation du monde du travail et &agrave; son impact sur l'emploi. Mais une nouvelle &eacute;tude de l'Organisation internationale du travail (OIT) des Nations Unies examinant l'effet potentiel de ces plate-formes d'intelligence artificielle, sugg&egrave;re que la plupart des emplois et des industries ne sont que partiellement expos&eacute;s &agrave; l'automatisation.L'IA ""permettra d'accompagner plut&ocirc;t que de remplacer certaines activit&eacute;s"", estime l'OIT. ""Ainsi la premi&egrave;re cons&eacute;quence de cette nouvelle technologie ne se traduira probablement pas par la destruction d'emplois, mais plut&ocirc;t par des changements potentiels dans la qualit&eacute; des emplois, notamment l'intensit&eacute; du travail et l'autonomie"", r&eacute;v&egrave;le l'&eacute;tude. L'&eacute;tude souligne aussi que les effets de cette nouvelle technologie varient consid&eacute;rablement selon les professions et les zones, les femmes &eacute;tant plus susceptibles que les hommes de voir leur travail affect&eacute;.Les pays &agrave; revenus &eacute;lev&eacute;s plus expos&eacute;s &agrave; l'automatisationLe travail administratif dans les bureaux s'av&egrave;re &ecirc;tre la cat&eacute;gorie la plus expos&eacute;e aux technologies d'intelligence artificielle avec pr&egrave;s d'un quart des t&acirc;ches consid&eacute;r&eacute;es comme tr&egrave;s expos&eacute;es et plus de la moiti&eacute; pr&eacute;sentant un niveau d'exposition moyen. Parmi les cadres et les techniciens, seule une petite partie des t&acirc;ches sera touch&eacute;e par l'IA, tandis qu'environ un quart pr&eacute;sente des niveaux d'exposition moyens, selon l'OIT. Le rapport indique que les pays &agrave; revenus &eacute;lev&eacute;s subiraient les effets les plus importants de l'automatisation en raison de la part importante notamment des emplois de bureau. Il a r&eacute;v&eacute;l&eacute; que 5,5% de l'emploi total dans les pays &agrave; revenus &eacute;lev&eacute;s &eacute;taient potentiellement expos&eacute;s aux effets d'automatisation de l'IA g&eacute;n&eacute;rative, alors que seulement 0,4% de l'emploi dans les pays &agrave; faibles revenus l'&eacute;taient. 	
		&Agrave; lire aussi : 
		
			Intelligence artificielle : Elon Musk lance xAI pour &ldquo;comprendre la v&eacute;ritable nature de l&rsquo;univers&rdquo;
		
	
Dans le m&ecirc;me temps, l'&eacute;tude a soulign&eacute; que la part de l'emploi potentiellement affect&eacute;e par l'automatisation &eacute;tait plus de deux fois plus &eacute;lev&eacute;e pour les femmes que pour les hommes, en raison de la surrepr&eacute;sentation des femmes dans le travail de bureau, en particulier dans les pays &agrave; revenus &eacute;lev&eacute;s et interm&eacute;diaires. Si cette &eacute;tude fait appara&icirc;tre des diff&eacute;rences significatives entre les pays riches et les pays pauvres, il constate que le nombre potentiel d'emplois cr&eacute;&eacute;s par l'IA est pratiquement le m&ecirc;me dans tous les pays. Cela sugg&egrave;re qu'""avec les bonnes politiques en place, cette nouvelle vague de transformation technologique pourrait offrir des avantages importants aux pays en d&eacute;veloppement"", a d&eacute;clar&eacute; l'OIT. Les pays devront donc concevoir des politiques visant &agrave; soutenir un changement ""ordonn&eacute;, &eacute;quitable et consultatif"", ont d&eacute;clar&eacute; les auteurs de l'&eacute;tude. 	
		&Agrave; lire aussi : 
		
			La Chine &ldquo;extr&ecirc;mement m&eacute;contente&rdquo; des Etats-Unis, l&rsquo;intelligence artificielle fera l&rsquo;objet de restrictions
		
	
",2023,,,,,,,,,,,
