URL link,Title,Date,Source,Source Link,description,keywords,og:description,twitter:description,@context,@type,itemListElement,mainEntityOfPage,headline,alternativeHeadline,name,datePublished,dateModified,author,speakable,image,articleSection,publisher,isAccessibleForFree,article:section,article:summary,article text,@graph,dateCreated,isPartOf,hasPart,url,countryOfOrigin,inLanguage,isFamilyFriendly
https://news.google.com/rss/articles/CBMijwFodHRwczovL3d3dy5vdWVzdC1mcmFuY2UuZnIvY3VsdHVyZS9hcnRzL3VuLXByb2pldC1kZS1tYXJpYW5uZS12YS1ldHJlLWNvbmN1LXBhci1pbnRlbGxpZ2VuY2UtYXJ0aWZpY2llbGxlLWE2ZDI2NGZjLTg5YWQtMTFlYy05YWU2LWQ1OTI4NThiNDBmNtIBAA?oc=5,Un projet de Marianne va être conçu par intelligence artificielle - Ouest-France,2022-02-09,Ouest-France,https://www.ouest-france.fr,"Avec ce nouveau concept artistique, le collectif Obvious veut « créer une nouvelle Marianne numérique, la plus représentative possible des femmes françaises, afin de mettre en avant la diversité », a expliqué l’un de ses membres, ce mercredi 9 février.","['Arts', 'Culture', 'Société', 'High Tech', 'Actualité en continu', 'Une']","Avec ce nouveau concept artistique, le collectif Obvious veut « créer une nouvelle Marianne numérique, la plus représentative possible des femmes françaises, afin de mettre en avant la diversité », a expliqué l’un de ses membres, ce mercredi 9 février.","Avec ce nouveau concept artistique, le collectif Obvious veut « créer une nouvelle Marianne numérique, la plus représentative possible des femmes françaises, afin de mettre en avant la diversité », a expliqué l’un de ses membres, ce mercredi 9 février.",https://schema.org,NewsArticle,"[{'@type': 'ListItem', 'position': 1, 'item': {'name': 'Culture', '@id': 'https://www.ouest-france.fr/culture/'}}, {'@type': 'ListItem', 'position': 2, 'item': {'name': 'Arts', '@id': 'https://www.ouest-france.fr/culture/arts/'}}]","{'@id': 'https://www.ouest-france.fr/culture/arts/un-projet-de-marianne-va-etre-concu-par-intelligence-artificielle-a6d264fc-89ad-11ec-9ae6-d592858b40f6', '@type': 'WebPage'}",Un projet de Marianne va être conçu par intelligence artificielle,"Avec ce nouveau concept artistique, le collectif Obvious veut « créer une nouvelle Marianne numérique, la plus représentative possible des femmes françaises, afin de mettre en avant la diversité », a expliqué l’un de ses membres, ce mercredi 9 février.",Un projet de Marianne va être conçu par intelligence artificielle,2022-02-09T14:58:49+01:00,2022-02-09T14:58:49+01:00,"[{'@type': 'Organization', 'name': 'Ouest-France avec AFP', 'url': 'http://www.ouest-france.fr/'}]","{'@type': 'SpeakableSpecification', 'cssSelector': ['h1.titre', 'div#article-detail p.chapeau']}","[{'@type': 'ImageObject', 'url': 'https://media.ouest-france.fr/v1/pictures/MjAyMjAyMDkyY2NmZTg3YjJjNmJjNzllY2MxNjU5MTgxMmY0ZDA?width=1260&height=708&focuspoint=50%2C25&cropresize=1&client_id=bpeditorial&sign=6c90ba892c126e87eace055805782fe379a6c08b1996ddd5e18a8b5d80e91fd4', 'width': 1260, 'height': 708}]",Arts,"{'@type': 'Organization', 'name': 'Ouest-France', 'url': 'https://www.ouest-france.fr', 'logo': {'@type': 'ImageObject', 'url': 'https://media.ouest-france.fr/v1/pictures/7856ef084164c8f5002a882c557b04df-ouest-france-couleur-170x56.png', 'width': 170, 'height': 56}, 'sameAs': ['https://www.facebook.com/ouest.france', 'https://twitter.com/ouestfrance']}",True,Arts,N/A,"



Un projet de Marianne va être conçu par intelligence artificielle

Avec ce nouveau concept artistique, le collectif Obvious veut « créer une nouvelle Marianne numérique, la plus représentative possible des femmes françaises, afin de mettre en avant la diversité », a expliqué l’un de ses membres, ce mercredi 9 février.





Une statue de Marianne photographiée à Mulhouse, dans l’est de la France, le 19 novembre 2021. | SÉBASTIEN BOZON / AFP


Voir en plein écran





fermer



Une statue de Marianne photographiée à Mulhouse, dans l’est de la France, le 19 novembre 2021. | SÉBASTIEN BOZON / AFP 







Ouest-France

                            Avec AFP.
                        


Publié le 09/02/2022  à 14h58






Abonnez-vous






Lire plus tard





Partager





Newsletter La Matinale
Chaque matin, l’actualité du jour sélectionnée par Ouest-France




Merci de saisir votre adresse e-mail





OK





Votre e-mail, avec votre consentement, est utilisé par Ouest-France pour recevoir notre newsletter. En savoir plus.









Un collectif d’artistes spécialisés dans l’intelligence artificielle (IA) propose une future Marianne numérique, réalisée à partir de milliers de portraits de femmes françaises, pour représenter la République, a fait savoir Pierre Fautrel, l’un des membres du collectif Obvious, à l’origine du projet.




Ce projet, intitulé « Nous sommes Marianne », vise à « créer une nouvelle Marianne numérique, la plus représentative possible des femmes françaises, afin de mettre en avant la diversité, à partir de photos de toutes celles qui souhaitent y participer » a-t-il précisé.




Ce collectif, qui réunit aussi Hugo Caselles-Dupré et Gauthier Vernier, férus d’art et de recherches sur l’IA, s’est fait connaître en 2018 pour avoir vendu chez Christie’s, à New York, la première œuvre d’art produite par un logiciel d’intelligence artificielle, une impression sur toile intitulée « Edmond de Belamy », portrait fictif flouté.




Plus de 5 000 candidates
Pour réaliser la future Marianne, il a lancé un appel à toutes les femmes de France qui peuvent envoyer une photo d’elles-mêmes sur un site dédié : noussommesmarianne.fr.




Plus de 5 000 candidates ont déjà répondu à l’appel qui s’achèvera le 10 avril. « Un algorithme va générer une infinité de visages à partir de critères communs dans toutes ces photos. Un seul d’entre eux sera sélectionné par les participantes d’ici fin avril », explique Pierre Fautrel qui « ne présage pas du résultat ».




Le collectif compte ensuite le proposer au futur président de la République.






Le trio Obvious, qui se passionne pour l’IA « d’un point de vue technique et philosophique, interroge les frontières entre l’art et ses outils et la démocratisation des algorithmes », explique-t-il.




Avec cette Marianne numérique, il a souhaité « s’affranchir des choix arbitraires qui ont été faits jusqu’à présent pour symboliser la République », comme celui d’actrices célèbres (Brigitte Bardot, Catherine Deneuve…).








L’apparition de Marianne remonte à 1792, au lendemain de la Révolution. La Convention avait alors décidé de représenter la République sous les traits d’une jeune femme triomphante, vêtue à l’antique et coiffée d’un bonnet phrygien, symbole de liberté porté dans l’empire romain par des esclaves affranchis.




Arts
Culture
Société
High Tech
Actualité en continu
gauchedroite




",,,,,,,,
https://news.google.com/rss/articles/CBMiXmh0dHBzOi8vd3d3LmJuZi5mci9mci9tZWRpYXRoZXF1ZS9sZXMtZW5qZXV4LWV0aGlxdWVzLWV0LXNvY2lhdXgtZGUtbGludGVsbGlnZW5jZS1hcnRpZmljaWVsbGXSAQA?oc=5,Les enjeux éthiques et sociaux de l'intelligence artificielle - BnF,2022-02-10,BnF,https://www.bnf.fr,.,N/A,BnF - Site institutionnel,N/A,,,,,,,,,,,,,,,,N/A,N/A,"
Laurence Devillers
Professeure à l’université Paris-Sorbonne et chercheuse au Laboratoire Interdisciplinaire des Sciences du Numérique (LISN) du CNRS

",,,,,,,,
https://news.google.com/rss/articles/CBMiV2h0dHBzOi8vd3d3Lm9ic2VydmF0aW9uc29jaWV0ZS5mci90cmF2YWlsL2Rvbm5lZXMtZ2VuZXJhbGVzLXRyYXZhaWwvZXZvbHV0aW9uZHV0cmF2YWlsL9IBAA?oc=5,"L'emploi progresse à nouveau, les inquiétudes demeurent - Centre d'observation de la société",2022-02-10,Centre d'observation de la société,https://www.observationsociete.fr,N/A,N/A,"L'emploi repart en France, notamment grâce aux services marchands. La crainte de sa disparition n'est pas fondée.",N/A,https://schema.org,,,,,,,,,,,,,,,N/A,N/A,"
L’évolution du nombre d’emplois est au cœur du débat public1. C’est logique : dans une société où l’abondance ne règne pas, le travail crée de la valeur et reste le fondement de la répartition de la richesse. S’il disparaît, comment allons-nous pouvoir vivre ? En novembre 1831, les canuts lyonnais (ouvriers tisserands) se révoltaient déjà contre l’introduction de métiers à tisser mécaniques. Dès les années 1950, la crainte des « robots » se développe en même temps qu’avance l’innovation dans ce domaine. Aujourd’hui, l’essor des nouvelles technologies de l’information et de la communication, l’intelligence artificielle et la faiblesse de la croissance relancent le débat sur « la fin du travail ».
Les craintes historiques sur la fin de l’emploi ne se sont pas avérées. Pour le comprendre, il faut observer les grandes tendances du passé, quitte à remonter très loin. Le nombre total d’emplois a stagné de la fin du XIXe siècle aux années 1960. Les Trente Glorieuses sont marquées par une nette progression : le nombre total d’emplois passe de 19 à 21 millions entre 1945 et 1975, il stagne entre 1979 et 1986, mais recommence à augmenter fortement pendant la période 1997-2001. Cependant, la courbe est marquée par les soubresauts économiques du début des années 1980 et 1990 ainsi qu’à la fin des années 2000, entraînant parfois de très fortes baisses (- 500 000 emplois entre 1991 et 1993 par exemple). Depuis 2016, la croissance de l’emploi est nette : on compte 660 000 emplois de plus qu’en 2016, alors même que l’année a été marquée par une forte récession.

En observant l’évolution de l’emploi en détail par secteur, on comprend bien mieux les transformations actuelles. Entre les années 1950 et 1975, l’emploi agricole s’effondre : il est divisé par trois, de six à deux millions de personnes. L’emploi industriel, dont l’essor est antérieur aux Trente Glorieuses, reste stable autour de cinq millions. En revanche, le développement des services, comme le dynamisme du bâtiment, alimentent la machine à emplois. Le chômage demeure contenu.
À partir du milieu des années 1970, l’industrie commence à décrocher : à l’époque, ce secteur regroupe encore 5,2 millions de postes et un quart de la main d’œuvre. En 2010, on ne compte plus que trois millions d’emplois dans l’industrie, soit 11 % de l’ensemble. Les services, même si le secteur reste dynamique, ne suffisent plus pour contenir ce déclin : le chômage progresse sauf durant quelques courtes périodes, entre 1986 et 1990 puis 1997 et 2001.
De 2008 au milieu des années 2010, les services flanchent à leur tour. L’emploi agricole, tombé sous le million, se stabilise autour de 800 000. Le déclin industriel se poursuit, mais il ralentit – pour la première fois depuis les années 1960 – dans les services non-marchands (l’Etat, les collectivités locales, les hôpitaux, les associations, etc.). Entre 2009 et 2012, l’emploi stagne. Soixante ans après son début, le processus de tertiarisation de l’emploi semble alors arrêté. Dans un contexte de poursuite du déclin industriel, le chômage est à nouveau tiré rapidement vers le haut.
Depuis le milieu des années 2010, l’emploi total a recommencé à augmenter plus nettement. L’activité reprend dans les services marchands qui ont créé presque plus d’un million de postes de travail entre 2009 et 2020. La reprise est plus modeste dans le secteur des services non-marchands. La grande nouveauté, c’est que l’emploi agricole et surtout industriel ne baisse plus. En 2020, on compte trois millions de postes dans l’industrie, autant qu’en 2010. Et c’est sans compter les emplois dans l’intérim comptabilisés parmi les services. Le taux de chômage diminue depuis 2016. La paternité de ce mouvement résulte beaucoup plus d’évolutions structurelles de l’activité économique, d’organisation des entreprises et d’innovation technologique que des mesures prises par tel ou tel gouvernement en place depuis 2010.
Une double inquiétude demeure cependant. Premièrement, celle de la durabilité de phase actuelle : le mouvement va-t-il venir se briser comme en 1983, 1993 ou 2008 sur une nouvelle récession ? Des milliards d’euros ont été dépensés par la collectivité pour amortir le choc de la crise sanitaire et l’emploi est reparti, mais l’incertitude reste grande. Sommes-nous entrés dans une période longue de cycles économiques plus marqués, comme avant les Trente Glorieuses ? Dans ce cas, on assisterait à nouveau à une montée du chômage assez rapidement. D’autre part, les nouveaux emplois sont souvent de moins bonne qualité, marqués notamment par la précarité et les bas salaires. Pourra-t-on parler de « plein emploi » avec des emplois qui ne rapportent plus guère ou très instables ? Le travail est loin d’avoir disparu, mais on comprend que les évolutions actuelles soulèvent des inquiétudes quant à son avenir2.
   
Photo : Janno Nivergal/Pixabay

Notes: Voir « Le Travail. Une valeur en voie de disparition », Dominique Meda, éd. Aubier, 1995. ↩ On ne discute pas ici de la question du statut de l’emploi, salarié ou non qui relève d’un registre différent, lire notre article. ↩ 
















","[{'@type': 'Article', '@id': 'https://www.observationsociete.fr/travail/donnees-generales-travail/evolutiondutravail/#article', 'isPartOf': {'@id': 'https://www.observationsociete.fr/travail/donnees-generales-travail/evolutiondutravail/'}, 'author': {'name': 'louis.maurin', '@id': 'https://www.observationsociete.fr/#/schema/person/6ec7bf7773e43937b50e0b9f6bec0090'}, 'headline': 'L&#8217;emploi progresse à nouveau, les inquiétudes demeurent', 'datePublished': '2022-02-10T07:01:00+00:00', 'dateModified': '2022-03-03T09:49:57+00:00', 'mainEntityOfPage': {'@id': 'https://www.observationsociete.fr/travail/donnees-generales-travail/evolutiondutravail/'}, 'wordCount': 831, 'publisher': {'@id': 'https://www.observationsociete.fr/#organization'}, 'image': {'@id': 'https://www.observationsociete.fr/travail/donnees-generales-travail/evolutiondutravail/#primaryimage'}, 'thumbnailUrl': 'https://www.observationsociete.fr/wp-content/uploads/2022/02/worker-ge7f3d023c_640.jpg', 'articleSection': ['Données générales'], 'inLanguage': 'fr-FR'}, {'@type': 'WebPage', '@id': 'https://www.observationsociete.fr/travail/donnees-generales-travail/evolutiondutravail/', 'url': 'https://www.observationsociete.fr/travail/donnees-generales-travail/evolutiondutravail/', 'name': ""L'emploi progresse à nouveau, les inquiétudes demeurent - Centre d&#039;observation de la société"", 'isPartOf': {'@id': 'https://www.observationsociete.fr/#website'}, 'primaryImageOfPage': {'@id': 'https://www.observationsociete.fr/travail/donnees-generales-travail/evolutiondutravail/#primaryimage'}, 'image': {'@id': 'https://www.observationsociete.fr/travail/donnees-generales-travail/evolutiondutravail/#primaryimage'}, 'thumbnailUrl': 'https://www.observationsociete.fr/wp-content/uploads/2022/02/worker-ge7f3d023c_640.jpg', 'datePublished': '2022-02-10T07:01:00+00:00', 'dateModified': '2022-03-03T09:49:57+00:00', 'breadcrumb': {'@id': 'https://www.observationsociete.fr/travail/donnees-generales-travail/evolutiondutravail/#breadcrumb'}, 'inLanguage': 'fr-FR', 'potentialAction': [{'@type': 'ReadAction', 'target': ['https://www.observationsociete.fr/travail/donnees-generales-travail/evolutiondutravail/']}]}, {'@type': 'ImageObject', 'inLanguage': 'fr-FR', '@id': 'https://www.observationsociete.fr/travail/donnees-generales-travail/evolutiondutravail/#primaryimage', 'url': 'https://www.observationsociete.fr/wp-content/uploads/2022/02/worker-ge7f3d023c_640.jpg', 'contentUrl': 'https://www.observationsociete.fr/wp-content/uploads/2022/02/worker-ge7f3d023c_640.jpg', 'width': 640, 'height': 427}, {'@type': 'BreadcrumbList', '@id': 'https://www.observationsociete.fr/travail/donnees-generales-travail/evolutiondutravail/#breadcrumb', 'itemListElement': [{'@type': 'ListItem', 'position': 1, 'name': 'Accueil', 'item': 'https://www.observationsociete.fr/'}, {'@type': 'ListItem', 'position': 2, 'name': 'L&#8217;emploi progresse à nouveau, les inquiétudes demeurent'}]}, {'@type': 'WebSite', '@id': 'https://www.observationsociete.fr/#website', 'url': 'https://www.observationsociete.fr/', 'name': 'Centre d&#039;observation de la société', 'description': '', 'publisher': {'@id': 'https://www.observationsociete.fr/#organization'}, 'potentialAction': [{'@type': 'SearchAction', 'target': {'@type': 'EntryPoint', 'urlTemplate': 'https://www.observationsociete.fr/?s={search_term_string}'}, 'query-input': 'required name=search_term_string'}], 'inLanguage': 'fr-FR'}, {'@type': 'Organization', '@id': 'https://www.observationsociete.fr/#organization', 'name': 'Centre d&#039;observation de la société', 'url': 'https://www.observationsociete.fr/', 'logo': {'@type': 'ImageObject', 'inLanguage': 'fr-FR', '@id': 'https://www.observationsociete.fr/#/schema/logo/image/', 'url': 'https://www.observationsociete.fr/wp-content/uploads/2022/03/Logo_complet_centreobs.png', 'contentUrl': 'https://www.observationsociete.fr/wp-content/uploads/2022/03/Logo_complet_centreobs.png', 'width': 1160, 'height': 230, 'caption': 'Centre d&#039;observation de la société'}, 'image': {'@id': 'https://www.observationsociete.fr/#/schema/logo/image/'}, 'sameAs': ['https://twitter.com/observ_societe']}, {'@type': 'Person', '@id': 'https://www.observationsociete.fr/#/schema/person/6ec7bf7773e43937b50e0b9f6bec0090', 'name': 'louis.maurin', 'url': 'https://www.observationsociete.fr/author/louis-maurin/'}]",,,,,,,
https://news.google.com/rss/articles/CBMiTmh0dHBzOi8vd3d3LnNjaWVuY2VwcmVzc2UucWMuY2Evdm90ZS1wb3VyLXNjaWVuY2UvMjAyMi8wMi8wOS9pYS1kaXNjcmltaW5hdGlvbtIBAA?oc=5,IA et discrimination - Agence Science-Presse,2022-02-09,Agence Science-Presse,https://www.sciencepresse.qc.ca,"Les médias parlent abondamment de l’intelligence artificielle et de tous les progrès qu’elle peut nous apporter. Il y a toutefois une face sombre: les biais et les discriminations qui y sont d’ores et déjà&nbsp;liés.
",N/A,"Les médias parlent abondamment de l’intelligence artificielle et de tous les progrès qu’elle peut nous apporter. Il y a toutefois une face sombre: les biais et les discriminations qui y sont d’ores et déjà&nbsp;liés.
","Les médias parlent abondamment de l’intelligence artificielle et de tous les progrès qu’elle peut nous apporter. Il y a toutefois une face sombre: les biais et les discriminations qui y sont d’ores et déjà&nbsp;liés.
",,,,,,,,,,,,,,,,N/A,N/A,"




Les médias parlent abondamment de l’intelligence artificielle et de tous les progrès qu’elle peut nous apporter. Il y a toutefois une face sombre: les biais et les discriminations qui y sont d’ores et déjà liés.


Fichier audio

















Par exemple, deux chercheuses, l’une de l’Université de Toronto et l’autre du MIT, ont testé trois technologies de reconnaissance faciale pour leur projet « Gender Shades ». Elles se sont aperçues que si vous êtes une femme à la peau sombre, vous aurez plus de difficultés à vous faire reconnaître.
De l’embauche aux décisions judiciaires, l’intelligence artificielle peut en effet être discriminatoire, tout dépendant de la couleur de votre peau, de votre genre et même de votre âge. Oui, il arrive aussi que la technologie fasse preuve d’âgisme.



Abonnez-vous à notre infolettre!
Pour ne rien rater de l'actualité scientifique et tout savoir sur nos efforts pour lutter contre les fausses nouvelles et la désinformation!



Courriel













Isabelle Burgun en parle cette semaine avec:
Karine Gentelet, professeure à l'Université du Québec en Outaouais en sciences sociales; titulaire de la Chaire Abeona-ENS-Obvia en intelligence artificielle et justice sociale 
Alexandra Parada, étudiante au doctorat en sciences juridiques à l’UQÀM.
On a longtemps pensé que les systèmes utilisant l’intelligence artificielle étaient plutôt objectifs. Ce n’est plus le cas, nous savons que de tels systèmes peuvent avoir les mêmes biais que ceux qui les ont imaginés. Quels sont les biais les plus courants? Quels sont les enjeux de discrimination les plus courants?
Au-delà du manque de femmes ou de personnes racisées parmi ceux qui programment, il y a la façon dont les données ont été collectées puis classées. Quels sont les problèmes de ce côté? Faudrait-il une formation éthique pour les informaticiens ? Une formation sur les enjeux sociaux?

« On ne peut pas séparer la technologie de l’Humain. La technologie est quelque chose créé par des humains, pas dans un vacuum social. » -Karine Gentelet

Quels sont les enjeux liés à l’âgisme? Est-ce que ces biais pourraient avoir un impact sur l’accès aux soins de certains groupes?
Comment encadrer tout cela, comment lutter contre ce type de discrimination? Comment limiter les risques?
 
+++++++++++++++++++++++++++++++++++
Je vote pour la science est diffusée le lundi à 13 h sur les cinq stations régionales de Radio VM. Elle est animée par Isabelle Burgun. Recherche pour cette émission: Fanny Rohrbacher. Vous pouvez également nous écouter, entre autres, sur CIBO (Senneterre), CFOU (Trois-Rivières), CIAX (Windsor) et CHOM (Toronto). 
Vous trouverez sur cette page des liens vers les émissions des saisons précédentes. Vous pouvez également nous suivre sur Twitter et sur Facebook.
 
Photo: Diversity UK























































Avec nos invitées: 
Entretien avec Karine Gentelet: Pour une gouvernance citoyenne des algorithmes, Le blogue Binaire, 20 janvier 2022.
Karine Gentelet, Comment l’intelligence artificielle reproduit et amplifie le racisme, La Conversation, 23 novembre 2021
Alexandra Parada, Vers la régulation de l’intelligence artificielle et la prise en compte des enjeux de discrimination, UQAM, 15 novembre 2021
Conférence: Discrimination et intelligence artificielle: peut-on en limiter les risques ?, UQAM, novembre 2021
Dans l’actualité:
Outils numériques en entreprise : une question d’éthique, L’actualité, 12 janvier 2022
Mieux recruter grâce à l’intelligence artificielle, TVA nouvelles, 16 aout 2021
Humaine, trop humaine l’intelligence artificielle? Le Devoir, 23 avril 2021
Intelligence artificielle et discrimination : tout savoir sur les biais de l’IA, DataScientest, 27 octobre 2020
Citizen Lab, A Human Rights Analysis of Automated Decision Making in Canada’s Immigration and Refugee System, 26 septembre 2018
Facial Recognition Is Accurate, if You’re a White Guy, New York Times, 9 février 2018
Artificial intelligence can discriminate on the basis of race and gender, and also age, The Conversation, janvier 2018
Vaincre les biais de l’intelligence artificielle, Québec Science, 2018
Ailleurs sur notre site: 
L'intelligence artificielle en santé: avancer avec prudence, 8 juillet 2021
Ce qu'il faut savoir du traçage électronique, 26 juin 2020
Travail: apprendre à collaborer avec l'intelligence artificielle, Je vote pour la science, 6 novembre 2019
Intelligence artificielle: combattre l'injustice des algorithmes, 5 juillet 2018





Vous aimerez aussi












Prédire les inondations grâce à l’IA?

Vendredi 22 mars 2024















Le Web a 35 ans: peut-il revenir à ce qu’il devait être?

Vendredi 15 mars 2024















L’IA pour remplacer les défunts?

Mardi 27 février 2024















Se rappeler que l’IA n’est pas humaine

Jeudi 22 février 2024















Travail : les ressources humaines dans la mire de l’IA

Jeudi 18 janvier 2024















L’IA peut aussi fabriquer des données trompeuses

Mardi 28 novembre 2023





",,,,,,,,
