URL link,Title,Date,Source,Source Link,description,keywords,og:description,twitter:description,@context,@type,author,copyrightHolder,copyrightYear,creator,dateCreated,dateModified,datePublished,headline,image,inLanguage,mainEntityOfPage,name,publisher,url,@id,address,contactPoint,foundingDate,logo,telephone,itemListElement,articleBody,speakable,sameAs,article:section,article:summary,article text,potentialAction,isAccessibleForFree,isPartOf,articleSection,publicAccess,@graph,wordcount,video,alternativeHeadline,countryOfOrigin,isFamilyFriendly
https://news.google.com/rss/articles/CBMihgFodHRwczovL3d3dy5lZGl0aW9ucy10aXNzb3QuZnIvYWN0dWFsaXRlL3NhbnRlLXNlY3VyaXRlL2xpbnRlbGxpZ2VuY2UtYXJ0aWZpY2llbGxlLWF1LXNlcnZpY2UtZGUtbGEtc2FudGUtZXQtZGUtbGEtc2VjdXJpdGUtYXUtdHJhdmFpbNIBAA?oc=5,L'intelligence artificielle au service de la santé et de la sécurité au travail ? - Editions Tissot,2022-12-13,Editions Tissot,https://www.editions-tissot.fr,"L’IA, la fameuse « Intelligence Artificielle », est entrée dans nos vies et suscite autant d’engouements que d’interrogations, sur le plan éthique par exemple. Qu’en est-il du côté de la santé au travail ? L’IA peut-elle représenter des opportunités ou des menaces pour la prévention des risques professionnels ? L’INRS (Institut National de Recherche et de Sécurité) s’est justement penchée sur la question : « Enjeux et perspectives à horizon 2035 ».",,"L’IA, la fameuse « Intelligence Artificielle », est entrée dans nos vies et suscite autant d’engouements que d’interrogations, sur le plan éthique par exemple. Qu’en est-il du côté de la santé au travail ? L’IA peut-elle représenter des opportunités ou des menaces pour la prévention des risques professionnels ? L’INRS (Institut National de Recherche et de Sécurité) s’est justement penchée sur la question : « Enjeux et perspectives à horizon 2035 ».","L’IA, la fameuse « Intelligence Artificielle », est entrée dans nos vies et suscite autant d’engouements que d’interrogations, sur le plan éthique par exemple. Qu’en est-il du côté de la santé au travail ? L’IA peut-elle représenter des opportunités ou des menaces pour la prévention des risques professionnels ? L’INRS (Institut National de Recherche et de Sécurité) s’est justement penchée sur la question : « Enjeux et perspectives à horizon 2035 ».",http://schema.org,WebSite,"{'@type': 'Person', 'name': 'Sabine Guichard', '@id': 'https://www.editions-tissot.fr/actualite/auteur/sabine-guichard', 'url': 'https://www.editions-tissot.fr/actualite/auteur/sabine-guichard'}",{'@id': 'https://www.editions-tissot.fr/#identity'},2022,{'@id': 'https://www.editions-tissot.fr/#identity'},2022-12-13T10:18:02+01:00,2022-12-16T16:00:53+01:00,2022-12-13T11:12:00+01:00,Guide du droit du travail,https://www.editions-tissot.fr/_next/image?url=/_next/static/media/default-hero.43374575.jpg&w=1200&q=75,fr-fr,"{'@type': 'WebPage', '@id': 'https://www.editions-tissot.fr/actualite/sante-securite/lintelligence-artificielle-au-service-de-la-sante-et-de-la-securite-au-travail'}",Guide du droit du travail,"{'@type': 'Organization', 'name': 'Éditions Tissot'}",https://www.editions-tissot.fr,https://www.editions-tissot.fr/#identity,"{'@type': 'PostalAddress', 'addressCountry': 'FR', 'addressLocality': 'Annecy', 'postalCode': '74940', 'streetAddress': '2 avenue du Pré Closet'}","[{'@type': 'ContactPoint', 'contactType': 'customer support', 'telephone': '+330450640808'}]",1976-01-01,"{'@type': 'ImageObject', 'height': '60', 'url': 'https://www.editions-tissot.fr/otis/media/newsletter/ad/_600x60_fit_center-center_82_none/editions-tissot-logo.png?mtime=1719829048', 'width': '60'}",04 50 64 08 08,"[{'@type': 'ListItem', 'item': {'@id': 'https://www.editions-tissot.fr', 'url': 'https://www.editions-tissot.fr', 'name': 'Accueil Éditions Tissot'}, 'position': 1}, {'@type': 'ListItem', 'item': {'@id': 'https://www.editions-tissot.fr/actualite', 'url': 'https://www.editions-tissot.fr/actualite', 'name': 'Actualités'}, 'position': 2}, {'@type': 'ListItem', 'item': {'@id': 'https://www.editions-tissot.fr/actualite/sante-securite', 'url': 'https://www.editions-tissot.fr/actualite/sante-securite', 'name': 'Santé & Sécurité'}, 'position': 3}, {'@type': 'ListItem', 'item': {'@id': 'https://www.editions-tissot.fr/actualite/sante-securite/thematique/risques-professionnels', 'url': 'https://www.editions-tissot.fr/actualite/sante-securite/thematique/risques-professionnels', 'name': 'Risques professionnels'}, 'position': 4}, {'@type': 'ListItem', 'item': {'@id': 'https://www.editions-tissot.fr/actualite/sante-securite/lintelligence-artificielle-au-service-de-la-sante-et-de-la-securite-au-travail', 'url': 'https://www.editions-tissot.fr/actualite/sante-securite/lintelligence-artificielle-au-service-de-la-sante-et-de-la-securite-au-travail', 'name': ""L'intelligence artificielle au service de la santé et de la sécurité au travail ? ""}, 'position': 5}]","IA : De quoi parle-t-on ?Loin des films de science-fiction et beaucoup plus proche de nos réalités au quotidien, qu’est-ce que l’IA ? Plusieurs définitions existent, dont l’une se veut globale : apprentissage automatique, raisonnement automatique, traitement de la langue naturelle, vision artificielle, représentation des connaissances.
Dans tous les cas, il s’agit de « capacités données à des machines (matériel et logiciel) de réaliser des tâches demandant de l’intelligence quand elles sont exercées par des humains. Des exemples :d’applications de ces capacités : véhicule autonome, agent conversationnel, reconnaissance d’images etc. ;des technologies au service de ces fonctions : représentation des connaissances, raisonnement, apprentissage, planification etc.) ». Et en santé sécurité au travail (SST) ? Pour l’INRS, l’objectif était ici d’explorer les usages des systèmes d’IA spécifiquement dédiés à la prévention des risques professionnels à un horizon d’une douzaine d’années.IA en santé sécurité au travail : les messages clésL’INRS a publié des messages clés, scénarii et cas d’usages en SST. Zoom sur certains d’entre eux.Un marché en plein développementLa sécurisation des environnements de travail est un des domaines d’usages professionnels des innovations possibles. Plus l’automatisation sera intelligente, plus la machine (ou l’algorithme) remplira les tâches effectuées jusqu’alors par des travailleurs. Et cette automatisation pourrait permettre de soustraire certains travailleurs à des risques.Des promesses en santé et sécurité au travailL’IA ouvre par exemple des possibilités de supervision d’un environnement de travail, un chantier ou un site industriel.Les limites et points de vigilance sur les usages de l’IA en SSTLa logique de rentabilisation des investissements dans ces technologies, parfois coûteuses, peut amener à positionner ces systèmes au centre de l’organisation du travail, au risque de placer le travail humain au second plan. La facilité apparente d’usage et d’implémentation de ces solutions « intelligentes » risque d’inciter les acteurs à ne prendre en considération que les risques identifiés par le système d’IA, sans évaluer régulièrement les risques plus organisationnels. Les accidents du travail surviennent fréquemment lors de situations atypiques par rapport au déroulement classique d’un processus de production : situations dégradées, pannes, etc. Ces situations imprévues sont une limite possible à l&#x27;entraînement des systèmes d’IA.Des pistes d’actionsLa formation des acteurs de la prévention, notamment sur le plan éthique, constitue un enjeu majeur. Et bien évidemment, une réflexion devra être menée sur la question des données utilisées dans des dispositifs d’IA touchant à la SST !
L’INRS a également envisagé 4 scenarii en prospective et des cas d’usage.
Au final, le message est clair : « Sans remettre en cause a priori l’utilisation de ces technologies, ces conséquences possibles imposent une vigilance et une réflexion particulières de la part des partenaires sociaux et plus généralement des organismes chargés de la prévention des risques professionnels
». Le champ des possibles est immense avec l’IA dans le champ de la santé au travail, en respectant ce principe de vigilance.L’intelligence artificielle au service de la santé et de la sécurité au travail (synthèse) - INRSTélécharger gratuitementINRS, l’intelligence artificielle au service de la santé et de la sécurité au travail, enjeux et perspectives à l’horizon 2035, 18 novembre 2022","{'@type': 'SpeakableSpecification', 'cssSelector': ['#page-content']}",['https://www.linkedin.com/company/editions-tissot/'],N/A,N/A,N/A,,,,,,,,,,,
https://news.google.com/rss/articles/CBMihwFodHRwczovL3d3dy5sZXNlY2hvcy5mci90ZWNoLW1lZGlhcy9pbnRlbGxpZ2VuY2UtYXJ0aWZpY2llbGxlL2dpdGh1Yi1tZXQtbGludGVsbGlnZW5jZS1hcnRpZmljaWVsbGUtYXUtc2VydmljZS1kZXMtZGV2ZWxvcHBldXJzLTE4ODg0NDjSAQA?oc=5,GitHub met l'intelligence artificielle au service des développeurs - Les Échos,2022-12-12,Les Échos,https://www.lesechos.fr,"La plateforme a lancé cette année Copilot, un outil qui utilise l'intelligence artificielle pour suggérer des lignes de code aux développeurs. Ces derniers peuvent ainsi se consacrer aux tâches les plus difficiles et automatiser le reste. Mais plusieurs développeurs ont porté plainte contre Copilot, l'accusant d'avoir volé leur code.",N/A,"La plateforme a lancé cette année Copilot, un outil qui utilise l'intelligence artificielle pour suggérer des lignes de code aux développeurs. Ces derniers peuvent ainsi se consacrer aux tâches les plus difficiles et automatiser le reste. Mais plusieurs développeurs ont porté plainte contre Copilot, l'accusant d'avoir volé leur code.","La plateforme a lancé cette année Copilot, un outil qui utilise l'intelligence artificielle pour suggérer des lignes de code aux développeurs. Ces derniers peuvent ainsi se consacrer aux tâches les plus difficiles et automatiser le reste. Mais plusieurs développeurs ont porté plainte contre Copilot, l'accusant d'avoir volé leur code.",http://schema.org,BreadcrumbList,"[{'@type': 'Person', 'name': 'Hortense GOULARD', 'jobTitle': 'Correspondante à San Francisco, Etats-Unis', 'sameAs': ['https://www.lesechos.fr/@hortense-goulard', 'https://twitter.com/HortenseGoulard', 'https://www.linkedin.com/in/hortense-goulard-3325286a']}]",,,,,2022-12-12T19:31:27+01:00,2022-12-12T18:08:19+01:00,GitHub met l'intelligence artificielle au service des développeurs,"{'@type': 'ImageObject', 'url': 'https://media.lesechos.com/api/v1/images/view/63976085697ee157561c3bfe/1280x720/0703001379267-web-tete.jpg', 'height': '720', 'width': '1280'}",,"{'@type': 'WebPage', '@id': 'https://www.lesechos.fr/tech-medias/intelligence-artificielle/github-met-lintelligence-artificielle-au-service-des-developpeurs-1888448'}",Les Echos,"{'@type': 'Organization', 'name': 'Les Echos', 'logo': {'@type': 'ImageObject', 'url': 'https://static.lesechos.com/0fbe31cfc3d7f1cdecc51f122d4c11b4.webp', 'width': 200, 'height': 38}}",https://www.lesechos.fr,,,,,https://static.lesechos.com/0fbe31cfc3d7f1cdecc51f122d4c11b4.webp,,"[{'@type': 'ListItem', 'position': 1, 'item': {'@id': 'https://www.lesechos.fr/', 'name': 'Les Echos'}}, {'@type': 'ListItem', 'position': 2, 'item': {'@id': 'https://www.lesechos.fr/tech-medias', 'name': 'Tech - Médias'}}, {'@type': 'ListItem', 'position': 3, 'item': {'@id': 'https://www.lesechos.fr/tech-medias/intelligence-artificielle', 'name': 'Intelligence artificielle'}}]",,,"['https://www.facebook.com/lesechos/', 'https://x.com/LesEchos?lang=fr', 'https://www.linkedin.com/company/les-echos']",Tech - Médias,N/A,"GitHub met l'intelligence artificielle au service des développeursLa plateforme a lancé cette année Copilot, un outil qui utilise l'intelligence artificielle pour suggérer des lignes de code aux développeurs. Ces derniers peuvent ainsi se consacrer aux tâches les plus difficiles et automatiser le reste. Mais plusieurs développeurs ont porté plainte contre Copilot, l'accusant d'avoir volé leur code.Ajouter à mes articlesCommenterPartagerPartagerCollèges, Lycées, écolesMicrosoftGitHub peut se vanter d'attirer toujours plus de développeurs sur sa plateforme. (Monstar Studio/Shutterstock)Par Hortense GOULARDPublié le 12 déc. 2022 à 18:08Mis à jour le 12 déc. 2022 à 19:31Plusieurs centaines de milliers de développeurs se servent déjà de l'intelligence artificielle pour accélérer leur travail au quotidien. Ces derniers mois, GitHub, la plateforme des développeurs rachetée par Microsoft en 2018, a ainsi lancé Copilot en l'ouvrant progressivement à un nombre croissant de développeurs.Cet outil utilise l'intelligence artificielle pour suggérer des lignes de code aux développeurs. Il a été développé en partenariat avec OpenAI, une entreprise étroitement liée à Microsoft, qui y a investi 1 milliard de dollars en 2019. Le groupe dirigé par Satya Nadella envisagerait même d'investir encore davantage dans le laboratoire californien, selon le « Wall Street Journal ».« Je m'en sers comme d'un deuxième cerveau », affirme Siva Kumar, un développeur qui participait à GitHub Universe, la conférence annuelle de GitHub à San Francisco. Il se dit particulièrement enthousiaste à l'idée de tester Copilot for Business, lancé début décembre. Le programme coûtera 19 dollars par mois et par utilisateur aux entreprises.« Chez GitHub, nous croyons que Copilot va jouer un rôle à chaque étape du cycle de vie des développeurs », affirme aux « Echos » le PDG de GitHub, Thomas Dohmke. « Cela va de la création de code à sa révision, jusqu'à l'optimisation du déploiement sur le cloud. L'intelligence artificielle pourra aider à toutes les étapes du processus. »Publicité94 millions de développeursGitHub est la première plateforme en open source, utilisée par 94 millions de développeurs. Un chiffre multiplié par deux en trois ans. Selon l'entreprise, 90 des 100 plus grandes entreprises américaines, répertoriées par « Fortune », utilisent GitHub.Lire aussi :Journalistes, développeurs, enseignants… Ces professions chamboulées par l'intelligence artificielleDECRYPTAGE - ChatGPT : plongée dans les entrailles du chatbot qui bouleverse la techLa filiale de Microsoft estime que les développeurs utilisent jusqu'à 40 % des lignes de code proposées par Copilot. Elle espère que cette proportion montera à 80 % dans les cinq prochaines années. Pour GitHub, la priorité est de choyer les développeurs en mettant à leur disposition des outils de pointe.Pour l'instant, la satisfaction des développeurs semble au rendez-vous. Dans un sondage réalisé par GitHub, 88 % d'entre eux se disent plus productifs avec l'aide de Copilot. Les trois quarts estiment pouvoir se concentrer sur des tâches plus satisfaisantes.Recours collectifMais le recours à l'intelligence artificielle n'est pas sans risque pour GitHub. Le mois dernier, des développeurs ont porté plainte contre la plateforme, l'accusant de « piratage de logiciels à une échelle sans précédent ». Ils reprochent à Copilot de récupérer des bribes de codes qui ont été rédigés par certains d'entre eux, et de les présenter aux utilisateurs de GitHub sans préciser d'où provient ce code.Lire aussi :DECRYPTAGE - ChatGPT marque un tournant pour l'intelligence artificielleLensa AI, l'application de retouche d'image qui fait fureur« Nous posons la question de la légalité de GitHub Copilot », a déclaré à The Verge Matthew Butterick, un développeur et avocat à l'origine de la plainte. « C'est la première étape d'un long processus. A notre connaissance, c'est la première plainte collective déposée aux Etats-Unis qui met en cause des systèmes d'intelligence artificielle. Ce ne sera pas la dernière. »En conférence de presse, Thomas Dohmke a répondu que GitHub « travaillait avec des partenaires dans la communauté open source » à rendre son outil plus « responsable ». L'entreprise pourrait ainsi indiquer plus clairement quelles sont les sources du code fourni par Copilot, dans le cas où ce dernier correspond à des contributions existant sur GitHub.L'intelligence artificielle risque par ailleurs de suggérer aux développeurs du code contenant des failles de sécurité. Comme pour la production de textes, une relecture attentive des développeurs reste donc indispensable.Hortense Goulard (Correspondante à San Francisco)Nouveau : découvrez nos offres Premium !Vos responsabilités exigent une attention fine aux événements et rapports de force qui régissent notre monde. Vous avez besoin d’anticiper les grandes tendances pour reconnaitre, au bon moment, les opportunités à saisir et les risques à prévenir.C’est précisément la promesse de nos offres PREMIUM : vous fournir des analyses exclusives et des outils de veille sectorielle pour prendre des décisions éclairées, identifier les signaux faibles et appuyer vos partis pris. N'attendez plus, les décisions les plus déterminantes pour vos succès 2024 se prennent maintenant !Je découvre les offresDécouvrez nos offres et profitez du 1er mois offert !Je m'abonneNos VidéosParis sportifs en ligne : qui sont les vrais gagnants ?Il y a 14 ans, la Française des Jeux (FDJ) perdait son monopole sur les paris sportifs en ligne. Aujourd’hui, 15 opérateurs se partagent ce marché toujours en croissance. Mais est-il si rentable que cela pour eux ? On vous explique.Portugal, Espagne, Grèce : la revanche des « pays du Club Med »Les jeunes ont-ils vraiment un problème avec le travail ?SNCF : la concurrence peut-elle faire baisser les prix des billets de train ?PublicitéLes plus lusPour l'antitrust français, l'IA générative pose déjà des risques concurrentiels DeepL, la star allemande de l'IA qui affronte Google et ChatGPT DécryptageAdobe en zone de turbulences PublicitéÀ la UneDécryptageLégislatives 2024 : ces onze circonscriptions sans front républicainSix questions sur le second tour de dimancheDirectLégislatives : « pas question » de gouverner avec LFI, lance Macron en Conseil des ministresPublicité","{'@type': 'SearchAction', 'target': 'https://www.lesechos.fr/recherche?q={query}', 'query-input': 'required name=query'}",True,,,,,,,,,
https://news.google.com/rss/articles/CBMigwFodHRwczovL3d3dy5sZWRldm9pci5jb20vY3VsdHVyZS83NzQ4NTgvaW50ZWxsaWdlbmNlLWFydGlmaWNpZWxsZS1pbnRlbGxpZ2VuY2UtYXJ0aWZpY2llbGxlLWxlcy1hcnRpc3Rlcy1jcmFpZ25lbnQtZC1ldHJlLXJlbXBsYWNlc9IBAA?oc=5,Intelligence artificielle: les artistes craignent d’être remplacés - Le Devoir,2022-12-16,Le Devoir,https://www.ledevoir.com,Les prouesses de l’IA suscitent maintes interrogations quant à l’avenir de l’art numérique et des droits d’auteur.,N/A,Les prouesses de l’IA suscitent maintes interrogations quant à l’avenir de l’art numérique et des droits d’auteur.,Les prouesses de l’IA suscitent maintes interrogations quant à l’avenir de l’art numérique et des droits d’auteur.,http://schema.org,BreadcrumbList,"[{'@type': 'Person', 'name': 'Étienne Paré', 'url': 'https://www.ledevoir.com/auteur/etienne-pare/'}]",,,,,,2022-12-16T12:48:30-05:00,Les artistes craignent d’être remplacés par l’IA,['https://media1.ledevoir.com/images_galerie/nwd_1438905_1104719/image.jpg?ts=1671212910'],,"{'@type': 'WebPage', '@id': 'https://www.ledevoir.com/culture/774858/intelligence-artificielle-intelligence-artificielle-les-artistes-craignent-d-etre-remplaces'}",Le Devoir,"{'@type': 'Organization', 'name': 'Le Devoir', 'logo': {'@type': 'ImageObject', 'url': 'https://www.ledevoir.com/images/ul/logos/logo_devoir_amp.png'}}",https://www.ledevoir.com,,,,,https://www.ledevoir.com/images/ul/logos/2018/logo_ledevoir.png,,"[{'@type': 'ListItem', 'position': 1, 'item': {'@id': '/', 'name': 'Accueil'}}, {'@type': 'ListItem', 'position': 2, 'item': {'@id': '/culture', 'name': 'Culture'}}]",,,"['https://www.facebook.com/ledevoir/', 'https://www.instagram.com/ledevoir/', 'https://www.linkedin.com/company/le-devoir', 'https://plus.google.com/+ledevoir']",N/A,N/A,"


L’Association des libraires du Québec n’est pas en déficit critique

","{'@type': 'SearchAction', 'target': 'https://www.ledevoir.com/recherche?expression={search_term_string}', 'query-input': 'required name=search_term_string'}",False,"{'@type': ['CreativeWork', 'Product'], 'name': 'Le Devoir', 'productID': 'ledevoir.com:showcase'}",,,,,,,,
https://news.google.com/rss/articles/CBMibmh0dHBzOi8vd3d3LmxlamRjLmZyL3ZhcmVubmVzLXZhdXplbGxlcy01ODY0MC9hY3R1YWxpdGVzL3JldHJvdXZlci11bi1lbXBsb2ktcGFyLWxlLWJpYWlzLWR1LWRpZ2l0YWxfMTQyMzM1ODQv0gEA?oc=5,Retrouver un emploi par le biais du digital - Varennes-Vauzelles (58640) - Le Journal du Centre,2022-12-15,Le Journal du Centre,https://www.lejdc.fr,"
	
		
			Varennes-Vauzelles.
			Des travailleurs privés d’emploi découvrent une entreprise pionnière de l’intelligence artificielle.
		
		La société Davi, installée récemment à Varennes-Vauzelles, milite pour humaniser la relation avec le monde digital afin que la machine s’adapte...",[],Retrouver un emploi par le biais du digital,Retrouver un emploi par le biais du digital,https://schema.org,NewsArticle,"{'@type': 'Organization', 'name': 'Le Journal du Centre'}",,,,,2022-12-15T05:05:00.000Z,2022-12-15T05:00:00.000Z,Retrouver un emploi par le biais du digital,"{'@type': 'ImageObject', 'url': 'https://img.lamontagne.fr/qAUoHFIooTPQJfbD-fwIVZ0pNceWbBKC1sFwXbf1-N8/fit/657/438/sm/0/bG9jYWw6Ly8vMDAvMDAvMDYvMzYvMDgvMjAwMDAwNjM2MDgzMw.jpg', 'width': '657', 'height': '438'}",,"{'@type': 'WebPage', '@id': 'https://www.lejdc.fr/varennes-vauzelles-58640/actualites/retrouver-un-emploi-par-le-biais-du-digital_14233584/'}",,"{'@type': 'Organization', 'name': 'Le Journal du Centre', 'logo': {'@type': 'ImageObject', 'url': 'https://www.lejdc.fr/static/bloc/ripolinage/logos/logo-JC.svg', 'width': '226', 'height': '26'}}",,,,,,,,,"Varennes-Vauzelles. Des travailleurs privés d’emploi découvrent une entreprise pionnière de l’intelligence artificielle. La société Davi, installée récemment à Varennes-Vauzelles, milite pour humaniser la relation avec le monde digital afin que la machine s’adapte à l’utilisateur et lui facilite la vie, et non l’inverse. Ce sont des éditeurs de logiciels, pionniers dans le domaine de l’Intelligence artificielle émotionnelle. Récemment, Davi a accepté d’ouvrir ses portes à un groupe en formation encadré par Hugues Dubois, d’Onlineformapro, qui précise : « Le groupe, composé d’une vingtaine d’apprenants, pour la plupart en reconversion, provient du site de formation Onlineformapro de Decize et Nevers, en collaboration avec Pôle emploi. La formation “Maîtrise des technologies de l’information” permet de familiariser les personnes avec l’environnement numérique et digital dans le but de retrouver un emploi ». Cet événement a été réalisé en partenariat avec le Campus des métiers et des qualifications de l’automobile et des mobilités du futur de Montbéliard (Doubs). ",,,Vie locale,N/A,N/A,,True,,[],True,,,,,,
