URL link,Title,Date,Source,Source Link,description,keywords,og:description,twitter:description,article:section,article:summary,article text,@context,@type,itemListElement,headline,publisher,mainEntityOfPage,image,datePublished,dateModified,articleSection,author,articleBody,copyrightYear,@graph,Image,inLanguage,url,isAccessibleForFree,name,hasPart,dateCreated,sameAs,potentialAction,breadcrumb
https://news.google.com/rss/articles/CBMiPGh0dHBzOi8vd3d3LmxlYmlnZGF0YS5mci9mb3JtYXRpb24taWEtcG91ci1sZXMtY29sbGVjdGl2aXRlc9IBAA?oc=5,Les enjeux de la formation IA pour les collectivités territoriales - Lebigdata.fr,2023-08-21,Lebigdata.fr,https://www.lebigdata.fr,La formation IA pour les collectivités est désormais un impératif. Il s'agit d'une étape essentielle à leur transformation numérique.,N/A,La formation IA pour les collectivités devient nécessaire au vu de l’impact de la technologie sur le,N/A,Dossiers,N/A,"









 

Les enjeux de la formation IA pour les collectivités territoriales

Magloire B. 
21 août 2023
6 minutes de lecture

Dossiers



La formation IA pour les collectivités devient nécessaire au vu de l'impact de la technologie sur le travail. La mise en œuvre de la technologie ne s'improvise pas.
Le monde vit désormais dans une économie de la donnée. La puissance de calcul des machines est devenue accessible grâce au déploiement de nouveaux paramètres de fonctionnement et d'usage. La formation IA pour les collectivités permet ainsi une adaptation aux transformations de l'intelligence artificielle sur le travail.
Le monde de l'économie de la donnée
Le sujet de l'intelligence artificielle continue de susciter de vifs débats, tellement celui-ci est vaste, passionnant et plein d'espoirs. La technologie comporte également sa part d'ombre qui alimente certaines peurs. D'où la nécessité d'une formation IA pour dissiper celles-ci.
Au regard des innombrables possibilités et domaines d'application qu'elle porte, celle-ci mérite l'approfondissement des recherches dont elle fait l'objet. L'IA nourrit également beaucoup de fantaisie. Cela vaut la peine de bien la définir.
Par ailleurs, l'émergence de l'IA n'est pas un hasard. Elle est due à plusieurs facteurs, à commencer par la valorisation de la donnée et la puissance de calcul disponible.
La course entre les différents acteurs du numérique est lancée. Sans surprise, les géants américains de l'high-tech sont en tête. Pour n'en nommer que quelques-uns, Google et Amazon ont investi des milliards de dollars sur la donnée au fil des ans. Il existe aujourd'hui aux États-Unis des centaines de start-ups spécialisées dans ce domaine.
De nombreux pays, dont la France, tentent désormais de rattraper leur retard. Cela en accélérant le développement et l'investissement sur leurs territoires. Leur objectif est de maîtriser la donnée pour ensuite profiter de l'intelligence artificielle.









Comprendre ce qu'est réellement l'IA
Il est difficile de parvenir à une définition précise de ce qu'est l'intelligence artificielle. Néanmoins, il est possible de voir la technologie comme un ensemble des moyens pour que des ordinateurs ou des machines exécutent des tâches. Notons que la réalisation de ces actions nécessite normalement l'intelligence humaine.
D'une certaine manière, l'intelligence artificielle repose sur un vaste corpus informatique, mathématique, scientifique et biologique.
Les programmes informatiques issus de ces moyens possèdent les facultés pour exécuter des tâches généralement associées à la créativité, l'expertise pointue et l'intuition. Que ce soit la conduite de véhicule, les traitements de textes ou l'analyse des radiographies, les algorithmes effectuent désormais des actions censées être réservées à l'Homme.
Rappelons que l'intérêt de l'intégration de la technologie dans le travail n'est pas de remplacer l'Homme. Il s'agit plutôt de gagner en efficacité et en vitesse pour améliorer la productivité. Dans cette optique, nombreuses sont les tâches que l'IA fait mieux que l'Homme.
La base de l'efficacité de l'intelligence artificielle
Le concept d'apprentissage automatique est au cœur du fonctionnement de l'intelligence artificielle. C'est en partie la capacité d'un algorithme à apprendre la meilleure façon d'atteindre un ou plusieurs objectifs. Soulignons que lorsqu'une machine apprend, elle le fait grâce aux données ou à l'expérience.
Par exemple, le programme AlphaGo de DeepMind a appris le jeu de Go en utilisant les règles du jeu et en analysant les parties des joueurs. En outre, sa version AlphaGo Zero a maîtrisé le jeu à partir des règles du jeu et en jouant contre elle-même. En termes de performances, la version Zero est meilleure que le programme AlphaGo originel.
Ainsi, sur la base d'algorithmes entraînés, l'IA peut reconnaître des objets ou des personnes. La machine peut également générer du texte à partir de simples paragraphes ou de transcrire une conversation orale. D'autre part, l'intelligence est capable d'intervenir dans un processus de décision. Pour cela, elle s'appuient sur des données qu'elle évalue afin d'en déduire une action.









Quelles applications concrètes de l'IA pour les collectivités ?
Malgré des débuts timides, les cas d'applications de l'IA émergent depuis quelques mois. En revanche, il faut souligner que les attentes ne sont pas les mêmes dans le public et dans le privé. Dans le secteur privé, la recherche d'efficacité et d'optimisation dans les processus métiers est beaucoup plus accentuée.
L'implémentation de l'intelligence artificielle pour les collectivités territoriales impacte différents domaines de compétences. Néanmoins, les principaux sont la mobilité, la prévention des risques et l'environnement. Par ailleurs, les possibilités d'application sont multiples grâce entre autres à des moyens comme le tracking d'activité sur la voie publique ou la reconnaissance d'images.
D'autres domaines pourraient également bénéficier de l'IA. Ce sont notamment la relation civique, la formation et l'éducation. Il y a ensuite la santé, la planification et l'urbanisme.
La plupart du temps, les solutions développées à l'aide de l'IA se positionnent comme des outils d'aide à la décision. Ces derniers se basent sur une collecte de données régulière, voire en temps réel si nécessaire. En tant que tel, ces outils améliorent les services rendus aux citoyens et font économiser de l'argent aux collectivités locales.



Ce qui bloque les collectivités à s'approprier l'intelligence artificielle
Sans surprise, les collectivités territoriales sont encore confrontées à de nombreux obstacles quant à l'utilisation de l'IA.
Le blocage technique
L'implémentation de l'IA peut nécessiter des ressources informatiques avancées. Cela implique la mise en place de systèmes d'information et des données structurées. Un travail interne – pris en charge par la Direction des systèmes d'information (DSI) ou accompagné par une plateforme de mutualisation – doit se faire avant tout.
Des compétences limitées
Parce que l'IA est encore une technologie émergente, l'impératif est de sensibiliser les élus et leurs équipes. Ce travail a pour objectif de limiter les risques de rejet en interne. D'autre part, les collectivités peuvent envisager des recrutements spécialisés dans ce sens.
Investissements dans des solutions adaptées
Désormais, un grand nombre d'acteurs privés proposent des solutions “sur étagère”, c'est-à-dire des moyens dont le déploiement s'effectue facilement et rapidement. La plateforme Delibia est un exemple de ses solutions sur étagère. Notons également que les solutions personnalisées nécessitent parfois des investissements significatifs.
La transition vers l'intelligence artificielle pousse à aller au-delà des investissements informatiques traditionnels. Les collectivités doivent ainsi miser sur les écosystèmes d'innovation.









Un encadrement approprié
Les applications de l'intelligence artificielle nécessitent une vision globale en interne. Par ailleurs, l'administration territoriale doit changer son approche des métiers traditionnels. Les start-ups spécialistes de la technologie peuvent offrir un accompagnement adéquat pour le déploiement de l'IA dans les collectivités.
Une nouvelle gestion des compétences pour les collectivités
La transformation numérique des territoires n'est pas uniquement à la charge des collectivités. Les protagonistes du marché de l'intelligence artificielle ont également leurs responsabilités. Leur principale mission consiste à orienter les administrations publiques vers une nouvelle gestion. Cela comporte trois grands axes.
Anticipation des impacts de l'intelligence artificielle sur le travail
La transformation numérique requiert en premier lieu  l'identification des tâches pouvant être automatisées grâce à l'IA. De ce fait, il faut un chantier prospectif pour déterminer ces fonctions.
Le lancement de cette prospection s'effectue selon les critères suivants : la complexité de la tâche, les potentielles erreurs tolérables de la technologie et le niveau d'interdépendance des différentes fonctions. Les collectivités ont ensuite besoin de soutien pour déterminer les futurs besoins en compétences. Cela est indispensable pour évaluer les candidats.
Assurer la formation IA pour les collectivités
Il faut mettre en œuvre un écosystème favorable à l'émergence de talents pour développer l'intelligence artificielle. Les stratégies doivent également encourager le développement des compétences en informatique. Sans cela, le déploiement des structures basées sur de l'IA ne serait possible.
Dans le même temps, la formation doit conscientiser les acteurs de l'administration publique sur les enjeux de l'application des outils IA. Ceux-ci sont principalement d'ordre technique, juridique, économique ou éthique.
Protection des métiers à risque face à l'emploi de l'IA
Le rapidité du déploiement de l'intelligence artificielle rend difficile l'évaluation des impacts de la technologie sur le travail. De ce fait, la protection des individus, dont les emplois pourraient disparaître, doit devenir un préalable. La formation des agents par blocs de compétences est une piste intéressante.
Comment se passe la formation IA pour les collectivités ?
La formation IA permet au secteur privé de se doter des moyens pour améliorer ses outils de travail. Nous avons récemment consacré un dossier sur la portée de la maîtrise des GPT pour les entreprises et les particuliers.
Cela peut également se passer de la même manière pour les collectivités territoriales. En revanche, le but ne sera pas la recherche du profit financier. Mais plutôt la réalisation des objectifs suivants :

L'amélioration de la qualité des services publics
Le renforcement de la sécurité informatique
Le déploiement de la vidéoprotection urbaine
L'amélioration de l'attractivité du territoire
La transition écologique et la transformation climatique










La formation IA à destination des collectivités ne se résume donc pas à l'apprentissage des plateformes populaires comme ChatGPT ou Midjourney. Elle se doit de proposer un contenu plus fourni ou un programme mieux élaboré. En tant que formation professionnelle digne de ce nom, l'initiation doit également inclure des ateliers. Découvrez ici le programme typique pour ce type de formation.
D'autre part, les collectivités locales peuvent opter pour une solution sur étagère pour leur transformation numérique. Dans ce cas de figure, le fournisseur peut offrir une formation à l'administration publique cliente. Cela est notamment le cas de la plateforme Delibia avec son service d'accompagnement.
Néanmoins, cette alternative comporte une limite. En effet, l'accompagnement ou la formation incluse dans les prestations du fournisseur ne concerne que sa solution. Cela est notamment le cas de Delibia.







 Restez à la pointe de l'information avec LEBIGDATA.FR !Abonnez-vous à notre chaîne YouTube et rejoignez-nous sur Google Actualités pour garder une longueur d'avance. 






Partager l'article : 



Facebook





Twitter





LinkedIn





Notre blog est alimenté par les lecteurs. Lorsque vous achetez via des liens sur notre site, nous pouvons percevoir une commission d’affiliation.

2023-08-21
Magloire B.


",https://schema.org,,,,,,,,,,,,,"[{'@type': 'NewsArticle', '@id': 'https://www.lebigdata.fr/formation-ia-pour-les-collectivites#article', 'isPartOf': {'@id': 'https://www.lebigdata.fr/formation-ia-pour-les-collectivites'}, 'author': {'name': 'Magloire B.', '@id': 'https://www.lebigdata.fr/#/schema/person/fa82c5c5eb8945012001294e567e7135'}, 'headline': 'Les enjeux de la formation IA pour les collectivités territoriales', 'datePublished': '2023-08-21T12:00:00+00:00', 'dateModified': '2023-08-22T19:41:53+00:00', 'mainEntityOfPage': {'@id': 'https://www.lebigdata.fr/formation-ia-pour-les-collectivites'}, 'wordCount': 1845, 'commentCount': 0, 'publisher': {'@id': 'https://www.lebigdata.fr/#organization'}, 'image': {'@id': 'https://www.lebigdata.fr/formation-ia-pour-les-collectivites#primaryimage'}, 'thumbnailUrl': 'https://www.lebigdata.fr/wp-content/uploads/2023/08/publithings_seo_A_city_hall_office_with_human_agents_and_robots_cda3b0ac-7b9e-4b2f-8d73-dc27d457243b.png', 'articleSection': ['Dossiers'], 'inLanguage': 'fr-FR', 'potentialAction': [{'@type': 'CommentAction', 'name': 'Comment', 'target': ['https://www.lebigdata.fr/formation-ia-pour-les-collectivites#respond']}], 'copyrightYear': '2023', 'copyrightHolder': {'@id': 'https://www.lebigdata.fr/#organization'}}, {'@type': 'WebPage', '@id': 'https://www.lebigdata.fr/formation-ia-pour-les-collectivites', 'url': 'https://www.lebigdata.fr/formation-ia-pour-les-collectivites', 'name': 'Les enjeux de la formation IA pour les collectivités territoriales', 'isPartOf': {'@id': 'https://www.lebigdata.fr/#website'}, 'primaryImageOfPage': {'@id': 'https://www.lebigdata.fr/formation-ia-pour-les-collectivites#primaryimage'}, 'image': {'@id': 'https://www.lebigdata.fr/formation-ia-pour-les-collectivites#primaryimage'}, 'thumbnailUrl': 'https://www.lebigdata.fr/wp-content/uploads/2023/08/publithings_seo_A_city_hall_office_with_human_agents_and_robots_cda3b0ac-7b9e-4b2f-8d73-dc27d457243b.png', 'datePublished': '2023-08-21T12:00:00+00:00', 'dateModified': '2023-08-22T19:41:53+00:00', 'description': ""La formation IA pour les collectivités est désormais un impératif. Il s'agit d'une étape essentielle à leur transformation numérique."", 'breadcrumb': {'@id': 'https://www.lebigdata.fr/formation-ia-pour-les-collectivites#breadcrumb'}, 'inLanguage': 'fr-FR', 'potentialAction': [{'@type': 'ReadAction', 'target': ['https://www.lebigdata.fr/formation-ia-pour-les-collectivites']}]}, {'@type': 'ImageObject', 'inLanguage': 'fr-FR', '@id': 'https://www.lebigdata.fr/formation-ia-pour-les-collectivites#primaryimage', 'url': 'https://www.lebigdata.fr/wp-content/uploads/2023/08/publithings_seo_A_city_hall_office_with_human_agents_and_robots_cda3b0ac-7b9e-4b2f-8d73-dc27d457243b.png', 'contentUrl': 'https://www.lebigdata.fr/wp-content/uploads/2023/08/publithings_seo_A_city_hall_office_with_human_agents_and_robots_cda3b0ac-7b9e-4b2f-8d73-dc27d457243b.png', 'width': 1344, 'height': 896}, {'@type': 'BreadcrumbList', '@id': 'https://www.lebigdata.fr/formation-ia-pour-les-collectivites#breadcrumb', 'itemListElement': [{'@type': 'ListItem', 'position': 1, 'name': 'Accueil', 'item': 'https://www.lebigdata.fr/'}, {'@type': 'ListItem', 'position': 2, 'name': 'Dossiers', 'item': 'https://www.lebigdata.fr/dossiers'}, {'@type': 'ListItem', 'position': 3, 'name': 'Les enjeux de la formation IA pour les collectivités territoriales'}]}, {'@type': 'WebSite', '@id': 'https://www.lebigdata.fr/#website', 'url': 'https://www.lebigdata.fr/', 'name': 'LEBIGDATA.FR', 'description': 'I.A, Cloud &amp; Cybersécurité', 'publisher': {'@id': 'https://www.lebigdata.fr/#organization'}, 'potentialAction': [{'@type': 'SearchAction', 'target': {'@type': 'EntryPoint', 'urlTemplate': 'https://www.lebigdata.fr/?s={search_term_string}'}, 'query-input': 'required name=search_term_string'}], 'inLanguage': 'fr-FR'}, {'@type': 'Organization', '@id': 'https://www.lebigdata.fr/#organization', 'name': 'Lebigdata.fr', 'url': 'https://www.lebigdata.fr/', 'logo': {'@type': 'ImageObject', 'inLanguage': 'fr-FR', '@id': 'https://www.lebigdata.fr/#/schema/logo/image/', 'url': 'https://www.lebigdata.fr/wp-content/uploads/2021/09/logo_lbd_noir.png', 'contentUrl': 'https://www.lebigdata.fr/wp-content/uploads/2021/09/logo_lbd_noir.png', 'width': 401, 'height': 109, 'caption': 'Lebigdata.fr'}, 'image': {'@id': 'https://www.lebigdata.fr/#/schema/logo/image/'}, 'sameAs': ['https://www.facebook.com/lebigdata/', 'https://x.com/lebigdata_fr', 'https://www.linkedin.com/company/10888265']}, {'@type': 'Person', '@id': 'https://www.lebigdata.fr/#/schema/person/fa82c5c5eb8945012001294e567e7135', 'name': 'Magloire B.', 'image': {'@type': 'ImageObject', 'inLanguage': 'fr-FR', '@id': 'https://www.lebigdata.fr/#/schema/person/image/', 'url': 'https://secure.gravatar.com/avatar/02614fc563485a682c179caee64b635c?s=96&d=mm&r=g', 'contentUrl': 'https://secure.gravatar.com/avatar/02614fc563485a682c179caee64b635c?s=96&d=mm&r=g', 'caption': 'Magloire B.'}, 'description': ""En tant que rédacteur spécialisé dans le domaine du big data, je m'engage pleinement à explorer les intrications complexes entre la technologie et les données sur lebigdata.fr, tout en apportant également ma contribution éditoriale à technplay.com, objetconnecte.com et realite-virtuelle.com. Avec une passion indéfectible pour l'analyse des données massives, mon travail consiste à décrypter les tendances émergentes et les innovations disruptives qui façonnent notre ère numérique. Sur lebigdata.fr, je m'attelle à fournir des analyses approfondies et accessibles, éclairant nos lecteurs sur l'impact transformateur du big data sur divers secteurs, de la santé à la finance en passant par la technologie. Mes articles visent à démystifier des concepts complexes tels que l'intelligence artificielle, le machine learning et l'analyse prédictive, tout en explorant les implications éthiques et sociétales de l'utilisation croissante des données. En parallèle, sur technplay.com, objetconnecte.com et realite-virtuelle.com, je m'efforce de captiver nos lecteurs avec des réflexions approfondies et des perspectives innovantes sur l'impact des technologies émergentes telles que la réalité virtuelle, l'internet des objets et les avancées dans le domaine de l'intelligence artificielle. Mon objectif global est de rester à la pointe de l'information technologique, offrant à nos lecteurs une compréhension enrichie et éclairée des dernières avancées dans le monde passionnant et en constante évolution du big data et des technologies connexes."", 'url': 'https://www.lebigdata.fr/author/magloire'}]",,,,,,,,,,
https://news.google.com/rss/articles/CBMiXWh0dHBzOi8vd3d3LmFnZWZpLmZyL25ld3MvZWNvbm9taWUtbWFyY2hlcy9jaGF0Z3B0LWVudHJlLWRlamEtZGFucy1sZXMtaGFiaXR1ZGVzLWRlcy1zYWxhcmllc9IBAA?oc=5,ChatGPT entre déjà dans les habitudes des salariés - L'Agefi,2023-08-19,L'Agefi,https://www.agefi.fr,"Plus d’un quart des répondants à un sondage aux Etats-Unis indiquent utiliser régulièrement l’outil d’intelligence artificielle au travail. A terme, 40% du temps de travail pourrait être affecté.",N/A,"Plus d’un quart des répondants à un sondage aux Etats-Unis indiquent utiliser régulièrement l’outil d’intelligence artificielle au travail. A terme, 40% du temps de travail pourrait être affecté.","Plus d’un quart des répondants à un sondage aux Etats-Unis indiquent utiliser régulièrement l’outil d’intelligence artificielle au travail. A terme, 40% du temps de travail pourrait être affecté.",Economie & Marchés,N/A,"













PARTENARIAT
Par Schroders


            Pourquoi investir dans les infrastructures d’énergies renouvelables à travers des fonds semi-liquides ?
        

",http://schema.org,NewsArticle,"[{'@context': 'http://schema.org', '@type': 'ListItem', 'item': 'https://www.agefi.fr/', 'name': ""Actualité financière et économique - Information finance avec l'AGEFI - L'Agefi"", 'position': 1}, {'@context': 'http://schema.org', '@type': 'ListItem', 'item': 'https://www.agefi.fr/news', 'name': ""News - Le fil d'actualités de l'Agefi - L'Agefi"", 'position': 2}, {'@context': 'http://schema.org', '@type': 'ListItem', 'item': 'https://www.agefi.fr/news/economie-marches', 'name': ""Economie & Marchés : Tous les articles et analyses  - L'Agefi"", 'position': 3}, {'@context': 'http://schema.org', '@type': 'ListItem', 'item': 'https://www.agefi.fr/news/economie-marches/chatgpt-entre-deja-dans-les-habitudes-des-salaries', 'name': ""ChatGPT entre déjà dans les habitudes des salariés - L'Agefi"", 'position': 4}]",ChatGPT entre déjà dans les habitudes des salariés,"{'@type': 'Organization', 'name': ""L'Agefi"", 'logo': {'@type': 'ImageObject', 'url': 'https://beymedias.brightspotcdn.com/dims4/default/526cb4e/2147483647/strip/false/crop/198x20+0+10/resize/600x60!/quality/90/?url=http%3A%2F%2Fl-opinion-brightspot.s3.amazonaws.com%2Fd7%2F66%2F604b41224276b1557e76e1681078%2Flogo-ga.png', 'width': 600, 'height': 60}}","{'@type': 'WebPage', '@id': 'https://www.agefi.fr/news/economie-marches/chatgpt-entre-deja-dans-les-habitudes-des-salaries'}","[{'@context': 'http://schema.org', '@type': 'ImageObject', 'height': 1238, 'url': 'https://beymedias.brightspotcdn.com/dims4/default/b3d511c/2147483647/strip/false/crop/1500x1250+0+0/resize/1486x1238!/quality/90/?url=http%3A%2F%2Fl-opinion-brightspot.s3.amazonaws.com%2F5a%2Fa8%2F09e4ee28f034b71ae8ee131535f8%2Fia-intelligence-artificielle-numerique-augmente-adobestock-89216634.jpg', 'width': 1486}, {'@context': 'http://schema.org', '@type': 'ImageObject', 'height': 675, 'url': 'https://beymedias.brightspotcdn.com/dims4/default/99eb05f/2147483647/strip/false/crop/1500x844+0+406/resize/1200x675!/quality/90/?url=http%3A%2F%2Fl-opinion-brightspot.s3.amazonaws.com%2F5a%2Fa8%2F09e4ee28f034b71ae8ee131535f8%2Fia-intelligence-artificielle-numerique-augmente-adobestock-89216634.jpg', 'width': 1200}]",2023-08-19T02:00:00-0400,2023-08-19T02:00:05-0400,,"[{'@context': 'http://schema.org', '@type': 'Person', 'image': {'@context': 'http://schema.org', '@type': 'ImageObject', 'url': 'https://beymedias.brightspotcdn.com/c5/54/d17819864f1196d3e4e389c0aa60/dsc02003.jpg'}, 'name': 'Johann Corric', 'url': 'https://www.agefi.fr/auteur/johann-corric'}]",,,,https://l-opinion-brightspot-lower.s3.amazonaws.com/1f/79/ded626d44c19a3dab6e6bc185ab3/logo.svg,fr,https://www.agefi.fr/news/economie-marches/chatgpt-entre-deja-dans-les-habitudes-des-salaries,True,ChatGPT entre déjà dans les habitudes des salariés - L'Agefi,,,,,
