URL link,Title,Date,Source,Source Link,description,keywords,og:description,twitter:description,@context,@type,itemListElement,mainEntityOfPage,headline,alternativeHeadline,name,datePublished,dateModified,author,speakable,image,articleSection,publisher,isAccessibleForFree,article:section,article:summary,article text,@graph,dateCreated,isPartOf,hasPart,url,countryOfOrigin,inLanguage,isFamilyFriendly
https://news.google.com/rss/articles/CBMiRGh0dHBzOi8vbW9udHJlYWxjYW1wdXMuY2EvMjAyMi8wMi8wOC9xdWFuZC1sYXJ0LWRldmllbnQtaW50ZWxsaWdlbnQv0gEA?oc=5,Quand l'art devient « intelligent » - Montréal Campus,2022-02-08,Montréal Campus,https://montrealcampus.ca,"L'intelligence artificielle (IA) est de plus en plus populaire dans plusieurs domaines. L’art ne fait pas exception. Plusieurs artistes croient que cette méthode de travail, qui continue à évoluer, ouvre de nouvelles possibilités dans le monde artistique.",N/A,"L'intelligence artificielle (IA) est de plus en plus populaire dans plusieurs domaines. L’art ne fait pas exception. Plusieurs artistes croient que cette méthode de travail, qui continue à évoluer, ouvre de nouvelles possibilités dans le monde artistique.",N/A,https://schema.org,,,,,,,,,,,,,,,N/A,N/A,N/A,"[{'@type': 'Article', '@id': 'https://montrealcampus.ca/2022/02/08/quand-lart-devient-intelligent/#article', 'isPartOf': {'@id': 'https://montrealcampus.ca/2022/02/08/quand-lart-devient-intelligent/'}, 'author': [{'@id': 'https://montrealcampus.ca/#/schema/person/ff8bee29b802252ba870c56e1818c185'}], 'headline': 'Quand l&rsquo;art devient «\xa0intelligent\xa0»', 'datePublished': '2022-02-08T16:30:17+00:00', 'dateModified': '2022-02-08T16:33:16+00:00', 'mainEntityOfPage': {'@id': 'https://montrealcampus.ca/2022/02/08/quand-lart-devient-intelligent/'}, 'wordCount': 775, 'commentCount': 0, 'publisher': {'@id': 'https://montrealcampus.ca/#organization'}, 'image': {'@id': 'https://montrealcampus.ca/2022/02/08/quand-lart-devient-intelligent/#primaryimage'}, 'thumbnailUrl': 'https://montrealcampus.ca/wp-content/uploads/2022/01/IMG_1293.jpeg', 'keywords': ['art', 'IA', 'intelligence artificielle'], 'articleSection': ['Culture'], 'inLanguage': 'fr-FR', 'potentialAction': [{'@type': 'CommentAction', 'name': 'Comment', 'target': ['https://montrealcampus.ca/2022/02/08/quand-lart-devient-intelligent/#respond']}]}, {'@type': 'WebPage', '@id': 'https://montrealcampus.ca/2022/02/08/quand-lart-devient-intelligent/', 'url': 'https://montrealcampus.ca/2022/02/08/quand-lart-devient-intelligent/', 'name': ""Quand l'art devient «\xa0intelligent\xa0» - Montréal Campus"", 'isPartOf': {'@id': 'https://montrealcampus.ca/#website'}, 'primaryImageOfPage': {'@id': 'https://montrealcampus.ca/2022/02/08/quand-lart-devient-intelligent/#primaryimage'}, 'image': {'@id': 'https://montrealcampus.ca/2022/02/08/quand-lart-devient-intelligent/#primaryimage'}, 'thumbnailUrl': 'https://montrealcampus.ca/wp-content/uploads/2022/01/IMG_1293.jpeg', 'datePublished': '2022-02-08T16:30:17+00:00', 'dateModified': '2022-02-08T16:33:16+00:00', 'description': ""L'intelligence artificielle (IA) est de plus en plus populaire dans plusieurs domaines. L’art ne fait pas exception. Plusieurs artistes croient que cette méthode de travail, qui continue à évoluer, ouvre de nouvelles possibilités dans le monde artistique."", 'breadcrumb': {'@id': 'https://montrealcampus.ca/2022/02/08/quand-lart-devient-intelligent/#breadcrumb'}, 'inLanguage': 'fr-FR', 'potentialAction': [{'@type': 'ReadAction', 'target': ['https://montrealcampus.ca/2022/02/08/quand-lart-devient-intelligent/']}]}, {'@type': 'ImageObject', 'inLanguage': 'fr-FR', '@id': 'https://montrealcampus.ca/2022/02/08/quand-lart-devient-intelligent/#primaryimage', 'url': 'https://montrealcampus.ca/wp-content/uploads/2022/01/IMG_1293.jpeg', 'contentUrl': 'https://montrealcampus.ca/wp-content/uploads/2022/01/IMG_1293.jpeg', 'width': 1015, 'height': 560}, {'@type': 'BreadcrumbList', '@id': 'https://montrealcampus.ca/2022/02/08/quand-lart-devient-intelligent/#breadcrumb', 'itemListElement': [{'@type': 'ListItem', 'position': 1, 'name': 'Accueil', 'item': 'https://montrealcampus.ca/'}, {'@type': 'ListItem', 'position': 2, 'name': 'Quand l&rsquo;art devient «\xa0intelligent\xa0»'}]}, {'@type': 'WebSite', '@id': 'https://montrealcampus.ca/#website', 'url': 'https://montrealcampus.ca/', 'name': 'Montréal Campus', 'description': 'Le journal indépendant des étudiantes et des étudiants de l&#039;UQAM depuis 1980.', 'publisher': {'@id': 'https://montrealcampus.ca/#organization'}, 'potentialAction': [{'@type': 'SearchAction', 'target': {'@type': 'EntryPoint', 'urlTemplate': 'https://montrealcampus.ca/?s={search_term_string}'}, 'query-input': 'required name=search_term_string'}], 'inLanguage': 'fr-FR'}, {'@type': 'Organization', '@id': 'https://montrealcampus.ca/#organization', 'name': 'Montréal Campus', 'url': 'https://montrealcampus.ca/', 'logo': {'@type': 'ImageObject', 'inLanguage': 'fr-FR', '@id': 'https://montrealcampus.ca/#/schema/logo/image/', 'url': 'https://montrealcampus.ca/wp-content/uploads/2023/11/logo-m-c.png', 'contentUrl': 'https://montrealcampus.ca/wp-content/uploads/2023/11/logo-m-c.png', 'width': 500, 'height': 214, 'caption': 'Montréal Campus'}, 'image': {'@id': 'https://montrealcampus.ca/#/schema/logo/image/'}, 'sameAs': ['https://www.facebook.com/montrealcampus/', 'https://x.com/montrealcampus', 'https://www.instagram.com/montrealcampus/']}, {'@type': 'Person', '@id': 'https://montrealcampus.ca/#/schema/person/ff8bee29b802252ba870c56e1818c185', 'name': 'Andrée Dolan', 'image': {'@type': 'ImageObject', 'inLanguage': 'fr-FR', '@id': 'https://montrealcampus.ca/#/schema/person/image/12f36e9f51f160cebad575fd5e0f1251', 'url': 'https://secure.gravatar.com/avatar/04950d26a35f737124659bda8d2e42e3?s=96&d=mm&r=g', 'contentUrl': 'https://secure.gravatar.com/avatar/04950d26a35f737124659bda8d2e42e3?s=96&d=mm&r=g', 'caption': 'Andrée Dolan'}, 'url': 'https://montrealcampus.ca/author/andreedolan/'}]",,,,,,,
https://news.google.com/rss/articles/CBMipwFodHRwczovL3d3dy5vdWVzdC1mcmFuY2UuZnIvc2FudGUvcXVhbmQtbGVzLXByZWp1Z2VzLWRlLWwtaW50ZWxsaWdlbmNlLWFydGlmaWNpZWxsZS1yZXByZXNlbnRlbnQtdW4tcmlzcXVlLXBvdXItbGEtc2FudGUtZGVzLWFpbmVzLTk4MGYxMTMwLTg5YWUtMTFlYy1hMTkzLWMyZjZhMGNkMzY2NdIBAA?oc=5,Quand les préjugés de l'intelligence artificielle représentent un risque pour la santé des aînés - Ouest-France,2022-02-09,Ouest-France,https://www.ouest-france.fr,"Les stéréotypes négatifs envers les personnes âgées, inclus dans les systèmes d’intelligence artificielle (IA), qui sont de plus en plus présents dans le domaine de la santé, menacent directement la qualité des soins aux aînés, met en garde l’OMS mercredi 9 février.","['Santé', 'Seniors', 'High Tech', 'Actualité en continu', 'Une']","Les stéréotypes négatifs envers les personnes âgées, inclus dans les systèmes d’intelligence artificielle (IA), qui sont de plus en plus présents dans le domaine de la santé, menacent directement la qualité des soins aux aînés, met en garde l’OMS mercredi 9 février.","Les stéréotypes négatifs envers les personnes âgées, inclus dans les systèmes d’intelligence artificielle (IA), qui sont de plus en plus présents dans le domaine de la santé, menacent directement la qualité des soins aux aînés, met en garde l’OMS mercredi 9 février.",https://schema.org,NewsArticle,"[{'@type': 'ListItem', 'position': 1, 'item': {'name': 'Santé', '@id': 'https://www.ouest-france.fr/sante/'}}]","{'@id': 'https://www.ouest-france.fr/sante/quand-les-prejuges-de-l-intelligence-artificielle-representent-un-risque-pour-la-sante-des-aines-980f1130-89ae-11ec-a193-c2f6a0cd3665', '@type': 'WebPage'}",Quand les préjugés de l’intelligence artificielle représentent un risque pour la santé des aînés,"Les stéréotypes négatifs envers les personnes âgées, inclus dans les systèmes d’intelligence artificielle (IA), qui sont de plus en plus présents dans le domaine de la santé, menacent directement la qualité des soins aux aînés, met en garde l’OMS mercredi 9 février.",Quand les préjugés de l’intelligence artificielle représentent un risque pour la santé des aînés,2022-02-09T15:55:22+01:00,2022-02-09T15:55:22+01:00,"[{'@type': 'Organization', 'name': 'Ouest-France avec AFP', 'url': 'http://www.ouest-france.fr/'}]","{'@type': 'SpeakableSpecification', 'cssSelector': ['h1.titre', 'div#article-detail p.chapeau']}","[{'@type': 'ImageObject', 'url': 'https://media.ouest-france.fr/v1/pictures/MjAyMjAyOGE0OTQ4YWQ3YzRkM2NmMDgyNTdmODc3ZTQ2ZmFhMWI?width=1260&height=708&focuspoint=50%2C25&cropresize=1&client_id=bpeditorial&sign=d02f7dc0299fcb2e167333404e53d4f8f749e5e9e0e6d72c907fecc0ed945a5a', 'width': 1260, 'height': 708}]",Santé,"{'@type': 'Organization', 'name': 'Ouest-France', 'url': 'https://www.ouest-france.fr', 'logo': {'@type': 'ImageObject', 'url': 'https://media.ouest-france.fr/v1/pictures/7856ef084164c8f5002a882c557b04df-ouest-france-couleur-170x56.png', 'width': 170, 'height': 56}, 'sameAs': ['https://www.facebook.com/ouest.france', 'https://twitter.com/ouestfrance']}",True,Santé,N/A,"



Quand les préjugés de l’intelligence artificielle représentent un risque pour la santé des aînés

Les stéréotypes négatifs envers les personnes âgées, inclus dans les systèmes d’intelligence artificielle (IA), qui sont de plus en plus présents dans le domaine de la santé, menacent directement la qualité des soins aux aînés, met en garde l’OMS mercredi 9 février.





Les biais et les préjugés de l’intelligence artificielle pourraient porter préjudice aux seniors, selon un texte de l’OMS. Photo d’illustration. | PHOVOIR


Voir en plein écran





fermer



Les biais et les préjugés de l’intelligence artificielle pourraient porter préjudice aux seniors, selon un texte de l’OMS. Photo d’illustration. | PHOVOIR 







Ouest-France

                            avec AFP.
                        


Publié le 09/02/2022  à 15h55






Abonnez-vous






Lire plus tard





Partager





Newsletter Médecine et Santé
Chaque mercredi, une sélection de contenus pour mieux comprendre l'actualité de la santé




Merci de saisir votre adresse e-mail





OK





Votre e-mail, avec votre consentement, est utilisé par Ouest-France pour recevoir notre newsletter. En savoir plus.









L’intelligence artificielle (IA) est de plus en plus présente dans le domaine de la santé. Si elle représente un progrès pour tous, son utilisation n’est pas sans risque. Et notamment pour les personnes âgées, alerte l’Organisation mondiale de la santé (OMS), qui publie ce mercredi 9 février un mémoire sur le sujet. En effet, les IA, créés par des humains, en fonction de bases de données parfois biaisées ou mal analysées, pourraient représenter un risque pour la santé des aînés.




Dans le domaine de la santé, le potentiel de l’IA est énorme pour améliorer la qualité des soins mais « l’encodage de stéréotypes ou de discrimination dans l’IA ou leur manifestation dans la façon dont on l’utilise pourrait miner la qualité des soins pour les personnes âgées », souligne l’OMS.




Examens plus poussés chez les hommes que chez les femmes
L’IA repose sur l’utilisation de vastes bases de données qui sont souvent compilées, partagées et analysées de manière peu transparente.




Comme cela a déjà été démontré pour le genre ou l’origine, ces bases de données peuvent être biaisées et reproduire voire amplifier des pratiques agistes déjà largement répandues dans les systèmes de soins.




« Les hommes âgés bénéficient souvent d’examens plus poussés que les femmes âgées, ou ont plus de chances de recevoir certains traitements ou soins préventifs », souligne la docteure Vania de la Fuente-Nunez qui fait partie de la cellule « Vieillir en bonne santé » de l’OMS, dans un entretien à l’AFP.




Elle pointe aussi du doigt les accès aux soins intensifs ou à de l’oxygène décidés sur la base de l’âge, durant les phases les plus critiques de la pandémie de Covid-19.






« Les algorithmes de l’IA peuvent incruster les inégalités existantes dans le domaine de la santé et avoir un effet systématiquement discriminant beaucoup plus large qu’un individu biaisé », souligne le mémoire.




Des données encore trop « jeunes »
Ces défauts peuvent encore être aggravés par la sous-représentation des personnes âgées dans les bases de données utilisées. En basant les algorithmes sur des données cumulées à partir des populations jeunes on prend le risque de manquer ce qui est spécifique aux aînés en matière de santé.




Pour autant, le mémoire souligne aussi les bénéfices que la santé des personnes âgées peut tirer de l’IA, en matière de prévention des chutes ou d’autres urgences médicales, grâce à la collecte de données par le biais d’accessoires connectés par exemple.




L’IA peut ainsi aider à faire une médecine plus préventive en permettant de mieux prédire l’évolution d’une maladie ou les risques. Mais si elle permet de compenser en partie un manque de personnel, l’IA risque aussi de réduire le contact physique entre soignants et patients âgés.




Et par conséquent « on limite les occasions de combattre l’âgisme à travers les interactions entre générations », souligne la docteure de la Fuente-Nunez.




Associer les seniors à l’élaboration de la santé de demain
Elle souligne un autre risque : « nous voyons cette tendance à créer (ces systèmes) pour les personnes âgées plutôt qu’avec elles ».




Et il y a bien sûr « un énorme fossé numérique », prévient la docteure, lequel peut aussi isoler les aînés, moins enclins à adopter de nouvelles technologies, et les mettre en marge d’un système de santé où la numérisation s’impose à marche forcée.




Le mémoire recommande de remédier à ce problème en informant mieux les personnes âgées sur le numérique mais aussi de les impliquer dans tous les aspects qui peuvent affecter la façon dont on les soigne.




Il faut les associer non seulement à l’élaboration des algorithmes mais aussi les inclure dans des comités d’éthique par exemple ou s’assurer que les agences sanitaires les consultent pour détecter et éliminer les biais en amont.








« L’IA est porteuse de promesses, mais il faut être prudent parce qu’elle présente aussi des risques », a résumé la docteure de la Fuente-Nunez.




Santé
Seniors
High Tech
Actualité en continu
gauchedroite




",,,,,,,,
