Unnamed: 0,URL Link,Date,Source,Source Link,Title,Description,Text to Process,Preprocessed Text,Value,Sentiment
78,https://news.google.com/rss/articles/CBMiemh0dHBzOi8vd3d3LmZvcmJlcy5jb20vc2l0ZXMvamVmZm1jbWFob24vMjAyMS8xMi8yOS9ob3ctZG9lLWlzLXVzaW5nLWFpLWFuZC1yb2JvdHMtdG8tZGVzaWduLXRoZS1zdWNjZXNzb3ItdG8tbGl0aGl1bS1pb24v0gEA?oc=5,2020-12-29,Forbes,https://www.forbes.com,How DOE Researchers Are Using AI And Robots To Design The Successor To Lithium,"Building the better battery may be too big a job for humans, according to researchers at the Joint Center for Energy Storage Research, so the researchers are turning to artificial intelligence to find the right ingredients and to robots to make and test them.","How DOE Researchers Are Using AI And Robots To Design The Successor To Lithium Building the better battery may be too big a job for humans, according to researchers at the Joint Center for Energy Storage Research, so the researchers are turning to artificial intelligence to find the right ingredients and to robots to make and test them.",doe researcher using ai robot design successor lithium building better battery may big job human according researcher joint center energy storage research researcher turning artificial intelligence find right ingredient robot make test,0.01428571428571429,positive
79,https://news.google.com/rss/articles/CBMiemh0dHBzOi8vd3d3Lm5ld3NjaWVudGlzdC5jb20vYXJ0aWNsZS9tZzI0ODMzMTQwLTcwMC1kZW1pcy1oYXNzYWJpcy1pbnRlcnZpZXctb3VyLWFpLXdpbGwtdW5sb2NrLXNlY3JldHMtb2YtaG93LWxpZmUtd29ya3Mv0gEA?oc=5,2020-12-30,New Scientist,https://www.newscientist.com,Demis Hassabis interview: Our AI will unlock secrets of how life works,"DeepMind&#039;s co-founder says artificial intelligence is set to crack many of the toughest problems in science, from the nature of life to nuclear fusion","Demis Hassabis interview: Our AI will unlock secrets of how life works DeepMind&#039;s co-founder says artificial intelligence is set to crack many of the toughest problems in science, from the nature of life to nuclear fusion",demis hassabis interview ai unlock secret life work deepminds cofounder say artificial intelligence set crack many toughest problem science nature life nuclear fusion,-0.16666666666666666,negative
80,https://news.google.com/rss/articles/CBMiU2h0dHBzOi8vdGVjaGNydW5jaC5jb20vMjAyMC8xMi8zMS9ob3ctYXJ0aWZpY2lhbC1pbnRlbGxpZ2VuY2Utd2lsbC1iZS11c2VkLWluLTIwMjEv0gEA?oc=5,2020-12-31,TechCrunch,https://techcrunch.com,How artificial intelligence will be used in 2021,"""We're going to start to see a lot of real value and ROI generated by AI across more and more businesses,""","How artificial intelligence will be used in 2021 ""We're going to start to see a lot of real value and ROI generated by AI across more and more businesses,""",artificial intelligence used going start see lot real value roi generated ai across business,-0.19999999999999998,negative
81,https://news.google.com/rss/articles/CBMie2h0dHBzOi8vd3d3LnRlY2h0YXJnZXQuY29tL3BhdGllbnRlbmdhZ2VtZW50L25ld3MvMzY2NTg1MDc0L0hvdy1Jcy1BcnRpZmljaWFsLUludGVsbGlnZW5jZS1TaGFwaW5nLVBhdGllbnQtRW5nYWdlbWVudC1Ub29sc9IBAA?oc=5,2020-12-31,TechTarget,https://www.techtarget.com,How Is Artificial Intelligence Shaping Patient Engagement Tools?,"Artificial intelligence has proven its effectiveness in healthcare. Now, tech developers are looking at how the technology can boost patient engagement tools and consumer experience.","How Is Artificial Intelligence Shaping Patient Engagement Tools? Artificial intelligence has proven its effectiveness in healthcare. Now, tech developers are looking at how the technology can boost patient engagement tools and consumer experience.",artificial intelligence shaping patient engagement tool artificial intelligence proven effectiveness healthcare tech developer looking technology boost patient engagement tool consumer experience,-0.6,negative
82,https://news.google.com/rss/articles/CBMieGh0dHBzOi8vdG93YXJkc2RhdGFzY2llbmNlLmNvbS81LXNpZ25pZmljYW50LXJlYXNvbnMtd2h5LWV4cGxhaW5hYmxlLWFpLWlzLWFuLWV4aXN0ZW50aWFsLW5lZWQtZm9yLWh1bWFuaXR5LWFiZTU3Y2VkNDU0MdIBAA?oc=5,2020-12-28,Towards Data Science,https://towardsdatascience.com,5 Significant Reasons Why Explainable AI is an Existential Need for Humanity,"What is explainable artificial intelligence (XAI), and why do we seek explainability & interpretability in AI systems?","5 Significant Reasons Why Explainable AI is an Existential Need for Humanity What is explainable artificial intelligence (XAI), and why do we seek explainability & interpretability in AI systems?",significant reason explainable ai existential need humanity explainable artificial intelligence xai seek explainability interpretability ai system,-0.11249999999999999,negative
83,https://news.google.com/rss/articles/CBMiYmh0dHBzOi8vd3d3LmNvbnN1bHRhbmN5LmFzaWEvbmV3cy8zODAwL2libS10by10cmFpbi0zMDAtc2luZ2Fwb3JlYW4tcHJvZmVzc2lvbmFscy1pbi1lbWVyZ2luZy10ZWNo0gFmaHR0cHM6Ly93d3cuY29uc3VsdGFuY3kuYXNpYS9uZXdzL2FtcC8zODAwL2libS10by10cmFpbi0zMDAtc2luZ2Fwb3JlYW4tcHJvZmVzc2lvbmFscy1pbi1lbWVyZ2luZy10ZWNo?oc=5,2020-12-30,Consultancy.asia,https://www.consultancy.asia,IBM to train 300 Singaporean professionals in emerging tech,"As part of a nationwide campaign to create jobs during and after Covid-19, the Singapore government has called upon IBM to recruit and train 300 local professionals in the next four years.","IBM to train 300 Singaporean professionals in emerging tech As part of a nationwide campaign to create jobs during and after Covid-19, the Singapore government has called upon IBM to recruit and train 300 local professionals in the next four years.",ibm train singaporean professional emerging tech part nationwide campaign create job covid singapore government called upon ibm recruit train local professional next four year,0.05,positive
84,https://news.google.com/rss/articles/CBMidWh0dHBzOi8vd3d3LmFuYWx5dGljc2luc2lnaHQubmV0L2FydGlmaWNpYWwtaW50ZWxsaWdlbmNlL2FydGlmaWNpYWwtaW50ZWxsaWdlbmNlLWluLWdvdmVybm1lbnQtaXRzLXVzZXMtcG9zc2liaWxpdGllc9IBf2h0dHBzOi8vd3d3LmFuYWx5dGljc2luc2lnaHQubmV0L2FtcC9zdG9yeS9hcnRpZmljaWFsLWludGVsbGlnZW5jZS9hcnRpZmljaWFsLWludGVsbGlnZW5jZS1pbi1nb3Zlcm5tZW50LWl0cy11c2VzLXBvc3NpYmlsaXRpZXM?oc=5,2020-12-30,Analytics Insight,https://www.analyticsinsight.net,Artificial Intelligence in Government: Its Uses & Possibilities,"AI allows the government to eliminate backlogs for effective management and several other key tasks. In today's world, artificial intelligence has become very p","Artificial Intelligence in Government: Its Uses & Possibilities AI allows the government to eliminate backlogs for effective management and several other key tasks. In today's world, artificial intelligence has become very p",artificial intelligence government us possibility ai allows government eliminate backlog effective management several key task today world artificial intelligence become p,-0.12,negative
85,https://news.google.com/rss/articles/CBMiP2h0dHBzOi8vaW5kaWFhaS5nb3YuaW4vYXJ0aWNsZS9yaXNlLW9mLWFpLWluLXRoZS1pbmRpYW4tZWNvbm9tedIBAA?oc=5,2020-12-28,INDIAai,https://indiaai.gov.in,Rise of AI in the Indian Economy,"One look around and we find applications of AI everywhere, be it finding insights from mountains of data or automating production and deliver services. AI is being embraced by an increasing number of businesses, individuals and even governments to boost productivity and raise efficiency. At a country level, while most countries have just started using AI, the technologically advanced countries have considerably leaped ahead. In this context, it will be interesting to find out India’s vision regarding AI and the growth consequences attached to it.","Rise of AI in the Indian Economy One look around and we find applications of AI everywhere, be it finding insights from mountains of data or automating production and deliver services. AI is being embraced by an increasing number of businesses, individuals and even governments to boost productivity and raise efficiency. At a country level, while most countries have just started using AI, the technologically advanced countries have considerably leaped ahead. In this context, it will be interesting to find out India’s vision regarding AI and the growth consequences attached to it.",rise ai indian economy one look around find application ai everywhere finding insight mountain data automating production deliver service ai embraced increasing number business individual even government boost productivity raise efficiency country level country started using ai technologically advanced country considerably leaped ahead context interesting find india vision regarding ai growth consequence attached,0.25,positive
86,https://news.google.com/rss/articles/CBMiSmh0dHBzOi8vd3d3LmluZGlhbndlYjIuY29tLzIwMjAvMTIvaW5kaWFzLTFzdC1hcnRpZmljaWFsLWludGVsbGlnZW5jZS5odG1s0gEA?oc=5,2020-12-28,IndianWeb2.com,https://www.indianweb2.com,India's 1st Artificial Intelligence Community Center “HexArt Institute” Launched By Hexagon in Partnership with ...,"News reports, trends, analysis and Daily Updates on Business, New Emerging Technology, Startups, Funding, and Innovation in India and across the World","India's 1st Artificial Intelligence Community Center “HexArt Institute” Launched By Hexagon in Partnership with ... News reports, trends, analysis and Daily Updates on Business, New Emerging Technology, Startups, Funding, and Innovation in India and across the World",india st artificial intelligence community center hexart institute launched hexagon partnership news report trend analysis daily update business new emerging technology startup funding innovation india across world,-0.1409090909090909,negative
87,https://news.google.com/rss/articles/CBMicGh0dHBzOi8vd3d3LmFuYWx5dGljc2luc2lnaHQubmV0L2FydGlmaWNpYWwtaW50ZWxsaWdlbmNlL3RoZS1ldm9sdXRpb24tb2YtYXJ0aWZpY2lhbC1pbnRlbGxpZ2VuY2UtaW4tdmlkZW8tZ2FtZXPSAXpodHRwczovL3d3dy5hbmFseXRpY3NpbnNpZ2h0Lm5ldC9hbXAvc3RvcnkvYXJ0aWZpY2lhbC1pbnRlbGxpZ2VuY2UvdGhlLWV2b2x1dGlvbi1vZi1hcnRpZmljaWFsLWludGVsbGlnZW5jZS1pbi12aWRlby1nYW1lcw?oc=5,2020-12-29,Analytics Insight,https://www.analyticsinsight.net,The Evolution of Artificial Intelligence in Video Games,"With a new generation of consoles at the door, the video game industry shows that it continues to work with the objective of offering its users better graphics ","The Evolution of Artificial Intelligence in Video Games With a new generation of consoles at the door, the video game industry shows that it continues to work with the objective of offering its users better graphics ",evolution artificial intelligence video game new generation console door video game industry show continues work objective offering user better graphic,-0.1090909090909091,negative
