Unnamed: 0,URL Link,Date,Source,Source Link,Title,Description,Text to Process,Preprocessed Text,Value,Sentiment
51,https://news.google.com/rss/articles/CBMiXGh0dHBzOi8vd3d3LnpkbmV0LmNvbS9hcnRpY2xlL3pvb20tdXBkYXRlLWFkZHMtc3VwcG9ydC1mb3ItYXBwbGVzLWFybS1zaWxpY29uLW0xLWJhc2VkLW1hY3Mv0gEA?oc=5,2020-12-21,ZDNet,https://www.zdnet.com,Zoom update adds support for Apple's Arm silicon M1,"Your company might not be in any rush to get its people back into the office, but home workers are suffering from burnout and 'Zoom fatigue'. Executives must think now about how to keep workers engaged as the WFH experiment continues.","Zoom update adds support for Apple's Arm silicon M1 Your company might not be in any rush to get its people back into the office, but home workers are suffering from burnout and 'Zoom fatigue'. Executives must think now about how to keep workers engaged as the WFH experiment continues.",zoom update add support apple arm silicon company might rush get people back office home worker suffering burnout zoom fatigue executive must think keep worker engaged wfh experiment continues,0.0,neutral
52,https://news.google.com/rss/articles/CBMiP2h0dHBzOi8vY3VwZS5jYS9lbWJyYWNpbmctdGVjaG5vbG9naWNhbC1jaGFuZ2UtanVzdC1wZXJzcGVjdGl2ZdIBAA?oc=5,2020-12-18,Canadian Union of Public Employees,https://cupe.ca,Embracing technological change from a just perspective,"The pandemic has accelerated technological change and the adoption of new tools. Remote learning, working from home, and having virtual meetings went from occasional to routine in less than a year. While some of these will no doubt lose their attractiveness once COVID-19 is under control, others will have a long-lasting impact on the way we live and work.","Embracing technological change from a just perspective The pandemic has accelerated technological change and the adoption of new tools. Remote learning, working from home, and having virtual meetings went from occasional to routine in less than a year. While some of these will no doubt lose their attractiveness once COVID-19 is under control, others will have a long-lasting impact on the way we live and work.",embracing technological change perspective pandemic accelerated technological change adoption new tool remote learning working home virtual meeting went occasional routine le year doubt lose attractiveness covid control others longlasting impact way live work,0.043181818181818175,positive
53,https://news.google.com/rss/articles/CBMidWh0dHBzOi8vd3d3LmFuYWx5dGljc2luc2lnaHQubmV0L2FydGlmaWNpYWwtaW50ZWxsaWdlbmNlL3doYXQtaXMtdGhlLXJvbGUtb2Ytdm9pY2UtYXV0b21hdGlvbi1haS1hbmQtaG93LWRvZXMtaXQtd29ya9IBf2h0dHBzOi8vd3d3LmFuYWx5dGljc2luc2lnaHQubmV0L2FtcC9zdG9yeS9hcnRpZmljaWFsLWludGVsbGlnZW5jZS93aGF0LWlzLXRoZS1yb2xlLW9mLXZvaWNlLWF1dG9tYXRpb24tYWktYW5kLWhvdy1kb2VzLWl0LXdvcms?oc=5,2020-12-21,Analytics Insight,https://www.analyticsinsight.net,What is the Role of Voice Automation/AI and How does it work?,"The next digital trend on the market is voice search technology, and in some cases, touch screens already have been replaced. Artificial Intelligence is a machi","What is the Role of Voice Automation/AI and How does it work? The next digital trend on the market is voice search technology, and in some cases, touch screens already have been replaced. Artificial Intelligence is a machi",role voice automationai work next digital trend market voice search technology case touch screen already replaced artificial intelligence machi,-0.19999999999999998,negative
54,https://news.google.com/rss/articles/CBMiYGh0dHBzOi8vd3d3LmltcGVyaWFsLmFjLnVrL25ld3MvMjEwMzEzL2FydGlmaWNpYWwtaW50ZWxsaWdlbmNlLWltcHJvdmVzLWNvbnRyb2wtcG93ZXJmdWwtcGxhc21hL9IBAA?oc=5,2020-12-11,Imperial College London,https://www.imperial.ac.uk,Artificial intelligence improves control of powerful plasma accelerators | Imperial News,"ACCELERATOR AI - Researchers have used AI to control beams for the next generation of smaller, cheaper accelerators for research, medical and industrial applications.","Artificial intelligence improves control of powerful plasma accelerators | Imperial News ACCELERATOR AI - Researchers have used AI to control beams for the next generation of smaller, cheaper accelerators for research, medical and industrial applications.",artificial intelligence improves control powerful plasma accelerator imperial news accelerator ai researcher used ai control beam next generation smaller cheaper accelerator research medical industrial application,-0.06,negative
55,https://news.google.com/rss/articles/CBMiMmh0dHBzOi8vd3d3Lm5hdHVyZS5jb20vYXJ0aWNsZXMvZDQxNTg2LTAyMC0wMzQwOS040gEA?oc=5,2020-12-09,Nature.com,https://www.nature.com,The race to the top among the world's leaders in artificial intelligence,"Nature - As revenues and research output soar in the field of AI, global competition between the United States, China and Europe heats up.","The race to the top among the world's leaders in artificial intelligence Nature - As revenues and research output soar in the field of AI, global competition between the United States, China and Europe heats up.",race top among world leader artificial intelligence nature revenue research output soar field ai global competition united state china europe heat,-0.033333333333333326,negative
56,https://news.google.com/rss/articles/CBMibWh0dHBzOi8vbmV3cy5taWNyb3NvZnQuY29tL2VzLXhsL2Vzby1hbmQtbWljcm9zb2Z0LXdpbGwtd29yay13aXRoLWFydGlmaWNpYWwtaW50ZWxsaWdlbmNlLXRvLWJvb3N0LWFzdHJvbm9teS_SAQA?oc=5,2020-12-10,Microsoft,https://news.microsoft.com,ESO and Microsoft will work with artificial intelligence to boost astronomy,"Following of “Transforma Chile #ReactivaciónDigital” investment plan announced yesterday, Brad Smith, President of Microsoft, met with ESO authorities to close a new stage of their collaboration agreement. Teams from both organizations will use Artificial Intelligence (AI) to analyze large volumes of atmosphere data and optimize the cutting-edge science performed by ESO telescopes. Microsoft will deliver […]","ESO and Microsoft will work with artificial intelligence to boost astronomy Following of “Transforma Chile #ReactivaciónDigital” investment plan announced yesterday, Brad Smith, President of Microsoft, met with ESO authorities to close a new stage of their collaboration agreement. Teams from both organizations will use Artificial Intelligence (AI) to analyze large volumes of atmosphere data and optimize the cutting-edge science performed by ESO telescopes. Microsoft will deliver […]",eso microsoft work artificial intelligence boost astronomy following transforma chile reactivacióndigital investment plan announced yesterday brad smith president microsoft met eso authority close new stage collaboration agreement team organization use artificial intelligence ai analyze large volume atmosphere data optimize cuttingedge science performed eso telescope microsoft deliver,-0.16987012987012984,negative
57,https://news.google.com/rss/articles/CBMia2h0dHBzOi8vd3d3LnN0YW5kYXJkLmNvLnVrL2Z1dHVyZWxvbmRvbi9zdGVtL3N0dWR5LWFydGlmaWNpYWwtaW50ZWxsaWdlbmNlLWFpLWNhcmVlci1zdGVtLWpvYnMtYjIxOTY5Ni5odG1s0gEA?oc=5,2020-12-09,Evening Standard,https://www.standard.co.uk,STEM careers: What is it like to study AI and can I use it at work?,"Meet Lucrezia Del Zompo, who is studying AI at Queen Mary University of London as part of an apprenticeship","STEM careers: What is it like to study AI and can I use it at work? Meet Lucrezia Del Zompo, who is studying AI at Queen Mary University of London as part of an apprenticeship",stem career like study ai use work meet lucrezia del zompo studying ai queen mary university london part apprenticeship,0.0,neutral
58,https://news.google.com/rss/articles/CBMiYmh0dHBzOi8vd3d3LnRoaW5rZ2xvYmFsaGVhbHRoLm9yZy9hcnRpY2xlL2FydGlmaWNpYWwtaW50ZWxsaWdlbmNlLXJhZGlvbG9neS1oZXNpdGFudC1zdGVwcy1mb3J3YXJk0gEA?oc=5,2020-12-11,Think Global Health,https://www.thinkglobalhealth.org,Artificial Intelligence in Radiology: Hesitant Steps Forward,How artificial intelligence is transforming the work of radiologists and reshaping global health delivery,Artificial Intelligence in Radiology: Hesitant Steps Forward How artificial intelligence is transforming the work of radiologists and reshaping global health delivery,artificial intelligence radiology hesitant step forward artificial intelligence transforming work radiologist reshaping global health delivery,-0.39999999999999997,negative
59,https://news.google.com/rss/articles/CBMiQ2h0dHBzOi8vd3d3LmljdHdvcmtzLm9yZy9hcnRpZmljaWFsLWludGVsbGlnZW5jZS1nbG9iYWwtaGVhbHRoY2FyZS_SAQA?oc=5,2020-12-09,ICTworks,https://www.ictworks.org,How Artificial Intelligence Can Reimagine Global Healthcare,Reimagining Global Health through Artificial Intelligence explores how AI can support global health goals and Sustainable Development Goal 3.,How Artificial Intelligence Can Reimagine Global Healthcare Reimagining Global Health through Artificial Intelligence explores how AI can support global health goals and Sustainable Development Goal 3.,artificial intelligence reimagine global healthcare reimagining global health artificial intelligence explores ai support global health goal sustainable development goal,-0.24,negative
60,https://news.google.com/rss/articles/CBMisAFodHRwczovL3d3dy5jb2UuaW50L2VuL3dlYi9odW1hbi1yaWdodHMtcnVsZS1vZi1sYXcvZXZlbnRzLy0vYXNzZXRfcHVibGlzaGVyL0U1V1d0aHN5NEpmZy9jb250ZW50L2NlcGVqLWFydGlmaWNpYWwtaW50ZWxsaWdlbmNlLWFuZC1jeWJlcmp1c3RpY2UtYXQtdGhlLWhlYXJ0LW9mLXRoZS1kaXNjdXNzaW9uc9IBAA?oc=5,2020-12-11,Council of Europe,https://www.coe.int,CEPEJ: Artificial intelligence and cyberjustice at the heart of the discussions, Strasbourg 11/12/2020,CEPEJ: Artificial intelligence and cyberjustice at the heart of the discussionsStrasbourg 11/12/2020,cepej artificial intelligence cyberjustice heart discussionsstrasbourg,-0.6,negative
61,https://news.google.com/rss/articles/CBMiT2h0dHBzOi8vd3d3Lm55dGltZXMuY29tLzIwMjAvMTIvMTAvb3Bpbmlvbi9hcnRpZmljaWFsLWludGVsbGlnZW5jZS1lY29ub215Lmh0bWzSAQA?oc=5,2020-12-10,The New York Times,https://www.nytimes.com,Opinion | Give the A.I. Economy a Human Touch (Published 2020),"Embracing artificial intelligence can help us create a new, equitable social contract — but only if we remember what makes us human.","Opinion | Give the A.I. Economy a Human Touch (Published 2020) Embracing artificial intelligence can help us create a new, equitable social contract — but only if we remember what makes us human.",opinion give ai economy human touch published embracing artificial intelligence help u create new equitable social contract remember make u human,-0.08606060606060606,negative
62,https://news.google.com/rss/articles/CBMiR2h0dHBzOi8vd3d3LndpcmVkLmNvbS9zdG9yeS9iZWhpbmQtcGFwZXItbGVkLWdvb2dsZS1yZXNlYXJjaGVycy1maXJpbmcv0gEA?oc=5,2020-12-08,WIRED,https://www.wired.com,Behind the Paper That Led to a Google Researcher's Firing,Timnit Gebru was one of seven authors on a study that examined prior research on training artificial intelligence models to understand language.,Behind the Paper That Led to a Google Researcher's Firing Timnit Gebru was one of seven authors on a study that examined prior research on training artificial intelligence models to understand language.,behind paper led google researcher firing timnit gebru one seven author study examined prior research training artificial intelligence model understand language,-0.3333333333333333,negative
63,https://news.google.com/rss/articles/CBMiV2h0dHBzOi8vbmV3cy51c25pLm9yZy8yMDIwLzEyLzA5L3BhbmVsLWRldGFpbHMtZ2xvYmFsLWFydGlmaWNpYWwtaW50ZWxsaWdlbmNlLWFybXMtcmFjZdIBAA?oc=5,2020-12-09,USNI News,https://news.usni.org,Panel Details Global Artificial Intelligence Arms Race,"Harnessing artificial intelligence and machine learning technologies has become the new arms race among the great powers, a Hudson Institute panel on handling big data in military operations said Monday. Speaking at the online forum, Richard Schultz, director of the international security program in the Fletcher School at Tufts University, said, “that’s the way [Russian President Vladimir] Putin looks at it. I don’t think we have a choice” but to view it the same way. He added in answer to a question that “the data in information space is enormous,” so finding tools to filter out what’s not necessary is","Panel Details Global Artificial Intelligence Arms Race Harnessing artificial intelligence and machine learning technologies has become the new arms race among the great powers, a Hudson Institute panel on handling big data in military operations said Monday. Speaking at the online forum, Richard Schultz, director of the international security program in the Fletcher School at Tufts University, said, “that’s the way [Russian President Vladimir] Putin looks at it. I don’t think we have a choice” but to view it the same way. He added in answer to a question that “the data in information space is enormous,” so finding tools to filter out what’s not necessary is",panel detail global artificial intelligence arm race harnessing artificial intelligence machine learning technology become new arm race among great power hudson institute panel handling big data military operation said monday speaking online forum richard schultz director international security program fletcher school tuft university said thats way russian president vladimir putin look dont think choice view way added answer question data information space enormous finding tool filter whats necessary,-0.0330578512396694,negative
64,https://news.google.com/rss/articles/CBMiYGh0dHBzOi8vd3d3LnVzZGEuZ292L21lZGlhL2Jsb2cvMjAyMC8xMi8xMC9hcnRpZmljaWFsLWludGVsbGlnZW5jZS1pbXByb3Zlcy1hbWVyaWNhcy1mb29kLXN5c3RlbdIBAA?oc=5,2020-12-10,USDA.gov,https://www.usda.gov,Artificial Intelligence Improves America's Food System,"Technology is everywhere in the 21st century, and America’s food system is no exception.","Artificial Intelligence Improves America's Food System Technology is everywhere in the 21st century, and America’s food system is no exception.",artificial intelligence improves america food system technology everywhere st century america food system exception,-0.6,negative
65,https://news.google.com/rss/articles/CBMiMmh0dHBzOi8vd3d3Lm5hdHVyZS5jb20vYXJ0aWNsZXMvZDQxNTg2LTAyMC0wMzQwOC050gEA?oc=5,2020-12-09,Nature.com,https://www.nature.com,Artificial,Nature - A look at one of the most rapidly advancing and controversial topics in scientific research.,Artificial Nature - A look at one of the most rapidly advancing and controversial topics in scientific research.,artificial nature look one rapidly advancing controversial topic scientific research,-0.024999999999999967,negative
66,https://news.google.com/rss/articles/CBMiiQFodHRwczovL3d3dy5kZWZlbnNlLmdvdi9OZXdzL05ld3MtU3Rvcmllcy9BcnRpY2xlL0FydGljbGUvMjQzODA3Ni9zcGVjaWFsLW9wZXJhdGlvbnMtc3RyaXZlcy10by11c2UtdGhlLXBvd2VyLW9mLWFydGlmaWNpYWwtaW50ZWxsaWdlbmNlL9IBAA?oc=5,2020-12-07,Department of Defense,https://www.defense.gov,Special Operations Strives to Use the Power of Artificial Intelligence,"U.S. Special Operations Command hopes to increasingly use artificial intelligence and machine learning in all aspects of warfare, its commander said.","Special Operations Strives to Use the Power of Artificial Intelligence U.S. Special Operations Command hopes to increasingly use artificial intelligence and machine learning in all aspects of warfare, its commander said.",special operation strives use power artificial intelligence u special operation command hope increasingly use artificial intelligence machine learning aspect warfare commander said,-0.12142857142857141,negative
67,https://news.google.com/rss/articles/CBMiZGh0dHBzOi8vd3d3Lmdvdi5wbC93ZWIvZGlnaXRhbGl6YXRpb24vcG9sYW5kLWpvaW5zLXRoZS1nbG9iYWwtcGFydG5lcnNoaXAtb24tYXJ0aWZpY2lhbC1pbnRlbGxpZ2VuY2XSAQA?oc=5,2020-12-08,Gov.pl,https://www.gov.pl,Poland joins the Global Partnership on Artificial Intelligence,"During the plenary summit held in Montreal, Poland joined the Global Partnership on Artificial Intelligence and its responsible development. ","Poland joins the Global Partnership on Artificial Intelligence During the plenary summit held in Montreal, Poland joined the Global Partnership on Artificial Intelligence and its responsible development. ",poland join global partnership artificial intelligence plenary summit held montreal poland joined global partnership artificial intelligence responsible development,-0.2,negative
68,https://news.google.com/rss/articles/CBMiamh0dHBzOi8vd3d3LmFjdHVpYS5jb20vZW5nbGlzaC9mb3VyLW5ldy1jb3VudHJpZXMtam9pbi10aGUtZ2xvYmFsLXBhcnRuZXJzaGlwLWZvci1hcnRpZmljaWFsLWludGVsbGlnZW5jZS_SAQA?oc=5,2020-12-08,Intelligence artificielle - Actu IA,https://www.actuia.com,Four new countries join the Global Partnership for Artificial Intelligence,"The first summit of the Global Partnership for Artificial Intelligence (GPIA) was held in Montreal on December 3 and 4. On this occasion, the Franco-Canadian PMIA initiative was expanded to include four new member states, Spain, the Netherlands, Poland and Brazil. Officially launched on 15 June 2020, the PMIA has 15 founding members: France, Canada, […]","Four new countries join the Global Partnership for Artificial Intelligence The first summit of the Global Partnership for Artificial Intelligence (GPIA) was held in Montreal on December 3 and 4. On this occasion, the Franco-Canadian PMIA initiative was expanded to include four new member states, Spain, the Netherlands, Poland and Brazil. Officially launched on 15 June 2020, the PMIA has 15 founding members: France, Canada, […]",four new country join global partnership artificial intelligence first summit global partnership artificial intelligence gpia held montreal december occasion francocanadian pmia initiative expanded include four new member state spain netherlands poland brazil officially launched june pmia founding member france canada,-0.09675324675324674,negative
69,https://news.google.com/rss/articles/CBMihwFodHRwczovL3d3dy5uZXh0Z292LmNvbS9hcnRpZmljaWFsLWludGVsbGlnZW5jZS8yMDIwLzEyL2FpLWFjY291bnRhYmlsaXR5LXRlY2gtdGFsZW50LXBpcGVsaW5lLWZvY3VzLW5leHQtY29uZ3Jlc3Mtc3RhZmZlcnMtc2F5LzE3MDU1Ny_SAQA?oc=5,2020-12-07,Nextgov/FCW,https://www.nextgov.com,"AI Accountability, Tech Talent Pipeline In",Officials recognize setbacks the pandemic is having on STEM education.,"AI Accountability, Tech Talent Pipeline In Officials recognize setbacks the pandemic is having on STEM education.",ai accountability tech talent pipeline official recognize setback pandemic stem education,0.0,neutral
70,https://news.google.com/rss/articles/CBMiVmh0dHBzOi8vdWguZWR1L25ld3MtZXZlbnRzL3N0b3JpZXMvMjAyMC9kZWNlbWJlci0yMDIwLzEyMTAyMDIwY290LWRpZ2l0YWwtb2lsZmllbGQucGhw0gEA?oc=5,2020-12-10,University of Houston,https://uh.edu,AI Digital Oilfield Lab Opens at University of Houston,"Project Teams Students, Faculty and Industry to Create Innovative Solutions  ","AI Digital Oilfield Lab Opens at University of Houston Project Teams Students, Faculty and Industry to Create Innovative Solutions",ai digital oilfield lab open university houston project team student faculty industry create innovative solution,0.16666666666666666,positive
71,https://news.google.com/rss/articles/CBMib2h0dHBzOi8vd3d3LnN0YW5kYXJkLmNvLnVrL2Z1dHVyZWxvbmRvbi9zdGVtL2FydGlmaWNpYWwtaW50ZWxsaWdlbmNlYWl2aWRlb2dhbWVzbm91Z2h0c2Nyb3NzZXNzdGVtLWIyMTg0MDAuaHRtbNIBAA?oc=5,2020-12-08,Evening Standard,https://www.standard.co.uk,Take the 5th STEM challenge: Understand AI by playing noughts and crosses,Learn how to never lose at noughts and crosses – and how that helps you understand AI ,Take the 5th STEM challenge: Understand AI by playing noughts and crosses Learn how to never lose at noughts and crosses – and how that helps you understand AI ,take th stem challenge understand ai playing nought cross learn never lose nought cross help understand ai,0.0,neutral
72,https://news.google.com/rss/articles/CBMiW2h0dHBzOi8vd3d3LnR1bmkuZmkvZW4vbmV3cy9hcnRpZmljaWFsLWludGVsbGlnZW5jZS1zY3JlZW5zLXdhci1waG90b3MtbWVldC1ldS1yZXF1aXJlbWVudHPSAQA?oc=5,2020-12-08,Tampereen korkeakouluyhteisö,https://www.tuni.fi,Artificial intelligence screens war photos to meet EU requirements | Tampere universities,A study by Tampere University uses artificial intelligence (AI) to study photographs from World War II in a multidisciplinary research project whose results will help museums and image archives to meet the requirements of the EU’s Web Accessibility Directive. Researchers in various fields will also benefit when AI handles the raw screening of large data.,Artificial intelligence screens war photos to meet EU requirements | Tampere universities A study by Tampere University uses artificial intelligence (AI) to study photographs from World War II in a multidisciplinary research project whose results will help museums and image archives to meet the requirements of the EU’s Web Accessibility Directive. Researchers in various fields will also benefit when AI handles the raw screening of large data.,artificial intelligence screen war photo meet eu requirement tampere university study tampere university us artificial intelligence ai study photograph world war ii multidisciplinary research project whose result help museum image archive meet requirement eu web accessibility directive researcher various field also benefit ai handle raw screening large data,-0.24329670329670333,negative
73,https://news.google.com/rss/articles/CBMiMmh0dHBzOi8vd3d3Lm5hdHVyZS5jb20vYXJ0aWNsZXMvZDQxNTg2LTAyMC0wMzQxMy150gEA?oc=5,2020-12-09,Nature.com,https://www.nature.com,Four AI technologies that could transform the way we live and work,"Nature - From facial recognition to drug discovery, these emerging technologies are the ones to watch.","Four AI technologies that could transform the way we live and work Nature - From facial recognition to drug discovery, these emerging technologies are the ones to watch.",four ai technology could transform way live work nature facial recognition drug discovery emerging technology one watch,0.06818181818181818,positive
74,https://news.google.com/rss/articles/CBMibWh0dHBzOi8vd3d3LnVuaXZlcnNpdGVpdGxlaWRlbi5ubC9lbi9uZXdzLzIwMjAvMTIvZWR1YXJkLWZvc2NoLXZpbGxhcm9uZ2EtYmVjb21lcy1hc3Npc3RhbnQtcHJvZmVzc29yLWF0LWVsYXfSAQA?oc=5,2020-12-10,Universiteit Leiden,https://www.universiteitleiden.nl,Eduard Fosch,"eLaw - Center for Law and Digital Technologies, has promoted Dr. Eduard Fosch-Villaronga to Assistant Professor to work on Law and Artificial Intelligence.","Eduard Fosch eLaw - Center for Law and Digital Technologies, has promoted Dr. Eduard Fosch-Villaronga to Assistant Professor to work on Law and Artificial Intelligence.",eduard fosch elaw center law digital technology promoted dr eduard foschvillaronga assistant professor work law artificial intelligence,-0.2333333333333333,negative
75,https://news.google.com/rss/articles/CBMiS2h0dHBzOi8veW91cnN0b3J5LmNvbS9teXN0b3J5L2FydGlmaWNpYWwtaW50ZWxsaWdlbmNlLWVjb21tZXJjZS1zdGFydC11c2luZ9IBAA?oc=5,2020-12-08,YourStory,https://yourstory.com,Artificial Intelligence In eCommerce: It's Time To Start Using It,Artificial Intelligence in e-commerce becomes an essential component for handling different tasks and business operations.,Artificial Intelligence In eCommerce: It's Time To Start Using It Artificial Intelligence in e-commerce becomes an essential component for handling different tasks and business operations.,artificial intelligence ecommerce time start using artificial intelligence ecommerce becomes essential component handling different task business operation,-0.3,negative
76,https://news.google.com/rss/articles/CBMic2h0dHBzOi8vd3d3LnV3YS5lZHUuYXUvc2Vlay13aXNkb20vc2Vla2Vycy1zcGFjZS9iZXlvbmQtdXdhL2NhcmVlci8yMDIwLzEyL1RvcC01LWVtZXJnaW5nLWpvYnMtYW5kLWhvdy10by1nZXQtdGhlcmXSAQA?oc=5,2020-12-09,The University of Western Australia,https://www.uwa.edu.au,Top 5 emerging jobs and how to get there,"Using its wide range of data, LinkedIn has crunched the numbers and dropped its 2020 Emerging Jobs Report Australia. Unsurprisingly, tech roles involving artificial intelligence and robotics are trending – in a big way. ","Top 5 emerging jobs and how to get there Using its wide range of data, LinkedIn has crunched the numbers and dropped its 2020 Emerging Jobs Report Australia. Unsurprisingly, tech roles involving artificial intelligence and robotics are trending – in a big way. ",top emerging job get using wide range data linkedin crunched number dropped emerging job report australia unsurprisingly tech role involving artificial intelligence robotics trending big way,-0.04999999999999999,negative
77,https://news.google.com/rss/articles/CBMibWh0dHBzOi8vd3d3LmFuYWx5dGljc2luc2lnaHQubmV0L2Ryb25lL2Ryb25lcy1sZXZlcmFnZS1hcnRpZmljaWFsLWludGVsbGlnZW5jZS10by1sb2NhdGUtcGVvcGxlLWxvc3QtaW4td29vZHPSAXdodHRwczovL3d3dy5hbmFseXRpY3NpbnNpZ2h0Lm5ldC9hbXAvc3RvcnkvZHJvbmUvZHJvbmVzLWxldmVyYWdlLWFydGlmaWNpYWwtaW50ZWxsaWdlbmNlLXRvLWxvY2F0ZS1wZW9wbGUtbG9zdC1pbi13b29kcw?oc=5,2020-12-07,Analytics Insight,https://www.analyticsinsight.net,Drones Leverage Artificial Intelligence to Locate People Lost in Woods,"A new Artificial Intelligence technology has improved drone imagery by 95% It is a widely known fact in the tech world that drones are flown at high altitudes, ","Drones Leverage Artificial Intelligence to Locate People Lost in Woods A new Artificial Intelligence technology has improved drone imagery by 95% It is a widely known fact in the tech world that drones are flown at high altitudes, ",drone leverage artificial intelligence locate people lost wood new artificial intelligence technology improved drone imagery widely known fact tech world drone flown high altitude,-0.20072727272727273,negative
