,URL link,Title,Date,Preprocessed Title,Value,Sentiment
0,https://news.google.com/rss/articles/CBMiSmh0dHBzOi8vd3d3LnBlb3BsZW1hdHRlcnMuaW4vYXJ0aWNsZS9jdWx0dXJlL2xlYXJuaW5nLW91dHNpZGUtb2Ytd29yay0yNTcx0gFGaHR0cHM6Ly93d3cucGVvcGxlbWF0dGVycy5pbi9hbXAtY3VsdHVyZS1sZWFybmluZy1vdXRzaWRlLW9mLXdvcmstMjU3MQ?oc=5,Learning outside of work: Shalini Pillay - People Matters,2013-03-08,learning outside work : shalini pillay,"{'neg': 0.0, 'neu': 1.0, 'pos': 0.0, 'compound': 0.0}",Neutral
1,https://news.google.com/rss/articles/CBMieGh0dHBzOi8vd3d3LnRlY2hvcGVkaWEuY29tLzIvMjgxODYvaXQtYnVzaW5lc3MvaXQtY2FyZWVycy90aGUtY3Jhemllc3QtdGVjaC1pbnRlcnZpZXctcXVlc3Rpb25zLWFuZC13aGF0LXRoZXktbWlnaHQtbWVhbtIBAA?oc=5,The Most Outlandish Tech Interview Questions and What They Mean - Techopedia,2013-03-14,outlandish tech interview question mean,"{'neg': 0.0, 'neu': 1.0, 'pos': 0.0, 'compound': 0.0}",Neutral
2,https://news.google.com/rss/articles/CBMiqQFodHRwczovL3d3dy53YXNoaW5ndG9ucG9zdC5jb20vYnVzaW5lc3MvdGVjaG5vbG9neS9uZXctcm9ib3RzLWluLXRoZS13b3JrcGxhY2Utam9iLWNyZWF0b3JzLW9yLWpvYi10ZXJtaW5hdG9ycy8yMDEzLzAzLzA2L2E4MGI4ZjM0LTc0NmMtMTFlMi04Zjg0LTNlNGI1MTNiMWExM19zdG9yeS5odG1s0gEA?oc=5,New robots in the workplace: Job creators or job terminators? - The Washington Post,2013-03-06,new robot workplace : job creator job terminator ?,"{'neg': 0.0, 'neu': 1.0, 'pos': 0.0, 'compound': 0.0}",Neutral
3,https://news.google.com/rss/articles/CBMiNmh0dHBzOi8vd3d3LnBjZ2FtZXIuY29tL2FybWEtMy1pbnRlcnZpZXctYXJtYS0zLWFscGhhL9IBAA?oc=5,"Arma 3 interview - AI, map design, mods, and a response to ""Will Arma 3 break my PC?"" - PC Gamer",2013-03-02,arma 3 interview,"{'neg': 0.0, 'neu': 1.0, 'pos': 0.0, 'compound': 0.0}",Neutral
4,https://news.google.com/rss/articles/CBMiOWh0dHBzOi8vd3d3LnV0b3JvbnRvLmNhL25ld3Mvc2NpZW5jZS1tb3ZpZXMtc2hvcnQtY2lyY3VpdNIBAA?oc=5,Science at the Movies: Short Circuit - University of Toronto,2013-03-25,science movie : short circuit,"{'neg': 0.0, 'neu': 1.0, 'pos': 0.0, 'compound': 0.0}",Neutral
5,https://news.google.com/rss/articles/CBMiZWh0dHBzOi8vYml6dGVjaG1hZ2F6aW5lLmNvbS9hcnRpY2xlLzIwMTMvMDMvZWxvbi1tdXNrLWFuZC10ZWNobm9sb2d5cy1yb2xlLXN0cnVnZ2xlLXdvcmstbGlmZS1iYWxhbmNl0gEA?oc=5,Elon Musk and Technology's Role in the Struggle for Work-Life Balance - BizTech Magazine,2013-03-11,elon musk technology 's role struggle work,"{'neg': 0.277, 'neu': 0.723, 'pos': 0.0, 'compound': -0.3182}",Negative
6,https://news.google.com/rss/articles/CBMiRGh0dHBzOi8vc2xvYW5yZXZpZXcubWl0LmVkdS9hcnRpY2xlL3JlaW52ZW50aW5nLWVtcGxveWVlLW9uYm9hcmRpbmcv0gEA?oc=5,Reinventing Employee Onboarding - MIT Sloan Management Review,2013-03-19,reinventing employee onboarding,"{'neg': 0.0, 'neu': 1.0, 'pos': 0.0, 'compound': 0.0}",Neutral
7,https://news.google.com/rss/articles/CBMiUGh0dHBzOi8vZ2l6bW9kby5jb20vdnBucy13aGF0LXRoZXktZG8taG93LXRoZXktd29yay1hbmQtd2h5LXlvdXJlLWR1bWItZi01OTkwMTky0gEA?oc=5,"VPNs: What They Do, How They Work, and Why You're Dumb for Not Using One - Gizmodo",2013-03-26,"vpns : , work , 're dumb using one","{'neg': 0.398, 'neu': 0.602, 'pos': 0.0, 'compound': -0.5106}",Negative
8,https://news.google.com/rss/articles/CBMiYWh0dHBzOi8vd3d3LmJsb29tYmVyZy5jb20vbmV3cy9hcnRpY2xlcy8yMDEzLTAzLTI4L21vcmUtYW1lcmljYW5zLXdvcmstaW4tdGhlLXVuZGVyZ3JvdW5kLWVjb25vbXnSAQA?oc=5,More Americans Work in the Underground Economy - Bloomberg,2013-03-28,american work underground economy,"{'neg': 0.0, 'neu': 1.0, 'pos': 0.0, 'compound': 0.0}",Neutral
9,https://news.google.com/rss/articles/CBMieGh0dHBzOi8vd3d3LnBlb3BsZW1hdHRlcnMuaW4vYXJ0aWNsZS9wZXJmb3JtYW5jZS1tYW5hZ2VtZW50L2hvdy10by1nZXQtd29yay1kb25lLXdoZW4tZW1wbG95ZWVzLWFyZS1pbi1mZXN0aXZlLW1vb2QtMjYxMNIBdGh0dHBzOi8vd3d3LnBlb3BsZW1hdHRlcnMuaW4vYW1wLXBlcmZvcm1hbmNlLW1hbmFnZW1lbnQtaG93LXRvLWdldC13b3JrLWRvbmUtd2hlbi1lbXBsb3llZXMtYXJlLWluLWZlc3RpdmUtbW9vZC0yNjEw?oc=5,How to get work done when employees are in festive mood - People Matters,2013-03-26,get work done employee festive mood,"{'neg': 0.0, 'neu': 0.625, 'pos': 0.375, 'compound': 0.4588}",Positive
10,https://news.google.com/rss/articles/CBMiXmh0dHBzOi8vd3d3Lml0cHJvdG9kYXkuY29tL2l0LWluZnJhc3RydWN0dXJlL25va2lhLXVuaXZlcnNhbC1wb3J0YWJsZS11c2ItY2hhcmdlci1kYy0xNi1yZXZpZXfSAQA?oc=5,Nokia Universal Portable USB Charger DC-16 Review - ITPro Today,2013-03-07,nokia universal portable usb charger dc,"{'neg': 0.0, 'neu': 1.0, 'pos': 0.0, 'compound': 0.0}",Neutral
11,https://news.google.com/rss/articles/CBMiowFodHRwczovL3RlY2hjcnVuY2guY29tLzIwMTMvMDMvMjIvb25lLW5vdGlvbi11bmRlci1qb2JzLW5ld2x5LXVuZWFydGhlZC12aWRlb3Mtc2hvdy0xOTg0LXN0ZXZlLXdvem5pYWstc3BlYWtpbmctb24tcHJhbmtzLXByb2JhdGlvbi1hbmQtdGhlLWVhcmxpZXN0LWRheXMtb2YtYXBwbGUv0gEA?oc=5,"One Notion Under Jobs: Newly Unearthed Videos Show 1984 Steve Wozniak Speaking On Pranks, Probation, And ... - TechCrunch",2013-03-22,"one notion job : newly unearthed video show 1984 steve wozniak speaking prank , probation , ...","{'neg': 0.0, 'neu': 1.0, 'pos': 0.0, 'compound': 0.0}",Neutral
12,https://news.google.com/rss/articles/CBMiYWh0dHBzOi8vc2xvYW5yZXZpZXcubWl0LmVkdS9hcnRpY2xlL3RlYW0tZ2ItdXNpbmctYW5hbHl0aWNzLWFuZC1pbnR1aXRpb24tdG8taW1wcm92ZS1wZXJmb3JtYW5jZS_SAQA?oc=5,Team GB: Using Analytics (and Intuition) to Improve Performance - MIT Sloan Management Review,2013-03-05,team gb : using analytics ( intuition ) improve performance,"{'neg': 0.0, 'neu': 0.674, 'pos': 0.326, 'compound': 0.4404}",Positive
13,https://news.google.com/rss/articles/CBMimwFodHRwczovL3d3dy53YXNoaW5ndG9ucG9zdC5jb20vYmxvZ3MvaW5ub3ZhdGlvbnMvcG9zdC90aW0tYmVybmVycy1sZWUtb24tdGhlLW1ha2luZy1vZi1uZXctd29ybGRzLzIwMTMvMDMvMTEvM2QzNGYwOGMtODllOS0xMWUyLTk4ZDktMzAxMmMxY2Q4ZDFlX2Jsb2cuaHRtbNIBAA?oc=5,Tim Berners-Lee on the making of new worlds - The Washington Post,2013-03-11,tim berners,"{'neg': 0.0, 'neu': 1.0, 'pos': 0.0, 'compound': 0.0}",Neutral
14,https://news.google.com/rss/articles/CBMiVWh0dHBzOi8vd3d3LnBlb3BsZW1hdHRlcnMuaW4vYXJ0aWNsZS9jdWx0dXJlL2ZsZXhpYmlsaXR5LWlzLWEtbXVzdC1mb3ItZXZlcnlib2R5LTI1NzDSAVFodHRwczovL3d3dy5wZW9wbGVtYXR0ZXJzLmluL2FtcC1jdWx0dXJlLWZsZXhpYmlsaXR5LWlzLWEtbXVzdC1mb3ItZXZlcnlib2R5LTI1NzA?oc=5,Flexibility is a must for everybody: Laura E. Kohler - People Matters,2013-03-08,flexibility must everybody : laura e. kohler,"{'neg': 0.0, 'neu': 0.676, 'pos': 0.324, 'compound': 0.34}",Positive
15,https://news.google.com/rss/articles/CBMidWh0dHBzOi8vdGVjaGNydW5jaC5jb20vMjAxMy8wMy8yMS9mb3JtZXItdGVlbmFnZS1oYWNrZXItYW5kLXR3aXR0ZXItY28tZm91bmRlci1qYWNrLWRvcnNleS1zYXlzLWhhY2tpbmctaXNudC1hLWNyaW1lL9IBAA?oc=5,"Former Boy Hacker And Twitter Co-Founder, Jack Dorsey, Says Hacking Isn't A Crime - TechCrunch",2013-03-21,former boy hacker twitter co,"{'neg': 0.0, 'neu': 1.0, 'pos': 0.0, 'compound': 0.0}",Neutral
16,https://news.google.com/rss/articles/CBMiSGh0dHBzOi8vd3d3LnV0b3JvbnRvLmNhL25ld3MvZ29vZ2xlLWFjcXVpcmVzLXUtdC1uZXVyYWwtbmV0d29ya3MtY29tcGFuedIBAA?oc=5,Google acquires U of T neural networks company - University of Toronto,2013-03-12,google acquires u neural network company,"{'neg': 0.0, 'neu': 1.0, 'pos': 0.0, 'compound': 0.0}",Neutral
17,https://news.google.com/rss/articles/CBMitQFodHRwczovL3d3dy53YXNoaW5ndG9ucG9zdC5jb20vYnVzaW5lc3MvdGVjaG5vbG9neS92aWRlby1nYW1lLWluZHVzdHJ5LXB1c2hlcy1yYXRpbmdzLWVkdWNhdGlvbi1hbWlkLWRlYmF0ZS1hYm91dC12aW9sZW5jZS8yMDEzLzAzLzEzL2Y4NWFkMjM4LThhNmEtMTFlMi04ZDcyLWRjNzY2NDFjYjhkNF9zdG9yeS5odG1s0gEA?oc=5,Video game industry pushes ratings education amid debate about violence - The Washington Post,2013-03-13,video game industry push rating education amid debate violence,"{'neg': 0.339, 'neu': 0.661, 'pos': 0.0, 'compound': -0.6249}",Negative
18,https://news.google.com/rss/articles/CBMioAFodHRwczovL3d3dy53YXNoaW5ndG9ucG9zdC5jb20vbmF0aW9uYWwvb24tbGVhZGVyc2hpcC9hLWdyZWF0LXNwZWVjaC1vbi13aHktdG8tZ28taW50by1wdWJsaWMtc2VydmljZS8yMDEzLzAzLzE4LzQ5NDNmM2M0LThmZTItMTFlMi1iZGVhLWUzMmFkOTBkYTIzOV9zdG9yeS5odG1s0gEA?oc=5,A great speech on why to go into public service - The Washington Post,2013-03-18,great speech go public service,"{'neg': 0.0, 'neu': 0.494, 'pos': 0.506, 'compound': 0.6249}",Positive
19,https://news.google.com/rss/articles/CBMipgFodHRwczovL3d3dy53YXNoaW5ndG9ucG9zdC5jb20vYnVzaW5lc3MvdGVjaG5vbG9neS9mYWNlYm9vay10by1jaGFuZ2UtbmV3cy1mZWVkLXRvLWEtcGVyc29uYWxpemVkLW5ld3NwYXBlci8yMDEzLzAzLzA3L2IyOTRmNjFlLTg3NTEtMTFlMi05OGEzLWIzZGI2YjlhYzU4Nl9zdG9yeS5odG1s0gEA?oc=5,Facebook to change News Feed to a 'personalized newspaper' - The Washington Post,2013-03-07,facebook change news feed 'personalized newspaper ',"{'neg': 0.0, 'neu': 1.0, 'pos': 0.0, 'compound': 0.0}",Neutral
20,https://news.google.com/rss/articles/CBMiTWh0dHBzOi8vd3d3LnJvY2twYXBlcnNob3RndW4uY29tL3NpbWNpdHlzLXNpbXMtZG9udC1zZWVtLXRoYXQtc21hcnQtYWZ0ZXItYWxs0gEA?oc=5,SimCity's Sims Don't Seem That Smart After All - Rock Paper Shotgun,2013-03-13,simcity 's sims n't seem smart,"{'neg': 0.311, 'neu': 0.689, 'pos': 0.0, 'compound': -0.3089}",Negative
21,https://news.google.com/rss/articles/CBMigQFodHRwczovL3d3dy5mYXN0Y29tcGFueS5jb20vMTY4MjYzMS90aGUtc2NpZW5jZS1vZi10aGUtY3Jvb2RzLWhvdy1kcmVhbXdvcmtzLWJyaW5ncy1tYXRoZW1hdGljYWwtZWZmaWNpZW5jeS10by10aGUtY3JlYXRpdmUtYnVzaS_SAQA?oc=5,"The Science Of ""The Croods"": How Dreamworks Brings Mathematical Efficiency To The Creative Business Of Filmmaking - Fast Company",2013-03-22,science `` croods '' : dreamworks brings mathematical efficiency creative business filmmaking,"{'neg': 0.0, 'neu': 0.625, 'pos': 0.375, 'compound': 0.6597}",Positive
22,https://news.google.com/rss/articles/CBMieGh0dHBzOi8vdGVjaGNydW5jaC5jb20vMjAxMy8wMy8wNi9zaGVyeWwtc2FuZGJlcmctbGF1bmNoZXMtbGVhbi1pbi1vcmdhbml6YXRpb24tYXMtYS1nbG9iYWwtY29tbXVuaXR5LWZvci13b3JraW5nLXdvbWVuL9IBAA?oc=5,Sheryl Sandberg Launches 'Lean In' Organization As A Global Community For Workplace Equality - TechCrunch,2013-03-06,sheryl sandberg launch 'lean ' organization global community workplace equality,"{'neg': 0.0, 'neu': 1.0, 'pos': 0.0, 'compound': 0.0}",Neutral
23,https://news.google.com/rss/articles/CBMiLGh0dHBzOi8vd3d3LmJiYy5jby51ay9uZXdzL21hZ2F6aW5lLTIxODc2MTIw0gEwaHR0cHM6Ly93d3cuYmJjLmNvLnVrL25ld3MvbWFnYXppbmUtMjE4NzYxMjAuYW1w?oc=5,A Point of View: Chess and 18th Century artificial intelligence - BBC,2013-03-22,point view : chess 18th century artificial intelligence,"{'neg': 0.0, 'neu': 0.659, 'pos': 0.341, 'compound': 0.4767}",Positive
24,https://news.google.com/rss/articles/CBMiWmh0dHBzOi8vd3d3LnBjZ2FtZXIuY29tL2dkYy0yMDEzLXRoZS1haS10cmlja3MtYmVoaW5kLXhjb20tYXNzYXNzaW5zLWNyZWVkLTMtYW5kLXdhcmZyYW1lL9IBAA?oc=5,"GDC 2013: The AI tricks behind XCOM, Assassins Creed 3 and Warframe - PC Gamer",2013-03-26,"gdc 2013 : ai trick behind xcom , assassin creed 3 warframe","{'neg': 0.13, 'neu': 0.87, 'pos': 0.0, 'compound': -0.0516}",Negative
25,https://news.google.com/rss/articles/CBMihQFodHRwczovL3RlY2hjcnVuY2guY29tLzIwMTMvMDMvMDQvdGhlcmVzLW5vLW5hdGl2ZS1pbnN0YWdyYW0tYXBwLWZvci1ibGFja2JlcnJ5LTEwLWJ1dC10aGlzLXBvcnRlZC1hbmRyb2lkLXZlcnNpb24tZ2V0cy10aGUtam9iLWRvbmUv0gEA?oc=5,"There's No Native Instagram App For BlackBerry 10, But This Ported Android Version Gets The Job Done - TechCrunch",2013-03-04,"'s native instagram app blackberry 10 , ported android version get job done","{'neg': 0.0, 'neu': 1.0, 'pos': 0.0, 'compound': 0.0}",Neutral
26,https://news.google.com/rss/articles/CBMiRGh0dHBzOi8vdGVjaGNydW5jaC5jb20vMjAxMy8wMy8yMi9kcm9wYm94LXJhc211cy1hbmRlcnNzb24tZGVzaWduZXIv0gEA?oc=5,"Dropbox Hits Another Hiring Homerun With Rasmus Andersson, Facebook's Mobile Design Guru - TechCrunch",2013-03-22,"dropbox hit another hiring homerun rasmus andersson , facebook 's mobile design guru","{'neg': 0.0, 'neu': 1.0, 'pos': 0.0, 'compound': 0.0}",Neutral
27,https://news.google.com/rss/articles/CBMigQFodHRwczovL3ZlbnR1cmViZWF0LmNvbS9zZWN1cml0eS9zZW5kZ3JpZC11bmRlci1kZG9zLWF0dGFjay1hZnRlci1pdHMtZGV2ZWxvcGVyLWV2YW5nZWxpc3QtY29tcGxhaW5zLWFib3V0LXNleHVhbC1qb2tlcy1hdC1weWNvbi_SAQA?oc=5,SendGrid under DDOS attack after its developer evangelist complains about sexual jokes at PyCon - VentureBeat,2013-03-21,sendgrid ddos attack developer evangelist complains sexual joke pycon,"{'neg': 0.41, 'neu': 0.432, 'pos': 0.158, 'compound': -0.5423}",Negative
28,https://news.google.com/rss/articles/CBMiTWh0dHBzOi8vd3d3Lndwci5vcmcvcG9saXRpY3Mvc3RhdGUtZGVtcy1nb3AtcGxheS1ibGFtZS1nYW1lLXNlcXVlc3Rlci1lZGl0aW9u0gEA?oc=5,"State Dems, GOP Play Blame Game: Sequester Edition - WPR",2013-03-11,"state dems , gop play blame game : sequester edition","{'neg': 0.222, 'neu': 0.556, 'pos': 0.222, 'compound': 0.0}",Neutral
29,https://news.google.com/rss/articles/CBMikwFodHRwczovL3RlY2hjcnVuY2guY29tLzIwMTMvMDMvMDQvc2lyLXJpY2hhcmQtYnJhbnNvbi1jaGlkZXMtbWF5b3ItbWljaGFlbC1ibG9vbWJlcmctYW5kLW1hcmlzc2EtbWF5ZXItc2F5cy10aGUtb2ZmaWNlLXdpbGwtYmUtYS10aGluZy1vZi10aGUtcGFzdC_SAQA?oc=5,"Sir Richard Branson Chides Mayor Michael Bloomberg And Marissa Mayer, Says The Office Will Be A Thing Of The Past - TechCrunch",2013-03-04,"sir richard branson chides mayor michael bloomberg marissa mayer , say office thing past","{'neg': 0.0, 'neu': 1.0, 'pos': 0.0, 'compound': 0.0}",Neutral
30,https://news.google.com/rss/articles/CBMitAFodHRwczovL3d3dy53YXNoaW5ndG9ucG9zdC5jb20vYnVzaW5lc3MvZWNvbm9teS92YWx1ZS1hZGRlZC1ob21lLWlzLXJpZ2h0LXdoZXJlLXBvdG9tYWMtbGF3LWdyb3VwLXdhbnRzLWl0cy13b3JrZXJzLXRvLWJlLzIwMTMvMDMvMDMvMGRmODI1OWUtODI5My0xMWUyLWI5OWUtNmJhZjRlYmU0MmRmX3N0b3J5Lmh0bWzSAQA?oc=5,Value Added: Home is right where Potomac Law Group wants its workers to be - The Washington Post,2013-03-03,value added : home right potomac law group want worker,"{'neg': 0.0, 'neu': 0.654, 'pos': 0.346, 'compound': 0.4019}",Positive
31,https://news.google.com/rss/articles/CBMijAFodHRwczovL3d3dy53YXNoaW5ndG9ucG9zdC5jb20vYnVzaW5lc3MvZWNvbm9teS9iZWluZy1hLXRlZW4tcGFyZW50LXdpbGwtY29zdC15b3UvMjAxMy8wMy8xNC80MzRiNTFjOC04Y2I0LTExZTItYjYzZi1mNTNmYjlmMmZjYjRfc3RvcnkuaHRtbNIBAA?oc=5,Being a teen parent will cost you - The Washington Post - The Washington Post,2013-03-14,teen parent cost,"{'neg': 0.0, 'neu': 1.0, 'pos': 0.0, 'compound': 0.0}",Neutral
32,https://news.google.com/rss/articles/CBMiW2h0dHBzOi8vdGhlYW1lcmljYW5nZW5pdXMuY29tL2VudHJlcHJlbmV1ci9zdGFydHVwcy1zdG9wLWRvaW5nLXlvdXItbWFya2V0aW5nLXRoZS1lYXN5LXdheS_SAQA?oc=5,"Startups, stop doing your marketing the easy way - The American Genius",2013-03-01,"startup , stop marketing easy way","{'neg': 0.272, 'neu': 0.37, 'pos': 0.358, 'compound': 0.1779}",Positive
33,https://news.google.com/rss/articles/CBMiKWh0dHBzOi8vdGVjaGNydW5jaC5jb20vMjAxMy8wMy8yOC9maXJlbWUv0gEA?oc=5,"Calm Down, No One's Getting Fired Because Of FireMe!, New Site That Exposes People Tweeting Horrible Things ... - TechCrunch",2013-03-28,"calm , one 's getting fired fireme ! , new site expose people tweeting horrible thing ...","{'neg': 0.422, 'neu': 0.47, 'pos': 0.108, 'compound': -0.7712}",Negative
34,https://news.google.com/rss/articles/CBMiowFodHRwczovL3d3dy53YXNoaW5ndG9ucG9zdC5jb20vd29ybGQvam9yZ2UtbWFyaW8tYmVyZ29nbGlvLXRoZS1maXJzdC1qZXN1aXQtcG9wZS1rbm93bi1mb3ItcGFzdG9yYWwtd29yay8yMDEzLzAzLzEzLzhhNDdlMzI0LThjMGItMTFlMi05ZjU0LWYzZmRkNzBhY2FkMl9zdG9yeS5odG1s0gEA?oc=5,"Jorge Mario Bergoglio, now Pope Francis, known for simplicity and conservatism - The Washington Post",2013-03-13,"jorge mario bergoglio , pope francis , known simplicity conservatism","{'neg': 0.0, 'neu': 1.0, 'pos': 0.0, 'compound': 0.0}",Neutral
35,https://news.google.com/rss/articles/CBMieWh0dHBzOi8vd3d3LnRoZWdsb2JlYW5kbWFpbC5jb20vcmVwb3J0LW9uLWJ1c2luZXNzL2VpLWZvci1zZWFzb25hbC13b3JrZXJzLWlzLWEtY29ycm9zaXZlLWVjb25vbWljLXBvbGljeS9hcnRpY2xlOTM2NTI4OS_SAQA?oc=5,EI for seasonal workers is a corrosive economic policy - The Globe and Mail,2013-03-06,ei seasonal worker corrosive economic policy,"{'neg': 0.0, 'neu': 1.0, 'pos': 0.0, 'compound': 0.0}",Neutral
36,https://news.google.com/rss/articles/CBMisgFodHRwczovL3d3dy53YXNoaW5ndG9ucG9zdC5jb20vd29ybGQvZXVyb3BlL3Jpc2Utb2YtYm9zbmlhbi1tYXlvci13aXRoLWEtaGVhZC1zY2FyZi1jaGFsbGVuZ2luZy1hc3N1bXB0aW9ucy1hYm91dC1pc2xhbS8yMDEzLzAzLzA5LzFkODViYWI4LTdjNGQtMTFlMi05YTc1LWRhYjAyMDE2NzBkYV9zdG9yeS5odG1s0gEA?oc=5,Rise of Bosnian mayor with a head scarf challenging assumptions about Islam - The Washington Post,2013-03-09,rise bosnian mayor head scarf challenging assumption islam,"{'neg': 0.0, 'neu': 0.814, 'pos': 0.186, 'compound': 0.1531}",Positive
37,https://news.google.com/rss/articles/CBMiP2h0dHBzOi8vd3d3LmdlZWt3aXJlLmNvbS8yMDEzL2V4dHJhaG9wLWZvdW5kZXItamVzc2Utcm90aHN0ZWluL9IBAA?oc=5,ExtraHop's Jesse Rothstein: You judge a leader by the team they've built - GeekWire,2013-03-31,extrahop 's jesse rothstein : judge leader team 've built,"{'neg': 0.0, 'neu': 1.0, 'pos': 0.0, 'compound': 0.0}",Neutral
38,https://news.google.com/rss/articles/CBMiJmh0dHBzOi8vd3d3LndpcmVkLmNvbS8yMDEzLzAzL2lwby1tYW4v0gEA?oc=5,Meet the Man Who Sold His Fate to Investors at $1 a Share - WIRED,2013-03-28,meet man sold fate investor $ 1 share,"{'neg': 0.0, 'neu': 0.694, 'pos': 0.306, 'compound': 0.296}",Positive
39,https://news.google.com/rss/articles/CBMiYGh0dHBzOi8vdGhlYW1lcmljYW5nZW5pdXMuY29tL3RlY2gtbmV3cy9oYXJ2ZXN0LXRpbWUtdHJhY2tpbmctYXBwLXBvcHVsYXItd2l0aC1zbWFsbC1idXNpbmVzc2VzL9IBZGh0dHBzOi8vdGhlYW1lcmljYW5nZW5pdXMuY29tL3RlY2gtbmV3cy9oYXJ2ZXN0LXRpbWUtdHJhY2tpbmctYXBwLXBvcHVsYXItd2l0aC1zbWFsbC1idXNpbmVzc2VzL2FtcC8?oc=5,Harvest time tracking app popular with small businesses - The American Genius,2013-03-15,harvest time tracking app popular small business,"{'neg': 0.0, 'neu': 0.682, 'pos': 0.318, 'compound': 0.4215}",Positive
40,https://news.google.com/rss/articles/CBMiX2h0dHBzOi8vd3d3LnBvbHlnb24uY29tLzIwMTMvMy8yMi80MTM2MDQ4L2RldXMtZXgtaHVtYW4tcmV2b2x1dGlvbi1kaXJlY3RvcnMtY3V0LXdpaS11LXBheC1lYXN00gEA?oc=5,"The 'best version' of Deus Ex: Human Revolution features improved graphics, AI, boss battles and may never leave Wii U - Polygon",2013-03-22,"'best version ' deus ex : human revolution feature improved graphic , ai , bos battle may never leave wii u","{'neg': 0.113, 'neu': 0.521, 'pos': 0.367, 'compound': 0.7048}",Positive
41,https://news.google.com/rss/articles/CBMibWh0dHBzOi8vaG9hcmRzLmNvbS9hcnRpY2xlLTgyODgtd2lzY29uc2luLWhvbHN0ZWluLWFzc29jaWF0aW9uLXRvLWhvbGQtc3ByaW5nLWJhcm4tbWVldGluZ3Mtb24taG9vZi1jYXJlLmh0bWzSAQA?oc=5,Wisconsin Holstein Association to Hold Spring Barn Meetings on Hoof Care - Hoard's Dairyman,2013-03-12,wisconsin holstein association hold spring barn meeting hoof care,"{'neg': 0.0, 'neu': 0.714, 'pos': 0.286, 'compound': 0.4939}",Positive
42,https://news.google.com/rss/articles/CBMiemh0dHBzOi8vd3d3LmV1cm9wZWFuYnVzaW5lc3NyZXZpZXcuY29tL3BlcmZvcm1hbmNlLW1hbmFnZW1lbnQtc3lzdGVtcy1pbi1tZXhpY28tdGhlLWR1YWwtbG9naWNzLW9mLWV2YWx1YXRpbmctcGVyZm9ybWFuY2Uv0gEA?oc=5,Performance Management Systems in Mexico: The Dual Logics of Evaluating Performance - The European Business Review,2013-03-10,performance management system mexico : dual logic evaluating performance,"{'neg': 0.0, 'neu': 1.0, 'pos': 0.0, 'compound': 0.0}",Neutral
43,https://news.google.com/rss/articles/CBMiX2h0dHBzOi8vd3d3LmhvcnNlYW5kaG91bmQuY28udWsvbmV3cy9zdGFsbGlvbi1haS1zZXJ2aWNlcy10by1mZWF0dXJlLW9uLWJiY3MtY291bnRyeWZpbGUtMzE2MDc50gEA?oc=5,Stallion AI Services to feature on BBC's Countryfile - Horse & Hound,2013-03-01,stallion ai service feature bbc 's countryfile,"{'neg': 0.0, 'neu': 1.0, 'pos': 0.0, 'compound': 0.0}",Neutral
